Request;20150812-000028;50558;null;Inpatient;PACE;C:\Users\FGuo\Documents\work doucment\attachment\attachmentDB\20161005\originalFileFromAerial\DOCSVC_20161003.tar\DOCSVC_20161003\Sect2\INPATIENT\REQ_20150812-000028\Lamas.Joyce B__No 50558__Montefiore MC_Moses__PRI__Rcvd 08.11.15__05.26.16_2016-05-26-15.45.52.193.tif
Request;20150812-000028;50558;null;Inpatient;PACE;C:\Users\FGuo\Documents\work doucment\attachment\attachmentDB\20161005\originalFileFromAerial\DOCSVC_20161003.tar\DOCSVC_20161003\Sect2\INPATIENT\REQ_20150812-000028\Lamas.Joyce B__No 50558__Montefiore_DC Plan__Rcvd 08.11.15__05.26.16_2016-05-26-15.46.55.631.tif
Request;20150821-000009;48475;DIRECT/SELECT LT;Inpatient;DIRECT/SELECT LT;C:\Users\FGuo\Documents\work doucment\attachment\attachmentDB\20161005\originalFileFromAerial\DOCSVC_20161003.tar\DOCSVC_20161003\Sect2\INPATIENT\REQ_20150821-000009\M Mccray -48475_2016-06-28-11.28.43.710.tif
Request;20150827-000027;41850;DIRECT;Inpatient;DIRECT;C:\Users\FGuo\Documents\work doucment\attachment\attachmentDB\20161005\originalFileFromAerial\DOCSVC_20161003.tar\DOCSVC_20161003\Sect2\INPATIENT\REQ_20150827-000027\Behnam Shokr, Yacob - Northshore University Hospital 7-15-16_2016-07-15-10.37.06.182.pdf
Request;20150827-000027;41850;DIRECT;Inpatient;DIRECT;C:\Users\FGuo\Documents\work doucment\attachment\attachmentDB\20161005\originalFileFromAerial\DOCSVC_20161003.tar\DOCSVC_20161003\Sect2\INPATIENT\REQ_20150827-000027\Behnam Shokr, Yacob -North Shore University Hospital  2.2.2016_2016-03-02-16.43.16.763.pdf
Request;20150918-000031;56918;null;Inpatient;PACE;C:\Users\FGuo\Documents\work doucment\attachment\attachmentDB\20161005\originalFileFromAerial\DOCSVC_20161003.tar\DOCSVC_20161003\Sect2\INPATIENT\REQ_20150918-000031\Lynch, Cynthia-NH notes_4-12-16_2016-04-12-16.57.18.107.pdf
Request;20151007-000075;57486;SELECT;Inpatient;SELECT;C:\Users\FGuo\Documents\work doucment\attachment\attachmentDB\20161005\originalFileFromAerial\DOCSVC_20161003.tar\DOCSVC_20161003\Sect2\INPATIENT\REQ_20151007-000075\Holliday Ella- Regeis Care Center   5-4-2016_2016-05-04-11.08.21.672.pdf
Request;20151008-000024;47799;PACE;Inpatient;PACE;C:\Users\FGuo\Documents\work doucment\attachment\attachmentDB\20161005\originalFileFromAerial\DOCSVC_20161003.tar\DOCSVC_20161003\Sect2\INPATIENT\REQ_20151008-000024\Hores, Edna - OUR LADY OF CONSOLATION 8.31.16_2016-08-31-12.05.38.226.pdf
Request;20151008-000024;47799;PACE;Inpatient;PACE;C:\Users\FGuo\Documents\work doucment\attachment\attachmentDB\20161005\originalFileFromAerial\DOCSVC_20161003.tar\DOCSVC_20161003\Sect2\INPATIENT\REQ_20151008-000024\Hores.Edna__No 47799__Our Lady of Consolation__Progress Notes__Rcvd 05.19.16__ 05.23.16_2016-05-23-10.12.46.814.tif
Request;20151012-000096;59540;SELECT;Inpatient;SELECT;C:\Users\FGuo\Documents\work doucment\attachment\attachmentDB\20161005\originalFileFromAerial\DOCSVC_20161003.tar\DOCSVC_20161003\Sect2\INPATIENT\REQ_20151012-000096\Migliore Michael - Sephardic-King David Rehab 3-1-16_2016-03-01-16.13.51.63.pdf
Request;20151021-000042;57292;SELECT;Inpatient;SELECT;C:\Users\FGuo\Documents\work doucment\attachment\attachmentDB\20161005\originalFileFromAerial\DOCSVC_20161003.tar\DOCSVC_20161003\Sect2\INPATIENT\REQ_20151021-000042\Hoyte, Neville - New York Congregational Nursing Home 7-11-16_2016-07-11-14.14.02.619.pdf
Request;20151022-000059;79013;PACE;Inpatient;PACE;C:\Users\FGuo\Documents\work doucment\attachment\attachmentDB\20161005\originalFileFromAerial\DOCSVC_20161003.tar\DOCSVC_20161003\Sect2\INPATIENT\REQ_20151022-000059\Zhang, Bao Yu.ATLANTIS REHAB & RHCF.4.12.16_2016-04-12-09.45.52.304.pdf
Request;20151022-000059;79013;PACE;Inpatient;PACE;C:\Users\FGuo\Documents\work doucment\attachment\attachmentDB\20161005\originalFileFromAerial\DOCSVC_20161003.tar\DOCSVC_20161003\Sect2\INPATIENT\REQ_20151022-000059\Zhang, Bao Yu.ATLANTIS REHAB & RHCF.4.12.16_2016-04-12-16.07.41.372.pdf
Request;20151023-000039;83367;PACE;Inpatient;PACE;C:\Users\FGuo\Documents\work doucment\attachment\attachmentDB\20161005\originalFileFromAerial\DOCSVC_20161003.tar\DOCSVC_20161003\Sect2\INPATIENT\REQ_20151023-000039\Xu, Cnang Y - The Phoenix Rehab and Nursing Center 2- 6.23.16_2016-06-23-15.52.40.129.pdf
Request;20151029-000065;21722;PACE;Inpatient;PACE;C:\Users\FGuo\Documents\work doucment\attachment\attachmentDB\20161005\originalFileFromAerial\DOCSVC_20161003.tar\DOCSVC_20161003\Sect2\INPATIENT\REQ_20151029-000065\Ringenberger Robert Integra Auth Approval 6.1_2016-06-01-09.53.50.646.pdf
Request;20151030-000031;30750;SELECT;Inpatient;SELECT;C:\Users\FGuo\Documents\work doucment\attachment\attachmentDB\20161005\originalFileFromAerial\DOCSVC_20161003.tar\DOCSVC_20161003\Sect2\INPATIENT\REQ_20151030-000031\CAROLYN ELLISON 09.09.16_2016-09-15-15.16.13.484.tif
Request;20151030-000031;30750;SELECT;Inpatient;SELECT;C:\Users\FGuo\Documents\work doucment\attachment\attachmentDB\20161005\originalFileFromAerial\DOCSVC_20161003.tar\DOCSVC_20161003\Sect2\INPATIENT\REQ_20151030-000031\Ellison, Carolyn - CLOVE LAKE HEALTH CARE REHAB CENTER 9.08.16_2016-09-08-15.37.57.400.pdf
Request;20151030-000031;30750;SELECT;Inpatient;SELECT;C:\Users\FGuo\Documents\work doucment\attachment\attachmentDB\20161005\originalFileFromAerial\DOCSVC_20161003.tar\DOCSVC_20161003\Sect2\INPATIENT\REQ_20151030-000031\Ellison, Carolyn - Clove Lake Health Care Rehab Center- 3.25.16_2016-03-25-12.07.26.351.pdf
Request;20151030-000031;30750;SELECT;Inpatient;SELECT;C:\Users\FGuo\Documents\work doucment\attachment\attachmentDB\20161005\originalFileFromAerial\DOCSVC_20161003.tar\DOCSVC_20161003\Sect2\INPATIENT\REQ_20151030-000031\Ellison, Carolyn_2016-07-13-13.42.48.285.tif
Request;20151106-000006;20171;SELECT;Inpatient;SELECT;C:\Users\FGuo\Documents\work doucment\attachment\attachmentDB\20161005\originalFileFromAerial\DOCSVC_20161003.tar\DOCSVC_20161003\Sect2\INPATIENT\REQ_20151106-000006\O_\Waters Place\Aerial\Medical Doc Rcvd\Schoner.M__CaringHospice__02.29.16_2016-02-29-13.52.50.488.tif
Request;20151106-000006;20171;SELECT;Inpatient;SELECT;C:\Users\FGuo\Documents\work doucment\attachment\attachmentDB\20161005\originalFileFromAerial\DOCSVC_20161003.tar\DOCSVC_20161003\Sect2\INPATIENT\REQ_20151106-000006\Schoner, Magda - Caring Hospice Services Of NY, LLC 07182016_2016-07-18-11.16.10.440.pdf
Request;20151106-000038;36506;PACE;Inpatient;PACE;C:\Users\FGuo\Documents\work doucment\attachment\attachmentDB\20161005\originalFileFromAerial\DOCSVC_20161003.tar\DOCSVC_20161003\Sect2\INPATIENT\REQ_20151106-000038\Olea, Yrenia - Montefiore Medical Center Approval Letter 3-15-16_2016-03-15-14.51.51.82.docx
Request;20151110-000050;39120;PACE;Inpatient;PACE;C:\Users\FGuo\Documents\work doucment\attachment\attachmentDB\20161005\originalFileFromAerial\DOCSVC_20161003.tar\DOCSVC_20161003\Sect2\INPATIENT\REQ_20151110-000050\evelyn washington31716_2016-03-17-17.14.45.340.tif
Request;20151110-000050;39120;PACE;Inpatient;PACE;C:\Users\FGuo\Documents\work doucment\attachment\attachmentDB\20161005\originalFileFromAerial\DOCSVC_20161003.tar\DOCSVC_20161003\Sect2\INPATIENT\REQ_20151110-000050\O_\Waters Place\Aerial\Auth Req_Clinicals\Washington.E__MountSinai__Clinical Request Form_ 03.15.16_2016-03-15-12.54.42.833.docx
Request;20151110-000050;39120;PACE;Inpatient;PACE;C:\Users\FGuo\Documents\work doucment\attachment\attachmentDB\20161005\originalFileFromAerial\DOCSVC_20161003.tar\DOCSVC_20161003\Sect2\INPATIENT\REQ_20151110-000050\Washington Evelyn IP Denial Mt Sinai Hospital 4-4-16_2016-04-04-15.35.24.895.pdf
Request;20151110-000050;39120;PACE;Inpatient;PACE;C:\Users\FGuo\Documents\work doucment\attachment\attachmentDB\20161005\originalFileFromAerial\DOCSVC_20161003.tar\DOCSVC_20161003\Sect2\INPATIENT\REQ_20151110-000050\Washington.E__MountSinai__Clinical Request Form_ 03.15.16_2016-03-15-12.55.33.99.docx
Request;20151116-000014;57120;null;Inpatient;SELECT;C:\Users\FGuo\Documents\work doucment\attachment\attachmentDB\20161005\originalFileFromAerial\DOCSVC_20161003.tar\DOCSVC_20161003\Sect2\INPATIENT\REQ_20151116-000014\Davis, Joerene   - Ditmas Park Rehab Care Center 7-11-16_2016-07-11-14.24.31.42.pdf
Request;20151125-000039;46672;SELECT;Inpatient;SELECT;C:\Users\FGuo\Documents\work doucment\attachment\attachmentDB\20161005\originalFileFromAerial\DOCSVC_20161003.tar\DOCSVC_20161003\Sect2\INPATIENT\REQ_20151125-000039\Geiger, Gary - New Vanderbilt Rehab 3-21-16_2016-03-21-13.34.05.543.pdf
Request;20151201-000016;21805;PACE;Inpatient;PACE;C:\Users\FGuo\Documents\work doucment\attachment\attachmentDB\20161005\originalFileFromAerial\DOCSVC_20161003.tar\DOCSVC_20161003\Sect2\INPATIENT\REQ_20151201-000016\Ruff, Mary -Atlantis Rehab & RHCF  5.12_2016-05-12-08.35.42.275.pdf
Request;20151201-000024;89356;SELECT;Inpatient;SELECT;C:\Users\FGuo\Documents\work doucment\attachment\attachmentDB\20161005\originalFileFromAerial\DOCSVC_20161003.tar\DOCSVC_20161003\Sect2\INPATIENT\REQ_20151201-000024\Martin, Anthony-Atlantis Rehab & RHCF (Auth 20151201-000024) 3.2.16_2016-03-02-10.24.54.619.pdf
Request;20151201-000030;25084;SELECT;Inpatient;SELECT;C:\Users\FGuo\Documents\work doucment\attachment\attachmentDB\20161005\originalFileFromAerial\DOCSVC_20161003.tar\DOCSVC_20161003\Sect2\INPATIENT\REQ_20151201-000030\Chan, Wan Lee - Atlantis Rehab & RHCF - 5.12_2016-05-12-08.55.44.708.pdf
Request;20151202-000005;58561;PACE;Inpatient;PACE;C:\Users\FGuo\Documents\work doucment\attachment\attachmentDB\20161005\originalFileFromAerial\DOCSVC_20161003.tar\DOCSVC_20161003\Sect2\INPATIENT\REQ_20151202-000005\Davis, Bessie M - ROCKVILLE SKILLED NURSING & REHABILITATION CENTER, - 5.24_2016-05-24-10.25.12.605.pdf
Request;20151202-000029;38676;SELECT;Inpatient;SELECT;C:\Users\FGuo\Documents\work doucment\attachment\attachmentDB\20161005\originalFileFromAerial\DOCSVC_20161003.tar\DOCSVC_20161003\Sect2\INPATIENT\REQ_20151202-000029\Fortune, Charles- Four Seasons Nursing Home  5.18_2016-05-18-11.45.57.508.pdf
Request;20151202-000051;36063;SELECT;Inpatient;SELECT;C:\Users\FGuo\Documents\work doucment\attachment\attachmentDB\20161005\originalFileFromAerial\DOCSVC_20161003.tar\DOCSVC_20161003\Sect2\INPATIENT\REQ_20151202-000051\Abrams, Barbara - Shoreview Nursing Home 7-5-16_2016-07-05-14.08.37.798.pdf
Request;20151202-000051;36063;SELECT;Inpatient;SELECT;C:\Users\FGuo\Documents\work doucment\attachment\attachmentDB\20161005\originalFileFromAerial\DOCSVC_20161003.tar\DOCSVC_20161003\Sect2\INPATIENT\REQ_20151202-000051\Abrams, Barbara .SHOREVIEW NURSING HOME.5.24_2016-05-24-08.07.55.184.pdf
Request;20151203-000016;58561;PACE;Inpatient;PACE;C:\Users\FGuo\Documents\work doucment\attachment\attachmentDB\20161005\originalFileFromAerial\DOCSVC_20161003.tar\DOCSVC_20161003\Sect2\INPATIENT\REQ_20151203-000016\Davis, Bessie M - Rockville Skilled Nursing & Rehabilitation Center - 7.21.16_2016-07-21-14.01.21.61.pdf
Request;20151203-000016;58561;PACE;Inpatient;PACE;C:\Users\FGuo\Documents\work doucment\attachment\attachmentDB\20161005\originalFileFromAerial\DOCSVC_20161003.tar\DOCSVC_20161003\Sect2\INPATIENT\REQ_20151203-000016\Davis, Bessie M - ROCKVILLE SKILLED NURSING & REHABILITATION CENTER, - 5.24_2016-05-24-09.33.23.721.pdf
Request;20151204-000059;24029;PACE;Inpatient;PACE;C:\Users\FGuo\Documents\work doucment\attachment\attachmentDB\20161005\originalFileFromAerial\DOCSVC_20161003.tar\DOCSVC_20161003\Sect2\INPATIENT\REQ_20151204-000059\CMalave.Shauvo, Galen-pri. 5.27.16_2016-05-27-08.56.07.577.tif
Request;20151204-000059;24029;PACE;Inpatient;PACE;C:\Users\FGuo\Documents\work doucment\attachment\attachmentDB\20161005\originalFileFromAerial\DOCSVC_20161003.tar\DOCSVC_20161003\Sect2\INPATIENT\REQ_20151204-000059\Galen Shauvo.SEPHARDIC NURSING HOME. 6.1.16 _2016-06-01-08.16.43.90.pdf
Request;20151207-000015;39292;SELECT;Inpatient;SELECT;C:\Users\FGuo\Documents\work doucment\attachment\attachmentDB\20161005\originalFileFromAerial\DOCSVC_20161003.tar\DOCSVC_20161003\Sect2\INPATIENT\REQ_20151207-000015\Katsifis, Mercedes Approval Letter Sutton Park Center for Nursing & Rehab 8.26.2016_2016-08-26-13.13.03.627.pdf
Request;20151207-000015;39292;SELECT;Inpatient;SELECT;C:\Users\FGuo\Documents\work doucment\attachment\attachmentDB\20161005\originalFileFromAerial\DOCSVC_20161003.tar\DOCSVC_20161003\Sect2\INPATIENT\REQ_20151207-000015\Katsifis, Mercedes_2016-08-26-12.48.04.263.pdf
Request;20151215-000074;60204;SELECT;Inpatient;SELECT;C:\Users\FGuo\Documents\work doucment\attachment\attachmentDB\20161005\originalFileFromAerial\DOCSVC_20161003.tar\DOCSVC_20161003\Sect2\INPATIENT\REQ_20151215-000074\Levey, Richard - Pine Valley Center  LLC  (Auth 20151215-000074) 2.16.16_2016-02-16-15.36.06.604.pdf
Request;20151215-000084;59710;SELECT;Inpatient;SELECT;C:\Users\FGuo\Documents\work doucment\attachment\attachmentDB\20161005\originalFileFromAerial\DOCSVC_20161003.tar\DOCSVC_20161003\Sect2\INPATIENT\REQ_20151215-000084\Motilall, Sita - Pine Valley Center  LLC  (Auth 20151215-000084 ) 2.16.16_2016-02-16-16.07.07.457.pdf
Request;20151218-000087;79779;SELECT;Inpatient;SELECT;C:\Users\FGuo\Documents\work doucment\attachment\attachmentDB\20161005\originalFileFromAerial\DOCSVC_20161003.tar\DOCSVC_20161003\Sect2\INPATIENT\REQ_20151218-000087\Cobo,Carmen - Keser nursing & rehab.5.25_2016-05-25-09.33.44.810.pdf
Request;20151222-000018;59922;SELECT;Inpatient;SELECT;C:\Users\FGuo\Documents\work doucment\attachment\attachmentDB\20161005\originalFileFromAerial\DOCSVC_20161003.tar\DOCSVC_20161003\Sect2\INPATIENT\REQ_20151222-000018\ABIATHA BERKELEY 09.01.16_2016-09-06-12.53.33.727.tif
Request;20151222-000062;59772;SELECT;Inpatient;SELECT;C:\Users\FGuo\Documents\work doucment\attachment\attachmentDB\20161005\originalFileFromAerial\DOCSVC_20161003.tar\DOCSVC_20161003\Sect2\INPATIENT\REQ_20151222-000062\Kibler, Keith - Pine Valley Center  LLC  (Auth 20151222-000062 ) 2.16.16_2016-02-16-15.29.09.196.pdf
Request;20151222-000098;60140;SELECT;Inpatient;SELECT;C:\Users\FGuo\Documents\work doucment\attachment\attachmentDB\20161005\originalFileFromAerial\DOCSVC_20161003.tar\DOCSVC_20161003\Sect2\INPATIENT\REQ_20151222-000098\Velez, William S-Pine Valley Center  LLC  (Auth 20151222-000098) 2.17.16_2016-02-17-11.05.01.643.pdf
Request;20151222-000099;49540;SELECT;Inpatient;SELECT;C:\Users\FGuo\Documents\work doucment\attachment\attachmentDB\20161005\originalFileFromAerial\DOCSVC_20161003.tar\DOCSVC_20161003\Sect2\INPATIENT\REQ_20151222-000099\Jean.M___ Approval Letter __PVC_ 04.06.16_2016-04-06-10.09.36.944.docx
Request;20151223-000098;42469;SELECT;Inpatient;SELECT;C:\Users\FGuo\Documents\work doucment\attachment\attachmentDB\20161005\originalFileFromAerial\DOCSVC_20161003.tar\DOCSVC_20161003\Sect2\INPATIENT\REQ_20151223-000098\caterina saglioca 3216a_2016-03-03-10.20.50.658.tif
Request;20151223-000098;42469;SELECT;Inpatient;SELECT;C:\Users\FGuo\Documents\work doucment\attachment\attachmentDB\20161005\originalFileFromAerial\DOCSVC_20161003.tar\DOCSVC_20161003\Sect2\INPATIENT\REQ_20151223-000098\caterina sagliocca3216_2016-03-03-10.19.26.590.tif
Request;20151223-000098;42469;SELECT;Inpatient;SELECT;C:\Users\FGuo\Documents\work doucment\attachment\attachmentDB\20161005\originalFileFromAerial\DOCSVC_20161003.tar\DOCSVC_20161003\Sect2\INPATIENT\REQ_20151223-000098\Sagliocca, Caterina - GLENGARIFF HEALTH CARE CENTER_2016-08-19-14.55.37.208.pdf
Request;20151224-000002;77414;PACE;Inpatient;PACE;C:\Users\FGuo\Documents\work doucment\attachment\attachmentDB\20161005\originalFileFromAerial\DOCSVC_20161003.tar\DOCSVC_20161003\Sect2\INPATIENT\REQ_20151224-000002\Son,SunYong 3940712_2016-04-11-10.49.56.422.pdf
Request;20151228-000054;42854;PACE;Inpatient;PACE;C:\Users\FGuo\Documents\work doucment\attachment\attachmentDB\20161005\originalFileFromAerial\DOCSVC_20161003.tar\DOCSVC_20161003\Sect2\INPATIENT\REQ_20151228-000054\Garcia, Juana-BUENA VIDA CONTINUING CARE & REHABI.5.11_2016-05-11-10.24.54.61.pdf
Request;20151230-000031;24200;SELECT;Inpatient;SELECT;C:\Users\FGuo\Documents\work doucment\attachment\attachmentDB\20161005\originalFileFromAerial\DOCSVC_20161003.tar\DOCSVC_20161003\Sect2\INPATIENT\REQ_20151230-000031\Charles, Gerone - Sheepshead Nursing and Rehab Center  5.11_2016-05-11-10.02.14.144.pdf
Request;20151230-000051;99612;PACE;Inpatient;PACE;C:\Users\FGuo\Documents\work doucment\attachment\attachmentDB\20161005\originalFileFromAerial\DOCSVC_20161003.tar\DOCSVC_20161003\Sect2\INPATIENT\REQ_20151230-000051\Eguez, Gloria - BETH ABRAHAM HEALTH SERVICES 9.07.16_2016-09-07-09.33.53.34.pdf
Request;20151231-000076;39047;PACE;Inpatient;PACE;C:\Users\FGuo\Documents\work doucment\attachment\attachmentDB\20161005\originalFileFromAerial\DOCSVC_20161003.tar\DOCSVC_20161003\Sect2\INPATIENT\REQ_20151231-000076\Brown, Howard E Clinicals.CMalave.6.3.16 _2016-06-03-11.47.32.384.tif
Request;20151231-000083;30303;PACE;Inpatient;PACE;C:\Users\FGuo\Documents\work doucment\attachment\attachmentDB\20161005\originalFileFromAerial\DOCSVC_20161003.tar\DOCSVC_20161003\Sect2\INPATIENT\REQ_20151231-000083\Burkes, James - WORKMEN'S CIRCLE HOME 9.08.16_2016-09-08-14.52.46.824.pdf
Request;20151231-000083;30303;PACE;Inpatient;PACE;C:\Users\FGuo\Documents\work doucment\attachment\attachmentDB\20161005\originalFileFromAerial\DOCSVC_20161003.tar\DOCSVC_20161003\Sect2\INPATIENT\REQ_20151231-000083\Burkes, James - Workmens Circle Home- 3.24.16_2016-03-24-12.16.10.310.pdf
Request;20151231-000093;81494;PACE;Inpatient;PACE;C:\Users\FGuo\Documents\work doucment\attachment\attachmentDB\20161005\originalFileFromAerial\DOCSVC_20161003.tar\DOCSVC_20161003\Sect2\INPATIENT\REQ_20151231-000093\Cheng Li, Lung Kam  - Atlantis Rehab & RHCF (Auth 20151231-000093) 3.7.16_2016-03-07-14.25.52.634.pdf
Request;20151231-000095;29577;PACE;Inpatient;PACE;C:\Users\FGuo\Documents\work doucment\attachment\attachmentDB\20161005\originalFileFromAerial\DOCSVC_20161003.tar\DOCSVC_20161003\Sect2\INPATIENT\REQ_20151231-000095\Chu, Kit C - Atlantis Rehab & RHCF (Auth 20151231-000095) 2.29.16_2016-02-29-10.58.45.809.pdf
Request;20151231-000095;29577;PACE;Inpatient;PACE;C:\Users\FGuo\Documents\work doucment\attachment\attachmentDB\20161005\originalFileFromAerial\DOCSVC_20161003.tar\DOCSVC_20161003\Sect2\INPATIENT\REQ_20151231-000095\Chu, Kit C - ATLANTIS REHAB & RHCF 9.07.16_2016-09-07-16.40.44.580.pdf
Request;20160104-000009;48463;null;Inpatient;PACE;C:\Users\FGuo\Documents\work doucment\attachment\attachmentDB\20161005\originalFileFromAerial\DOCSVC_20161003.tar\DOCSVC_20161003\Sect2\INPATIENT\REQ_20160104-000009\Coley, Vivian Beth Abraham Health Services 3.22.16_2016-03-22-15.34.01.768.pdf
Request;20160104-000009;48463;null;Inpatient;PACE;C:\Users\FGuo\Documents\work doucment\attachment\attachmentDB\20161005\originalFileFromAerial\DOCSVC_20161003.tar\DOCSVC_20161003\Sect2\INPATIENT\REQ_20160104-000009\Coley, Vivian Beth Abraham Health Services 3.22.16_2016-03-22-15.34.45.420.pdf
Request;20160104-000011;96668;PACE;Inpatient;PACE;C:\Users\FGuo\Documents\work doucment\attachment\attachmentDB\20161005\originalFileFromAerial\DOCSVC_20161003.tar\DOCSVC_20161003\Sect2\INPATIENT\REQ_20160104-000011\Collado, Dominica-BUENA VIDA CONTINUING CARE & REHABI.3.22.16_2016-03-22-15.58.25.741.pdf
Request;20160104-000012;83972;PACE;Inpatient;PACE;C:\Users\FGuo\Documents\work doucment\attachment\attachmentDB\20161005\originalFileFromAerial\DOCSVC_20161003.tar\DOCSVC_20161003\Sect2\INPATIENT\REQ_20160104-000012\Delvalle Gloria-BUENA VIDA CONTINUING CARE & REHABI.3.22.16_2016-03-22-16.06.54.683.pdf
Request;20160104-000012;83972;PACE;Inpatient;PACE;C:\Users\FGuo\Documents\work doucment\attachment\attachmentDB\20161005\originalFileFromAerial\DOCSVC_20161003.tar\DOCSVC_20161003\Sect2\INPATIENT\REQ_20160104-000012\_2016-03-22-16.06.59.690
Request;20160104-000015;74934;PACE;Inpatient;PACE;C:\Users\FGuo\Documents\work doucment\attachment\attachmentDB\20161005\originalFileFromAerial\DOCSVC_20161003.tar\DOCSVC_20161003\Sect2\INPATIENT\REQ_20160104-000015\Deshields Bernice-CENTER FOR NURSING AND REHABILITATION.3.22.16_2016-03-22-16.22.23.742.pdf
Request;20160104-000022;35362;PACE;Inpatient;PACE;C:\Users\FGuo\Documents\work doucment\attachment\attachmentDB\20161005\originalFileFromAerial\DOCSVC_20161003.tar\DOCSVC_20161003\Sect2\INPATIENT\REQ_20160104-000022\Erazo, Francisco - BETH ABRAHAM HEALTH SERVICES 9.13.16_2016-09-13-15.24.36.730.pdf
Request;20160104-000022;35362;PACE;Inpatient;PACE;C:\Users\FGuo\Documents\work doucment\attachment\attachmentDB\20161005\originalFileFromAerial\DOCSVC_20161003.tar\DOCSVC_20161003\Sect2\INPATIENT\REQ_20160104-000022\ErazoFrancisco-BethAbrahamNH-3.22.16_2016-03-22-16.48.31.924.pdf
Request;20160104-000026;75820;PACE;Inpatient;PACE;C:\Users\FGuo\Documents\work doucment\attachment\attachmentDB\20161005\originalFileFromAerial\DOCSVC_20161003.tar\DOCSVC_20161003\Sect2\INPATIENT\REQ_20160104-000026\ErazoFrancisco-BethAbrahamNH-3.22.16_2016-03-23-09.22.50.108.pdf
Request;20160104-000031;73910;PACE;Inpatient;PACE;C:\Users\FGuo\Documents\work doucment\attachment\attachmentDB\20161005\originalFileFromAerial\DOCSVC_20161003.tar\DOCSVC_20161003\Sect2\INPATIENT\REQ_20160104-000031\Felton.George.BethAbrahamHealthServices.3.23.16_2016-03-23-09.34.25.435.pdf
Request;20160104-000036;20032;PACE;Inpatient;PACE;C:\Users\FGuo\Documents\work doucment\attachment\attachmentDB\20161005\originalFileFromAerial\DOCSVC_20161003.tar\DOCSVC_20161003\Sect2\INPATIENT\REQ_20160104-000036\Friedman.Dorothy.SephardicNursingHome.3.23.16_2016-03-23-09.44.47.730.pdf
Request;20160104-000037;30846;PACE;Inpatient;PACE;C:\Users\FGuo\Documents\work doucment\attachment\attachmentDB\20161005\originalFileFromAerial\DOCSVC_20161003.tar\DOCSVC_20161003\Sect2\INPATIENT\REQ_20160104-000037\Frolova, Anna - CROWN NURSING HOME ASSOCIATES - 4.19.16_2016-04-19-09.02.03.869.pdf
Request;20160104-000040;52729;PACE;Inpatient;PACE;C:\Users\FGuo\Documents\work doucment\attachment\attachmentDB\20161005\originalFileFromAerial\DOCSVC_20161003.tar\DOCSVC_20161003\Sect2\INPATIENT\REQ_20160104-000040\Garcia.Carmen.verrazanoNH.3.23.16_2016-03-23-10.25.27.472.pdf
Request;20160104-000042;25829;PACE;Inpatient;PACE;C:\Users\FGuo\Documents\work doucment\attachment\attachmentDB\20161005\originalFileFromAerial\DOCSVC_20161003.tar\DOCSVC_20161003\Sect2\INPATIENT\REQ_20160104-000042\Gill.Marjorie.RIVERMANORNH.3.23.16_2016-03-23-10.39.38.883.pdf
Request;20160104-000048;44187;PACE;Inpatient;PACE;C:\Users\FGuo\Documents\work doucment\attachment\attachmentDB\20161005\originalFileFromAerial\DOCSVC_20161003.tar\DOCSVC_20161003\Sect2\INPATIENT\REQ_20160104-000048\Vivas.Jorge.CNR.3.23.16_2016-03-23-11.03.41.981.pdf
Request;20160104-000051;72154;PACE;Inpatient;PACE;C:\Users\FGuo\Documents\work doucment\attachment\attachmentDB\20161005\originalFileFromAerial\DOCSVC_20161003.tar\DOCSVC_20161003\Sect2\INPATIENT\REQ_20160104-000051\GoldmanMariyaM.ShoreviewNH.3.23.16_2016-03-23-11.31.50.982.pdf
Request;20160104-000056;82812;PACE;Inpatient;PACE;C:\Users\FGuo\Documents\work doucment\attachment\attachmentDB\20161005\originalFileFromAerial\DOCSVC_20161003.tar\DOCSVC_20161003\Sect2\INPATIENT\REQ_20160104-000056\Gomez, Evaristo  -Beth Abraham Health Svcs.  (Auth 20160104-000056 ) 2.17.16_2016-02-18-11.10.18.768.pdf
Request;20160104-000058;84555;PACE;Inpatient;PACE;C:\Users\FGuo\Documents\work doucment\attachment\attachmentDB\20161005\originalFileFromAerial\DOCSVC_20161003.tar\DOCSVC_20161003\Sect2\INPATIENT\REQ_20160104-000058\Goris.Blanca.IsabellaGeriatricNH.3.23.16_2016-03-23-11.42.42.152.pdf
Request;20160104-000061;80031;PACE;Inpatient;PACE;C:\Users\FGuo\Documents\work doucment\attachment\attachmentDB\20161005\originalFileFromAerial\DOCSVC_20161003.tar\DOCSVC_20161003\Sect2\INPATIENT\REQ_20160104-000061\GurleyPatricia.BethAbrahamHealthServices.3.23.16_2016-03-23-11.53.31.778.pdf
Request;20160104-000061;80031;PACE;Inpatient;PACE;C:\Users\FGuo\Documents\work doucment\attachment\attachmentDB\20161005\originalFileFromAerial\DOCSVC_20161003.tar\DOCSVC_20161003\Sect2\INPATIENT\REQ_20160104-000061\_2016-03-23-11.53.35.527
Request;20160104-000067;60305;null;Inpatient;SELECT;C:\Users\FGuo\Documents\work doucment\attachment\attachmentDB\20161005\originalFileFromAerial\DOCSVC_20161003.tar\DOCSVC_20161003\Sect2\INPATIENT\REQ_20160104-000067\Amberwood, Lee 60305 -  Avalon Gardens  06-14-16_2016-06-15-09.28.46.913.pdf
Request;20160104-000069;29785;SELECT;Inpatient;SELECT;C:\Users\FGuo\Documents\work doucment\attachment\attachmentDB\20161005\originalFileFromAerial\DOCSVC_20161003.tar\DOCSVC_20161003\Sect2\INPATIENT\REQ_20160104-000069\Leonard, James - Peninsula General NH  4-8-16_2016-04-08-15.43.28.86.pdf
Request;20160104-000076;30083;PACE;Inpatient;PACE;C:\Users\FGuo\Documents\work doucment\attachment\attachmentDB\20161005\originalFileFromAerial\DOCSVC_20161003.tar\DOCSVC_20161003\Sect2\INPATIENT\REQ_20160104-000076\Guzman.Margarita.BethAbrahamHealthServices.3.23.16_2016-03-23-15.49.00.815.pdf
Request;20160104-000078;81976;PACE;Inpatient;PACE;C:\Users\FGuo\Documents\work doucment\attachment\attachmentDB\20161005\originalFileFromAerial\DOCSVC_20161003.tar\DOCSVC_20161003\Sect2\INPATIENT\REQ_20160104-000078\HernandezAbigail.IsabellaGeriatricNH.3.23.16_2016-03-23-16.04.38.828.pdf
Request;20160104-000080;82967;PACE;Inpatient;PACE;C:\Users\FGuo\Documents\work doucment\attachment\attachmentDB\20161005\originalFileFromAerial\DOCSVC_20161003.tar\DOCSVC_20161003\Sect2\INPATIENT\REQ_20160104-000080\HernandezAngelL.BethAbrahamHealthServices.3.23.16_2016-03-23-16.16.11.738.pdf
Request;20160104-000086;77002;PACE;Inpatient;PACE;C:\Users\FGuo\Documents\work doucment\attachment\attachmentDB\20161005\originalFileFromAerial\DOCSVC_20161003.tar\DOCSVC_20161003\Sect2\INPATIENT\REQ_20160104-000086\HodgesWilliemae.BethAbrahamHealthServices.3.23.16_2016-03-23-16.23.36.725.pdf
Request;20160104-000088;26059;PACE;Inpatient;PACE;C:\Users\FGuo\Documents\work doucment\attachment\attachmentDB\20161005\originalFileFromAerial\DOCSVC_20161003.tar\DOCSVC_20161003\Sect2\INPATIENT\REQ_20160104-000088\Hunt, Horace - BETH ABRAHAM HEALTH SERVICES 9.02.16_2016-09-02-15.58.08.560.pdf
Request;20160104-000088;26059;PACE;Inpatient;PACE;C:\Users\FGuo\Documents\work doucment\attachment\attachmentDB\20161005\originalFileFromAerial\DOCSVC_20161003.tar\DOCSVC_20161003\Sect2\INPATIENT\REQ_20160104-000088\HuntHorace.BethAbrahamHealthServices.3.23.16_2016-03-23-16.44.11.439.pdf
Request;20160104-000092;25499;PACE;Inpatient;PACE;C:\Users\FGuo\Documents\work doucment\attachment\attachmentDB\20161005\originalFileFromAerial\DOCSVC_20161003.tar\DOCSVC_20161003\Sect2\INPATIENT\REQ_20160104-000092\ImperatoAngelina.CLOVELAKEHEALTHCAREREHABCENTER.3.23.16_2016-03-23-17.00.06.798.pdf
Request;20160104-000094;45276;PACE;Inpatient;PACE;C:\Users\FGuo\Documents\work doucment\attachment\attachmentDB\20161005\originalFileFromAerial\DOCSVC_20161003.tar\DOCSVC_20161003\Sect2\INPATIENT\REQ_20160104-000094\James.Esther.BethAbrahamHealthServices.3.23.16_2016-03-23-17.15.52.168.pdf
Request;20160104-000097;80529;PACE;Inpatient;PACE;C:\Users\FGuo\Documents\work doucment\attachment\attachmentDB\20161005\originalFileFromAerial\DOCSVC_20161003.tar\DOCSVC_20161003\Sect2\INPATIENT\REQ_20160104-000097\JiangAiYou.UnionPlazaNH.3.23.16_2016-03-23-17.46.05.939.pdf
Request;20160104-000101;74268;PACE;Inpatient;PACE;C:\Users\FGuo\Documents\work doucment\attachment\attachmentDB\20161005\originalFileFromAerial\DOCSVC_20161003.tar\DOCSVC_20161003\Sect2\INPATIENT\REQ_20160104-000101\JoynerPansy-CENTER FOR NURSING AND REHABILITATION.3.24.16_2016-03-24-09.08.57.606.pdf
Request;20160104-000103;85931;PACE;Inpatient;PACE;C:\Users\FGuo\Documents\work doucment\attachment\attachmentDB\20161005\originalFileFromAerial\DOCSVC_20161003.tar\DOCSVC_20161003\Sect2\INPATIENT\REQ_20160104-000103\KimBokS-UnionPlazaNH.3.24.16_2016-03-24-09.22.20.738.pdf
Request;20160104-000105;70963;PACE;Inpatient;PACE;C:\Users\FGuo\Documents\work doucment\attachment\attachmentDB\20161005\originalFileFromAerial\DOCSVC_20161003.tar\DOCSVC_20161003\Sect2\INPATIENT\REQ_20160104-000105\KudishevaAnna.Shoreview Nursing Home3.24.16_2016-03-24-09.44.29.333.pdf
Request;20160104-000107;35799;PACE;Inpatient;PACE;C:\Users\FGuo\Documents\work doucment\attachment\attachmentDB\20161005\originalFileFromAerial\DOCSVC_20161003.tar\DOCSVC_20161003\Sect2\INPATIENT\REQ_20160104-000107\Laborde, Peter - River Manor Nursing Home  9.13.16_2016-09-13-16.03.00.50.pdf
Request;20160104-000107;35799;PACE;Inpatient;PACE;C:\Users\FGuo\Documents\work doucment\attachment\attachmentDB\20161005\originalFileFromAerial\DOCSVC_20161003.tar\DOCSVC_20161003\Sect2\INPATIENT\REQ_20160104-000107\Laborde, Peter_2016-08-15-11.41.22.149.tif
Request;20160104-000107;35799;PACE;Inpatient;PACE;C:\Users\FGuo\Documents\work doucment\attachment\attachmentDB\20161005\originalFileFromAerial\DOCSVC_20161003.tar\DOCSVC_20161003\Sect2\INPATIENT\REQ_20160104-000107\Laborde, Peter_2016-09-13-11.24.49.980.tif
Request;20160104-000107;35799;PACE;Inpatient;PACE;C:\Users\FGuo\Documents\work doucment\attachment\attachmentDB\20161005\originalFileFromAerial\DOCSVC_20161003.tar\DOCSVC_20161003\Sect2\INPATIENT\REQ_20160104-000107\LabordePeter.River Manor Nursing Home.3.24.16_2016-03-24-09.51.48.81.pdf
Request;20160104-000111;78284;PACE;Inpatient;PACE;C:\Users\FGuo\Documents\work doucment\attachment\attachmentDB\20161005\originalFileFromAerial\DOCSVC_20161003.tar\DOCSVC_20161003\Sect2\INPATIENT\REQ_20160104-000111\Lee.Donja.UnionPlazaNH.3.24.16_2016-03-24-09.56.22.169.pdf
Request;20160104-000112;81005;PACE;Inpatient;PACE;C:\Users\FGuo\Documents\work doucment\attachment\attachmentDB\20161005\originalFileFromAerial\DOCSVC_20161003.tar\DOCSVC_20161003\Sect2\INPATIENT\REQ_20160104-000112\Gutin.Kim.ISABELLAGERIATRICNURSINGHOME3.24.16_2016-03-24-16.24.45.578.pdf
Request;20160104-000114;99348;PACE;Inpatient;PACE;C:\Users\FGuo\Documents\work doucment\attachment\attachmentDB\20161005\originalFileFromAerial\DOCSVC_20161003.tar\DOCSVC_20161003\Sect2\INPATIENT\REQ_20160104-000114\LiYuLan.UnionPlazaNH.3.24.16_2016-03-24-10.03.37.613.pdf
Request;20160104-000115;21697;PACE;Inpatient;PACE;C:\Users\FGuo\Documents\work doucment\attachment\attachmentDB\20161005\originalFileFromAerial\DOCSVC_20161003.tar\DOCSVC_20161003\Sect2\INPATIENT\REQ_20160104-000115\LopezNicholas-BUENA VIDA CONTINUING CARE & REHABI.3.24.16_2016-03-24-10.10.11.880.pdf
Request;20160104-000124;81709;PACE;Inpatient;PACE;C:\Users\FGuo\Documents\work doucment\attachment\attachmentDB\20161005\originalFileFromAerial\DOCSVC_20161003.tar\DOCSVC_20161003\Sect2\INPATIENT\REQ_20160104-000124\LukeEmelda.Cobble Hill Nh.3.24.16_2016-03-24-10.24.09.680.pdf
Request;20160104-000124;81709;PACE;Inpatient;PACE;C:\Users\FGuo\Documents\work doucment\attachment\attachmentDB\20161005\originalFileFromAerial\DOCSVC_20161003.tar\DOCSVC_20161003\Sect2\INPATIENT\REQ_20160104-000124\LukeEmelda.Cobble Hill Nh.3.24.16_2016-03-24-10.27.29.337.pdf
Request;20160104-000124;81709;PACE;Inpatient;PACE;C:\Users\FGuo\Documents\work doucment\attachment\attachmentDB\20161005\originalFileFromAerial\DOCSVC_20161003.tar\DOCSVC_20161003\Sect2\INPATIENT\REQ_20160104-000124\_2016-03-24-10.24.12.384
Request;20160104-000125;34086;PACE;Inpatient;PACE;C:\Users\FGuo\Documents\work doucment\attachment\attachmentDB\20161005\originalFileFromAerial\DOCSVC_20161003.tar\DOCSVC_20161003\Sect2\INPATIENT\REQ_20160104-000125\Ly, Hue - UNION PLAZA NURSING HOME 9.12.16_2016-09-12-15.05.17.998.pdf
Request;20160104-000125;34086;PACE;Inpatient;PACE;C:\Users\FGuo\Documents\work doucment\attachment\attachmentDB\20161005\originalFileFromAerial\DOCSVC_20161003.tar\DOCSVC_20161003\Sect2\INPATIENT\REQ_20160104-000125\Ly,Hue Union Plaza Nursing Home 3.24.16_2016-03-24-10.20.29.639.pdf
Request;20160104-000127;29096;PACE;Inpatient;PACE;C:\Users\FGuo\Documents\work doucment\attachment\attachmentDB\20161005\originalFileFromAerial\DOCSVC_20161003.tar\DOCSVC_20161003\Sect2\INPATIENT\REQ_20160104-000127\Mane, Gjyle - BUENA VIDA CONTINUING CARE & REHABI 9.07.16_2016-09-07-13.11.57.406.pdf
Request;20160104-000127;29096;PACE;Inpatient;PACE;C:\Users\FGuo\Documents\work doucment\attachment\attachmentDB\20161005\originalFileFromAerial\DOCSVC_20161003.tar\DOCSVC_20161003\Sect2\INPATIENT\REQ_20160104-000127\Mane, Gjyle BUENA VIDA CONTINUING CARE & REHABI 3.24.16_2016-03-24-11.30.37.473.pdf
Request;20160104-000127;29096;PACE;Inpatient;PACE;C:\Users\FGuo\Documents\work doucment\attachment\attachmentDB\20161005\originalFileFromAerial\DOCSVC_20161003.tar\DOCSVC_20161003\Sect2\INPATIENT\REQ_20160104-000127\Mane, Gjyle BUENA VIDA CONTINUING CARE & REHABI 3.24.16_2016-03-24-12.06.35.207.pdf
Request;20160104-000129;78031;PACE;Inpatient;PACE;C:\Users\FGuo\Documents\work doucment\attachment\attachmentDB\20161005\originalFileFromAerial\DOCSVC_20161003.tar\DOCSVC_20161003\Sect2\INPATIENT\REQ_20160104-000129\MartinUrsulaBeth Abraham Health Services 3.24.16_2016-03-24-11.27.23.357.pdf
Request;20160104-000131;29843;PACE;Inpatient;PACE;C:\Users\FGuo\Documents\work doucment\attachment\attachmentDB\20161005\originalFileFromAerial\DOCSVC_20161003.tar\DOCSVC_20161003\Sect2\INPATIENT\REQ_20160104-000131\Mills, Robert - BETH ABRAHAM HEALTH SERVICES 9.08.16_2016-09-08-10.14.07.689.pdf
Request;20160104-000131;29843;PACE;Inpatient;PACE;C:\Users\FGuo\Documents\work doucment\attachment\attachmentDB\20161005\originalFileFromAerial\DOCSVC_20161003.tar\DOCSVC_20161003\Sect2\INPATIENT\REQ_20160104-000131\Mills.Robert.Beth Abraham Health Services 3.24.16_2016-03-24-11.41.49.351.pdf
Request;20160105-000024;31583;PACE;Inpatient;PACE;C:\Users\FGuo\Documents\work doucment\attachment\attachmentDB\20161005\originalFileFromAerial\DOCSVC_20161003.tar\DOCSVC_20161003\Sect2\INPATIENT\REQ_20160105-000024\Mok.JooEung.UNION PLAZA NURSING HOME.3.24.16_2016-03-24-12.20.27.574.pdf
Request;20160105-000031;60247;SELECT;Inpatient;DIRECT/SELECT LT;C:\Users\FGuo\Documents\work doucment\attachment\attachmentDB\20161005\originalFileFromAerial\DOCSVC_20161003.tar\DOCSVC_20161003\Sect2\INPATIENT\REQ_20160105-000031\Katherinelaufer.SchnurmacherNH.3.25.16_2016-03-25-10.02.11.82.pdf
Request;20160105-000041;83979;PACE;Inpatient;PACE;C:\Users\FGuo\Documents\work doucment\attachment\attachmentDB\20161005\originalFileFromAerial\DOCSVC_20161003.tar\DOCSVC_20161003\Sect2\INPATIENT\REQ_20160105-000041\Juanaortiz.RegisCareCenter.3.24.16_2016-03-24-12.58.15.115.pdf
Request;20160105-000041;83979;PACE;Inpatient;PACE;C:\Users\FGuo\Documents\work doucment\attachment\attachmentDB\20161005\originalFileFromAerial\DOCSVC_20161003.tar\DOCSVC_20161003\Sect2\INPATIENT\REQ_20160105-000041\Ortiz, Juana 6.3.16 _2016-06-03-16.46.49.802.tif
Request;20160105-000043;26549;PACE;Inpatient;PACE;C:\Users\FGuo\Documents\work doucment\attachment\attachmentDB\20161005\originalFileFromAerial\DOCSVC_20161003.tar\DOCSVC_20161003\Sect2\INPATIENT\REQ_20160105-000043\Pala, Janina - EGER HEALTH CARE & REHAB CENTER 9.07.16_2016-09-07-09.21.18.861.pdf
Request;20160105-000043;26549;PACE;Inpatient;PACE;C:\Users\FGuo\Documents\work doucment\attachment\attachmentDB\20161005\originalFileFromAerial\DOCSVC_20161003.tar\DOCSVC_20161003\Sect2\INPATIENT\REQ_20160105-000043\Pala.Janina.Eger Nursing Home.3.24.16_2016-03-24-15.32.46.221.pdf
Request;20160105-000045;27423;SELECT;Inpatient;FIDA;C:\Users\FGuo\Documents\work doucment\attachment\attachmentDB\20161005\originalFileFromAerial\DOCSVC_20161003.tar\DOCSVC_20161003\Sect2\INPATIENT\REQ_20160105-000045\Quarless, Veronica - River Manor Care Center 9.07.16_2016-09-07-10.58.17.305.pdf
Request;20160105-000045;27423;SELECT;Inpatient;FIDA;C:\Users\FGuo\Documents\work doucment\attachment\attachmentDB\20161005\originalFileFromAerial\DOCSVC_20161003.tar\DOCSVC_20161003\Sect2\INPATIENT\REQ_20160105-000045\Quarless, Veronica - River Manor Corp, DBA River Manor Care   4.28.16_2016-04-28-10.36.20.869.pdf
Request;20160105-000045;27423;SELECT;Inpatient;FIDA;C:\Users\FGuo\Documents\work doucment\attachment\attachmentDB\20161005\originalFileFromAerial\DOCSVC_20161003.tar\DOCSVC_20161003\Sect2\INPATIENT\REQ_20160105-000045\VERONICA QUARLESS_2016-09-29-15.48.29.630.tif
Request;20160105-000051;76606;PACE;Inpatient;PACE;C:\Users\FGuo\Documents\work doucment\attachment\attachmentDB\20161005\originalFileFromAerial\DOCSVC_20161003.tar\DOCSVC_20161003\Sect2\INPATIENT\REQ_20160105-000051\BokSoonPark.UnionPlazaCareCenter.3.24.16_2016-03-24-15.49.48.406.pdf
Request;20160105-000052;49600;PACE;Inpatient;PACE;C:\Users\FGuo\Documents\work doucment\attachment\attachmentDB\20161005\originalFileFromAerial\DOCSVC_20161003.tar\DOCSVC_20161003\Sect2\INPATIENT\REQ_20160105-000052\MaryFGeorge.WomensCircleHome.3.24.16_2016-03-24-15.56.44.829.pdf
Request;20160105-000053;77439;PACE;Inpatient;PACE;C:\Users\FGuo\Documents\work doucment\attachment\attachmentDB\20161005\originalFileFromAerial\DOCSVC_20161003.tar\DOCSVC_20161003\Sect2\INPATIENT\REQ_20160105-000053\ParkYoungJ.UNIONPLAZANURSINGHOME.3.24.16_2016-03-24-16.05.45.712.pdf
Request;20160105-000056;77944;PACE;Inpatient;PACE;C:\Users\FGuo\Documents\work doucment\attachment\attachmentDB\20161005\originalFileFromAerial\DOCSVC_20161003.tar\DOCSVC_20161003\Sect2\INPATIENT\REQ_20160105-000056\MariePaul.RivermanorCorp.3.24.16_2016-03-24-16.13.36.494.pdf
Request;20160105-000057;29692;DIRECT;Inpatient;DIRECT;C:\Users\FGuo\Documents\work doucment\attachment\attachmentDB\20161005\originalFileFromAerial\DOCSVC_20161003.tar\DOCSVC_20161003\Sect2\INPATIENT\REQ_20160105-000057\NilsaPerez.BETHABRAHAMHEALTHSERVICES.3.24.16_2016-03-24-16.18.27.226.pdf
Request;20160105-000058;27123;PACE;Inpatient;PACE;C:\Users\FGuo\Documents\work doucment\attachment\attachmentDB\20161005\originalFileFromAerial\DOCSVC_20161003.tar\DOCSVC_20161003\Sect2\INPATIENT\REQ_20160105-000058\ClarencePhillips.ISABELLAGERIATRICNURSINGHOME.3.24.16_2016-03-24-16.32.49.796.pdf
Request;20160105-000061;20215;PACE;Inpatient;PACE;C:\Users\FGuo\Documents\work doucment\attachment\attachmentDB\20161005\originalFileFromAerial\DOCSVC_20161003.tar\DOCSVC_20161003\Sect2\INPATIENT\REQ_20160105-000061\DorothyPhillips.CENTERFORNURSINGANDREHABILITATION.3.24.16_2016-03-24-16.45.21.301.pdf
Request;20160105-000064;29841;DIRECT;Inpatient;PACE;C:\Users\FGuo\Documents\work doucment\attachment\attachmentDB\20161005\originalFileFromAerial\DOCSVC_20161003.tar\DOCSVC_20161003\Sect2\INPATIENT\REQ_20160105-000064\Rivas Minerva - Northern Manhattan Rehab 3-24-16_2016-03-24-14.10.00.457.pdf
Request;20160105-000066;80235;PACE;Inpatient;PACE;C:\Users\FGuo\Documents\work doucment\attachment\attachmentDB\20161005\originalFileFromAerial\DOCSVC_20161003.tar\DOCSVC_20161003\Sect2\INPATIENT\REQ_20160105-000066\Rosario, Guillermina - Isabell Geriatric NH 3-24-16_2016-03-24-12.05.36.220.pdf
Request;20160105-000077;73954;PACE;Inpatient;PACE;C:\Users\FGuo\Documents\work doucment\attachment\attachmentDB\20161005\originalFileFromAerial\DOCSVC_20161003.tar\DOCSVC_20161003\Sect2\INPATIENT\REQ_20160105-000077\Shpiglov, Pyotr SHOREVIEW NURSING HOME 3.24.16_2016-03-24-16.21.57.195.pdf
Request;20160105-000081;99110;null;Inpatient;PACE;C:\Users\FGuo\Documents\work doucment\attachment\attachmentDB\20161005\originalFileFromAerial\DOCSVC_20161003.tar\DOCSVC_20161003\Sect2\INPATIENT\REQ_20160105-000081\Sidosky Ida  - Beth Abraham Health Services 3-24-16_2016-03-24-16.31.07.31.pdf
Request;20160105-000084;74952;PACE;Inpatient;PACE;C:\Users\FGuo\Documents\work doucment\attachment\attachmentDB\20161005\originalFileFromAerial\DOCSVC_20161003.tar\DOCSVC_20161003\Sect2\INPATIENT\REQ_20160105-000084\Singleton Matthew - Beth Abraham Health Services 3-24-16_2016-03-24-16.32.21.699.pdf
Request;20160105-000087;92657;PACE;Inpatient;PACE;C:\Users\FGuo\Documents\work doucment\attachment\attachmentDB\20161005\originalFileFromAerial\DOCSVC_20161003.tar\DOCSVC_20161003\Sect2\INPATIENT\REQ_20160105-000087\DavidSmith.CEDARMANOR.3.24.16_2016-03-24-17.35.57.887.pdf
Request;20160105-000092;45034;SELECT;Inpatient;SELECT;C:\Users\FGuo\Documents\work doucment\attachment\attachmentDB\20161005\originalFileFromAerial\DOCSVC_20161003.tar\DOCSVC_20161003\Sect2\INPATIENT\REQ_20160105-000092\MackeyLorraine.FourSeasonsNH.3.24.16_2016-03-24-17.42.37.461.pdf
Request;20160105-000093;24351;PACE;Inpatient;PACE;C:\Users\FGuo\Documents\work doucment\attachment\attachmentDB\20161005\originalFileFromAerial\DOCSVC_20161003.tar\DOCSVC_20161003\Sect2\INPATIENT\REQ_20160105-000093\SmithLerriaJ.ShoreviewNH.3.25.16_2016-03-25-09.09.07.850.pdf
Request;20160105-000094;52231;SELECT;Inpatient;SELECT;C:\Users\FGuo\Documents\work doucment\attachment\attachmentDB\20161005\originalFileFromAerial\DOCSVC_20161003.tar\DOCSVC_20161003\Sect2\INPATIENT\REQ_20160105-000094\Greenfield, Josephine - DUMONT MASONIC NH - 4.29_2016-04-29-11.37.21.742.pdf
Request;20160105-000095;86211;SELECT;Inpatient;SELECT;C:\Users\FGuo\Documents\work doucment\attachment\attachmentDB\20161005\originalFileFromAerial\DOCSVC_20161003.tar\DOCSVC_20161003\Sect2\INPATIENT\REQ_20160105-000095\AdaDickenson.BethAbrahamHealthServices.3.25.16_2016-03-25-09.12.42.182.pdf
Request;20160105-000097;95944;PACE;Inpatient;PACE;C:\Users\FGuo\Documents\work doucment\attachment\attachmentDB\20161005\originalFileFromAerial\DOCSVC_20161003.tar\DOCSVC_20161003\Sect2\INPATIENT\REQ_20160105-000097\Smith, Ruth -Gouveneur Healthcare Svcs. (Auth 20160105-000097 ) 2.19.16_2016-02-19-09.30.13.940.pdf
Request;20160105-000097;95944;PACE;Inpatient;PACE;C:\Users\FGuo\Documents\work doucment\attachment\attachmentDB\20161005\originalFileFromAerial\DOCSVC_20161003.tar\DOCSVC_20161003\Sect2\INPATIENT\REQ_20160105-000097\_2016-02-19-09.30.01.151
Request;20160105-000098;56108;PACE;Inpatient;PACE;C:\Users\FGuo\Documents\work doucment\attachment\attachmentDB\20161005\originalFileFromAerial\DOCSVC_20161003.tar\DOCSVC_20161003\Sect2\INPATIENT\REQ_20160105-000098\Martin, Helene A - Atlantis Rehab & RHCF (Auth 20160105-000098) 3.7.16_2016-03-07-14.39.19.514.pdf
Request;20160105-000101;57246;null;Inpatient;PACE;C:\Users\FGuo\Documents\work doucment\attachment\attachmentDB\20161005\originalFileFromAerial\DOCSVC_20161003.tar\DOCSVC_20161003\Sect2\INPATIENT\REQ_20160105-000101\Heggs.Sammie.RIVERMANORNH.3.25.16_2016-03-25-09.16.41.644.pdf
Request;20160105-000102;54181;PACE;Inpatient;PACE;C:\Users\FGuo\Documents\work doucment\attachment\attachmentDB\20161005\originalFileFromAerial\DOCSVC_20161003.tar\DOCSVC_20161003\Sect2\INPATIENT\REQ_20160105-000102\Stewart Walter.WomensCircleHome.3.25.16_2016-03-25-09.24.32.316.pdf
Request;20160105-000102;54181;PACE;Inpatient;PACE;C:\Users\FGuo\Documents\work doucment\attachment\attachmentDB\20161005\originalFileFromAerial\DOCSVC_20161003.tar\DOCSVC_20161003\Sect2\INPATIENT\REQ_20160105-000102\walter stewart32916_2016-03-29-10.57.49.656.tif
Request;20160105-000104;85714;SELECT;Inpatient;SELECT;C:\Users\FGuo\Documents\work doucment\attachment\attachmentDB\20161005\originalFileFromAerial\DOCSVC_20161003.tar\DOCSVC_20161003\Sect2\INPATIENT\REQ_20160105-000104\ChuChunPong.WoodcrestRehab.3.25.16_2016-03-25-09.50.33.457.pdf
Request;20160105-000105;24369;PACE;Inpatient;PACE;C:\Users\FGuo\Documents\work doucment\attachment\attachmentDB\20161005\originalFileFromAerial\DOCSVC_20161003.tar\DOCSVC_20161003\Sect2\INPATIENT\REQ_20160105-000105\AdamsSammie-CENTER FOR NURSING AND REHABILITATION.3.25.16_2016-03-25-10.06.45.90.pdf
Request;20160105-000108;87676;PACE;Inpatient;PACE;C:\Users\FGuo\Documents\work doucment\attachment\attachmentDB\20161005\originalFileFromAerial\DOCSVC_20161003.tar\DOCSVC_20161003\Sect2\INPATIENT\REQ_20160105-000108\ElenaRodriguez.LIANG, JIAN Q.3.25.16_2016-03-25-10.24.19.841.pdf
Request;20160105-000109;24725;PACE;Inpatient;PACE;C:\Users\FGuo\Documents\work doucment\attachment\attachmentDB\20161005\originalFileFromAerial\DOCSVC_20161003.tar\DOCSVC_20161003\Sect2\INPATIENT\REQ_20160105-000109\Glikhman, SofiyaV - The Pavilion At Queens Rehabilitaion & Nursing - 7.6.16_2016-07-06-14.26.15.529.pdf
Request;20160105-000109;24725;PACE;Inpatient;PACE;C:\Users\FGuo\Documents\work doucment\attachment\attachmentDB\20161005\originalFileFromAerial\DOCSVC_20161003.tar\DOCSVC_20161003\Sect2\INPATIENT\REQ_20160105-000109\GlikhmanSofiyaV - KennedyPaillion - 6.6.16docx_2016-06-06-14.37.21.744.pdf
Request;20160105-000109;24725;PACE;Inpatient;PACE;C:\Users\FGuo\Documents\work doucment\attachment\attachmentDB\20161005\originalFileFromAerial\DOCSVC_20161003.tar\DOCSVC_20161003\Sect2\INPATIENT\REQ_20160105-000109\GlikhmanSofiyaV.KennedyPaillion.3.25.16_2016-03-25-10.42.57.967.pdf
Request;20160105-000111;44786;PACE;Inpatient;PACE;C:\Users\FGuo\Documents\work doucment\attachment\attachmentDB\20161005\originalFileFromAerial\DOCSVC_20161003.tar\DOCSVC_20161003\Sect2\INPATIENT\REQ_20160105-000111\JohnnieLThomas.CENTER FOR NURSING AND REHABILITATION.3.25.16_2016-03-25-11.49.57.581.pdf
Request;20160105-000112;43813;SELECT;Inpatient;SELECT;C:\Users\FGuo\Documents\work doucment\attachment\attachmentDB\20161005\originalFileFromAerial\DOCSVC_20161003.tar\DOCSVC_20161003\Sect2\INPATIENT\REQ_20160105-000112\MaryWreh- New Vanderbilt Rehab & Care Center  3.25.16_2016-03-25-11.25.17.970.pdf
Request;20160105-000112;43813;SELECT;Inpatient;SELECT;C:\Users\FGuo\Documents\work doucment\attachment\attachmentDB\20161005\originalFileFromAerial\DOCSVC_20161003.tar\DOCSVC_20161003\Sect2\INPATIENT\REQ_20160105-000112\_2016-03-25-11.24.58.631
Request;20160105-000113;37847;SELECT;Inpatient;SELECT;C:\Users\FGuo\Documents\work doucment\attachment\attachmentDB\20161005\originalFileFromAerial\DOCSVC_20161003.tar\DOCSVC_20161003\Sect2\INPATIENT\REQ_20160105-000113\VeraZlatkina.ShoreviewNH.3.25.16_2016-03-25-11.57.40.257.pdf
Request;20160105-000115;92870;PACE;Inpatient;PACE;C:\Users\FGuo\Documents\work doucment\attachment\attachmentDB\20161005\originalFileFromAerial\DOCSVC_20161003.tar\DOCSVC_20161003\Sect2\INPATIENT\REQ_20160105-000115\Hallie Thompson.REGEIS CARE CENTER.3.25.16_2016-03-25-12.25.47.995.pdf
Request;20160105-000115;92870;PACE;Inpatient;PACE;C:\Users\FGuo\Documents\work doucment\attachment\attachmentDB\20161005\originalFileFromAerial\DOCSVC_20161003.tar\DOCSVC_20161003\Sect2\INPATIENT\REQ_20160105-000115\_2016-03-25-12.25.34.284
Request;20160105-000117;56796;PACE;Inpatient;PACE;C:\Users\FGuo\Documents\work doucment\attachment\attachmentDB\20161005\originalFileFromAerial\DOCSVC_20161003.tar\DOCSVC_20161003\Sect2\INPATIENT\REQ_20160105-000117\Rafael Rodriguez-BUENA VIDA CONTINUING CARE & REHABI.3.25.16_2016-03-25-12.20.06.273.pdf
Request;20160105-000120;81605;PACE;Inpatient;PACE;C:\Users\FGuo\Documents\work doucment\attachment\attachmentDB\20161005\originalFileFromAerial\DOCSVC_20161003.tar\DOCSVC_20161003\Sect2\INPATIENT\REQ_20160105-000120\Tian.Jindi.CedarmanorInc.3.25.16_2016-03-25-12.33.45.652.pdf
Request;20160106-000007;70430;PACE;Inpatient;PACE;C:\Users\FGuo\Documents\work doucment\attachment\attachmentDB\20161005\originalFileFromAerial\DOCSVC_20161003.tar\DOCSVC_20161003\Sect2\INPATIENT\REQ_20160106-000007\CelesteValdes.CedarmanorInc.3.25.16_2016-03-25-13.29.39.84.pdf
Request;20160106-000009;52622;PACE;Inpatient;PACE;C:\Users\FGuo\Documents\work doucment\attachment\attachmentDB\20161005\originalFileFromAerial\DOCSVC_20161003.tar\DOCSVC_20161003\Sect2\INPATIENT\REQ_20160106-000009\ConsueloVillalta.CedarmanorInc.3.25.16_2016-03-25-13.37.34.265.pdf
Request;20160106-000009;52622;PACE;Inpatient;PACE;C:\Users\FGuo\Documents\work doucment\attachment\attachmentDB\20161005\originalFileFromAerial\DOCSVC_20161003.tar\DOCSVC_20161003\Sect2\INPATIENT\REQ_20160106-000009\Villalta, Consuelo 52622 LTC SNF Service Authorization Approval PRAp6_2016-03-15-15.22.42.553.docx
Request;20160106-000011;28541;PACE;Inpatient;PACE;C:\Users\FGuo\Documents\work doucment\attachment\attachmentDB\20161005\originalFileFromAerial\DOCSVC_20161003.tar\DOCSVC_20161003\Sect2\INPATIENT\REQ_20160106-000011\ViolaWaldron.CENTER FOR NURSING AND REHABILITATION.3.25.16_2016-03-25-13.44.22.381.pdf
Request;20160106-000011;28541;PACE;Inpatient;PACE;C:\Users\FGuo\Documents\work doucment\attachment\attachmentDB\20161005\originalFileFromAerial\DOCSVC_20161003.tar\DOCSVC_20161003\Sect2\INPATIENT\REQ_20160106-000011\Waldron, Viola - CENTER FOR NURSING AND REHABILITATION 9.07.16_2016-09-07-12.48.25.564.pdf
Request;20160106-000013;74911;PACE;Inpatient;PACE;C:\Users\FGuo\Documents\work doucment\attachment\attachmentDB\20161005\originalFileFromAerial\DOCSVC_20161003.tar\DOCSVC_20161003\Sect2\INPATIENT\REQ_20160106-000013\AnselWalker.RIVERMANORNH.3.23.16_2016-03-25-15.48.07.794.pdf
Request;20160106-000013;74911;PACE;Inpatient;PACE;C:\Users\FGuo\Documents\work doucment\attachment\attachmentDB\20161005\originalFileFromAerial\DOCSVC_20161003.tar\DOCSVC_20161003\Sect2\INPATIENT\REQ_20160106-000013\AnselWalker.RIVERMANORNH.3.23.16_2016-03-29-10.38.34.147.pdf
Request;20160106-000014;29161;PACE;Inpatient;PACE;C:\Users\FGuo\Documents\work doucment\attachment\attachmentDB\20161005\originalFileFromAerial\DOCSVC_20161003.tar\DOCSVC_20161003\Sect2\INPATIENT\REQ_20160106-000014\Walsh, Ivylin  - River Manor Care Center 9.07.16_2016-09-07-14.56.02.194.pdf
Request;20160106-000014;29161;PACE;Inpatient;PACE;C:\Users\FGuo\Documents\work doucment\attachment\attachmentDB\20161005\originalFileFromAerial\DOCSVC_20161003.tar\DOCSVC_20161003\Sect2\INPATIENT\REQ_20160106-000014\Walsh.Ivylin.RIVERMANORNH.3.25.16_2016-03-25-15.53.48.311.pdf
Request;20160106-000017;99421;PACE;Inpatient;PACE;C:\Users\FGuo\Documents\work doucment\attachment\attachmentDB\20161005\originalFileFromAerial\DOCSVC_20161003.tar\DOCSVC_20161003\Sect2\INPATIENT\REQ_20160106-000017\Watson.Theola.BethAbrahamHealthServices.3.25.16_2016-03-25-15.57.52.500.pdf
Request;20160106-000020;99225;PACE;Inpatient;PACE;C:\Users\FGuo\Documents\work doucment\attachment\attachmentDB\20161005\originalFileFromAerial\DOCSVC_20161003.tar\DOCSVC_20161003\Sect2\INPATIENT\REQ_20160106-000020\GlendaWhite.WAYNE CENTER FOR NURSING AND REHAB.3.25.16_2016-03-25-16.24.42.381.pdf
Request;20160106-000024;82097;PACE;Inpatient;PACE;C:\Users\FGuo\Documents\work doucment\attachment\attachmentDB\20161005\originalFileFromAerial\DOCSVC_20161003.tar\DOCSVC_20161003\Sect2\INPATIENT\REQ_20160106-000024\White, Isaac.RIVERMANORNH.3.29.16_2016-03-29-10.35.23.666.pdf
Request;20160106-000028;29674;PACE;Inpatient;PACE;C:\Users\FGuo\Documents\work doucment\attachment\attachmentDB\20161005\originalFileFromAerial\DOCSVC_20161003.tar\DOCSVC_20161003\Sect2\INPATIENT\REQ_20160106-000028\Wynn, Beulah - CENTER FOR NURSING AND REHABILITATION 9.08.16_2016-09-08-08.39.38.943.pdf
Request;20160106-000028;29674;PACE;Inpatient;PACE;C:\Users\FGuo\Documents\work doucment\attachment\attachmentDB\20161005\originalFileFromAerial\DOCSVC_20161003.tar\DOCSVC_20161003\Sect2\INPATIENT\REQ_20160106-000028\WynnBeulah .CENTERFORNURSINGANDREHABILITATION.3.29.16_2016-03-29-10.31.59.989.pdf
Request;20160106-000032;86221;PACE;Inpatient;PACE;C:\Users\FGuo\Documents\work doucment\attachment\attachmentDB\20161005\originalFileFromAerial\DOCSVC_20161003.tar\DOCSVC_20161003\Sect2\INPATIENT\REQ_20160106-000032\EvelynYan.CloveLakeHealthcareAndRehab.3.29.16_2016-03-29-10.30.54.281.pdf
Request;20160106-000050;79642;PACE;Inpatient;PACE;C:\Users\FGuo\Documents\work doucment\attachment\attachmentDB\20161005\originalFileFromAerial\DOCSVC_20161003.tar\DOCSVC_20161003\Sect2\INPATIENT\REQ_20160106-000050\SunYeunJ.UnionPlazaCareCenter.3.29.16_2016-03-29-10.24.41.849.pdf
Request;20160106-000054;81628;PACE;Inpatient;PACE;C:\Users\FGuo\Documents\work doucment\attachment\attachmentDB\20161005\originalFileFromAerial\DOCSVC_20161003.tar\DOCSVC_20161003\Sect2\INPATIENT\REQ_20160106-000054\BongJYi.UNIONPLAZANURSINGHOME.3.29.16_2016-03-29-11.28.31.559.pdf
Request;20160106-000055;81630;PACE;Inpatient;PACE;C:\Users\FGuo\Documents\work doucment\attachment\attachmentDB\20161005\originalFileFromAerial\DOCSVC_20161003.tar\DOCSVC_20161003\Sect2\INPATIENT\REQ_20160106-000055\Yi, Dol Deuk .UNIONPLAZANURSINGHOME.3.29.16_2016-03-29-11.31.17.290.pdf
Request;20160106-000057;76787;PACE;Inpatient;PACE;C:\Users\FGuo\Documents\work doucment\attachment\attachmentDB\20161005\originalFileFromAerial\DOCSVC_20161003.tar\DOCSVC_20161003\Sect2\INPATIENT\REQ_20160106-000057\You, Jian Sheng .CliffsideNursingHome.3.29.16_2016-03-29-12.51.29.680.pdf
Request;20160106-000058;32012;PACE;Inpatient;PACE;C:\Users\FGuo\Documents\work doucment\attachment\attachmentDB\20161005\originalFileFromAerial\DOCSVC_20161003.tar\DOCSVC_20161003\Sect2\INPATIENT\REQ_20160106-000058\Zheng, Bao Ying - Atlantis Rehab & Residential Health Care 9.09.16_2016-09-09-14.39.33.196.pdf
Request;20160106-000058;32012;PACE;Inpatient;PACE;C:\Users\FGuo\Documents\work doucment\attachment\attachmentDB\20161005\originalFileFromAerial\DOCSVC_20161003.tar\DOCSVC_20161003\Sect2\INPATIENT\REQ_20160106-000058\Zheng, Bao Ying - Atlantis Rehab & RHCF (Auth 20160106-000058) 3.4.16_2016-03-04-13.52.31.855.pdf
Request;20160106-000058;32012;PACE;Inpatient;PACE;C:\Users\FGuo\Documents\work doucment\attachment\attachmentDB\20161005\originalFileFromAerial\DOCSVC_20161003.tar\DOCSVC_20161003\Sect2\INPATIENT\REQ_20160106-000058\Zheng, Bao Ying_2016-07-27-11.51.22.805.tif
Request;20160106-000060;87950;SELECT;Inpatient;SELECT;C:\Users\FGuo\Documents\work doucment\attachment\attachmentDB\20161005\originalFileFromAerial\DOCSVC_20161003.tar\DOCSVC_20161003\Sect2\INPATIENT\REQ_20160106-000060\Angelo, Elizabeth . Gurwin Jewish Nursing & Rehabilitation Center .3.29.16_2016-03-29-12.48.39.982.pdf
Request;20160107-000015;27608;null;Inpatient;SELECT;C:\Users\FGuo\Documents\work doucment\attachment\attachmentDB\20161005\originalFileFromAerial\DOCSVC_20161003.tar\DOCSVC_20161003\Sect2\INPATIENT\REQ_20160107-000015\Harrison, Oswald - SCHULMAN & SCHACNE INSTITUTE FOR NURSING & REHAB - 5.5_2016-05-05-08.53.05.153.pdf
Request;20160107-000015;27608;null;Inpatient;SELECT;C:\Users\FGuo\Documents\work doucment\attachment\attachmentDB\20161005\originalFileFromAerial\DOCSVC_20161003.tar\DOCSVC_20161003\Sect2\INPATIENT\REQ_20160107-000015\Oswald Harrison - Clinicals - 5.5_2016-05-05-08.37.08.808.16
Request;20160107-000015;27608;null;Inpatient;SELECT;C:\Users\FGuo\Documents\work doucment\attachment\attachmentDB\20161005\originalFileFromAerial\DOCSVC_20161003.tar\DOCSVC_20161003\Sect2\INPATIENT\REQ_20160107-000015\Oswald Harrison - Update - 5.5_2016-05-05-08.37.31.843.16
Request;20160107-000015;27608;null;Inpatient;SELECT;C:\Users\FGuo\Documents\work doucment\attachment\attachmentDB\20161005\originalFileFromAerial\DOCSVC_20161003.tar\DOCSVC_20161003\Sect2\INPATIENT\REQ_20160107-000015\_2016-05-05-08.37.12.845
Request;20160107-000021;36071;null;Inpatient;SELECT;C:\Users\FGuo\Documents\work doucment\attachment\attachmentDB\20161005\originalFileFromAerial\DOCSVC_20161003.tar\DOCSVC_20161003\Sect2\INPATIENT\REQ_20160107-000021\Anghelone, Thomas  NORTHERN METROPOLITAN INC 3.25.16_2016-03-25-10.02.37.752.pdf
Request;20160107-000023;76398;SELECT;Inpatient;SELECT;C:\Users\FGuo\Documents\work doucment\attachment\attachmentDB\20161005\originalFileFromAerial\DOCSVC_20161003.tar\DOCSVC_20161003\Sect2\INPATIENT\REQ_20160107-000023\Arellano Juliana - Port Chester Nursing & Rehab 3-25-16_2016-03-25-12.02.38.294.pdf
Request;20160107-000025;56591;PACE;Inpatient;PACE;C:\Users\FGuo\Documents\work doucment\attachment\attachmentDB\20161005\originalFileFromAerial\DOCSVC_20161003.tar\DOCSVC_20161003\Sect2\INPATIENT\REQ_20160107-000025\Guevara, Paul  PORT CHESTER NURSING & REHAB CENTER 3.25.16_2016-03-25-10.39.24.291.pdf
Request;20160107-000026;41254;SELECT;Inpatient;SELECT;C:\Users\FGuo\Documents\work doucment\attachment\attachmentDB\20161005\originalFileFromAerial\DOCSVC_20161003.tar\DOCSVC_20161003\Sect2\INPATIENT\REQ_20160107-000026\Bailey, Ernest PARKVIEW OPERATING CO, LLC DBA WESTCHESTER CENTER 3.25.16_2016-03-25-10.16.34.961.pdf
Request;20160107-000028;55377;SELECT;Inpatient;SELECT;C:\Users\FGuo\Documents\work doucment\attachment\attachmentDB\20161005\originalFileFromAerial\DOCSVC_20161003.tar\DOCSVC_20161003\Sect2\INPATIENT\REQ_20160107-000028\BA-FAX1_1603251448563240_2016-03-25-15.01.24.89.TIF
Request;20160107-000028;55377;SELECT;Inpatient;SELECT;C:\Users\FGuo\Documents\work doucment\attachment\attachmentDB\20161005\originalFileFromAerial\DOCSVC_20161003.tar\DOCSVC_20161003\Sect2\INPATIENT\REQ_20160107-000028\Messina, Angelina PORT CHESTER NURSING & REHAB CENTER 3.25.16_2016-03-25-10.29.07.221.pdf
Request;20160107-000030;40712;null;Inpatient;SELECT;C:\Users\FGuo\Documents\work doucment\attachment\attachmentDB\20161005\originalFileFromAerial\DOCSVC_20161003.tar\DOCSVC_20161003\Sect2\INPATIENT\REQ_20160107-000030\Belizaire, Nevita  NORTHERN METROPOLITAN INC 3.25.16_2016-03-25-10.47.06.373.pdf
Request;20160107-000034;41329;SELECT;Inpatient;SELECT;C:\Users\FGuo\Documents\work doucment\attachment\attachmentDB\20161005\originalFileFromAerial\DOCSVC_20161003.tar\DOCSVC_20161003\Sect2\INPATIENT\REQ_20160107-000034\Bruno, Florence CARMEL RICHMOND HEALTH CARE AND REHABILITATION CEN 3.25.16_2016-03-25-11.04.30.122.pdf
Request;20160107-000040;20090;PACE;Inpatient;PACE;C:\Users\FGuo\Documents\work doucment\attachment\attachmentDB\20161005\originalFileFromAerial\DOCSVC_20161003.tar\DOCSVC_20161003\Sect2\INPATIENT\REQ_20160107-000040\Sims, Wendy  NORTHERN MANHATTAN REHAB & NURSING 3.25.16_2016-03-25-11.36.44.544.pdf
Request;20160107-000042;84856;SELECT;Inpatient;SELECT;C:\Users\FGuo\Documents\work doucment\attachment\attachmentDB\20161005\originalFileFromAerial\DOCSVC_20161003.tar\DOCSVC_20161003\Sect2\INPATIENT\REQ_20160107-000042\Borodyanskaya, Sofya MENORAH HOME & HOSP FOR THE AGED AND INFIRMARY 3.25.16_2016-03-25-12.00.11.535.pdf
Request;20160107-000049;23070;PACE;Inpatient;PACE;C:\Users\FGuo\Documents\work doucment\attachment\attachmentDB\20161005\originalFileFromAerial\DOCSVC_20161003.tar\DOCSVC_20161003\Sect2\INPATIENT\REQ_20160107-000049\Toon Della - Center for Nursing & Rehab 3-25-16_2016-03-25-10.47.28.639.pdf
Request;20160107-000052;42757;PACE;Inpatient;PACE;C:\Users\FGuo\Documents\work doucment\attachment\attachmentDB\20161005\originalFileFromAerial\DOCSVC_20161003.tar\DOCSVC_20161003\Sect2\INPATIENT\REQ_20160107-000052\Montague Gladys - Regeis Care Center 3-25-16_2016-03-25-10.35.47.664.pdf
Request;20160107-000052;42757;PACE;Inpatient;PACE;C:\Users\FGuo\Documents\work doucment\attachment\attachmentDB\20161005\originalFileFromAerial\DOCSVC_20161003.tar\DOCSVC_20161003\Sect2\INPATIENT\REQ_20160107-000052\Montague Gladys - Regeis Care Center 3-25-16_2016-03-31-16.43.21.304.pdf
Request;20160107-000052;42757;PACE;Inpatient;PACE;C:\Users\FGuo\Documents\work doucment\attachment\attachmentDB\20161005\originalFileFromAerial\DOCSVC_20161003.tar\DOCSVC_20161003\Sect2\INPATIENT\REQ_20160107-000052\Montague, Gladys_2016-07-11-16.40.28.987.tif
Request;20160107-000056;87324;PACE;Inpatient;PACE;C:\Users\FGuo\Documents\work doucment\attachment\attachmentDB\20161005\originalFileFromAerial\DOCSVC_20161003.tar\DOCSVC_20161003\Sect2\INPATIENT\REQ_20160107-000056\Lee, Pao Wei  CLIFFSIDE REHABILITATION AND 3.25.16_2016-03-25-12.10.39.799.pdf
Request;20160107-000058;85819;SELECT;Inpatient;SELECT;C:\Users\FGuo\Documents\work doucment\attachment\attachmentDB\20161005\originalFileFromAerial\DOCSVC_20161003.tar\DOCSVC_20161003\Sect2\INPATIENT\REQ_20160107-000058\Yau Manduen - Union Plaza NH 3-25-16_2016-03-25-10.42.58.22.pdf
Request;20160107-000063;94987;PACE;Inpatient;PACE;C:\Users\FGuo\Documents\work doucment\attachment\attachmentDB\20161005\originalFileFromAerial\DOCSVC_20161003.tar\DOCSVC_20161003\Sect2\INPATIENT\REQ_20160107-000063\Charon, Filomena  - Schnurmacher Nursing Home - 4.29_2016-04-29-12.18.21.373.pdf
Request;20160107-000071;30061;SELECT;Inpatient;SELECT;C:\Users\FGuo\Documents\work doucment\attachment\attachmentDB\20161005\originalFileFromAerial\DOCSVC_20161003.tar\DOCSVC_20161003\Sect2\INPATIENT\REQ_20160107-000071\Bermudez, Maxima  Workmens Circle Home Geriatric Center 3.25.16_2016-03-25-14.31.19.644.pdf
Request;20160107-000080;81156;SELECT;Inpatient;SELECT;C:\Users\FGuo\Documents\work doucment\attachment\attachmentDB\20161005\originalFileFromAerial\DOCSVC_20161003.tar\DOCSVC_20161003\Sect2\INPATIENT\REQ_20160107-000080\Cabrera, Margarita  - Beth Abraham Health Services 3-25-16_2016-03-25-13.44.53.3.pdf
Request;20160107-000081;78033;null;Inpatient;SELECT;C:\Users\FGuo\Documents\work doucment\attachment\attachmentDB\20161005\originalFileFromAerial\DOCSVC_20161003.tar\DOCSVC_20161003\Sect2\INPATIENT\REQ_20160107-000081\Campos, Natividad  - Silvercrest Extended Care Facility 3-25-16_2016-03-25-13.51.57.794.pdf
Request;20160107-000100;46353;SELECT;Inpatient;SELECT;C:\Users\FGuo\Documents\work doucment\attachment\attachmentDB\20161005\originalFileFromAerial\DOCSVC_20161003.tar\DOCSVC_20161003\Sect2\INPATIENT\REQ_20160107-000100\Carbajal, Nancy - Hudson View Care Center 3-25-16_2016-03-25-14.11.41.688.pdf
Request;20160107-000101;48083;SELECT;Inpatient;SELECT;C:\Users\FGuo\Documents\work doucment\attachment\attachmentDB\20161005\originalFileFromAerial\DOCSVC_20161003.tar\DOCSVC_20161003\Sect2\INPATIENT\REQ_20160107-000101\Carlucci Guiseppe - Hudson View Care Center 3-25-16_2016-03-25-11.55.37.483.pdf
Request;20160107-000105;45350;SELECT;Inpatient;SELECT;C:\Users\FGuo\Documents\work doucment\attachment\attachmentDB\20161005\originalFileFromAerial\DOCSVC_20161003.tar\DOCSVC_20161003\Sect2\INPATIENT\REQ_20160107-000105\Carraway, Robert  SEA CREST HEALTH CARE CENTER, LLC 3.28.16_2016-03-28-11.18.14.391.pdf
Request;20160107-000109;83196;SELECT;Inpatient;SELECT;C:\Users\FGuo\Documents\work doucment\attachment\attachmentDB\20161005\originalFileFromAerial\DOCSVC_20161003.tar\DOCSVC_20161003\Sect2\INPATIENT\REQ_20160107-000109\Chang Yudong- Union Plaza Nursing Home- 4-21-16_2016-04-21-11.12.24.161.pdf
Request;20160107-000115;82458;PACE;Inpatient;PACE;C:\Users\FGuo\Documents\work doucment\attachment\attachmentDB\20161005\originalFileFromAerial\DOCSVC_20161003.tar\DOCSVC_20161003\Sect2\INPATIENT\REQ_20160107-000115\Chu, Hsceh Chen - Atlantis Rehab  3-25-16_2016-03-25-14.06.33.41.pdf
Request;20160107-000117;84258;SELECT;Inpatient;SELECT;C:\Users\FGuo\Documents\work doucment\attachment\attachmentDB\20161005\originalFileFromAerial\DOCSVC_20161003.tar\DOCSVC_20161003\Sect2\INPATIENT\REQ_20160107-000117\Chen, Chang Nan - Atlantis Rehab & RHCF (Auth 20160107-000117) 2.29.16_2016-02-29-10.43.36.321.pdf
Request;20160107-000119;59903;null;Inpatient;SELECT;C:\Users\FGuo\Documents\work doucment\attachment\attachmentDB\20161005\originalFileFromAerial\DOCSVC_20161003.tar\DOCSVC_20161003\Sect2\INPATIENT\REQ_20160107-000119\Moore, Marva.AVALON GARDENS REHAB & HEALTHCARE.5.2_2016-05-02-10.50.46.963.pdf
Request;20160107-000124;83831;SELECT;Inpatient;SELECT;C:\Users\FGuo\Documents\work doucment\attachment\attachmentDB\20161005\originalFileFromAerial\DOCSVC_20161003.tar\DOCSVC_20161003\Sect2\INPATIENT\REQ_20160107-000124\Chen Lan - Union Plaza NH 3-25-16_2016-03-25-14.37.59.644.pdf
Request;20160107-000128;23709;SELECT;Inpatient;SELECT;C:\Users\FGuo\Documents\work doucment\attachment\attachmentDB\20161005\originalFileFromAerial\DOCSVC_20161003.tar\DOCSVC_20161003\Sect2\INPATIENT\REQ_20160107-000128\Cheung, Chiukan - Union Plaza NH 3-25-16_2016-03-25-14.16.44.373.pdf
Request;20160107-000131;29356;SELECT;Inpatient;SELECT;C:\Users\FGuo\Documents\work doucment\attachment\attachmentDB\20161005\originalFileFromAerial\DOCSVC_20161003.tar\DOCSVC_20161003\Sect2\INPATIENT\REQ_20160107-000131\Choy, Ying Wo - Union Plaza NH 3-25-16_2016-03-25-15.23.20.40.pdf
Request;20160107-000131;29356;SELECT;Inpatient;SELECT;C:\Users\FGuo\Documents\work doucment\attachment\attachmentDB\20161005\originalFileFromAerial\DOCSVC_20161003.tar\DOCSVC_20161003\Sect2\INPATIENT\REQ_20160107-000131\Choy, Ying Wo - UNION PLAZA NURSING HOME 9.07.16_2016-09-07-15.16.30.819.pdf
Request;20160107-000133;81810;SELECT;Inpatient;SELECT;C:\Users\FGuo\Documents\work doucment\attachment\attachmentDB\20161005\originalFileFromAerial\DOCSVC_20161003.tar\DOCSVC_20161003\Sect2\INPATIENT\REQ_20160107-000133\Cintron, Miriam   - Beth Abraham Health Services 3-25-16_2016-03-25-15.29.41.290.pdf
Request;20160107-000139;22414;SELECT;Inpatient;SELECT;C:\Users\FGuo\Documents\work doucment\attachment\attachmentDB\20161005\originalFileFromAerial\DOCSVC_20161003.tar\DOCSVC_20161003\Sect2\INPATIENT\REQ_20160107-000139\Conte, Teresa  CLOVE LAKE HEALTH CARE REHAB CENTER 3.25.16_2016-03-25-16.01.57.497.pdf
Request;20160107-000142;53380;SELECT;Inpatient;SELECT;C:\Users\FGuo\Documents\work doucment\attachment\attachmentDB\20161005\originalFileFromAerial\DOCSVC_20161003.tar\DOCSVC_20161003\Sect2\INPATIENT\REQ_20160107-000142\Decker, Warren - New Vanderbilt Rehab 3-25-16_2016-03-25-15.39.50.547.pdf
Request;20160107-000145;24809;PACE;Inpatient;PACE;C:\Users\FGuo\Documents\work doucment\attachment\attachmentDB\20161005\originalFileFromAerial\DOCSVC_20161003.tar\DOCSVC_20161003\Sect2\INPATIENT\REQ_20160107-000145\erene medovard3716_2016-03-07-13.21.53.567.tif
Request;20160107-000145;24809;PACE;Inpatient;PACE;C:\Users\FGuo\Documents\work doucment\attachment\attachmentDB\20161005\originalFileFromAerial\DOCSVC_20161003.tar\DOCSVC_20161003\Sect2\INPATIENT\REQ_20160107-000145\Medovard, Erene - Four Seasons Nursing Home -  5.2_2016-05-02-11.34.23.407.pdf
Request;20160108-000004;43381;PACE;Inpatient;PACE;C:\Users\FGuo\Documents\work doucment\attachment\attachmentDB\20161005\originalFileFromAerial\DOCSVC_20161003.tar\DOCSVC_20161003\Sect2\INPATIENT\REQ_20160108-000004\Toner, Camille A   ST. BARNABAS NURSING & REHABILITATI 3.25.16_2016-03-25-16.12.42.116.pdf
Request;20160108-000005;75322;SELECT;Inpatient;SELECT;C:\Users\FGuo\Documents\work doucment\attachment\attachmentDB\20161005\originalFileFromAerial\DOCSVC_20161003.tar\DOCSVC_20161003\Sect2\INPATIENT\REQ_20160108-000005\Davis, Marie  RIVER MANOR CORP DBA RIVER MANOR CA 3.25.16_2016-03-25-16.25.40.707.pdf
Request;20160108-000005;75322;SELECT;Inpatient;SELECT;C:\Users\FGuo\Documents\work doucment\attachment\attachmentDB\20161005\originalFileFromAerial\DOCSVC_20161003.tar\DOCSVC_20161003\Sect2\INPATIENT\REQ_20160108-000005\_2016-03-25-16.25.45.806
Request;20160108-000006;40871;SELECT;Inpatient;SELECT;C:\Users\FGuo\Documents\work doucment\attachment\attachmentDB\20161005\originalFileFromAerial\DOCSVC_20161003.tar\DOCSVC_20161003\Sect2\INPATIENT\REQ_20160108-000006\Monaca, Orazia  CLOVE LAKE HEALTH CARE REHAB CENTER 3.25.16_2016-03-25-16.35.29.510.pdf
Request;20160108-000007;25527;PACE;Inpatient;PACE;C:\Users\FGuo\Documents\work doucment\attachment\attachmentDB\20161005\originalFileFromAerial\DOCSVC_20161003.tar\DOCSVC_20161003\Sect2\INPATIENT\REQ_20160108-000007\Covington, Laverne  PENINSULA GENERAL NURSING HOME 3.28.16_2016-03-28-09.14.37.249.pdf
Request;20160108-000011;32320;SELECT;Inpatient;SELECT;C:\Users\FGuo\Documents\work doucment\attachment\attachmentDB\20161005\originalFileFromAerial\DOCSVC_20161003.tar\DOCSVC_20161003\Sect2\INPATIENT\REQ_20160108-000011\Lam, Pong S  NEW FRANKLIN REHABLITATION & HEALTH CARE FACILITY 3.28.16_2016-03-28-09.22.21.336.pdf
Request;20160108-000011;32320;SELECT;Inpatient;SELECT;C:\Users\FGuo\Documents\work doucment\attachment\attachmentDB\20161005\originalFileFromAerial\DOCSVC_20161003.tar\DOCSVC_20161003\Sect2\INPATIENT\REQ_20160108-000011\Lam, Pong S - NEW FRANKLIN REHABLITATION & HEALTH CARE FACILITY 9.12.16_2016-09-12-10.10.59.808.pdf
Request;20160108-000028;76933;SELECT;Inpatient;SELECT;C:\Users\FGuo\Documents\work doucment\attachment\attachmentDB\20161005\originalFileFromAerial\DOCSVC_20161003.tar\DOCSVC_20161003\Sect2\INPATIENT\REQ_20160108-000028\Donaldson, Emily  BETH ABRAHAM HEALTH SERVICES 3.28.16._2016-03-28-09.31.42.483.pdf
Request;20160108-000030;31334;SELECT;Inpatient;SELECT;C:\Users\FGuo\Documents\work doucment\attachment\attachmentDB\20161005\originalFileFromAerial\DOCSVC_20161003.tar\DOCSVC_20161003\Sect2\INPATIENT\REQ_20160108-000030\Dorceus, Gerard  PENINSULA GENERAL NURSING HOME3.28.16._2016-03-28-09.39.00.704.pdf
Request;20160108-000030;31334;SELECT;Inpatient;SELECT;C:\Users\FGuo\Documents\work doucment\attachment\attachmentDB\20161005\originalFileFromAerial\DOCSVC_20161003.tar\DOCSVC_20161003\Sect2\INPATIENT\REQ_20160108-000030\Dorceus, Gerard - PENINSULA GENERAL NURSING HOME 9.09.16_2016-09-09-10.11.16.801.pdf
Request;20160108-000033;48540;SELECT;Inpatient;SELECT;C:\Users\FGuo\Documents\work doucment\attachment\attachmentDB\20161005\originalFileFromAerial\DOCSVC_20161003.tar\DOCSVC_20161003\Sect2\INPATIENT\REQ_20160108-000033\Doyle, Jane E  CEDAR MANOR INC 3.28.16._2016-03-28-09.51.52.606.pdf
Request;20160108-000033;48540;SELECT;Inpatient;SELECT;C:\Users\FGuo\Documents\work doucment\attachment\attachmentDB\20161005\originalFileFromAerial\DOCSVC_20161003.tar\DOCSVC_20161003\Sect2\INPATIENT\REQ_20160108-000033\JANE DOYLE 08.22.16_2016-09-08-10.12.32.462.tif
Request;20160108-000034;48289;SELECT;Inpatient;SELECT;C:\Users\FGuo\Documents\work doucment\attachment\attachmentDB\20161005\originalFileFromAerial\DOCSVC_20161003.tar\DOCSVC_20161003\Sect2\INPATIENT\REQ_20160108-000034\Eppich, Frank R NORTHERN METROPOLITAN INC 3.28.16._2016-03-28-10.02.18.32.pdf
Request;20160108-000048;73870;SELECT;Inpatient;SELECT;C:\Users\FGuo\Documents\work doucment\attachment\attachmentDB\20161005\originalFileFromAerial\DOCSVC_20161003.tar\DOCSVC_20161003\Sect2\INPATIENT\REQ_20160108-000048\Felix, Dulce ISABELLA GERIATRIC NURSING HOME 3.28.16_2016-03-28-12.47.53.72.pdf
Request;20160108-000048;73870;SELECT;Inpatient;SELECT;C:\Users\FGuo\Documents\work doucment\attachment\attachmentDB\20161005\originalFileFromAerial\DOCSVC_20161003.tar\DOCSVC_20161003\Sect2\INPATIENT\REQ_20160108-000048\Felix, Dulce_2016-06-10-09.55.52.835.tif
Request;20160108-000049;42868;SELECT;Inpatient;SELECT;C:\Users\FGuo\Documents\work doucment\attachment\attachmentDB\20161005\originalFileFromAerial\DOCSVC_20161003.tar\DOCSVC_20161003\Sect2\INPATIENT\REQ_20160108-000049\Ferguson, Rawle  SHOREVIEW NURSING HOME 3.28.16_2016-03-28-12.55.17.52.pdf
Request;20160108-000049;42868;SELECT;Inpatient;SELECT;C:\Users\FGuo\Documents\work doucment\attachment\attachmentDB\20161005\originalFileFromAerial\DOCSVC_20161003.tar\DOCSVC_20161003\Sect2\INPATIENT\REQ_20160108-000049\Ferguson, Rawle  SHOREVIEW NURSING HOME 3.28.16_2016-03-28-12.58.36.74.pdf
Request;20160108-000049;42868;SELECT;Inpatient;SELECT;C:\Users\FGuo\Documents\work doucment\attachment\attachmentDB\20161005\originalFileFromAerial\DOCSVC_20161003.tar\DOCSVC_20161003\Sect2\INPATIENT\REQ_20160108-000049\Ferguson, Rawle - Shoreview Nursing Home - 6.7.16_2016-06-07-15.11.06.302.pdf
Request;20160108-000049;42868;SELECT;Inpatient;SELECT;C:\Users\FGuo\Documents\work doucment\attachment\attachmentDB\20161005\originalFileFromAerial\DOCSVC_20161003.tar\DOCSVC_20161003\Sect2\INPATIENT\REQ_20160108-000049\_2016-03-28-12.58.39.170
Request;20160108-000051;45465;SELECT;Inpatient;SELECT;C:\Users\FGuo\Documents\work doucment\attachment\attachmentDB\20161005\originalFileFromAerial\DOCSVC_20161003.tar\DOCSVC_20161003\Sect2\INPATIENT\REQ_20160108-000051\Fuentes, Pablo   BUENA VIDA CONTINUING CARE & REHABI 3.28.16_2016-03-28-14.22.53.571.pdf
Request;20160108-000053;20116;null;Inpatient;SELECT;C:\Users\FGuo\Documents\work doucment\attachment\attachmentDB\20161005\originalFileFromAerial\DOCSVC_20161003.tar\DOCSVC_20161003\Sect2\INPATIENT\REQ_20160108-000053\Gonzalez Lourdes - Isabella Geriatric Nursing Home 3-28-16_2016-03-28-13.31.19.800.pdf
Request;20160108-000054;84009;null;Inpatient;SELECT;C:\Users\FGuo\Documents\work doucment\attachment\attachmentDB\20161005\originalFileFromAerial\DOCSVC_20161003.tar\DOCSVC_20161003\Sect2\INPATIENT\REQ_20160108-000054\Gordan Beverly- River Manor Corp 3-28-16_2016-03-28-13.34.25.39.pdf
Request;20160108-000056;50399;SELECT;Inpatient;SELECT;C:\Users\FGuo\Documents\work doucment\attachment\attachmentDB\20161005\originalFileFromAerial\DOCSVC_20161003.tar\DOCSVC_20161003\Sect2\INPATIENT\REQ_20160108-000056\Gordon Williams - Oak Hollow  Nursing Cente 3-28-16_2016-03-28-13.42.24.117.pdf
Request;20160108-000056;50399;SELECT;Inpatient;SELECT;C:\Users\FGuo\Documents\work doucment\attachment\attachmentDB\20161005\originalFileFromAerial\DOCSVC_20161003.tar\DOCSVC_20161003\Sect2\INPATIENT\REQ_20160108-000056\Gordon, William F - Oak Hollow Nursing Center (Auth 20160108-000056) 2.16.16_2016-02-16-13.43.59.607.pdf
Request;20160108-000057;38351;SELECT;Inpatient;SELECT;C:\Users\FGuo\Documents\work doucment\attachment\attachmentDB\20161005\originalFileFromAerial\DOCSVC_20161003.tar\DOCSVC_20161003\Sect2\INPATIENT\REQ_20160108-000057\Green Joseph - Peninsula General NH  3-28-16_2016-03-28-14.00.50.136.pdf
Request;20160108-000057;38351;SELECT;Inpatient;SELECT;C:\Users\FGuo\Documents\work doucment\attachment\attachmentDB\20161005\originalFileFromAerial\DOCSVC_20161003.tar\DOCSVC_20161003\Sect2\INPATIENT\REQ_20160108-000057\Green, Joseph J - Peninsula General Nursing Home- 8.18.16_2016-08-18-16.29.46.867.pdf
Request;20160108-000057;38351;SELECT;Inpatient;SELECT;C:\Users\FGuo\Documents\work doucment\attachment\attachmentDB\20161005\originalFileFromAerial\DOCSVC_20161003.tar\DOCSVC_20161003\Sect2\INPATIENT\REQ_20160108-000057\JOSEPH GREEN_2016-08-22-11.42.38.841.tif
Request;20160108-000058;22307;SELECT;Inpatient;SELECT;C:\Users\FGuo\Documents\work doucment\attachment\attachmentDB\20161005\originalFileFromAerial\DOCSVC_20161003.tar\DOCSVC_20161003\Sect2\INPATIENT\REQ_20160108-000058\Hammad, Henrietta - Cobblehill Health Center  3-28-16_2016-03-28-14.07.35.510.pdf
Request;20160108-000059;48957;PACE;Inpatient;PACE;C:\Users\FGuo\Documents\work doucment\attachment\attachmentDB\20161005\originalFileFromAerial\DOCSVC_20161003.tar\DOCSVC_20161003\Sect2\INPATIENT\REQ_20160108-000059\Blocker, Benzena -Workmen's Circle (Auth 20160108-000059) 3.2.16_2016-03-02-15.19.06.625.pdf
Request;20160108-000068;83934;PACE;Inpatient;PACE;C:\Users\FGuo\Documents\work doucment\attachment\attachmentDB\20161005\originalFileFromAerial\DOCSVC_20161003.tar\DOCSVC_20161003\Sect2\INPATIENT\REQ_20160108-000068\Gonzalez, William .ALLIANCE HEALTH ASSOCIATES, INC.3.30.16_2016-03-30-13.47.29.562.pdf
Request;20160111-000016;38347;SELECT;Inpatient;SELECT;C:\Users\FGuo\Documents\work doucment\attachment\attachmentDB\20161005\originalFileFromAerial\DOCSVC_20161003.tar\DOCSVC_20161003\Sect2\INPATIENT\REQ_20160111-000016\Hariu, Robert E  MAYFAIR CARE CENTER, INC. 3.28.16_2016-03-28-16.29.23.378.pdf
Request;20160111-000016;38347;SELECT;Inpatient;SELECT;C:\Users\FGuo\Documents\work doucment\attachment\attachmentDB\20161005\originalFileFromAerial\DOCSVC_20161003.tar\DOCSVC_20161003\Sect2\INPATIENT\REQ_20160111-000016\Hariu, Robert_2016-08-15-17.17.02.991.tif
Request;20160111-000016;38347;SELECT;Inpatient;SELECT;C:\Users\FGuo\Documents\work doucment\attachment\attachmentDB\20161005\originalFileFromAerial\DOCSVC_20161003.tar\DOCSVC_20161003\Sect2\INPATIENT\REQ_20160111-000016\ROBERT HARIU 09.01.16_2016-09-06-09.57.06.402.tif
Request;20160111-000021;41308;SELECT;Inpatient;SELECT;C:\Users\FGuo\Documents\work doucment\attachment\attachmentDB\20161005\originalFileFromAerial\DOCSVC_20161003.tar\DOCSVC_20161003\Sect2\INPATIENT\REQ_20160111-000021\Haywood, Yolanda - Hudson View Care Center 3-28-16_2016-03-28-16.27.09.352.pdf
Request;20160111-000024;79076;SELECT;Inpatient;SELECT;C:\Users\FGuo\Documents\work doucment\attachment\attachmentDB\20161005\originalFileFromAerial\DOCSVC_20161003.tar\DOCSVC_20161003\Sect2\INPATIENT\REQ_20160111-000024\Huang, Yuan X - Atlantis Rehab & RHCF (Auth 20160111-000024) 3.1.16_2016-03-01-10.46.08.218.pdf
Request;20160111-000028;34618;SELECT;Inpatient;SELECT;C:\Users\FGuo\Documents\work doucment\attachment\attachmentDB\20161005\originalFileFromAerial\DOCSVC_20161003.tar\DOCSVC_20161003\Sect2\INPATIENT\REQ_20160111-000028\Jeselnik, Margaret - Dumont Operating 3-28-16_2016-03-28-16.41.53.19.pdf
Request;20160111-000028;34618;SELECT;Inpatient;SELECT;C:\Users\FGuo\Documents\work doucment\attachment\attachmentDB\20161005\originalFileFromAerial\DOCSVC_20161003.tar\DOCSVC_20161003\Sect2\INPATIENT\REQ_20160111-000028\Jeselnik, Margaret - DUMONT OPERATING LLC DBA 9.13.16_2016-09-13-12.50.06.472.pdf
Request;20160111-000030;33723;SELECT;Inpatient;SELECT;C:\Users\FGuo\Documents\work doucment\attachment\attachmentDB\20161005\originalFileFromAerial\DOCSVC_20161003.tar\DOCSVC_20161003\Sect2\INPATIENT\REQ_20160111-000030\Hyatt, Alice  HUDSON VIEW CARE CENTER DBA REGENCY EXTENDED CARE 3.29.16_2016-03-29-09.27.03.452.pdf
Request;20160111-000030;33723;SELECT;Inpatient;SELECT;C:\Users\FGuo\Documents\work doucment\attachment\attachmentDB\20161005\originalFileFromAerial\DOCSVC_20161003.tar\DOCSVC_20161003\Sect2\INPATIENT\REQ_20160111-000030\Hyatt, Alice - HUDSON VIEW CARE CENTER DBA REGENCY EXTENDED CARE 9.12.16_2016-09-12-14.34.11.138.pdf
Request;20160111-000031;46927;SELECT;Inpatient;SELECT;C:\Users\FGuo\Documents\work doucment\attachment\attachmentDB\20161005\originalFileFromAerial\DOCSVC_20161003.tar\DOCSVC_20161003\Sect2\INPATIENT\REQ_20160111-000031\John, Lynette  RIVER MANOR CORP DBA RIVER MANOR CA 3.29.16_2016-03-29-09.35.20.401.pdf
Request;20160111-000040;29466;SELECT;Inpatient;SELECT;C:\Users\FGuo\Documents\work doucment\attachment\attachmentDB\20161005\originalFileFromAerial\DOCSVC_20161003.tar\DOCSVC_20161003\Sect2\INPATIENT\REQ_20160111-000040\Karantzalis, Vasilios - SEPHARDIC NURSING HOME 9.07.16_2016-09-07-16.41.50.33.pdf
Request;20160111-000041;36320;SELECT;Inpatient;SELECT;C:\Users\FGuo\Documents\work doucment\attachment\attachmentDB\20161005\originalFileFromAerial\DOCSVC_20161003.tar\DOCSVC_20161003\Sect2\INPATIENT\REQ_20160111-000041\Kesepara, Cecelia  - Buena Vida continuing Care & Rehab 3-29-16_2016-03-29-09.54.58.752.pdf
Request;20160111-000041;36320;SELECT;Inpatient;SELECT;C:\Users\FGuo\Documents\work doucment\attachment\attachmentDB\20161005\originalFileFromAerial\DOCSVC_20161003.tar\DOCSVC_20161003\Sect2\INPATIENT\REQ_20160111-000041\Kesepara, Cecelia - BUENA VIDA CONTINUING CARE & REHAB. 9.14.16_2016-09-14-10.50.23.737.pdf
Request;20160111-000046;85385;SELECT;Inpatient;SELECT;C:\Users\FGuo\Documents\work doucment\attachment\attachmentDB\20161005\originalFileFromAerial\DOCSVC_20161003.tar\DOCSVC_20161003\Sect2\INPATIENT\REQ_20160111-000046\Kim, Yooei UNION PLAZA NURSING HOME 3.29.16_2016-03-29-10.08.43.920.pdf
Request;20160111-000054;35744;SELECT;Inpatient;SELECT;C:\Users\FGuo\Documents\work doucment\attachment\attachmentDB\20161005\originalFileFromAerial\DOCSVC_20161003.tar\DOCSVC_20161003\Sect2\INPATIENT\REQ_20160111-000054\Labell, Ruth  CEDAR MANOR INC 3.29.16_2016-03-29-10.19.45.17.pdf
Request;20160111-000066;21990;SELECT;Inpatient;SELECT;C:\Users\FGuo\Documents\work doucment\attachment\attachmentDB\20161005\originalFileFromAerial\DOCSVC_20161003.tar\DOCSVC_20161003\Sect2\INPATIENT\REQ_20160111-000066\Laura, Martina SEA CREST HEALTH CARE CENTER, LLC 3.29.16_2016-03-29-10.57.04.94.pdf
Request;20160111-000067;48058;SELECT;Inpatient;SELECT;C:\Users\FGuo\Documents\work doucment\attachment\attachmentDB\20161005\originalFileFromAerial\DOCSVC_20161003.tar\DOCSVC_20161003\Sect2\INPATIENT\REQ_20160111-000067\Lindenbaum, James .MAYFAIR CARE CENTER, INC..3.30.16_2016-03-30-14.35.56.347.pdf
Request;20160111-000068;82396;SELECT;Inpatient;SELECT;C:\Users\FGuo\Documents\work doucment\attachment\attachmentDB\20161005\originalFileFromAerial\DOCSVC_20161003.tar\DOCSVC_20161003\Sect2\INPATIENT\REQ_20160111-000068\Lounds, Pearline  ISABELLA GERIATRIC NURSING HOME 3.29.16_2016-03-29-11.18.56.175.pdf
Request;20160111-000068;82396;SELECT;Inpatient;SELECT;C:\Users\FGuo\Documents\work doucment\attachment\attachmentDB\20161005\originalFileFromAerial\DOCSVC_20161003.tar\DOCSVC_20161003\Sect2\INPATIENT\REQ_20160111-000068\_2016-03-29-11.18.58.173
Request;20160111-000069;35598;SELECT;Inpatient;SELECT;C:\Users\FGuo\Documents\work doucment\attachment\attachmentDB\20161005\originalFileFromAerial\DOCSVC_20161003.tar\DOCSVC_20161003\Sect2\INPATIENT\REQ_20160111-000069\Lucyazyn, William - PINE VALLEY CENTER, LLC 9.13.16_2016-09-13-15.47.50.662.pdf
Request;20160111-000069;35598;SELECT;Inpatient;SELECT;C:\Users\FGuo\Documents\work doucment\attachment\attachmentDB\20161005\originalFileFromAerial\DOCSVC_20161003.tar\DOCSVC_20161003\Sect2\INPATIENT\REQ_20160111-000069\Lucyazyn, William PINE VALLEY CENTER, LLC 3.29.16_2016-03-29-11.25.09.983.pdf
Request;20160111-000071;38724;SELECT;Inpatient;SELECT;C:\Users\FGuo\Documents\work doucment\attachment\attachmentDB\20161005\originalFileFromAerial\DOCSVC_20161003.tar\DOCSVC_20161003\Sect2\INPATIENT\REQ_20160111-000071\Maddi, Bernard - Cliffside Rehab & Residence 3-29-16_2016-03-29-10.46.35.846.pdf
Request;20160111-000073;37951;SELECT;Inpatient;SELECT;C:\Users\FGuo\Documents\work doucment\attachment\attachmentDB\20161005\originalFileFromAerial\DOCSVC_20161003.tar\DOCSVC_20161003\Sect2\INPATIENT\REQ_20160111-000073\Manso, Pedro - East Haven Nursing & Rehab 6-30-16_2016-06-30-15.19.09.972.pdf
Request;20160111-000076;20531;SELECT;Inpatient;SELECT;C:\Users\FGuo\Documents\work doucment\attachment\attachmentDB\20161005\originalFileFromAerial\DOCSVC_20161003.tar\DOCSVC_20161003\Sect2\INPATIENT\REQ_20160111-000076\Mason, Albert  -Atlantis Rehab & RHCF (Auth 20160111-000076) 3.2.16_2016-03-02-11.05.26.176.pdf
Request;20160111-000078;26947;SELECT;Inpatient;SELECT;C:\Users\FGuo\Documents\work doucment\attachment\attachmentDB\20161005\originalFileFromAerial\DOCSVC_20161003.tar\DOCSVC_20161003\Sect2\INPATIENT\REQ_20160111-000078\Mativier, Pierre - Center for Nursing & Rehab 3-29-16_2016-03-29-11.09.05.583.pdf
Request;20160111-000078;26947;SELECT;Inpatient;SELECT;C:\Users\FGuo\Documents\work doucment\attachment\attachmentDB\20161005\originalFileFromAerial\DOCSVC_20161003.tar\DOCSVC_20161003\Sect2\INPATIENT\REQ_20160111-000078\Mativier, Pierre - CENTER FOR NURSING AND REHABILITATION 9.07.16_2016-09-07-10.47.28.889.pdf
Request;20160111-000081;89281;SELECT;Inpatient;SELECT;C:\Users\FGuo\Documents\work doucment\attachment\attachmentDB\20161005\originalFileFromAerial\DOCSVC_20161003.tar\DOCSVC_20161003\Sect2\INPATIENT\REQ_20160111-000081\Maynfeld, Mara - Sea Crest Health Care Center 3-29-16_2016-03-29-11.23.32.414.pdf
Request;20160111-000081;89281;SELECT;Inpatient;SELECT;C:\Users\FGuo\Documents\work doucment\attachment\attachmentDB\20161005\originalFileFromAerial\DOCSVC_20161003.tar\DOCSVC_20161003\Sect2\INPATIENT\REQ_20160111-000081\Maynfeld, Mara - Sea Crest Health Care Center 3-29-16_2016-03-29-11.25.52.476.pdf
Request;20160111-000082;32842;PACE;Inpatient;PACE;C:\Users\FGuo\Documents\work doucment\attachment\attachmentDB\20161005\originalFileFromAerial\DOCSVC_20161003.tar\DOCSVC_20161003\Sect2\INPATIENT\REQ_20160111-000082\Poe, Lucas -.Beth Abraham Health Services - 5.3_2016-05-03-16.23.04.120.pdf
Request;20160111-000083;47452;null;Inpatient;SELECT;C:\Users\FGuo\Documents\work doucment\attachment\attachmentDB\20161005\originalFileFromAerial\DOCSVC_20161003.tar\DOCSVC_20161003\Sect2\INPATIENT\REQ_20160111-000083\Mirza, Azam  NEW FRANKLIN REHABLITATION & HEALTH CARE FACILITY 3.29.16_2016-03-29-13.45.15.775.pdf
Request;20160111-000086;38257;SELECT;Inpatient;SELECT;C:\Users\FGuo\Documents\work doucment\attachment\attachmentDB\20161005\originalFileFromAerial\DOCSVC_20161003.tar\DOCSVC_20161003\Sect2\INPATIENT\REQ_20160111-000086\Montanez, Guillermo  .CliffsideNursingHome.3.29.16_2016-03-29-12.44.33.154.pdf
Request;20160111-000087;21178;FIDA;Inpatient;FIDA;C:\Users\FGuo\Documents\work doucment\attachment\attachmentDB\20161005\originalFileFromAerial\DOCSVC_20161003.tar\DOCSVC_20161003\Sect2\INPATIENT\REQ_20160111-000087\AnnaClaudio.WomensCircleHome.3.29.16_2016-03-29-12.47.32.647.pdf
Request;20160111-000090;80458;SELECT;Inpatient;SELECT;C:\Users\FGuo\Documents\work doucment\attachment\attachmentDB\20161005\originalFileFromAerial\DOCSVC_20161003.tar\DOCSVC_20161003\Sect2\INPATIENT\REQ_20160111-000090\Moy, KamChing   .CliffsideNursingHome.3.29.16_2016-03-29-12.42.57.37.pdf
Request;20160111-000091;85237;PACE;Inpatient;PACE;C:\Users\FGuo\Documents\work doucment\attachment\attachmentDB\20161005\originalFileFromAerial\DOCSVC_20161003.tar\DOCSVC_20161003\Sect2\INPATIENT\REQ_20160111-000091\BlancaA.Guzman.BethAbrahamHealthServices.3.29.16_2016-03-29-12.40.13.267.pdf
Request;20160111-000094;83114;SELECT;Inpatient;SELECT;C:\Users\FGuo\Documents\work doucment\attachment\attachmentDB\20161005\originalFileFromAerial\DOCSVC_20161003.tar\DOCSVC_20161003\Sect2\INPATIENT\REQ_20160111-000094\Murray, Margaret .CROWN NURSING HOME ASSOCIATES.3.29.16_2016-03-29-12.36.31.911.pdf
Request;20160111-000095;86655;PACE;Inpatient;PACE;C:\Users\FGuo\Documents\work doucment\attachment\attachmentDB\20161005\originalFileFromAerial\DOCSVC_20161003.tar\DOCSVC_20161003\Sect2\INPATIENT\REQ_20160111-000095\JoseCalderon.BethAbrahamHealthServices.3.29.16_2016-03-29-12.37.58.587.pdf
Request;20160111-000096;38336;FIDA;Inpatient;FIDA;C:\Users\FGuo\Documents\work doucment\attachment\attachmentDB\20161005\originalFileFromAerial\DOCSVC_20161003.tar\DOCSVC_20161003\Sect2\INPATIENT\REQ_20160111-000096\Khoroshun, Sarra .ShoreviewNH.3.25.16_2016-03-30-15.44.40.430.pdf
Request;20160111-000098;36647;PACE;Inpatient;PACE;C:\Users\FGuo\Documents\work doucment\attachment\attachmentDB\20161005\originalFileFromAerial\DOCSVC_20161003.tar\DOCSVC_20161003\Sect2\INPATIENT\REQ_20160111-000098\DignRivera.PALM TREE CENTER FOR NURSING.3.29.16_2016-03-29-14.42.10.408.pdf
Request;20160111-000098;36647;PACE;Inpatient;PACE;C:\Users\FGuo\Documents\work doucment\attachment\attachmentDB\20161005\originalFileFromAerial\DOCSVC_20161003.tar\DOCSVC_20161003\Sect2\INPATIENT\REQ_20160111-000098\Rivera, Digna - PALM TREE CENTER FOR NURSING 9.14.16_2016-09-14-11.32.57.661.pdf
Request;20160111-000099;83410;SELECT;Inpatient;SELECT;C:\Users\FGuo\Documents\work doucment\attachment\attachmentDB\20161005\originalFileFromAerial\DOCSVC_20161003.tar\DOCSVC_20161003\Sect2\INPATIENT\REQ_20160111-000099\Ng, Leungchor  .CliffsideNursingHome.3.29.16_2016-03-29-14.39.14.759.pdf
Request;20160111-000103;82688;PACE;Inpatient;PACE;C:\Users\FGuo\Documents\work doucment\attachment\attachmentDB\20161005\originalFileFromAerial\DOCSVC_20161003.tar\DOCSVC_20161003\Sect2\INPATIENT\REQ_20160111-000103\Huh, Bong Yul  .UNIONPLAZANURSINGHOME.3.29.16_2016-03-29-14.40.55.236.pdf
Request;20160111-000107;79799;SELECT;Inpatient;SELECT;C:\Users\FGuo\Documents\work doucment\attachment\attachmentDB\20161005\originalFileFromAerial\DOCSVC_20161003.tar\DOCSVC_20161003\Sect2\INPATIENT\REQ_20160111-000107\Padilla, Italina .ISABELLAGERIATRICNURSINGHOME.3.24.16_2016-03-29-14.37.44.223.pdf
Request;20160112-000010;49630;SELECT;Inpatient;SELECT;C:\Users\FGuo\Documents\work doucment\attachment\attachmentDB\20161005\originalFileFromAerial\DOCSVC_20161003.tar\DOCSVC_20161003\Sect2\INPATIENT\REQ_20160112-000010\Perez, Felipe_2016-09-23-15.04.30.411.tif
Request;20160112-000010;49630;SELECT;Inpatient;SELECT;C:\Users\FGuo\Documents\work doucment\attachment\attachmentDB\20161005\originalFileFromAerial\DOCSVC_20161003.tar\DOCSVC_20161003\Sect2\INPATIENT\REQ_20160112-000010\Perez,Felipe. OUR LADY OF CONSOLATION.3.29.16_2016-03-29-14.45.25.812.pdf
Request;20160112-000010;49630;SELECT;Inpatient;SELECT;C:\Users\FGuo\Documents\work doucment\attachment\attachmentDB\20161005\originalFileFromAerial\DOCSVC_20161003.tar\DOCSVC_20161003\Sect2\INPATIENT\REQ_20160112-000010\Perez,Felipe. OUR LADY OF CONSOLATION.3.29.16_2016-03-29-14.46.29.418.pdf
Request;20160112-000010;49630;SELECT;Inpatient;SELECT;C:\Users\FGuo\Documents\work doucment\attachment\attachmentDB\20161005\originalFileFromAerial\DOCSVC_20161003.tar\DOCSVC_20161003\Sect2\INPATIENT\REQ_20160112-000010\Perez,Felipe. OUR LADY OF CONSOLATION.3.29.16_2016-03-30-08.18.15.842.pdf
Request;20160112-000012;31709;SELECT;Inpatient;SELECT;C:\Users\FGuo\Documents\work doucment\attachment\attachmentDB\20161005\originalFileFromAerial\DOCSVC_20161003.tar\DOCSVC_20161003\Sect2\INPATIENT\REQ_20160112-000012\Perry, Julius - West Lawrence Care Center  9.09.16_2016-09-09-14.16.01.593.pdf
Request;20160112-000012;31709;SELECT;Inpatient;SELECT;C:\Users\FGuo\Documents\work doucment\attachment\attachmentDB\20161005\originalFileFromAerial\DOCSVC_20161003.tar\DOCSVC_20161003\Sect2\INPATIENT\REQ_20160112-000012\Perry, Julius .WEST LAWRENCE CARE CENTER, LLC.3.29.16_2016-03-29-14.34.23.366.pdf
Request;20160112-000015;34527;SELECT;Inpatient;SELECT;C:\Users\FGuo\Documents\work doucment\attachment\attachmentDB\20161005\originalFileFromAerial\DOCSVC_20161003.tar\DOCSVC_20161003\Sect2\INPATIENT\REQ_20160112-000015\Rios, Rafaela .EAST HAVEN NURSING AND REHABILITATI.3.29.16_2016-03-29-14.32.54.43.pdf
Request;20160112-000016;35847;SELECT;Inpatient;SELECT;C:\Users\FGuo\Documents\work doucment\attachment\attachmentDB\20161005\originalFileFromAerial\DOCSVC_20161003.tar\DOCSVC_20161003\Sect2\INPATIENT\REQ_20160112-000016\Rosa, Eileen B - DAUGHTERS OF JACOB NURSING HOME 9.13.16_2016-09-13-16.12.29.602.pdf
Request;20160112-000016;35847;SELECT;Inpatient;SELECT;C:\Users\FGuo\Documents\work doucment\attachment\attachmentDB\20161005\originalFileFromAerial\DOCSVC_20161003.tar\DOCSVC_20161003\Sect2\INPATIENT\REQ_20160112-000016\Rosa, Eileen B.DAUGHTERS OF JACOB NURSING HOME.3.29.16_2016-03-29-14.31.03.96.pdf
Request;20160112-000019;44521;SELECT;Inpatient;SELECT;C:\Users\FGuo\Documents\work doucment\attachment\attachmentDB\20161005\originalFileFromAerial\DOCSVC_20161003.tar\DOCSVC_20161003\Sect2\INPATIENT\REQ_20160112-000019\LorinaRosario .WEST LAWRENCE CARE CENTER, LLC.3.30.16_2016-03-30-09.35.45.903.pdf
Request;20160112-000028;50121;SELECT;Inpatient;SELECT;C:\Users\FGuo\Documents\work doucment\attachment\attachmentDB\20161005\originalFileFromAerial\DOCSVC_20161003.tar\DOCSVC_20161003\Sect2\INPATIENT\REQ_20160112-000028\Ruiz, Leonarda .ST. BARNABAS NURSING & REHABILITATI.3.30.16_2016-03-30-09.56.17.899.pdf
Request;20160112-000031;29460;SELECT;Inpatient;SELECT;C:\Users\FGuo\Documents\work doucment\attachment\attachmentDB\20161005\originalFileFromAerial\DOCSVC_20161003.tar\DOCSVC_20161003\Sect2\INPATIENT\REQ_20160112-000031\Schwede, John K - WEST LAWRENCE CARE CENTER, LLC 9.07.16_2016-09-07-16.03.00.963.pdf
Request;20160112-000031;29460;SELECT;Inpatient;SELECT;C:\Users\FGuo\Documents\work doucment\attachment\attachmentDB\20161005\originalFileFromAerial\DOCSVC_20161003.tar\DOCSVC_20161003\Sect2\INPATIENT\REQ_20160112-000031\Schwede, John K .WEST LAWRENCE CARE CENTER, LLC.3.30.16_2016-03-30-09.50.15.472.pdf
Request;20160112-000032;74919;SELECT;Inpatient;SELECT;C:\Users\FGuo\Documents\work doucment\attachment\attachmentDB\20161005\originalFileFromAerial\DOCSVC_20161003.tar\DOCSVC_20161003\Sect2\INPATIENT\REQ_20160112-000032\SelimoskiSafet.RESORTNURSINGHOME.3.24.16_2016-03-30-09.48.55.489.docx
Request;20160112-000036;51574;SELECT;Inpatient;SELECT;C:\Users\FGuo\Documents\work doucment\attachment\attachmentDB\20161005\originalFileFromAerial\DOCSVC_20161003.tar\DOCSVC_20161003\Sect2\INPATIENT\REQ_20160112-000036\Silberberg, Jimmy .Eger Nursing Home.3.30.16_2016-03-30-09.46.29.629.pdf
Request;20160112-000039;37125;SELECT;Inpatient;SELECT;C:\Users\FGuo\Documents\work doucment\attachment\attachmentDB\20161005\originalFileFromAerial\DOCSVC_20161003.tar\DOCSVC_20161003\Sect2\INPATIENT\REQ_20160112-000039\Singh, Kamaldai  .BethAbrahamHealthServices.3.30.16_2016-03-30-11.22.41.355.pdf
Request;20160112-000045;31500;SELECT;Inpatient;SELECT;C:\Users\FGuo\Documents\work doucment\attachment\attachmentDB\20161005\originalFileFromAerial\DOCSVC_20161003.tar\DOCSVC_20161003\Sect2\INPATIENT\REQ_20160112-000045\Sotoguiros, Pedro L - Buena Vida Continuing Care & Rehabilitation - 6.9.16_2016-06-09-09.13.40.13.pdf
Request;20160112-000045;31500;SELECT;Inpatient;SELECT;C:\Users\FGuo\Documents\work doucment\attachment\attachmentDB\20161005\originalFileFromAerial\DOCSVC_20161003.tar\DOCSVC_20161003\Sect2\INPATIENT\REQ_20160112-000045\Sotoguiros, Pedro L-BUENA VIDA CONTINUING CARE & REHABI.3.30.16_2016-03-30-09.42.54.931.pdf
Request;20160112-000046;24468;SELECT;Inpatient;SELECT;C:\Users\FGuo\Documents\work doucment\attachment\attachmentDB\20161005\originalFileFromAerial\DOCSVC_20161003.tar\DOCSVC_20161003\Sect2\INPATIENT\REQ_20160112-000046\Tao, Sun P  .UnionPlazaNH.3.30.16_2016-03-30-09.41.24.769.pdf
Request;20160112-000047;84979;SELECT;Inpatient;SELECT;C:\Users\FGuo\Documents\work doucment\attachment\attachmentDB\20161005\originalFileFromAerial\DOCSVC_20161003.tar\DOCSVC_20161003\Sect2\INPATIENT\REQ_20160112-000047\Tillman, Gerald .BethAbrahamHealthServices.3.30.16_2016-03-30-09.40.06.12.pdf
Request;20160112-000050;76250;SELECT;Inpatient;SELECT;C:\Users\FGuo\Documents\work doucment\attachment\attachmentDB\20161005\originalFileFromAerial\DOCSVC_20161003.tar\DOCSVC_20161003\Sect2\INPATIENT\REQ_20160112-000050\Torres, Francisco  .EAST HAVEN NURSING AND REHABILITATI.3.29.16_2016-03-30-09.38.36.329.pdf
Request;20160112-000052;52745;SELECT;Inpatient;SELECT;C:\Users\FGuo\Documents\work doucment\attachment\attachmentDB\20161005\originalFileFromAerial\DOCSVC_20161003.tar\DOCSVC_20161003\Sect2\INPATIENT\REQ_20160112-000052\Torres, Maria .TOWNHOUSE EXTENDED CARE FACILITY.3.30.16_2016-03-30-09.37.14.883.pdf
Request;20160112-000054;38404;SELECT;Inpatient;SELECT;C:\Users\FGuo\Documents\work doucment\attachment\attachmentDB\20161005\originalFileFromAerial\DOCSVC_20161003.tar\DOCSVC_20161003\Sect2\INPATIENT\REQ_20160112-000054\Vilalo Pezcepero, Gerardo W - Oak Hollow Nursing Center (Auth 20160112-000054) 2.16.16_2016-02-16-13.48.59.618.pdf
Request;20160112-000054;38404;SELECT;Inpatient;SELECT;C:\Users\FGuo\Documents\work doucment\attachment\attachmentDB\20161005\originalFileFromAerial\DOCSVC_20161003.tar\DOCSVC_20161003\Sect2\INPATIENT\REQ_20160112-000054\Vilalo Pezcepero, Gerardo W.OAK HOLLOW NURSING CENTER.3.30.16_2016-03-30-11.21.28.517.pdf
Request;20160112-000058;97271;SELECT;Inpatient;SELECT;C:\Users\FGuo\Documents\work doucment\attachment\attachmentDB\20161005\originalFileFromAerial\DOCSVC_20161003.tar\DOCSVC_20161003\Sect2\INPATIENT\REQ_20160112-000058\Zheng, Min   .UnionPlazaNH.3.30.16_2016-03-30-11.19.12.928.pdf
Request;20160112-000059;79373;SELECT;Inpatient;SELECT;C:\Users\FGuo\Documents\work doucment\attachment\attachmentDB\20161005\originalFileFromAerial\DOCSVC_20161003.tar\DOCSVC_20161003\Sect2\INPATIENT\REQ_20160112-000059\Zou, Yu L - Atlantis Rehab & RHCF (Auth 20160112-000059) 3.4.16_2016-03-04-14.15.11.643.pdf
Request;20160112-000060;78208;PACE;Inpatient;PACE;C:\Users\FGuo\Documents\work doucment\attachment\attachmentDB\20161005\originalFileFromAerial\DOCSVC_20161003.tar\DOCSVC_20161003\Sect2\INPATIENT\REQ_20160112-000060\Moreno, Haydee   .BethAbrahamHealthServices.3.30.16_2016-03-30-10.58.30.835.pdf
Request;20160112-000062;78210;PACE;Inpatient;PACE;C:\Users\FGuo\Documents\work doucment\attachment\attachmentDB\20161005\originalFileFromAerial\DOCSVC_20161003.tar\DOCSVC_20161003\Sect2\INPATIENT\REQ_20160112-000062\Moreno, Miguel   .BethAbrahamHealthServices.3.30.16_2016-03-30-10.57.25.870.pdf
Request;20160112-000074;98679;PACE;Inpatient;PACE;C:\Users\FGuo\Documents\work doucment\attachment\attachmentDB\20161005\originalFileFromAerial\DOCSVC_20161003.tar\DOCSVC_20161003\Sect2\INPATIENT\REQ_20160112-000074\Sanchez, Francisco  .BethAbrahamHealthServices.3.30.16_2016-03-30-10.55.32.784.pdf
Request;20160112-000075;99165;PACE;Inpatient;PACE;C:\Users\FGuo\Documents\work doucment\attachment\attachmentDB\20161005\originalFileFromAerial\DOCSVC_20161003.tar\DOCSVC_20161003\Sect2\INPATIENT\REQ_20160112-000075\Williams, Joan .MARGARET TIETZ NURSING AND REHAB CTR.3.30.16_2016-03-30-10.54.03.348.pdf
Request;20160112-000076;40628;PACE;Inpatient;PACE;C:\Users\FGuo\Documents\work doucment\attachment\attachmentDB\20161005\originalFileFromAerial\DOCSVC_20161003.tar\DOCSVC_20161003\Sect2\INPATIENT\REQ_20160112-000076\Petitfrere, Fortune  .CliffsideNursingHome.3.30.16_2016-03-30-10.52.53.936.pdf
Request;20160112-000080;21285;SELECT;Inpatient;SELECT;C:\Users\FGuo\Documents\work doucment\attachment\attachmentDB\20161005\originalFileFromAerial\DOCSVC_20161003.tar\DOCSVC_20161003\Sect2\INPATIENT\REQ_20160112-000080\Lew, Danny .MARGARET TIETZ NURSING AND REHAB CTR.3.30.16_2016-03-30-10.51.41.97.pdf
Request;20160112-000084;43969;SELECT;Inpatient;SELECT;C:\Users\FGuo\Documents\work doucment\attachment\attachmentDB\20161005\originalFileFromAerial\DOCSVC_20161003.tar\DOCSVC_20161003\Sect2\INPATIENT\REQ_20160112-000084\Felumero, Catherine  .Eger Nursing Home.3.30.16_2016-03-30-10.50.30.697.pdf
Request;20160112-000084;43969;SELECT;Inpatient;SELECT;C:\Users\FGuo\Documents\work doucment\attachment\attachmentDB\20161005\originalFileFromAerial\DOCSVC_20161003.tar\DOCSVC_20161003\Sect2\INPATIENT\REQ_20160112-000084\Felumero, Catherine Eger Healthcarfe & Rehab  (Auth 20160112-000084 ) 2.19.16_2016-02-19-11.27.36.40.pdf
Request;20160112-000084;43969;SELECT;Inpatient;SELECT;C:\Users\FGuo\Documents\work doucment\attachment\attachmentDB\20161005\originalFileFromAerial\DOCSVC_20161003.tar\DOCSVC_20161003\Sect2\INPATIENT\REQ_20160112-000084\Felumero, Catherine_2016-07-21-16.52.27.122.tif
Request;20160112-000089;55364;SELECT;Inpatient;SELECT;C:\Users\FGuo\Documents\work doucment\attachment\attachmentDB\20161005\originalFileFromAerial\DOCSVC_20161003.tar\DOCSVC_20161003\Sect2\INPATIENT\REQ_20160112-000089\Buller, Hazel .SCHAFFER EXTENDED CARE CENTER.3.30.16_2016-03-30-10.49.08.555.pdf
Request;20160112-000091;42926;PACE;Inpatient;PACE;C:\Users\FGuo\Documents\work doucment\attachment\attachmentDB\20161005\originalFileFromAerial\DOCSVC_20161003.tar\DOCSVC_20161003\Sect2\INPATIENT\REQ_20160112-000091\Wilson, John    - Beth Abraham Health Services 3-29-16_2016-03-29-11.37.52.694.pdf
Request;20160112-000097;53465;SELECT;Inpatient;SELECT;C:\Users\FGuo\Documents\work doucment\attachment\attachmentDB\20161005\originalFileFromAerial\DOCSVC_20161003.tar\DOCSVC_20161003\Sect2\INPATIENT\REQ_20160112-000097\Viola, Eleanor  SILVERLAKE SPECIALIZED REHABILITATION & CARE CENTE3.29.16_2016-03-29-13.52.57.891.pdf
Request;20160112-000097;53465;SELECT;Inpatient;SELECT;C:\Users\FGuo\Documents\work doucment\attachment\attachmentDB\20161005\originalFileFromAerial\DOCSVC_20161003.tar\DOCSVC_20161003\Sect2\INPATIENT\REQ_20160112-000097\Viola, Eleanor - SILVERLAKE SPECIALIZED REHABILITATION & CARE CENTER 9.01.16_2016-09-01-09.49.15.187.pdf
Request;20160112-000097;53465;SELECT;Inpatient;SELECT;C:\Users\FGuo\Documents\work doucment\attachment\attachmentDB\20161005\originalFileFromAerial\DOCSVC_20161003.tar\DOCSVC_20161003\Sect2\INPATIENT\REQ_20160112-000097\Viola, Eleanor .SILVERLAKE SPECIALIZED REHABILITATION & CARE CENTE.3.30.16_2016-03-30-12.25.24.975.pdf
Request;20160112-000103;60167;null;Inpatient;PACE;C:\Users\FGuo\Documents\work doucment\attachment\attachmentDB\20161005\originalFileFromAerial\DOCSVC_20161003.tar\DOCSVC_20161003\Sect2\INPATIENT\REQ_20160112-000103\Yan, Shi Rui- Atlantis Rehab & RHCF (Auth 20160112-000103) 3.3.16_2016-03-03-15.35.37.1.pdf
Request;20160112-000107;29136;PACE;Inpatient;PACE;C:\Users\FGuo\Documents\work doucment\attachment\attachmentDB\20161005\originalFileFromAerial\DOCSVC_20161003.tar\DOCSVC_20161003\Sect2\INPATIENT\REQ_20160112-000107\Aviles Cruz, Angela - New Glen Oaks Nursing Home 3-29-16_2016-03-29-12.00.22.284.pdf
Request;20160112-000107;29136;PACE;Inpatient;PACE;C:\Users\FGuo\Documents\work doucment\attachment\attachmentDB\20161005\originalFileFromAerial\DOCSVC_20161003.tar\DOCSVC_20161003\Sect2\INPATIENT\REQ_20160112-000107\Aviles Cruz, Angela - NEW GLEN OAKS NURSING HOME INC 9.07.16_2016-09-07-14.46.20.812.pdf
Request;20160112-000109;85009;SELECT;Inpatient;SELECT;C:\Users\FGuo\Documents\work doucment\attachment\attachmentDB\20161005\originalFileFromAerial\DOCSVC_20161003.tar\DOCSVC_20161003\Sect2\INPATIENT\REQ_20160112-000109\Shum, So Chun - KFG Operating Two LLC 5-3-16_2016-05-03-10.37.08.569.pdf
Request;20160112-000113;87874;PACE;Inpatient;PACE;C:\Users\FGuo\Documents\work doucment\attachment\attachmentDB\20161005\originalFileFromAerial\DOCSVC_20161003.tar\DOCSVC_20161003\Sect2\INPATIENT\REQ_20160112-000113\Valenzuela Martinez, Julio - Beth Abraham Health Services 3-29-16_2016-03-29-12.27.48.308.pdf
Request;20160112-000114;89356;SELECT;Inpatient;SELECT;C:\Users\FGuo\Documents\work doucment\attachment\attachmentDB\20161005\originalFileFromAerial\DOCSVC_20161003.tar\DOCSVC_20161003\Sect2\INPATIENT\REQ_20160112-000114\AnthonyMartin.ATLANTIS REHAB & RHCF.3.30.16_2016-03-30-12.27.07.444.pdf
Request;20160113-000013;49503;null;Inpatient;SELECT;C:\Users\FGuo\Documents\work doucment\attachment\attachmentDB\20161005\originalFileFromAerial\DOCSVC_20161003.tar\DOCSVC_20161003\Sect2\INPATIENT\REQ_20160113-000013\Leiderman, Rose .OAK HOLLOW NURSING CENTER.3.30.16_2016-03-30-14.34.45.446.pdf
Request;20160113-000018;49602;null;Inpatient;SELECT;C:\Users\FGuo\Documents\work doucment\attachment\attachmentDB\20161005\originalFileFromAerial\DOCSVC_20161003.tar\DOCSVC_20161003\Sect2\INPATIENT\REQ_20160113-000018\Schneiderman, Jay .AVALON GARDENS REHAB & HEALTHCARE.3.30.16_2016-03-30-14.31.30.713.pdf
Request;20160113-000018;49602;null;Inpatient;SELECT;C:\Users\FGuo\Documents\work doucment\attachment\attachmentDB\20161005\originalFileFromAerial\DOCSVC_20161003.tar\DOCSVC_20161003\Sect2\INPATIENT\REQ_20160113-000018\Schneiderman, Jay-Clinicals-CMalave-6.2.16_2016-06-02-16.56.40.947.tif
Request;20160113-000019;87139;DIRECT;Inpatient;DIRECT;C:\Users\FGuo\Documents\work doucment\attachment\attachmentDB\20161005\originalFileFromAerial\DOCSVC_20161003.tar\DOCSVC_20161003\Sect2\INPATIENT\REQ_20160113-000019\Roth, Pauline  .MARGARET TIETZ NURSING AND REHAB CTR.3.30.16_2016-03-30-14.29.53.254.pdf
Request;20160113-000021;83445;DIRECT;Inpatient;DIRECT;C:\Users\FGuo\Documents\work doucment\attachment\attachmentDB\20161005\originalFileFromAerial\DOCSVC_20161003.tar\DOCSVC_20161003\Sect2\INPATIENT\REQ_20160113-000021\Wilson, Ella   .MARGARET TIETZ NURSING AND REHAB CTR.3.30.16_2016-03-30-13.51.50.433.pdf
Request;20160113-000023;85332;PACE;Inpatient;PACE;C:\Users\FGuo\Documents\work doucment\attachment\attachmentDB\20161005\originalFileFromAerial\DOCSVC_20161003.tar\DOCSVC_20161003\Sect2\INPATIENT\REQ_20160113-000023\Herring, Hazel- Kings Harbor Multicare Center  5.4_2016-05-04-11.22.26.825.pdf
Request;20160113-000024;32923;SELECT;Inpatient;SELECT;C:\Users\FGuo\Documents\work doucment\attachment\attachmentDB\20161005\originalFileFromAerial\DOCSVC_20161003.tar\DOCSVC_20161003\Sect2\INPATIENT\REQ_20160113-000024\Segal, Michael - GOUVENEUR HEALTHCARE SERVICES 9.12.16_2016-09-12-11.12.14.258.pdf
Request;20160113-000024;32923;SELECT;Inpatient;SELECT;C:\Users\FGuo\Documents\work doucment\attachment\attachmentDB\20161005\originalFileFromAerial\DOCSVC_20161003.tar\DOCSVC_20161003\Sect2\INPATIENT\REQ_20160113-000024\Segal, Michael .GOUVENEUR HEALTHCARE SERVICES.3.30.16_2016-03-30-13.50.15.331.pdf
Request;20160113-000025;95984;PACE;Inpatient;PACE;C:\Users\FGuo\Documents\work doucment\attachment\attachmentDB\20161005\originalFileFromAerial\DOCSVC_20161003.tar\DOCSVC_20161003\Sect2\INPATIENT\REQ_20160113-000025\Roman, Margarita - WORKMEN'S CIRCLE HOME - 5.4_2016-05-04-11.53.07.493.pdf
Request;20160113-000027;92149;PACE;Inpatient;PACE;C:\Users\FGuo\Documents\work doucment\attachment\attachmentDB\20161005\originalFileFromAerial\DOCSVC_20161003.tar\DOCSVC_20161003\Sect2\INPATIENT\REQ_20160113-000027\Robles-Otero, Ruben .BethAbrahamHealthServices.3.25.16_2016-03-30-13.48.48.883.pdf
Request;20160113-000028;51992;SELECT;Inpatient;SELECT;C:\Users\FGuo\Documents\work doucment\attachment\attachmentDB\20161005\originalFileFromAerial\DOCSVC_20161003.tar\DOCSVC_20161003\Sect2\INPATIENT\REQ_20160113-000028\Nash, Roshonda D - Ocean Promenade Rehabilation (Auth 20160113-000028  2.16.16_2016-02-16-14.55.39.771.pdf
Request;20160113-000029;76293;PACE;Inpatient;PACE;C:\Users\FGuo\Documents\work doucment\attachment\attachmentDB\20161005\originalFileFromAerial\DOCSVC_20161003.tar\DOCSVC_20161003\Sect2\INPATIENT\REQ_20160113-000029\Ruditskaya, Noemi .SHOREVIEW NURSING HOME.3.30.16_2016-03-30-13.46.03.594.pdf
Request;20160113-000030;53571;SELECT;Inpatient;SELECT;C:\Users\FGuo\Documents\work doucment\attachment\attachmentDB\20161005\originalFileFromAerial\DOCSVC_20161003.tar\DOCSVC_20161003\Sect2\INPATIENT\REQ_20160113-000030\G_\Irvina McLeod\Authorization Letters - 2016\Milianta, Giuseppina-Throgs Neck Extended Care Facility (Auth 20160113-000030 ) 2.19.16_2016-02-19-12.05.50.723.pdf
Request;20160113-000030;53571;SELECT;Inpatient;SELECT;C:\Users\FGuo\Documents\work doucment\attachment\attachmentDB\20161005\originalFileFromAerial\DOCSVC_20161003.tar\DOCSVC_20161003\Sect2\INPATIENT\REQ_20160113-000030\G_\Irvina McLeod\Authorization Letters - 2016\Milianta, Giuseppina-Throgs Neck Extended Care Facility (Auth 20160113-000030 ) 2.19.16_2016-02-19-12.06.11.469.docx
Request;20160113-000030;53571;SELECT;Inpatient;SELECT;C:\Users\FGuo\Documents\work doucment\attachment\attachmentDB\20161005\originalFileFromAerial\DOCSVC_20161003.tar\DOCSVC_20161003\Sect2\INPATIENT\REQ_20160113-000030\Milianta, Giuseppina-Throgs Neck Extended Care Facility (Auth 20160113-000030 ) 2.19.16_2016-02-19-11.15.42.484.pdf
Request;20160113-000048;26307;PACE;Inpatient;PACE;C:\Users\FGuo\Documents\work doucment\attachment\attachmentDB\20161005\originalFileFromAerial\DOCSVC_20161003.tar\DOCSVC_20161003\Sect2\INPATIENT\REQ_20160113-000048\Lee, Ying Tong - GOUVERNEUR HEALTHCARE SERVICES 9.02.16_2016-09-02-16.48.32.699.pdf
Request;20160113-000048;26307;PACE;Inpatient;PACE;C:\Users\FGuo\Documents\work doucment\attachment\attachmentDB\20161005\originalFileFromAerial\DOCSVC_20161003.tar\DOCSVC_20161003\Sect2\INPATIENT\REQ_20160113-000048\Lee, Ying Tong .GOUVENEUR HEALTHCARE SERVICES.3.30.16_2016-03-30-15.52.36.4.pdf
Request;20160113-000052;39988;PACE;Inpatient;PACE;C:\Users\FGuo\Documents\work doucment\attachment\attachmentDB\20161005\originalFileFromAerial\DOCSVC_20161003.tar\DOCSVC_20161003\Sect2\INPATIENT\REQ_20160113-000052\James, Craig .CROWN NURSING HOME ASSOCIATES.3.30.16_2016-03-30-15.55.35.824.pdf
Request;20160113-000053;48342;PACE;Inpatient;PACE;C:\Users\FGuo\Documents\work doucment\attachment\attachmentDB\20161005\originalFileFromAerial\DOCSVC_20161003.tar\DOCSVC_20161003\Sect2\INPATIENT\REQ_20160113-000053\Burgess, Joslyn -CENTER FOR NURSING AND REHABILITATION.3.30.16_2016-03-30-15.59.48.768.pdf
Request;20160113-000057;21362;SELECT;Inpatient;SELECT;C:\Users\FGuo\Documents\work doucment\attachment\attachmentDB\20161005\originalFileFromAerial\DOCSVC_20161003.tar\DOCSVC_20161003\Sect2\INPATIENT\REQ_20160113-000057\Torres, Emelda .ISABELLAGERIATRICNURSINGHOME3.31.16_2016-03-31-12.24.23.152.pdf
Request;20160113-000060;81916;SELECT;Inpatient;SELECT;C:\Users\FGuo\Documents\work doucment\attachment\attachmentDB\20161005\originalFileFromAerial\DOCSVC_20161003.tar\DOCSVC_20161003\Sect2\INPATIENT\REQ_20160113-000060\West, Alice -  Ditmas Park Rehab-Care Center - 5.6_2016-05-06-08.57.07.556.pdf
Request;20160113-000063;31338;SELECT;Inpatient;SELECT;C:\Users\FGuo\Documents\work doucment\attachment\attachmentDB\20161005\originalFileFromAerial\DOCSVC_20161003.tar\DOCSVC_20161003\Sect2\INPATIENT\REQ_20160113-000063\Bell, Dean C - BROOKHAVEN REHAB & HEALTH CENTER 9.09.16_2016-09-09-10.16.46.919.pdf
Request;20160113-000063;31338;SELECT;Inpatient;SELECT;C:\Users\FGuo\Documents\work doucment\attachment\attachmentDB\20161005\originalFileFromAerial\DOCSVC_20161003.tar\DOCSVC_20161003\Sect2\INPATIENT\REQ_20160113-000063\Bell, Dean C.BROOKHAVEN REHAB & HEALTH CENTER.3.31.16_2016-03-31-12.21.40.97.pdf
Request;20160113-000065;36895;DIRECT;Inpatient;DIRECT;C:\Users\FGuo\Documents\work doucment\attachment\attachmentDB\20161005\originalFileFromAerial\DOCSVC_20161003.tar\DOCSVC_20161003\Sect2\INPATIENT\REQ_20160113-000065\Isaacs, Eileen R-CENTER FOR NURSING AND REHABILITATION.3.31.16_2016-03-31-12.18.12.930.pdf
Request;20160113-000068;48612;DIRECT;Inpatient;DIRECT;C:\Users\FGuo\Documents\work doucment\attachment\attachmentDB\20161005\originalFileFromAerial\DOCSVC_20161003.tar\DOCSVC_20161003\Sect2\INPATIENT\REQ_20160113-000068\Morris, Stanley .SchnurmacherNH.3.25.16_2016-03-31-10.07.50.364.pdf
Request;20160113-000084;87322;PACE;Inpatient;PACE;C:\Users\FGuo\Documents\work doucment\attachment\attachmentDB\20161005\originalFileFromAerial\DOCSVC_20161003.tar\DOCSVC_20161003\Sect2\INPATIENT\REQ_20160113-000084\Lee, Gin Chi   .CliffsideNursingHome.3.31.16_2016-03-31-10.04.43.774.pdf
Request;20160113-000088;53587;PACE;Inpatient;PACE;C:\Users\FGuo\Documents\work doucment\attachment\attachmentDB\20161005\originalFileFromAerial\DOCSVC_20161003.tar\DOCSVC_20161003\Sect2\INPATIENT\REQ_20160113-000088\Rodriguez, Julio . Beth Abraham Health Services 3.31.16_2016-03-31-14.34.00.477.pdf
Request;20160113-000091;33391;null;Inpatient;SELECT;C:\Users\FGuo\Documents\work doucment\attachment\attachmentDB\20161005\originalFileFromAerial\DOCSVC_20161003.tar\DOCSVC_20161003\Sect2\INPATIENT\REQ_20160113-000091\Cortes, Marina . NORTHERN METROPOLITAN INC . 3.31.16_2016-03-31-14.28.29.66.pdf
Request;20160113-000092;48678;SELECT;Inpatient;SELECT;C:\Users\FGuo\Documents\work doucment\attachment\attachmentDB\20161005\originalFileFromAerial\DOCSVC_20161003.tar\DOCSVC_20161003\Sect2\INPATIENT\REQ_20160113-000092\Pinnock, Lloyd . CATON PARK REHABILITATION AND NURSING CENTER . 3.31.16_2016-03-31-14.31.34.835.pdf
Request;20160113-000101;30891;PACE;Inpatient;PACE;C:\Users\FGuo\Documents\work doucment\attachment\attachmentDB\20161005\originalFileFromAerial\DOCSVC_20161003.tar\DOCSVC_20161003\Sect2\INPATIENT\REQ_20160113-000101\Moses, Claudia M - CROWN NURSING HOME ASSOCIATES 9.08.16_2016-09-09-08.34.12.238.pdf
Request;20160113-000101;30891;PACE;Inpatient;PACE;C:\Users\FGuo\Documents\work doucment\attachment\attachmentDB\20161005\originalFileFromAerial\DOCSVC_20161003.tar\DOCSVC_20161003\Sect2\INPATIENT\REQ_20160113-000101\Moses, Claudia M .CROWN NURSING HOME ASSOCIATES.3.31.16_2016-03-31-14.00.54.561.pdf
Request;20160113-000103;26813;PACE;Inpatient;PACE;C:\Users\FGuo\Documents\work doucment\attachment\attachmentDB\20161005\originalFileFromAerial\DOCSVC_20161003.tar\DOCSVC_20161003\Sect2\INPATIENT\REQ_20160113-000103\Allen, Margaret  .MARGARET TIETZ NURSING AND REHAB CTR.3.31.16_2016-03-31-13.59.31.46.pdf
Request;20160113-000103;26813;PACE;Inpatient;PACE;C:\Users\FGuo\Documents\work doucment\attachment\attachmentDB\20161005\originalFileFromAerial\DOCSVC_20161003.tar\DOCSVC_20161003\Sect2\INPATIENT\REQ_20160113-000103\Allen, Margaret - MARGARET TIETZ NURSING AND REHAB CTR 9.07.16_2016-09-07-10.19.53.464.pdf
Request;20160113-000105;33536;SELECT;Inpatient;SELECT;C:\Users\FGuo\Documents\work doucment\attachment\attachmentDB\20161005\originalFileFromAerial\DOCSVC_20161003.tar\DOCSVC_20161003\Sect2\INPATIENT\REQ_20160113-000105\Holiday, Henry L - PINE VALLEY CENTER, LLC 9.12.16_2016-09-12-12.10.32.258.pdf
Request;20160113-000105;33536;SELECT;Inpatient;SELECT;C:\Users\FGuo\Documents\work doucment\attachment\attachmentDB\20161005\originalFileFromAerial\DOCSVC_20161003.tar\DOCSVC_20161003\Sect2\INPATIENT\REQ_20160113-000105\HOLIDAY, HENRY L- Pine Valley Center  LLC  (Auth 20160113-000105) 2.16.16_2016-02-16-11.53.36.729.pdf
Request;20160113-000105;33536;SELECT;Inpatient;SELECT;C:\Users\FGuo\Documents\work doucment\attachment\attachmentDB\20161005\originalFileFromAerial\DOCSVC_20161003.tar\DOCSVC_20161003\Sect2\INPATIENT\REQ_20160113-000105\Holiday, Henry L.PINE VALLEY CENTER, LLC.3.31.16_2016-03-31-13.58.17.512.pdf
Request;20160114-000014;36359;SELECT;Inpatient;SELECT;C:\Users\FGuo\Documents\work doucment\attachment\attachmentDB\20161005\originalFileFromAerial\DOCSVC_20161003.tar\DOCSVC_20161003\Sect2\INPATIENT\REQ_20160114-000014\Figueroa, Carmen  T TERENCE CARDINAL COOKE HEALTH CARE 3.30.16_2016-03-30-16.21.52.975.pdf
Request;20160114-000016;91561;PACE;Inpatient;PACE;C:\Users\FGuo\Documents\work doucment\attachment\attachmentDB\20161005\originalFileFromAerial\DOCSVC_20161003.tar\DOCSVC_20161003\Sect2\INPATIENT\REQ_20160114-000016\Walters, Frederica V BETH ABRAHAM HEALTH SERVICES 3.30.16_2016-03-30-14.05.38.699.pdf
Request;20160114-000018;31113;PACE;Inpatient;PACE;C:\Users\FGuo\Documents\work doucment\attachment\attachmentDB\20161005\originalFileFromAerial\DOCSVC_20161003.tar\DOCSVC_20161003\Sect2\INPATIENT\REQ_20160114-000018\Jin, Gordon M RESORT NURSING HOME 3.30.16_2016-03-30-14.13.25.869.pdf
Request;20160114-000020;34514;SELECT;Inpatient;SELECT;C:\Users\FGuo\Documents\work doucment\attachment\attachmentDB\20161005\originalFileFromAerial\DOCSVC_20161003.tar\DOCSVC_20161003\Sect2\INPATIENT\REQ_20160114-000020\Olivo, Manuel  TERENCE CARDINAL COOKE HEALTH CARE 9.13.16_2016-09-13-10.43.53.278.pdf
Request;20160114-000020;34514;SELECT;Inpatient;SELECT;C:\Users\FGuo\Documents\work doucment\attachment\attachmentDB\20161005\originalFileFromAerial\DOCSVC_20161003.tar\DOCSVC_20161003\Sect2\INPATIENT\REQ_20160114-000020\Olivo, Manuel T TERENCE CARDINAL COOKE HEALTH CARE 3.30.16_2016-03-30-15.19.08.42.pdf
Request;20160114-000021;50275;PACE;Inpatient;PACE;C:\Users\FGuo\Documents\work doucment\attachment\attachmentDB\20161005\originalFileFromAerial\DOCSVC_20161003.tar\DOCSVC_20161003\Sect2\INPATIENT\REQ_20160114-000021\Wong, Wai K -Atlantis Rehab & RHCF (Auth 20160114-000021) 3.2.16_2016-03-02-11.16.15.906.pdf
Request;20160114-000025;73999;null;Inpatient;PACE;C:\Users\FGuo\Documents\work doucment\attachment\attachmentDB\20161005\originalFileFromAerial\DOCSVC_20161003.tar\DOCSVC_20161003\Sect2\INPATIENT\REQ_20160114-000025\Rodriguez, Maria T TERENCE CARDINAL COOKE HEALTH CARE 3.30.16_2016-03-30-15.01.08.312.pdf
Request;20160114-000026;29673;SELECT;Inpatient;SELECT;C:\Users\FGuo\Documents\work doucment\attachment\attachmentDB\20161005\originalFileFromAerial\DOCSVC_20161003.tar\DOCSVC_20161003\Sect2\INPATIENT\REQ_20160114-000026\Rivera, Eloisa THE RIVERSIDE 3.30.16_2016-03-30-15.36.28.22.pdf
Request;20160114-000058;24200;SELECT;Inpatient;SELECT;C:\Users\FGuo\Documents\work doucment\attachment\attachmentDB\20161005\originalFileFromAerial\DOCSVC_20161003.tar\DOCSVC_20161003\Sect2\INPATIENT\REQ_20160114-000058\Charles, Gerone  .SHEEPSHEAD NURSING AND REHAB CENTER.3.31.16_2016-03-31-16.22.39.355.pdf
Request;20160114-000059;55358;PACE;Inpatient;PACE;C:\Users\FGuo\Documents\work doucment\attachment\attachmentDB\20161005\originalFileFromAerial\DOCSVC_20161003.tar\DOCSVC_20161003\Sect2\INPATIENT\REQ_20160114-000059\Dejesus, Nereida .SchnurmacherNH.3.31.16_2016-03-31-16.24.00.816.pdf
Request;20160114-000063;38793;SELECT;Inpatient;SELECT;C:\Users\FGuo\Documents\work doucment\attachment\attachmentDB\20161005\originalFileFromAerial\DOCSVC_20161003.tar\DOCSVC_20161003\Sect2\INPATIENT\REQ_20160114-000063\Mccluney, Richard J. NORTHERN METROPOLITAN INC . 3.31.16_2016-03-31-16.32.32.21.pdf
Request;20160114-000064;76185;PACE;Inpatient;PACE;C:\Users\FGuo\Documents\work doucment\attachment\attachmentDB\20161005\originalFileFromAerial\DOCSVC_20161003.tar\DOCSVC_20161003\Sect2\INPATIENT\REQ_20160114-000064\Cozzolino, Josephine  - Schervier Nursing Care 3-30-16_2016-03-30-16.24.39.472.pdf
Request;20160114-000067;98664;PACE;Inpatient;PACE;C:\Users\FGuo\Documents\work doucment\attachment\attachmentDB\20161005\originalFileFromAerial\DOCSVC_20161003.tar\DOCSVC_20161003\Sect2\INPATIENT\REQ_20160114-000067\Gomez, Virginia .ISABELLAGERIATRICNURSINGHOME.3.31.16_2016-03-31-16.18.13.531.pdf
Request;20160114-000070;47971;SELECT;Inpatient;SELECT;C:\Users\FGuo\Documents\work doucment\attachment\attachmentDB\20161005\originalFileFromAerial\DOCSVC_20161003.tar\DOCSVC_20161003\Sect2\INPATIENT\REQ_20160114-000070\Betts.Craig.FULTON COMMONS CARE CENTER, INC..4.1.16_2016-04-01-11.56.56.934.pdf
Request;20160114-000079;51439;SELECT;Inpatient;SELECT;C:\Users\FGuo\Documents\work doucment\attachment\attachmentDB\20161005\originalFileFromAerial\DOCSVC_20161003.tar\DOCSVC_20161003\Sect2\INPATIENT\REQ_20160114-000079\Schwartz, Steven H.HEBREW HOSPITAL HOME OF WESTCHESTER, INC..4.1.16_2016-04-01-12.12.13.236.pdf
Request;20160114-000081;77554;SELECT;Inpatient;SELECT;C:\Users\FGuo\Documents\work doucment\attachment\attachmentDB\20161005\originalFileFromAerial\DOCSVC_20161003.tar\DOCSVC_20161003\Sect2\INPATIENT\REQ_20160114-000081\Chen, Hongrang  .ATLANTIS REHAB & RHCF.4.1.16_2016-04-01-12.10.13.284.pdf
Request;20160114-000083;98777;PACE;Inpatient;PACE;C:\Users\FGuo\Documents\work doucment\attachment\attachmentDB\20161005\originalFileFromAerial\DOCSVC_20161003.tar\DOCSVC_20161003\Sect2\INPATIENT\REQ_20160114-000083\Li, Yue Mei  - Atlantis Rehab & RHCF (Auth 20160114-000083) 3.2.16_2016-03-02-09.46.05.271.pdf
Request;20160114-000083;98777;PACE;Inpatient;PACE;C:\Users\FGuo\Documents\work doucment\attachment\attachmentDB\20161005\originalFileFromAerial\DOCSVC_20161003.tar\DOCSVC_20161003\Sect2\INPATIENT\REQ_20160114-000083\YUE MEI LI_2016-06-30-11.34.39.966.tif
Request;20160114-000085;23159;SELECT;Inpatient;SELECT;C:\Users\FGuo\Documents\work doucment\attachment\attachmentDB\20161005\originalFileFromAerial\DOCSVC_20161003.tar\DOCSVC_20161003\Sect2\INPATIENT\REQ_20160114-000085\Lau, Chan C -Atlantis Rehab & RHCF  (Auth 20160114-000085 ) 2.18.16_2016-02-18-10.53.07.926.pdf
Request;20160114-000086;45539;FIDA;Inpatient;FIDA;C:\Users\FGuo\Documents\work doucment\attachment\attachmentDB\20161005\originalFileFromAerial\DOCSVC_20161003.tar\DOCSVC_20161003\Sect2\INPATIENT\REQ_20160114-000086\Barraco Giacomo - Dry Harbor HRF 2-17-16_2016-02-17-13.59.47.957.pdf
Request;20160114-000088;39032;FIDA;Inpatient;FIDA;C:\Users\FGuo\Documents\work doucment\attachment\attachmentDB\20161005\originalFileFromAerial\DOCSVC_20161003.tar\DOCSVC_20161003\Sect2\INPATIENT\REQ_20160114-000088\MARIA RAICH_2016-08-16-16.13.55.36.tif
Request;20160114-000088;39032;FIDA;Inpatient;FIDA;C:\Users\FGuo\Documents\work doucment\attachment\attachmentDB\20161005\originalFileFromAerial\DOCSVC_20161003.tar\DOCSVC_20161003\Sect2\INPATIENT\REQ_20160114-000088\Raich, Maria  SHOREVIEW NURSING HOME 3.31.16_2016-03-31-13.25.07.610.pdf
Request;20160114-000088;39032;FIDA;Inpatient;FIDA;C:\Users\FGuo\Documents\work doucment\attachment\attachmentDB\20161005\originalFileFromAerial\DOCSVC_20161003.tar\DOCSVC_20161003\Sect2\INPATIENT\REQ_20160114-000088\Raich, Maria  SHOREVIEW NURSING HOME 3.31.16_2016-03-31-13.33.08.257.pdf
Request;20160114-000088;39032;FIDA;Inpatient;FIDA;C:\Users\FGuo\Documents\work doucment\attachment\attachmentDB\20161005\originalFileFromAerial\DOCSVC_20161003.tar\DOCSVC_20161003\Sect2\INPATIENT\REQ_20160114-000088\RAICH, MARIA_2016-06-15-11.27.29.398.TIF
Request;20160114-000091;57191;SELECT;Inpatient;SELECT;C:\Users\FGuo\Documents\work doucment\attachment\attachmentDB\20161005\originalFileFromAerial\DOCSVC_20161003.tar\DOCSVC_20161003\Sect2\INPATIENT\REQ_20160114-000091\earl pittman31416_2016-03-14-13.17.29.456.tif
Request;20160114-000091;57191;SELECT;Inpatient;SELECT;C:\Users\FGuo\Documents\work doucment\attachment\attachmentDB\20161005\originalFileFromAerial\DOCSVC_20161003.tar\DOCSVC_20161003\Sect2\INPATIENT\REQ_20160114-000091\Pittman, Earl MORNINGSIDE HOUSE NURSING HOME 3.31.16_2016-03-31-13.43.39.587.pdf
Request;20160114-000094;84871;PACE;Inpatient;PACE;C:\Users\FGuo\Documents\work doucment\attachment\attachmentDB\20161005\originalFileFromAerial\DOCSVC_20161003.tar\DOCSVC_20161003\Sect2\INPATIENT\REQ_20160114-000094\Firmin, Christiane  FOUR SEASONS NURSING HOME 3.31.16_2016-03-31-14.27.52.361.pdf
Request;20160114-000097;74742;PACE;Inpatient;PACE;C:\Users\FGuo\Documents\work doucment\attachment\attachmentDB\20161005\originalFileFromAerial\DOCSVC_20161003.tar\DOCSVC_20161003\Sect2\INPATIENT\REQ_20160114-000097\Verdejo, Ana  BETH ABRAHAM HEALTH SERVICES  3.31.16_2016-03-31-15.14.29.912.pdf
Request;20160114-000098;76871;SELECT;Inpatient;SELECT;C:\Users\FGuo\Documents\work doucment\attachment\attachmentDB\20161005\originalFileFromAerial\DOCSVC_20161003.tar\DOCSVC_20161003\Sect2\INPATIENT\REQ_20160114-000098\Kwokleung, Yau Shong UNION PLAZA NURSING HOME  3.31.16_2016-03-31-15.20.25.156.pdf
Request;20160114-000104;55358;PACE;Inpatient;PACE;C:\Users\FGuo\Documents\work doucment\attachment\attachmentDB\20161005\originalFileFromAerial\DOCSVC_20161003.tar\DOCSVC_20161003\Sect2\INPATIENT\REQ_20160114-000104\Dejesus, Nereida SCHNURMACHER NURSING HOME  3.31.16_2016-03-31-15.43.09.471.pdf
Request;20160114-000110;23683;PACE;Inpatient;PACE;C:\Users\FGuo\Documents\work doucment\attachment\attachmentDB\20161005\originalFileFromAerial\DOCSVC_20161003.tar\DOCSVC_20161003\Sect2\INPATIENT\REQ_20160114-000110\Roldan, Tiburcio REGEIS CARE CENTER  3.31.16_2016-03-31-16.15.03.563.pdf
Request;20160114-000111;74721;PACE;Inpatient;PACE;C:\Users\FGuo\Documents\work doucment\attachment\attachmentDB\20161005\originalFileFromAerial\DOCSVC_20161003.tar\DOCSVC_20161003\Sect2\INPATIENT\REQ_20160114-000111\Lin, Ru Yi  ATLANTIS REHAB & RHCF  3.31.16_2016-03-31-16.23.13.324.pdf
Request;20160114-000113;96438;PACE;Inpatient;PACE;C:\Users\FGuo\Documents\work doucment\attachment\attachmentDB\20161005\originalFileFromAerial\DOCSVC_20161003.tar\DOCSVC_20161003\Sect2\INPATIENT\REQ_20160114-000113\Sanchez, Ruben  BETH ABRAHAM HEALTH SERVICES 4.1.16_2016-04-04-09.08.26.31.pdf
Request;20160114-000115;60522;SELECT;Inpatient;SELECT;C:\Users\FGuo\Documents\work doucment\attachment\attachmentDB\20161005\originalFileFromAerial\DOCSVC_20161003.tar\DOCSVC_20161003\Sect2\INPATIENT\REQ_20160114-000115\Gee, Gin - Atlantis Rehab & RHCF (Auth 20160114-000115) 2.29.16_2016-02-29-11.28.30.350.pdf
Request;20160114-000117;84547;SELECT;Inpatient;SELECT;C:\Users\FGuo\Documents\work doucment\attachment\attachmentDB\20161005\originalFileFromAerial\DOCSVC_20161003.tar\DOCSVC_20161003\Sect2\INPATIENT\REQ_20160114-000117\Hussett, Barrington HIGHLAND CARE CENTER, INC 4.1.16_2016-04-04-09.17.51.535.pdf
Request;20160114-000117;84547;SELECT;Inpatient;SELECT;C:\Users\FGuo\Documents\work doucment\attachment\attachmentDB\20161005\originalFileFromAerial\DOCSVC_20161003.tar\DOCSVC_20161003\Sect2\INPATIENT\REQ_20160114-000117\Hussett, Barrington HIGHLAND CARE CENTER, INC 4.1.16_2016-04-04-09.21.59.416.pdf
Request;20160114-000118;60522;SELECT;Inpatient;SELECT;C:\Users\FGuo\Documents\work doucment\attachment\attachmentDB\20161005\originalFileFromAerial\DOCSVC_20161003.tar\DOCSVC_20161003\Sect2\INPATIENT\REQ_20160114-000118\Gee, Gin - Atlantis Rehab & RHCF (Auth 20160114-000118) 2.29.16_2016-02-29-11.37.46.972.pdf
Request;20160114-000120;83216;FIDA;Inpatient;FIDA;C:\Users\FGuo\Documents\work doucment\attachment\attachmentDB\20161005\originalFileFromAerial\DOCSVC_20161003.tar\DOCSVC_20161003\Sect2\INPATIENT\REQ_20160114-000120\Allen, Mae  CLIFFSIDE REHABILITATION AND 4.1.16_2016-04-04-09.31.41.889.pdf
Request;20160114-000121;60526;SELECT;Inpatient;SELECT;C:\Users\FGuo\Documents\work doucment\attachment\attachmentDB\20161005\originalFileFromAerial\DOCSVC_20161003.tar\DOCSVC_20161003\Sect2\INPATIENT\REQ_20160114-000121\Chiu, Choihar  ATLANTIS REHAB & RHCF 4.1.16_2016-04-04-09.47.41.946.pdf
Request;20160114-000126;26814;PACE;Inpatient;PACE;C:\Users\FGuo\Documents\work doucment\attachment\attachmentDB\20161005\originalFileFromAerial\DOCSVC_20161003.tar\DOCSVC_20161003\Sect2\INPATIENT\REQ_20160114-000126\Clarke, Mentor - MARGARET TIETZ NURSING AND REHAB CTR .9.07.16_2016-09-07-14.27.19.246.pdf
Request;20160114-000126;26814;PACE;Inpatient;PACE;C:\Users\FGuo\Documents\work doucment\attachment\attachmentDB\20161005\originalFileFromAerial\DOCSVC_20161003.tar\DOCSVC_20161003\Sect2\INPATIENT\REQ_20160114-000126\Clarke, Mentor.MARGARET TIETZ NURSING AND REHAB CTR.4.1.16_2016-04-01-14.55.32.630.pdf
Request;20160114-000129;40835;SELECT;Inpatient;SELECT;C:\Users\FGuo\Documents\work doucment\attachment\attachmentDB\20161005\originalFileFromAerial\DOCSVC_20161003.tar\DOCSVC_20161003\Sect2\INPATIENT\REQ_20160114-000129\Amberger, Sherrie.WEST LEDGE REHABLITATION.4.1.2016_2016-04-01-15.15.36.5.pdf
Request;20160114-000129;40835;SELECT;Inpatient;SELECT;C:\Users\FGuo\Documents\work doucment\attachment\attachmentDB\20161005\originalFileFromAerial\DOCSVC_20161003.tar\DOCSVC_20161003\Sect2\INPATIENT\REQ_20160114-000129\Amberger, Sherrie.WEST LEDGE REHABLITATION.4.1.2016_2016-04-04-09.57.07.874.pdf
Request;20160114-000132;75256;PACE;Inpatient;PACE;C:\Users\FGuo\Documents\work doucment\attachment\attachmentDB\20161005\originalFileFromAerial\DOCSVC_20161003.tar\DOCSVC_20161003\Sect2\INPATIENT\REQ_20160114-000132\Croutch, Dorothy .CENTERFORNURSINGANDREHABILITATION.4.1.16_2016-04-01-15.36.36.448.pdf
Request;20160114-000132;75256;PACE;Inpatient;PACE;C:\Users\FGuo\Documents\work doucment\attachment\attachmentDB\20161005\originalFileFromAerial\DOCSVC_20161003.tar\DOCSVC_20161003\Sect2\INPATIENT\REQ_20160114-000132\WynnBeulah .CENTERFORNURSINGANDREHABILITATION.3.29.16_2016-04-01-15.23.45.461.pdf
Request;20160114-000134;30464;null;Inpatient;PACE;C:\Users\FGuo\Documents\work doucment\attachment\attachmentDB\20161005\originalFileFromAerial\DOCSVC_20161003.tar\DOCSVC_20161003\Sect2\INPATIENT\REQ_20160114-000134\Gonzalez, Awilda .SCHERVIER NURSING CARE.4.1.2016_2016-04-01-16.36.29.898.pdf
Request;20160114-000136;55634;SELECT;Inpatient;SELECT;C:\Users\FGuo\Documents\work doucment\attachment\attachmentDB\20161005\originalFileFromAerial\DOCSVC_20161003.tar\DOCSVC_20161003\Sect2\INPATIENT\REQ_20160114-000136\Alford, Daisy B.SCHAFFER EXTENDED CARE CENTER.4.1.16_2016-04-01-16.44.57.623.pdf
Request;20160114-000138;34052;PACE;Inpatient;PACE;C:\Users\FGuo\Documents\work doucment\attachment\attachmentDB\20161005\originalFileFromAerial\DOCSVC_20161003.tar\DOCSVC_20161003\Sect2\INPATIENT\REQ_20160114-000138\Graham, Naomi - BETH ABRAHAM HEALTH SERVICES 9.12.16_2016-09-12-14.59.31.434.pdf
Request;20160114-000138;34052;PACE;Inpatient;PACE;C:\Users\FGuo\Documents\work doucment\attachment\attachmentDB\20161005\originalFileFromAerial\DOCSVC_20161003.tar\DOCSVC_20161003\Sect2\INPATIENT\REQ_20160114-000138\Graham, Naomi.BethAbrahamHealthServices.4.4.16_2016-04-04-10.20.59.74.pdf
Request;20160114-000141;30870;PACE;Inpatient;PACE;C:\Users\FGuo\Documents\work doucment\attachment\attachmentDB\20161005\originalFileFromAerial\DOCSVC_20161003.tar\DOCSVC_20161003\Sect2\INPATIENT\REQ_20160114-000141\Somma, Rose - Buena Vida Continuing Care and Rehab Center 9.08.16_2016-09-08-16.13.30.97.pdf
Request;20160114-000141;30870;PACE;Inpatient;PACE;C:\Users\FGuo\Documents\work doucment\attachment\attachmentDB\20161005\originalFileFromAerial\DOCSVC_20161003.tar\DOCSVC_20161003\Sect2\INPATIENT\REQ_20160114-000141\Somma, Rose-BUENA VIDA CONTINUING CARE & REHABI.4.4.16_2016-04-04-11.18.31.593.pdf
Request;20160115-000006;43169;SELECT;Inpatient;SELECT;C:\Users\FGuo\Documents\work doucment\attachment\attachmentDB\20161005\originalFileFromAerial\DOCSVC_20161003.tar\DOCSVC_20161003\Sect2\INPATIENT\REQ_20160115-000006\Rivera, Rafael .PROSPECT PARK OPERATING.4.4.16_2016-04-04-11.32.47.595.pdf
Request;20160115-000008;52030;SELECT;Inpatient;SELECT;C:\Users\FGuo\Documents\work doucment\attachment\attachmentDB\20161005\originalFileFromAerial\DOCSVC_20161003.tar\DOCSVC_20161003\Sect2\INPATIENT\REQ_20160115-000008\LaoyFrancisco.ST VINCENT DE PAUL RESIDENCE.4.1.16._2016-04-01-16.04.46.559.pdf
Request;20160115-000011;48053;SELECT;Inpatient;SELECT;C:\Users\FGuo\Documents\work doucment\attachment\attachmentDB\20161005\originalFileFromAerial\DOCSVC_20161003.tar\DOCSVC_20161003\Sect2\INPATIENT\REQ_20160115-000011\Osario, Maria .SEA CREST HEALTH CARE CENTER, LLC.4.4.16_2016-04-04-11.36.49.263.pdf
Request;20160115-000012;57067;PACE;Inpatient;PACE;C:\Users\FGuo\Documents\work doucment\attachment\attachmentDB\20161005\originalFileFromAerial\DOCSVC_20161003.tar\DOCSVC_20161003\Sect2\INPATIENT\REQ_20160115-000012\Zhu, Xueru.ATLANTIS REHAB & RHCF.4.4.16_2016-04-04-11.46.55.172.pdf
Request;20160115-000012;57067;PACE;Inpatient;PACE;C:\Users\FGuo\Documents\work doucment\attachment\attachmentDB\20161005\originalFileFromAerial\DOCSVC_20161003.tar\DOCSVC_20161003\Sect2\INPATIENT\REQ_20160115-000012\Zhu, Xueru.ATLANTIS REHAB & RHCF.4.4.16_2016-04-04-11.55.50.256.pdf
Request;20160115-000016;55484;SELECT;Inpatient;SELECT;C:\Users\FGuo\Documents\work doucment\attachment\attachmentDB\20161005\originalFileFromAerial\DOCSVC_20161003.tar\DOCSVC_20161003\Sect2\INPATIENT\REQ_20160115-000016\Hernandez, Ramona.COBBLE HILL HEALTH CENTER.4.4.16_2016-04-04-12.12.07.920.pdf
Request;20160115-000016;55484;SELECT;Inpatient;SELECT;C:\Users\FGuo\Documents\work doucment\attachment\attachmentDB\20161005\originalFileFromAerial\DOCSVC_20161003.tar\DOCSVC_20161003\Sect2\INPATIENT\REQ_20160115-000016\Hernandez, Ramona.COBBLE HILL HEALTH CENTER.4.4.16_2016-04-04-12.37.13.518.pdf
Request;20160115-000016;55484;SELECT;Inpatient;SELECT;C:\Users\FGuo\Documents\work doucment\attachment\attachmentDB\20161005\originalFileFromAerial\DOCSVC_20161003.tar\DOCSVC_20161003\Sect2\INPATIENT\REQ_20160115-000016\Hernandez, Ramona.COBBLE HILL HEALTH CENTER.4.4.16_2016-04-06-09.34.26.490.pdf
Request;20160115-000016;55484;SELECT;Inpatient;SELECT;C:\Users\FGuo\Documents\work doucment\attachment\attachmentDB\20161005\originalFileFromAerial\DOCSVC_20161003.tar\DOCSVC_20161003\Sect2\INPATIENT\REQ_20160115-000016\Hernandez, Ramona.COBBLE HILL HEALTH CENTER.4.6.16_2016-04-06-10.03.04.97.pdf
Request;20160115-000017;76055;SELECT;Inpatient;SELECT;C:\Users\FGuo\Documents\work doucment\attachment\attachmentDB\20161005\originalFileFromAerial\DOCSVC_20161003.tar\DOCSVC_20161003\Sect2\INPATIENT\REQ_20160115-000017\Morales, Emmy.PENINSULA GENERAL NURSING HOME.4.4.16_2016-04-04-12.24.41.804.pdf
Request;20160115-000018;42354;PACE;Inpatient;PACE;C:\Users\FGuo\Documents\work doucment\attachment\attachmentDB\20161005\originalFileFromAerial\DOCSVC_20161003.tar\DOCSVC_20161003\Sect2\INPATIENT\REQ_20160115-000018\Perez, Maria A.CABS NURSING HOME COMPANY, INC..4.18.16_2016-04-18-11.26.38.75.pdf
Request;20160115-000018;42354;PACE;Inpatient;PACE;C:\Users\FGuo\Documents\work doucment\attachment\attachmentDB\20161005\originalFileFromAerial\DOCSVC_20161003.tar\DOCSVC_20161003\Sect2\INPATIENT\REQ_20160115-000018\Perez, Maria A.CABS NURSING HOME COMPANY, INC..4.4.16_2016-04-04-12.30.39.610.pdf
Request;20160115-000018;42354;PACE;Inpatient;PACE;C:\Users\FGuo\Documents\work doucment\attachment\attachmentDB\20161005\originalFileFromAerial\DOCSVC_20161003.tar\DOCSVC_20161003\Sect2\INPATIENT\REQ_20160115-000018\Perez, Maria A.CABS NURSING HOME COMPANY, INC..4.4.16_2016-04-11-14.20.28.307.pdf
Request;20160115-000022;20818;SELECT;Inpatient;SELECT;C:\Users\FGuo\Documents\work doucment\attachment\attachmentDB\20161005\originalFileFromAerial\DOCSVC_20161003.tar\DOCSVC_20161003\Sect2\INPATIENT\REQ_20160115-000022\Farley, Cordelia .FourSeasonsNH.4.4.16_2016-04-04-13.17.58.239.pdf
Request;20160115-000022;20818;SELECT;Inpatient;SELECT;C:\Users\FGuo\Documents\work doucment\attachment\attachmentDB\20161005\originalFileFromAerial\DOCSVC_20161003.tar\DOCSVC_20161003\Sect2\INPATIENT\REQ_20160115-000022\Farley, Cordelia_2016-07-12-12.03.59.690.tif
Request;20160115-000024;53341;SELECT;Inpatient;SELECT;C:\Users\FGuo\Documents\work doucment\attachment\attachmentDB\20161005\originalFileFromAerial\DOCSVC_20161003.tar\DOCSVC_20161003\Sect2\INPATIENT\REQ_20160115-000024\French, Graham .STATEN ISLAND CARE CENTER, LLC.4.4.16_2016-04-04-13.30.58.145.pdf
Request;20160115-000026;24101;SELECT;Inpatient;SELECT;C:\Users\FGuo\Documents\work doucment\attachment\attachmentDB\20161005\originalFileFromAerial\DOCSVC_20161003.tar\DOCSVC_20161003\Sect2\INPATIENT\REQ_20160115-000026\Maxi, Emmanuel W.SEA CREST HEALTH CARE CENTER, LLC.4.4.16_2016-04-04-14.49.58.437.pdf
Request;20160115-000028;26696;SELECT;Inpatient;SELECT;C:\Users\FGuo\Documents\work doucment\attachment\attachmentDB\20161005\originalFileFromAerial\DOCSVC_20161003.tar\DOCSVC_20161003\Sect2\INPATIENT\REQ_20160115-000028\ETTA GRANT_2016-07-20-11.23.39.319.tif
Request;20160115-000028;26696;SELECT;Inpatient;SELECT;C:\Users\FGuo\Documents\work doucment\attachment\attachmentDB\20161005\originalFileFromAerial\DOCSVC_20161003.tar\DOCSVC_20161003\Sect2\INPATIENT\REQ_20160115-000028\Grant, Etta - DITMAS PARK REHAB AND CARE CENTER 2  9.07.16_2016-09-07-10.10.24.898.pdf
Request;20160115-000028;26696;SELECT;Inpatient;SELECT;C:\Users\FGuo\Documents\work doucment\attachment\attachmentDB\20161005\originalFileFromAerial\DOCSVC_20161003.tar\DOCSVC_20161003\Sect2\INPATIENT\REQ_20160115-000028\Grant, Etta .DITMAS PARK REHAB AND CARE CENTER.4.4.16_2016-04-04-14.59.11.412.pdf
Request;20160115-000030;88231;SELECT;Inpatient;SELECT;C:\Users\FGuo\Documents\work doucment\attachment\attachmentDB\20161005\originalFileFromAerial\DOCSVC_20161003.tar\DOCSVC_20161003\Sect2\INPATIENT\REQ_20160115-000030\Wolynski, Anne.OXFORD NURSING HOME, INC.4.4.16_2016-04-04-15.10.04.565.pdf
Request;20160115-000033;44159;PACE;Inpatient;PACE;C:\Users\FGuo\Documents\work doucment\attachment\attachmentDB\20161005\originalFileFromAerial\DOCSVC_20161003.tar\DOCSVC_20161003\Sect2\INPATIENT\REQ_20160115-000033\Bondarenko, Margaryta.NEW VANDERBILT REHAB & CARE CENTER.4.4.16_2016-04-04-15.19.30.771.pdf
Request;20160115-000037;51783;null;Inpatient;SELECT;C:\Users\FGuo\Documents\work doucment\attachment\attachmentDB\20161005\originalFileFromAerial\DOCSVC_20161003.tar\DOCSVC_20161003\Sect2\INPATIENT\REQ_20160115-000037\robert Vaugh41316_2016-04-13-13.29.51.570.tif
Request;20160115-000037;51783;null;Inpatient;SELECT;C:\Users\FGuo\Documents\work doucment\attachment\attachmentDB\20161005\originalFileFromAerial\DOCSVC_20161003.tar\DOCSVC_20161003\Sect2\INPATIENT\REQ_20160115-000037\Vaughn, Robert W - Broadlawn Manor Nursing Care CT - 5.24.16_2016-05-24-15.28.06.360.pdf
Request;20160115-000037;51783;null;Inpatient;SELECT;C:\Users\FGuo\Documents\work doucment\attachment\attachmentDB\20161005\originalFileFromAerial\DOCSVC_20161003.tar\DOCSVC_20161003\Sect2\INPATIENT\REQ_20160115-000037\Vaughn, Robert w 517 83 SNF Service Authorization Approval PRAp6_2016-03-16-13.44.13.89.docx
Request;20160115-000043;54804;PACE;Inpatient;PACE;C:\Users\FGuo\Documents\work doucment\attachment\attachmentDB\20161005\originalFileFromAerial\DOCSVC_20161003.tar\DOCSVC_20161003\Sect2\INPATIENT\REQ_20160115-000043\Austin, Marie.UnionPlazaNH.4.4.16_2016-04-04-15.40.59.711.pdf
Request;20160115-000044;77679;PACE;Inpatient;PACE;C:\Users\FGuo\Documents\work doucment\attachment\attachmentDB\20161005\originalFileFromAerial\DOCSVC_20161003.tar\DOCSVC_20161003\Sect2\INPATIENT\REQ_20160115-000044\Stovall, Thelma.BethAbrahamHealthServices.4.4.16_2016-04-04-15.57.37.506.pdf
Request;20160115-000096;84134;SELECT;Inpatient;SELECT;C:\Users\FGuo\Documents\work doucment\attachment\attachmentDB\20161005\originalFileFromAerial\DOCSVC_20161003.tar\DOCSVC_20161003\Sect2\INPATIENT\REQ_20160115-000096\Gordon, Myrna  HAMILTON PARK NURSING AND REHABILITATION 4.1.16_2016-04-04-12.02.49.259.pdf
Request;20160119-000020;26614;PACE;Inpatient;PACE;C:\Users\FGuo\Documents\work doucment\attachment\attachmentDB\20161005\originalFileFromAerial\DOCSVC_20161003.tar\DOCSVC_20161003\Sect2\INPATIENT\REQ_20160119-000020\Mighty, Margaret - HIGHFIELD GARDENS CARE CENTER OF GR - 5.17_2016-05-17-15.57.06.190.pdf
Request;20160119-000101;60722;SELECT;Inpatient;SELECT;C:\Users\FGuo\Documents\work doucment\attachment\attachmentDB\20161005\originalFileFromAerial\DOCSVC_20161003.tar\DOCSVC_20161003\Sect2\INPATIENT\REQ_20160119-000101\JohnsonEllaR.PINE VALLEY CENTER, LLC.4.12.16_2016-04-12-09.39.26.836.pdf
Request;20160119-000101;60722;SELECT;Inpatient;SELECT;C:\Users\FGuo\Documents\work doucment\attachment\attachmentDB\20161005\originalFileFromAerial\DOCSVC_20161003.tar\DOCSVC_20161003\Sect2\INPATIENT\REQ_20160119-000101\JohnsonEllaR.PINE VALLEY CENTER, LLC.4.12.16_2016-04-12-16.20.30.478.pdf
Request;20160119-000102;60721;SELECT;Inpatient;SELECT;C:\Users\FGuo\Documents\work doucment\attachment\attachmentDB\20161005\originalFileFromAerial\DOCSVC_20161003.tar\DOCSVC_20161003\Sect2\INPATIENT\REQ_20160119-000102\Sussman, Peggy - Pine Valley Center  LLC  (Auth 20160119-000102 ) 2.17.16_2016-02-17-11.24.31.966.pdf
Request;20160119-000103;22382;SELECT;Inpatient;SELECT;C:\Users\FGuo\Documents\work doucment\attachment\attachmentDB\20161005\originalFileFromAerial\DOCSVC_20161003.tar\DOCSVC_20161003\Sect2\INPATIENT\REQ_20160119-000103\G_\Genis\Bronx\Posternak, Frida 22382- Clinicals_2016-02-03-13.26.05.113.TIF
Request;20160119-000103;22382;SELECT;Inpatient;SELECT;C:\Users\FGuo\Documents\work doucment\attachment\attachmentDB\20161005\originalFileFromAerial\DOCSVC_20161003.tar\DOCSVC_20161003\Sect2\INPATIENT\REQ_20160119-000103\Posternak, Frida- Seagate Rehabilitation And Health Care Center- 3.23.16_2016-03-23-16.25.33.69.pdf
Request;20160119-000104;60724;SELECT;Inpatient;SELECT;C:\Users\FGuo\Documents\work doucment\attachment\attachmentDB\20161005\originalFileFromAerial\DOCSVC_20161003.tar\DOCSVC_20161003\Sect2\INPATIENT\REQ_20160119-000104\Weglicki, Robert  - Pine Valley Center  LLC  (Auth 20160119-000104 ) 2.17.16_2016-02-17-11.31.27.408.pdf
Request;20160120-000007;27120;SELECT;Inpatient;SELECT;C:\Users\FGuo\Documents\work doucment\attachment\attachmentDB\20161005\originalFileFromAerial\DOCSVC_20161003.tar\DOCSVC_20161003\Sect2\INPATIENT\REQ_20160120-000007\Spektor, Aysa- Margaret Tietz Nursing and Rehabilitation Center 3.22.16_2016-03-22-16.41.21.143.pdf
Request;20160120-000065;60873;SELECT;Inpatient;SELECT;C:\Users\FGuo\Documents\work doucment\attachment\attachmentDB\20161005\originalFileFromAerial\DOCSVC_20161003.tar\DOCSVC_20161003\Sect2\INPATIENT\REQ_20160120-000065\TEOFILO WELCH_2016-09-21-10.14.18.29.tif
Request;20160120-000065;60873;SELECT;Inpatient;SELECT;C:\Users\FGuo\Documents\work doucment\attachment\attachmentDB\20161005\originalFileFromAerial\DOCSVC_20161003.tar\DOCSVC_20161003\Sect2\INPATIENT\REQ_20160120-000065\TEOFILO WELCH_2016-09-21-10.16.10.387.tif
Request;20160120-000065;60873;SELECT;Inpatient;SELECT;C:\Users\FGuo\Documents\work doucment\attachment\attachmentDB\20161005\originalFileFromAerial\DOCSVC_20161003.tar\DOCSVC_20161003\Sect2\INPATIENT\REQ_20160120-000065\Welch Teofilo Approval Letter Four Seasons Nursing Home 8.16.2016_2016-08-16-12.54.48.29.pdf
Request;20160120-000065;60873;SELECT;Inpatient;SELECT;C:\Users\FGuo\Documents\work doucment\attachment\attachmentDB\20161005\originalFileFromAerial\DOCSVC_20161003.tar\DOCSVC_20161003\Sect2\INPATIENT\REQ_20160120-000065\Welch, Teofilo - Four Seasons Nursing Home  - 4.12.16_2016-04-12-11.52.29.739.pdf
Request;20160121-000023;58350;PACE;Inpatient;PACE;C:\Users\FGuo\Documents\work doucment\attachment\attachmentDB\20161005\originalFileFromAerial\DOCSVC_20161003.tar\DOCSVC_20161003\Sect2\INPATIENT\REQ_20160121-000023\EungSKim.UNION PLAZA NURSING HOME.4.12.16_2016-04-12-15.13.39.226.pdf
Request;20160121-000026;94566;PACE;Inpatient;PACE;C:\Users\FGuo\Documents\work doucment\attachment\attachmentDB\20161005\originalFileFromAerial\DOCSVC_20161003.tar\DOCSVC_20161003\Sect2\INPATIENT\REQ_20160121-000026\Yee, Poyhar L - Union Plaza Nursing Home - 4.12.16_2016-04-12-15.08.36.735.pdf
Request;20160121-000064;42210;SELECT;Inpatient;SELECT;C:\Users\FGuo\Documents\work doucment\attachment\attachmentDB\20161005\originalFileFromAerial\DOCSVC_20161003.tar\DOCSVC_20161003\Sect2\INPATIENT\REQ_20160121-000064\Weng, Mary S . NORTHERN METROPOLITAN INC . 5.20.16._2016-05-20-16.24.46.649.pdf
Request;20160122-000039;38482;SELECT;Inpatient;SELECT;C:\Users\FGuo\Documents\work doucment\attachment\attachmentDB\20161005\originalFileFromAerial\DOCSVC_20161003.tar\DOCSVC_20161003\Sect2\INPATIENT\REQ_20160122-000039\Blyumin, Nata - SPRING CREEK REHABILITATION & NURSING CARE CENTER - 4.14.16_2016-04-14-09.33.02.337.pdf
Request;20160122-000041;25698;PACE;Inpatient;PACE;C:\Users\FGuo\Documents\work doucment\attachment\attachmentDB\20161005\originalFileFromAerial\DOCSVC_20161003.tar\DOCSVC_20161003\Sect2\INPATIENT\REQ_20160122-000041\Brown, Gregory -CENTER FOR NURSING AND REHABILITATION.5.25_2016-05-25-10.22.41.586.pdf
Request;20160122-000061;37151;PACE;Inpatient;PACE;C:\Users\FGuo\Documents\work doucment\attachment\attachmentDB\20161005\originalFileFromAerial\DOCSVC_20161003.tar\DOCSVC_20161003\Sect2\INPATIENT\REQ_20160122-000061\Benyaminpour, Molook - HIGHFIELD GARDENS CARE CENTER OF GR - 5.25_2016-05-25-12.42.10.549.pdf
Request;20160122-000061;37151;PACE;Inpatient;PACE;C:\Users\FGuo\Documents\work doucment\attachment\attachmentDB\20161005\originalFileFromAerial\DOCSVC_20161003.tar\DOCSVC_20161003\Sect2\INPATIENT\REQ_20160122-000061\Benyaminpour, Molook Approval Letter Highfield Gardens Care Center_2016-09-20-08.09.27.23.pdf
Request;20160122-000070;60874;SELECT;Inpatient;SELECT;C:\Users\FGuo\Documents\work doucment\attachment\attachmentDB\20161005\originalFileFromAerial\DOCSVC_20161003.tar\DOCSVC_20161003\Sect2\INPATIENT\REQ_20160122-000070\Garai, Ilona SEA CREST HEALTH CARE CENTER, LLC 5.25_2016-05-25-15.32.22.301.pdf
Request;20160122-000070;60874;SELECT;Inpatient;SELECT;C:\Users\FGuo\Documents\work doucment\attachment\attachmentDB\20161005\originalFileFromAerial\DOCSVC_20161003.tar\DOCSVC_20161003\Sect2\INPATIENT\REQ_20160122-000070\O_\nursing home documents\I Garai  60874_2016-03-08-16.08.47.16.tif
Request;20160122-000077;84024;PACE;Inpatient;PACE;C:\Users\FGuo\Documents\work doucment\attachment\attachmentDB\20161005\originalFileFromAerial\DOCSVC_20161003.tar\DOCSVC_20161003\Sect2\INPATIENT\REQ_20160122-000077\Donneys, Teresa . HOSPICE OF NEW YORK, LLC . 4.18.16_2016-04-18-09.26.17.787.pdf
Request;20160125-000040;36255;PACE;Inpatient;PACE;C:\Users\FGuo\Documents\work doucment\attachment\attachmentDB\20161005\originalFileFromAerial\DOCSVC_20161003.tar\DOCSVC_20161003\Sect2\INPATIENT\REQ_20160125-000040\Ellis, Sarah - Westchester Center for rehab & nursing - 4.26.16_2016-04-26-10.29.51.338.pdf
Request;20160125-000044;36368;SELECT;Inpatient;SELECT;C:\Users\FGuo\Documents\work doucment\attachment\attachmentDB\20161005\originalFileFromAerial\DOCSVC_20161003.tar\DOCSVC_20161003\Sect2\INPATIENT\REQ_20160125-000044\Dominguez, Frank.ST VINCENT DE PAUL RESIDENCE.4.18.16._2016-04-18-12.00.42.341.pdf
Request;20160125-000064;39066;PACE;Inpatient;PACE;C:\Users\FGuo\Documents\work doucment\attachment\attachmentDB\20161005\originalFileFromAerial\DOCSVC_20161003.tar\DOCSVC_20161003\Sect2\INPATIENT\REQ_20160125-000064\Chen, Bingyuan - NEW FRANKLIN REHABLITATION & HEALTH CARE FACILITY 8.29.16_2016-08-29-11.26.00.629.pdf
Request;20160125-000064;39066;PACE;Inpatient;PACE;C:\Users\FGuo\Documents\work doucment\attachment\attachmentDB\20161005\originalFileFromAerial\DOCSVC_20161003.tar\DOCSVC_20161003\Sect2\INPATIENT\REQ_20160125-000064\Chen, Bingyuan . NEW FRANKLIN REHABLITATION & HEALTH CARE FACILITY. 4.18.16_2016-04-18-15.41.01.564.pdf
Request;20160126-000016;40719;SELECT;Inpatient;SELECT;C:\Users\FGuo\Documents\work doucment\attachment\attachmentDB\20161005\originalFileFromAerial\DOCSVC_20161003.tar\DOCSVC_20161003\Sect2\INPATIENT\REQ_20160126-000016\Wedlake, Margaret- Eger Health Care & Rehab Center  4.18.16_2016-04-18-16.36.44.648.pdf
Request;20160126-000030;73996;PACE;Inpatient;PACE;C:\Users\FGuo\Documents\work doucment\attachment\attachmentDB\20161005\originalFileFromAerial\DOCSVC_20161003.tar\DOCSVC_20161003\Sect2\INPATIENT\REQ_20160126-000030\Garcia, Dalila  - Dumont Operating LLC DBA 4.19.16_2016-04-19-11.18.47.81.pdf
Request;20160126-000075;36966;PACE;Inpatient;Not Valued;C:\Users\FGuo\Documents\work doucment\attachment\attachmentDB\20161005\originalFileFromAerial\DOCSVC_20161003.tar\DOCSVC_20161003\Sect2\INPATIENT\REQ_20160126-000075\O_\Waters Place\Aerial\Auth Req_Clinicals\Ysaguirre.L.M___LenoxHill__Clinical Request Form_ 02.19.16_2016-02-19-14.51.48.557.docx
Request;20160126-000075;36966;PACE;Inpatient;Not Valued;C:\Users\FGuo\Documents\work doucment\attachment\attachmentDB\20161005\originalFileFromAerial\DOCSVC_20161003.tar\DOCSVC_20161003\Sect2\INPATIENT\REQ_20160126-000075\O_\Waters Place\Aerial\Auth Req_Clinicals\Ysaguirre.L.M___LenoxHill__Clinical Request Form_ 02.19.16_2016-02-23-08.57.16.513.docx
Request;20160126-000075;36966;PACE;Inpatient;Not Valued;C:\Users\FGuo\Documents\work doucment\attachment\attachmentDB\20161005\originalFileFromAerial\DOCSVC_20161003.tar\DOCSVC_20161003\Sect2\INPATIENT\REQ_20160126-000075\Ysaguirre.L.M___LenoxHill__Clinical Request Form_ 02.19.16_2016-02-23-08.58.14.486.docx
Request;20160128-000017;37824;SELECT;Inpatient;SELECT;C:\Users\FGuo\Documents\work doucment\attachment\attachmentDB\20161005\originalFileFromAerial\DOCSVC_20161003.tar\DOCSVC_20161003\Sect2\INPATIENT\REQ_20160128-000017\O_\Clinicals\BB Clinicals 3.2.16_2016-03-07-09.28.14.651.TIF
Request;20160128-000100;59019;SELECT;Inpatient;SELECT;C:\Users\FGuo\Documents\work doucment\attachment\attachmentDB\20161005\originalFileFromAerial\DOCSVC_20161003.tar\DOCSVC_20161003\Sect2\INPATIENT\REQ_20160128-000100\Anderson, Lorna M- Jacob Perlow Hospice Corporation  4.20.16_2016-04-20-16.00.35.886.pdf
Request;20160129-000071;34109;PACE;Inpatient;PACE;C:\Users\FGuo\Documents\work doucment\attachment\attachmentDB\20161005\originalFileFromAerial\DOCSVC_20161003.tar\DOCSVC_20161003\Sect2\INPATIENT\REQ_20160129-000071\marmol roberto21616_2016-02-17-12.57.38.260.tif
Request;20160129-000071;34109;PACE;Inpatient;PACE;C:\Users\FGuo\Documents\work doucment\attachment\attachmentDB\20161005\originalFileFromAerial\DOCSVC_20161003.tar\DOCSVC_20161003\Sect2\INPATIENT\REQ_20160129-000071\Marmol, Roberto - Workmens Circle Home- 6.1_2016-06-01-10.16.39.846.pdf
Request;20160201-000007;86498;SELECT;Inpatient;SELECT;C:\Users\FGuo\Documents\work doucment\attachment\attachmentDB\20161005\originalFileFromAerial\DOCSVC_20161003.tar\DOCSVC_20161003\Sect2\INPATIENT\REQ_20160201-000007\Giaimo, Frances - Margaret Tietz Nursing And Rehab Center-5.4.16_2016-05-04-11.39.07.915.pdf
Request;20160201-000008;86498;SELECT;Inpatient;SELECT;C:\Users\FGuo\Documents\work doucment\attachment\attachmentDB\20161005\originalFileFromAerial\DOCSVC_20161003.tar\DOCSVC_20161003\Sect2\INPATIENT\REQ_20160201-000008\...Giaimo, Frances - Margaret Tietz Nursing And Rehab Center-5.4.16_2016-05-04-11.40.57.15.pdf
Request;20160201-000010;27120;SELECT;Inpatient;SELECT;C:\Users\FGuo\Documents\work doucment\attachment\attachmentDB\20161005\originalFileFromAerial\DOCSVC_20161003.tar\DOCSVC_20161003\Sect2\INPATIENT\REQ_20160201-000010\Spektor, Asya - Margaret Tietz Nursing And Rehab Center - 5.4.16_2016-05-04-11.43.13.583.pdf
Request;20160201-000013;26813;PACE;Inpatient;PACE;C:\Users\FGuo\Documents\work doucment\attachment\attachmentDB\20161005\originalFileFromAerial\DOCSVC_20161003.tar\DOCSVC_20161003\Sect2\INPATIENT\REQ_20160201-000013\Allen, Margaret - Margaret Tietz Nursing And Rehab Center - 5.4.16_2016-05-04-11.46.19.224.pdf
Request;20160201-000014;26813;PACE;Inpatient;PACE;C:\Users\FGuo\Documents\work doucment\attachment\attachmentDB\20161005\originalFileFromAerial\DOCSVC_20161003.tar\DOCSVC_20161003\Sect2\INPATIENT\REQ_20160201-000014\. .Allen, Margaret - Margaret Tietz Nursing And Rehab Center - 5.4.16_2016-05-04-13.25.35.781.pdf
Request;20160201-000017;85374;PACE;Inpatient;PACE;C:\Users\FGuo\Documents\work doucment\attachment\attachmentDB\20161005\originalFileFromAerial\DOCSVC_20161003.tar\DOCSVC_20161003\Sect2\INPATIENT\REQ_20160201-000017\. GArcia, Guillermo - Margaret Tietz Nursing And Rehab Center - 5.4.16_2016-05-04-13.31.58.223.pdf
Request;20160201-000018;29251;PACE;Inpatient;PACE;C:\Users\FGuo\Documents\work doucment\attachment\attachmentDB\20161005\originalFileFromAerial\DOCSVC_20161003.tar\DOCSVC_20161003\Sect2\INPATIENT\REQ_20160201-000018\Lamberth, Scenna - Margaret Tietz Nursing And Rehab Center - 5.4.16_2016-05-04-13.34.27.212.pdf
Request;20160201-000022;46156;PACE;Inpatient;PACE;C:\Users\FGuo\Documents\work doucment\attachment\attachmentDB\20161005\originalFileFromAerial\DOCSVC_20161003.tar\DOCSVC_20161003\Sect2\INPATIENT\REQ_20160201-000022\Wright, Clara - Mayfair Care Center, Inc. - 5.4.16_2016-05-04-13.39.24.556.pdf
Request;20160201-000039;52231;SELECT;Inpatient;SELECT;C:\Users\FGuo\Documents\work doucment\attachment\attachmentDB\20161005\originalFileFromAerial\DOCSVC_20161003.tar\DOCSVC_20161003\Sect2\INPATIENT\REQ_20160201-000039\Greenfield, Josephine - Dumont Operating LLC DBA - 5.6.16_2016-05-06-14.54.32.651.pdf
Request;20160201-000052;56171;SELECT;Inpatient;SELECT;C:\Users\FGuo\Documents\work doucment\attachment\attachmentDB\20161005\originalFileFromAerial\DOCSVC_20161003.tar\DOCSVC_20161003\Sect2\INPATIENT\REQ_20160201-000052\Roberta Small TCC_2016-03-31-16.59.58.871.tif
Request;20160202-000021;38936;SELECT;Inpatient;SELECT;C:\Users\FGuo\Documents\work doucment\attachment\attachmentDB\20161005\originalFileFromAerial\DOCSVC_20161003.tar\DOCSVC_20161003\Sect2\INPATIENT\REQ_20160202-000021\Chan, Yukwan-  Atlantis Rehab & RHCF (Auth 20160202-000021) 2.29.16_2016-02-29-10.34.58.999.pdf
Request;20160202-000061;99664;PACE;Inpatient;PACE;C:\Users\FGuo\Documents\work doucment\attachment\attachmentDB\20161005\originalFileFromAerial\DOCSVC_20161003.tar\DOCSVC_20161003\Sect2\INPATIENT\REQ_20160202-000061\Kuang, Pei Qiong -.ATLANTIS REHAB & RHCF.- 6.1_2016-06-01-15.48.38.32.pdf
Request;20160202-000061;99664;PACE;Inpatient;PACE;C:\Users\FGuo\Documents\work doucment\attachment\attachmentDB\20161005\originalFileFromAerial\DOCSVC_20161003.tar\DOCSVC_20161003\Sect2\INPATIENT\REQ_20160202-000061\Kuang, Pei Qiong_2016-06-28-10.38.48.908.tif
Request;20160203-000046;60256;null;Inpatient;SELECT;C:\Users\FGuo\Documents\work doucment\attachment\attachmentDB\20161005\originalFileFromAerial\DOCSVC_20161003.tar\DOCSVC_20161003\Sect2\INPATIENT\REQ_20160203-000046\Mckenna, Joanna - Hilaire Farm Skilled Living & Rehabilitation Center, LLC - 7.11.16_2016-07-11-11.51.53.551.pdf
Request;20160203-000046;60256;null;Inpatient;SELECT;C:\Users\FGuo\Documents\work doucment\attachment\attachmentDB\20161005\originalFileFromAerial\DOCSVC_20161003.tar\DOCSVC_20161003\Sect2\INPATIENT\REQ_20160203-000046\Mckenna, Joanna 60256 BA-FAX1_1603031943190413_2016-03-04-15.04.52.644.TIF
Request;20160203-000046;60256;null;Inpatient;SELECT;C:\Users\FGuo\Documents\work doucment\attachment\attachmentDB\20161005\originalFileFromAerial\DOCSVC_20161003.tar\DOCSVC_20161003\Sect2\INPATIENT\REQ_20160203-000046\Mckenna, Joanna 60256 LTC BA-FAX1_1601262028526224_2016-03-03-14.03.12.124.TIF
Request;20160203-000046;60256;null;Inpatient;SELECT;C:\Users\FGuo\Documents\work doucment\attachment\attachmentDB\20161005\originalFileFromAerial\DOCSVC_20161003.tar\DOCSVC_20161003\Sect2\INPATIENT\REQ_20160203-000046\Mckenna, Joanna 60256 LTC BA-FAX1_1601262028526224_2016-03-04-15.05.05.504.TIF
Request;20160203-000046;60256;null;Inpatient;SELECT;C:\Users\FGuo\Documents\work doucment\attachment\attachmentDB\20161005\originalFileFromAerial\DOCSVC_20161003.tar\DOCSVC_20161003\Sect2\INPATIENT\REQ_20160203-000046\McKenna, Joanna Clinicals -5.5_2016-05-05-10.34.23.327.16
Request;20160203-000046;60256;null;Inpatient;SELECT;C:\Users\FGuo\Documents\work doucment\attachment\attachmentDB\20161005\originalFileFromAerial\DOCSVC_20161003.tar\DOCSVC_20161003\Sect2\INPATIENT\REQ_20160203-000046\Mckenna, Joanna-PORF_2016-06-30-11.40.27.853.pdf
Request;20160203-000059;26166;PACE;Inpatient;PACE;C:\Users\FGuo\Documents\work doucment\attachment\attachmentDB\20161005\originalFileFromAerial\DOCSVC_20161003.tar\DOCSVC_20161003\Sect2\INPATIENT\REQ_20160203-000059\AKBER, SHAHNAZ - BED HOLD_2016-03-08-12.40.20.866.docx
Request;20160203-000059;26166;PACE;Inpatient;PACE;C:\Users\FGuo\Documents\work doucment\attachment\attachmentDB\20161005\originalFileFromAerial\DOCSVC_20161003.tar\DOCSVC_20161003\Sect2\INPATIENT\REQ_20160203-000059\Akber, Shahnaz 26166-  Union Plaza Nursing Home  06-14-16_2016-06-14-16.52.21.715.pdf
Request;20160204-000049;61230;SELECT;Inpatient;SELECT;C:\Users\FGuo\Documents\work doucment\attachment\attachmentDB\20161005\originalFileFromAerial\DOCSVC_20161003.tar\DOCSVC_20161003\Sect2\INPATIENT\REQ_20160204-000049\O_\nursing home documents\D Peterson 61230.tif #2_2016-03-10-11.29.26.896.tif
Request;20160204-000049;61230;SELECT;Inpatient;SELECT;C:\Users\FGuo\Documents\work doucment\attachment\attachmentDB\20161005\originalFileFromAerial\DOCSVC_20161003.tar\DOCSVC_20161003\Sect2\INPATIENT\REQ_20160204-000049\O_\Waters Place\Letter Request\Peterson.D___ Approval Letter __Island Rehab and Nursing Center__03.22.16_2016-03-22-13.20.22.412.docx
Request;20160204-000049;61230;SELECT;Inpatient;SELECT;C:\Users\FGuo\Documents\work doucment\attachment\attachmentDB\20161005\originalFileFromAerial\DOCSVC_20161003.tar\DOCSVC_20161003\Sect2\INPATIENT\REQ_20160204-000049\Peterson.D___ Approval Letter __Island Rehab and Nursing Center__03.22.16_2016-03-22-13.21.38.215.docx
Request;20160205-000015;31755;SELECT;Inpatient;SELECT;C:\Users\FGuo\Documents\work doucment\attachment\attachmentDB\20161005\originalFileFromAerial\DOCSVC_20161003.tar\DOCSVC_20161003\Sect2\INPATIENT\REQ_20160205-000015\Yang, Ye - Atlantis Rehab & RHCF (Auth 20160205-000015) 3.3.16_2016-03-03-16.18.17.35.pdf
Request;20160205-000015;31755;SELECT;Inpatient;SELECT;C:\Users\FGuo\Documents\work doucment\attachment\attachmentDB\20161005\originalFileFromAerial\DOCSVC_20161003.tar\DOCSVC_20161003\Sect2\INPATIENT\REQ_20160205-000015\_2016-03-03-16.17.22.835
Request;20160205-000070;60247;SELECT;Inpatient;DIRECT/SELECT LT;C:\Users\FGuo\Documents\work doucment\attachment\attachmentDB\20161005\originalFileFromAerial\DOCSVC_20161003.tar\DOCSVC_20161003\Sect2\INPATIENT\REQ_20160205-000070\Laufer, Katherine - Schnurmacher Nursing Home 7-11-16_2016-07-11-13.58.17.979.pdf
Request;20160205-000070;60247;SELECT;Inpatient;DIRECT/SELECT LT;C:\Users\FGuo\Documents\work doucment\attachment\attachmentDB\20161005\originalFileFromAerial\DOCSVC_20161003.tar\DOCSVC_20161003\Sect2\INPATIENT\REQ_20160205-000070\Laufer, Katherine - Schnurmacher Nursing Home 7-11-16_2016-07-11-13.59.20.738.pdf
Request;20160208-000026;47367;SELECT;Inpatient;SELECT;C:\Users\FGuo\Documents\work doucment\attachment\attachmentDB\20161005\originalFileFromAerial\DOCSVC_20161003.tar\DOCSVC_20161003\Sect2\INPATIENT\REQ_20160208-000026\Holder, Muriel G -  Ditmas Park Rehab-Care Center - 3.25.16_2016-03-25-12.19.50.851.pdf
Request;20160208-000041;56514;PACE;Inpatient;PACE;C:\Users\FGuo\Documents\work doucment\attachment\attachmentDB\20161005\originalFileFromAerial\DOCSVC_20161003.tar\DOCSVC_20161003\Sect2\INPATIENT\REQ_20160208-000041\Mcquilkin, Lorrentine A - Beth Abraham Health Services - 3.25.16_2016-03-25-13.56.05.772.pdf
Request;20160209-000008;33517;null;Inpatient;SELECT;C:\Users\FGuo\Documents\work doucment\attachment\attachmentDB\20161005\originalFileFromAerial\DOCSVC_20161003.tar\DOCSVC_20161003\Sect2\INPATIENT\REQ_20160209-000008\Im, So Young  -Hamilton Park Nursing & Rehab (Auth 20160209-000008) 3.2.16_2016-03-02-13.53.43.585.pdf
Request;20160209-000008;33517;null;Inpatient;SELECT;C:\Users\FGuo\Documents\work doucment\attachment\attachmentDB\20161005\originalFileFromAerial\DOCSVC_20161003.tar\DOCSVC_20161003\Sect2\INPATIENT\REQ_20160209-000008\Im, So Young  -Hamilton Park Nursing & Rehab (Auth 20160209-000008) 3.2.16_2016-03-02-13.56.43.410.pdf
Request;20160209-000034;36711;PACE;Inpatient;PACE;C:\Users\FGuo\Documents\work doucment\attachment\attachmentDB\20161005\originalFileFromAerial\DOCSVC_20161003.tar\DOCSVC_20161003\Sect2\INPATIENT\REQ_20160209-000034\Cho, Kum C - Gouveneur Healthcare services- 3.25.16_2016-03-25-14.26.07.835.pdf
Request;20160209-000034;36711;PACE;Inpatient;PACE;C:\Users\FGuo\Documents\work doucment\attachment\attachmentDB\20161005\originalFileFromAerial\DOCSVC_20161003.tar\DOCSVC_20161003\Sect2\INPATIENT\REQ_20160209-000034\Cho, Kum C - GOUVERNEUR HEALTHCARE SERVICES 9.14.16_2016-09-14-11.37.43.480.pdf
Request;20160209-000077;33532;SELECT;Inpatient;SELECT;C:\Users\FGuo\Documents\work doucment\attachment\attachmentDB\20161005\originalFileFromAerial\DOCSVC_20161003.tar\DOCSVC_20161003\Sect2\INPATIENT\REQ_20160209-000077\Galan, edwin - Northern Manor Multicare Center 6-29-16_2016-06-29-16.07.18.590.pdf
Request;20160209-000077;33532;SELECT;Inpatient;SELECT;C:\Users\FGuo\Documents\work doucment\attachment\attachmentDB\20161005\originalFileFromAerial\DOCSVC_20161003.tar\DOCSVC_20161003\Sect2\INPATIENT\REQ_20160209-000077\galan, edwin_ PRI_2016-03-16-12.16.35.270.tif
Request;20160209-000077;33532;SELECT;Inpatient;SELECT;C:\Users\FGuo\Documents\work doucment\attachment\attachmentDB\20161005\originalFileFromAerial\DOCSVC_20161003.tar\DOCSVC_20161003\Sect2\INPATIENT\REQ_20160209-000077\galan, edwin_ progress_2016-03-16-12.16.55.783.tif
Request;20160209-000080;28683;PACE;Inpatient;PACE;C:\Users\FGuo\Documents\work doucment\attachment\attachmentDB\20161005\originalFileFromAerial\DOCSVC_20161003.tar\DOCSVC_20161003\Sect2\INPATIENT\REQ_20160209-000080\johnson robeert 22516_2016-02-25-16.10.03.275.tif
Request;20160209-000080;28683;PACE;Inpatient;PACE;C:\Users\FGuo\Documents\work doucment\attachment\attachmentDB\20161005\originalFileFromAerial\DOCSVC_20161003.tar\DOCSVC_20161003\Sect2\INPATIENT\REQ_20160209-000080\johnson robert 3316_2016-03-03-14.28.53.17.tif
Request;20160209-000080;28683;PACE;Inpatient;PACE;C:\Users\FGuo\Documents\work doucment\attachment\attachmentDB\20161005\originalFileFromAerial\DOCSVC_20161003.tar\DOCSVC_20161003\Sect2\INPATIENT\REQ_20160209-000080\johnson robert21816_2016-02-18-10.00.06.394.tif
Request;20160209-000083;59960;FIDA;Inpatient;FIDA;C:\Users\FGuo\Documents\work doucment\attachment\attachmentDB\20161005\originalFileFromAerial\DOCSVC_20161003.tar\DOCSVC_20161003\Sect2\INPATIENT\REQ_20160209-000083\Garcia, Hortencia - New Vanderbilt Rehab & Nursing Center - 3.28.16_2016-03-28-09.41.22.506.pdf
Request;20160210-000016;43615;SELECT;Inpatient;SELECT;C:\Users\FGuo\Documents\work doucment\attachment\attachmentDB\20161005\originalFileFromAerial\DOCSVC_20161003.tar\DOCSVC_20161003\Sect2\INPATIENT\REQ_20160210-000016\Yancey, James J - Northern Metropolitan INC - 3.28.16_2016-03-28-11.04.54.656.pdf
Request;20160210-000026;30335;PACE;Inpatient;PACE;C:\Users\FGuo\Documents\work doucment\attachment\attachmentDB\20161005\originalFileFromAerial\DOCSVC_20161003.tar\DOCSVC_20161003\Sect2\INPATIENT\REQ_20160210-000026\Berrios, Reinaldo  - Beth Abraham Health Services 7-7-16_2016-07-07-11.51.19.143.pdf
Request;20160210-000026;30335;PACE;Inpatient;PACE;C:\Users\FGuo\Documents\work doucment\attachment\attachmentDB\20161005\originalFileFromAerial\DOCSVC_20161003.tar\DOCSVC_20161003\Sect2\INPATIENT\REQ_20160210-000026\Berrios, Reinaldo  - Beth Abraham Health Services 7-7-16_2016-07-07-11.51.47.702.pdf
Request;20160210-000066;92442;PACE;Inpatient;PACE;C:\Users\FGuo\Documents\work doucment\attachment\attachmentDB\20161005\originalFileFromAerial\DOCSVC_20161003.tar\DOCSVC_20161003\Sect2\INPATIENT\REQ_20160210-000066\Lontoft, Thomas 92442 Beth Abraham_2016-07-11-12.26.37.358.pdf
Request;20160210-000066;92442;PACE;Inpatient;PACE;C:\Users\FGuo\Documents\work doucment\attachment\attachmentDB\20161005\originalFileFromAerial\DOCSVC_20161003.tar\DOCSVC_20161003\Sect2\INPATIENT\REQ_20160210-000066\O_\Scans\MX-M753N_20160309_093734_2016-03-09-10.45.55.739.pdf
Request;20160210-000066;92442;PACE;Inpatient;PACE;C:\Users\FGuo\Documents\work doucment\attachment\attachmentDB\20161005\originalFileFromAerial\DOCSVC_20161003.tar\DOCSVC_20161003\Sect2\INPATIENT\REQ_20160210-000066\O_\Scans\MX-M753N_20160309_093800_2016-03-09-10.44.28.936.pdf
Request;20160212-000051;76280;SELECT;Inpatient;SELECT;C:\Users\FGuo\Documents\work doucment\attachment\attachmentDB\20161005\originalFileFromAerial\DOCSVC_20161003.tar\DOCSVC_20161003\Sect2\INPATIENT\REQ_20160212-000051\Matveyeva, Galina - Shore View Nursing Home- 3.29.16_2016-03-29-11.40.17.874.pdf
Request;20160216-000023;52125;SELECT;Inpatient;SELECT;C:\Users\FGuo\Documents\work doucment\attachment\attachmentDB\20161005\originalFileFromAerial\DOCSVC_20161003.tar\DOCSVC_20161003\Sect2\INPATIENT\REQ_20160216-000023\lillian Scavone pri pt_2016-02-17-12.01.54.973.tif
Request;20160216-000023;52125;SELECT;Inpatient;SELECT;C:\Users\FGuo\Documents\work doucment\attachment\attachmentDB\20161005\originalFileFromAerial\DOCSVC_20161003.tar\DOCSVC_20161003\Sect2\INPATIENT\REQ_20160216-000023\Scavone, Lillian - Gurwin Jewish Nursing & Rehab Center - 3.29.16_2016-03-29-14.18.11.364.pdf
Request;20160216-000023;52125;SELECT;Inpatient;SELECT;C:\Users\FGuo\Documents\work doucment\attachment\attachmentDB\20161005\originalFileFromAerial\DOCSVC_20161003.tar\DOCSVC_20161003\Sect2\INPATIENT\REQ_20160216-000023\Scavone, Lillian 52125 NOTIFICATION OF SNF COPAY 2015_2016-02-22-12.54.48.879.doc
Request;20160216-000026;74810;PACE;Inpatient;PACE;C:\Users\FGuo\Documents\work doucment\attachment\attachmentDB\20161005\originalFileFromAerial\DOCSVC_20161003.tar\DOCSVC_20161003\Sect2\INPATIENT\REQ_20160216-000026\garcia neiredapri_2016-02-16-16.07.14.638.tif
Request;20160216-000026;74810;PACE;Inpatient;PACE;C:\Users\FGuo\Documents\work doucment\attachment\attachmentDB\20161005\originalFileFromAerial\DOCSVC_20161003.tar\DOCSVC_20161003\Sect2\INPATIENT\REQ_20160216-000026\Garcia, Nereida - Gouverneur Healthcare Services 07132016_2016-07-14-15.53.25.698.pdf
Request;20160216-000029;39189;PACE;Inpatient;PACE;C:\Users\FGuo\Documents\work doucment\attachment\attachmentDB\20161005\originalFileFromAerial\DOCSVC_20161003.tar\DOCSVC_20161003\Sect2\INPATIENT\REQ_20160216-000029\jamilla khan dc22316_2016-02-25-10.42.19.708.tif
Request;20160216-000029;39189;PACE;Inpatient;PACE;C:\Users\FGuo\Documents\work doucment\attachment\attachmentDB\20161005\originalFileFromAerial\DOCSVC_20161003.tar\DOCSVC_20161003\Sect2\INPATIENT\REQ_20160216-000029\jamillan khan 22416ur_2016-02-25-10.43.49.762.tif
Request;20160216-000029;39189;PACE;Inpatient;PACE;C:\Users\FGuo\Documents\work doucment\attachment\attachmentDB\20161005\originalFileFromAerial\DOCSVC_20161003.tar\DOCSVC_20161003\Sect2\INPATIENT\REQ_20160216-000029\Khan Jamilla IP Denial Elmhurst Hospital Center 3-9-16_2016-03-09-09.46.29.16.pdf
Request;20160216-000029;39189;PACE;Inpatient;PACE;C:\Users\FGuo\Documents\work doucment\attachment\attachmentDB\20161005\originalFileFromAerial\DOCSVC_20161003.tar\DOCSVC_20161003\Sect2\INPATIENT\REQ_20160216-000029\KHAN, JAMILA - CLINICAL REVIEW REQUEST_2016-02-22-14.31.15.166.doc
Request;20160216-000029;39189;PACE;Inpatient;PACE;C:\Users\FGuo\Documents\work doucment\attachment\attachmentDB\20161005\originalFileFromAerial\DOCSVC_20161003.tar\DOCSVC_20161003\Sect2\INPATIENT\REQ_20160216-000029\KHAN, JAMILA - CLINICAL REVIEW REQUEST_2016-02-22-14.41.09.990.doc
Request;20160216-000029;39189;PACE;Inpatient;PACE;C:\Users\FGuo\Documents\work doucment\attachment\attachmentDB\20161005\originalFileFromAerial\DOCSVC_20161003.tar\DOCSVC_20161003\Sect2\INPATIENT\REQ_20160216-000029\KHAN, JAMILLA CLINICAL REVIEW REQUEST FORM_2016-02-16-11.55.04.725.doc
Request;20160216-000033;45919;SELECT;Inpatient;SELECT;C:\Users\FGuo\Documents\work doucment\attachment\attachmentDB\20161005\originalFileFromAerial\DOCSVC_20161003.tar\DOCSVC_20161003\Sect2\INPATIENT\REQ_20160216-000033\O_\Clinicals\MJ Discharge Summary 3.1.16_2016-03-01-09.55.22.547.TIF
Request;20160216-000034;26283;PACE;Inpatient;PACE;C:\Users\FGuo\Documents\work doucment\attachment\attachmentDB\20161005\originalFileFromAerial\DOCSVC_20161003.tar\DOCSVC_20161003\Sect2\INPATIENT\REQ_20160216-000034\devi sushila 33116_2016-03-31-16.19.28.7.tif
Request;20160216-000034;26283;PACE;Inpatient;PACE;C:\Users\FGuo\Documents\work doucment\attachment\attachmentDB\20161005\originalFileFromAerial\DOCSVC_20161003.tar\DOCSVC_20161003\Sect2\INPATIENT\REQ_20160216-000034\devi sushila0216_2016-02-16-12.08.48.896.tif
Request;20160216-000034;26283;PACE;Inpatient;PACE;C:\Users\FGuo\Documents\work doucment\attachment\attachmentDB\20161005\originalFileFromAerial\DOCSVC_20161003.tar\DOCSVC_20161003\Sect2\INPATIENT\REQ_20160216-000034\devi sushila22516_2016-02-25-12.52.43.57.tif
Request;20160216-000034;26283;PACE;Inpatient;PACE;C:\Users\FGuo\Documents\work doucment\attachment\attachmentDB\20161005\originalFileFromAerial\DOCSVC_20161003.tar\DOCSVC_20161003\Sect2\INPATIENT\REQ_20160216-000034\devi sushila32116_2016-03-21-16.29.35.241.tif
Request;20160216-000034;26283;PACE;Inpatient;PACE;C:\Users\FGuo\Documents\work doucment\attachment\attachmentDB\20161005\originalFileFromAerial\DOCSVC_20161003.tar\DOCSVC_20161003\Sect2\INPATIENT\REQ_20160216-000034\Devi, Sushila - Queens Blvd. Extended Care  (Auth 20160216-000034) 2.16.16_2016-02-16-13.37.15.52.pdf
Request;20160216-000034;26283;PACE;Inpatient;PACE;C:\Users\FGuo\Documents\work doucment\attachment\attachmentDB\20161005\originalFileFromAerial\DOCSVC_20161003.tar\DOCSVC_20161003\Sect2\INPATIENT\REQ_20160216-000034\Devi, Sushila - Queens Boulevard Extended Care - 5.11.16_2016-05-11-12.10.00.472.pdf
Request;20160216-000034;26283;PACE;Inpatient;PACE;C:\Users\FGuo\Documents\work doucment\attachment\attachmentDB\20161005\originalFileFromAerial\DOCSVC_20161003.tar\DOCSVC_20161003\Sect2\INPATIENT\REQ_20160216-000034\Devi, Sushila - QUEENS BOULEVARD EXTENDED CARE 9.02.16_2016-09-02-16.34.34.20.pdf
Request;20160216-000035;33720;SELECT;Inpatient;SELECT;C:\Users\FGuo\Documents\work doucment\attachment\attachmentDB\20161005\originalFileFromAerial\DOCSVC_20161003.tar\DOCSVC_20161003\Sect2\INPATIENT\REQ_20160216-000035\Ellman, Norma L -  The Riverside - 3.29.16_2016-03-29-14.50.52.508.pdf
Request;20160216-000035;33720;SELECT;Inpatient;SELECT;C:\Users\FGuo\Documents\work doucment\attachment\attachmentDB\20161005\originalFileFromAerial\DOCSVC_20161003.tar\DOCSVC_20161003\Sect2\INPATIENT\REQ_20160216-000035\Ellman, Norma L - THE RIVERSIDE 9.12.16_2016-09-12-14.05.33.187.pdf
Request;20160216-000035;33720;SELECT;Inpatient;SELECT;C:\Users\FGuo\Documents\work doucment\attachment\attachmentDB\20161005\originalFileFromAerial\DOCSVC_20161003.tar\DOCSVC_20161003\Sect2\INPATIENT\REQ_20160216-000035\G_\Genis\Bronx\Ellman, Norma 33720- Clinicals_2016-02-16-12.10.47.496.TIF
Request;20160216-000037;89514;FIDA;Inpatient;FIDA;C:\Users\FGuo\Documents\work doucment\attachment\attachmentDB\20161005\originalFileFromAerial\DOCSVC_20161003.tar\DOCSVC_20161003\Sect2\INPATIENT\REQ_20160216-000037\89514 KEENE, GERTRUDE UR REQ SHEET_2016-02-22_2016-02-22-12.39.29.489.doc
Request;20160216-000037;89514;FIDA;Inpatient;FIDA;C:\Users\FGuo\Documents\work doucment\attachment\attachmentDB\20161005\originalFileFromAerial\DOCSVC_20161003.tar\DOCSVC_20161003\Sect2\INPATIENT\REQ_20160216-000037\Keene Gertrude - Interfaith Medical Center 2-26-16_2016-02-26-10.56.46.476.pdf
Request;20160216-000037;89514;FIDA;Inpatient;FIDA;C:\Users\FGuo\Documents\work doucment\attachment\attachmentDB\20161005\originalFileFromAerial\DOCSVC_20161003.tar\DOCSVC_20161003\Sect2\INPATIENT\REQ_20160216-000037\Keene Gertrude-2-14-16-Appeal_2016-03-31-10.00.55.624.pdf
Request;20160216-000037;89514;FIDA;Inpatient;FIDA;C:\Users\FGuo\Documents\work doucment\attachment\attachmentDB\20161005\originalFileFromAerial\DOCSVC_20161003.tar\DOCSVC_20161003\Sect2\INPATIENT\REQ_20160216-000037\Keene, Gertrude  89514_2016-02-23-11.36.17.621.doc
Request;20160216-000037;89514;FIDA;Inpatient;FIDA;C:\Users\FGuo\Documents\work doucment\attachment\attachmentDB\20161005\originalFileFromAerial\DOCSVC_20161003.tar\DOCSVC_20161003\Sect2\INPATIENT\REQ_20160216-000037\MX-3140N_20160226_100722_2016-02-26-10.52.30.749.pdf
Request;20160216-000037;89514;FIDA;Inpatient;FIDA;C:\Users\FGuo\Documents\work doucment\attachment\attachmentDB\20161005\originalFileFromAerial\DOCSVC_20161003.tar\DOCSVC_20161003\Sect2\INPATIENT\REQ_20160216-000037\O_\89514 KEENE, GERTRUDE UR REQ SHEET_2016-02-16-12.21.46.391.doc
Request;20160216-000047;72713;PACE;Inpatient;PACE;C:\Users\FGuo\Documents\work doucment\attachment\attachmentDB\20161005\originalFileFromAerial\DOCSVC_20161003.tar\DOCSVC_20161003\Sect2\INPATIENT\REQ_20160216-000047\3.23.16 Hattie Keith _2016-04-21-10.26.20.407.pdf
Request;20160216-000047;72713;PACE;Inpatient;PACE;C:\Users\FGuo\Documents\work doucment\attachment\attachmentDB\20161005\originalFileFromAerial\DOCSVC_20161003.tar\DOCSVC_20161003\Sect2\INPATIENT\REQ_20160216-000047\Keitt Hatie - Montefiore Medical Center 2-24-16_2016-02-24-10.40.13.352.pdf
Request;20160216-000047;72713;PACE;Inpatient;PACE;C:\Users\FGuo\Documents\work doucment\attachment\attachmentDB\20161005\originalFileFromAerial\DOCSVC_20161003.tar\DOCSVC_20161003\Sect2\INPATIENT\REQ_20160216-000047\KEITT, HATTIE - CLINICAL REVIEW REQUEST FORM_2016-02-16-13.16.53.541.doc
Request;20160216-000047;72713;PACE;Inpatient;PACE;C:\Users\FGuo\Documents\work doucment\attachment\attachmentDB\20161005\originalFileFromAerial\DOCSVC_20161003.tar\DOCSVC_20161003\Sect2\INPATIENT\REQ_20160216-000047\MX-3140N_20160224_142748_2016-02-24-15.15.15.61.pdf
Request;20160216-000049;38834;null;Inpatient;SELECT;C:\Users\FGuo\Documents\work doucment\attachment\attachmentDB\20161005\originalFileFromAerial\DOCSVC_20161003.tar\DOCSVC_20161003\Sect2\INPATIENT\REQ_20160216-000049\Drummer, Gitta -Hamilton Park Nursing & Rehab (Auth 20160216-000049 ) 3.2.16_2016-03-02-13.09.14.707.pdf
Request;20160216-000050;38834;null;Inpatient;SELECT;C:\Users\FGuo\Documents\work doucment\attachment\attachmentDB\20161005\originalFileFromAerial\DOCSVC_20161003.tar\DOCSVC_20161003\Sect2\INPATIENT\REQ_20160216-000050\Drummer Gitta - Hamilton Park Nursing & Rehab LTC Jan 29 to Feb 23  4-11-16_2016-04-11-16.09.45.253.pdf
Request;20160216-000050;38834;null;Inpatient;SELECT;C:\Users\FGuo\Documents\work doucment\attachment\attachmentDB\20161005\originalFileFromAerial\DOCSVC_20161003.tar\DOCSVC_20161003\Sect2\INPATIENT\REQ_20160216-000050\Drummer, Gitta -Hamilton Park Nursing & Rehab (Auth 20160216-000050) 3.2.16_2016-03-02-13.13.46.582.pdf
Request;20160216-000052;27447;null;Inpatient;DIRECT;C:\Users\FGuo\Documents\work doucment\attachment\attachmentDB\20161005\originalFileFromAerial\DOCSVC_20161003.tar\DOCSVC_20161003\Sect2\INPATIENT\REQ_20160216-000052\GLeifer_2016-02-18-11.54.13.208.tif
Request;20160216-000052;27447;null;Inpatient;DIRECT;C:\Users\FGuo\Documents\work doucment\attachment\attachmentDB\20161005\originalFileFromAerial\DOCSVC_20161003.tar\DOCSVC_20161003\Sect2\INPATIENT\REQ_20160216-000052\LEIFER, GERTRUDE - ADMISSION_2016-02-16-13.45.13.51.pdf
Request;20160216-000052;27447;null;Inpatient;DIRECT;C:\Users\FGuo\Documents\work doucment\attachment\attachmentDB\20161005\originalFileFromAerial\DOCSVC_20161003.tar\DOCSVC_20161003\Sect2\INPATIENT\REQ_20160216-000052\LEIFER, GERTRUDE - CLINICAL REVIEW REQUEST FORM_2016-02-16-13.49.19.496.doc
Request;20160216-000053;59187;PACE;Inpatient;PACE;C:\Users\FGuo\Documents\work doucment\attachment\attachmentDB\20161005\originalFileFromAerial\DOCSVC_20161003.tar\DOCSVC_20161003\Sect2\INPATIENT\REQ_20160216-000053\Cipriano Lucia-White Plains Hospital 2-16-16_2016-02-16-14.16.52.690.pdf
Request;20160216-000053;59187;PACE;Inpatient;PACE;C:\Users\FGuo\Documents\work doucment\attachment\attachmentDB\20161005\originalFileFromAerial\DOCSVC_20161003.tar\DOCSVC_20161003\Sect2\INPATIENT\REQ_20160216-000053\Cipriano, Lucia - White Plains Hospital Center 07182016_2016-07-18-12.36.00.815.pdf
Request;20160216-000053;59187;PACE;Inpatient;PACE;C:\Users\FGuo\Documents\work doucment\attachment\attachmentDB\20161005\originalFileFromAerial\DOCSVC_20161003.tar\DOCSVC_20161003\Sect2\INPATIENT\REQ_20160216-000053\Cipriano, Lucia_CLINICAL_2016-02-18-15.40.50.761.tif
Request;20160216-000053;59187;PACE;Inpatient;PACE;C:\Users\FGuo\Documents\work doucment\attachment\attachmentDB\20161005\originalFileFromAerial\DOCSVC_20161003.tar\DOCSVC_20161003\Sect2\INPATIENT\REQ_20160216-000053\CIP_CLINICAL_2016-02-18-15.48.00.917.tif
Request;20160216-000065;89366;null;Inpatient;SELECT;C:\Users\FGuo\Documents\work doucment\attachment\attachmentDB\20161005\originalFileFromAerial\DOCSVC_20161003.tar\DOCSVC_20161003\Sect2\INPATIENT\REQ_20160216-000065\Reyesalarcon, Juana A -The Riverside Nursing Home  (Auth 20160216-000065) 2.17.16_2016-02-17-14.28.36.331.pdf
Request;20160216-000068;34521;PACE;Inpatient;PACE;C:\Users\FGuo\Documents\work doucment\attachment\attachmentDB\20161005\originalFileFromAerial\DOCSVC_20161003.tar\DOCSVC_20161003\Sect2\INPATIENT\REQ_20160216-000068\Pointzes, Rebecca - Montefiore Medical Center 07182016_2016-07-18-13.20.00.603.pdf
Request;20160216-000068;34521;PACE;Inpatient;PACE;C:\Users\FGuo\Documents\work doucment\attachment\attachmentDB\20161005\originalFileFromAerial\DOCSVC_20161003.tar\DOCSVC_20161003\Sect2\INPATIENT\REQ_20160216-000068\POINTZES, REBECCA CLINICAL REVIEW REQUEST FORM_2016-02-16-16.41.32.785.doc
Request;20160216-000068;34521;PACE;Inpatient;PACE;C:\Users\FGuo\Documents\work doucment\attachment\attachmentDB\20161005\originalFileFromAerial\DOCSVC_20161003.tar\DOCSVC_20161003\Sect2\INPATIENT\REQ_20160216-000068\POINTZES, REBECCA_CLINICAL_2016-02-18-16.29.35.605.tif
Request;20160216-000069;28750;PACE;Inpatient;PACE;C:\Users\FGuo\Documents\work doucment\attachment\attachmentDB\20161005\originalFileFromAerial\DOCSVC_20161003.tar\DOCSVC_20161003\Sect2\INPATIENT\REQ_20160216-000069\3.23.16 Yury Volkov MR1_2016-04-21-11.16.26.819.pdf
Request;20160216-000069;28750;PACE;Inpatient;PACE;C:\Users\FGuo\Documents\work doucment\attachment\attachmentDB\20161005\originalFileFromAerial\DOCSVC_20161003.tar\DOCSVC_20161003\Sect2\INPATIENT\REQ_20160216-000069\3.23.16 Yury Volkov MR2_2016-04-21-11.17.24.45.pdf
Request;20160216-000069;28750;PACE;Inpatient;PACE;C:\Users\FGuo\Documents\work doucment\attachment\attachmentDB\20161005\originalFileFromAerial\DOCSVC_20161003.tar\DOCSVC_20161003\Sect2\INPATIENT\REQ_20160216-000069\3.23.16 Yury Volkov MR3_2016-04-21-11.18.12.913.pdf
Request;20160216-000069;28750;PACE;Inpatient;PACE;C:\Users\FGuo\Documents\work doucment\attachment\attachmentDB\20161005\originalFileFromAerial\DOCSVC_20161003.tar\DOCSVC_20161003\Sect2\INPATIENT\REQ_20160216-000069\Volkov Yuriy - Staten Island Univ Hospital North 3-2-16_2016-03-02-09.16.00.377.pdf
Request;20160216-000069;28750;PACE;Inpatient;PACE;C:\Users\FGuo\Documents\work doucment\attachment\attachmentDB\20161005\originalFileFromAerial\DOCSVC_20161003.tar\DOCSVC_20161003\Sect2\INPATIENT\REQ_20160216-000069\VOLKOV, YURIY - ADMISSION_2016-02-16-16.26.05.930.tif
Request;20160216-000069;28750;PACE;Inpatient;PACE;C:\Users\FGuo\Documents\work doucment\attachment\attachmentDB\20161005\originalFileFromAerial\DOCSVC_20161003.tar\DOCSVC_20161003\Sect2\INPATIENT\REQ_20160216-000069\VOLKOV, YURIY - CLINICAL REQUEST REVIEW_2016-02-25-13.02.47.51.doc
Request;20160216-000069;28750;PACE;Inpatient;PACE;C:\Users\FGuo\Documents\work doucment\attachment\attachmentDB\20161005\originalFileFromAerial\DOCSVC_20161003.tar\DOCSVC_20161003\Sect2\INPATIENT\REQ_20160216-000069\VOLKOV, YURIY - CLINICAL REVIEW REQUEST FORM_2016-02-16-16.56.49.232.doc
Request;20160216-000073;53009;SELECT;Inpatient;SELECT;C:\Users\FGuo\Documents\work doucment\attachment\attachmentDB\20161005\originalFileFromAerial\DOCSVC_20161003.tar\DOCSVC_20161003\Sect2\INPATIENT\REQ_20160216-000073\73 Fratto, Tommasina - Westchester Center for Rehabilitation and Nursing - 6.14.16_2016-06-14-10.56.03.538.pdf
Request;20160216-000073;53009;SELECT;Inpatient;SELECT;C:\Users\FGuo\Documents\work doucment\attachment\attachmentDB\20161005\originalFileFromAerial\DOCSVC_20161003.tar\DOCSVC_20161003\Sect2\INPATIENT\REQ_20160216-000073\FRATTO, THOMASINA_PRI_2016-02-18-16.51.57.108.tif
Request;20160217-000008;60318;DIRECT;Inpatient;DIRECT;C:\Users\FGuo\Documents\work doucment\attachment\attachmentDB\20161005\originalFileFromAerial\DOCSVC_20161003.tar\DOCSVC_20161003\Sect2\INPATIENT\REQ_20160217-000008\JMcdonald_2016-02-18-13.42.34.907.tif
Request;20160217-000008;60318;DIRECT;Inpatient;DIRECT;C:\Users\FGuo\Documents\work doucment\attachment\attachmentDB\20161005\originalFileFromAerial\DOCSVC_20161003.tar\DOCSVC_20161003\Sect2\INPATIENT\REQ_20160217-000008\McDonald Joan IP Denial Forest Hills Hospital 3-15-16_2016-03-15-16.48.49.554.pdf
Request;20160217-000008;60318;DIRECT;Inpatient;DIRECT;C:\Users\FGuo\Documents\work doucment\attachment\attachmentDB\20161005\originalFileFromAerial\DOCSVC_20161003.tar\DOCSVC_20161003\Sect2\INPATIENT\REQ_20160217-000008\MCDONALD, JOAN CLINICAL REVIEW REQUEST FORM_2016-02-17-11.01.24.760.doc
Request;20160217-000008;60318;DIRECT;Inpatient;DIRECT;C:\Users\FGuo\Documents\work doucment\attachment\attachmentDB\20161005\originalFileFromAerial\DOCSVC_20161003.tar\DOCSVC_20161003\Sect2\INPATIENT\REQ_20160217-000008\MCDONALD, JOAN_1OF5_040116_2016-05-16-14.16.42.228.pdf
Request;20160217-000008;60318;DIRECT;Inpatient;DIRECT;C:\Users\FGuo\Documents\work doucment\attachment\attachmentDB\20161005\originalFileFromAerial\DOCSVC_20161003.tar\DOCSVC_20161003\Sect2\INPATIENT\REQ_20160217-000008\MCDONALD, JOAN_2OF5_040116_2016-05-16-14.17.13.984.pdf
Request;20160217-000008;60318;DIRECT;Inpatient;DIRECT;C:\Users\FGuo\Documents\work doucment\attachment\attachmentDB\20161005\originalFileFromAerial\DOCSVC_20161003.tar\DOCSVC_20161003\Sect2\INPATIENT\REQ_20160217-000008\MCDONALD, JOAN_3OF5_040116_2016-05-16-14.17.48.371.pdf
Request;20160217-000008;60318;DIRECT;Inpatient;DIRECT;C:\Users\FGuo\Documents\work doucment\attachment\attachmentDB\20161005\originalFileFromAerial\DOCSVC_20161003.tar\DOCSVC_20161003\Sect2\INPATIENT\REQ_20160217-000008\MCDONALD, JOAN_4OF5_040116_2016-05-16-14.18.21.150.pdf
Request;20160217-000008;60318;DIRECT;Inpatient;DIRECT;C:\Users\FGuo\Documents\work doucment\attachment\attachmentDB\20161005\originalFileFromAerial\DOCSVC_20161003.tar\DOCSVC_20161003\Sect2\INPATIENT\REQ_20160217-000008\MCDONALD, JOAN_5OF5_040116_2016-05-16-14.18.49.689.pdf
Request;20160217-000010;60682;SELECT;Inpatient;SELECT;C:\Users\FGuo\Documents\work doucment\attachment\attachmentDB\20161005\originalFileFromAerial\DOCSVC_20161003.tar\DOCSVC_20161003\Sect2\INPATIENT\REQ_20160217-000010\O_\nursing home documents\C Perri 60682_2016-02-17-10.43.37.888.tif
Request;20160217-000010;60682;SELECT;Inpatient;SELECT;C:\Users\FGuo\Documents\work doucment\attachment\attachmentDB\20161005\originalFileFromAerial\DOCSVC_20161003.tar\DOCSVC_20161003\Sect2\INPATIENT\REQ_20160217-000010\Perri, Connie - Mills Pond  Nursing and Rehabilitation- 3.29.16_2016-03-29-16.47.27.995.pdf
Request;20160217-000013;36449;PACE;Inpatient;PACE;C:\Users\FGuo\Documents\work doucment\attachment\attachmentDB\20161005\originalFileFromAerial\DOCSVC_20161003.tar\DOCSVC_20161003\Sect2\INPATIENT\REQ_20160217-000013\Brown Louisa IP Denial Kingsbrook Jewish Medical Center 2-22-16_2016-02-22-15.50.25.103.pdf
Request;20160217-000013;36449;PACE;Inpatient;PACE;C:\Users\FGuo\Documents\work doucment\attachment\attachmentDB\20161005\originalFileFromAerial\DOCSVC_20161003.tar\DOCSVC_20161003\Sect2\INPATIENT\REQ_20160217-000013\Brown, Louisa  36449_2016-02-17-11.05.22.581.tif
Request;20160217-000013;36449;PACE;Inpatient;PACE;C:\Users\FGuo\Documents\work doucment\attachment\attachmentDB\20161005\originalFileFromAerial\DOCSVC_20161003.tar\DOCSVC_20161003\Sect2\INPATIENT\REQ_20160217-000013\BROWN, LOUISA  KINGSBROOK JEWISH MEDICAL CENTER_2016-02-17-11.09.44.271.doc
Request;20160217-000013;36449;PACE;Inpatient;PACE;C:\Users\FGuo\Documents\work doucment\attachment\attachmentDB\20161005\originalFileFromAerial\DOCSVC_20161003.tar\DOCSVC_20161003\Sect2\INPATIENT\REQ_20160217-000013\Brown, Louisa_clinical #2_2-17-16_2016-02-19-10.59.09.775.pdf
Request;20160217-000013;36449;PACE;Inpatient;PACE;C:\Users\FGuo\Documents\work doucment\attachment\attachmentDB\20161005\originalFileFromAerial\DOCSVC_20161003.tar\DOCSVC_20161003\Sect2\INPATIENT\REQ_20160217-000013\Brown, Louisa_clinical #3_2-17-16_2016-02-19-10.59.20.897.pdf
Request;20160217-000013;36449;PACE;Inpatient;PACE;C:\Users\FGuo\Documents\work doucment\attachment\attachmentDB\20161005\originalFileFromAerial\DOCSVC_20161003.tar\DOCSVC_20161003\Sect2\INPATIENT\REQ_20160217-000013\Brown, Louisa_clinical-PRI_2-18-16_2016-02-19-10.21.15.181.pdf
Request;20160217-000013;36449;PACE;Inpatient;PACE;C:\Users\FGuo\Documents\work doucment\attachment\attachmentDB\20161005\originalFileFromAerial\DOCSVC_20161003.tar\DOCSVC_20161003\Sect2\INPATIENT\REQ_20160217-000013\Brown, Louisa_clinical_2-16-16_2016-02-19-10.58.23.467.pdf
Request;20160217-000013;36449;PACE;Inpatient;PACE;C:\Users\FGuo\Documents\work doucment\attachment\attachmentDB\20161005\originalFileFromAerial\DOCSVC_20161003.tar\DOCSVC_20161003\Sect2\INPATIENT\REQ_20160217-000013\Brown, Louisa_clinical_2-17-16_2016-02-19-10.58.51.970.pdf
Request;20160217-000014;79013;PACE;Inpatient;PACE;C:\Users\FGuo\Documents\work doucment\attachment\attachmentDB\20161005\originalFileFromAerial\DOCSVC_20161003.tar\DOCSVC_20161003\Sect2\INPATIENT\REQ_20160217-000014\Zhang, Bao Yu - Atlantis Rehab & RHCF (Auth 20160217-000014) 3.4.16_2016-03-04-13.39.09.911.pdf
Request;20160217-000017;21111;PACE;Inpatient;PACE;C:\Users\FGuo\Documents\work doucment\attachment\attachmentDB\20161005\originalFileFromAerial\DOCSVC_20161003.tar\DOCSVC_20161003\Sect2\INPATIENT\REQ_20160217-000017\Johnson James IP Denial Woodhull Med & Mental Health Crt 2-22-16_2016-02-22-13.33.01.524.pdf
Request;20160217-000017;21111;PACE;Inpatient;PACE;C:\Users\FGuo\Documents\work doucment\attachment\attachmentDB\20161005\originalFileFromAerial\DOCSVC_20161003.tar\DOCSVC_20161003\Sect2\INPATIENT\REQ_20160217-000017\JOHNSON, JAMES_042716_2016-06-23-14.12.46.591.pdf
Request;20160217-000017;21111;PACE;Inpatient;PACE;C:\Users\FGuo\Documents\work doucment\attachment\attachmentDB\20161005\originalFileFromAerial\DOCSVC_20161003.tar\DOCSVC_20161003\Sect2\INPATIENT\REQ_20160217-000017\JOHNSON, JAMES_042716_2016-06-30-10.16.31.385.pdf
Request;20160217-000017;21111;PACE;Inpatient;PACE;C:\Users\FGuo\Documents\work doucment\attachment\attachmentDB\20161005\originalFileFromAerial\DOCSVC_20161003.tar\DOCSVC_20161003\Sect2\INPATIENT\REQ_20160217-000017\Johnson, James_clinical_2-17-16_2016-02-19-12.08.19.70.pdf
Request;20160217-000020;55490;DIRECT;Inpatient;DIRECT;C:\Users\FGuo\Documents\work doucment\attachment\attachmentDB\20161005\originalFileFromAerial\DOCSVC_20161003.tar\DOCSVC_20161003\Sect2\INPATIENT\REQ_20160217-000020\KEHOE, PATRICIA  55490 BROOKLYN HOSPITAL_2016-02-17-11.46.40.895.docx
Request;20160217-000020;55490;DIRECT;Inpatient;DIRECT;C:\Users\FGuo\Documents\work doucment\attachment\attachmentDB\20161005\originalFileFromAerial\DOCSVC_20161003.tar\DOCSVC_20161003\Sect2\INPATIENT\REQ_20160217-000020\Kehoe, Patricia  55490_2016-02-17-11.42.01.389.tif
Request;20160217-000020;55490;DIRECT;Inpatient;DIRECT;C:\Users\FGuo\Documents\work doucment\attachment\attachmentDB\20161005\originalFileFromAerial\DOCSVC_20161003.tar\DOCSVC_20161003\Sect2\INPATIENT\REQ_20160217-000020\Kehoe, Patricia - Brooklyn Hospital Center 07202016_2016-07-20-10.22.59.692.pdf
Request;20160217-000023;38395;SELECT;Inpatient;SELECT;C:\Users\FGuo\Documents\work doucment\attachment\attachmentDB\20161005\originalFileFromAerial\DOCSVC_20161003.tar\DOCSVC_20161003\Sect2\INPATIENT\REQ_20160217-000023\G_\Genis\CoPay Letter\Savarese, Vincent 38395- FAX NOTIFICATION OF SNF COPAY (2)_2016-02-22-11.07.44.278.doc
Request;20160217-000023;38395;SELECT;Inpatient;SELECT;C:\Users\FGuo\Documents\work doucment\attachment\attachmentDB\20161005\originalFileFromAerial\DOCSVC_20161003.tar\DOCSVC_20161003\Sect2\INPATIENT\REQ_20160217-000023\savarese vincent21616_2016-02-17-12.29.51.228.tif
Request;20160217-000023;38395;SELECT;Inpatient;SELECT;C:\Users\FGuo\Documents\work doucment\attachment\attachmentDB\20161005\originalFileFromAerial\DOCSVC_20161003.tar\DOCSVC_20161003\Sect2\INPATIENT\REQ_20160217-000023\Savarese, Vincent - Oasis Rehabilitation and Nursing LLC 07142016_2016-07-15-09.22.53.842.pdf
Request;20160217-000024;97989;PACE;Inpatient;PACE;C:\Users\FGuo\Documents\work doucment\attachment\attachmentDB\20161005\originalFileFromAerial\DOCSVC_20161003.tar\DOCSVC_20161003\Sect2\INPATIENT\REQ_20160217-000024\Green Sinclair - Mt. Sinai Hospital 2-26-16_2016-02-26-11.00.20.366.pdf
Request;20160217-000024;97989;PACE;Inpatient;PACE;C:\Users\FGuo\Documents\work doucment\attachment\attachmentDB\20161005\originalFileFromAerial\DOCSVC_20161003.tar\DOCSVC_20161003\Sect2\INPATIENT\REQ_20160217-000024\GreenS__Mt.Sinai__Clinical Request Form_ 02.17.16docx_2016-02-17-12.52.13.219.docx
Request;20160217-000024;97989;PACE;Inpatient;PACE;C:\Users\FGuo\Documents\work doucment\attachment\attachmentDB\20161005\originalFileFromAerial\DOCSVC_20161003.tar\DOCSVC_20161003\Sect2\INPATIENT\REQ_20160217-000024\MX-3140N_20160226_100656_2016-02-26-11.00.56.387.pdf
Request;20160217-000027;86928;PACE;Inpatient;PACE;C:\Users\FGuo\Documents\work doucment\attachment\attachmentDB\20161005\originalFileFromAerial\DOCSVC_20161003.tar\DOCSVC_20161003\Sect2\INPATIENT\REQ_20160217-000027\SHIUNG, SU LO - ADMISSION_2016-02-17-13.10.50.766.pdf
Request;20160217-000027;86928;PACE;Inpatient;PACE;C:\Users\FGuo\Documents\work doucment\attachment\attachmentDB\20161005\originalFileFromAerial\DOCSVC_20161003.tar\DOCSVC_20161003\Sect2\INPATIENT\REQ_20160217-000027\SHIUNG, SU LO - CLINICAL REVIEW REQUEST FORM_2016-02-17-13.17.38.603.doc
Request;20160217-000027;86928;PACE;Inpatient;PACE;C:\Users\FGuo\Documents\work doucment\attachment\attachmentDB\20161005\originalFileFromAerial\DOCSVC_20161003.tar\DOCSVC_20161003\Sect2\INPATIENT\REQ_20160217-000027\SHIUNG, SU LO - WALKER_2016-02-24-16.12.15.745.pdf
Request;20160217-000027;86928;PACE;Inpatient;PACE;C:\Users\FGuo\Documents\work doucment\attachment\attachmentDB\20161005\originalFileFromAerial\DOCSVC_20161003.tar\DOCSVC_20161003\Sect2\INPATIENT\REQ_20160217-000027\SLShiung_2016-02-17-15.57.50.31.tif
Request;20160217-000030;49752;PACE;Inpatient;PACE;C:\Users\FGuo\Documents\work doucment\attachment\attachmentDB\20161005\originalFileFromAerial\DOCSVC_20161003.tar\DOCSVC_20161003\Sect2\INPATIENT\REQ_20160217-000030\O_\Waters Place\Aerial\Medical Doc Rcvd\Williams.R___SouthNassauCH__AdmissionReport__02.23.16_2016-02-23-08.52.00.925.tif
Request;20160217-000030;49752;PACE;Inpatient;PACE;C:\Users\FGuo\Documents\work doucment\attachment\attachmentDB\20161005\originalFileFromAerial\DOCSVC_20161003.tar\DOCSVC_20161003\Sect2\INPATIENT\REQ_20160217-000030\rosa williams22416_2016-02-24-19.57.19.961.tif
Request;20160217-000030;49752;PACE;Inpatient;PACE;C:\Users\FGuo\Documents\work doucment\attachment\attachmentDB\20161005\originalFileFromAerial\DOCSVC_20161003.tar\DOCSVC_20161003\Sect2\INPATIENT\REQ_20160217-000030\Williams, Rosa - South Nassau Communities Hospital - 4.6.16_2016-04-06-14.21.46.511.pdf
Request;20160217-000030;49752;PACE;Inpatient;PACE;C:\Users\FGuo\Documents\work doucment\attachment\attachmentDB\20161005\originalFileFromAerial\DOCSVC_20161003.tar\DOCSVC_20161003\Sect2\INPATIENT\REQ_20160217-000030\WilliamsR__SouthNassauCommunity___ Clinical Request Form_ 02.17.16_2016-02-17-14.05.14.535.docx
Request;20160217-000036;60829;SELECT;Inpatient;SELECT;C:\Users\FGuo\Documents\work doucment\attachment\attachmentDB\20161005\originalFileFromAerial\DOCSVC_20161003.tar\DOCSVC_20161003\Sect2\INPATIENT\REQ_20160217-000036\Nochomovits Laura 1-1-16 ._2016-02-18-14.49.52.722.tif
Request;20160217-000036;60829;SELECT;Inpatient;SELECT;C:\Users\FGuo\Documents\work doucment\attachment\attachmentDB\20161005\originalFileFromAerial\DOCSVC_20161003.tar\DOCSVC_20161003\Sect2\INPATIENT\REQ_20160217-000036\Nochomovits, Laura  - Northern Metropolitan INC - 4.4.16_2016-04-04-14.41.44.935.pdf
Request;20160217-000038;98735;PACE;Inpatient;PACE;C:\Users\FGuo\Documents\work doucment\attachment\attachmentDB\20161005\originalFileFromAerial\DOCSVC_20161003.tar\DOCSVC_20161003\Sect2\INPATIENT\REQ_20160217-000038\MR Piteo, Grace 041216_2016-05-27-11.27.22.480.pdf
Request;20160217-000038;98735;PACE;Inpatient;PACE;C:\Users\FGuo\Documents\work doucment\attachment\attachmentDB\20161005\originalFileFromAerial\DOCSVC_20161003.tar\DOCSVC_20161003\Sect2\INPATIENT\REQ_20160217-000038\Piteo Grace IP Denial Lawrence Hospital 3-16-16_2016-03-16-11.58.46.336.pdf
Request;20160217-000038;98735;PACE;Inpatient;PACE;C:\Users\FGuo\Documents\work doucment\attachment\attachmentDB\20161005\originalFileFromAerial\DOCSVC_20161003.tar\DOCSVC_20161003\Sect2\INPATIENT\REQ_20160217-000038\PITEO, GRACE - CLINICAL REVIEW REQUEST FORM_2016-02-17-16.21.56.414.doc
Request;20160217-000038;98735;PACE;Inpatient;PACE;C:\Users\FGuo\Documents\work doucment\attachment\attachmentDB\20161005\originalFileFromAerial\DOCSVC_20161003.tar\DOCSVC_20161003\Sect2\INPATIENT\REQ_20160217-000038\PITEO, GRACE_CLINICAL_2016-02-18-13.12.06.695.tif
Request;20160217-000039;97688;PACE;Inpatient;PACE;C:\Users\FGuo\Documents\work doucment\attachment\attachmentDB\20161005\originalFileFromAerial\DOCSVC_20161003.tar\DOCSVC_20161003\Sect2\INPATIENT\REQ_20160217-000039\Simmons, Joseph - Montefiore Medical Center 07182016_2016-07-18-13.06.48.930.pdf
Request;20160217-000039;97688;PACE;Inpatient;PACE;C:\Users\FGuo\Documents\work doucment\attachment\attachmentDB\20161005\originalFileFromAerial\DOCSVC_20161003.tar\DOCSVC_20161003\Sect2\INPATIENT\REQ_20160217-000039\SIMMONS, JOSEPH CLINICAL REVIEW REQUEST FORM_2016-02-17-15.35.08.569.doc
Request;20160217-000039;97688;PACE;Inpatient;PACE;C:\Users\FGuo\Documents\work doucment\attachment\attachmentDB\20161005\originalFileFromAerial\DOCSVC_20161003.tar\DOCSVC_20161003\Sect2\INPATIENT\REQ_20160217-000039\SIMMONS, JOSEPH_CLINICAL_2016-02-18-16.01.08.590.tif
Request;20160217-000041;88465;PACE;Inpatient;PACE;C:\Users\FGuo\Documents\work doucment\attachment\attachmentDB\20161005\originalFileFromAerial\DOCSVC_20161003.tar\DOCSVC_20161003\Sect2\INPATIENT\REQ_20160217-000041\howard kathleen3116_2016-03-02-13.02.58.61.tif
Request;20160217-000041;88465;PACE;Inpatient;PACE;C:\Users\FGuo\Documents\work doucment\attachment\attachmentDB\20161005\originalFileFromAerial\DOCSVC_20161003.tar\DOCSVC_20161003\Sect2\INPATIENT\REQ_20160217-000041\howard kathleen32316_2016-03-23-10.07.27.882.tif
Request;20160217-000041;88465;PACE;Inpatient;PACE;C:\Users\FGuo\Documents\work doucment\attachment\attachmentDB\20161005\originalFileFromAerial\DOCSVC_20161003.tar\DOCSVC_20161003\Sect2\INPATIENT\REQ_20160217-000041\Howard, Kathleen - Four Seasons Nursing Home 2 - 3.31.16_2016-03-31-15.45.54.827.pdf
Request;20160217-000041;88465;PACE;Inpatient;PACE;C:\Users\FGuo\Documents\work doucment\attachment\attachmentDB\20161005\originalFileFromAerial\DOCSVC_20161003.tar\DOCSVC_20161003\Sect2\INPATIENT\REQ_20160217-000041\Howard, Kathleen_notes-PRI_2-11-16_2016-02-17-15.39.26.190.pdf
Request;20160217-000041;88465;PACE;Inpatient;PACE;C:\Users\FGuo\Documents\work doucment\attachment\attachmentDB\20161005\originalFileFromAerial\DOCSVC_20161003.tar\DOCSVC_20161003\Sect2\INPATIENT\REQ_20160217-000041\Howard, Kathleen_progress notes_2-19-16_2016-02-19-16.33.45.398.pdf
Request;20160217-000041;88465;PACE;Inpatient;PACE;C:\Users\FGuo\Documents\work doucment\attachment\attachmentDB\20161005\originalFileFromAerial\DOCSVC_20161003.tar\DOCSVC_20161003\Sect2\INPATIENT\REQ_20160217-000041\kathleen Howard 22416_2016-02-24-16.24.00.85.tif
Request;20160217-000041;88465;PACE;Inpatient;PACE;C:\Users\FGuo\Documents\work doucment\attachment\attachmentDB\20161005\originalFileFromAerial\DOCSVC_20161003.tar\DOCSVC_20161003\Sect2\INPATIENT\REQ_20160217-000041\kathleen Howard 31416_2016-03-14-11.06.32.241.tif
Request;20160217-000041;88465;PACE;Inpatient;PACE;C:\Users\FGuo\Documents\work doucment\attachment\attachmentDB\20161005\originalFileFromAerial\DOCSVC_20161003.tar\DOCSVC_20161003\Sect2\INPATIENT\REQ_20160217-000041\kathleen Howard 31416_2016-03-15-16.27.57.98.tif
Request;20160217-000041;88465;PACE;Inpatient;PACE;C:\Users\FGuo\Documents\work doucment\attachment\attachmentDB\20161005\originalFileFromAerial\DOCSVC_20161003.tar\DOCSVC_20161003\Sect2\INPATIENT\REQ_20160217-000041\kathleen Howard 31516a_2016-03-15-16.29.42.281.tif
Request;20160217-000041;88465;PACE;Inpatient;PACE;C:\Users\FGuo\Documents\work doucment\attachment\attachmentDB\20161005\originalFileFromAerial\DOCSVC_20161003.tar\DOCSVC_20161003\Sect2\INPATIENT\REQ_20160217-000041\kathleen howard32916_2016-03-29-17.19.25.458.tif
Request;20160217-000042;25132;PACE;Inpatient;PACE;C:\Users\FGuo\Documents\work doucment\attachment\attachmentDB\20161005\originalFileFromAerial\DOCSVC_20161003.tar\DOCSVC_20161003\Sect2\INPATIENT\REQ_20160217-000042\Dasouza Isaac IP Denial Kingsbrook Jewish Medical Center 2-22-16_2016-02-22-09.45.38.381.pdf
Request;20160217-000042;25132;PACE;Inpatient;PACE;C:\Users\FGuo\Documents\work doucment\attachment\attachmentDB\20161005\originalFileFromAerial\DOCSVC_20161003.tar\DOCSVC_20161003\Sect2\INPATIENT\REQ_20160217-000042\DASOUZA, ISAAC N CLINICAL REVIEW REQUEST FORM_2016-02-17-15.52.35.163.doc
Request;20160217-000042;25132;PACE;Inpatient;PACE;C:\Users\FGuo\Documents\work doucment\attachment\attachmentDB\20161005\originalFileFromAerial\DOCSVC_20161003.tar\DOCSVC_20161003\Sect2\INPATIENT\REQ_20160217-000042\DASOUZA, ISAAC N_040416_MR_2016-05-16-12.23.10.672.pdf
Request;20160217-000042;25132;PACE;Inpatient;PACE;C:\Users\FGuo\Documents\work doucment\attachment\attachmentDB\20161005\originalFileFromAerial\DOCSVC_20161003.tar\DOCSVC_20161003\Sect2\INPATIENT\REQ_20160217-000042\Dasouza, Isaac_initial clinical--2-15-16_2016-02-19-11.28.59.326.pdf
Request;20160217-000048;44378;PACE;Inpatient;PACE;C:\Users\FGuo\Documents\work doucment\attachment\attachmentDB\20161005\originalFileFromAerial\DOCSVC_20161003.tar\DOCSVC_20161003\Sect2\INPATIENT\REQ_20160217-000048\MX-3140N_20160224_142702_2016-02-24-15.08.55.247.pdf
Request;20160217-000048;44378;PACE;Inpatient;PACE;C:\Users\FGuo\Documents\work doucment\attachment\attachmentDB\20161005\originalFileFromAerial\DOCSVC_20161003.tar\DOCSVC_20161003\Sect2\INPATIENT\REQ_20160217-000048\Quinones Antonio - Montefiore Medical Center 2-24-16_2016-02-24-10.45.00.963.pdf
Request;20160217-000048;44378;PACE;Inpatient;PACE;C:\Users\FGuo\Documents\work doucment\attachment\attachmentDB\20161005\originalFileFromAerial\DOCSVC_20161003.tar\DOCSVC_20161003\Sect2\INPATIENT\REQ_20160217-000048\QUINONES, ANTOINIO  - CLINICAL REVIEW REQUEST FORM_2016-02-17-16.25.52.557.doc
Request;20160217-000051;29027;PACE;Inpatient;PACE;C:\Users\FGuo\Documents\work doucment\attachment\attachmentDB\20161005\originalFileFromAerial\DOCSVC_20161003.tar\DOCSVC_20161003\Sect2\INPATIENT\REQ_20160217-000051\gupta lajwanti22416_2016-02-24-20.12.19.897.tif
Request;20160217-000051;29027;PACE;Inpatient;PACE;C:\Users\FGuo\Documents\work doucment\attachment\attachmentDB\20161005\originalFileFromAerial\DOCSVC_20161003.tar\DOCSVC_20161003\Sect2\INPATIENT\REQ_20160217-000051\Gupta, Lajwanti  - Long Island Jewish Medical Center  8-16-17_2016-08-17-09.52.50.782.pdf
Request;20160217-000051;29027;PACE;Inpatient;PACE;C:\Users\FGuo\Documents\work doucment\attachment\attachmentDB\20161005\originalFileFromAerial\DOCSVC_20161003.tar\DOCSVC_20161003\Sect2\INPATIENT\REQ_20160217-000051\GUPTA, LAJWANTI - CLINICAL REVIEW REQUEST_2016-02-22-14.37.07.466.doc
Request;20160217-000051;29027;PACE;Inpatient;PACE;C:\Users\FGuo\Documents\work doucment\attachment\attachmentDB\20161005\originalFileFromAerial\DOCSVC_20161003.tar\DOCSVC_20161003\Sect2\INPATIENT\REQ_20160217-000051\GUPTA, LAJWANTI - CLINICAL REVIEW REQUEST_2016-02-22-14.40.05.418.doc
Request;20160217-000051;29027;PACE;Inpatient;PACE;C:\Users\FGuo\Documents\work doucment\attachment\attachmentDB\20161005\originalFileFromAerial\DOCSVC_20161003.tar\DOCSVC_20161003\Sect2\INPATIENT\REQ_20160217-000051\O_\29027 GUPTA, LAJWANTI UR REQ SHEET_2016-02-17-16.42.51.573.doc
Request;20160217-000053;42854;PACE;Inpatient;PACE;C:\Users\FGuo\Documents\work doucment\attachment\attachmentDB\20161005\originalFileFromAerial\DOCSVC_20161003.tar\DOCSVC_20161003\Sect2\INPATIENT\REQ_20160217-000053\garcia juana 21716_2016-02-17-17.00.16.73.tif
Request;20160217-000053;42854;PACE;Inpatient;PACE;C:\Users\FGuo\Documents\work doucment\attachment\attachmentDB\20161005\originalFileFromAerial\DOCSVC_20161003.tar\DOCSVC_20161003\Sect2\INPATIENT\REQ_20160217-000053\Garcia, Juana_2016-06-14-16.04.48.590.tif
Request;20160217-000053;42854;PACE;Inpatient;PACE;C:\Users\FGuo\Documents\work doucment\attachment\attachmentDB\20161005\originalFileFromAerial\DOCSVC_20161003.tar\DOCSVC_20161003\Sect2\INPATIENT\REQ_20160217-000053\Garcia, Juana_2016-06-14-16.11.59.877.tif
Request;20160217-000053;42854;PACE;Inpatient;PACE;C:\Users\FGuo\Documents\work doucment\attachment\attachmentDB\20161005\originalFileFromAerial\DOCSVC_20161003.tar\DOCSVC_20161003\Sect2\INPATIENT\REQ_20160217-000053\juana garcia31016_2016-03-10-15.45.52.223.tif
Request;20160217-000053;42854;PACE;Inpatient;PACE;C:\Users\FGuo\Documents\work doucment\attachment\attachmentDB\20161005\originalFileFromAerial\DOCSVC_20161003.tar\DOCSVC_20161003\Sect2\INPATIENT\REQ_20160217-000053\JUANA GARCIA_2016-08-16-10.43.29.880.tif
Request;20160217-000054;60094;PACE;Inpatient;PACE;C:\Users\FGuo\Documents\work doucment\attachment\attachmentDB\20161005\originalFileFromAerial\DOCSVC_20161003.tar\DOCSVC_20161003\Sect2\INPATIENT\REQ_20160217-000054\harinder toor pri_2016-02-17-17.05.13.432.tif
Request;20160217-000054;60094;PACE;Inpatient;PACE;C:\Users\FGuo\Documents\work doucment\attachment\attachmentDB\20161005\originalFileFromAerial\DOCSVC_20161003.tar\DOCSVC_20161003\Sect2\INPATIENT\REQ_20160217-000054\HARINDER TOOR3116_2016-03-01-17.07.17.492.tif
Request;20160218-000008;52987;PACE;Inpatient;PACE;C:\Users\FGuo\Documents\work doucment\attachment\attachmentDB\20161005\originalFileFromAerial\DOCSVC_20161003.tar\DOCSVC_20161003\Sect2\INPATIENT\REQ_20160218-000008\Hall Billy - Interfaith Medical Center 3-1-16_2016-03-01-11.58.54.12.pdf
Request;20160218-000008;52987;PACE;Inpatient;PACE;C:\Users\FGuo\Documents\work doucment\attachment\attachmentDB\20161005\originalFileFromAerial\DOCSVC_20161003.tar\DOCSVC_20161003\Sect2\INPATIENT\REQ_20160218-000008\Hall, Billy J  52987_2016-02-23-11.41.54.924.doc
Request;20160218-000008;52987;PACE;Inpatient;PACE;C:\Users\FGuo\Documents\work doucment\attachment\attachmentDB\20161005\originalFileFromAerial\DOCSVC_20161003.tar\DOCSVC_20161003\Sect2\INPATIENT\REQ_20160218-000008\Hall, Billy J 2-29-16_2016-02-29-10.35.00.824.doc
Request;20160218-000008;52987;PACE;Inpatient;PACE;C:\Users\FGuo\Documents\work doucment\attachment\attachmentDB\20161005\originalFileFromAerial\DOCSVC_20161003.tar\DOCSVC_20161003\Sect2\INPATIENT\REQ_20160218-000008\HALL, BILLY J CLINICAL REVIEW REQUEST FORM_2016-02-18-09.35.57.743.doc
Request;20160218-000008;52987;PACE;Inpatient;PACE;C:\Users\FGuo\Documents\work doucment\attachment\attachmentDB\20161005\originalFileFromAerial\DOCSVC_20161003.tar\DOCSVC_20161003\Sect2\INPATIENT\REQ_20160218-000008\HALL_BILLY J_041216 (1)_2016-05-04-10.31.26.80.pdf
Request;20160218-000008;52987;PACE;Inpatient;PACE;C:\Users\FGuo\Documents\work doucment\attachment\attachmentDB\20161005\originalFileFromAerial\DOCSVC_20161003.tar\DOCSVC_20161003\Sect2\INPATIENT\REQ_20160218-000008\MX-3140N_20160301_152931_2016-03-01-16.06.56.817.pdf
Request;20160218-000009;51979;PACE;Inpatient;PACE;C:\Users\FGuo\Documents\work doucment\attachment\attachmentDB\20161005\originalFileFromAerial\DOCSVC_20161003.tar\DOCSVC_20161003\Sect2\INPATIENT\REQ_20160218-000009\04062016 CATALAN_CHARLES_MR1_2016-05-16-11.49.35.692.pdf
Request;20160218-000009;51979;PACE;Inpatient;PACE;C:\Users\FGuo\Documents\work doucment\attachment\attachmentDB\20161005\originalFileFromAerial\DOCSVC_20161003.tar\DOCSVC_20161003\Sect2\INPATIENT\REQ_20160218-000009\04062016 CATALAN_CHARLES_MR2_2016-05-16-11.49.51.276.pdf
Request;20160218-000009;51979;PACE;Inpatient;PACE;C:\Users\FGuo\Documents\work doucment\attachment\attachmentDB\20161005\originalFileFromAerial\DOCSVC_20161003.tar\DOCSVC_20161003\Sect2\INPATIENT\REQ_20160218-000009\Catalan Charles IP Denial Forest Hills Hospital  3-3-16_2016-03-03-10.50.20.165.pdf
Request;20160218-000009;51979;PACE;Inpatient;PACE;C:\Users\FGuo\Documents\work doucment\attachment\attachmentDB\20161005\originalFileFromAerial\DOCSVC_20161003.tar\DOCSVC_20161003\Sect2\INPATIENT\REQ_20160218-000009\CATALAN, CHARLES - ADMISSION_2016-02-18-09.43.58.736.tif
Request;20160218-000009;51979;PACE;Inpatient;PACE;C:\Users\FGuo\Documents\work doucment\attachment\attachmentDB\20161005\originalFileFromAerial\DOCSVC_20161003.tar\DOCSVC_20161003\Sect2\INPATIENT\REQ_20160218-000009\CATALAN, CHARLES - CLINICAL REVIEW REQUEST FORM_2016-02-18-09.47.41.299.doc
Request;20160218-000009;51979;PACE;Inpatient;PACE;C:\Users\FGuo\Documents\work doucment\attachment\attachmentDB\20161005\originalFileFromAerial\DOCSVC_20161003.tar\DOCSVC_20161003\Sect2\INPATIENT\REQ_20160218-000009\CCatalan_2016-02-25-11.19.24.499.tif
Request;20160218-000027;29260;FIDA;Inpatient;FIDA;C:\Users\FGuo\Documents\work doucment\attachment\attachmentDB\20161005\originalFileFromAerial\DOCSVC_20161003.tar\DOCSVC_20161003\Sect2\INPATIENT\REQ_20160218-000027\helen williams 22416_2016-02-24-15.03.53.51.tif
Request;20160218-000027;29260;FIDA;Inpatient;FIDA;C:\Users\FGuo\Documents\work doucment\attachment\attachmentDB\20161005\originalFileFromAerial\DOCSVC_20161003.tar\DOCSVC_20161003\Sect2\INPATIENT\REQ_20160218-000027\HWilliams PRI_2016-02-18-11.09.13.273.tif
Request;20160218-000027;29260;FIDA;Inpatient;FIDA;C:\Users\FGuo\Documents\work doucment\attachment\attachmentDB\20161005\originalFileFromAerial\DOCSVC_20161003.tar\DOCSVC_20161003\Sect2\INPATIENT\REQ_20160218-000027\Williams, Helen - CLOVE LAKE HEALTH CARE REHAB CENTER 8.9.16_2016-08-09-11.06.01.645.pdf
Request;20160218-000039;76198;PACE;Inpatient;PACE;C:\Users\FGuo\Documents\work doucment\attachment\attachmentDB\20161005\originalFileFromAerial\DOCSVC_20161003.tar\DOCSVC_20161003\Sect2\INPATIENT\REQ_20160218-000039\charles una_2016-02-24-15.10.37.378.tif
Request;20160218-000039;76198;PACE;Inpatient;PACE;C:\Users\FGuo\Documents\work doucment\attachment\attachmentDB\20161005\originalFileFromAerial\DOCSVC_20161003.tar\DOCSVC_20161003\Sect2\INPATIENT\REQ_20160218-000039\Charles, Una - Center for Nursing and Rehabilitation- 4.1.16_2016-04-01-10.24.45.96.pdf
Request;20160218-000039;76198;PACE;Inpatient;PACE;C:\Users\FGuo\Documents\work doucment\attachment\attachmentDB\20161005\originalFileFromAerial\DOCSVC_20161003.tar\DOCSVC_20161003\Sect2\INPATIENT\REQ_20160218-000039\Charles, Una_clinical-PRI_2-17-16_2016-02-18-12.36.07.641.pdf
Request;20160218-000040;26432;PACE;Inpatient;PACE;C:\Users\FGuo\Documents\work doucment\attachment\attachmentDB\20161005\originalFileFromAerial\DOCSVC_20161003.tar\DOCSVC_20161003\Sect2\INPATIENT\REQ_20160218-000040\Kumari,Shanta - New Franklin Rehabilitation & Health Care 07182016_2016-07-18-09.12.07.740.pdf
Request;20160218-000047;23174;PACE;Inpatient;PACE;C:\Users\FGuo\Documents\work doucment\attachment\attachmentDB\20161005\originalFileFromAerial\DOCSVC_20161003.tar\DOCSVC_20161003\Sect2\INPATIENT\REQ_20160218-000047\guzman silvia22316_2016-02-23-10.53.34.611.tif
Request;20160218-000047;23174;PACE;Inpatient;PACE;C:\Users\FGuo\Documents\work doucment\attachment\attachmentDB\20161005\originalFileFromAerial\DOCSVC_20161003.tar\DOCSVC_20161003\Sect2\INPATIENT\REQ_20160218-000047\Guzman.S.D__LenoxHill___AdmissionForm__02.18.16_2016-02-18-13.06.09.587.tif
Request;20160218-000047;23174;PACE;Inpatient;PACE;C:\Users\FGuo\Documents\work doucment\attachment\attachmentDB\20161005\originalFileFromAerial\DOCSVC_20161003.tar\DOCSVC_20161003\Sect2\INPATIENT\REQ_20160218-000047\silvia guzman22516_2016-02-25-16.22.52.444.tif
Request;20160218-000051;60546;SELECT;Inpatient;SELECT;C:\Users\FGuo\Documents\work doucment\attachment\attachmentDB\20161005\originalFileFromAerial\DOCSVC_20161003.tar\DOCSVC_20161003\Sect2\INPATIENT\REQ_20160218-000051\Industrious, Beverly - Atlantis Rehab & RHCF (Auth20160218-000051) 3.2.16_2016-03-02-09.36.58.692.pdf
Request;20160218-000054;85831;SELECT;Inpatient;SELECT;C:\Users\FGuo\Documents\work doucment\attachment\attachmentDB\20161005\originalFileFromAerial\DOCSVC_20161003.tar\DOCSVC_20161003\Sect2\INPATIENT\REQ_20160218-000054\Shin, Kyung Ok - Union Plaza Nursing Home - 4.1.16_2016-04-01-11.53.43.415.pdf
Request;20160218-000056;78791;SELECT;Inpatient;SELECT;C:\Users\FGuo\Documents\work doucment\attachment\attachmentDB\20161005\originalFileFromAerial\DOCSVC_20161003.tar\DOCSVC_20161003\Sect2\INPATIENT\REQ_20160218-000056\Pyun, Sam Keun K - Union Plaza Nursing Home - 4.1.16_2016-04-01-13.06.12.162.pdf
Request;20160218-000058;36755;PACE;Inpatient;PACE;C:\Users\FGuo\Documents\work doucment\attachment\attachmentDB\20161005\originalFileFromAerial\DOCSVC_20161003.tar\DOCSVC_20161003\Sect2\INPATIENT\REQ_20160218-000058\Gray Tamela IP Denial Montefiore Medical Center 2.23.16_2016-02-24-09.47.38.912.pdf
Request;20160218-000058;36755;PACE;Inpatient;PACE;C:\Users\FGuo\Documents\work doucment\attachment\attachmentDB\20161005\originalFileFromAerial\DOCSVC_20161003.tar\DOCSVC_20161003\Sect2\INPATIENT\REQ_20160218-000058\GRAY, TAMELA_042216_2016-05-25-14.56.16.235.pdf
Request;20160218-000058;36755;PACE;Inpatient;PACE;C:\Users\FGuo\Documents\work doucment\attachment\attachmentDB\20161005\originalFileFromAerial\DOCSVC_20161003.tar\DOCSVC_20161003\Sect2\INPATIENT\REQ_20160218-000058\Gray, Tamela_clinical_2016-02-22-15.56.23.753.tif
Request;20160218-000060;56765;PACE;Inpatient;PACE;C:\Users\FGuo\Documents\work doucment\attachment\attachmentDB\20161005\originalFileFromAerial\DOCSVC_20161003.tar\DOCSVC_20161003\Sect2\INPATIENT\REQ_20160218-000060\Lodge, Linda E - BROOKDALE UNIV HOSP 8.9.16_2016-08-09-11.56.55.990.pdf
Request;20160218-000060;56765;PACE;Inpatient;PACE;C:\Users\FGuo\Documents\work doucment\attachment\attachmentDB\20161005\originalFileFromAerial\DOCSVC_20161003.tar\DOCSVC_20161003\Sect2\INPATIENT\REQ_20160218-000060\Lodge, Linda E - BROOKDALE UNIV HOSP 8.9.16_2016-08-09-11.59.08.838.pdf
Request;20160218-000060;56765;PACE;Inpatient;PACE;C:\Users\FGuo\Documents\work doucment\attachment\attachmentDB\20161005\originalFileFromAerial\DOCSVC_20161003.tar\DOCSVC_20161003\Sect2\INPATIENT\REQ_20160218-000060\Lodge, Linda_clinical_2-19-16_2016-02-23-10.45.41.387.pdf
Request;20160218-000060;56765;PACE;Inpatient;PACE;C:\Users\FGuo\Documents\work doucment\attachment\attachmentDB\20161005\originalFileFromAerial\DOCSVC_20161003.tar\DOCSVC_20161003\Sect2\INPATIENT\REQ_20160218-000060\O_\56765 LODGE, LINDA UR REQ SHEET_2016-02-18-14.45.41.53.doc
Request;20160218-000063;86928;PACE;Inpatient;PACE;C:\Users\FGuo\Documents\work doucment\attachment\attachmentDB\20161005\originalFileFromAerial\DOCSVC_20161003.tar\DOCSVC_20161003\Sect2\INPATIENT\REQ_20160218-000063\Shiung Su Lo - Union Plaza Nursing Home 2-19-16_2016-02-19-09.32.29.278.pdf
Request;20160218-000063;86928;PACE;Inpatient;PACE;C:\Users\FGuo\Documents\work doucment\attachment\attachmentDB\20161005\originalFileFromAerial\DOCSVC_20161003.tar\DOCSVC_20161003\Sect2\INPATIENT\REQ_20160218-000063\Shiung Su Lo - Union Plaza Nursing Home 2-22-16_2016-02-22-10.08.17.852.pdf
Request;20160218-000063;86928;PACE;Inpatient;PACE;C:\Users\FGuo\Documents\work doucment\attachment\attachmentDB\20161005\originalFileFromAerial\DOCSVC_20161003.tar\DOCSVC_20161003\Sect2\INPATIENT\REQ_20160218-000063\shiung su lo 22316_2016-02-23-11.37.16.625.tif
Request;20160218-000063;86928;PACE;Inpatient;PACE;C:\Users\FGuo\Documents\work doucment\attachment\attachmentDB\20161005\originalFileFromAerial\DOCSVC_20161003.tar\DOCSVC_20161003\Sect2\INPATIENT\REQ_20160218-000063\shiung su lo22316_2016-02-23-11.31.11.307.tif
Request;20160218-000063;86928;PACE;Inpatient;PACE;C:\Users\FGuo\Documents\work doucment\attachment\attachmentDB\20161005\originalFileFromAerial\DOCSVC_20161003.tar\DOCSVC_20161003\Sect2\INPATIENT\REQ_20160218-000063\shiung su lo22416_2016-02-24-13.48.18.530.tif
Request;20160218-000063;86928;PACE;Inpatient;PACE;C:\Users\FGuo\Documents\work doucment\attachment\attachmentDB\20161005\originalFileFromAerial\DOCSVC_20161003.tar\DOCSVC_20161003\Sect2\INPATIENT\REQ_20160218-000063\shiung su22516_2016-02-25-13.14.12.928.tif
Request;20160218-000063;86928;PACE;Inpatient;PACE;C:\Users\FGuo\Documents\work doucment\attachment\attachmentDB\20161005\originalFileFromAerial\DOCSVC_20161003.tar\DOCSVC_20161003\Sect2\INPATIENT\REQ_20160218-000063\SLShiung_2016-02-18-15.30.45.383.tif
Request;20160218-000063;86928;PACE;Inpatient;PACE;C:\Users\FGuo\Documents\work doucment\attachment\attachmentDB\20161005\originalFileFromAerial\DOCSVC_20161003.tar\DOCSVC_20161003\Sect2\INPATIENT\REQ_20160218-000063\SShiung_2016-02-19-16.50.15.286.tif
Request;20160218-000064;59187;PACE;Inpatient;PACE;C:\Users\FGuo\Documents\work doucment\attachment\attachmentDB\20161005\originalFileFromAerial\DOCSVC_20161003.tar\DOCSVC_20161003\Sect2\INPATIENT\REQ_20160218-000064\Cipriano, Lucia - Schnurmacher Nursing Home 07182016_2016-07-18-12.57.23.672.pdf
Request;20160218-000064;59187;PACE;Inpatient;PACE;C:\Users\FGuo\Documents\work doucment\attachment\attachmentDB\20161005\originalFileFromAerial\DOCSVC_20161003.tar\DOCSVC_20161003\Sect2\INPATIENT\REQ_20160218-000064\CIPRIANO, LUCIA_PRI_2016-02-18-15.28.21.884.tif
Request;20160218-000065;82705;PACE;Inpatient;PACE;C:\Users\FGuo\Documents\work doucment\attachment\attachmentDB\20161005\originalFileFromAerial\DOCSVC_20161003.tar\DOCSVC_20161003\Sect2\INPATIENT\REQ_20160218-000065\Ho, Nancy Wong - Cliffside Rehabilitation & Residential 07182016_2016-07-18-11.36.43.550.pdf
Request;20160218-000067;51979;PACE;Inpatient;PACE;C:\Users\FGuo\Documents\work doucment\attachment\attachmentDB\20161005\originalFileFromAerial\DOCSVC_20161003.tar\DOCSVC_20161003\Sect2\INPATIENT\REQ_20160218-000067\catalan charles 22316_2016-02-23-11.43.57.605.tif
Request;20160218-000067;51979;PACE;Inpatient;PACE;C:\Users\FGuo\Documents\work doucment\attachment\attachmentDB\20161005\originalFileFromAerial\DOCSVC_20161003.tar\DOCSVC_20161003\Sect2\INPATIENT\REQ_20160218-000067\catalan charles3216_2016-03-03-11.23.57.375.tif
Request;20160218-000067;51979;PACE;Inpatient;PACE;C:\Users\FGuo\Documents\work doucment\attachment\attachmentDB\20161005\originalFileFromAerial\DOCSVC_20161003.tar\DOCSVC_20161003\Sect2\INPATIENT\REQ_20160218-000067\catalan charles3216_2016-03-03-11.24.39.466.tif
Request;20160218-000067;51979;PACE;Inpatient;PACE;C:\Users\FGuo\Documents\work doucment\attachment\attachmentDB\20161005\originalFileFromAerial\DOCSVC_20161003.tar\DOCSVC_20161003\Sect2\INPATIENT\REQ_20160218-000067\catalan charles3716_2016-03-08-11.07.58.23.tif
Request;20160218-000067;51979;PACE;Inpatient;PACE;C:\Users\FGuo\Documents\work doucment\attachment\attachmentDB\20161005\originalFileFromAerial\DOCSVC_20161003.tar\DOCSVC_20161003\Sect2\INPATIENT\REQ_20160218-000067\CCatalan DC 21816_2016-02-18-15.45.01.123.tif
Request;20160218-000068;79013;PACE;Inpatient;PACE;C:\Users\FGuo\Documents\work doucment\attachment\attachmentDB\20161005\originalFileFromAerial\DOCSVC_20161003.tar\DOCSVC_20161003\Sect2\INPATIENT\REQ_20160218-000068\O_\79013 ZHANG, BAO YU UR REQ SHEET_2016-02-18-15.56.17.539.doc
Request;20160218-000068;79013;PACE;Inpatient;PACE;C:\Users\FGuo\Documents\work doucment\attachment\attachmentDB\20161005\originalFileFromAerial\DOCSVC_20161003.tar\DOCSVC_20161003\Sect2\INPATIENT\REQ_20160218-000068\Zhang, Bao Yu_clinical-2-16-16_2016-02-19-16.56.13.869.pdf
Request;20160218-000068;79013;PACE;Inpatient;PACE;C:\Users\FGuo\Documents\work doucment\attachment\attachmentDB\20161005\originalFileFromAerial\DOCSVC_20161003.tar\DOCSVC_20161003\Sect2\INPATIENT\REQ_20160218-000068\Zhang, Bao Yu_dc summary-2-16-16_2016-02-19-17.16.39.296.pdf
Request;20160219-000002;43028;PACE;Inpatient;PACE;C:\Users\FGuo\Documents\work doucment\attachment\attachmentDB\20161005\originalFileFromAerial\DOCSVC_20161003.tar\DOCSVC_20161003\Sect2\INPATIENT\REQ_20160219-000002\geraldine pierson22916_2016-03-01-11.59.07.222.tif
Request;20160219-000002;43028;PACE;Inpatient;PACE;C:\Users\FGuo\Documents\work doucment\attachment\attachmentDB\20161005\originalFileFromAerial\DOCSVC_20161003.tar\DOCSVC_20161003\Sect2\INPATIENT\REQ_20160219-000002\O_\Waters Place\Aerial\Medical Doc Rcvd\Pierson.G__WestcherCNR___PRI_ExtensionRequest__03.04.16_2016-03-04-13.10.39.537.tif
Request;20160219-000002;43028;PACE;Inpatient;PACE;C:\Users\FGuo\Documents\work doucment\attachment\attachmentDB\20161005\originalFileFromAerial\DOCSVC_20161003.tar\DOCSVC_20161003\Sect2\INPATIENT\REQ_20160219-000002\pierson geraldine 22316_2016-02-24-15.56.08.987.tif
Request;20160219-000002;43028;PACE;Inpatient;PACE;C:\Users\FGuo\Documents\work doucment\attachment\attachmentDB\20161005\originalFileFromAerial\DOCSVC_20161003.tar\DOCSVC_20161003\Sect2\INPATIENT\REQ_20160219-000002\PIERSON, GERALDINE_ PRI_2016-02-19-09.29.07.457.tif
Request;20160219-000002;43028;PACE;Inpatient;PACE;C:\Users\FGuo\Documents\work doucment\attachment\attachmentDB\20161005\originalFileFromAerial\DOCSVC_20161003.tar\DOCSVC_20161003\Sect2\INPATIENT\REQ_20160219-000002\PIERSON, GERALDINE_ PRI_2016-02-19-09.40.33.596.tif
Request;20160219-000002;43028;PACE;Inpatient;PACE;C:\Users\FGuo\Documents\work doucment\attachment\attachmentDB\20161005\originalFileFromAerial\DOCSVC_20161003.tar\DOCSVC_20161003\Sect2\INPATIENT\REQ_20160219-000002\Pierson,Geraldine - MC Acquisitions Westchester Center for Rehab & Nursing 07202016_2016-07-20-09.26.45.515.pdf
Request;20160219-000002;43028;PACE;Inpatient;PACE;C:\Users\FGuo\Documents\work doucment\attachment\attachmentDB\20161005\originalFileFromAerial\DOCSVC_20161003.tar\DOCSVC_20161003\Sect2\INPATIENT\REQ_20160219-000002\PIERSON_GERALDINE_PRI_2016-02-19-09.42.51.751.tif
Request;20160219-000003;59230;PACE;Inpatient;PACE;C:\Users\FGuo\Documents\work doucment\attachment\attachmentDB\20161005\originalFileFromAerial\DOCSVC_20161003.tar\DOCSVC_20161003\Sect2\INPATIENT\REQ_20160219-000003\Vega, Maria L - Hopkins Center for Rehab. & Healthcare (Auth 20160219-000003) 3.7.16_2016-03-07-10.58.01.97.pdf
Request;20160219-000003;59230;PACE;Inpatient;PACE;C:\Users\FGuo\Documents\work doucment\attachment\attachmentDB\20161005\originalFileFromAerial\DOCSVC_20161003.tar\DOCSVC_20161003\Sect2\INPATIENT\REQ_20160219-000003\Vega, Maria L_2016-02-19-09.18.48.583.tif
Request;20160219-000023;82833;SELECT;Inpatient;SELECT;C:\Users\FGuo\Documents\work doucment\attachment\attachmentDB\20161005\originalFileFromAerial\DOCSVC_20161003.tar\DOCSVC_20161003\Sect2\INPATIENT\REQ_20160219-000023\Chan, Cheuk Yuk - Union Plaza Nursing Home - 4.1.16_2016-04-01-14.58.38.571.pdf
Request;20160219-000026;60284;SELECT;Inpatient;SELECT;C:\Users\FGuo\Documents\work doucment\attachment\attachmentDB\20161005\originalFileFromAerial\DOCSVC_20161003.tar\DOCSVC_20161003\Sect2\INPATIENT\REQ_20160219-000026\G_\Genis\Bronx\Levkowitz, Judith 60284- Clinicals_2016-02-19-12.02.33.452.pdf
Request;20160219-000026;60284;SELECT;Inpatient;SELECT;C:\Users\FGuo\Documents\work doucment\attachment\attachmentDB\20161005\originalFileFromAerial\DOCSVC_20161003.tar\DOCSVC_20161003\Sect2\INPATIENT\REQ_20160219-000026\Levkowitz, Judith - Oxford Nursing Home, INC 07192016_2016-07-19-16.17.46.598.pdf
Request;20160219-000027;81978;PACE;Inpatient;PACE;C:\Users\FGuo\Documents\work doucment\attachment\attachmentDB\20161005\originalFileFromAerial\DOCSVC_20161003.tar\DOCSVC_20161003\Sect2\INPATIENT\REQ_20160219-000027\bik ng 22616_2016-02-26-17.00.42.959.tif
Request;20160219-000027;81978;PACE;Inpatient;PACE;C:\Users\FGuo\Documents\work doucment\attachment\attachmentDB\20161005\originalFileFromAerial\DOCSVC_20161003.tar\DOCSVC_20161003\Sect2\INPATIENT\REQ_20160219-000027\bikyak ng31116_2016-03-11-13.16.12.840.tif
Request;20160219-000027;81978;PACE;Inpatient;PACE;C:\Users\FGuo\Documents\work doucment\attachment\attachmentDB\20161005\originalFileFromAerial\DOCSVC_20161003.tar\DOCSVC_20161003\Sect2\INPATIENT\REQ_20160219-000027\BNG 21916_2016-02-19-12.20.45.388.tif
Request;20160219-000027;81978;PACE;Inpatient;PACE;C:\Users\FGuo\Documents\work doucment\attachment\attachmentDB\20161005\originalFileFromAerial\DOCSVC_20161003.tar\DOCSVC_20161003\Sect2\INPATIENT\REQ_20160219-000027\ng biyak22616_2016-02-26-17.01.31.427.tif
Request;20160219-000029;42190;PACE;Inpatient;PACE;C:\Users\FGuo\Documents\work doucment\attachment\attachmentDB\20161005\originalFileFromAerial\DOCSVC_20161003.tar\DOCSVC_20161003\Sect2\INPATIENT\REQ_20160219-000029\G_\Genis\Inpt Admit\Riley, Ninevah 42190- Medical Center Clinical Review Request Form_2016-02-19-12.27.08.406.doc
Request;20160219-000029;42190;PACE;Inpatient;PACE;C:\Users\FGuo\Documents\work doucment\attachment\attachmentDB\20161005\originalFileFromAerial\DOCSVC_20161003.tar\DOCSVC_20161003\Sect2\INPATIENT\REQ_20160219-000029\O_\42190 RILEY, NINEVAH CLINICALS_2016-02-23-09.41.55.878.tif
Request;20160219-000029;42190;PACE;Inpatient;PACE;C:\Users\FGuo\Documents\work doucment\attachment\attachmentDB\20161005\originalFileFromAerial\DOCSVC_20161003.tar\DOCSVC_20161003\Sect2\INPATIENT\REQ_20160219-000029\Riley, Ninevah - White Plains Hospital Center 07252016_2016-07-25-13.23.39.62.pdf
Request;20160219-000030;56530;PACE;Inpatient;PACE;C:\Users\FGuo\Documents\work doucment\attachment\attachmentDB\20161005\originalFileFromAerial\DOCSVC_20161003.tar\DOCSVC_20161003\Sect2\INPATIENT\REQ_20160219-000030\PICHARDO, MONICA - CLINICAL REVIEW REQUEST FORM_2016-02-19-12.35.49.105.doc
Request;20160219-000034;44664;SELECT;Inpatient;SELECT;C:\Users\FGuo\Documents\work doucment\attachment\attachmentDB\20161005\originalFileFromAerial\DOCSVC_20161003.tar\DOCSVC_20161003\Sect2\INPATIENT\REQ_20160219-000034\carmen lazu22516_2016-02-25-13.06.40.948.tif
Request;20160219-000034;44664;SELECT;Inpatient;SELECT;C:\Users\FGuo\Documents\work doucment\attachment\attachmentDB\20161005\originalFileFromAerial\DOCSVC_20161003.tar\DOCSVC_20161003\Sect2\INPATIENT\REQ_20160219-000034\carmen lazupri_2016-02-24-14.59.16.980.tif
Request;20160219-000034;44664;SELECT;Inpatient;SELECT;C:\Users\FGuo\Documents\work doucment\attachment\attachmentDB\20161005\originalFileFromAerial\DOCSVC_20161003.tar\DOCSVC_20161003\Sect2\INPATIENT\REQ_20160219-000034\Lazu, Carmen 44664 2 22  NOTIFICATION OF SNF COPAY 2015_2016-02-22-14.30.56.845.doc
Request;20160219-000037;34109;PACE;Inpatient;PACE;C:\Users\FGuo\Documents\work doucment\attachment\attachmentDB\20161005\originalFileFromAerial\DOCSVC_20161003.tar\DOCSVC_20161003\Sect2\INPATIENT\REQ_20160219-000037\Marmol, Roberto - WORKMEN'S CIRCLE HOME 9.12.16_2016-09-12-15.34.42.45.pdf
Request;20160219-000037;34109;PACE;Inpatient;PACE;C:\Users\FGuo\Documents\work doucment\attachment\attachmentDB\20161005\originalFileFromAerial\DOCSVC_20161003.tar\DOCSVC_20161003\Sect2\INPATIENT\REQ_20160219-000037\Marmol, Roberto - Workmens Circle Home- 4.1.16_2016-04-01-15.33.19.376.pdf
Request;20160219-000041;48068;FIDA;Inpatient;FIDA;C:\Users\FGuo\Documents\work doucment\attachment\attachmentDB\20161005\originalFileFromAerial\DOCSVC_20161003.tar\DOCSVC_20161003\Sect2\INPATIENT\REQ_20160219-000041\RUIZ JIMENEZ, RAFAEL - BRAIN STIMULATOR_2016-02-22-10.08.58.881.pdf
Request;20160219-000041;48068;FIDA;Inpatient;FIDA;C:\Users\FGuo\Documents\work doucment\attachment\attachmentDB\20161005\originalFileFromAerial\DOCSVC_20161003.tar\DOCSVC_20161003\Sect2\INPATIENT\REQ_20160219-000041\Ruiz Jimenez, Rafael- NYU Hospital Center - 4.4.16_2016-04-04-10.20.36.11.pdf
Request;20160219-000041;48068;FIDA;Inpatient;FIDA;C:\Users\FGuo\Documents\work doucment\attachment\attachmentDB\20161005\originalFileFromAerial\DOCSVC_20161003.tar\DOCSVC_20161003\Sect2\INPATIENT\REQ_20160219-000041\Ruiz Jimenez, Rafael- NYU Hospital Center - 4.4.16_2016-04-04-10.23.58.572.pdf
Request;20160219-000043;56530;PACE;Inpatient;PACE;C:\Users\FGuo\Documents\work doucment\attachment\attachmentDB\20161005\originalFileFromAerial\DOCSVC_20161003.tar\DOCSVC_20161003\Sect2\INPATIENT\REQ_20160219-000043\08012016 Pichardo Monica _2016-08-11-15.37.39.211.pdf
Request;20160219-000043;56530;PACE;Inpatient;PACE;C:\Users\FGuo\Documents\work doucment\attachment\attachmentDB\20161005\originalFileFromAerial\DOCSVC_20161003.tar\DOCSVC_20161003\Sect2\INPATIENT\REQ_20160219-000043\monica Pichardo21916_2016-02-19-15.45.53.455.tif
Request;20160219-000043;56530;PACE;Inpatient;PACE;C:\Users\FGuo\Documents\work doucment\attachment\attachmentDB\20161005\originalFileFromAerial\DOCSVC_20161003.tar\DOCSVC_20161003\Sect2\INPATIENT\REQ_20160219-000043\Pichardo, Monica 56530 PORF Submission Received_2016-02-22-16.16.56.755.txt
Request;20160219-000045;58773;null;Inpatient;PACE;C:\Users\FGuo\Documents\work doucment\attachment\attachmentDB\20161005\originalFileFromAerial\DOCSVC_20161003.tar\DOCSVC_20161003\Sect2\INPATIENT\REQ_20160219-000045\fayza Assanein22216_2016-02-23-12.24.57.247.tif
Request;20160219-000045;58773;null;Inpatient;PACE;C:\Users\FGuo\Documents\work doucment\attachment\attachmentDB\20161005\originalFileFromAerial\DOCSVC_20161003.tar\DOCSVC_20161003\Sect2\INPATIENT\REQ_20160219-000045\Hassanien Fayva IP Denial North Shore University Hospital 2-23-16_2016-02-23-16.16.33.125.pdf
Request;20160219-000045;58773;null;Inpatient;PACE;C:\Users\FGuo\Documents\work doucment\attachment\attachmentDB\20161005\originalFileFromAerial\DOCSVC_20161003.tar\DOCSVC_20161003\Sect2\INPATIENT\REQ_20160219-000045\Hassanien Fayva IP Denial North Shore University Hospital 2-23-16_2016-02-23-16.37.01.524.pdf
Request;20160219-000045;58773;null;Inpatient;PACE;C:\Users\FGuo\Documents\work doucment\attachment\attachmentDB\20161005\originalFileFromAerial\DOCSVC_20161003.tar\DOCSVC_20161003\Sect2\INPATIENT\REQ_20160219-000045\Hassanien Fayza MR1_2016-04-04-11.20.12.307.pdf
Request;20160219-000045;58773;null;Inpatient;PACE;C:\Users\FGuo\Documents\work doucment\attachment\attachmentDB\20161005\originalFileFromAerial\DOCSVC_20161003.tar\DOCSVC_20161003\Sect2\INPATIENT\REQ_20160219-000045\Hassanien Fayza MR2_2016-04-04-11.21.44.26.pdf
Request;20160219-000045;58773;null;Inpatient;PACE;C:\Users\FGuo\Documents\work doucment\attachment\attachmentDB\20161005\originalFileFromAerial\DOCSVC_20161003.tar\DOCSVC_20161003\Sect2\INPATIENT\REQ_20160219-000045\O_\58773 HASSANIEN, FAYVA UR REQ SHEET_2016-02-19-15.13.20.716.doc
Request;20160219-000048;36449;PACE;Inpatient;PACE;C:\Users\FGuo\Documents\work doucment\attachment\attachmentDB\20161005\originalFileFromAerial\DOCSVC_20161003.tar\DOCSVC_20161003\Sect2\INPATIENT\REQ_20160219-000048\brown louisa 22616_2016-02-26-12.21.54.665.tif
Request;20160219-000048;36449;PACE;Inpatient;PACE;C:\Users\FGuo\Documents\work doucment\attachment\attachmentDB\20161005\originalFileFromAerial\DOCSVC_20161003.tar\DOCSVC_20161003\Sect2\INPATIENT\REQ_20160219-000048\brown louisa 3216_2016-03-02-12.52.12.479.tif
Request;20160219-000048;36449;PACE;Inpatient;PACE;C:\Users\FGuo\Documents\work doucment\attachment\attachmentDB\20161005\originalFileFromAerial\DOCSVC_20161003.tar\DOCSVC_20161003\Sect2\INPATIENT\REQ_20160219-000048\brown louisa3916_2016-03-09-14.05.44.134.tif
Request;20160219-000048;36449;PACE;Inpatient;PACE;C:\Users\FGuo\Documents\work doucment\attachment\attachmentDB\20161005\originalFileFromAerial\DOCSVC_20161003.tar\DOCSVC_20161003\Sect2\INPATIENT\REQ_20160219-000048\brown luisa31516_2016-03-15-16.43.12.339.tif
Request;20160219-000048;36449;PACE;Inpatient;PACE;C:\Users\FGuo\Documents\work doucment\attachment\attachmentDB\20161005\originalFileFromAerial\DOCSVC_20161003.tar\DOCSVC_20161003\Sect2\INPATIENT\REQ_20160219-000048\Brown, Louisa - River Manor Care Center 07202016_2016-07-20-10.47.50.913.pdf
Request;20160219-000048;36449;PACE;Inpatient;PACE;C:\Users\FGuo\Documents\work doucment\attachment\attachmentDB\20161005\originalFileFromAerial\DOCSVC_20161003.tar\DOCSVC_20161003\Sect2\INPATIENT\REQ_20160219-000048\Brown, Louisa_clinical-PRI_2-18-16_2016-02-19-15.52.45.851.pdf
Request;20160219-000048;36449;PACE;Inpatient;PACE;C:\Users\FGuo\Documents\work doucment\attachment\attachmentDB\20161005\originalFileFromAerial\DOCSVC_20161003.tar\DOCSVC_20161003\Sect2\INPATIENT\REQ_20160219-000048\luisa brown22516_2016-02-25-14.46.35.938.tif
Request;20160219-000051;52258;PACE;Inpatient;PACE;C:\Users\FGuo\Documents\work doucment\attachment\attachmentDB\20161005\originalFileFromAerial\DOCSVC_20161003.tar\DOCSVC_20161003\Sect2\INPATIENT\REQ_20160219-000051\Bonn Jean - Workmen's Circle Home 2-23-16_2016-02-23-15.42.15.360.pdf
Request;20160219-000051;52258;PACE;Inpatient;PACE;C:\Users\FGuo\Documents\work doucment\attachment\attachmentDB\20161005\originalFileFromAerial\DOCSVC_20161003.tar\DOCSVC_20161003\Sect2\INPATIENT\REQ_20160219-000051\bonn, Jean_PRI_2016-02-22-11.48.22.295.tif
Request;20160219-000052;74392;SELECT;Inpatient;PACE;C:\Users\FGuo\Documents\work doucment\attachment\attachmentDB\20161005\originalFileFromAerial\DOCSVC_20161003.tar\DOCSVC_20161003\Sect2\INPATIENT\REQ_20160219-000052\MColon pri_2016-02-19-16.27.13.49.pdf
Request;20160219-000054;22894;PACE;Inpatient;PACE;C:\Users\FGuo\Documents\work doucment\attachment\attachmentDB\20161005\originalFileFromAerial\DOCSVC_20161003.tar\DOCSVC_20161003\Sect2\INPATIENT\REQ_20160219-000054\SANTIAGO, AGUSTINA - ADMISSION_2016-02-19-16.29.17.2.pdf
Request;20160219-000054;22894;PACE;Inpatient;PACE;C:\Users\FGuo\Documents\work doucment\attachment\attachmentDB\20161005\originalFileFromAerial\DOCSVC_20161003.tar\DOCSVC_20161003\Sect2\INPATIENT\REQ_20160219-000054\SANTIAGO, AGUSTINA - CLINICAL REVIEW REQUEST FORM_2016-02-19-16.27.38.234.doc
Request;20160219-000054;22894;PACE;Inpatient;PACE;C:\Users\FGuo\Documents\work doucment\attachment\attachmentDB\20161005\originalFileFromAerial\DOCSVC_20161003.tar\DOCSVC_20161003\Sect2\INPATIENT\REQ_20160219-000054\Santiago, Agustina -St. Barnabas Hospital 07252016_2016-07-25-13.12.56.826.pdf
Request;20160219-000054;22894;PACE;Inpatient;PACE;C:\Users\FGuo\Documents\work doucment\attachment\attachmentDB\20161005\originalFileFromAerial\DOCSVC_20161003.tar\DOCSVC_20161003\Sect2\INPATIENT\REQ_20160219-000054\Santiago, Augustina_clinical_2016-02-23-16.46.41.930.tif
Request;20160222-000006;23338;PACE;Inpatient;PACE;C:\Users\FGuo\Documents\work doucment\attachment\attachmentDB\20161005\originalFileFromAerial\DOCSVC_20161003.tar\DOCSVC_20161003\Sect2\INPATIENT\REQ_20160222-000006\Salcedo, Julia - WOODHULL HOSPITAL 8.10.16_2016-08-10-16.40.53.61.pdf
Request;20160222-000006;23338;PACE;Inpatient;PACE;C:\Users\FGuo\Documents\work doucment\attachment\attachmentDB\20161005\originalFileFromAerial\DOCSVC_20161003.tar\DOCSVC_20161003\Sect2\INPATIENT\REQ_20160222-000006\Salcedo, Julia - Woodhull Hospital Clinical Review Request Form 2-22-16_2016-02-22-09.37.09.907.docx
Request;20160222-000006;23338;PACE;Inpatient;PACE;C:\Users\FGuo\Documents\work doucment\attachment\attachmentDB\20161005\originalFileFromAerial\DOCSVC_20161003.tar\DOCSVC_20161003\Sect2\INPATIENT\REQ_20160222-000006\Salcedo, Julia_clinical_2-24-16_2016-02-25-17.15.13.41.pdf
Request;20160222-000017;28901;SELECT;Inpatient;SELECT;C:\Users\FGuo\Documents\work doucment\attachment\attachmentDB\20161005\originalFileFromAerial\DOCSVC_20161003.tar\DOCSVC_20161003\Sect2\INPATIENT\REQ_20160222-000017\RAMON RAMOS _ PRI_2016-02-22-11.29.27.943.tif
Request;20160222-000017;28901;SELECT;Inpatient;SELECT;C:\Users\FGuo\Documents\work doucment\attachment\attachmentDB\20161005\originalFileFromAerial\DOCSVC_20161003.tar\DOCSVC_20161003\Sect2\INPATIENT\REQ_20160222-000017\RAMON RAMOS _ PRI_2016-02-22-15.11.38.425.tif
Request;20160222-000017;28901;SELECT;Inpatient;SELECT;C:\Users\FGuo\Documents\work doucment\attachment\attachmentDB\20161005\originalFileFromAerial\DOCSVC_20161003.tar\DOCSVC_20161003\Sect2\INPATIENT\REQ_20160222-000017\Ramos Ramon Adverse Determ Beth Abraham Health Services 3-2-16_2016-03-03-09.50.18.260.pdf
Request;20160222-000017;28901;SELECT;Inpatient;SELECT;C:\Users\FGuo\Documents\work doucment\attachment\attachmentDB\20161005\originalFileFromAerial\DOCSVC_20161003.tar\DOCSVC_20161003\Sect2\INPATIENT\REQ_20160222-000017\Ramos Ramon MLTC Beth Abraham Health Services 3-2-16_2016-03-03-09.50.28.631.pdf
Request;20160222-000020;97698;PACE;Inpatient;PACE;C:\Users\FGuo\Documents\work doucment\attachment\attachmentDB\20161005\originalFileFromAerial\DOCSVC_20161003.tar\DOCSVC_20161003\Sect2\INPATIENT\REQ_20160222-000020\COLEY DAPHNE CLINICAL REVIEW REQUEST FORM_2016-02-22-12.07.44.182.doc
Request;20160222-000020;97698;PACE;Inpatient;PACE;C:\Users\FGuo\Documents\work doucment\attachment\attachmentDB\20161005\originalFileFromAerial\DOCSVC_20161003.tar\DOCSVC_20161003\Sect2\INPATIENT\REQ_20160222-000020\Coley, Daphne - Montefiore Medical Center 07252016_2016-07-25-16.20.00.531.pdf
Request;20160222-000020;97698;PACE;Inpatient;PACE;C:\Users\FGuo\Documents\work doucment\attachment\attachmentDB\20161005\originalFileFromAerial\DOCSVC_20161003.tar\DOCSVC_20161003\Sect2\INPATIENT\REQ_20160222-000020\COLEY, DAPHNE.tif ADMISSION REQUEST_2016-02-22-11.25.30.710.tif
Request;20160222-000020;97698;PACE;Inpatient;PACE;C:\Users\FGuo\Documents\work doucment\attachment\attachmentDB\20161005\originalFileFromAerial\DOCSVC_20161003.tar\DOCSVC_20161003\Sect2\INPATIENT\REQ_20160222-000020\COLEY, DAPHNE_2016-02-22-11.24.34.961.tif
Request;20160222-000021;74392;SELECT;Inpatient;PACE;C:\Users\FGuo\Documents\work doucment\attachment\attachmentDB\20161005\originalFileFromAerial\DOCSVC_20161003.tar\DOCSVC_20161003\Sect2\INPATIENT\REQ_20160222-000021\Colon Myrna Approval Letter Montefiore Medical Center 8.2.2016_2016-08-02-12.18.26.80.pdf
Request;20160222-000021;74392;SELECT;Inpatient;PACE;C:\Users\FGuo\Documents\work doucment\attachment\attachmentDB\20161005\originalFileFromAerial\DOCSVC_20161003.tar\DOCSVC_20161003\Sect2\INPATIENT\REQ_20160222-000021\COLON, MYRNA_2016-02-22-11.40.35.207.tif
Request;20160222-000021;74392;SELECT;Inpatient;PACE;C:\Users\FGuo\Documents\work doucment\attachment\attachmentDB\20161005\originalFileFromAerial\DOCSVC_20161003.tar\DOCSVC_20161003\Sect2\INPATIENT\REQ_20160222-000021\COLON, MYRNA_2016-02-22-11.52.15.667.tif
Request;20160222-000021;74392;SELECT;Inpatient;PACE;C:\Users\FGuo\Documents\work doucment\attachment\attachmentDB\20161005\originalFileFromAerial\DOCSVC_20161003.tar\DOCSVC_20161003\Sect2\INPATIENT\REQ_20160222-000021\COLON, MYRNA_CLINICAL_2016-02-24-11.01.09.627.tif
Request;20160222-000026;88978;PACE;Inpatient;PACE;C:\Users\FGuo\Documents\work doucment\attachment\attachmentDB\20161005\originalFileFromAerial\DOCSVC_20161003.tar\DOCSVC_20161003\Sect2\INPATIENT\REQ_20160222-000026\Ocampo Teodora Approval Letter Montefiore Medical Center 8.2.2016_2016-08-02-14.38.37.541.pdf
Request;20160222-000026;88978;PACE;Inpatient;PACE;C:\Users\FGuo\Documents\work doucment\attachment\attachmentDB\20161005\originalFileFromAerial\DOCSVC_20161003.tar\DOCSVC_20161003\Sect2\INPATIENT\REQ_20160222-000026\ocampo, teodora_clinical_2016-02-24-10.00.48.192.tif
Request;20160222-000029;29991;PACE;Inpatient;PACE;C:\Users\FGuo\Documents\work doucment\attachment\attachmentDB\20161005\originalFileFromAerial\DOCSVC_20161003.tar\DOCSVC_20161003\Sect2\INPATIENT\REQ_20160222-000029\chen gui 3116_2016-03-01-16.40.28.844.tif
Request;20160222-000029;29991;PACE;Inpatient;PACE;C:\Users\FGuo\Documents\work doucment\attachment\attachmentDB\20161005\originalFileFromAerial\DOCSVC_20161003.tar\DOCSVC_20161003\Sect2\INPATIENT\REQ_20160222-000029\chen Gui H22216_2016-02-22-12.28.54.242.tif
Request;20160222-000029;29991;PACE;Inpatient;PACE;C:\Users\FGuo\Documents\work doucment\attachment\attachmentDB\20161005\originalFileFromAerial\DOCSVC_20161003.tar\DOCSVC_20161003\Sect2\INPATIENT\REQ_20160222-000029\Chen, Gui H - Atlantis Rehab & RHCF 07252016_2016-07-25-08.52.33.425.pdf
Request;20160222-000030;34461;SELECT;Inpatient;SELECT;C:\Users\FGuo\Documents\work doucment\attachment\attachmentDB\20161005\originalFileFromAerial\DOCSVC_20161003.tar\DOCSVC_20161003\Sect2\INPATIENT\REQ_20160222-000030\Littman, Regina - Bronx Center for Nursing & Rehab Approval Letter 3-15-16_2016-03-15-14.40.32.192.docx
Request;20160222-000030;34461;SELECT;Inpatient;SELECT;C:\Users\FGuo\Documents\work doucment\attachment\attachmentDB\20161005\originalFileFromAerial\DOCSVC_20161003.tar\DOCSVC_20161003\Sect2\INPATIENT\REQ_20160222-000030\RJ Littman, R 34461 2-12-16_2016-02-22-12.43.31.594.tif
Request;20160222-000030;34461;SELECT;Inpatient;SELECT;C:\Users\FGuo\Documents\work doucment\attachment\attachmentDB\20161005\originalFileFromAerial\DOCSVC_20161003.tar\DOCSVC_20161003\Sect2\INPATIENT\REQ_20160222-000030\RJ Littman, R 34461 2-9-16_2016-02-22-12.43.25.175.tif
Request;20160222-000032;78060;PACE;Inpatient;PACE;C:\Users\FGuo\Documents\work doucment\attachment\attachmentDB\20161005\originalFileFromAerial\DOCSVC_20161003.tar\DOCSVC_20161003\Sect2\INPATIENT\REQ_20160222-000032\Callender Myrle IP Denial Interfaith Medical Center 2-24-16_2016-02-24-16.33.07.679.pdf
Request;20160222-000032;78060;PACE;Inpatient;PACE;C:\Users\FGuo\Documents\work doucment\attachment\attachmentDB\20161005\originalFileFromAerial\DOCSVC_20161003.tar\DOCSVC_20161003\Sect2\INPATIENT\REQ_20160222-000032\Callender Myrtle-2-19-16-Resub_2016-03-31-10.07.00.820.pdf
Request;20160222-000032;78060;PACE;Inpatient;PACE;C:\Users\FGuo\Documents\work doucment\attachment\attachmentDB\20161005\originalFileFromAerial\DOCSVC_20161003.tar\DOCSVC_20161003\Sect2\INPATIENT\REQ_20160222-000032\Callender, Mrytle_clinical_2-22-16_2016-02-23-10.42.04.630.pdf
Request;20160222-000032;78060;PACE;Inpatient;PACE;C:\Users\FGuo\Documents\work doucment\attachment\attachmentDB\20161005\originalFileFromAerial\DOCSVC_20161003.tar\DOCSVC_20161003\Sect2\INPATIENT\REQ_20160222-000032\O_\78060 CALLENDER, MYRTLE UR REQ SHEET_2016-02-22-12.45.49.24.doc
Request;20160222-000034;34109;PACE;Inpatient;PACE;C:\Users\FGuo\Documents\work doucment\attachment\attachmentDB\20161005\originalFileFromAerial\DOCSVC_20161003.tar\DOCSVC_20161003\Sect2\INPATIENT\REQ_20160222-000034\Marmol, Roberto - NORTH CENTRAL BRONX HOSPITAL 8.9.16_2016-08-09-15.12.39.200.pdf
Request;20160222-000034;34109;PACE;Inpatient;PACE;C:\Users\FGuo\Documents\work doucment\attachment\attachmentDB\20161005\originalFileFromAerial\DOCSVC_20161003.tar\DOCSVC_20161003\Sect2\INPATIENT\REQ_20160222-000034\Marmol, Roberto_2-25-16_clinical_2016-02-25-16.30.09.815.tif
Request;20160222-000034;34109;PACE;Inpatient;PACE;C:\Users\FGuo\Documents\work doucment\attachment\attachmentDB\20161005\originalFileFromAerial\DOCSVC_20161003.tar\DOCSVC_20161003\Sect2\INPATIENT\REQ_20160222-000034\Marmol.R___NorthCentralBronx___ Clinical Request Form_ 02.22.16_2016-02-22-14.12.14.513.docx
Request;20160222-000034;34109;PACE;Inpatient;PACE;C:\Users\FGuo\Documents\work doucment\attachment\attachmentDB\20161005\originalFileFromAerial\DOCSVC_20161003.tar\DOCSVC_20161003\Sect2\INPATIENT\REQ_20160222-000034\O_\Waters Place\Aerial\Auth Req_Clinicals\Marmol.R___NorthCentralBronx___ Clinical Request Form_ 02.22.16_2016-02-22-14.10.39.857.docx
Request;20160222-000037;99570;PACE;Inpatient;PACE;C:\Users\FGuo\Documents\work doucment\attachment\attachmentDB\20161005\originalFileFromAerial\DOCSVC_20161003.tar\DOCSVC_20161003\Sect2\INPATIENT\REQ_20160222-000037\gilberto nieves 22316_2016-02-23-10.46.18.352.tif
Request;20160222-000037;99570;PACE;Inpatient;PACE;C:\Users\FGuo\Documents\work doucment\attachment\attachmentDB\20161005\originalFileFromAerial\DOCSVC_20161003.tar\DOCSVC_20161003\Sect2\INPATIENT\REQ_20160222-000037\NIEVES, GILBERTO CLINICAL REVIEW REQUEST FORM_2016-02-22-15.13.32.114.doc
Request;20160222-000038;80552;SELECT;Inpatient;SELECT;C:\Users\FGuo\Documents\work doucment\attachment\attachmentDB\20161005\originalFileFromAerial\DOCSVC_20161003.tar\DOCSVC_20161003\Sect2\INPATIENT\REQ_20160222-000038\AH S CHIANG 09.01.16_2016-09-06-13.36.30.608.tif
Request;20160222-000038;80552;SELECT;Inpatient;SELECT;C:\Users\FGuo\Documents\work doucment\attachment\attachmentDB\20161005\originalFileFromAerial\DOCSVC_20161003.tar\DOCSVC_20161003\Sect2\INPATIENT\REQ_20160222-000038\chiang ah 32116_2016-03-21-12.43.56.604.tif
Request;20160222-000038;80552;SELECT;Inpatient;SELECT;C:\Users\FGuo\Documents\work doucment\attachment\attachmentDB\20161005\originalFileFromAerial\DOCSVC_20161003.tar\DOCSVC_20161003\Sect2\INPATIENT\REQ_20160222-000038\chiang Ah s 22216_2016-02-22-15.02.37.46.tif
Request;20160222-000038;80552;SELECT;Inpatient;SELECT;C:\Users\FGuo\Documents\work doucment\attachment\attachmentDB\20161005\originalFileFromAerial\DOCSVC_20161003.tar\DOCSVC_20161003\Sect2\INPATIENT\REQ_20160222-000038\Chiang, Ah S - New franklin Rehabilitation & Health Care 07202016_2016-07-20-12.51.56.604.pdf
Request;20160222-000045;39189;PACE;Inpatient;PACE;C:\Users\FGuo\Documents\work doucment\attachment\attachmentDB\20161005\originalFileFromAerial\DOCSVC_20161003.tar\DOCSVC_20161003\Sect2\INPATIENT\REQ_20160222-000045\Jamilla Khan pri_2016-02-22-15.25.14.741.tif
Request;20160222-000045;39189;PACE;Inpatient;PACE;C:\Users\FGuo\Documents\work doucment\attachment\attachmentDB\20161005\originalFileFromAerial\DOCSVC_20161003.tar\DOCSVC_20161003\Sect2\INPATIENT\REQ_20160222-000045\Khan, Jamilla - MARGARET TIETZ NURSING AND REHAB CTR8.9.16_2016-08-09-09.55.23.500.pdf
Request;20160222-000047;56243;DIRECT;Inpatient;DIRECT;C:\Users\FGuo\Documents\work doucment\attachment\attachmentDB\20161005\originalFileFromAerial\DOCSVC_20161003.tar\DOCSVC_20161003\Sect2\INPATIENT\REQ_20160222-000047\Gura, Ilya  56243_2016-02-23-11.50.50.419.docx
Request;20160222-000047;56243;DIRECT;Inpatient;DIRECT;C:\Users\FGuo\Documents\work doucment\attachment\attachmentDB\20161005\originalFileFromAerial\DOCSVC_20161003.tar\DOCSVC_20161003\Sect2\INPATIENT\REQ_20160222-000047\Gura, Ilya - MAIMONIDES MEDICAL CENTER 8.9.16_2016-08-09-12.24.54.136.pdf
Request;20160222-000047;56243;DIRECT;Inpatient;DIRECT;C:\Users\FGuo\Documents\work doucment\attachment\attachmentDB\20161005\originalFileFromAerial\DOCSVC_20161003.tar\DOCSVC_20161003\Sect2\INPATIENT\REQ_20160222-000047\Gura, Ilya CLINICAL RQ_2016-02-22-15.37.02.187.docx
Request;20160222-000047;56243;DIRECT;Inpatient;DIRECT;C:\Users\FGuo\Documents\work doucment\attachment\attachmentDB\20161005\originalFileFromAerial\DOCSVC_20161003.tar\DOCSVC_20161003\Sect2\INPATIENT\REQ_20160222-000047\Gura, Ilya_2016-02-22-15.31.52.362.tif
Request;20160222-000048;70193;null;Inpatient;PACE;C:\Users\FGuo\Documents\work doucment\attachment\attachmentDB\20161005\originalFileFromAerial\DOCSVC_20161003.tar\DOCSVC_20161003\Sect2\INPATIENT\REQ_20160222-000048\cruz luz22516_2016-02-25-12.55.16.243.tif
Request;20160222-000048;70193;null;Inpatient;PACE;C:\Users\FGuo\Documents\work doucment\attachment\attachmentDB\20161005\originalFileFromAerial\DOCSVC_20161003.tar\DOCSVC_20161003\Sect2\INPATIENT\REQ_20160222-000048\CRUZ, LUZ CLINICAL REVIEW REQUEST FORM_2016-02-22-15.43.55.795.doc
Request;20160222-000049;59187;PACE;Inpatient;PACE;C:\Users\FGuo\Documents\work doucment\attachment\attachmentDB\20161005\originalFileFromAerial\DOCSVC_20161003.tar\DOCSVC_20161003\Sect2\INPATIENT\REQ_20160222-000049\Cipriano, Lucia - WHITE PLAINS HOSPITAL 8.9.16_2016-08-09-16.03.08.409.pdf
Request;20160222-000049;59187;PACE;Inpatient;PACE;C:\Users\FGuo\Documents\work doucment\attachment\attachmentDB\20161005\originalFileFromAerial\DOCSVC_20161003.tar\DOCSVC_20161003\Sect2\INPATIENT\REQ_20160222-000049\Cipriano, Lucia - WHITE PLAINS HOSPITAL 8.9.16_2016-08-09-16.04.37.72.pdf
Request;20160222-000049;59187;PACE;Inpatient;PACE;C:\Users\FGuo\Documents\work doucment\attachment\attachmentDB\20161005\originalFileFromAerial\DOCSVC_20161003.tar\DOCSVC_20161003\Sect2\INPATIENT\REQ_20160222-000049\CIPRIANO, LUCIA -2-25-PDF_2016-02-25-16.54.29.956.pdf
Request;20160222-000049;59187;PACE;Inpatient;PACE;C:\Users\FGuo\Documents\work doucment\attachment\attachmentDB\20161005\originalFileFromAerial\DOCSVC_20161003.tar\DOCSVC_20161003\Sect2\INPATIENT\REQ_20160222-000049\O_\59187 CIPRIANO, LUCIA UR REQ SHEET_2016-02-22-15.54.14.248.doc
Request;20160222-000050;43839;PACE;Inpatient;PACE;C:\Users\FGuo\Documents\work doucment\attachment\attachmentDB\20161005\originalFileFromAerial\DOCSVC_20161003.tar\DOCSVC_20161003\Sect2\INPATIENT\REQ_20160222-000050\Colucci, Lucille - WHITE PLAINS HOSPITAL 8.9.16_2016-08-09-14.36.45.999.pdf
Request;20160222-000050;43839;PACE;Inpatient;PACE;C:\Users\FGuo\Documents\work doucment\attachment\attachmentDB\20161005\originalFileFromAerial\DOCSVC_20161003.tar\DOCSVC_20161003\Sect2\INPATIENT\REQ_20160222-000050\COLUCCI, LUCILLE_CLINICAL_2-25-16_2016-02-25-15.49.15.462.tif
Request;20160222-000050;43839;PACE;Inpatient;PACE;C:\Users\FGuo\Documents\work doucment\attachment\attachmentDB\20161005\originalFileFromAerial\DOCSVC_20161003.tar\DOCSVC_20161003\Sect2\INPATIENT\REQ_20160222-000050\O_\43839 COLUCCI, LUCILLE UR REQ SHEET_2016-02-22-16.02.06.715.doc
Request;20160222-000052;42190;PACE;Inpatient;PACE;C:\Users\FGuo\Documents\work doucment\attachment\attachmentDB\20161005\originalFileFromAerial\DOCSVC_20161003.tar\DOCSVC_20161003\Sect2\INPATIENT\REQ_20160222-000052\Riley Ninevah - White Plains Center For Nursing Care 2-23-16_2016-02-23-15.20.42.173.pdf
Request;20160222-000052;42190;PACE;Inpatient;PACE;C:\Users\FGuo\Documents\work doucment\attachment\attachmentDB\20161005\originalFileFromAerial\DOCSVC_20161003.tar\DOCSVC_20161003\Sect2\INPATIENT\REQ_20160222-000052\Riley, Ninevah_PRI_2016-02-22-16.10.06.210.tif
Request;20160223-000003;70410;PACE;Inpatient;PACE;C:\Users\FGuo\Documents\work doucment\attachment\attachmentDB\20161005\originalFileFromAerial\DOCSVC_20161003.tar\DOCSVC_20161003\Sect2\INPATIENT\REQ_20160223-000003\05062016 Martinez, Leopoldina_2016-06-23-08.53.01.384.pdf
Request;20160223-000003;70410;PACE;Inpatient;PACE;C:\Users\FGuo\Documents\work doucment\attachment\attachmentDB\20161005\originalFileFromAerial\DOCSVC_20161003.tar\DOCSVC_20161003\Sect2\INPATIENT\REQ_20160223-000003\Martinez, Leopoldina  IPDenial Bronx Lebanon Hospital Center 3-1-16_2016-03-01-11.52.00.936.pdf
Request;20160223-000003;70410;PACE;Inpatient;PACE;C:\Users\FGuo\Documents\work doucment\attachment\attachmentDB\20161005\originalFileFromAerial\DOCSVC_20161003.tar\DOCSVC_20161003\Sect2\INPATIENT\REQ_20160223-000003\Martinez, Leopoldina - Bronx Lebanon Hospital Ctr Clinical Review Request 2-23-16_2016-02-23-09.37.11.68.docx
Request;20160223-000003;70410;PACE;Inpatient;PACE;C:\Users\FGuo\Documents\work doucment\attachment\attachmentDB\20161005\originalFileFromAerial\DOCSVC_20161003.tar\DOCSVC_20161003\Sect2\INPATIENT\REQ_20160223-000003\MARTINEZ, LEO_CLINICAL_2-25-16_2016-02-25-12.54.01.650.tif
Request;20160223-000004;28908;SELECT;Inpatient;SELECT;C:\Users\FGuo\Documents\work doucment\attachment\attachmentDB\20161005\originalFileFromAerial\DOCSVC_20161003.tar\DOCSVC_20161003\Sect2\INPATIENT\REQ_20160223-000004\Brik, Lyudmila  - Sheepshead Nursing & Rehab Center( Auth 20160223-000004)3.11.16_2016-03-11-13.09.26.675.pdf
Request;20160223-000005;85228;PACE;Inpatient;PACE;C:\Users\FGuo\Documents\work doucment\attachment\attachmentDB\20161005\originalFileFromAerial\DOCSVC_20161003.tar\DOCSVC_20161003\Sect2\INPATIENT\REQ_20160223-000005\kenny mary ur 22416_2016-02-24-14.00.34.680.tif
Request;20160223-000005;85228;PACE;Inpatient;PACE;C:\Users\FGuo\Documents\work doucment\attachment\attachmentDB\20161005\originalFileFromAerial\DOCSVC_20161003.tar\DOCSVC_20161003\Sect2\INPATIENT\REQ_20160223-000005\Kenny Tonwen Mary  IP Denial Staten Island University Hospital N 3-1-16_2016-03-01-10.46.19.771.pdf
Request;20160223-000005;85228;PACE;Inpatient;PACE;C:\Users\FGuo\Documents\work doucment\attachment\attachmentDB\20161005\originalFileFromAerial\DOCSVC_20161003.tar\DOCSVC_20161003\Sect2\INPATIENT\REQ_20160223-000005\KENNY, TONWEN MARY - ADMISSION_2016-02-23-09.54.14.664.tif
Request;20160223-000005;85228;PACE;Inpatient;PACE;C:\Users\FGuo\Documents\work doucment\attachment\attachmentDB\20161005\originalFileFromAerial\DOCSVC_20161003.tar\DOCSVC_20161003\Sect2\INPATIENT\REQ_20160223-000005\KENNY, TONWEN MARY - CLINICAL REVIEW REQUEST FORM_2016-02-23-09.57.52.376.doc
Request;20160223-000012;97334;PACE;Inpatient;PACE;C:\Users\FGuo\Documents\work doucment\attachment\attachmentDB\20161005\originalFileFromAerial\DOCSVC_20161003.tar\DOCSVC_20161003\Sect2\INPATIENT\REQ_20160223-000012\alice robinson22416_2016-02-24-19.41.50.282.tif
Request;20160223-000012;97334;PACE;Inpatient;PACE;C:\Users\FGuo\Documents\work doucment\attachment\attachmentDB\20161005\originalFileFromAerial\DOCSVC_20161003.tar\DOCSVC_20161003\Sect2\INPATIENT\REQ_20160223-000012\Robinson, Alice - Mount Sinai Hospital Clinical Review Request Form 2-23-16_2016-02-23-10.26.10.304.docx
Request;20160223-000016;21697;PACE;Inpatient;PACE;C:\Users\FGuo\Documents\work doucment\attachment\attachmentDB\20161005\originalFileFromAerial\DOCSVC_20161003.tar\DOCSVC_20161003\Sect2\INPATIENT\REQ_20160223-000016\Lopez Nicolas IP Denial Brooklyn Hospital Center 2.26.2016_2016-02-26-16.34.15.726.pdf
Request;20160223-000016;21697;PACE;Inpatient;PACE;C:\Users\FGuo\Documents\work doucment\attachment\attachmentDB\20161005\originalFileFromAerial\DOCSVC_20161003.tar\DOCSVC_20161003\Sect2\INPATIENT\REQ_20160223-000016\Lopez, Nicolas_clinical_2-24-16_2016-02-25-17.05.59.980.pdf
Request;20160223-000016;21697;PACE;Inpatient;PACE;C:\Users\FGuo\Documents\work doucment\attachment\attachmentDB\20161005\originalFileFromAerial\DOCSVC_20161003.tar\DOCSVC_20161003\Sect2\INPATIENT\REQ_20160223-000016\Lopez, Nicolas_Notes-PRI_2-24-16_2016-02-25-17.06.48.25.pdf
Request;20160223-000021;46626;null;Inpatient;DIRECT;C:\Users\FGuo\Documents\work doucment\attachment\attachmentDB\20161005\originalFileFromAerial\DOCSVC_20161003.tar\DOCSVC_20161003\Sect2\INPATIENT\REQ_20160223-000021\RJ Velez, L 2-25-16_2016-02-26-11.29.02.854.tif
Request;20160223-000021;46626;null;Inpatient;DIRECT;C:\Users\FGuo\Documents\work doucment\attachment\attachmentDB\20161005\originalFileFromAerial\DOCSVC_20161003.tar\DOCSVC_20161003\Sect2\INPATIENT\REQ_20160223-000021\Velez Mojica, L 46626 3-10-16_2016-03-11-10.02.56.188.tif
Request;20160223-000021;46626;null;Inpatient;DIRECT;C:\Users\FGuo\Documents\work doucment\attachment\attachmentDB\20161005\originalFileFromAerial\DOCSVC_20161003.tar\DOCSVC_20161003\Sect2\INPATIENT\REQ_20160223-000021\Velez Mojica, Luz - MMC Einstein Clinical Review Request Form 2-23-16_2016-02-23-11.03.27.419.docx
Request;20160223-000021;46626;null;Inpatient;DIRECT;C:\Users\FGuo\Documents\work doucment\attachment\attachmentDB\20161005\originalFileFromAerial\DOCSVC_20161003.tar\DOCSVC_20161003\Sect2\INPATIENT\REQ_20160223-000021\Velez Mojica, Luz - Montefiore Medical Center - 5.3.16_2016-05-03-14.02.29.810.pdf
Request;20160223-000021;46626;null;Inpatient;DIRECT;C:\Users\FGuo\Documents\work doucment\attachment\attachmentDB\20161005\originalFileFromAerial\DOCSVC_20161003.tar\DOCSVC_20161003\Sect2\INPATIENT\REQ_20160223-000021\Velez, Luz_2-29-16_2016-02-29-11.08.54.936.tif
Request;20160223-000021;46626;null;Inpatient;DIRECT;C:\Users\FGuo\Documents\work doucment\attachment\attachmentDB\20161005\originalFileFromAerial\DOCSVC_20161003.tar\DOCSVC_20161003\Sect2\INPATIENT\REQ_20160223-000021\_2016-02-29-11.09.35.694
Request;20160223-000022;61111;SELECT;Inpatient;SELECT;C:\Users\FGuo\Documents\work doucment\attachment\attachmentDB\20161005\originalFileFromAerial\DOCSVC_20161003.tar\DOCSVC_20161003\Sect2\INPATIENT\REQ_20160223-000022\Halaly, Nur  61111_2016-02-23-11.14.12.513.tif
Request;20160223-000022;61111;SELECT;Inpatient;SELECT;C:\Users\FGuo\Documents\work doucment\attachment\attachmentDB\20161005\originalFileFromAerial\DOCSVC_20161003.tar\DOCSVC_20161003\Sect2\INPATIENT\REQ_20160223-000022\Halaly, Nur - Four Seasons Nursing Home 2 - 4.4.16_2016-04-04-12.12.28.534.pdf
Request;20160223-000029;52687;PACE;Inpatient;PACE;C:\Users\FGuo\Documents\work doucment\attachment\attachmentDB\20161005\originalFileFromAerial\DOCSVC_20161003.tar\DOCSVC_20161003\Sect2\INPATIENT\REQ_20160223-000029\RJ Saxton, Inez- Utilization Review 2-20-16_2016-02-23-12.51.39.542.tif
Request;20160223-000029;52687;PACE;Inpatient;PACE;C:\Users\FGuo\Documents\work doucment\attachment\attachmentDB\20161005\originalFileFromAerial\DOCSVC_20161003.tar\DOCSVC_20161003\Sect2\INPATIENT\REQ_20160223-000029\Saxton, Inez M - MONTEFIORE MEDICAL CENTER 8.9.16_2016-08-09-15.51.05.329.pdf
Request;20160223-000029;52687;PACE;Inpatient;PACE;C:\Users\FGuo\Documents\work doucment\attachment\attachmentDB\20161005\originalFileFromAerial\DOCSVC_20161003.tar\DOCSVC_20161003\Sect2\INPATIENT\REQ_20160223-000029\saxton_inez_2-25_pdf_2016-02-25-16.49.18.177.pdf
Request;20160223-000031;51642;null;Inpatient;DIRECT;C:\Users\FGuo\Documents\work doucment\attachment\attachmentDB\20161005\originalFileFromAerial\DOCSVC_20161003.tar\DOCSVC_20161003\Sect2\INPATIENT\REQ_20160223-000031\Goncalves.A___No.  51642__ Montefior NR__DOA.  02.22.16____Rcvd. 03.04.16____04.14.16_2016-04-14-11.10.12.292.tif
Request;20160223-000031;51642;null;Inpatient;DIRECT;C:\Users\FGuo\Documents\work doucment\attachment\attachmentDB\20161005\originalFileFromAerial\DOCSVC_20161003.tar\DOCSVC_20161003\Sect2\INPATIENT\REQ_20160223-000031\G_\Genis\Inpt Admit\Goncalves, Augusta 51642- Medical Center Clinical Review Request Form_2016-02-23-12.16.38.244.doc
Request;20160223-000031;51642;null;Inpatient;DIRECT;C:\Users\FGuo\Documents\work doucment\attachment\attachmentDB\20161005\originalFileFromAerial\DOCSVC_20161003.tar\DOCSVC_20161003\Sect2\INPATIENT\REQ_20160223-000031\O_\51642 GONCALVES, AUGUSTA CLINICALS_2016-02-29-10.05.00.820.tif
Request;20160223-000032;26301;PACE;Inpatient;PACE;C:\Users\FGuo\Documents\work doucment\attachment\attachmentDB\20161005\originalFileFromAerial\DOCSVC_20161003.tar\DOCSVC_20161003\Sect2\INPATIENT\REQ_20160223-000032\narda vidal pri22316_2016-02-23-13.00.21.992.tif
Request;20160223-000032;26301;PACE;Inpatient;PACE;C:\Users\FGuo\Documents\work doucment\attachment\attachmentDB\20161005\originalFileFromAerial\DOCSVC_20161003.tar\DOCSVC_20161003\Sect2\INPATIENT\REQ_20160223-000032\narda vidal22416_2016-02-24-13.45.54.218.tif
Request;20160223-000034;58773;null;Inpatient;PACE;C:\Users\FGuo\Documents\work doucment\attachment\attachmentDB\20161005\originalFileFromAerial\DOCSVC_20161003.tar\DOCSVC_20161003\Sect2\INPATIENT\REQ_20160223-000034\fayva hassanienpri22316_2016-02-23-13.51.45.266.tif
Request;20160223-000039;74644;PACE;Inpatient;PACE;C:\Users\FGuo\Documents\work doucment\attachment\attachmentDB\20161005\originalFileFromAerial\DOCSVC_20161003.tar\DOCSVC_20161003\Sect2\INPATIENT\REQ_20160223-000039\PAUL, MARTHA ALBERTA - ADMISSION_2016-02-23-13.02.53.116.pdf
Request;20160223-000039;74644;PACE;Inpatient;PACE;C:\Users\FGuo\Documents\work doucment\attachment\attachmentDB\20161005\originalFileFromAerial\DOCSVC_20161003.tar\DOCSVC_20161003\Sect2\INPATIENT\REQ_20160223-000039\PAUL, MARTHA ALBERTA - CLINICAL REVIEW REQUEST FORM_2016-02-23-13.08.03.758.doc
Request;20160223-000040;58746;PACE;Inpatient;PACE;C:\Users\FGuo\Documents\work doucment\attachment\attachmentDB\20161005\originalFileFromAerial\DOCSVC_20161003.tar\DOCSVC_20161003\Sect2\INPATIENT\REQ_20160223-000040\bennie jenkins3116_2016-03-01-16.42.59.128.tif
Request;20160223-000040;58746;PACE;Inpatient;PACE;C:\Users\FGuo\Documents\work doucment\attachment\attachmentDB\20161005\originalFileFromAerial\DOCSVC_20161003.tar\DOCSVC_20161003\Sect2\INPATIENT\REQ_20160223-000040\bennie jenkins31416_2016-03-14-10.57.20.392.tif
Request;20160223-000040;58746;PACE;Inpatient;PACE;C:\Users\FGuo\Documents\work doucment\attachment\attachmentDB\20161005\originalFileFromAerial\DOCSVC_20161003.tar\DOCSVC_20161003\Sect2\INPATIENT\REQ_20160223-000040\Jenkins, Bennie_Rehab Notes_2-23-16_2016-02-23-13.04.37.41.pdf
Request;20160223-000040;58746;PACE;Inpatient;PACE;C:\Users\FGuo\Documents\work doucment\attachment\attachmentDB\20161005\originalFileFromAerial\DOCSVC_20161003.tar\DOCSVC_20161003\Sect2\INPATIENT\REQ_20160223-000040\Jenkins,Bennie N-Atlantis Rehab & RHCF 07252016_2016-07-25-08.38.44.521.pdf
Request;20160223-000041;77606;PACE;Inpatient;PACE;C:\Users\FGuo\Documents\work doucment\attachment\attachmentDB\20161005\originalFileFromAerial\DOCSVC_20161003.tar\DOCSVC_20161003\Sect2\INPATIENT\REQ_20160223-000041\O_\Waters Place\Aerial\Auth Req_Clinicals\Pranio.P__SIUH_North__ Clinical Request Form_ 02.23.16_2016-02-23-13.06.52.352.docx
Request;20160223-000041;77606;PACE;Inpatient;PACE;C:\Users\FGuo\Documents\work doucment\attachment\attachmentDB\20161005\originalFileFromAerial\DOCSVC_20161003.tar\DOCSVC_20161003\Sect2\INPATIENT\REQ_20160223-000041\PPranio_2016-02-25-11.51.04.311.tif
Request;20160223-000041;77606;PACE;Inpatient;PACE;C:\Users\FGuo\Documents\work doucment\attachment\attachmentDB\20161005\originalFileFromAerial\DOCSVC_20161003.tar\DOCSVC_20161003\Sect2\INPATIENT\REQ_20160223-000041\Pranio.P__SIUH_North__ Clinical Request Form_ 02.23.16_2016-02-23-13.07.47.764.docx
Request;20160223-000043;91561;PACE;Inpatient;PACE;C:\Users\FGuo\Documents\work doucment\attachment\attachmentDB\20161005\originalFileFromAerial\DOCSVC_20161003.tar\DOCSVC_20161003\Sect2\INPATIENT\REQ_20160223-000043\MX-3140N_20160309_112806_2016-03-09-12.05.46.921.pdf
Request;20160223-000043;91561;PACE;Inpatient;PACE;C:\Users\FGuo\Documents\work doucment\attachment\attachmentDB\20161005\originalFileFromAerial\DOCSVC_20161003.tar\DOCSVC_20161003\Sect2\INPATIENT\REQ_20160223-000043\Walters, Frederica  IP Denial Brookdale Univ Hospital 5-6-16_2016-05-06-16.13.09.954.pdf
Request;20160223-000043;91561;PACE;Inpatient;PACE;C:\Users\FGuo\Documents\work doucment\attachment\attachmentDB\20161005\originalFileFromAerial\DOCSVC_20161003.tar\DOCSVC_20161003\Sect2\INPATIENT\REQ_20160223-000043\Walters, Frederica  IP Denial Montefiore Medical Center 5-6-16_2016-05-17-14.44.17.757.docx
Request;20160223-000043;91561;PACE;Inpatient;PACE;C:\Users\FGuo\Documents\work doucment\attachment\attachmentDB\20161005\originalFileFromAerial\DOCSVC_20161003.tar\DOCSVC_20161003\Sect2\INPATIENT\REQ_20160223-000043\Walters, Frederica - Montefiore Med Cen-Moses-Clinical Review Request Form 2-23-16_2016-02-23-13.19.00.494.docx
Request;20160223-000045;85228;PACE;Inpatient;PACE;C:\Users\FGuo\Documents\work doucment\attachment\attachmentDB\20161005\originalFileFromAerial\DOCSVC_20161003.tar\DOCSVC_20161003\Sect2\INPATIENT\REQ_20160223-000045\BA-FAX1_1602221920523314_2016-02-25-11.45.28.805.TIF
Request;20160223-000045;85228;PACE;Inpatient;PACE;C:\Users\FGuo\Documents\work doucment\attachment\attachmentDB\20161005\originalFileFromAerial\DOCSVC_20161003.tar\DOCSVC_20161003\Sect2\INPATIENT\REQ_20160223-000045\Kenny Tonwen Mary -Clove Lake Healthcare Rehab 2-25-16_2016-02-25-11.46.35.149.pdf
Request;20160223-000046;57763;PACE;Inpatient;PACE;C:\Users\FGuo\Documents\work doucment\attachment\attachmentDB\20161005\originalFileFromAerial\DOCSVC_20161003.tar\DOCSVC_20161003\Sect2\INPATIENT\REQ_20160223-000046\O_\Waters Place\Aerial\Auth Req_Clinicals\Ramos.V___QueensHospitalCenter__ Clinical Request Form_ 02.23.16_2016-02-23-13.36.23.602.docx
Request;20160223-000046;57763;PACE;Inpatient;PACE;C:\Users\FGuo\Documents\work doucment\attachment\attachmentDB\20161005\originalFileFromAerial\DOCSVC_20161003.tar\DOCSVC_20161003\Sect2\INPATIENT\REQ_20160223-000046\Ramos Venilda IP Denial Queens Hospital Center 3-8-16_2016-03-09-09.54.43.955.pdf
Request;20160223-000046;57763;PACE;Inpatient;PACE;C:\Users\FGuo\Documents\work doucment\attachment\attachmentDB\20161005\originalFileFromAerial\DOCSVC_20161003.tar\DOCSVC_20161003\Sect2\INPATIENT\REQ_20160223-000046\ramos venilda22916_2016-03-01-11.44.30.948.tif
Request;20160223-000046;57763;PACE;Inpatient;PACE;C:\Users\FGuo\Documents\work doucment\attachment\attachmentDB\20161005\originalFileFromAerial\DOCSVC_20161003.tar\DOCSVC_20161003\Sect2\INPATIENT\REQ_20160223-000046\RAMOS, VENILDA_1OF2_041916_2016-05-27-11.04.53.733.pdf
Request;20160223-000046;57763;PACE;Inpatient;PACE;C:\Users\FGuo\Documents\work doucment\attachment\attachmentDB\20161005\originalFileFromAerial\DOCSVC_20161003.tar\DOCSVC_20161003\Sect2\INPATIENT\REQ_20160223-000046\RAMOS, VENILDA_MR2OF2_041916_2016-05-27-11.22.28.725.pdf
Request;20160223-000046;57763;PACE;Inpatient;PACE;C:\Users\FGuo\Documents\work doucment\attachment\attachmentDB\20161005\originalFileFromAerial\DOCSVC_20161003.tar\DOCSVC_20161003\Sect2\INPATIENT\REQ_20160223-000046\Ramos.V___QueensHospitalCenter__ Clinical Request Form_ 02.23.16_2016-02-23-13.37.55.309.docx
Request;20160223-000059;33979;PACE;Inpatient;PACE;C:\Users\FGuo\Documents\work doucment\attachment\attachmentDB\20161005\originalFileFromAerial\DOCSVC_20161003.tar\DOCSVC_20161003\Sect2\INPATIENT\REQ_20160223-000059\Johnson Augusta - Chester County Hospital 3-4-16_2016-03-04-11.59.00.448.pdf
Request;20160223-000059;33979;PACE;Inpatient;PACE;C:\Users\FGuo\Documents\work doucment\attachment\attachmentDB\20161005\originalFileFromAerial\DOCSVC_20161003.tar\DOCSVC_20161003\Sect2\INPATIENT\REQ_20160223-000059\JOHNSON, AUGUSTA_1OF2_041316_2016-05-25-12.03.08.275.pdf
Request;20160223-000059;33979;PACE;Inpatient;PACE;C:\Users\FGuo\Documents\work doucment\attachment\attachmentDB\20161005\originalFileFromAerial\DOCSVC_20161003.tar\DOCSVC_20161003\Sect2\INPATIENT\REQ_20160223-000059\JOHNSON, AUGUSTA_2OF2_041316_2016-05-25-12.03.30.43.pdf
Request;20160223-000059;33979;PACE;Inpatient;PACE;C:\Users\FGuo\Documents\work doucment\attachment\attachmentDB\20161005\originalFileFromAerial\DOCSVC_20161003.tar\DOCSVC_20161003\Sect2\INPATIENT\REQ_20160223-000059\O_\Waters Place\Aerial\Auth Req_Clinicals\Johnston.A__ Clinical Request Form_02.23.16_2016-02-23-15.04.06.592.docx
Request;20160223-000059;33979;PACE;Inpatient;PACE;C:\Users\FGuo\Documents\work doucment\attachment\attachmentDB\20161005\originalFileFromAerial\DOCSVC_20161003.tar\DOCSVC_20161003\Sect2\INPATIENT\REQ_20160223-000059\O_\Waters Place\Aerial\Auth Req_Clinicals\Johnston.A__ Clinical Request Form_02.29.16_2016-02-29-09.37.01.505.docx
Request;20160223-000061;54630;DIRECT;Inpatient;DIRECT;C:\Users\FGuo\Documents\work doucment\attachment\attachmentDB\20161005\originalFileFromAerial\DOCSVC_20161003.tar\DOCSVC_20161003\Sect2\INPATIENT\REQ_20160223-000061\Lewis Clive IP Denial Beth Israel Medical Center 2-29-16_2016-02-29-11.32.43.530.pdf
Request;20160223-000061;54630;DIRECT;Inpatient;DIRECT;C:\Users\FGuo\Documents\work doucment\attachment\attachmentDB\20161005\originalFileFromAerial\DOCSVC_20161003.tar\DOCSVC_20161003\Sect2\INPATIENT\REQ_20160223-000061\Lewis, Clive 54630 Clinical Review 10 15 Req Form_2016-02-23-15.33.39.454.docx
Request;20160223-000061;54630;DIRECT;Inpatient;DIRECT;C:\Users\FGuo\Documents\work doucment\attachment\attachmentDB\20161005\originalFileFromAerial\DOCSVC_20161003.tar\DOCSVC_20161003\Sect2\INPATIENT\REQ_20160223-000061\Lewis, Clive 54630 hosp adm BA-FAX1_1602201759062665_2016-02-23-15.23.36.792.TIF
Request;20160223-000061;54630;DIRECT;Inpatient;DIRECT;C:\Users\FGuo\Documents\work doucment\attachment\attachmentDB\20161005\originalFileFromAerial\DOCSVC_20161003.tar\DOCSVC_20161003\Sect2\INPATIENT\REQ_20160223-000061\LEWIS, CLIVE_1OF2_042216_2016-05-25-15.12.42.622.pdf
Request;20160223-000061;54630;DIRECT;Inpatient;DIRECT;C:\Users\FGuo\Documents\work doucment\attachment\attachmentDB\20161005\originalFileFromAerial\DOCSVC_20161003.tar\DOCSVC_20161003\Sect2\INPATIENT\REQ_20160223-000061\LEWIS, CLIVE_2OF2_042216_2016-05-25-15.13.09.76.pdf
Request;20160223-000061;54630;DIRECT;Inpatient;DIRECT;C:\Users\FGuo\Documents\work doucment\attachment\attachmentDB\20161005\originalFileFromAerial\DOCSVC_20161003.tar\DOCSVC_20161003\Sect2\INPATIENT\REQ_20160223-000061\Lewis, Clive_clinical_2-23-16_2016-02-25-17.26.58.234.pdf
Request;20160223-000070;84891;DIRECT;Inpatient;DIRECT;C:\Users\FGuo\Documents\work doucment\attachment\attachmentDB\20161005\originalFileFromAerial\DOCSVC_20161003.tar\DOCSVC_20161003\Sect2\INPATIENT\REQ_20160223-000070\Davis Merle IP Denial White Plains Hospital 2-26-16_2016-02-26-10.05.33.87.pdf
Request;20160223-000070;84891;DIRECT;Inpatient;DIRECT;C:\Users\FGuo\Documents\work doucment\attachment\attachmentDB\20161005\originalFileFromAerial\DOCSVC_20161003.tar\DOCSVC_20161003\Sect2\INPATIENT\REQ_20160223-000070\DAVIS, MERLE_CLINICAL_2016-02-25-13.00.09.519.tif
Request;20160223-000070;84891;DIRECT;Inpatient;DIRECT;C:\Users\FGuo\Documents\work doucment\attachment\attachmentDB\20161005\originalFileFromAerial\DOCSVC_20161003.tar\DOCSVC_20161003\Sect2\INPATIENT\REQ_20160223-000070\O_\84891 DAVIS, MERLE UR REQ SHEET_2016-02-23-16.09.39.618.doc
Request;20160224-000015;47638;PACE;Inpatient;PACE;C:\Users\FGuo\Documents\work doucment\attachment\attachmentDB\20161005\originalFileFromAerial\DOCSVC_20161003.tar\DOCSVC_20161003\Sect2\INPATIENT\REQ_20160224-000015\Schmulson, Yetta - JACOBI MEDICAL CENTER_2016-08-22-13.05.03.188.pdf
Request;20160224-000015;47638;PACE;Inpatient;PACE;C:\Users\FGuo\Documents\work doucment\attachment\attachmentDB\20161005\originalFileFromAerial\DOCSVC_20161003.tar\DOCSVC_20161003\Sect2\INPATIENT\REQ_20160224-000015\Schmulson, Yetta 47638 Clinical Review 10 15 Req Form_2016-02-24-10.52.29.870.docx
Request;20160224-000015;47638;PACE;Inpatient;PACE;C:\Users\FGuo\Documents\work doucment\attachment\attachmentDB\20161005\originalFileFromAerial\DOCSVC_20161003.tar\DOCSVC_20161003\Sect2\INPATIENT\REQ_20160224-000015\Yetta_3-3-2016_ PDF_2016-03-04-11.27.03.323.pdf
Request;20160224-000017;30846;PACE;Inpatient;PACE;C:\Users\FGuo\Documents\work doucment\attachment\attachmentDB\20161005\originalFileFromAerial\DOCSVC_20161003.tar\DOCSVC_20161003\Sect2\INPATIENT\REQ_20160224-000017\Frolova, Ana_Clinical_2016-02-29-15.48.20.577.tif
Request;20160224-000017;30846;PACE;Inpatient;PACE;C:\Users\FGuo\Documents\work doucment\attachment\attachmentDB\20161005\originalFileFromAerial\DOCSVC_20161003.tar\DOCSVC_20161003\Sect2\INPATIENT\REQ_20160224-000017\Frolova, Anna  2-29-16_2016-02-29-10.23.20.867.docx
Request;20160224-000017;30846;PACE;Inpatient;PACE;C:\Users\FGuo\Documents\work doucment\attachment\attachmentDB\20161005\originalFileFromAerial\DOCSVC_20161003.tar\DOCSVC_20161003\Sect2\INPATIENT\REQ_20160224-000017\Frolova, Anna - NEW YORK COMMUNITY HOSP OF BROOKLYN 8.17.16_2016-08-17-09.55.42.791.pdf
Request;20160224-000017;30846;PACE;Inpatient;PACE;C:\Users\FGuo\Documents\work doucment\attachment\attachmentDB\20161005\originalFileFromAerial\DOCSVC_20161003.tar\DOCSVC_20161003\Sect2\INPATIENT\REQ_20160224-000017\Frolova, Anna - NY Comm Hosp of Brooklyn Clinical Review Request Form 2-24-16_2016-02-24-11.09.36.736.docx
Request;20160224-000022;26758;PACE;Inpatient;PACE;C:\Users\FGuo\Documents\work doucment\attachment\attachmentDB\20161005\originalFileFromAerial\DOCSVC_20161003.tar\DOCSVC_20161003\Sect2\INPATIENT\REQ_20160224-000022\Singh, Rookmin - MMC Einstein Clinical Review Request Form 2-24-16_2016-02-24-11.47.15.724.docx
Request;20160224-000022;26758;PACE;Inpatient;PACE;C:\Users\FGuo\Documents\work doucment\attachment\attachmentDB\20161005\originalFileFromAerial\DOCSVC_20161003.tar\DOCSVC_20161003\Sect2\INPATIENT\REQ_20160224-000022\Singh, Rookmin - MONTEFIORE MEDICAL CENTER 8.9.16_2016-08-09-15.36.09.910.pdf
Request;20160224-000022;26758;PACE;Inpatient;PACE;C:\Users\FGuo\Documents\work doucment\attachment\attachmentDB\20161005\originalFileFromAerial\DOCSVC_20161003.tar\DOCSVC_20161003\Sect2\INPATIENT\REQ_20160224-000022\Singh,Rookmin_ clinical_2016-02-25-16.40.49.473.tif
Request;20160224-000024;87754;PACE;Inpatient;PACE;C:\Users\FGuo\Documents\work doucment\attachment\attachmentDB\20161005\originalFileFromAerial\DOCSVC_20161003.tar\DOCSVC_20161003\Sect2\INPATIENT\REQ_20160224-000024\Younge-King Doraldina  IP Denial  New York Methodist Hospital 2-29-16_2016-02-29-12.11.47.438.pdf
Request;20160224-000024;87754;PACE;Inpatient;PACE;C:\Users\FGuo\Documents\work doucment\attachment\attachmentDB\20161005\originalFileFromAerial\DOCSVC_20161003.tar\DOCSVC_20161003\Sect2\INPATIENT\REQ_20160224-000024\Younge-King, Doraldina 87754 Clinical Review 10 15 Req Form_2016-02-24-12.04.15.863.docx
Request;20160224-000024;87754;PACE;Inpatient;PACE;C:\Users\FGuo\Documents\work doucment\attachment\attachmentDB\20161005\originalFileFromAerial\DOCSVC_20161003.tar\DOCSVC_20161003\Sect2\INPATIENT\REQ_20160224-000024\YOUNGE-KING, DORALDINA_1OF2_042216_2016-05-16-08.51.55.113.pdf
Request;20160224-000024;87754;PACE;Inpatient;PACE;C:\Users\FGuo\Documents\work doucment\attachment\attachmentDB\20161005\originalFileFromAerial\DOCSVC_20161003.tar\DOCSVC_20161003\Sect2\INPATIENT\REQ_20160224-000024\YOUNGE-KING, DORALDINA_2OF2_042216_2016-05-16-08.52.11.296.pdf
Request;20160224-000024;87754;PACE;Inpatient;PACE;C:\Users\FGuo\Documents\work doucment\attachment\attachmentDB\20161005\originalFileFromAerial\DOCSVC_20161003.tar\DOCSVC_20161003\Sect2\INPATIENT\REQ_20160224-000024\Younge-King, Doraldina_clinical_2-26-16_2016-02-26-16.07.40.98.pdf
Request;20160224-000026;22425;PACE;Inpatient;PACE;C:\Users\FGuo\Documents\work doucment\attachment\attachmentDB\20161005\originalFileFromAerial\DOCSVC_20161003.tar\DOCSVC_20161003\Sect2\INPATIENT\REQ_20160224-000026\Chan, Tai Luck - CONEY ISLAND HOSPITAL 8-8-16_2016-08-08-12.16.34.124.pdf
Request;20160224-000026;22425;PACE;Inpatient;PACE;C:\Users\FGuo\Documents\work doucment\attachment\attachmentDB\20161005\originalFileFromAerial\DOCSVC_20161003.tar\DOCSVC_20161003\Sect2\INPATIENT\REQ_20160224-000026\Chan, Tai Luck 2-29-16_2016-02-29-10.13.15.987.doc
Request;20160224-000026;22425;PACE;Inpatient;PACE;C:\Users\FGuo\Documents\work doucment\attachment\attachmentDB\20161005\originalFileFromAerial\DOCSVC_20161003.tar\DOCSVC_20161003\Sect2\INPATIENT\REQ_20160224-000026\Chan, Tai Luck_clinical_2-25-16_2016-03-01-10.51.03.629.pdf
Request;20160224-000026;22425;PACE;Inpatient;PACE;C:\Users\FGuo\Documents\work doucment\attachment\attachmentDB\20161005\originalFileFromAerial\DOCSVC_20161003.tar\DOCSVC_20161003\Sect2\INPATIENT\REQ_20160224-000026\O_\22425 CHAN, TAI LUCK UR REQ SHEET_2016-02-24-12.16.55.594.doc
Request;20160224-000030;60849;SELECT;Inpatient;SELECT;C:\Users\FGuo\Documents\work doucment\attachment\attachmentDB\20161005\originalFileFromAerial\DOCSVC_20161003.tar\DOCSVC_20161003\Sect2\INPATIENT\REQ_20160224-000030\Desola, Anthony - Four Seasons Nursing Home  - 4.26.16_2016-04-26-16.53.26.293.pdf
Request;20160224-000030;60849;SELECT;Inpatient;SELECT;C:\Users\FGuo\Documents\work doucment\attachment\attachmentDB\20161005\originalFileFromAerial\DOCSVC_20161003.tar\DOCSVC_20161003\Sect2\INPATIENT\REQ_20160224-000030\Desola, Anthony II- Four Seasons Nursing Home  -8.9.16_2016-08-09-15.01.47.461.pdf
Request;20160224-000030;60849;SELECT;Inpatient;SELECT;C:\Users\FGuo\Documents\work doucment\attachment\attachmentDB\20161005\originalFileFromAerial\DOCSVC_20161003.tar\DOCSVC_20161003\Sect2\INPATIENT\REQ_20160224-000030\Desola, Anthony II- Four Seasons Nursing Home  -9.29.16_2016-09-29-14.27.14.389.pdf
Request;20160224-000030;60849;SELECT;Inpatient;SELECT;C:\Users\FGuo\Documents\work doucment\attachment\attachmentDB\20161005\originalFileFromAerial\DOCSVC_20161003.tar\DOCSVC_20161003\Sect2\INPATIENT\REQ_20160224-000030\Desola, Anthony_PRI_2-24-16_2016-02-24-13.53.29.853.pdf
Request;20160224-000033;89562;PACE;Inpatient;FIDA;C:\Users\FGuo\Documents\work doucment\attachment\attachmentDB\20161005\originalFileFromAerial\DOCSVC_20161003.tar\DOCSVC_20161003\Sect2\INPATIENT\REQ_20160224-000033\Haris Dorothy -  IP Denial Brooklyn Hospital Center 3-1-16_2016-03-01-16.34.12.435.pdf
Request;20160224-000033;89562;PACE;Inpatient;FIDA;C:\Users\FGuo\Documents\work doucment\attachment\attachmentDB\20161005\originalFileFromAerial\DOCSVC_20161003.tar\DOCSVC_20161003\Sect2\INPATIENT\REQ_20160224-000033\Harris, Dorothy  2-29-16_2016-02-29-10.50.36.945.doc
Request;20160224-000033;89562;PACE;Inpatient;FIDA;C:\Users\FGuo\Documents\work doucment\attachment\attachmentDB\20161005\originalFileFromAerial\DOCSVC_20161003.tar\DOCSVC_20161003\Sect2\INPATIENT\REQ_20160224-000033\Harris, Dorothy_Clinical_2016-02-29-15.38.10.814.tif
Request;20160224-000033;89562;PACE;Inpatient;FIDA;C:\Users\FGuo\Documents\work doucment\attachment\attachmentDB\20161005\originalFileFromAerial\DOCSVC_20161003.tar\DOCSVC_20161003\Sect2\INPATIENT\REQ_20160224-000033\HARRIS, DOROTHY_MR2_041916_2016-05-16-15.34.56.436.pdf
Request;20160224-000033;89562;PACE;Inpatient;FIDA;C:\Users\FGuo\Documents\work doucment\attachment\attachmentDB\20161005\originalFileFromAerial\DOCSVC_20161003.tar\DOCSVC_20161003\Sect2\INPATIENT\REQ_20160224-000033\HARRIS_DOROTHY_MR1_041916_2016-05-16-15.34.39.226.pdf
Request;20160224-000033;89562;PACE;Inpatient;FIDA;C:\Users\FGuo\Documents\work doucment\attachment\attachmentDB\20161005\originalFileFromAerial\DOCSVC_20161003.tar\DOCSVC_20161003\Sect2\INPATIENT\REQ_20160224-000033\O_\89562 HARRIS, DOROTHY UR REQ SHEET_2016-02-24-14.15.43.686.doc
Request;20160224-000034;32461;PACE;Inpatient;PACE;C:\Users\FGuo\Documents\work doucment\attachment\attachmentDB\20161005\originalFileFromAerial\DOCSVC_20161003.tar\DOCSVC_20161003\Sect2\INPATIENT\REQ_20160224-000034\Figueroa Rosa IP Denial Brooklyn Hospital Center 2-29-16_2016-02-29-11.47.59.197.pdf
Request;20160224-000034;32461;PACE;Inpatient;PACE;C:\Users\FGuo\Documents\work doucment\attachment\attachmentDB\20161005\originalFileFromAerial\DOCSVC_20161003.tar\DOCSVC_20161003\Sect2\INPATIENT\REQ_20160224-000034\Figueroa, Rosa_clinical_2-24-16_2016-02-25-17.35.38.233.pdf
Request;20160224-000034;32461;PACE;Inpatient;PACE;C:\Users\FGuo\Documents\work doucment\attachment\attachmentDB\20161005\originalFileFromAerial\DOCSVC_20161003.tar\DOCSVC_20161003\Sect2\INPATIENT\REQ_20160224-000034\FIGUEROA_ROSA _041816_1_2016-05-16-08.49.37.341.pdf
Request;20160224-000034;32461;PACE;Inpatient;PACE;C:\Users\FGuo\Documents\work doucment\attachment\attachmentDB\20161005\originalFileFromAerial\DOCSVC_20161003.tar\DOCSVC_20161003\Sect2\INPATIENT\REQ_20160224-000034\FIGUEROA_ROSA _041816_2_2016-05-16-08.50.08.42.pdf
Request;20160224-000034;32461;PACE;Inpatient;PACE;C:\Users\FGuo\Documents\work doucment\attachment\attachmentDB\20161005\originalFileFromAerial\DOCSVC_20161003.tar\DOCSVC_20161003\Sect2\INPATIENT\REQ_20160224-000034\O_\32461 FIGUEROA, ROSA UR REQ SHEET_2016-02-24-14.21.43.462.doc
Request;20160224-000035;44423;SELECT;Inpatient;SELECT;C:\Users\FGuo\Documents\work doucment\attachment\attachmentDB\20161005\originalFileFromAerial\DOCSVC_20161003.tar\DOCSVC_20161003\Sect2\INPATIENT\REQ_20160224-000035\payne ruth 22416_2016-02-24-14.36.31.239.tif
Request;20160224-000035;44423;SELECT;Inpatient;SELECT;C:\Users\FGuo\Documents\work doucment\attachment\attachmentDB\20161005\originalFileFromAerial\DOCSVC_20161003.tar\DOCSVC_20161003\Sect2\INPATIENT\REQ_20160224-000035\payne ruth 3216_2016-03-03-13.27.02.179.tif
Request;20160224-000035;44423;SELECT;Inpatient;SELECT;C:\Users\FGuo\Documents\work doucment\attachment\attachmentDB\20161005\originalFileFromAerial\DOCSVC_20161003.tar\DOCSVC_20161003\Sect2\INPATIENT\REQ_20160224-000035\Payne, Ruth 44423 NOTIFICATION OF SNF COPAY 2015_2016-02-25-13.22.53.393.doc
Request;20160224-000036;45276;PACE;Inpatient;PACE;C:\Users\FGuo\Documents\work doucment\attachment\attachmentDB\20161005\originalFileFromAerial\DOCSVC_20161003.tar\DOCSVC_20161003\Sect2\INPATIENT\REQ_20160224-000036\James, Esther - MONTEFIORE MEDICAL CENTER 8.9.16_2016-08-10-09.57.50.373.pdf
Request;20160224-000036;45276;PACE;Inpatient;PACE;C:\Users\FGuo\Documents\work doucment\attachment\attachmentDB\20161005\originalFileFromAerial\DOCSVC_20161003.tar\DOCSVC_20161003\Sect2\INPATIENT\REQ_20160224-000036\JAMES, ESTHER_pdf-2-25-16_2016-02-25-15.57.37.54.pdf
Request;20160224-000036;45276;PACE;Inpatient;PACE;C:\Users\FGuo\Documents\work doucment\attachment\attachmentDB\20161005\originalFileFromAerial\DOCSVC_20161003.tar\DOCSVC_20161003\Sect2\INPATIENT\REQ_20160224-000036\O_\Waters Place\Aerial\Auth Req_Clinicals\James.E__MMMC_Moses__Clinical Request Form_02.24.16_2016-02-24-15.00.26.587.docx
Request;20160224-000037;49870;SELECT;Inpatient;FIDA;C:\Users\FGuo\Documents\work doucment\attachment\attachmentDB\20161005\originalFileFromAerial\DOCSVC_20161003.tar\DOCSVC_20161003\Sect2\INPATIENT\REQ_20160224-000037\munawar sultana22916_2016-03-01-11.16.27.442.tif
Request;20160224-000037;49870;SELECT;Inpatient;FIDA;C:\Users\FGuo\Documents\work doucment\attachment\attachmentDB\20161005\originalFileFromAerial\DOCSVC_20161003.tar\DOCSVC_20161003\Sect2\INPATIENT\REQ_20160224-000037\O_\49870 SULTANA, MUNAWAR UR REQ SHEET_2016-02-24-14.49.55.463.doc
Request;20160224-000037;49870;SELECT;Inpatient;FIDA;C:\Users\FGuo\Documents\work doucment\attachment\attachmentDB\20161005\originalFileFromAerial\DOCSVC_20161003.tar\DOCSVC_20161003\Sect2\INPATIENT\REQ_20160224-000037\SULTANA, MUNAWAR - ADMISSION_2016-02-26-09.09.51.215.pdf
Request;20160224-000037;49870;SELECT;Inpatient;FIDA;C:\Users\FGuo\Documents\work doucment\attachment\attachmentDB\20161005\originalFileFromAerial\DOCSVC_20161003.tar\DOCSVC_20161003\Sect2\INPATIENT\REQ_20160224-000037\SULTANA, MUNAWAR - CLINICAL REVIEW REQUEST_2016-02-26-09.03.43.602.doc
Request;20160224-000041;21700;SELECT;Inpatient;SELECT;C:\Users\FGuo\Documents\work doucment\attachment\attachmentDB\20161005\originalFileFromAerial\DOCSVC_20161003.tar\DOCSVC_20161003\Sect2\INPATIENT\REQ_20160224-000041\gan weixian22216_2016-02-24-15.18.33.505.tif
Request;20160224-000041;21700;SELECT;Inpatient;SELECT;C:\Users\FGuo\Documents\work doucment\attachment\attachmentDB\20161005\originalFileFromAerial\DOCSVC_20161003.tar\DOCSVC_20161003\Sect2\INPATIENT\REQ_20160224-000041\GAN, WEIXIAN - SNF COPAY LETTER_2016-04-05-11.13.23.53.doc
Request;20160224-000042;28218;null;Inpatient;PACE;C:\Users\FGuo\Documents\work doucment\attachment\attachmentDB\20161005\originalFileFromAerial\DOCSVC_20161003.tar\DOCSVC_20161003\Sect2\INPATIENT\REQ_20160224-000042\Pimentel, Jose -Beth Abraham (Auth  20160224-000042) 2.24.16_2016-02-24-16.12.19.39.pdf
Request;20160224-000042;28218;null;Inpatient;PACE;C:\Users\FGuo\Documents\work doucment\attachment\attachmentDB\20161005\originalFileFromAerial\DOCSVC_20161003.tar\DOCSVC_20161003\Sect2\INPATIENT\REQ_20160224-000042\RJ Pimentel, J 28215 2-17-16_2016-02-24-15.23.52.279.tif
Request;20160224-000047;83081;FIDA;Inpatient;FIDA;C:\Users\FGuo\Documents\work doucment\attachment\attachmentDB\20161005\originalFileFromAerial\DOCSVC_20161003.tar\DOCSVC_20161003\Sect2\INPATIENT\REQ_20160224-000047\Marshall, Gerthel - BETH ABRAHAM HEALTH SERVICES 8.9.16_2016-08-09-11.29.39.782.pdf
Request;20160224-000050;26007;PACE;Inpatient;PACE;C:\Users\FGuo\Documents\work doucment\attachment\attachmentDB\20161005\originalFileFromAerial\DOCSVC_20161003.tar\DOCSVC_20161003\Sect2\INPATIENT\REQ_20160224-000050\04062016 DIXON_MYRTLE_MR1_2016-05-16-14.19.43.194.pdf
Request;20160224-000050;26007;PACE;Inpatient;PACE;C:\Users\FGuo\Documents\work doucment\attachment\attachmentDB\20161005\originalFileFromAerial\DOCSVC_20161003.tar\DOCSVC_20161003\Sect2\INPATIENT\REQ_20160224-000050\04062016 DIXON_MYRTLE_MR2_2016-05-16-14.20.03.358.pdf
Request;20160224-000050;26007;PACE;Inpatient;PACE;C:\Users\FGuo\Documents\work doucment\attachment\attachmentDB\20161005\originalFileFromAerial\DOCSVC_20161003.tar\DOCSVC_20161003\Sect2\INPATIENT\REQ_20160224-000050\Dixon, Myrtle  IP Denial Long Island Jewish Medical Center 3-1-16_2016-03-01-11.35.30.950.pdf
Request;20160224-000050;26007;PACE;Inpatient;PACE;C:\Users\FGuo\Documents\work doucment\attachment\attachmentDB\20161005\originalFileFromAerial\DOCSVC_20161003.tar\DOCSVC_20161003\Sect2\INPATIENT\REQ_20160224-000050\O_\26007 DIXON, MYRTLE CLINICALS_2016-02-26-12.37.29.36.tif
Request;20160224-000050;26007;PACE;Inpatient;PACE;C:\Users\FGuo\Documents\work doucment\attachment\attachmentDB\20161005\originalFileFromAerial\DOCSVC_20161003.tar\DOCSVC_20161003\Sect2\INPATIENT\REQ_20160224-000050\O_\26007 DIXON, MYRTLE UR REQ SHEET_2016-02-24-15.58.22.222.doc
Request;20160224-000054;57179;SELECT;Inpatient;SELECT;C:\Users\FGuo\Documents\work doucment\attachment\attachmentDB\20161005\originalFileFromAerial\DOCSVC_20161003.tar\DOCSVC_20161003\Sect2\INPATIENT\REQ_20160224-000054\delaney sultan22416_2016-02-24-19.35.56.354.tif
Request;20160225-000003;93477;PACE;Inpatient;PACE;C:\Users\FGuo\Documents\work doucment\attachment\attachmentDB\20161005\originalFileFromAerial\DOCSVC_20161003.tar\DOCSVC_20161003\Sect2\INPATIENT\REQ_20160225-000003\Quiterio, Juana - Montefiore Medical Center - 5.3.16_2016-05-03-14.17.48.616.pdf
Request;20160225-000003;93477;PACE;Inpatient;PACE;C:\Users\FGuo\Documents\work doucment\attachment\attachmentDB\20161005\originalFileFromAerial\DOCSVC_20161003.tar\DOCSVC_20161003\Sect2\INPATIENT\REQ_20160225-000003\QUITERIO,JUAN_2-29-16_2016-02-29-16.45.16.207.tif
Request;20160225-000009;52881;DIRECT;Inpatient;DIRECT;C:\Users\FGuo\Documents\work doucment\attachment\attachmentDB\20161005\originalFileFromAerial\DOCSVC_20161003.tar\DOCSVC_20161003\Sect2\INPATIENT\REQ_20160225-000009\raymond registre22516_2016-02-25-14.05.15.852.tif
Request;20160225-000009;52881;DIRECT;Inpatient;DIRECT;C:\Users\FGuo\Documents\work doucment\attachment\attachmentDB\20161005\originalFileFromAerial\DOCSVC_20161003.tar\DOCSVC_20161003\Sect2\INPATIENT\REQ_20160225-000009\REGISTRE, RAYMOND CLINICAL REVIEW REQUEST FORM_2016-02-25-10.20.18.123.doc
Request;20160225-000032;32600;PACE;Inpatient;PACE;C:\Users\FGuo\Documents\work doucment\attachment\attachmentDB\20161005\originalFileFromAerial\DOCSVC_20161003.tar\DOCSVC_20161003\Sect2\INPATIENT\REQ_20160225-000032\Morales Antonia - The Presbyterian Hospital 3-2-16_2016-03-02-09.33.37.1.pdf
Request;20160225-000032;32600;PACE;Inpatient;PACE;C:\Users\FGuo\Documents\work doucment\attachment\attachmentDB\20161005\originalFileFromAerial\DOCSVC_20161003.tar\DOCSVC_20161003\Sect2\INPATIENT\REQ_20160225-000032\O_\32600 MORALES, ANTONIA UR REQ SHEET_2016-02-25-12.09.09.719.doc
Request;20160225-000034;34488;PACE;Inpatient;PACE;C:\Users\FGuo\Documents\work doucment\attachment\attachmentDB\20161005\originalFileFromAerial\DOCSVC_20161003.tar\DOCSVC_20161003\Sect2\INPATIENT\REQ_20160225-000034\Marcano, Genoveva - WORKMEN'S CIRCLE HOME 8.9.16_2016-08-09-12.45.28.956.pdf
Request;20160225-000036;47354;PACE;Inpatient;PACE;C:\Users\FGuo\Documents\work doucment\attachment\attachmentDB\20161005\originalFileFromAerial\DOCSVC_20161003.tar\DOCSVC_20161003\Sect2\INPATIENT\REQ_20160225-000036\IZQUIERDO, DULCE - CLINICAL REVIEW REQUEST FORM_2016-02-25-13.08.57.722.doc
Request;20160225-000036;47354;PACE;Inpatient;PACE;C:\Users\FGuo\Documents\work doucment\attachment\attachmentDB\20161005\originalFileFromAerial\DOCSVC_20161003.tar\DOCSVC_20161003\Sect2\INPATIENT\REQ_20160225-000036\Izquierdo, Dulce - NEW YORK METHODIST HOSPITAL 8.17.16_2016-08-17-10.09.03.137.pdf
Request;20160225-000036;47354;PACE;Inpatient;PACE;C:\Users\FGuo\Documents\work doucment\attachment\attachmentDB\20161005\originalFileFromAerial\DOCSVC_20161003.tar\DOCSVC_20161003\Sect2\INPATIENT\REQ_20160225-000036\IZQUIERDO, DULCE_CLINICAL_2016-02-29-16.02.25.334.tif
Request;20160225-000040;95910;PACE;Inpatient;PACE;C:\Users\FGuo\Documents\work doucment\attachment\attachmentDB\20161005\originalFileFromAerial\DOCSVC_20161003.tar\DOCSVC_20161003\Sect2\INPATIENT\REQ_20160225-000040\Andrade, Marina - St Barnabas Hospital - 5.3.16_2016-05-03-14.08.25.698.pdf
Request;20160225-000040;95910;PACE;Inpatient;PACE;C:\Users\FGuo\Documents\work doucment\attachment\attachmentDB\20161005\originalFileFromAerial\DOCSVC_20161003.tar\DOCSVC_20161003\Sect2\INPATIENT\REQ_20160225-000040\Andrade, Marina- St Barnabas Hospital-Clinical Review Request Form 2-25-16_2016-02-25-12.43.34.322.docx
Request;20160225-000040;95910;PACE;Inpatient;PACE;C:\Users\FGuo\Documents\work doucment\attachment\attachmentDB\20161005\originalFileFromAerial\DOCSVC_20161003.tar\DOCSVC_20161003\Sect2\INPATIENT\REQ_20160225-000040\ANDRADE, MARINA_2-29-16_2016-03-01-09.40.36.756.tif
Request;20160225-000042;30665;PACE;Inpatient;PACE;C:\Users\FGuo\Documents\work doucment\attachment\attachmentDB\20161005\originalFileFromAerial\DOCSVC_20161003.tar\DOCSVC_20161003\Sect2\INPATIENT\REQ_20160225-000042\Ryans, Irene - HEMPSTEAD PARK NURSING HOME 9.08.16_2016-09-08-14.59.52.993.pdf
Request;20160225-000042;30665;PACE;Inpatient;PACE;C:\Users\FGuo\Documents\work doucment\attachment\attachmentDB\20161005\originalFileFromAerial\DOCSVC_20161003.tar\DOCSVC_20161003\Sect2\INPATIENT\REQ_20160225-000042\Ryans, Irene-Hempstead Park Nursing Home  (Auth  20160225-000042) 3.2.16_2016-03-02-14.01.50.706.pdf
Request;20160225-000042;30665;PACE;Inpatient;PACE;C:\Users\FGuo\Documents\work doucment\attachment\attachmentDB\20161005\originalFileFromAerial\DOCSVC_20161003.tar\DOCSVC_20161003\Sect2\INPATIENT\REQ_20160225-000042\Ryans, Irene_2016-07-21-13.10.58.163.tif
Request;20160225-000046;22102;PACE;Inpatient;PACE;C:\Users\FGuo\Documents\work doucment\attachment\attachmentDB\20161005\originalFileFromAerial\DOCSVC_20161003.tar\DOCSVC_20161003\Sect2\INPATIENT\REQ_20160225-000046\Nham, Eu -Margaret Tietz Nursing & Rehab.  (Auth 20160225-000046) 2.25.16_2016-02-25-16.44.14.104.pdf
Request;20160225-000046;22102;PACE;Inpatient;PACE;C:\Users\FGuo\Documents\work doucment\attachment\attachmentDB\20161005\originalFileFromAerial\DOCSVC_20161003.tar\DOCSVC_20161003\Sect2\INPATIENT\REQ_20160225-000046\O_\22102 NHAM, EU CLINICALS-UR_2016-02-25-14.23.43.128.tif
Request;20160225-000047;58798;null;Inpatient;DIRECT;C:\Users\FGuo\Documents\work doucment\attachment\attachmentDB\20161005\originalFileFromAerial\DOCSVC_20161003.tar\DOCSVC_20161003\Sect2\INPATIENT\REQ_20160225-000047\Robinson Adlin -Mount Sinai Hospital 3-4-16_2016-03-04-11.55.50.481.pdf
Request;20160225-000047;58798;null;Inpatient;DIRECT;C:\Users\FGuo\Documents\work doucment\attachment\attachmentDB\20161005\originalFileFromAerial\DOCSVC_20161003.tar\DOCSVC_20161003\Sect2\INPATIENT\REQ_20160225-000047\Robinson Adlin -Mount Sinai Hospital 3-4-16_2016-03-04-11.56.13.993.pdf
Request;20160225-000047;58798;null;Inpatient;DIRECT;C:\Users\FGuo\Documents\work doucment\attachment\attachmentDB\20161005\originalFileFromAerial\DOCSVC_20161003.tar\DOCSVC_20161003\Sect2\INPATIENT\REQ_20160225-000047\Robinson Adlin- Mt. Sinai of Queens 2-25-16_2016-02-25-14.30.05.212.pdf
Request;20160225-000058;21697;PACE;Inpatient;PACE;C:\Users\FGuo\Documents\work doucment\attachment\attachmentDB\20161005\originalFileFromAerial\DOCSVC_20161003.tar\DOCSVC_20161003\Sect2\INPATIENT\REQ_20160225-000058\Lopez, Nicolas - BUENA VIDA CONTINUING CARE & REHABI 8.9.16_2016-08-09-14.15.30.301.pdf
Request;20160225-000058;21697;PACE;Inpatient;PACE;C:\Users\FGuo\Documents\work doucment\attachment\attachmentDB\20161005\originalFileFromAerial\DOCSVC_20161003.tar\DOCSVC_20161003\Sect2\INPATIENT\REQ_20160225-000058\Lopez, Nicolas_Notes-PRI_2-24-16_2016-02-25-15.31.02.328.pdf
Request;20160225-000064;95921;PACE;Inpatient;PACE;C:\Users\FGuo\Documents\work doucment\attachment\attachmentDB\20161005\originalFileFromAerial\DOCSVC_20161003.tar\DOCSVC_20161003\Sect2\INPATIENT\REQ_20160225-000064\ma yun man 3116_2016-03-01-16.54.51.407.tif
Request;20160225-000064;95921;PACE;Inpatient;PACE;C:\Users\FGuo\Documents\work doucment\attachment\attachmentDB\20161005\originalFileFromAerial\DOCSVC_20161003.tar\DOCSVC_20161003\Sect2\INPATIENT\REQ_20160225-000064\ma yun man22916_2016-02-29-13.10.13.438.tif
Request;20160225-000064;95921;PACE;Inpatient;PACE;C:\Users\FGuo\Documents\work doucment\attachment\attachmentDB\20161005\originalFileFromAerial\DOCSVC_20161003.tar\DOCSVC_20161003\Sect2\INPATIENT\REQ_20160225-000064\O_\95921 MA, YUN MAN UR REQ SHEET_2016-02-25-15.48.44.387.doc
Request;20160225-000067;52745;SELECT;Inpatient;SELECT;C:\Users\FGuo\Documents\work doucment\attachment\attachmentDB\20161005\originalFileFromAerial\DOCSVC_20161003.tar\DOCSVC_20161003\Sect2\INPATIENT\REQ_20160225-000067\maria torres pri22516_2016-02-25-16.37.51.343.tif
Request;20160225-000069;46326;PACE;Inpatient;PACE;C:\Users\FGuo\Documents\work doucment\attachment\attachmentDB\20161005\originalFileFromAerial\DOCSVC_20161003.tar\DOCSVC_20161003\Sect2\INPATIENT\REQ_20160225-000069\Gladden PRI_2016-02-25-16.19.51.549.pdf
Request;20160225-000073;60824;SELECT;Inpatient;SELECT;C:\Users\FGuo\Documents\work doucment\attachment\attachmentDB\20161005\originalFileFromAerial\DOCSVC_20161003.tar\DOCSVC_20161003\Sect2\INPATIENT\REQ_20160225-000073\Chardon, Peter - Nursing Care Center At Medford INC - 4.5.16_2016-04-05-15.50.18.80.pdf
Request;20160225-000073;60824;SELECT;Inpatient;SELECT;C:\Users\FGuo\Documents\work doucment\attachment\attachmentDB\20161005\originalFileFromAerial\DOCSVC_20161003.tar\DOCSVC_20161003\Sect2\INPATIENT\REQ_20160225-000073\O_\Chardon Peter_2016-02-25-16.52.33.844.tif
Request;20160226-000004;46326;PACE;Inpatient;PACE;C:\Users\FGuo\Documents\work doucment\attachment\attachmentDB\20161005\originalFileFromAerial\DOCSVC_20161003.tar\DOCSVC_20161003\Sect2\INPATIENT\REQ_20160226-000004\audrey gladden3816_2016-03-08-11.14.23.132.tif
Request;20160226-000004;46326;PACE;Inpatient;PACE;C:\Users\FGuo\Documents\work doucment\attachment\attachmentDB\20161005\originalFileFromAerial\DOCSVC_20161003.tar\DOCSVC_20161003\Sect2\INPATIENT\REQ_20160226-000004\audrey gladden3916_2016-03-09-11.30.11.571.tif
Request;20160226-000004;46326;PACE;Inpatient;PACE;C:\Users\FGuo\Documents\work doucment\attachment\attachmentDB\20161005\originalFileFromAerial\DOCSVC_20161003.tar\DOCSVC_20161003\Sect2\INPATIENT\REQ_20160226-000004\Gladden, Audrey T - REGEIS CARE CENTER_2016-08-10-11.50.16.538.pdf
Request;20160226-000006;36810;null;Inpatient;SELECT;C:\Users\FGuo\Documents\work doucment\attachment\attachmentDB\20161005\originalFileFromAerial\DOCSVC_20161003.tar\DOCSVC_20161003\Sect2\INPATIENT\REQ_20160226-000006\O_\nursing home documents\D Rollack  36810_2016-03-07-08.33.48.837.tif
Request;20160226-000010;60886;SELECT;Inpatient;SELECT;C:\Users\FGuo\Documents\work doucment\attachment\attachmentDB\20161005\originalFileFromAerial\DOCSVC_20161003.tar\DOCSVC_20161003\Sect2\INPATIENT\REQ_20160226-000010\Boone, Daisy V - Four Seasons Nursing Home  -8.9.16_2016-08-09-14.57.31.803.pdf
Request;20160226-000010;60886;SELECT;Inpatient;SELECT;C:\Users\FGuo\Documents\work doucment\attachment\attachmentDB\20161005\originalFileFromAerial\DOCSVC_20161003.tar\DOCSVC_20161003\Sect2\INPATIENT\REQ_20160226-000010\O_\nursing home documents\D Boone 60886_2016-03-07-08.29.41.595.tif
Request;20160226-000012;84234;PACE;Inpatient;PACE;C:\Users\FGuo\Documents\work doucment\attachment\attachmentDB\20161005\originalFileFromAerial\DOCSVC_20161003.tar\DOCSVC_20161003\Sect2\INPATIENT\REQ_20160226-000012\Ramirez, Reinaldo - WORKMEN'S CIRCLE HOME 8.10.16_2016-08-10-09.46.54.61.pdf
Request;20160226-000012;84234;PACE;Inpatient;PACE;C:\Users\FGuo\Documents\work doucment\attachment\attachmentDB\20161005\originalFileFromAerial\DOCSVC_20161003.tar\DOCSVC_20161003\Sect2\INPATIENT\REQ_20160226-000012\Ramirez, Reinaldo - Workmen?s Circle Home - 9.21.16_2016-09-21-13.00.11.683.pdf
Request;20160226-000012;84234;PACE;Inpatient;PACE;C:\Users\FGuo\Documents\work doucment\attachment\attachmentDB\20161005\originalFileFromAerial\DOCSVC_20161003.tar\DOCSVC_20161003\Sect2\INPATIENT\REQ_20160226-000012\Ramirez, Reinaldo 84234 SNF Progress Notes_2016-03-10-12.44.38.617.pdf
Request;20160226-000012;84234;PACE;Inpatient;PACE;C:\Users\FGuo\Documents\work doucment\attachment\attachmentDB\20161005\originalFileFromAerial\DOCSVC_20161003.tar\DOCSVC_20161003\Sect2\INPATIENT\REQ_20160226-000012\Ramirez, Reinaldo PRI-SCREEN 2_2016-02-26-10.22.57.595.pdf
Request;20160226-000012;84234;PACE;Inpatient;PACE;C:\Users\FGuo\Documents\work doucment\attachment\attachmentDB\20161005\originalFileFromAerial\DOCSVC_20161003.tar\DOCSVC_20161003\Sect2\INPATIENT\REQ_20160226-000012\Ramirez, Reinaldo_2016-07-27-16.30.58.565.tif
Request;20160226-000012;84234;PACE;Inpatient;PACE;C:\Users\FGuo\Documents\work doucment\attachment\attachmentDB\20161005\originalFileFromAerial\DOCSVC_20161003.tar\DOCSVC_20161003\Sect2\INPATIENT\REQ_20160226-000012\Ramirez, Reinaldo_2016-08-11-12.49.15.990.tif
Request;20160226-000015;84296;SELECT;Inpatient;SELECT;C:\Users\FGuo\Documents\work doucment\attachment\attachmentDB\20161005\originalFileFromAerial\DOCSVC_20161003.tar\DOCSVC_20161003\Sect2\INPATIENT\REQ_20160226-000015\Zhao, Ru Guo - Atlantis Rehab & RHCF - 6.23.16_2016-06-23-12.11.13.939.pdf
Request;20160226-000015;84296;SELECT;Inpatient;SELECT;C:\Users\FGuo\Documents\work doucment\attachment\attachmentDB\20161005\originalFileFromAerial\DOCSVC_20161003.tar\DOCSVC_20161003\Sect2\INPATIENT\REQ_20160226-000015\Zhao, Ru Guo- Atlantis Rehab & RHCF (Auth 20160226-000015) 3.7.16_2016-03-07-14.49.43.748.pdf
Request;20160226-000017;60372;DIRECT/SELECT LT;Inpatient;DIRECT/SELECT LT;C:\Users\FGuo\Documents\work doucment\attachment\attachmentDB\20161005\originalFileFromAerial\DOCSVC_20161003.tar\DOCSVC_20161003\Sect2\INPATIENT\REQ_20160226-000017\Freides, Seymour .MARGARET TIETZ NURSING AND REHAB CTR.3.30.16_2016-04-05-11.43.16.770.pdf
Request;20160226-000017;60372;DIRECT/SELECT LT;Inpatient;DIRECT/SELECT LT;C:\Users\FGuo\Documents\work doucment\attachment\attachmentDB\20161005\originalFileFromAerial\DOCSVC_20161003.tar\DOCSVC_20161003\Sect2\INPATIENT\REQ_20160226-000017\S Freides #60372_2016-04-01-12.36.20.531.tif
Request;20160226-000023;43267;PACE;Inpatient;PACE;C:\Users\FGuo\Documents\work doucment\attachment\attachmentDB\20161005\originalFileFromAerial\DOCSVC_20161003.tar\DOCSVC_20161003\Sect2\INPATIENT\REQ_20160226-000023\Neufeld, Phyllis - NEW GLEN OAKS NURSING HOME INC 8.10.16_2016-08-10-10.29.09.177.pdf
Request;20160226-000023;43267;PACE;Inpatient;PACE;C:\Users\FGuo\Documents\work doucment\attachment\attachmentDB\20161005\originalFileFromAerial\DOCSVC_20161003.tar\DOCSVC_20161003\Sect2\INPATIENT\REQ_20160226-000023\Neufeld, Phyllis - NEW GLEN OAKS NURSING HOME INC 8.10.16_2016-08-10-10.34.12.395.pdf
Request;20160226-000027;58434;PACE;Inpatient;PACE;C:\Users\FGuo\Documents\work doucment\attachment\attachmentDB\20161005\originalFileFromAerial\DOCSVC_20161003.tar\DOCSVC_20161003\Sect2\INPATIENT\REQ_20160226-000027\HYACINTH SIMMS 3116_2016-03-01-17.16.02.628.tif
Request;20160226-000027;58434;PACE;Inpatient;PACE;C:\Users\FGuo\Documents\work doucment\attachment\attachmentDB\20161005\originalFileFromAerial\DOCSVC_20161003.tar\DOCSVC_20161003\Sect2\INPATIENT\REQ_20160226-000027\SIMMS, HYACINTH CLINICAL REVIEW REQUEST FORM_2016-02-26-11.10.04.301.doc
Request;20160226-000028;60979;SELECT;Inpatient;SELECT;C:\Users\FGuo\Documents\work doucment\attachment\attachmentDB\20161005\originalFileFromAerial\DOCSVC_20161003.tar\DOCSVC_20161003\Sect2\INPATIENT\REQ_20160226-000028\Mavridis, Annika - PORT CHESTER NURSING & REHAB CENTER 8.10.16_2016-08-10-10.55.04.717.pdf
Request;20160226-000028;60979;SELECT;Inpatient;SELECT;C:\Users\FGuo\Documents\work doucment\attachment\attachmentDB\20161005\originalFileFromAerial\DOCSVC_20161003.tar\DOCSVC_20161003\Sect2\INPATIENT\REQ_20160226-000028\MAVRIDIS, ANNIKA_2016-02-26-11.32.31.475.tif
Request;20160226-000033;45276;PACE;Inpatient;PACE;C:\Users\FGuo\Documents\work doucment\attachment\attachmentDB\20161005\originalFileFromAerial\DOCSVC_20161003.tar\DOCSVC_20161003\Sect2\INPATIENT\REQ_20160226-000033\RJ James, E 45276 2-23-16_2016-02-26-11.20.31.641.tif
Request;20160226-000037;55691;PACE;Inpatient;PACE;C:\Users\FGuo\Documents\work doucment\attachment\attachmentDB\20161005\originalFileFromAerial\DOCSVC_20161003.tar\DOCSVC_20161003\Sect2\INPATIENT\REQ_20160226-000037\Bess, Martin  - SPLIT ROCK NURSING HOME 8.25.16_2016-08-25-09.39.50.567.pdf
Request;20160226-000037;55691;PACE;Inpatient;PACE;C:\Users\FGuo\Documents\work doucment\attachment\attachmentDB\20161005\originalFileFromAerial\DOCSVC_20161003.tar\DOCSVC_20161003\Sect2\INPATIENT\REQ_20160226-000037\BESS, MARTIN_PRI_2016-02-26-11.53.18.425.tif
Request;20160226-000039;30846;PACE;Inpatient;PACE;C:\Users\FGuo\Documents\work doucment\attachment\attachmentDB\20161005\originalFileFromAerial\DOCSVC_20161003.tar\DOCSVC_20161003\Sect2\INPATIENT\REQ_20160226-000039\Frolova, Anna  2-26-16_2016-02-26-11.56.17.841.tif
Request;20160226-000039;30846;PACE;Inpatient;PACE;C:\Users\FGuo\Documents\work doucment\attachment\attachmentDB\20161005\originalFileFromAerial\DOCSVC_20161003.tar\DOCSVC_20161003\Sect2\INPATIENT\REQ_20160226-000039\Frolova, Anna - Crown Nursing Home Associates - 4.5.16_2016-04-05-16.54.10.652.pdf
Request;20160226-000042;29621;FIDA;Inpatient;FIDA;C:\Users\FGuo\Documents\work doucment\attachment\attachmentDB\20161005\originalFileFromAerial\DOCSVC_20161003.tar\DOCSVC_20161003\Sect2\INPATIENT\REQ_20160226-000042\Clarke, Beatrice - Shore View Nursing Home- 4.6.16_2016-04-06-09.31.52.905.pdf
Request;20160226-000042;29621;FIDA;Inpatient;FIDA;C:\Users\FGuo\Documents\work doucment\attachment\attachmentDB\20161005\originalFileFromAerial\DOCSVC_20161003.tar\DOCSVC_20161003\Sect2\INPATIENT\REQ_20160226-000042\Clarke, Beatrice_progress notes_2-25-16_2016-02-26-12.09.00.114.pdf
Request;20160226-000044;60522;SELECT;Inpatient;SELECT;C:\Users\FGuo\Documents\work doucment\attachment\attachmentDB\20161005\originalFileFromAerial\DOCSVC_20161003.tar\DOCSVC_20161003\Sect2\INPATIENT\REQ_20160226-000044\Gee, Gin - Atlantis Rehab & RHCF (Auth  20160226-000044) 2.29.16_2016-02-29-13.12.00.713.pdf
Request;20160226-000045;60167;null;Inpatient;PACE;C:\Users\FGuo\Documents\work doucment\attachment\attachmentDB\20161005\originalFileFromAerial\DOCSVC_20161003.tar\DOCSVC_20161003\Sect2\INPATIENT\REQ_20160226-000045\Yan, Shi Rui  - Atlantis Rehab & RHCF - 4.5.16_2016-04-05-16.40.30.197.pdf
Request;20160226-000048;79076;SELECT;Inpatient;SELECT;C:\Users\FGuo\Documents\work doucment\attachment\attachmentDB\20161005\originalFileFromAerial\DOCSVC_20161003.tar\DOCSVC_20161003\Sect2\INPATIENT\REQ_20160226-000048\Huang, Yuan X - Atlantis Rehab & RHCF (Auth 20160226-000048) 3.1.16_2016-03-01-11.39.32.703.pdf
Request;20160226-000049;79076;SELECT;Inpatient;SELECT;C:\Users\FGuo\Documents\work doucment\attachment\attachmentDB\20161005\originalFileFromAerial\DOCSVC_20161003.tar\DOCSVC_20161003\Sect2\INPATIENT\REQ_20160226-000049\Huang, Yuan X - Atlantis Rehab & RHCF (Auth 20160226-000049) 3.1.16_2016-03-01-11.32.47.845.pdf
Request;20160226-000051;79076;SELECT;Inpatient;SELECT;C:\Users\FGuo\Documents\work doucment\attachment\attachmentDB\20161005\originalFileFromAerial\DOCSVC_20161003.tar\DOCSVC_20161003\Sect2\INPATIENT\REQ_20160226-000051\Huang, Yuan X - Atlantis Rehab & RHCF (Auth 20160226-000051) 3.1.16_2016-03-01-13.04.54.361.pdf
Request;20160226-000052;79076;SELECT;Inpatient;SELECT;C:\Users\FGuo\Documents\work doucment\attachment\attachmentDB\20161005\originalFileFromAerial\DOCSVC_20161003.tar\DOCSVC_20161003\Sect2\INPATIENT\REQ_20160226-000052\Huang, Yuan X - Atlantis Rehab & RHCF (Auth 20160226-000052) 3.1.16_2016-03-01-13.07.54.270.pdf
Request;20160226-000052;79076;SELECT;Inpatient;SELECT;C:\Users\FGuo\Documents\work doucment\attachment\attachmentDB\20161005\originalFileFromAerial\DOCSVC_20161003.tar\DOCSVC_20161003\Sect2\INPATIENT\REQ_20160226-000052\Huang, Yuan X - Atlantis Rehab & RHCF (Auth 20160226-000052) 3.1.16_2016-03-07-13.14.06.504.pdf
Request;20160226-000052;79076;SELECT;Inpatient;SELECT;C:\Users\FGuo\Documents\work doucment\attachment\attachmentDB\20161005\originalFileFromAerial\DOCSVC_20161003.tar\DOCSVC_20161003\Sect2\INPATIENT\REQ_20160226-000052\Huang, Yuan_2016-09-23-16.51.00.327.tif
Request;20160226-000053;60801;SELECT;Inpatient;SELECT;C:\Users\FGuo\Documents\work doucment\attachment\attachmentDB\20161005\originalFileFromAerial\DOCSVC_20161003.tar\DOCSVC_20161003\Sect2\INPATIENT\REQ_20160226-000053\Louie, Kamfat - Atlantis Rehab & RHCF (Auth 20160226-000053) 3.2.16_2016-03-02-10.02.45.613.pdf
Request;20160226-000055;32520;SELECT;Inpatient;SELECT;C:\Users\FGuo\Documents\work doucment\attachment\attachmentDB\20161005\originalFileFromAerial\DOCSVC_20161003.tar\DOCSVC_20161003\Sect2\INPATIENT\REQ_20160226-000055\Thompson, Ingrid - Sutton Park Center For Nursing & Rehabilitation - 7.15.16_2016-07-15-11.32.10.674.pdf
Request;20160226-000068;86928;PACE;Inpatient;Not Valued;C:\Users\FGuo\Documents\work doucment\attachment\attachmentDB\20161005\originalFileFromAerial\DOCSVC_20161003.tar\DOCSVC_20161003\Sect2\INPATIENT\REQ_20160226-000068\Shiung, Su Lo - UNION PLAZA NURSING HOME 8.10.16_2016-08-10-13.29.44.685.pdf
Request;20160226-000072;83367;PACE;Inpatient;PACE;C:\Users\FGuo\Documents\work doucment\attachment\attachmentDB\20161005\originalFileFromAerial\DOCSVC_20161003.tar\DOCSVC_20161003\Sect2\INPATIENT\REQ_20160226-000072\CYXu_2016-03-25-16.17.57.269.rtf
Request;20160226-000072;83367;PACE;Inpatient;PACE;C:\Users\FGuo\Documents\work doucment\attachment\attachmentDB\20161005\originalFileFromAerial\DOCSVC_20161003.tar\DOCSVC_20161003\Sect2\INPATIENT\REQ_20160226-000072\CYXu_2016-03-25-16.28.26.784.rtf
Request;20160226-000072;83367;PACE;Inpatient;PACE;C:\Users\FGuo\Documents\work doucment\attachment\attachmentDB\20161005\originalFileFromAerial\DOCSVC_20161003.tar\DOCSVC_20161003\Sect2\INPATIENT\REQ_20160226-000072\Xu, Cnang Y  -Atlantis Rehab & RHCF (Auth 20160226-000072) 3.3.16_2016-03-03-11.45.27.427.pdf
Request;20160226-000073;81298;PACE;Inpatient;PACE;C:\Users\FGuo\Documents\work doucment\attachment\attachmentDB\20161005\originalFileFromAerial\DOCSVC_20161003.tar\DOCSVC_20161003\Sect2\INPATIENT\REQ_20160226-000073\Xu, Jin - Atlantis Rehab & RHCF (Auth 20160226-000073) 3.3.16_2016-03-03-15.16.41.417.pdf
Request;20160226-000077;83469;DIRECT;Inpatient;DIRECT;C:\Users\FGuo\Documents\work doucment\attachment\attachmentDB\20161005\originalFileFromAerial\DOCSVC_20161003.tar\DOCSVC_20161003\Sect2\INPATIENT\REQ_20160226-000077\O_\83469 RIJOS, CARMELINA UR REQ SHEET_2016-02-26-14.51.09.575.doc
Request;20160226-000077;83469;DIRECT;Inpatient;DIRECT;C:\Users\FGuo\Documents\work doucment\attachment\attachmentDB\20161005\originalFileFromAerial\DOCSVC_20161003.tar\DOCSVC_20161003\Sect2\INPATIENT\REQ_20160226-000077\Rijo, CARM_CLINICAL_2016-03-04-11.14.27.510.tif
Request;20160226-000077;83469;DIRECT;Inpatient;DIRECT;C:\Users\FGuo\Documents\work doucment\attachment\attachmentDB\20161005\originalFileFromAerial\DOCSVC_20161003.tar\DOCSVC_20161003\Sect2\INPATIENT\REQ_20160226-000077\Rijos, Carmelina  - Jacobi Medical Center  8-16-16_2016-08-16-09.21.24.31.pdf
Request;20160226-000078;29985;PACE;Inpatient;PACE;C:\Users\FGuo\Documents\work doucment\attachment\attachmentDB\20161005\originalFileFromAerial\DOCSVC_20161003.tar\DOCSVC_20161003\Sect2\INPATIENT\REQ_20160226-000078\Sykes, David - Montefiore Medical Center 8-11-16_2016-08-11-10.25.43.53.pdf
Request;20160226-000078;29985;PACE;Inpatient;PACE;C:\Users\FGuo\Documents\work doucment\attachment\attachmentDB\20161005\originalFileFromAerial\DOCSVC_20161003.tar\DOCSVC_20161003\Sect2\INPATIENT\REQ_20160226-000078\SYKES, DAVID CLINICAL REVIEW REQUEST FORM_2016-02-26-14.56.12.377.doc
Request;20160226-000078;29985;PACE;Inpatient;PACE;C:\Users\FGuo\Documents\work doucment\attachment\attachmentDB\20161005\originalFileFromAerial\DOCSVC_20161003.tar\DOCSVC_20161003\Sect2\INPATIENT\REQ_20160226-000078\SYKES, DAVID_CLINICAL_2016-03-02-16.37.40.149.tif
Request;20160226-000081;79013;PACE;Inpatient;PACE;C:\Users\FGuo\Documents\work doucment\attachment\attachmentDB\20161005\originalFileFromAerial\DOCSVC_20161003.tar\DOCSVC_20161003\Sect2\INPATIENT\REQ_20160226-000081\Zhang, Bao Yu - Atlantis Rehab & RHCF (Auth 20160226-000081 3.3.16_2016-03-03-16.25.30.604.pdf
Request;20160226-000082;79013;PACE;Inpatient;PACE;C:\Users\FGuo\Documents\work doucment\attachment\attachmentDB\20161005\originalFileFromAerial\DOCSVC_20161003.tar\DOCSVC_20161003\Sect2\INPATIENT\REQ_20160226-000082\Zhang, Bao Yu - Atlantis Rehab & RHCF (Auth20160226-000082) 3.4.16_2016-03-04-13.27.34.788.pdf
Request;20160226-000083;93135;PACE;Inpatient;PACE;C:\Users\FGuo\Documents\work doucment\attachment\attachmentDB\20161005\originalFileFromAerial\DOCSVC_20161003.tar\DOCSVC_20161003\Sect2\INPATIENT\REQ_20160226-000083\Febres - Cordero, Maria - Montefiore Medical Center - 5.3.16_2016-05-03-14.14.05.260.pdf
Request;20160226-000083;93135;PACE;Inpatient;PACE;C:\Users\FGuo\Documents\work doucment\attachment\attachmentDB\20161005\originalFileFromAerial\DOCSVC_20161003.tar\DOCSVC_20161003\Sect2\INPATIENT\REQ_20160226-000083\febres, cordero-2-29-16_2016-03-01-09.27.15.601.tif
Request;20160226-000083;93135;PACE;Inpatient;PACE;C:\Users\FGuo\Documents\work doucment\attachment\attachmentDB\20161005\originalFileFromAerial\DOCSVC_20161003.tar\DOCSVC_20161003\Sect2\INPATIENT\REQ_20160226-000083\O_\93135 FEBRES CORDERO, MARIA UR REQ SHEET_2016-02-26-15.29.34.783.doc
Request;20160226-000088;30790;DIRECT;Inpatient;DIRECT;C:\Users\FGuo\Documents\work doucment\attachment\attachmentDB\20161005\originalFileFromAerial\DOCSVC_20161003.tar\DOCSVC_20161003\Sect2\INPATIENT\REQ_20160226-000088\Rivero, E 2-29-16_2016-03-01-11.00.31.543.tif
Request;20160226-000088;30790;DIRECT;Inpatient;DIRECT;C:\Users\FGuo\Documents\work doucment\attachment\attachmentDB\20161005\originalFileFromAerial\DOCSVC_20161003.tar\DOCSVC_20161003\Sect2\INPATIENT\REQ_20160226-000088\Rivero, Enrique  - Montefiore Medical Center 8-11-16_2016-08-11-11.05.38.896.pdf
Request;20160226-000088;30790;DIRECT;Inpatient;DIRECT;C:\Users\FGuo\Documents\work doucment\attachment\attachmentDB\20161005\originalFileFromAerial\DOCSVC_20161003.tar\DOCSVC_20161003\Sect2\INPATIENT\REQ_20160226-000088\RIVERO, ENRIQUE CLINICAL REVIEW REQUEST FORM_2016-02-26-16.29.44.348.doc
Request;20160226-000088;30790;DIRECT;Inpatient;DIRECT;C:\Users\FGuo\Documents\work doucment\attachment\attachmentDB\20161005\originalFileFromAerial\DOCSVC_20161003.tar\DOCSVC_20161003\Sect2\INPATIENT\REQ_20160226-000088\RIVERO, ENRIQUE_CLINICAL_2016-03-03-10.36.49.73.tif
Request;20160226-000089;26007;PACE;Inpatient;PACE;C:\Users\FGuo\Documents\work doucment\attachment\attachmentDB\20161005\originalFileFromAerial\DOCSVC_20161003.tar\DOCSVC_20161003\Sect2\INPATIENT\REQ_20160226-000089\dixon myrtle3116_2016-03-02-13.15.03.64.tif
Request;20160226-000089;26007;PACE;Inpatient;PACE;C:\Users\FGuo\Documents\work doucment\attachment\attachmentDB\20161005\originalFileFromAerial\DOCSVC_20161003.tar\DOCSVC_20161003\Sect2\INPATIENT\REQ_20160226-000089\dixon myrtle31616_2016-03-16-12.52.26.867.tif
Request;20160226-000089;26007;PACE;Inpatient;PACE;C:\Users\FGuo\Documents\work doucment\attachment\attachmentDB\20161005\originalFileFromAerial\DOCSVC_20161003.tar\DOCSVC_20161003\Sect2\INPATIENT\REQ_20160226-000089\dixon myrtle33016_2016-03-31-11.36.18.2.tif
Request;20160226-000089;26007;PACE;Inpatient;PACE;C:\Users\FGuo\Documents\work doucment\attachment\attachmentDB\20161005\originalFileFromAerial\DOCSVC_20161003.tar\DOCSVC_20161003\Sect2\INPATIENT\REQ_20160226-000089\dixon myrtle3916_2016-03-10-11.08.42.3.tif
Request;20160226-000089;26007;PACE;Inpatient;PACE;C:\Users\FGuo\Documents\work doucment\attachment\attachmentDB\20161005\originalFileFromAerial\DOCSVC_20161003.tar\DOCSVC_20161003\Sect2\INPATIENT\REQ_20160226-000089\MDixon PRI PT_2016-02-26-16.18.11.838.tif
Request;20160226-000092;43094;PACE;Inpatient;PACE;C:\Users\FGuo\Documents\work doucment\attachment\attachmentDB\20161005\originalFileFromAerial\DOCSVC_20161003.tar\DOCSVC_20161003\Sect2\INPATIENT\REQ_20160226-000092\carmel douby22916_2016-02-29-15.52.00.155.tif
Request;20160226-000092;43094;PACE;Inpatient;PACE;C:\Users\FGuo\Documents\work doucment\attachment\attachmentDB\20161005\originalFileFromAerial\DOCSVC_20161003.tar\DOCSVC_20161003\Sect2\INPATIENT\REQ_20160226-000092\O_\43094 DOUBY, CARMEL UR REQ SHEET_2016-02-26-16.33.55.460.doc
Request;20160229-000003;60800;SELECT;Inpatient;SELECT;C:\Users\FGuo\Documents\work doucment\attachment\attachmentDB\20161005\originalFileFromAerial\DOCSVC_20161003.tar\DOCSVC_20161003\Sect2\INPATIENT\REQ_20160229-000003\Hu, Ying K. - Atlantis Rehab & RHCF (Auth 20160229-000003) 2.29.16_2016-02-29-14.35.34.495.pdf
Request;20160229-000003;60800;SELECT;Inpatient;SELECT;C:\Users\FGuo\Documents\work doucment\attachment\attachmentDB\20161005\originalFileFromAerial\DOCSVC_20161003.tar\DOCSVC_20161003\Sect2\INPATIENT\REQ_20160229-000003\_2016-02-29-14.35.25.862
Request;20160229-000007;58944;PACE;Inpatient;PACE;C:\Users\FGuo\Documents\work doucment\attachment\attachmentDB\20161005\originalFileFromAerial\DOCSVC_20161003.tar\DOCSVC_20161003\Sect2\INPATIENT\REQ_20160229-000007\Estien, Juan  3-3-16_2016-03-03-11.33.50.867.docx
Request;20160229-000007;58944;PACE;Inpatient;PACE;C:\Users\FGuo\Documents\work doucment\attachment\attachmentDB\20161005\originalFileFromAerial\DOCSVC_20161003.tar\DOCSVC_20161003\Sect2\INPATIENT\REQ_20160229-000007\Estien, Juan - NEW YORK METHODIST HOSPITAL 8.24.16_2016-08-24-09.56.11.199.pdf
Request;20160229-000007;58944;PACE;Inpatient;PACE;C:\Users\FGuo\Documents\work doucment\attachment\attachmentDB\20161005\originalFileFromAerial\DOCSVC_20161003.tar\DOCSVC_20161003\Sect2\INPATIENT\REQ_20160229-000007\Estien, Juan 58944 Clinical Review 10 15 Req Form_2016-02-29-10.04.51.836.docx
Request;20160229-000007;58944;PACE;Inpatient;PACE;C:\Users\FGuo\Documents\work doucment\attachment\attachmentDB\20161005\originalFileFromAerial\DOCSVC_20161003.tar\DOCSVC_20161003\Sect2\INPATIENT\REQ_20160229-000007\G_\Rafael Noboa-Lemonier\Estien, Juan_clinical_3-3-16_2016-03-07-21.36.14.252.pdf
Request;20160229-000008;83367;PACE;Inpatient;PACE;C:\Users\FGuo\Documents\work doucment\attachment\attachmentDB\20161005\originalFileFromAerial\DOCSVC_20161003.tar\DOCSVC_20161003\Sect2\INPATIENT\REQ_20160229-000008\Xu, Cnang Y  -Atlantis Rehab & RHCF (Auth 20160229-000008) 3.2.16_2016-03-02-11.34.07.913.pdf
Request;20160229-000008;83367;PACE;Inpatient;PACE;C:\Users\FGuo\Documents\work doucment\attachment\attachmentDB\20161005\originalFileFromAerial\DOCSVC_20161003.tar\DOCSVC_20161003\Sect2\INPATIENT\REQ_20160229-000008\Xu, Cnang Y - ATLANTIS REHAB & RHCF 8.11.16_2016-08-11-15.44.54.253.pdf
Request;20160229-000010;56767;PACE;Inpatient;PACE;C:\Users\FGuo\Documents\work doucment\attachment\attachmentDB\20161005\originalFileFromAerial\DOCSVC_20161003.tar\DOCSVC_20161003\Sect2\INPATIENT\REQ_20160229-000010\castello ideltina 31016_2016-03-10-14.50.12.338.tif
Request;20160229-000010;56767;PACE;Inpatient;PACE;C:\Users\FGuo\Documents\work doucment\attachment\attachmentDB\20161005\originalFileFromAerial\DOCSVC_20161003.tar\DOCSVC_20161003\Sect2\INPATIENT\REQ_20160229-000010\castello ideltina22916_2016-03-01-11.05.09.22.tif
Request;20160229-000010;56767;PACE;Inpatient;PACE;C:\Users\FGuo\Documents\work doucment\attachment\attachmentDB\20161005\originalFileFromAerial\DOCSVC_20161003.tar\DOCSVC_20161003\Sect2\INPATIENT\REQ_20160229-000010\castello ideltina3316_2016-03-03-09.44.23.37.tif
Request;20160229-000010;56767;PACE;Inpatient;PACE;C:\Users\FGuo\Documents\work doucment\attachment\attachmentDB\20161005\originalFileFromAerial\DOCSVC_20161003.tar\DOCSVC_20161003\Sect2\INPATIENT\REQ_20160229-000010\castelo ideltina3716_2016-03-07-13.44.32.442.tif
Request;20160229-000010;56767;PACE;Inpatient;PACE;C:\Users\FGuo\Documents\work doucment\attachment\attachmentDB\20161005\originalFileFromAerial\DOCSVC_20161003.tar\DOCSVC_20161003\Sect2\INPATIENT\REQ_20160229-000010\CASTELO, IDELTINA CLINICAL REVIEW REQUEST FORM_2016-02-29-10.18.30.198.doc
Request;20160229-000010;56767;PACE;Inpatient;PACE;C:\Users\FGuo\Documents\work doucment\attachment\attachmentDB\20161005\originalFileFromAerial\DOCSVC_20161003.tar\DOCSVC_20161003\Sect2\INPATIENT\REQ_20160229-000010\casteloideltina3116_2016-03-01-17.25.08.820.tif
Request;20160229-000014;46326;PACE;Inpatient;PACE;C:\Users\FGuo\Documents\work doucment\attachment\attachmentDB\20161005\originalFileFromAerial\DOCSVC_20161003.tar\DOCSVC_20161003\Sect2\INPATIENT\REQ_20160229-000014\GLADDEN, AUDREY CLINICAL REVIEW REQUEST FORM_2016-02-29-10.46.58.682.doc
Request;20160229-000014;46326;PACE;Inpatient;PACE;C:\Users\FGuo\Documents\work doucment\attachment\attachmentDB\20161005\originalFileFromAerial\DOCSVC_20161003.tar\DOCSVC_20161003\Sect2\INPATIENT\REQ_20160229-000014\Gladden, Audrey T - Montefiore Medical Center 8-17-16_2016-08-17-10.13.06.719.pdf
Request;20160229-000014;46326;PACE;Inpatient;PACE;C:\Users\FGuo\Documents\work doucment\attachment\attachmentDB\20161005\originalFileFromAerial\DOCSVC_20161003.tar\DOCSVC_20161003\Sect2\INPATIENT\REQ_20160229-000014\Gladden, Audrey_3-3-16_clinical_2016-03-04-12.39.17.352.tif
Request;20160229-000026;74264;PACE;Inpatient;PACE;C:\Users\FGuo\Documents\work doucment\attachment\attachmentDB\20161005\originalFileFromAerial\DOCSVC_20161003.tar\DOCSVC_20161003\Sect2\INPATIENT\REQ_20160229-000026\chan pun chuen22916_2016-03-01-11.37.22.103.tif
Request;20160229-000026;74264;PACE;Inpatient;PACE;C:\Users\FGuo\Documents\work doucment\attachment\attachmentDB\20161005\originalFileFromAerial\DOCSVC_20161003.tar\DOCSVC_20161003\Sect2\INPATIENT\REQ_20160229-000026\Chan, Pun Chuen 74264 Clinical Review 10 15 Req Form_2016-02-29-12.32.23.750.docx
Request;20160229-000031;27598;PACE;Inpatient;PACE;C:\Users\FGuo\Documents\work doucment\attachment\attachmentDB\20161005\originalFileFromAerial\DOCSVC_20161003.tar\DOCSVC_20161003\Sect2\INPATIENT\REQ_20160229-000031\Marcos Miriam IP Denial Maimonides Medical Center 3-4-16_2016-03-04-11.13.53.116.pdf
Request;20160229-000031;27598;PACE;Inpatient;PACE;C:\Users\FGuo\Documents\work doucment\attachment\attachmentDB\20161005\originalFileFromAerial\DOCSVC_20161003.tar\DOCSVC_20161003\Sect2\INPATIENT\REQ_20160229-000031\Marcos Miriam IP Denial Maimonides Medical Center 3-4-16_2016-04-13-11.41.21.984.docx
Request;20160229-000031;27598;PACE;Inpatient;PACE;C:\Users\FGuo\Documents\work doucment\attachment\attachmentDB\20161005\originalFileFromAerial\DOCSVC_20161003.tar\DOCSVC_20161003\Sect2\INPATIENT\REQ_20160229-000031\Marcos Miriam IP Denial Maimonides Medical Center 3-4-16_2016-04-13-11.41.47.978.docx
Request;20160229-000031;27598;PACE;Inpatient;PACE;C:\Users\FGuo\Documents\work doucment\attachment\attachmentDB\20161005\originalFileFromAerial\DOCSVC_20161003.tar\DOCSVC_20161003\Sect2\INPATIENT\REQ_20160229-000031\Marcos, Miriam Appeal Acknowledgement _2016-04-13-11.41.39.115.docx
Request;20160229-000031;27598;PACE;Inpatient;PACE;C:\Users\FGuo\Documents\work doucment\attachment\attachmentDB\20161005\originalFileFromAerial\DOCSVC_20161003.tar\DOCSVC_20161003\Sect2\INPATIENT\REQ_20160229-000031\Marcos, Miriam_clinical_3-1-16_2016-03-02-15.40.21.722.pdf
Request;20160229-000031;27598;PACE;Inpatient;PACE;C:\Users\FGuo\Documents\work doucment\attachment\attachmentDB\20161005\originalFileFromAerial\DOCSVC_20161003.tar\DOCSVC_20161003\Sect2\INPATIENT\REQ_20160229-000031\O_\27598 MARCOS, MIRIAM UR REQ SHEET_2016-02-29-12.23.28.93.doc
Request;20160229-000032;86335;PACE;Inpatient;PACE;C:\Users\FGuo\Documents\work doucment\attachment\attachmentDB\20161005\originalFileFromAerial\DOCSVC_20161003.tar\DOCSVC_20161003\Sect2\INPATIENT\REQ_20160229-000032\gloria wilson dc_2016-03-03-17.05.32.445.tif
Request;20160229-000032;86335;PACE;Inpatient;PACE;C:\Users\FGuo\Documents\work doucment\attachment\attachmentDB\20161005\originalFileFromAerial\DOCSVC_20161003.tar\DOCSVC_20161003\Sect2\INPATIENT\REQ_20160229-000032\wilson gloriadc_2016-03-03-17.05.56.730.tif
Request;20160229-000032;86335;PACE;Inpatient;PACE;C:\Users\FGuo\Documents\work doucment\attachment\attachmentDB\20161005\originalFileFromAerial\DOCSVC_20161003.tar\DOCSVC_20161003\Sect2\INPATIENT\REQ_20160229-000032\Wilson, Gloria - Townhouse Extended Care Facility - 4.7.16_2016-04-07-10.54.52.557.pdf
Request;20160229-000033;23111;PACE;Inpatient;PACE;C:\Users\FGuo\Documents\work doucment\attachment\attachmentDB\20161005\originalFileFromAerial\DOCSVC_20161003.tar\DOCSVC_20161003\Sect2\INPATIENT\REQ_20160229-000033\lopez manuel3116_2016-03-01-16.56.00.51.tif
Request;20160229-000033;23111;PACE;Inpatient;PACE;C:\Users\FGuo\Documents\work doucment\attachment\attachmentDB\20161005\originalFileFromAerial\DOCSVC_20161003.tar\DOCSVC_20161003\Sect2\INPATIENT\REQ_20160229-000033\lopez manuel3116_2016-03-01-16.56.50.708.tif
Request;20160229-000033;23111;PACE;Inpatient;PACE;C:\Users\FGuo\Documents\work doucment\attachment\attachmentDB\20161005\originalFileFromAerial\DOCSVC_20161003.tar\DOCSVC_20161003\Sect2\INPATIENT\REQ_20160229-000033\O_\Waters Place\Aerial\Auth Req_Clinicals\Lopez.M__BIMC__Clinical Request Form_ 02.29.16_2016-02-29-12.29.26.162.docx
Request;20160229-000033;23111;PACE;Inpatient;PACE;C:\Users\FGuo\Documents\work doucment\attachment\attachmentDB\20161005\originalFileFromAerial\DOCSVC_20161003.tar\DOCSVC_20161003\Sect2\INPATIENT\REQ_20160229-000033\O_\Waters Place\Aerial\Medical Doc Rcvd\Lopez.M__BIMC__ScreenShot__03.01.16_2016-03-01-16.14.49.381.tif
Request;20160229-000043;23112;PACE;Inpatient;Not Valued;C:\Users\FGuo\Documents\work doucment\attachment\attachmentDB\20161005\originalFileFromAerial\DOCSVC_20161003.tar\DOCSVC_20161003\Sect2\INPATIENT\REQ_20160229-000043\caprile joseph22916_2016-03-01-12.06.17.404.tif
Request;20160229-000043;23112;PACE;Inpatient;Not Valued;C:\Users\FGuo\Documents\work doucment\attachment\attachmentDB\20161005\originalFileFromAerial\DOCSVC_20161003.tar\DOCSVC_20161003\Sect2\INPATIENT\REQ_20160229-000043\Caprile, Joseph - Forest Hills Hospital  2-29-16_2016-02-29-13.56.25.962.doc
Request;20160229-000043;23112;PACE;Inpatient;Not Valued;C:\Users\FGuo\Documents\work doucment\attachment\attachmentDB\20161005\originalFileFromAerial\DOCSVC_20161003.tar\DOCSVC_20161003\Sect2\INPATIENT\REQ_20160229-000043\O_\23112 CAPRILE, JOSEPH CLINICALS_2016-03-01-10.51.08.403.tif
Request;20160229-000047;61226;SELECT;Inpatient;SELECT;C:\Users\FGuo\Documents\work doucment\attachment\attachmentDB\20161005\originalFileFromAerial\DOCSVC_20161003.tar\DOCSVC_20161003\Sect2\INPATIENT\REQ_20160229-000047\O_\nursing home documents\M Davidson 61226 #1_2016-02-29-14.17.36.307.tif
Request;20160229-000051;92313;PACE;Inpatient;PACE;C:\Users\FGuo\Documents\work doucment\attachment\attachmentDB\20161005\originalFileFromAerial\DOCSVC_20161003.tar\DOCSVC_20161003\Sect2\INPATIENT\REQ_20160229-000051\Hollwell Olivette IP Denial Montefiore Medical Center 3-8-16_2016-03-08-15.34.31.215.pdf
Request;20160229-000051;92313;PACE;Inpatient;PACE;C:\Users\FGuo\Documents\work doucment\attachment\attachmentDB\20161005\originalFileFromAerial\DOCSVC_20161003.tar\DOCSVC_20161003\Sect2\INPATIENT\REQ_20160229-000051\Holwell Olivette - Montefiore Medical Center  2-29-16_2016-02-29-14.50.42.845.pdf
Request;20160229-000051;92313;PACE;Inpatient;PACE;C:\Users\FGuo\Documents\work doucment\attachment\attachmentDB\20161005\originalFileFromAerial\DOCSVC_20161003.tar\DOCSVC_20161003\Sect2\INPATIENT\REQ_20160229-000051\Holwell, O 92313 CR 2-29-16_2016-03-04-12.45.09.905.tif
Request;20160229-000051;92313;PACE;Inpatient;PACE;C:\Users\FGuo\Documents\work doucment\attachment\attachmentDB\20161005\originalFileFromAerial\DOCSVC_20161003.tar\DOCSVC_20161003\Sect2\INPATIENT\REQ_20160229-000051\HOlwell, Olivette_cliniclal_2016-03-07-16.35.19.235.pdf
Request;20160229-000051;92313;PACE;Inpatient;PACE;C:\Users\FGuo\Documents\work doucment\attachment\attachmentDB\20161005\originalFileFromAerial\DOCSVC_20161003.tar\DOCSVC_20161003\Sect2\INPATIENT\REQ_20160229-000051\HOLWELL_OLIVETTE M_1OF3_041216  _2016-05-16-13.55.38.152.pdf
Request;20160229-000051;92313;PACE;Inpatient;PACE;C:\Users\FGuo\Documents\work doucment\attachment\attachmentDB\20161005\originalFileFromAerial\DOCSVC_20161003.tar\DOCSVC_20161003\Sect2\INPATIENT\REQ_20160229-000051\HOLWELL_OLIVETTE M_2OF3_041216  _2016-05-16-13.55.58.733.pdf
Request;20160229-000051;92313;PACE;Inpatient;PACE;C:\Users\FGuo\Documents\work doucment\attachment\attachmentDB\20161005\originalFileFromAerial\DOCSVC_20161003.tar\DOCSVC_20161003\Sect2\INPATIENT\REQ_20160229-000051\HOLWELL_OLIVETTE M_3OF3_041216  _2016-05-16-13.56.25.138.pdf
Request;20160229-000053;42430;PACE;Inpatient;PACE;C:\Users\FGuo\Documents\work doucment\attachment\attachmentDB\20161005\originalFileFromAerial\DOCSVC_20161003.tar\DOCSVC_20161003\Sect2\INPATIENT\REQ_20160229-000053\Hernandez Maria - Montefiore Medical Center  2-29-16_2016-02-29-14.46.51.276.pdf
Request;20160229-000053;42430;PACE;Inpatient;PACE;C:\Users\FGuo\Documents\work doucment\attachment\attachmentDB\20161005\originalFileFromAerial\DOCSVC_20161003.tar\DOCSVC_20161003\Sect2\INPATIENT\REQ_20160229-000053\Hernandez, Maria S - MONTEFIORE MEDICAL CENTER 8.22.16_2016-08-22-13.21.31.20.pdf
Request;20160229-000053;42430;PACE;Inpatient;PACE;C:\Users\FGuo\Documents\work doucment\attachment\attachmentDB\20161005\originalFileFromAerial\DOCSVC_20161003.tar\DOCSVC_20161003\Sect2\INPATIENT\REQ_20160229-000053\HERNANDEZ, MARIA _2-29-16_2016-03-04-11.48.25.483.pdf
Request;20160229-000058;22778;SELECT;Inpatient;SELECT;C:\Users\FGuo\Documents\work doucment\attachment\attachmentDB\20161005\originalFileFromAerial\DOCSVC_20161003.tar\DOCSVC_20161003\Sect2\INPATIENT\REQ_20160229-000058\Hoffler, Alma 22778 LTC   PRI BA-FAX1_1602262122526971_2016-02-29-15.27.32.608.TIF
Request;20160229-000063;47509;SELECT;Inpatient;SELECT;C:\Users\FGuo\Documents\work doucment\attachment\attachmentDB\20161005\originalFileFromAerial\DOCSVC_20161003.tar\DOCSVC_20161003\Sect2\INPATIENT\REQ_20160229-000063\Conlon, Janine - GLENGARIFF HEALTH CARE CENTER 8.17.16_2016-08-17-10.29.33.949.pdf
Request;20160229-000063;47509;SELECT;Inpatient;SELECT;C:\Users\FGuo\Documents\work doucment\attachment\attachmentDB\20161005\originalFileFromAerial\DOCSVC_20161003.tar\DOCSVC_20161003\Sect2\INPATIENT\REQ_20160229-000063\Conlon, Janini 47509  LTC BA-FAX1_1602262056096934_2016-02-29-16.06.33.685.TIF
Request;20160229-000063;47509;SELECT;Inpatient;SELECT;C:\Users\FGuo\Documents\work doucment\attachment\attachmentDB\20161005\originalFileFromAerial\DOCSVC_20161003.tar\DOCSVC_20161003\Sect2\INPATIENT\REQ_20160229-000063\Conlon.Janine__No 47509__ Glengariff Health CC__Updtd Notes__ Rcv 05.04.16__05.12.16_2016-05-12-10.25.13.297.TIF
Request;20160229-000063;47509;SELECT;Inpatient;SELECT;C:\Users\FGuo\Documents\work doucment\attachment\attachmentDB\20161005\originalFileFromAerial\DOCSVC_20161003.tar\DOCSVC_20161003\Sect2\INPATIENT\REQ_20160229-000063\JANINE CONLON_2016-06-10-11.36.26.960.tif
Request;20160301-000002;46148;PACE;Inpatient;PACE;C:\Users\FGuo\Documents\work doucment\attachment\attachmentDB\20161005\originalFileFromAerial\DOCSVC_20161003.tar\DOCSVC_20161003\Sect2\INPATIENT\REQ_20160301-000002\04112016 WALLACE_WILLIE R_MR1_041116_2016-05-17-08.48.29.846.pdf
Request;20160301-000002;46148;PACE;Inpatient;PACE;C:\Users\FGuo\Documents\work doucment\attachment\attachmentDB\20161005\originalFileFromAerial\DOCSVC_20161003.tar\DOCSVC_20161003\Sect2\INPATIENT\REQ_20160301-000002\04112016 WALLACE_WILLIE R_MR2_041116_2016-05-17-08.48.50.840.pdf
Request;20160301-000002;46148;PACE;Inpatient;PACE;C:\Users\FGuo\Documents\work doucment\attachment\attachmentDB\20161005\originalFileFromAerial\DOCSVC_20161003.tar\DOCSVC_20161003\Sect2\INPATIENT\REQ_20160301-000002\04112016 WALLACE_WILLIE R_MR3_041116_2016-05-17-08.49.11.933.pdf
Request;20160301-000002;46148;PACE;Inpatient;PACE;C:\Users\FGuo\Documents\work doucment\attachment\attachmentDB\20161005\originalFileFromAerial\DOCSVC_20161003.tar\DOCSVC_20161003\Sect2\INPATIENT\REQ_20160301-000002\Wallace Willie  IP Denial Long Island Jewish Medical Center 3-1-16_2016-03-01-16.21.07.887.pdf
Request;20160301-000002;46148;PACE;Inpatient;PACE;C:\Users\FGuo\Documents\work doucment\attachment\attachmentDB\20161005\originalFileFromAerial\DOCSVC_20161003.tar\DOCSVC_20161003\Sect2\INPATIENT\REQ_20160301-000002\wallace willie22916_2016-03-01-12.01.10.15.tif
Request;20160301-000002;46148;PACE;Inpatient;PACE;C:\Users\FGuo\Documents\work doucment\attachment\attachmentDB\20161005\originalFileFromAerial\DOCSVC_20161003.tar\DOCSVC_20161003\Sect2\INPATIENT\REQ_20160301-000002\Wallace, Willie R 46148 Clinical Review 10 15 Req Form - Copy (2)_2016-03-01-09.57.26.492.docx
Request;20160301-000008;73996;PACE;Inpatient;PACE;C:\Users\FGuo\Documents\work doucment\attachment\attachmentDB\20161005\originalFileFromAerial\DOCSVC_20161003.tar\DOCSVC_20161003\Sect2\INPATIENT\REQ_20160301-000008\Garcia, Dalila  - Montefiore New Rochelle 8-19-16_2016-08-19-10.07.22.120.pdf
Request;20160301-000008;73996;PACE;Inpatient;PACE;C:\Users\FGuo\Documents\work doucment\attachment\attachmentDB\20161005\originalFileFromAerial\DOCSVC_20161003.tar\DOCSVC_20161003\Sect2\INPATIENT\REQ_20160301-000008\GARCIA, Dalila_clinical_2016-03-04-12.26.51.998.tif
Request;20160301-000008;73996;PACE;Inpatient;PACE;C:\Users\FGuo\Documents\work doucment\attachment\attachmentDB\20161005\originalFileFromAerial\DOCSVC_20161003.tar\DOCSVC_20161003\Sect2\INPATIENT\REQ_20160301-000008\O_\73996 GARCIA, DALILA UR REQ SHEET_2016-03-01-10.59.57.812.doc
Request;20160301-000012;60747;null;Inpatient;PACE;C:\Users\FGuo\Documents\work doucment\attachment\attachmentDB\20161005\originalFileFromAerial\DOCSVC_20161003.tar\DOCSVC_20161003\Sect2\INPATIENT\REQ_20160301-000012\lian zhang3116_2016-03-01-16.46.33.860.tif
Request;20160301-000012;60747;null;Inpatient;PACE;C:\Users\FGuo\Documents\work doucment\attachment\attachmentDB\20161005\originalFileFromAerial\DOCSVC_20161003.tar\DOCSVC_20161003\Sect2\INPATIENT\REQ_20160301-000012\Zhang Lian IP Denial Queens Hospital Center 3-2-16_2016-03-03-09.43.29.915.pdf
Request;20160301-000012;60747;null;Inpatient;PACE;C:\Users\FGuo\Documents\work doucment\attachment\attachmentDB\20161005\originalFileFromAerial\DOCSVC_20161003.tar\DOCSVC_20161003\Sect2\INPATIENT\REQ_20160301-000012\Zhang, Lian - Queens Hospital Center  Clinical Review Request Form 3-1-16_2016-03-01-11.34.24.342.docx
Request;20160301-000013;59187;PACE;Inpatient;PACE;C:\Users\FGuo\Documents\work doucment\attachment\attachmentDB\20161005\originalFileFromAerial\DOCSVC_20161003.tar\DOCSVC_20161003\Sect2\INPATIENT\REQ_20160301-000013\cipriano lucia 32816_2016-03-29-11.19.51.184.tif
Request;20160301-000013;59187;PACE;Inpatient;PACE;C:\Users\FGuo\Documents\work doucment\attachment\attachmentDB\20161005\originalFileFromAerial\DOCSVC_20161003.tar\DOCSVC_20161003\Sect2\INPATIENT\REQ_20160301-000013\cipriano lucia031416_2016-03-14-11.02.55.5.tif
Request;20160301-000013;59187;PACE;Inpatient;PACE;C:\Users\FGuo\Documents\work doucment\attachment\attachmentDB\20161005\originalFileFromAerial\DOCSVC_20161003.tar\DOCSVC_20161003\Sect2\INPATIENT\REQ_20160301-000013\cipriano lucia318_2016-03-18-17.08.54.153.tif
Request;20160301-000013;59187;PACE;Inpatient;PACE;C:\Users\FGuo\Documents\work doucment\attachment\attachmentDB\20161005\originalFileFromAerial\DOCSVC_20161003.tar\DOCSVC_20161003\Sect2\INPATIENT\REQ_20160301-000013\Cipriano, Lucia- Schnurmacher Nursing Home (Auth20160301-000013 )  3.11.16_2016-03-11-10.56.01.261.pdf
Request;20160301-000013;59187;PACE;Inpatient;PACE;C:\Users\FGuo\Documents\work doucment\attachment\attachmentDB\20161005\originalFileFromAerial\DOCSVC_20161003.tar\DOCSVC_20161003\Sect2\INPATIENT\REQ_20160301-000013\CIPRIANO, LUCIA_PRI_2016-03-01-11.41.20.845.tif
Request;20160301-000018;45276;PACE;Inpatient;PACE;C:\Users\FGuo\Documents\work doucment\attachment\attachmentDB\20161005\originalFileFromAerial\DOCSVC_20161003.tar\DOCSVC_20161003\Sect2\INPATIENT\REQ_20160301-000018\James, Esther - Beth Abraham Nursing Home (Auth 20160301-000018 )3.11.16_2016-03-11-11.07.20.588.pdf
Request;20160301-000018;45276;PACE;Inpatient;PACE;C:\Users\FGuo\Documents\work doucment\attachment\attachmentDB\20161005\originalFileFromAerial\DOCSVC_20161003.tar\DOCSVC_20161003\Sect2\INPATIENT\REQ_20160301-000018\JAMES, ESTHER_PRI_2016-03-01-12.12.38.304.tif
Request;20160301-000020;81215;PACE;Inpatient;PACE;C:\Users\FGuo\Documents\work doucment\attachment\attachmentDB\20161005\originalFileFromAerial\DOCSVC_20161003.tar\DOCSVC_20161003\Sect2\INPATIENT\REQ_20160301-000020\James Astley IP Denial Montefiore Medical Center 3-4-16_2016-03-04-11.39.29.336.pdf
Request;20160301-000020;81215;PACE;Inpatient;PACE;C:\Users\FGuo\Documents\work doucment\attachment\attachmentDB\20161005\originalFileFromAerial\DOCSVC_20161003.tar\DOCSVC_20161003\Sect2\INPATIENT\REQ_20160301-000020\JAMES, ASTLEY_050216_2016-06-16-12.56.42.602.pdf
Request;20160301-000020;81215;PACE;Inpatient;PACE;C:\Users\FGuo\Documents\work doucment\attachment\attachmentDB\20161005\originalFileFromAerial\DOCSVC_20161003.tar\DOCSVC_20161003\Sect2\INPATIENT\REQ_20160301-000020\James, Astley_clinical_2016-03-03-16.26.59.64.tif
Request;20160301-000020;81215;PACE;Inpatient;PACE;C:\Users\FGuo\Documents\work doucment\attachment\attachmentDB\20161005\originalFileFromAerial\DOCSVC_20161003.tar\DOCSVC_20161003\Sect2\INPATIENT\REQ_20160301-000020\James.A__MontefioreMC__Moses__Clinical Request Form_ 03.01.16_2016-03-01-12.22.20.198.docx
Request;20160301-000020;81215;PACE;Inpatient;PACE;C:\Users\FGuo\Documents\work doucment\attachment\attachmentDB\20161005\originalFileFromAerial\DOCSVC_20161003.tar\DOCSVC_20161003\Sect2\INPATIENT\REQ_20160301-000020\O_\Waters Place\Aerial\Auth Req_Clinicals\James.A__MontefioreMC__Moses__Clinical Request Form_ 03.01.16_2016-03-01-12.21.15.722.docx
Request;20160301-000021;52258;PACE;Inpatient;PACE;C:\Users\FGuo\Documents\work doucment\attachment\attachmentDB\20161005\originalFileFromAerial\DOCSVC_20161003.tar\DOCSVC_20161003\Sect2\INPATIENT\REQ_20160301-000021\Bonn, Jean M - Montefiore Medical Center 8-11-16_2016-08-11-13.21.14.354.pdf
Request;20160301-000021;52258;PACE;Inpatient;PACE;C:\Users\FGuo\Documents\work doucment\attachment\attachmentDB\20161005\originalFileFromAerial\DOCSVC_20161003.tar\DOCSVC_20161003\Sect2\INPATIENT\REQ_20160301-000021\Bonn, Jean_clinical_2016-03-04-10.09.42.341.tif
Request;20160301-000021;52258;PACE;Inpatient;PACE;C:\Users\FGuo\Documents\work doucment\attachment\attachmentDB\20161005\originalFileFromAerial\DOCSVC_20161003.tar\DOCSVC_20161003\Sect2\INPATIENT\REQ_20160301-000021\Bonn.Jean.M__MontefioreMC__Moses__Clinical Request Form_ 03.01.16_2016-03-01-12.26.24.800.docx
Request;20160301-000021;52258;PACE;Inpatient;PACE;C:\Users\FGuo\Documents\work doucment\attachment\attachmentDB\20161005\originalFileFromAerial\DOCSVC_20161003.tar\DOCSVC_20161003\Sect2\INPATIENT\REQ_20160301-000021\Jean, Bonn_Clinical _2-29-16_2016-03-02-16.20.56.383.tif
Request;20160301-000021;52258;PACE;Inpatient;PACE;C:\Users\FGuo\Documents\work doucment\attachment\attachmentDB\20161005\originalFileFromAerial\DOCSVC_20161003.tar\DOCSVC_20161003\Sect2\INPATIENT\REQ_20160301-000021\O_\Waters Place\Aerial\Auth Req_Clinicals\Bonn.Jean.M__MontefioreMC__Moses__Clinical Request Form_ 03.01.16_2016-03-01-12.25.37.368.docx
Request;20160301-000023;31626;SELECT;Inpatient;SELECT;C:\Users\FGuo\Documents\work doucment\attachment\attachmentDB\20161005\originalFileFromAerial\DOCSVC_20161003.tar\DOCSVC_20161003\Sect2\INPATIENT\REQ_20160301-000023\Kontorovich Sima- Haym Salomon Home for The Aged- 4-21-16_2016-04-21-11.30.48.144.pdf
Request;20160301-000023;31626;SELECT;Inpatient;SELECT;C:\Users\FGuo\Documents\work doucment\attachment\attachmentDB\20161005\originalFileFromAerial\DOCSVC_20161003.tar\DOCSVC_20161003\Sect2\INPATIENT\REQ_20160301-000023\Kontorovich, Sima - Haym Salomon Home for Nursing & Rehab. 9.09.16_2016-09-09-14.06.57.898.pdf
Request;20160301-000026;46156;PACE;Inpatient;PACE;C:\Users\FGuo\Documents\work doucment\attachment\attachmentDB\20161005\originalFileFromAerial\DOCSVC_20161003.tar\DOCSVC_20161003\Sect2\INPATIENT\REQ_20160301-000026\O_\Waters Place\Aerial\Auth Req_Clinicals\Wright.C__MercyMC__Clinical Request Form_ 03.01.16_2016-03-01-13.05.16.708.docx
Request;20160301-000026;46156;PACE;Inpatient;PACE;C:\Users\FGuo\Documents\work doucment\attachment\attachmentDB\20161005\originalFileFromAerial\DOCSVC_20161003.tar\DOCSVC_20161003\Sect2\INPATIENT\REQ_20160301-000026\O_\Waters Place\Aerial\Medical Doc Rcvd\Wright.C__MercyMedical__ 03.04.16_2016-03-04-11.57.26.524.tif
Request;20160301-000026;46156;PACE;Inpatient;PACE;C:\Users\FGuo\Documents\work doucment\attachment\attachmentDB\20161005\originalFileFromAerial\DOCSVC_20161003.tar\DOCSVC_20161003\Sect2\INPATIENT\REQ_20160301-000026\Wright Clara - Mercy Medical Center 3-18-16_2016-03-18-11.55.53.336.pdf
Request;20160301-000026;46156;PACE;Inpatient;PACE;C:\Users\FGuo\Documents\work doucment\attachment\attachmentDB\20161005\originalFileFromAerial\DOCSVC_20161003.tar\DOCSVC_20161003\Sect2\INPATIENT\REQ_20160301-000026\Wright Clara - Mercy Medical Center 3-18-16_2016-03-18-12.22.45.479.pdf
Request;20160301-000026;46156;PACE;Inpatient;PACE;C:\Users\FGuo\Documents\work doucment\attachment\attachmentDB\20161005\originalFileFromAerial\DOCSVC_20161003.tar\DOCSVC_20161003\Sect2\INPATIENT\REQ_20160301-000026\Wright Clara -Mercy Medical Center 3-8-16_2016-03-08-16.11.20.4.pdf
Request;20160301-000029;59998;SELECT;Inpatient;SELECT;C:\Users\FGuo\Documents\work doucment\attachment\attachmentDB\20161005\originalFileFromAerial\DOCSVC_20161003.tar\DOCSVC_20161003\Sect2\INPATIENT\REQ_20160301-000029\Bechutskiy, Yuiry_2016-09-23-09.34.25.666.tif
Request;20160301-000029;59998;SELECT;Inpatient;SELECT;C:\Users\FGuo\Documents\work doucment\attachment\attachmentDB\20161005\originalFileFromAerial\DOCSVC_20161003.tar\DOCSVC_20161003\Sect2\INPATIENT\REQ_20160301-000029\YBechutskiy PRI_2016-03-02-16.54.49.101.tif
Request;20160301-000030;26301;PACE;Inpatient;PACE;C:\Users\FGuo\Documents\work doucment\attachment\attachmentDB\20161005\originalFileFromAerial\DOCSVC_20161003.tar\DOCSVC_20161003\Sect2\INPATIENT\REQ_20160301-000030\narda vidal 3116_2016-03-01-13.59.53.381.tif
Request;20160301-000030;26301;PACE;Inpatient;PACE;C:\Users\FGuo\Documents\work doucment\attachment\attachmentDB\20161005\originalFileFromAerial\DOCSVC_20161003.tar\DOCSVC_20161003\Sect2\INPATIENT\REQ_20160301-000030\Vidal, Narda-Peninsula General Nursing Home (Auth20160301-000030 ) 3.10.16_2016-03-10-15.55.52.425.pdf
Request;20160301-000030;26301;PACE;Inpatient;PACE;C:\Users\FGuo\Documents\work doucment\attachment\attachmentDB\20161005\originalFileFromAerial\DOCSVC_20161003.tar\DOCSVC_20161003\Sect2\INPATIENT\REQ_20160301-000030\_2016-03-10-15.55.39.939
Request;20160301-000033;56967;PACE;Inpatient;PACE;C:\Users\FGuo\Documents\work doucment\attachment\attachmentDB\20161005\originalFileFromAerial\DOCSVC_20161003.tar\DOCSVC_20161003\Sect2\INPATIENT\REQ_20160301-000033\Bennett Marie IP Denial Queens Hospital Center 3-15-16_2016-03-15-16.37.57.174.docx
Request;20160301-000033;56967;PACE;Inpatient;PACE;C:\Users\FGuo\Documents\work doucment\attachment\attachmentDB\20161005\originalFileFromAerial\DOCSVC_20161003.tar\DOCSVC_20161003\Sect2\INPATIENT\REQ_20160301-000033\BENNETT, MARIE_1OF2_042016_2016-06-10-14.05.52.405.pdf
Request;20160301-000033;56967;PACE;Inpatient;PACE;C:\Users\FGuo\Documents\work doucment\attachment\attachmentDB\20161005\originalFileFromAerial\DOCSVC_20161003.tar\DOCSVC_20161003\Sect2\INPATIENT\REQ_20160301-000033\BENNETT, MARIE_2OF2_042016_2016-06-10-14.06.07.467.pdf
Request;20160301-000033;56967;PACE;Inpatient;PACE;C:\Users\FGuo\Documents\work doucment\attachment\attachmentDB\20161005\originalFileFromAerial\DOCSVC_20161003.tar\DOCSVC_20161003\Sect2\INPATIENT\REQ_20160301-000033\MBennett_2016-03-03-12.11.42.128.tif
Request;20160301-000033;56967;PACE;Inpatient;PACE;C:\Users\FGuo\Documents\work doucment\attachment\attachmentDB\20161005\originalFileFromAerial\DOCSVC_20161003.tar\DOCSVC_20161003\Sect2\INPATIENT\REQ_20160301-000033\O_\56967 BENNETT, MARIE UR REQ SHEET_2016-03-01-14.20.05.639.doc
Request;20160301-000034;76740;PACE;Inpatient;PACE;C:\Users\FGuo\Documents\work doucment\attachment\attachmentDB\20161005\originalFileFromAerial\DOCSVC_20161003.tar\DOCSVC_20161003\Sect2\INPATIENT\REQ_20160301-000034\Arroyo, Maria A  3-3-16_2016-03-03-11.47.39.914.doc
Request;20160301-000034;76740;PACE;Inpatient;PACE;C:\Users\FGuo\Documents\work doucment\attachment\attachmentDB\20161005\originalFileFromAerial\DOCSVC_20161003.tar\DOCSVC_20161003\Sect2\INPATIENT\REQ_20160301-000034\Arroyo, Maria A  3-7-16_2016-03-07-13.30.30.213.doc
Request;20160301-000034;76740;PACE;Inpatient;PACE;C:\Users\FGuo\Documents\work doucment\attachment\attachmentDB\20161005\originalFileFromAerial\DOCSVC_20161003.tar\DOCSVC_20161003\Sect2\INPATIENT\REQ_20160301-000034\Arroyo, Maria A -Brookdale Hospital 8-16-16_2016-08-16-11.51.38.266.pdf
Request;20160301-000034;76740;PACE;Inpatient;PACE;C:\Users\FGuo\Documents\work doucment\attachment\attachmentDB\20161005\originalFileFromAerial\DOCSVC_20161003.tar\DOCSVC_20161003\Sect2\INPATIENT\REQ_20160301-000034\Arroyo, Maria_clinical_3-8-16_2016-03-09-17.16.25.603.pdf
Request;20160301-000034;76740;PACE;Inpatient;PACE;C:\Users\FGuo\Documents\work doucment\attachment\attachmentDB\20161005\originalFileFromAerial\DOCSVC_20161003.tar\DOCSVC_20161003\Sect2\INPATIENT\REQ_20160301-000034\O_\76740 ARROYO, MARIA UR REQ SHEET_2016-03-01-14.32.54.155.doc
Request;20160301-000036;30344;PACE;Inpatient;PACE;C:\Users\FGuo\Documents\work doucment\attachment\attachmentDB\20161005\originalFileFromAerial\DOCSVC_20161003.tar\DOCSVC_20161003\Sect2\INPATIENT\REQ_20160301-000036\Hawkins, Samuel  3-4-16_2016-03-04-15.58.35.243.docx
Request;20160301-000036;30344;PACE;Inpatient;PACE;C:\Users\FGuo\Documents\work doucment\attachment\attachmentDB\20161005\originalFileFromAerial\DOCSVC_20161003.tar\DOCSVC_20161003\Sect2\INPATIENT\REQ_20160301-000036\Hawkins, Samuel  3-7-16_2016-03-07-12.46.42.961.docx
Request;20160301-000036;30344;PACE;Inpatient;PACE;C:\Users\FGuo\Documents\work doucment\attachment\attachmentDB\20161005\originalFileFromAerial\DOCSVC_20161003.tar\DOCSVC_20161003\Sect2\INPATIENT\REQ_20160301-000036\Hawkins, Samuel - LUTHERAN MEDICAL CENTER 8.23.16_2016-08-23-11.37.10.257.pdf
Request;20160301-000036;30344;PACE;Inpatient;PACE;C:\Users\FGuo\Documents\work doucment\attachment\attachmentDB\20161005\originalFileFromAerial\DOCSVC_20161003.tar\DOCSVC_20161003\Sect2\INPATIENT\REQ_20160301-000036\Hawkins, Samuel_clinical-Lutheran #2_3-21-16_2016-03-31-12.13.03.649.pdf
Request;20160301-000036;30344;PACE;Inpatient;PACE;C:\Users\FGuo\Documents\work doucment\attachment\attachmentDB\20161005\originalFileFromAerial\DOCSVC_20161003.tar\DOCSVC_20161003\Sect2\INPATIENT\REQ_20160301-000036\Hawkins, Samuel_clinical-Lutheran_3-21-16_2016-03-31-12.12.44.895.pdf
Request;20160301-000036;30344;PACE;Inpatient;PACE;C:\Users\FGuo\Documents\work doucment\attachment\attachmentDB\20161005\originalFileFromAerial\DOCSVC_20161003.tar\DOCSVC_20161003\Sect2\INPATIENT\REQ_20160301-000036\Hawkins, Samuel_clinical-Lutheran_3-24-16_2016-03-31-12.13.31.579.pdf
Request;20160301-000036;30344;PACE;Inpatient;PACE;C:\Users\FGuo\Documents\work doucment\attachment\attachmentDB\20161005\originalFileFromAerial\DOCSVC_20161003.tar\DOCSVC_20161003\Sect2\INPATIENT\REQ_20160301-000036\Hawkins, Samuel_clinical-Lutheran_3-7-16_2016-03-08-17.01.19.411.pdf
Request;20160301-000036;30344;PACE;Inpatient;PACE;C:\Users\FGuo\Documents\work doucment\attachment\attachmentDB\20161005\originalFileFromAerial\DOCSVC_20161003.tar\DOCSVC_20161003\Sect2\INPATIENT\REQ_20160301-000036\Hawkins.S___LutheranMC__ Clinical Request Form_ 03.01.16_2016-03-01-14.42.30.476.docx
Request;20160301-000036;30344;PACE;Inpatient;PACE;C:\Users\FGuo\Documents\work doucment\attachment\attachmentDB\20161005\originalFileFromAerial\DOCSVC_20161003.tar\DOCSVC_20161003\Sect2\INPATIENT\REQ_20160301-000036\O_\Waters Place\Aerial\Auth Req_Clinicals\Hawkins.S___LutheranMC__ Clinical Request Form_ 03.01.16_2016-03-01-14.41.17.153.docx
Request;20160301-000039;26301;PACE;Inpatient;PACE;C:\Users\FGuo\Documents\work doucment\attachment\attachmentDB\20161005\originalFileFromAerial\DOCSVC_20161003.tar\DOCSVC_20161003\Sect2\INPATIENT\REQ_20160301-000039\Vidal Narda IP Denial St John's Episcopal Hospital 3-2-16_2016-03-03-09.35.45.886.pdf
Request;20160301-000039;26301;PACE;Inpatient;PACE;C:\Users\FGuo\Documents\work doucment\attachment\attachmentDB\20161005\originalFileFromAerial\DOCSVC_20161003.tar\DOCSVC_20161003\Sect2\INPATIENT\REQ_20160301-000039\VIDAL, NARDA MR1_2016-05-25-16.44.49.274.pdf
Request;20160301-000039;26301;PACE;Inpatient;PACE;C:\Users\FGuo\Documents\work doucment\attachment\attachmentDB\20161005\originalFileFromAerial\DOCSVC_20161003.tar\DOCSVC_20161003\Sect2\INPATIENT\REQ_20160301-000039\VIDAL, NARDA MR2_2016-05-25-16.45.38.467.pdf
Request;20160301-000039;26301;PACE;Inpatient;PACE;C:\Users\FGuo\Documents\work doucment\attachment\attachmentDB\20161005\originalFileFromAerial\DOCSVC_20161003.tar\DOCSVC_20161003\Sect2\INPATIENT\REQ_20160301-000039\Vidal.N__StJohnsEpiscopal___SouthSide__ Clinical Request Form_ 03.01.16_2016-03-01-15.08.14.598.docx
Request;20160301-000039;26301;PACE;Inpatient;PACE;C:\Users\FGuo\Documents\work doucment\attachment\attachmentDB\20161005\originalFileFromAerial\DOCSVC_20161003.tar\DOCSVC_20161003\Sect2\INPATIENT\REQ_20160301-000039\Vidal.N__StJohnsE_SouthSide__AdmissionForm with DC Summary__03.01.06_2016-03-01-15.08.41.348.tif
Request;20160301-000042;82705;PACE;Inpatient;PACE;C:\Users\FGuo\Documents\work doucment\attachment\attachmentDB\20161005\originalFileFromAerial\DOCSVC_20161003.tar\DOCSVC_20161003\Sect2\INPATIENT\REQ_20160301-000042\Ho, Nancy Wong 82705  Hosp Notification BA-FAX1_1602291437087393_2016-03-01-15.32.54.855.TIF
Request;20160301-000042;82705;PACE;Inpatient;PACE;C:\Users\FGuo\Documents\work doucment\attachment\attachmentDB\20161005\originalFileFromAerial\DOCSVC_20161003.tar\DOCSVC_20161003\Sect2\INPATIENT\REQ_20160301-000042\Ho, Nancy wong 82705 Clinical Review 10 15 Req Form - Copy (2)_2016-03-01-15.41.46.960.docx
Request;20160301-000042;82705;PACE;Inpatient;PACE;C:\Users\FGuo\Documents\work doucment\attachment\attachmentDB\20161005\originalFileFromAerial\DOCSVC_20161003.tar\DOCSVC_20161003\Sect2\INPATIENT\REQ_20160301-000042\NHo Initial_2016-03-07-12.20.37.717.tif
Request;20160301-000042;82705;PACE;Inpatient;PACE;C:\Users\FGuo\Documents\work doucment\attachment\attachmentDB\20161005\originalFileFromAerial\DOCSVC_20161003.tar\DOCSVC_20161003\Sect2\INPATIENT\REQ_20160301-000042\NHo_2016-03-07-12.16.09.457.tif
Request;20160301-000043;79642;PACE;Inpatient;PACE;C:\Users\FGuo\Documents\work doucment\attachment\attachmentDB\20161005\originalFileFromAerial\DOCSVC_20161003.tar\DOCSVC_20161003\Sect2\INPATIENT\REQ_20160301-000043\O_\79642 YEUN, SUN J UR REQ SHEET_2016-03-01-15.39.54.604.doc
Request;20160301-000043;79642;PACE;Inpatient;PACE;C:\Users\FGuo\Documents\work doucment\attachment\attachmentDB\20161005\originalFileFromAerial\DOCSVC_20161003.tar\DOCSVC_20161003\Sect2\INPATIENT\REQ_20160301-000043\SYeun_2016-03-03-12.28.06.582.tif
Request;20160301-000048;46375;PACE;Inpatient;PACE;C:\Users\FGuo\Documents\work doucment\attachment\attachmentDB\20161005\originalFileFromAerial\DOCSVC_20161003.tar\DOCSVC_20161003\Sect2\INPATIENT\REQ_20160301-000048\Foster, Lydia - JACOB PERLOW HOSPICE CORPORATION 8.19.16_2016-08-19-10.38.20.654.pdf
Request;20160301-000048;46375;PACE;Inpatient;PACE;C:\Users\FGuo\Documents\work doucment\attachment\attachmentDB\20161005\originalFileFromAerial\DOCSVC_20161003.tar\DOCSVC_20161003\Sect2\INPATIENT\REQ_20160301-000048\RJ Foster, L 46375 2-29-16_2016-03-01-16.31.48.862.tif
Request;20160302-000001;74007;PACE;Inpatient;PACE;C:\Users\FGuo\Documents\work doucment\attachment\attachmentDB\20161005\originalFileFromAerial\DOCSVC_20161003.tar\DOCSVC_20161003\Sect2\INPATIENT\REQ_20160302-000001\ELLIOT PEPPER_PRI_2016-03-02-09.07.19.353.tif
Request;20160302-000001;74007;PACE;Inpatient;PACE;C:\Users\FGuo\Documents\work doucment\attachment\attachmentDB\20161005\originalFileFromAerial\DOCSVC_20161003.tar\DOCSVC_20161003\Sect2\INPATIENT\REQ_20160302-000001\Pepper, Elliot - BETH ABRAHAM HEALTH SERVICES 8.19.16_2016-08-19-10.49.05.222.pdf
Request;20160302-000005;57944;null;Inpatient;PACE;C:\Users\FGuo\Documents\work doucment\attachment\attachmentDB\20161005\originalFileFromAerial\DOCSVC_20161003.tar\DOCSVC_20161003\Sect2\INPATIENT\REQ_20160302-000005\06212016 Elliot, Icema_2016-07-11-14.41.11.245.pdf
Request;20160302-000005;57944;null;Inpatient;PACE;C:\Users\FGuo\Documents\work doucment\attachment\attachmentDB\20161005\originalFileFromAerial\DOCSVC_20161003.tar\DOCSVC_20161003\Sect2\INPATIENT\REQ_20160302-000005\Elliott Icema IP Denial  New York Methodist Hospital 3-10-16_2016-03-11-10.55.18.889.pdf
Request;20160302-000005;57944;null;Inpatient;PACE;C:\Users\FGuo\Documents\work doucment\attachment\attachmentDB\20161005\originalFileFromAerial\DOCSVC_20161003.tar\DOCSVC_20161003\Sect2\INPATIENT\REQ_20160302-000005\Elliott, Icema  3-7-16_2016-03-07-12.38.15.45.docx
Request;20160302-000005;57944;null;Inpatient;PACE;C:\Users\FGuo\Documents\work doucment\attachment\attachmentDB\20161005\originalFileFromAerial\DOCSVC_20161003.tar\DOCSVC_20161003\Sect2\INPATIENT\REQ_20160302-000005\Elliott, Icema - NY Methodist Hosp Clinical Review Request Form 3-2-16_2016-03-02-09.53.45.789.docx
Request;20160302-000005;57944;null;Inpatient;PACE;C:\Users\FGuo\Documents\work doucment\attachment\attachmentDB\20161005\originalFileFromAerial\DOCSVC_20161003.tar\DOCSVC_20161003\Sect2\INPATIENT\REQ_20160302-000005\Elliott, Icema_clinical_3-4-16_2016-03-07-16.50.47.533.pdf
Request;20160302-000005;57944;null;Inpatient;PACE;C:\Users\FGuo\Documents\work doucment\attachment\attachmentDB\20161005\originalFileFromAerial\DOCSVC_20161003.tar\DOCSVC_20161003\Sect2\INPATIENT\REQ_20160302-000005\Elliott, Icema_clinical_3-7-16-Corrected_2016-03-08-16.26.38.32.pdf
Request;20160302-000005;57944;null;Inpatient;PACE;C:\Users\FGuo\Documents\work doucment\attachment\attachmentDB\20161005\originalFileFromAerial\DOCSVC_20161003.tar\DOCSVC_20161003\Sect2\INPATIENT\REQ_20160302-000005\Elliott, Icema_clinical_3-7-16-New_2016-03-08-16.47.21.348.pdf
Request;20160302-000006;30344;PACE;Inpatient;PACE;C:\Users\FGuo\Documents\work doucment\attachment\attachmentDB\20161005\originalFileFromAerial\DOCSVC_20161003.tar\DOCSVC_20161003\Sect2\INPATIENT\REQ_20160302-000006\G_\Rafael Noboa-Lemonier\Hawkins, Samuel_clinical-Brookdale_3-4-16_2016-03-07-21.20.57.966.pdf
Request;20160302-000006;30344;PACE;Inpatient;PACE;C:\Users\FGuo\Documents\work doucment\attachment\attachmentDB\20161005\originalFileFromAerial\DOCSVC_20161003.tar\DOCSVC_20161003\Sect2\INPATIENT\REQ_20160302-000006\Hawkins, Samuel  brookdale  3-4-16_2016-03-04-16.02.09.713.docx
Request;20160302-000006;30344;PACE;Inpatient;PACE;C:\Users\FGuo\Documents\work doucment\attachment\attachmentDB\20161005\originalFileFromAerial\DOCSVC_20161003.tar\DOCSVC_20161003\Sect2\INPATIENT\REQ_20160302-000006\Hawkins, Samuel - Brookdale Hospital Medical Center 8-17-16_2016-08-17-12.38.18.375.pdf
Request;20160302-000006;30344;PACE;Inpatient;PACE;C:\Users\FGuo\Documents\work doucment\attachment\attachmentDB\20161005\originalFileFromAerial\DOCSVC_20161003.tar\DOCSVC_20161003\Sect2\INPATIENT\REQ_20160302-000006\Hawkins, Samuel 30344 BA-FAX1_1602292256338232_2016-03-02-09.48.59.485.TIF
Request;20160302-000006;30344;PACE;Inpatient;PACE;C:\Users\FGuo\Documents\work doucment\attachment\attachmentDB\20161005\originalFileFromAerial\DOCSVC_20161003.tar\DOCSVC_20161003\Sect2\INPATIENT\REQ_20160302-000006\Hawkins, Samuel 30344 BA-FAX1_1602292256338232_2016-03-02-09.56.59.641.TIF
Request;20160302-000006;30344;PACE;Inpatient;PACE;C:\Users\FGuo\Documents\work doucment\attachment\attachmentDB\20161005\originalFileFromAerial\DOCSVC_20161003.tar\DOCSVC_20161003\Sect2\INPATIENT\REQ_20160302-000006\_2016-03-02-09.56.33.831
Request;20160302-000015;53830;null;Inpatient;DIRECT;C:\Users\FGuo\Documents\work doucment\attachment\attachmentDB\20161005\originalFileFromAerial\DOCSVC_20161003.tar\DOCSVC_20161003\Sect2\INPATIENT\REQ_20160302-000015\Wilson, Albert_clinical-PRI_2-26-16_2016-03-02-11.03.56.466.pdf
Request;20160302-000019;53830;null;Inpatient;DIRECT;C:\Users\FGuo\Documents\work doucment\attachment\attachmentDB\20161005\originalFileFromAerial\DOCSVC_20161003.tar\DOCSVC_20161003\Sect2\INPATIENT\REQ_20160302-000019\Wilson Albert- VA New York Harbor Healthcare System Bklyn 3-18-16_2016-03-18-12.11.00.910.pdf
Request;20160302-000019;53830;null;Inpatient;DIRECT;C:\Users\FGuo\Documents\work doucment\attachment\attachmentDB\20161005\originalFileFromAerial\DOCSVC_20161003.tar\DOCSVC_20161003\Sect2\INPATIENT\REQ_20160302-000019\Wilson, A 71306_2016-03-16-16.20.17.432.tif
Request;20160302-000020;48535;PACE;Inpatient;PACE;C:\Users\FGuo\Documents\work doucment\attachment\attachmentDB\20161005\originalFileFromAerial\DOCSVC_20161003.tar\DOCSVC_20161003\Sect2\INPATIENT\REQ_20160302-000020\04112016  YUNG_YIKCHUNG_1OF4_041116 _2016-05-16-13.35.29.350.pdf
Request;20160302-000020;48535;PACE;Inpatient;PACE;C:\Users\FGuo\Documents\work doucment\attachment\attachmentDB\20161005\originalFileFromAerial\DOCSVC_20161003.tar\DOCSVC_20161003\Sect2\INPATIENT\REQ_20160302-000020\04112016  YUNG_YIKCHUNG_2OF4_041116 _2016-05-16-13.35.57.853.pdf
Request;20160302-000020;48535;PACE;Inpatient;PACE;C:\Users\FGuo\Documents\work doucment\attachment\attachmentDB\20161005\originalFileFromAerial\DOCSVC_20161003.tar\DOCSVC_20161003\Sect2\INPATIENT\REQ_20160302-000020\04112016  YUNG_YIKCHUNG_3OF4_041116 _2016-05-16-13.36.22.36.pdf
Request;20160302-000020;48535;PACE;Inpatient;PACE;C:\Users\FGuo\Documents\work doucment\attachment\attachmentDB\20161005\originalFileFromAerial\DOCSVC_20161003.tar\DOCSVC_20161003\Sect2\INPATIENT\REQ_20160302-000020\04112016  YUNG_YIKCHUNG_4OF4_041116 _2016-05-16-13.36.47.676.pdf
Request;20160302-000020;48535;PACE;Inpatient;PACE;C:\Users\FGuo\Documents\work doucment\attachment\attachmentDB\20161005\originalFileFromAerial\DOCSVC_20161003.tar\DOCSVC_20161003\Sect2\INPATIENT\REQ_20160302-000020\Yung Yikchung IP Denial Forest Hills Hospital  3-8-16_2016-03-08-11.43.42.821.pdf
Request;20160302-000020;48535;PACE;Inpatient;PACE;C:\Users\FGuo\Documents\work doucment\attachment\attachmentDB\20161005\originalFileFromAerial\DOCSVC_20161003.tar\DOCSVC_20161003\Sect2\INPATIENT\REQ_20160302-000020\Yung, Yikchung 48535 Clinical Review 10 15 Req Form - Copy (2)_2016-03-02-11.40.02.245.docx
Request;20160302-000020;48535;PACE;Inpatient;PACE;C:\Users\FGuo\Documents\work doucment\attachment\attachmentDB\20161005\originalFileFromAerial\DOCSVC_20161003.tar\DOCSVC_20161003\Sect2\INPATIENT\REQ_20160302-000020\YYung_2016-03-03-11.32.50.97.tif
Request;20160302-000026;99912;PACE;Inpatient;PACE;C:\Users\FGuo\Documents\work doucment\attachment\attachmentDB\20161005\originalFileFromAerial\DOCSVC_20161003.tar\DOCSVC_20161003\Sect2\INPATIENT\REQ_20160302-000026\Cho, Yuk Wun- Beth Israel MC Petrie -Clinical Review Request Form 3-2-16_2016-03-02-12.21.05.442.docx
Request;20160302-000033;38834;null;Inpatient;SELECT;C:\Users\FGuo\Documents\work doucment\attachment\attachmentDB\20161005\originalFileFromAerial\DOCSVC_20161003.tar\DOCSVC_20161003\Sect2\INPATIENT\REQ_20160302-000033\Drummer Gitta - Hamilton Park Nursing & Rehab Bed Hold  4-11-16_2016-04-11-16.05.23.94.pdf
Request;20160302-000033;38834;null;Inpatient;SELECT;C:\Users\FGuo\Documents\work doucment\attachment\attachmentDB\20161005\originalFileFromAerial\DOCSVC_20161003.tar\DOCSVC_20161003\Sect2\INPATIENT\REQ_20160302-000033\Drummer, Gitta -Hamilton Park Nursing & Rehab (Auth20160302-000033) 3.2.16_2016-03-02-13.18.25.700.pdf
Request;20160302-000034;49569;SELECT;Inpatient;SELECT;C:\Users\FGuo\Documents\work doucment\attachment\attachmentDB\20161005\originalFileFromAerial\DOCSVC_20161003.tar\DOCSVC_20161003\Sect2\INPATIENT\REQ_20160302-000034\Stewart, Loleta - BRONX LEBANON SPECIAL CARE CENTER 8.19.16_2016-08-19-11.25.57.64.pdf
Request;20160302-000034;49569;SELECT;Inpatient;SELECT;C:\Users\FGuo\Documents\work doucment\attachment\attachmentDB\20161005\originalFileFromAerial\DOCSVC_20161003.tar\DOCSVC_20161003\Sect2\INPATIENT\REQ_20160302-000034\Stewart, Loleta - BRONX LEBANON SPECIAL CARE CENTER 8.19.16_2016-08-19-11.31.41.631.pdf
Request;20160302-000034;49569;SELECT;Inpatient;SELECT;C:\Users\FGuo\Documents\work doucment\attachment\attachmentDB\20161005\originalFileFromAerial\DOCSVC_20161003.tar\DOCSVC_20161003\Sect2\INPATIENT\REQ_20160302-000034\Stewart, LOLETA_PRI_2016-03-02-12.36.48.61.tif
Request;20160302-000041;48553;PACE;Inpatient;PACE;C:\Users\FGuo\Documents\work doucment\attachment\attachmentDB\20161005\originalFileFromAerial\DOCSVC_20161003.tar\DOCSVC_20161003\Sect2\INPATIENT\REQ_20160302-000041\Petrosyan, Serho - HAYM SALOMON HOME FOR THE AGED LLC - 4.21.16_2016-04-21-12.27.55.783.pdf
Request;20160302-000041;48553;PACE;Inpatient;PACE;C:\Users\FGuo\Documents\work doucment\attachment\attachmentDB\20161005\originalFileFromAerial\DOCSVC_20161003.tar\DOCSVC_20161003\Sect2\INPATIENT\REQ_20160302-000041\Petrosyan, Serho_Notes-PRI_3-2-16_2016-03-02-13.31.23.52.pdf
Request;20160302-000042;23397;SELECT;Inpatient;SELECT;C:\Users\FGuo\Documents\work doucment\attachment\attachmentDB\20161005\originalFileFromAerial\DOCSVC_20161003.tar\DOCSVC_20161003\Sect2\INPATIENT\REQ_20160302-000042\RFAT23397_2016-03-02-16.49.44.187.TIF
Request;20160302-000044;70653;PACE;Inpatient;PACE;C:\Users\FGuo\Documents\work doucment\attachment\attachmentDB\20161005\originalFileFromAerial\DOCSVC_20161003.tar\DOCSVC_20161003\Sect2\INPATIENT\REQ_20160302-000044\Broughton Thomasina IP Denial Montefiore Medical Center 3-9-16_2016-03-09-11.43.12.172.pdf
Request;20160302-000044;70653;PACE;Inpatient;PACE;C:\Users\FGuo\Documents\work doucment\attachment\attachmentDB\20161005\originalFileFromAerial\DOCSVC_20161003.tar\DOCSVC_20161003\Sect2\INPATIENT\REQ_20160302-000044\Broughton, T 70653 CR 3-2-16_2016-03-03-14.59.19.603.tif
Request;20160302-000044;70653;PACE;Inpatient;PACE;C:\Users\FGuo\Documents\work doucment\attachment\attachmentDB\20161005\originalFileFromAerial\DOCSVC_20161003.tar\DOCSVC_20161003\Sect2\INPATIENT\REQ_20160302-000044\Broughton, Thomasina 70653 Clinical Review 10 15 Req Form - Copy (2)_2016-03-02-13.47.20.591.docx
Request;20160302-000044;70653;PACE;Inpatient;PACE;C:\Users\FGuo\Documents\work doucment\attachment\attachmentDB\20161005\originalFileFromAerial\DOCSVC_20161003.tar\DOCSVC_20161003\Sect2\INPATIENT\REQ_20160302-000044\BROUGHTON, THOMASIN_CLINICAL_2016-03-07-16.46.27.116.pdf
Request;20160302-000045;79530;PACE;Inpatient;PACE;C:\Users\FGuo\Documents\work doucment\attachment\attachmentDB\20161005\originalFileFromAerial\DOCSVC_20161003.tar\DOCSVC_20161003\Sect2\INPATIENT\REQ_20160302-000045\G_\Rafael Noboa-Lemonier\Nix, Sallie_clinical_3-2-16_2016-03-07-21.48.19.447.pdf
Request;20160302-000045;79530;PACE;Inpatient;PACE;C:\Users\FGuo\Documents\work doucment\attachment\attachmentDB\20161005\originalFileFromAerial\DOCSVC_20161003.tar\DOCSVC_20161003\Sect2\INPATIENT\REQ_20160302-000045\G_\Rafael Noboa-Lemonier\Nix, Sallie_clinical_3-4-16_2016-03-07-21.48.40.404.pdf
Request;20160302-000045;79530;PACE;Inpatient;PACE;C:\Users\FGuo\Documents\work doucment\attachment\attachmentDB\20161005\originalFileFromAerial\DOCSVC_20161003.tar\DOCSVC_20161003\Sect2\INPATIENT\REQ_20160302-000045\Nix Sallie - Brookdale Hospital Medical Center  3-2-16_2016-03-02-13.54.38.621.pdf
Request;20160302-000045;79530;PACE;Inpatient;PACE;C:\Users\FGuo\Documents\work doucment\attachment\attachmentDB\20161005\originalFileFromAerial\DOCSVC_20161003.tar\DOCSVC_20161003\Sect2\INPATIENT\REQ_20160302-000045\Nix, Sallie -  Brookdale University Hospital Lab 8.24.16_2016-08-24-10.08.45.529.pdf
Request;20160302-000046;23397;SELECT;Inpatient;SELECT;C:\Users\FGuo\Documents\work doucment\attachment\attachmentDB\20161005\originalFileFromAerial\DOCSVC_20161003.tar\DOCSVC_20161003\Sect2\INPATIENT\REQ_20160302-000046\Fattorusso, Rocco- Rutland Nursing Home  4.21.16_2016-04-21-12.35.00.73.pdf
Request;20160302-000046;23397;SELECT;Inpatient;SELECT;C:\Users\FGuo\Documents\work doucment\attachment\attachmentDB\20161005\originalFileFromAerial\DOCSVC_20161003.tar\DOCSVC_20161003\Sect2\INPATIENT\REQ_20160302-000046\Fattorusso, Rocco_notes-PRI_3-1-16_2016-03-02-14.01.00.747.pdf
Request;20160302-000051;99847;PACE;Inpatient;PACE;C:\Users\FGuo\Documents\work doucment\attachment\attachmentDB\20161005\originalFileFromAerial\DOCSVC_20161003.tar\DOCSVC_20161003\Sect2\INPATIENT\REQ_20160302-000051\julia rondon31416_2016-03-15-11.48.34.638.tif
Request;20160302-000051;99847;PACE;Inpatient;PACE;C:\Users\FGuo\Documents\work doucment\attachment\attachmentDB\20161005\originalFileFromAerial\DOCSVC_20161003.tar\DOCSVC_20161003\Sect2\INPATIENT\REQ_20160302-000051\julia rondon33116_2016-03-31-17.00.38.512.tif
Request;20160302-000051;99847;PACE;Inpatient;PACE;C:\Users\FGuo\Documents\work doucment\attachment\attachmentDB\20161005\originalFileFromAerial\DOCSVC_20161003.tar\DOCSVC_20161003\Sect2\INPATIENT\REQ_20160302-000051\julia rondon4416_2016-04-04-12.17.31.552.tif
Request;20160302-000051;99847;PACE;Inpatient;PACE;C:\Users\FGuo\Documents\work doucment\attachment\attachmentDB\20161005\originalFileFromAerial\DOCSVC_20161003.tar\DOCSVC_20161003\Sect2\INPATIENT\REQ_20160302-000051\Rondon, Julia - BETH ABRAHAM HEALTH SERVICES 8.19.16_2016-08-19-12.33.04.479.pdf
Request;20160302-000051;99847;PACE;Inpatient;PACE;C:\Users\FGuo\Documents\work doucment\attachment\attachmentDB\20161005\originalFileFromAerial\DOCSVC_20161003.tar\DOCSVC_20161003\Sect2\INPATIENT\REQ_20160302-000051\Rondon, Julia_PRI_2016-03-02-14.47.00.150.pdf
Request;20160302-000051;99847;PACE;Inpatient;PACE;C:\Users\FGuo\Documents\work doucment\attachment\attachmentDB\20161005\originalFileFromAerial\DOCSVC_20161003.tar\DOCSVC_20161003\Sect2\INPATIENT\REQ_20160302-000051\Rondon, Julia_PT NOTES_2016-03-25-11.04.57.66.tif
Request;20160302-000055;53009;SELECT;Inpatient;SELECT;C:\Users\FGuo\Documents\work doucment\attachment\attachmentDB\20161005\originalFileFromAerial\DOCSVC_20161003.tar\DOCSVC_20161003\Sect2\INPATIENT\REQ_20160302-000055\Fratto, Tommasina - Westchester Center for Rehabilitation and Nursing - 6.14.16_2016-06-14-10.53.14.833.pdf
Request;20160302-000055;53009;SELECT;Inpatient;SELECT;C:\Users\FGuo\Documents\work doucment\attachment\attachmentDB\20161005\originalFileFromAerial\DOCSVC_20161003.tar\DOCSVC_20161003\Sect2\INPATIENT\REQ_20160302-000055\Fratto, Tommasina_PRI_2016-03-03-09.26.26.164.tif
Request;20160302-000058;78367;PACE;Inpatient;PACE;C:\Users\FGuo\Documents\work doucment\attachment\attachmentDB\20161005\originalFileFromAerial\DOCSVC_20161003.tar\DOCSVC_20161003\Sect2\INPATIENT\REQ_20160302-000058\Roopa, H 78367 CR 2-29-16_2016-03-02-14.57.20.793.tif
Request;20160302-000058;78367;PACE;Inpatient;PACE;C:\Users\FGuo\Documents\work doucment\attachment\attachmentDB\20161005\originalFileFromAerial\DOCSVC_20161003.tar\DOCSVC_20161003\Sect2\INPATIENT\REQ_20160302-000058\Roopa, Hemraj - MONTEFIORE MEDICAL CENTER 8.22.16_2016-08-22-13.33.29.847.pdf
Request;20160302-000058;78367;PACE;Inpatient;PACE;C:\Users\FGuo\Documents\work doucment\attachment\attachmentDB\20161005\originalFileFromAerial\DOCSVC_20161003.tar\DOCSVC_20161003\Sect2\INPATIENT\REQ_20160302-000058\ROOPA, HEMRAJ_ CLINICAL_2016-03-04-11.54.59.469.tif
Request;20160302-000060;99847;PACE;Inpatient;PACE;C:\Users\FGuo\Documents\work doucment\attachment\attachmentDB\20161005\originalFileFromAerial\DOCSVC_20161003.tar\DOCSVC_20161003\Sect2\INPATIENT\REQ_20160302-000060\Rondon, J 99847 2-29-16_2016-03-02-15.05.36.269.tif
Request;20160302-000060;99847;PACE;Inpatient;PACE;C:\Users\FGuo\Documents\work doucment\attachment\attachmentDB\20161005\originalFileFromAerial\DOCSVC_20161003.tar\DOCSVC_20161003\Sect2\INPATIENT\REQ_20160302-000060\Rondon, Julia  - Montefiore Medical Center 8-16-16_2016-08-16-09.47.56.677.pdf
Request;20160302-000061;95543;DIRECT;Inpatient;DIRECT;C:\Users\FGuo\Documents\work doucment\attachment\attachmentDB\20161005\originalFileFromAerial\DOCSVC_20161003.tar\DOCSVC_20161003\Sect2\INPATIENT\REQ_20160302-000061\Chrusciel, W 95543 3-1-16_2016-03-02-15.10.00.712.tif
Request;20160302-000061;95543;DIRECT;Inpatient;DIRECT;C:\Users\FGuo\Documents\work doucment\attachment\attachmentDB\20161005\originalFileFromAerial\DOCSVC_20161003.tar\DOCSVC_20161003\Sect2\INPATIENT\REQ_20160302-000061\Chrusciel, Wendy - MONTEFIORE MEDICAL CENTER 8.22.16_2016-08-22-12.47.06.209.pdf
Request;20160302-000061;95543;DIRECT;Inpatient;DIRECT;C:\Users\FGuo\Documents\work doucment\attachment\attachmentDB\20161005\originalFileFromAerial\DOCSVC_20161003.tar\DOCSVC_20161003\Sect2\INPATIENT\REQ_20160302-000061\O_\95543 CHRUSCIEL, WENDY CLINICALS_2016-03-03-12.56.41.591.tif
Request;20160302-000063;96509;PACE;Inpatient;PACE;C:\Users\FGuo\Documents\work doucment\attachment\attachmentDB\20161005\originalFileFromAerial\DOCSVC_20161003.tar\DOCSVC_20161003\Sect2\INPATIENT\REQ_20160302-000063\O_\96509 QUINONES, REGINA CLINICALS_2016-03-03-12.53.11.222.tif
Request;20160302-000063;96509;PACE;Inpatient;PACE;C:\Users\FGuo\Documents\work doucment\attachment\attachmentDB\20161005\originalFileFromAerial\DOCSVC_20161003.tar\DOCSVC_20161003\Sect2\INPATIENT\REQ_20160302-000063\Quinones, R 96509 2-26-16_2016-03-02-15.16.04.46.tif
Request;20160302-000063;96509;PACE;Inpatient;PACE;C:\Users\FGuo\Documents\work doucment\attachment\attachmentDB\20161005\originalFileFromAerial\DOCSVC_20161003.tar\DOCSVC_20161003\Sect2\INPATIENT\REQ_20160302-000063\Quinones, Regina  - Montefiore Medical Center 8-19-16_2016-08-19-11.36.55.234.pdf
Request;20160302-000066;88294;SELECT;Inpatient;PACE;C:\Users\FGuo\Documents\work doucment\attachment\attachmentDB\20161005\originalFileFromAerial\DOCSVC_20161003.tar\DOCSVC_20161003\Sect2\INPATIENT\REQ_20160302-000066\G_\Rafael Noboa-Lemonier\Vaughn, Sharon_clinical_3-3-16_2016-03-07-21.56.29.892.pdf
Request;20160302-000066;88294;SELECT;Inpatient;PACE;C:\Users\FGuo\Documents\work doucment\attachment\attachmentDB\20161005\originalFileFromAerial\DOCSVC_20161003.tar\DOCSVC_20161003\Sect2\INPATIENT\REQ_20160302-000066\O_\88294 VAUGHN, SHARON UR REQ SHEET_2016-03-02-15.38.45.270.doc
Request;20160302-000066;88294;SELECT;Inpatient;PACE;C:\Users\FGuo\Documents\work doucment\attachment\attachmentDB\20161005\originalFileFromAerial\DOCSVC_20161003.tar\DOCSVC_20161003\Sect2\INPATIENT\REQ_20160302-000066\Vaughn, Sharon  - Brooklyn Hospital Center 8-18-18_2016-08-18-09.49.56.181.pdf
Request;20160302-000067;29819;PACE;Inpatient;PACE;C:\Users\FGuo\Documents\work doucment\attachment\attachmentDB\20161005\originalFileFromAerial\DOCSVC_20161003.tar\DOCSVC_20161003\Sect2\INPATIENT\REQ_20160302-000067\04112016 DOBI_TELAT_1OF3_041116_2016-05-19-11.56.36.424.pdf
Request;20160302-000067;29819;PACE;Inpatient;PACE;C:\Users\FGuo\Documents\work doucment\attachment\attachmentDB\20161005\originalFileFromAerial\DOCSVC_20161003.tar\DOCSVC_20161003\Sect2\INPATIENT\REQ_20160302-000067\04112016 DOBI_TELAT_2OF3_041116_2016-05-19-11.57.21.160.pdf
Request;20160302-000067;29819;PACE;Inpatient;PACE;C:\Users\FGuo\Documents\work doucment\attachment\attachmentDB\20161005\originalFileFromAerial\DOCSVC_20161003.tar\DOCSVC_20161003\Sect2\INPATIENT\REQ_20160302-000067\04112016 DOBI_TELAT_3OF3_041116_2016-05-19-11.57.37.477.pdf
Request;20160302-000067;29819;PACE;Inpatient;PACE;C:\Users\FGuo\Documents\work doucment\attachment\attachmentDB\20161005\originalFileFromAerial\DOCSVC_20161003.tar\DOCSVC_20161003\Sect2\INPATIENT\REQ_20160302-000067\Dobi Telat IP Denial Maimonides Medical Center 3-4-16_2016-03-04-11.29.13.701.pdf
Request;20160302-000067;29819;PACE;Inpatient;PACE;C:\Users\FGuo\Documents\work doucment\attachment\attachmentDB\20161005\originalFileFromAerial\DOCSVC_20161003.tar\DOCSVC_20161003\Sect2\INPATIENT\REQ_20160302-000067\DOBI, TELAT  MAIMONIDES_2016-03-02-15.56.17.684.doc
Request;20160302-000067;29819;PACE;Inpatient;PACE;C:\Users\FGuo\Documents\work doucment\attachment\attachmentDB\20161005\originalFileFromAerial\DOCSVC_20161003.tar\DOCSVC_20161003\Sect2\INPATIENT\REQ_20160302-000067\dobi, telat facesheet_2016-03-02-15.54.16.804.tif
Request;20160302-000067;29819;PACE;Inpatient;PACE;C:\Users\FGuo\Documents\work doucment\attachment\attachmentDB\20161005\originalFileFromAerial\DOCSVC_20161003.tar\DOCSVC_20161003\Sect2\INPATIENT\REQ_20160302-000067\Dobi, Telat_clinical_3-1-16_2016-03-03-14.38.38.480.pdf
Request;20160302-000067;29819;PACE;Inpatient;PACE;C:\Users\FGuo\Documents\work doucment\attachment\attachmentDB\20161005\originalFileFromAerial\DOCSVC_20161003.tar\DOCSVC_20161003\Sect2\INPATIENT\REQ_20160302-000067\Dobi,Telat_clinical-PRI_3-2-16_2016-03-03-15.18.12.292.pdf
Request;20160302-000080;61322;SELECT;Inpatient;SELECT;C:\Users\FGuo\Documents\work doucment\attachment\attachmentDB\20161005\originalFileFromAerial\DOCSVC_20161003.tar\DOCSVC_20161003\Sect2\INPATIENT\REQ_20160302-000080\RJ Webster, M 61322 2-29-16_2016-03-02-16.47.16.236.tif
Request;20160302-000080;61322;SELECT;Inpatient;SELECT;C:\Users\FGuo\Documents\work doucment\attachment\attachmentDB\20161005\originalFileFromAerial\DOCSVC_20161003.tar\DOCSVC_20161003\Sect2\INPATIENT\REQ_20160302-000080\Webster, Melvin - REGEIS CARE CENTER 8.19.16_2016-08-19-13.59.15.675.pdf
Request;20160302-000080;61322;SELECT;Inpatient;SELECT;C:\Users\FGuo\Documents\work doucment\attachment\attachmentDB\20161005\originalFileFromAerial\DOCSVC_20161003.tar\DOCSVC_20161003\Sect2\INPATIENT\REQ_20160302-000080\Webster, Melvin_2016-07-15-10.31.35.83.tif
Request;20160302-000080;61322;SELECT;Inpatient;SELECT;C:\Users\FGuo\Documents\work doucment\attachment\attachmentDB\20161005\originalFileFromAerial\DOCSVC_20161003.tar\DOCSVC_20161003\Sect2\INPATIENT\REQ_20160302-000080\web_2016-03-29-12.28.56.35.tif
Request;20160302-000081;54773;DIRECT;Inpatient;DIRECT;C:\Users\FGuo\Documents\work doucment\attachment\attachmentDB\20161005\originalFileFromAerial\DOCSVC_20161003.tar\DOCSVC_20161003\Sect2\INPATIENT\REQ_20160302-000081\francisco panigua 3416_2016-03-07-11.03.30.239.tif
Request;20160302-000081;54773;DIRECT;Inpatient;DIRECT;C:\Users\FGuo\Documents\work doucment\attachment\attachmentDB\20161005\originalFileFromAerial\DOCSVC_20161003.tar\DOCSVC_20161003\Sect2\INPATIENT\REQ_20160302-000081\Paniagua, francisco -54773- clinical review_2016-03-02-16.53.14.283.docx
Request;20160302-000081;54773;DIRECT;Inpatient;DIRECT;C:\Users\FGuo\Documents\work doucment\attachment\attachmentDB\20161005\originalFileFromAerial\DOCSVC_20161003.tar\DOCSVC_20161003\Sect2\INPATIENT\REQ_20160302-000081\Paniagua, Francisco 54773 hosp notification BA-FAX1_1603012331209114_2016-03-02-16.45.27.613.TIF
Request;20160303-000003;77670;PACE;Inpatient;PACE;C:\Users\FGuo\Documents\work doucment\attachment\attachmentDB\20161005\originalFileFromAerial\DOCSVC_20161003.tar\DOCSVC_20161003\Sect2\INPATIENT\REQ_20160303-000003\Mcclellan, W 77670 CR 3-2-16_2016-03-03-15.01.57.225.tif
Request;20160303-000003;77670;PACE;Inpatient;PACE;C:\Users\FGuo\Documents\work doucment\attachment\attachmentDB\20161005\originalFileFromAerial\DOCSVC_20161003.tar\DOCSVC_20161003\Sect2\INPATIENT\REQ_20160303-000003\MCCLELLAN, WILHELMENIA CLINICAL REVIEW REQUEST FORM_2016-03-03-09.46.29.67.doc
Request;20160303-000003;77670;PACE;Inpatient;PACE;C:\Users\FGuo\Documents\work doucment\attachment\attachmentDB\20161005\originalFileFromAerial\DOCSVC_20161003.tar\DOCSVC_20161003\Sect2\INPATIENT\REQ_20160303-000003\MX-3140N_20160311_115552_2016-03-11-12.36.15.582.pdf
Request;20160303-000004;40377;SELECT;Inpatient;SELECT;C:\Users\FGuo\Documents\work doucment\attachment\attachmentDB\20161005\originalFileFromAerial\DOCSVC_20161003.tar\DOCSVC_20161003\Sect2\INPATIENT\REQ_20160303-000004\carmen morel abreu3316_2016-03-03-09.50.01.718.tif
Request;20160303-000004;40377;SELECT;Inpatient;SELECT;C:\Users\FGuo\Documents\work doucment\attachment\attachmentDB\20161005\originalFileFromAerial\DOCSVC_20161003.tar\DOCSVC_20161003\Sect2\INPATIENT\REQ_20160303-000004\Morel Abreu, Carmen - OUR LADY OF CONSOLATION 8.19.16_2016-08-19-14.40.04.937.pdf
Request;20160303-000008;72216;PACE;Inpatient;PACE;C:\Users\FGuo\Documents\work doucment\attachment\attachmentDB\20161005\originalFileFromAerial\DOCSVC_20161003.tar\DOCSVC_20161003\Sect2\INPATIENT\REQ_20160303-000008\Lee, Ok  - WHITE PLAINS HOSPITAL 8-17-16_2016-08-17-09.27.25.865.pdf
Request;20160303-000008;72216;PACE;Inpatient;PACE;C:\Users\FGuo\Documents\work doucment\attachment\attachmentDB\20161005\originalFileFromAerial\DOCSVC_20161003.tar\DOCSVC_20161003\Sect2\INPATIENT\REQ_20160303-000008\Lee, Ok 72216 Clinical Review 10 15 Req Form - Copy (2)_2016-03-03-10.35.27.286.docx
Request;20160303-000008;72216;PACE;Inpatient;PACE;C:\Users\FGuo\Documents\work doucment\attachment\attachmentDB\20161005\originalFileFromAerial\DOCSVC_20161003.tar\DOCSVC_20161003\Sect2\INPATIENT\REQ_20160303-000008\LEE, OK_3-7-1116_2016-03-07-16.55.53.590.pdf
Request;20160303-000010;57718;PACE;Inpatient;PACE;C:\Users\FGuo\Documents\work doucment\attachment\attachmentDB\20161005\originalFileFromAerial\DOCSVC_20161003.tar\DOCSVC_20161003\Sect2\INPATIENT\REQ_20160303-000010\Grant Vanda  IP Denial Tufts Medical Center  3-16-16_2016-03-16-16.03.11.864.pdf
Request;20160303-000010;57718;PACE;Inpatient;PACE;C:\Users\FGuo\Documents\work doucment\attachment\attachmentDB\20161005\originalFileFromAerial\DOCSVC_20161003.tar\DOCSVC_20161003\Sect2\INPATIENT\REQ_20160303-000010\GRANT, VANDA - CLINICAL_2016-03-17-11.29.38.333.pdf
Request;20160303-000010;57718;PACE;Inpatient;PACE;C:\Users\FGuo\Documents\work doucment\attachment\attachmentDB\20161005\originalFileFromAerial\DOCSVC_20161003.tar\DOCSVC_20161003\Sect2\INPATIENT\REQ_20160303-000010\Grant, Vanda M  3-4-16_2016-03-04-09.51.45.123.tif
Request;20160303-000010;57718;PACE;Inpatient;PACE;C:\Users\FGuo\Documents\work doucment\attachment\attachmentDB\20161005\originalFileFromAerial\DOCSVC_20161003.tar\DOCSVC_20161003\Sect2\INPATIENT\REQ_20160303-000010\VGrant_2016-03-15-13.17.31.746.tif
Request;20160303-000011;73372;PACE;Inpatient;PACE;C:\Users\FGuo\Documents\work doucment\attachment\attachmentDB\20161005\originalFileFromAerial\DOCSVC_20161003.tar\DOCSVC_20161003\Sect2\INPATIENT\REQ_20160303-000011\Gomez, Francisca   MAIMONIDES_2016-03-03-10.31.54.149.doc
Request;20160303-000011;73372;PACE;Inpatient;PACE;C:\Users\FGuo\Documents\work doucment\attachment\attachmentDB\20161005\originalFileFromAerial\DOCSVC_20161003.tar\DOCSVC_20161003\Sect2\INPATIENT\REQ_20160303-000011\Gomez, Francisca  - Maimonides Medical Center 8-18-16_2016-08-18-15.53.00.905.pdf
Request;20160303-000011;73372;PACE;Inpatient;PACE;C:\Users\FGuo\Documents\work doucment\attachment\attachmentDB\20161005\originalFileFromAerial\DOCSVC_20161003.tar\DOCSVC_20161003\Sect2\INPATIENT\REQ_20160303-000011\Gomez, Francisca  facesheet_2016-03-03-10.27.53.426.tif
Request;20160303-000011;73372;PACE;Inpatient;PACE;C:\Users\FGuo\Documents\work doucment\attachment\attachmentDB\20161005\originalFileFromAerial\DOCSVC_20161003.tar\DOCSVC_20161003\Sect2\INPATIENT\REQ_20160303-000011\G_\Rafael Noboa-Lemonier\Gomez, Francisca_clinical_3-3-16_2016-03-07-21.43.06.358.pdf
Request;20160303-000012;60489;SELECT;Inpatient;SELECT;C:\Users\FGuo\Documents\work doucment\attachment\attachmentDB\20161005\originalFileFromAerial\DOCSVC_20161003.tar\DOCSVC_20161003\Sect2\INPATIENT\REQ_20160303-000012\gilliam, jerome  3-4-16_2016-03-04-11.53.07.478.pdf
Request;20160303-000012;60489;SELECT;Inpatient;SELECT;C:\Users\FGuo\Documents\work doucment\attachment\attachmentDB\20161005\originalFileFromAerial\DOCSVC_20161003.tar\DOCSVC_20161003\Sect2\INPATIENT\REQ_20160303-000012\Gilliam, Jerome - OXFORD NURSING HOME, INC - 4.26.16_2016-04-26-12.26.21.841.pdf
Request;20160303-000012;60489;SELECT;Inpatient;SELECT;C:\Users\FGuo\Documents\work doucment\attachment\attachmentDB\20161005\originalFileFromAerial\DOCSVC_20161003.tar\DOCSVC_20161003\Sect2\INPATIENT\REQ_20160303-000012\J Gilliam  60489_2016-03-31-16.29.16.358.tif
Request;20160303-000014;61232;SELECT;Inpatient;SELECT;C:\Users\FGuo\Documents\work doucment\attachment\attachmentDB\20161005\originalFileFromAerial\DOCSVC_20161003.tar\DOCSVC_20161003\Sect2\INPATIENT\REQ_20160303-000014\antonnucii frances 3216_2016-03-03-10.45.20.48.tif
Request;20160303-000014;61232;SELECT;Inpatient;SELECT;C:\Users\FGuo\Documents\work doucment\attachment\attachmentDB\20161005\originalFileFromAerial\DOCSVC_20161003.tar\DOCSVC_20161003\Sect2\INPATIENT\REQ_20160303-000014\Antonucci, Frances - EAST NECK NURSING & REHABILITATION CENTER 8.19.16_2016-08-19-15.24.15.885.pdf
Request;20160303-000017;61229;SELECT;Inpatient;SELECT;C:\Users\FGuo\Documents\work doucment\attachment\attachmentDB\20161005\originalFileFromAerial\DOCSVC_20161003.tar\DOCSVC_20161003\Sect2\INPATIENT\REQ_20160303-000017\broderick therea3216_2016-03-03-10.50.47.469.tif
Request;20160303-000017;61229;SELECT;Inpatient;SELECT;C:\Users\FGuo\Documents\work doucment\attachment\attachmentDB\20161005\originalFileFromAerial\DOCSVC_20161003.tar\DOCSVC_20161003\Sect2\INPATIENT\REQ_20160303-000017\Broderick, Theresa - East Neck Nursing & Rehabilitation Center - 9.26.16_2016-09-26-10.43.18.570.pdf
Request;20160303-000018;61226;SELECT;Inpatient;SELECT;C:\Users\FGuo\Documents\work doucment\attachment\attachmentDB\20161005\originalFileFromAerial\DOCSVC_20161003.tar\DOCSVC_20161003\Sect2\INPATIENT\REQ_20160303-000018\davidson marvin3216_2016-03-03-10.55.27.130.tif
Request;20160303-000018;61226;SELECT;Inpatient;SELECT;C:\Users\FGuo\Documents\work doucment\attachment\attachmentDB\20161005\originalFileFromAerial\DOCSVC_20161003.tar\DOCSVC_20161003\Sect2\INPATIENT\REQ_20160303-000018\Davidson, Marvin - EAST NECK NURSING & REHABILITATION CENTER 8.19.16_2016-08-19-15.39.53.664.pdf
Request;20160303-000019;60348;null;Inpatient;PACE;C:\Users\FGuo\Documents\work doucment\attachment\attachmentDB\20161005\originalFileFromAerial\DOCSVC_20161003.tar\DOCSVC_20161003\Sect2\INPATIENT\REQ_20160303-000019\Lopez, G 60348 3-9-16_2016-03-10-11.16.00.866.tif
Request;20160303-000019;60348;null;Inpatient;PACE;C:\Users\FGuo\Documents\work doucment\attachment\attachmentDB\20161005\originalFileFromAerial\DOCSVC_20161003.tar\DOCSVC_20161003\Sect2\INPATIENT\REQ_20160303-000019\Lopez, Gloria 60348 Clinical Review 10 15 Req Form - Copy (2)_2016-03-03-11.24.43.556.docx
Request;20160303-000020;29895;PACE;Inpatient;Not Valued;C:\Users\FGuo\Documents\work doucment\attachment\attachmentDB\20161005\originalFileFromAerial\DOCSVC_20161003.tar\DOCSVC_20161003\Sect2\INPATIENT\REQ_20160303-000020\G_\Rafael Noboa-Lemonier\Lopez, Adela, clinical_3-3-16_2016-03-07-22.02.18.953.pdf
Request;20160303-000020;29895;PACE;Inpatient;Not Valued;C:\Users\FGuo\Documents\work doucment\attachment\attachmentDB\20161005\originalFileFromAerial\DOCSVC_20161003.tar\DOCSVC_20161003\Sect2\INPATIENT\REQ_20160303-000020\Lopez, Adela - MAIMONIDES MEDICAL CENTER 8.23.16_2016-08-23-13.19.05.263.pdf
Request;20160303-000020;29895;PACE;Inpatient;Not Valued;C:\Users\FGuo\Documents\work doucment\attachment\attachmentDB\20161005\originalFileFromAerial\DOCSVC_20161003.tar\DOCSVC_20161003\Sect2\INPATIENT\REQ_20160303-000020\Lopez, Adela_2016-03-03-11.40.59.839.tif
Request;20160303-000020;29895;PACE;Inpatient;Not Valued;C:\Users\FGuo\Documents\work doucment\attachment\attachmentDB\20161005\originalFileFromAerial\DOCSVC_20161003.tar\DOCSVC_20161003\Sect2\INPATIENT\REQ_20160303-000020\Lopez, Adela_2016-03-03-11.54.53.560.pdf
Request;20160303-000021;22425;PACE;Inpatient;PACE;C:\Users\FGuo\Documents\work doucment\attachment\attachmentDB\20161005\originalFileFromAerial\DOCSVC_20161003.tar\DOCSVC_20161003\Sect2\INPATIENT\REQ_20160303-000021\Chan, Tai Luck - Crown Nursing Home Associates  4.22.16_2016-04-22-12.36.52.523.pdf
Request;20160303-000021;22425;PACE;Inpatient;PACE;C:\Users\FGuo\Documents\work doucment\attachment\attachmentDB\20161005\originalFileFromAerial\DOCSVC_20161003.tar\DOCSVC_20161003\Sect2\INPATIENT\REQ_20160303-000021\Chan, Tai Luck_Notes-PRI_3-1-16_2016-03-03-11.47.01.541.pdf
Request;20160303-000023;29027;PACE;Inpatient;PACE;C:\Users\FGuo\Documents\work doucment\attachment\attachmentDB\20161005\originalFileFromAerial\DOCSVC_20161003.tar\DOCSVC_20161003\Sect2\INPATIENT\REQ_20160303-000023\Gupta, Lajwanti - PARKER JEWISH INSTITUTE FOR HEALTH CARE AND REHAB - 4.25.16_2016-04-25-13.02.00.770.pdf
Request;20160303-000023;29027;PACE;Inpatient;PACE;C:\Users\FGuo\Documents\work doucment\attachment\attachmentDB\20161005\originalFileFromAerial\DOCSVC_20161003.tar\DOCSVC_20161003\Sect2\INPATIENT\REQ_20160303-000023\LGupta_2016-03-03-12.07.43.681.tif
Request;20160303-000028;56731;SELECT;Inpatient;SELECT;C:\Users\FGuo\Documents\work doucment\attachment\attachmentDB\20161005\originalFileFromAerial\DOCSVC_20161003.tar\DOCSVC_20161003\Sect2\INPATIENT\REQ_20160303-000028\david walker_2016-03-03-12.33.49.963.tif
Request;20160303-000028;56731;SELECT;Inpatient;SELECT;C:\Users\FGuo\Documents\work doucment\attachment\attachmentDB\20161005\originalFileFromAerial\DOCSVC_20161003.tar\DOCSVC_20161003\Sect2\INPATIENT\REQ_20160303-000028\PRI David walker_2016-03-03-12.33.15.669.tif
Request;20160303-000028;56731;SELECT;Inpatient;SELECT;C:\Users\FGuo\Documents\work doucment\attachment\attachmentDB\20161005\originalFileFromAerial\DOCSVC_20161003.tar\DOCSVC_20161003\Sect2\INPATIENT\REQ_20160303-000028\Walker, David-Hebrew Home for the Aged 3.4.16_2016-03-04-11.17.08.491.pdf
Request;20160303-000029;49208;PACE;Inpatient;PACE;C:\Users\FGuo\Documents\work doucment\attachment\attachmentDB\20161005\originalFileFromAerial\DOCSVC_20161003.tar\DOCSVC_20161003\Sect2\INPATIENT\REQ_20160303-000029\MONTEFIORE MEDICAL CENTER 8-15-16_2016-08-15-14.22.20.134.pdf
Request;20160303-000029;49208;PACE;Inpatient;PACE;C:\Users\FGuo\Documents\work doucment\attachment\attachmentDB\20161005\originalFileFromAerial\DOCSVC_20161003.tar\DOCSVC_20161003\Sect2\INPATIENT\REQ_20160303-000029\Rodriguez, Gloria I 49208 Clinical Review 10 15 Req Form - Copy (2)_2016-03-03-12.40.43.583.docx
Request;20160303-000029;49208;PACE;Inpatient;PACE;C:\Users\FGuo\Documents\work doucment\attachment\attachmentDB\20161005\originalFileFromAerial\DOCSVC_20161003.tar\DOCSVC_20161003\Sect2\INPATIENT\REQ_20160303-000029\RODRIGUEZ, GLORIA_3-7-2016_2016-03-07-16.54.19.670.pdf
Request;20160303-000032;45655;SELECT;Inpatient;SELECT;C:\Users\FGuo\Documents\work doucment\attachment\attachmentDB\20161005\originalFileFromAerial\DOCSVC_20161003.tar\DOCSVC_20161003\Sect2\INPATIENT\REQ_20160303-000032\O_\discharge planning Tsidilkovskiy Issak 03.03.2016_2016-03-03-13.13.31.377.TIF
Request;20160303-000032;45655;SELECT;Inpatient;SELECT;C:\Users\FGuo\Documents\work doucment\attachment\attachmentDB\20161005\originalFileFromAerial\DOCSVC_20161003.tar\DOCSVC_20161003\Sect2\INPATIENT\REQ_20160303-000032\_2016-03-03-13.11.27.135
Request;20160303-000034;59397;DIRECT;Inpatient;DIRECT;C:\Users\FGuo\Documents\work doucment\attachment\attachmentDB\20161005\originalFileFromAerial\DOCSVC_20161003.tar\DOCSVC_20161003\Sect2\INPATIENT\REQ_20160303-000034\Corbin, C 59397 CR 3-2-16_2016-03-04-14.09.07.944.tif
Request;20160303-000034;59397;DIRECT;Inpatient;DIRECT;C:\Users\FGuo\Documents\work doucment\attachment\attachmentDB\20161005\originalFileFromAerial\DOCSVC_20161003.tar\DOCSVC_20161003\Sect2\INPATIENT\REQ_20160303-000034\O_\59397 CORBIN, CUMMINS APPROVAL LTR_2016-03-17-11.14.29.561.docx
Request;20160303-000034;59397;DIRECT;Inpatient;DIRECT;C:\Users\FGuo\Documents\work doucment\attachment\attachmentDB\20161005\originalFileFromAerial\DOCSVC_20161003.tar\DOCSVC_20161003\Sect2\INPATIENT\REQ_20160303-000034\O_\59397 CORBIN, CUMMINS CLINICALS 2.25.16_2016-03-11-09.29.27.864.tif
Request;20160303-000034;59397;DIRECT;Inpatient;DIRECT;C:\Users\FGuo\Documents\work doucment\attachment\attachmentDB\20161005\originalFileFromAerial\DOCSVC_20161003.tar\DOCSVC_20161003\Sect2\INPATIENT\REQ_20160303-000034\O_\59397 CORBIN, CUMMINS UR REQ SHEET_2016-03-03-13.11.40.945.doc
Request;20160303-000035;61055;PACE;Inpatient;PACE;C:\Users\FGuo\Documents\work doucment\attachment\attachmentDB\20161005\originalFileFromAerial\DOCSVC_20161003.tar\DOCSVC_20161003\Sect2\INPATIENT\REQ_20160303-000035\mona thomas 3716_2016-03-07-12.09.34.764.tif
Request;20160303-000035;61055;PACE;Inpatient;PACE;C:\Users\FGuo\Documents\work doucment\attachment\attachmentDB\20161005\originalFileFromAerial\DOCSVC_20161003.tar\DOCSVC_20161003\Sect2\INPATIENT\REQ_20160303-000035\mona Thomas31116_2016-03-11-14.27.39.361.tif
Request;20160303-000035;61055;PACE;Inpatient;PACE;C:\Users\FGuo\Documents\work doucment\attachment\attachmentDB\20161005\originalFileFromAerial\DOCSVC_20161003.tar\DOCSVC_20161003\Sect2\INPATIENT\REQ_20160303-000035\mona thomas32316a_2016-03-23-19.32.31.72.tif
Request;20160303-000035;61055;PACE;Inpatient;PACE;C:\Users\FGuo\Documents\work doucment\attachment\attachmentDB\20161005\originalFileFromAerial\DOCSVC_20161003.tar\DOCSVC_20161003\Sect2\INPATIENT\REQ_20160303-000035\mona thomas32316_2016-03-23-11.13.37.937.tif
Request;20160303-000035;61055;PACE;Inpatient;PACE;C:\Users\FGuo\Documents\work doucment\attachment\attachmentDB\20161005\originalFileFromAerial\DOCSVC_20161003.tar\DOCSVC_20161003\Sect2\INPATIENT\REQ_20160303-000035\mona thomas32816_2016-03-28-16.17.32.332.tif
Request;20160303-000035;61055;PACE;Inpatient;PACE;C:\Users\FGuo\Documents\work doucment\attachment\attachmentDB\20161005\originalFileFromAerial\DOCSVC_20161003.tar\DOCSVC_20161003\Sect2\INPATIENT\REQ_20160303-000035\Thomas, Mona O - Crown Nursing Home Associates  4.25.16_2016-04-25-11.57.46.597.pdf
Request;20160303-000035;61055;PACE;Inpatient;PACE;C:\Users\FGuo\Documents\work doucment\attachment\attachmentDB\20161005\originalFileFromAerial\DOCSVC_20161003.tar\DOCSVC_20161003\Sect2\INPATIENT\REQ_20160303-000035\Thomas, Mona_Clinical_3-3-16_2016-03-03-13.28.33.773.pdf
Request;20160303-000035;61055;PACE;Inpatient;PACE;C:\Users\FGuo\Documents\work doucment\attachment\attachmentDB\20161005\originalFileFromAerial\DOCSVC_20161003.tar\DOCSVC_20161003\Sect2\INPATIENT\REQ_20160303-000035\Thomas, Mona_notes-PRI_3-3-16_2016-03-03-13.28.15.550.pdf
Request;20160303-000036;20834;PACE;Inpatient;PACE;C:\Users\FGuo\Documents\work doucment\attachment\attachmentDB\20161005\originalFileFromAerial\DOCSVC_20161003.tar\DOCSVC_20161003\Sect2\INPATIENT\REQ_20160303-000036\G_\Rafael Noboa-Lemonier\Tatom, Ruth_clinical_3-3-16_2016-03-07-21.17.43.492.pdf
Request;20160303-000036;20834;PACE;Inpatient;PACE;C:\Users\FGuo\Documents\work doucment\attachment\attachmentDB\20161005\originalFileFromAerial\DOCSVC_20161003.tar\DOCSVC_20161003\Sect2\INPATIENT\REQ_20160303-000036\Tatom, Ruth  - Brookdale Hospital Medical Center 8-17-16_2016-08-17-10.05.05.524.pdf
Request;20160303-000036;20834;PACE;Inpatient;PACE;C:\Users\FGuo\Documents\work doucment\attachment\attachmentDB\20161005\originalFileFromAerial\DOCSVC_20161003.tar\DOCSVC_20161003\Sect2\INPATIENT\REQ_20160303-000036\Tatom, Ruth 20834  Clinical Review 10 15 Req Form - Copy (2)_2016-03-03-13.37.52.733.docx
Request;20160303-000039;52987;PACE;Inpatient;PACE;C:\Users\FGuo\Documents\work doucment\attachment\attachmentDB\20161005\originalFileFromAerial\DOCSVC_20161003.tar\DOCSVC_20161003\Sect2\INPATIENT\REQ_20160303-000039\Hall Billy - Kingsbrook Jewisgh Medical Center  3-3-16_2016-03-03-14.23.06.321.pdf
Request;20160303-000039;52987;PACE;Inpatient;PACE;C:\Users\FGuo\Documents\work doucment\attachment\attachmentDB\20161005\originalFileFromAerial\DOCSVC_20161003.tar\DOCSVC_20161003\Sect2\INPATIENT\REQ_20160303-000039\Hall, Billy J - Kingsbrook Jewish Medical Center 8-18-16_2016-08-18-15.37.06.288.pdf
Request;20160303-000039;52987;PACE;Inpatient;PACE;C:\Users\FGuo\Documents\work doucment\attachment\attachmentDB\20161005\originalFileFromAerial\DOCSVC_20161003.tar\DOCSVC_20161003\Sect2\INPATIENT\REQ_20160303-000039\Hall, Billy_clinical_3-3-16_2016-03-08-09.52.37.461.pdf
Request;20160303-000039;52987;PACE;Inpatient;PACE;C:\Users\FGuo\Documents\work doucment\attachment\attachmentDB\20161005\originalFileFromAerial\DOCSVC_20161003.tar\DOCSVC_20161003\Sect2\INPATIENT\REQ_20160303-000039\Hall, Billy_neuro-psych notes-3-8-16_2016-03-09-09.37.43.664.pdf
Request;20160303-000039;52987;PACE;Inpatient;PACE;C:\Users\FGuo\Documents\work doucment\attachment\attachmentDB\20161005\originalFileFromAerial\DOCSVC_20161003.tar\DOCSVC_20161003\Sect2\INPATIENT\REQ_20160303-000039\Hall, Billy_Rehab consult-PT eval_3--8-16_2016-03-09-09.37.01.624.pdf
Request;20160303-000042;29985;PACE;Inpatient;PACE;C:\Users\FGuo\Documents\work doucment\attachment\attachmentDB\20161005\originalFileFromAerial\DOCSVC_20161003.tar\DOCSVC_20161003\Sect2\INPATIENT\REQ_20160303-000042\david skyes 32516_2016-03-25-12.41.43.113.tif
Request;20160303-000042;29985;PACE;Inpatient;PACE;C:\Users\FGuo\Documents\work doucment\attachment\attachmentDB\20161005\originalFileFromAerial\DOCSVC_20161003.tar\DOCSVC_20161003\Sect2\INPATIENT\REQ_20160303-000042\david skyes4816_2016-04-08-13.05.02.967.tif
Request;20160303-000042;29985;PACE;Inpatient;PACE;C:\Users\FGuo\Documents\work doucment\attachment\attachmentDB\20161005\originalFileFromAerial\DOCSVC_20161003.tar\DOCSVC_20161003\Sect2\INPATIENT\REQ_20160303-000042\david sykes 41516_2016-04-15-15.25.05.906.tif
Request;20160303-000042;29985;PACE;Inpatient;PACE;C:\Users\FGuo\Documents\work doucment\attachment\attachmentDB\20161005\originalFileFromAerial\DOCSVC_20161003.tar\DOCSVC_20161003\Sect2\INPATIENT\REQ_20160303-000042\david sykes31416_2016-03-14-10.46.53.563.tif
Request;20160303-000042;29985;PACE;Inpatient;PACE;C:\Users\FGuo\Documents\work doucment\attachment\attachmentDB\20161005\originalFileFromAerial\DOCSVC_20161003.tar\DOCSVC_20161003\Sect2\INPATIENT\REQ_20160303-000042\david sykes3716_2016-03-07-12.02.03.785.tif
Request;20160303-000042;29985;PACE;Inpatient;PACE;C:\Users\FGuo\Documents\work doucment\attachment\attachmentDB\20161005\originalFileFromAerial\DOCSVC_20161003.tar\DOCSVC_20161003\Sect2\INPATIENT\REQ_20160303-000042\david sykes4116_2016-04-01-10.58.41.756.tif
Request;20160303-000042;29985;PACE;Inpatient;PACE;C:\Users\FGuo\Documents\work doucment\attachment\attachmentDB\20161005\originalFileFromAerial\DOCSVC_20161003.tar\DOCSVC_20161003\Sect2\INPATIENT\REQ_20160303-000042\David, Sykes_2016-03-03-14.46.00.117.pdf
Request;20160303-000042;29985;PACE;Inpatient;PACE;C:\Users\FGuo\Documents\work doucment\attachment\attachmentDB\20161005\originalFileFromAerial\DOCSVC_20161003.tar\DOCSVC_20161003\Sect2\INPATIENT\REQ_20160303-000042\Sykes, David - WORKMEN'S CIRCLE HOME 8.19.16_2016-08-19-16.25.45.585.pdf
Request;20160303-000044;56767;PACE;Inpatient;PACE;C:\Users\FGuo\Documents\work doucment\attachment\attachmentDB\20161005\originalFileFromAerial\DOCSVC_20161003.tar\DOCSVC_20161003\Sect2\INPATIENT\REQ_20160303-000044\Castelo Ideltina -Florida Hospital Flagler 3-4-16_2016-03-04-10.34.35.326.pdf
Request;20160303-000044;56767;PACE;Inpatient;PACE;C:\Users\FGuo\Documents\work doucment\attachment\attachmentDB\20161005\originalFileFromAerial\DOCSVC_20161003.tar\DOCSVC_20161003\Sect2\INPATIENT\REQ_20160303-000044\castelo ideltina pt 3316_2016-03-03-15.06.08.898.tif
Request;20160303-000045;77670;PACE;Inpatient;PACE;C:\Users\FGuo\Documents\work doucment\attachment\attachmentDB\20161005\originalFileFromAerial\DOCSVC_20161003.tar\DOCSVC_20161003\Sect2\INPATIENT\REQ_20160303-000045\mcclean whilemina31516_2016-03-15-16.38.14.173.tif
Request;20160303-000045;77670;PACE;Inpatient;PACE;C:\Users\FGuo\Documents\work doucment\attachment\attachmentDB\20161005\originalFileFromAerial\DOCSVC_20161003.tar\DOCSVC_20161003\Sect2\INPATIENT\REQ_20160303-000045\mcclellan wilhelmenia 31016_2016-03-10-14.59.34.460.tif
Request;20160303-000045;77670;PACE;Inpatient;PACE;C:\Users\FGuo\Documents\work doucment\attachment\attachmentDB\20161005\originalFileFromAerial\DOCSVC_20161003.tar\DOCSVC_20161003\Sect2\INPATIENT\REQ_20160303-000045\Mcclellan, Wilhelmenia - BETH ABRAHAM HEALTH SERVICES 8.19.16_2016-08-19-16.48.02.616.pdf
Request;20160303-000045;77670;PACE;Inpatient;PACE;C:\Users\FGuo\Documents\work doucment\attachment\attachmentDB\20161005\originalFileFromAerial\DOCSVC_20161003.tar\DOCSVC_20161003\Sect2\INPATIENT\REQ_20160303-000045\WILHELMANIA MCELLAN PRI PART 1_2016-03-03-15.00.55.970.pdf
Request;20160303-000045;77670;PACE;Inpatient;PACE;C:\Users\FGuo\Documents\work doucment\attachment\attachmentDB\20161005\originalFileFromAerial\DOCSVC_20161003.tar\DOCSVC_20161003\Sect2\INPATIENT\REQ_20160303-000045\WILHELMANIA MCELLAN PRI PART 2 pdf_2016-03-03-15.01.19.687.pdf
Request;20160303-000045;77670;PACE;Inpatient;PACE;C:\Users\FGuo\Documents\work doucment\attachment\attachmentDB\20161005\originalFileFromAerial\DOCSVC_20161003.tar\DOCSVC_20161003\Sect2\INPATIENT\REQ_20160303-000045\WILHELMANIA MCELLAN Progress notes_3-22-16_2016-03-22-10.36.33.193.tif
Request;20160303-000054;49342;null;Inpatient;PACE;C:\Users\FGuo\Documents\work doucment\attachment\attachmentDB\20161005\originalFileFromAerial\DOCSVC_20161003.tar\DOCSVC_20161003\Sect2\INPATIENT\REQ_20160303-000054\Anderson Lorraine -St John's Riverside Hospital 3-8-16_2016-03-08-10.40.07.363.pdf
Request;20160303-000056;26166;PACE;Inpatient;PACE;C:\Users\FGuo\Documents\work doucment\attachment\attachmentDB\20161005\originalFileFromAerial\DOCSVC_20161003.tar\DOCSVC_20161003\Sect2\INPATIENT\REQ_20160303-000056\Akber Shahnaz -  Flushing Hospital Medical Center 3-10-16_2016-03-10-15.15.55.741.pdf
Request;20160303-000056;26166;PACE;Inpatient;PACE;C:\Users\FGuo\Documents\work doucment\attachment\attachmentDB\20161005\originalFileFromAerial\DOCSVC_20161003.tar\DOCSVC_20161003\Sect2\INPATIENT\REQ_20160303-000056\SAkber_2016-03-04-10.30.03.436.tif
Request;20160303-000060;39510;PACE;Inpatient;PACE;C:\Users\FGuo\Documents\work doucment\attachment\attachmentDB\20161005\originalFileFromAerial\DOCSVC_20161003.tar\DOCSVC_20161003\Sect2\INPATIENT\REQ_20160303-000060\Wawa, Jean - CLIFFSIDE REHABILITATION AND RESIDENTIAL 8.22.16_2016-08-22-09.29.04.148.pdf
Request;20160303-000060;39510;PACE;Inpatient;PACE;C:\Users\FGuo\Documents\work doucment\attachment\attachmentDB\20161005\originalFileFromAerial\DOCSVC_20161003.tar\DOCSVC_20161003\Sect2\INPATIENT\REQ_20160303-000060\Wawa, Jean_SNF notes_5-25-16_2016-05-27-10.06.55.230.pdf
Request;20160303-000061;54438;PACE;Inpatient;PACE;C:\Users\FGuo\Documents\work doucment\attachment\attachmentDB\20161005\originalFileFromAerial\DOCSVC_20161003.tar\DOCSVC_20161003\Sect2\INPATIENT\REQ_20160303-000061\Alexander, Vivian  - Montefiore Medical Center 8-16-16_2016-08-16-11.33.52.861.pdf
Request;20160303-000061;54438;PACE;Inpatient;PACE;C:\Users\FGuo\Documents\work doucment\attachment\attachmentDB\20161005\originalFileFromAerial\DOCSVC_20161003.tar\DOCSVC_20161003\Sect2\INPATIENT\REQ_20160303-000061\Alexander, Vivian_3-7-116_2016-03-07-16.42.17.202.docx
Request;20160303-000061;54438;PACE;Inpatient;PACE;C:\Users\FGuo\Documents\work doucment\attachment\attachmentDB\20161005\originalFileFromAerial\DOCSVC_20161003.tar\DOCSVC_20161003\Sect2\INPATIENT\REQ_20160303-000061\O_\54438 ALEXANDER, VIVAN UR REQ SHEET_2016-03-03-16.14.59.198.doc
Request;20160303-000062;76400;PACE;Inpatient;PACE;C:\Users\FGuo\Documents\work doucment\attachment\attachmentDB\20161005\originalFileFromAerial\DOCSVC_20161003.tar\DOCSVC_20161003\Sect2\INPATIENT\REQ_20160303-000062\Arias-Perez, Ynes- Montefiore Medical Center 8-16-16_2016-08-16-16.47.23.211.pdf
Request;20160303-000062;76400;PACE;Inpatient;PACE;C:\Users\FGuo\Documents\work doucment\attachment\attachmentDB\20161005\originalFileFromAerial\DOCSVC_20161003.tar\DOCSVC_20161003\Sect2\INPATIENT\REQ_20160303-000062\ARIAS-PEREZ, YNES_3-7-16_2016-03-07-16.51.27.507.pdf
Request;20160303-000062;76400;PACE;Inpatient;PACE;C:\Users\FGuo\Documents\work doucment\attachment\attachmentDB\20161005\originalFileFromAerial\DOCSVC_20161003.tar\DOCSVC_20161003\Sect2\INPATIENT\REQ_20160303-000062\O_\76400 ARIAS PEREZ, YNES UR REQ SHEET_2016-03-03-16.21.13.456.doc
Request;20160303-000063;98830;PACE;Inpatient;PACE;C:\Users\FGuo\Documents\work doucment\attachment\attachmentDB\20161005\originalFileFromAerial\DOCSVC_20161003.tar\DOCSVC_20161003\Sect2\INPATIENT\REQ_20160303-000063\Claudio, A 98830 CR 2-26-16_2016-03-03-16.29.59.170.tif
Request;20160303-000063;98830;PACE;Inpatient;PACE;C:\Users\FGuo\Documents\work doucment\attachment\attachmentDB\20161005\originalFileFromAerial\DOCSVC_20161003.tar\DOCSVC_20161003\Sect2\INPATIENT\REQ_20160303-000063\Claudio, Alice  - Montefiore Medical Center 8-10-2016_2016-08-10-16.04.49.267.pdf
Request;20160303-000063;98830;PACE;Inpatient;PACE;C:\Users\FGuo\Documents\work doucment\attachment\attachmentDB\20161005\originalFileFromAerial\DOCSVC_20161003.tar\DOCSVC_20161003\Sect2\INPATIENT\REQ_20160303-000063\CLAUDIO, ALICE_3-7-16_2016-03-08-10.17.12.737.pdf
Request;20160304-000004;60571;SELECT;Inpatient;SELECT;C:\Users\FGuo\Documents\work doucment\attachment\attachmentDB\20161005\originalFileFromAerial\DOCSVC_20161003.tar\DOCSVC_20161003\Sect2\INPATIENT\REQ_20160304-000004\Gonzalez, Neri - Four Seasons Nursing Home  4.26.16_2016-04-26-11.33.38.805.pdf
Request;20160304-000005;60571;SELECT;Inpatient;SELECT;C:\Users\FGuo\Documents\work doucment\attachment\attachmentDB\20161005\originalFileFromAerial\DOCSVC_20161003.tar\DOCSVC_20161003\Sect2\INPATIENT\REQ_20160304-000005\Gonzalez, Neri - Four Seasons Nursing Home-(2)  4.26.16_2016-04-26-11.37.48.9.pdf
Request;20160304-000007;52755;PACE;Inpatient;PACE;C:\Users\FGuo\Documents\work doucment\attachment\attachmentDB\20161005\originalFileFromAerial\DOCSVC_20161003.tar\DOCSVC_20161003\Sect2\INPATIENT\REQ_20160304-000007\Neyman, Yakov 52755 Clinical Review 10 15 Req Form - Copy (2)_2016-03-04-10.36.19.885.docx
Request;20160304-000007;52755;PACE;Inpatient;PACE;C:\Users\FGuo\Documents\work doucment\attachment\attachmentDB\20161005\originalFileFromAerial\DOCSVC_20161003.tar\DOCSVC_20161003\Sect2\INPATIENT\REQ_20160304-000007\NYakov_2016-03-07-12.45.58.299.tif
Request;20160304-000013;29819;PACE;Inpatient;PACE;C:\Users\FGuo\Documents\work doucment\attachment\attachmentDB\20161005\originalFileFromAerial\DOCSVC_20161003.tar\DOCSVC_20161003\Sect2\INPATIENT\REQ_20160304-000013\DOBI TELAT 31016_2016-03-10-16.39.46.643.tif
Request;20160304-000013;29819;PACE;Inpatient;PACE;C:\Users\FGuo\Documents\work doucment\attachment\attachmentDB\20161005\originalFileFromAerial\DOCSVC_20161003.tar\DOCSVC_20161003\Sect2\INPATIENT\REQ_20160304-000013\dobi telat31716_2016-03-17-10.22.57.882.tif
Request;20160304-000013;29819;PACE;Inpatient;PACE;C:\Users\FGuo\Documents\work doucment\attachment\attachmentDB\20161005\originalFileFromAerial\DOCSVC_20161003.tar\DOCSVC_20161003\Sect2\INPATIENT\REQ_20160304-000013\Dobi, Telat - HAYM SALOMON HOME FOR THE AGED LLC 8.22.16_2016-08-22-12.38.33.616.pdf
Request;20160304-000013;29819;PACE;Inpatient;PACE;C:\Users\FGuo\Documents\work doucment\attachment\attachmentDB\20161005\originalFileFromAerial\DOCSVC_20161003.tar\DOCSVC_20161003\Sect2\INPATIENT\REQ_20160304-000013\Dobi,Telat_clinical-PRI_3-2-16_2016-03-04-11.06.30.52.pdf
Request;20160304-000018;82287;PACE;Inpatient;PACE;C:\Users\FGuo\Documents\work doucment\attachment\attachmentDB\20161005\originalFileFromAerial\DOCSVC_20161003.tar\DOCSVC_20161003\Sect2\INPATIENT\REQ_20160304-000018\Benitez, Lucila 82287 Clinical Review 10 15 Req Form - Copy (2)_2016-03-04-11.49.02.39.docx
Request;20160304-000018;82287;PACE;Inpatient;PACE;C:\Users\FGuo\Documents\work doucment\attachment\attachmentDB\20161005\originalFileFromAerial\DOCSVC_20161003.tar\DOCSVC_20161003\Sect2\INPATIENT\REQ_20160304-000018\BENITEZ, LUCILA_3-7-16_2016-03-07-16.50.30.628.pdf
Request;20160304-000018;82287;PACE;Inpatient;PACE;C:\Users\FGuo\Documents\work doucment\attachment\attachmentDB\20161005\originalFileFromAerial\DOCSVC_20161003.tar\DOCSVC_20161003\Sect2\INPATIENT\REQ_20160304-000018\Lucenabenitez, Lucila  - Montefiore Medical Center 8-18-16_2016-08-18-11.29.51.450.pdf
Request;20160304-000024;61608;SELECT;Inpatient;SELECT;C:\Users\FGuo\Documents\work doucment\attachment\attachmentDB\20161005\originalFileFromAerial\DOCSVC_20161003.tar\DOCSVC_20161003\Sect2\INPATIENT\REQ_20160304-000024\gaspard, roland  3-4-16_2016-03-04-12.20.02.842.pdf
Request;20160304-000024;61608;SELECT;Inpatient;SELECT;C:\Users\FGuo\Documents\work doucment\attachment\attachmentDB\20161005\originalFileFromAerial\DOCSVC_20161003.tar\DOCSVC_20161003\Sect2\INPATIENT\REQ_20160304-000024\Gaspard, Roland - OXFORD NURSING HOME, INC - 4.26.16_2016-04-26-12.34.33.737.pdf
Request;20160304-000024;61608;SELECT;Inpatient;SELECT;C:\Users\FGuo\Documents\work doucment\attachment\attachmentDB\20161005\originalFileFromAerial\DOCSVC_20161003.tar\DOCSVC_20161003\Sect2\INPATIENT\REQ_20160304-000024\Gaspard, Roland - OXFORD NURSING HOME, INC - 4.26.16_2016-04-26-12.38.04.632.pdf
Request;20160304-000030;54905;PACE;Inpatient;PACE;C:\Users\FGuo\Documents\work doucment\attachment\attachmentDB\20161005\originalFileFromAerial\DOCSVC_20161003.tar\DOCSVC_20161003\Sect2\INPATIENT\REQ_20160304-000030\Reece, Michael - SCHNURMACHER NURSING HOME 8.22.16_2016-08-22-16.13.07.267.pdf
Request;20160304-000031;83148;SELECT;Inpatient;SELECT;C:\Users\FGuo\Documents\work doucment\attachment\attachmentDB\20161005\originalFileFromAerial\DOCSVC_20161003.tar\DOCSVC_20161003\Sect2\INPATIENT\REQ_20160304-000031\Salvatore, Roberta 83148- Auth Approval Letter for Long Term Care_2016-03-24-09.25.14.652.doc
Request;20160304-000031;83148;SELECT;Inpatient;SELECT;C:\Users\FGuo\Documents\work doucment\attachment\attachmentDB\20161005\originalFileFromAerial\DOCSVC_20161003.tar\DOCSVC_20161003\Sect2\INPATIENT\REQ_20160304-000031\Salvatore, Roberta_2016-07-12-11.58.06.880.tif
Request;20160304-000053;21695;PACE;Inpatient;PACE;C:\Users\FGuo\Documents\work doucment\attachment\attachmentDB\20161005\originalFileFromAerial\DOCSVC_20161003.tar\DOCSVC_20161003\Sect2\INPATIENT\REQ_20160304-000053\Vacianna, Mabel -CENTER FOR NURSING AND REHABILITATION.6.14_2016-06-14-10.06.57.936.pdf
Request;20160307-000003;60849;SELECT;Inpatient;SELECT;C:\Users\FGuo\Documents\work doucment\attachment\attachmentDB\20161005\originalFileFromAerial\DOCSVC_20161003.tar\DOCSVC_20161003\Sect2\INPATIENT\REQ_20160307-000003\Desola, Anthony I- Four Seasons Nursing Home  - 9.29.16_2016-09-29-13.22.58.747.pdf
Request;20160307-000003;60849;SELECT;Inpatient;SELECT;C:\Users\FGuo\Documents\work doucment\attachment\attachmentDB\20161005\originalFileFromAerial\DOCSVC_20161003.tar\DOCSVC_20161003\Sect2\INPATIENT\REQ_20160307-000003\Desola, Anthony I- Four Seasons Nursing Home  -8.9.16_2016-08-09-15.00.13.478.pdf
Request;20160307-000003;60849;SELECT;Inpatient;SELECT;C:\Users\FGuo\Documents\work doucment\attachment\attachmentDB\20161005\originalFileFromAerial\DOCSVC_20161003.tar\DOCSVC_20161003\Sect2\INPATIENT\REQ_20160307-000003\O_\nursing home documents\A Desola 60849_2016-03-07-08.45.50.679.tif
Request;20160307-000004;21190;PACE;Inpatient;PACE;C:\Users\FGuo\Documents\work doucment\attachment\attachmentDB\20161005\originalFileFromAerial\DOCSVC_20161003.tar\DOCSVC_20161003\Sect2\INPATIENT\REQ_20160307-000004\Carr, Theresa  - New York Methodist Hospital  -_2016-03-16-12.57.25.538.docx
Request;20160307-000004;21190;PACE;Inpatient;PACE;C:\Users\FGuo\Documents\work doucment\attachment\attachmentDB\20161005\originalFileFromAerial\DOCSVC_20161003.tar\DOCSVC_20161003\Sect2\INPATIENT\REQ_20160307-000004\Carr, theresa  21190 Clinical Review 10 15 Req Form - Copy (2)_2016-03-07-09.18.23.749.docx
Request;20160307-000004;21190;PACE;Inpatient;PACE;C:\Users\FGuo\Documents\work doucment\attachment\attachmentDB\20161005\originalFileFromAerial\DOCSVC_20161003.tar\DOCSVC_20161003\Sect2\INPATIENT\REQ_20160307-000004\Carr, Theresa  ny methodist_2016-03-10-12.48.07.707.docx
Request;20160307-000004;21190;PACE;Inpatient;PACE;C:\Users\FGuo\Documents\work doucment\attachment\attachmentDB\20161005\originalFileFromAerial\DOCSVC_20161003.tar\DOCSVC_20161003\Sect2\INPATIENT\REQ_20160307-000004\Carr, Theresa  ny methodist_2016-03-14-11.12.48.114.docx
Request;20160307-000005;29560;PACE;Inpatient;PACE;C:\Users\FGuo\Documents\work doucment\attachment\attachmentDB\20161005\originalFileFromAerial\DOCSVC_20161003.tar\DOCSVC_20161003\Sect2\INPATIENT\REQ_20160307-000005\05052016 Ng, Yuen Ping_2016-06-13-10.54.42.326.pdf
Request;20160307-000005;29560;PACE;Inpatient;PACE;C:\Users\FGuo\Documents\work doucment\attachment\attachmentDB\20161005\originalFileFromAerial\DOCSVC_20161003.tar\DOCSVC_20161003\Sect2\INPATIENT\REQ_20160307-000005\Ng Yuen Ping 29560 Clinical Review 10 15 Req Form - Copy (2)_2016-03-07-09.41.09.477.docx
Request;20160307-000005;29560;PACE;Inpatient;PACE;C:\Users\FGuo\Documents\work doucment\attachment\attachmentDB\20161005\originalFileFromAerial\DOCSVC_20161003.tar\DOCSVC_20161003\Sect2\INPATIENT\REQ_20160307-000005\Ng Yuen Ping IP Denial  New York Methodist Hospital 3-10-16_2016-03-11-11.10.57.130.pdf
Request;20160307-000005;29560;PACE;Inpatient;PACE;C:\Users\FGuo\Documents\work doucment\attachment\attachmentDB\20161005\originalFileFromAerial\DOCSVC_20161003.tar\DOCSVC_20161003\Sect2\INPATIENT\REQ_20160307-000005\Ng, Yuen Ping_clinical_3-7-16_2016-03-08-16.20.27.481.pdf
Request;20160307-000012;73139;PACE;Inpatient;PACE;C:\Users\FGuo\Documents\work doucment\attachment\attachmentDB\20161005\originalFileFromAerial\DOCSVC_20161003.tar\DOCSVC_20161003\Sect2\INPATIENT\REQ_20160307-000012\Glenn Beatrice IP Denial Montefiore Medical Center 3-10-16_2016-03-10-15.00.12.947.pdf
Request;20160307-000012;73139;PACE;Inpatient;PACE;C:\Users\FGuo\Documents\work doucment\attachment\attachmentDB\20161005\originalFileFromAerial\DOCSVC_20161003.tar\DOCSVC_20161003\Sect2\INPATIENT\REQ_20160307-000012\Glenn, Beatrice 73139  Clinical Review 10 15 Req Form - Copy (2)_2016-03-07-10.16.26.298.docx
Request;20160307-000012;73139;PACE;Inpatient;PACE;C:\Users\FGuo\Documents\work doucment\attachment\attachmentDB\20161005\originalFileFromAerial\DOCSVC_20161003.tar\DOCSVC_20161003\Sect2\INPATIENT\REQ_20160307-000012\GLENN, BEATRICE_3-8-16_2016-03-09-10.02.14.743.pdf
Request;20160307-000012;73139;PACE;Inpatient;PACE;C:\Users\FGuo\Documents\work doucment\attachment\attachmentDB\20161005\originalFileFromAerial\DOCSVC_20161003.tar\DOCSVC_20161003\Sect2\INPATIENT\REQ_20160307-000012\GLENN_BEATRICE  _041216_2016-05-23-15.23.24.227.pdf
Request;20160307-000014;95921;PACE;Inpatient;PACE;C:\Users\FGuo\Documents\work doucment\attachment\attachmentDB\20161005\originalFileFromAerial\DOCSVC_20161003.tar\DOCSVC_20161003\Sect2\INPATIENT\REQ_20160307-000014\ma yun manpri3716_2016-03-07-13.23.28.256.tif
Request;20160307-000014;95921;PACE;Inpatient;PACE;C:\Users\FGuo\Documents\work doucment\attachment\attachmentDB\20161005\originalFileFromAerial\DOCSVC_20161003.tar\DOCSVC_20161003\Sect2\INPATIENT\REQ_20160307-000014\Ma, Yun Man - Gouveneur Healthcare Services 8.22.16_2016-08-22-16.26.01.648.pdf
Request;20160307-000020;46326;PACE;Inpatient;PACE;C:\Users\FGuo\Documents\work doucment\attachment\attachmentDB\20161005\originalFileFromAerial\DOCSVC_20161003.tar\DOCSVC_20161003\Sect2\INPATIENT\REQ_20160307-000020\audrey gladden3416_2016-03-07-11.29.49.754.tif
Request;20160307-000020;46326;PACE;Inpatient;PACE;C:\Users\FGuo\Documents\work doucment\attachment\attachmentDB\20161005\originalFileFromAerial\DOCSVC_20161003.tar\DOCSVC_20161003\Sect2\INPATIENT\REQ_20160307-000020\Gladden, Audrey T -Mosholu Parkway Nursing And Rehabilitation Center 8.22.16_2016-08-22-16.37.44.730.pdf
Request;20160307-000024;46418;SELECT;Inpatient;SELECT;C:\Users\FGuo\Documents\work doucment\attachment\attachmentDB\20161005\originalFileFromAerial\DOCSVC_20161003.tar\DOCSVC_20161003\Sect2\INPATIENT\REQ_20160307-000024\Chambers- buckley, Dea - NORTH SHORE UNIVERSITY HOSPITAL 8.23.16_2016-08-23-12.01.33.461.pdf
Request;20160307-000027;73139;PACE;Inpatient;PACE;C:\Users\FGuo\Documents\work doucment\attachment\attachmentDB\20161005\originalFileFromAerial\DOCSVC_20161003.tar\DOCSVC_20161003\Sect2\INPATIENT\REQ_20160307-000027\GLEEN. BEATRICE_PRI_2016-03-07-16.06.31.417.pdf
Request;20160307-000028;43615;SELECT;Inpatient;Not Valued;C:\Users\FGuo\Documents\work doucment\attachment\attachmentDB\20161005\originalFileFromAerial\DOCSVC_20161003.tar\DOCSVC_20161003\Sect2\INPATIENT\REQ_20160307-000028\O_\43615 YANCEY, JAMES SNF AUTH REQ_2016-03-07-12.47.50.872.docx
Request;20160307-000028;43615;SELECT;Inpatient;Not Valued;C:\Users\FGuo\Documents\work doucment\attachment\attachmentDB\20161005\originalFileFromAerial\DOCSVC_20161003.tar\DOCSVC_20161003\Sect2\INPATIENT\REQ_20160307-000028\O_\43615 YANCEY, JAMES SNF FROM GOOD SAM_2016-03-07-12.48.17.442.tif
Request;20160307-000028;43615;SELECT;Inpatient;Not Valued;C:\Users\FGuo\Documents\work doucment\attachment\attachmentDB\20161005\originalFileFromAerial\DOCSVC_20161003.tar\DOCSVC_20161003\Sect2\INPATIENT\REQ_20160307-000028\O_\43615 YANCEY, JAMES SNF NOTES_2016-03-07-12.48.41.380.tif
Request;20160307-000028;43615;SELECT;Inpatient;Not Valued;C:\Users\FGuo\Documents\work doucment\attachment\attachmentDB\20161005\originalFileFromAerial\DOCSVC_20161003.tar\DOCSVC_20161003\Sect2\INPATIENT\REQ_20160307-000028\Yancey James Adverse Determ Northern Manor Multicare Center 3-8-16_2016-03-09-10.42.56.670.pdf
Request;20160307-000028;43615;SELECT;Inpatient;Not Valued;C:\Users\FGuo\Documents\work doucment\attachment\attachmentDB\20161005\originalFileFromAerial\DOCSVC_20161003.tar\DOCSVC_20161003\Sect2\INPATIENT\REQ_20160307-000028\Yancey James MLTC Northern Manor Multicare Center 3-9-16_2016-03-09-10.43.07.452.pdf
Request;20160307-000029;45895;PACE;Inpatient;PACE;C:\Users\FGuo\Documents\work doucment\attachment\attachmentDB\20161005\originalFileFromAerial\DOCSVC_20161003.tar\DOCSVC_20161003\Sect2\INPATIENT\REQ_20160307-000029\Moronta, B 45895 3-7-16_2016-03-11-12.47.09.899.tif
Request;20160307-000029;45895;PACE;Inpatient;PACE;C:\Users\FGuo\Documents\work doucment\attachment\attachmentDB\20161005\originalFileFromAerial\DOCSVC_20161003.tar\DOCSVC_20161003\Sect2\INPATIENT\REQ_20160307-000029\O_\45895 MORONTA, BASILICIA APPROVAL LTR_2016-03-17-10.15.06.22.docx
Request;20160307-000029;45895;PACE;Inpatient;PACE;C:\Users\FGuo\Documents\work doucment\attachment\attachmentDB\20161005\originalFileFromAerial\DOCSVC_20161003.tar\DOCSVC_20161003\Sect2\INPATIENT\REQ_20160307-000029\O_\45895 MORONTA, BASILICIA UR REQ SHEET_2016-03-07-12.58.03.974.doc
Request;20160307-000031;43028;PACE;Inpatient;PACE;C:\Users\FGuo\Documents\work doucment\attachment\attachmentDB\20161005\originalFileFromAerial\DOCSVC_20161003.tar\DOCSVC_20161003\Sect2\INPATIENT\REQ_20160307-000031\geraldine pierson 32216_2016-03-22-11.03.18.306.tif
Request;20160307-000032;31986;SELECT;Inpatient;SELECT;C:\Users\FGuo\Documents\work doucment\attachment\attachmentDB\20161005\originalFileFromAerial\DOCSVC_20161003.tar\DOCSVC_20161003\Sect2\INPATIENT\REQ_20160307-000032\Chan, Yanyee - ATLANTIS REHAB & RHCF 8.24.16_2016-08-24-16.33.14.679.pdf
Request;20160307-000037;57067;PACE;Inpatient;PACE;C:\Users\FGuo\Documents\work doucment\attachment\attachmentDB\20161005\originalFileFromAerial\DOCSVC_20161003.tar\DOCSVC_20161003\Sect2\INPATIENT\REQ_20160307-000037\Zhu, Xueru - Atlantis Rehab & RHCF (Auth 20160307-000037) 3.7.16_2016-03-07-15.22.33.323.pdf
Request;20160307-000038;98115;PACE;Inpatient;PACE;C:\Users\FGuo\Documents\work doucment\attachment\attachmentDB\20161005\originalFileFromAerial\DOCSVC_20161003.tar\DOCSVC_20161003\Sect2\INPATIENT\REQ_20160307-000038\Leung.P.S___NY Presbyterian_Downtown Hospital__ Clinical Request Form_03.07.16_2016-03-07-13.43.25.748.docx
Request;20160307-000040;28683;PACE;Inpatient;PACE;C:\Users\FGuo\Documents\work doucment\attachment\attachmentDB\20161005\originalFileFromAerial\DOCSVC_20161003.tar\DOCSVC_20161003\Sect2\INPATIENT\REQ_20160307-000040\Johnson, Robert C - MARGARET TIETZ NURSING AND REHAB CTR 8.23.16_2016-08-23-09.11.49.723.pdf
Request;20160307-000041;27023;FIDA;Inpatient;FIDA;C:\Users\FGuo\Documents\work doucment\attachment\attachmentDB\20161005\originalFileFromAerial\DOCSVC_20161003.tar\DOCSVC_20161003\Sect2\INPATIENT\REQ_20160307-000041\He, Cai F - Atlantis Rehab & RHCF (Auth 20160307-000041) 3.7.16_2016-03-07-15.28.50.94.pdf
Request;20160307-000050;42971;PACE;Inpatient;PACE;C:\Users\FGuo\Documents\work doucment\attachment\attachmentDB\20161005\originalFileFromAerial\DOCSVC_20161003.tar\DOCSVC_20161003\Sect2\INPATIENT\REQ_20160307-000050\Rivera, Sergio 03-07-2016 clincial request_2016-03-07-15.22.11.91.pdf
Request;20160307-000050;42971;PACE;Inpatient;PACE;C:\Users\FGuo\Documents\work doucment\attachment\attachmentDB\20161005\originalFileFromAerial\DOCSVC_20161003.tar\DOCSVC_20161003\Sect2\INPATIENT\REQ_20160307-000050\Rivera, Sergio 03-07-2016_2016-03-07-15.17.39.383.tif
Request;20160307-000050;42971;PACE;Inpatient;PACE;C:\Users\FGuo\Documents\work doucment\attachment\attachmentDB\20161005\originalFileFromAerial\DOCSVC_20161003.tar\DOCSVC_20161003\Sect2\INPATIENT\REQ_20160307-000050\SRivera_2016-03-10-12.40.07.11.tif
Request;20160307-000051;34204;PACE;Inpatient;PACE;C:\Users\FGuo\Documents\work doucment\attachment\attachmentDB\20161005\originalFileFromAerial\DOCSVC_20161003.tar\DOCSVC_20161003\Sect2\INPATIENT\REQ_20160307-000051\G_\Genis\Bronx\Hernandez, Carmen 34204- Clinicals_2016-03-08-13.18.37.40.TIF
Request;20160307-000051;34204;PACE;Inpatient;PACE;C:\Users\FGuo\Documents\work doucment\attachment\attachmentDB\20161005\originalFileFromAerial\DOCSVC_20161003.tar\DOCSVC_20161003\Sect2\INPATIENT\REQ_20160307-000051\G_\Genis\Inpt Admit\Hernandez, Carmen 34204- Medical Center Clinical Review Request Form_2016-03-07-15.33.28.163.doc
Request;20160307-000051;34204;PACE;Inpatient;PACE;C:\Users\FGuo\Documents\work doucment\attachment\attachmentDB\20161005\originalFileFromAerial\DOCSVC_20161003.tar\DOCSVC_20161003\Sect2\INPATIENT\REQ_20160307-000051\Hernandez Carmen  IP Denial Montefiore Medical Center 3-11-16_2016-03-11-15.28.55.847.pdf
Request;20160307-000051;34204;PACE;Inpatient;PACE;C:\Users\FGuo\Documents\work doucment\attachment\attachmentDB\20161005\originalFileFromAerial\DOCSVC_20161003.tar\DOCSVC_20161003\Sect2\INPATIENT\REQ_20160307-000051\HERNANDEZ, CARMEN_042216_2016-05-25-14.59.49.780.pdf
Request;20160307-000055;36506;PACE;Inpatient;PACE;C:\Users\FGuo\Documents\work doucment\attachment\attachmentDB\20161005\originalFileFromAerial\DOCSVC_20161003.tar\DOCSVC_20161003\Sect2\INPATIENT\REQ_20160307-000055\Olea, Yrenia - Montefiore Medical Center 8-16_2016-08-19-10.43.28.827.pdf
Request;20160307-000055;36506;PACE;Inpatient;PACE;C:\Users\FGuo\Documents\work doucment\attachment\attachmentDB\20161005\originalFileFromAerial\DOCSVC_20161003.tar\DOCSVC_20161003\Sect2\INPATIENT\REQ_20160307-000055\OLEA, YRENIA_CLINICAL-3-8-16_2016-03-09-10.23.28.828.pdf
Request;20160307-000055;36506;PACE;Inpatient;PACE;C:\Users\FGuo\Documents\work doucment\attachment\attachmentDB\20161005\originalFileFromAerial\DOCSVC_20161003.tar\DOCSVC_20161003\Sect2\INPATIENT\REQ_20160307-000055\O_\36506 OLEA, YRENIA UR REQ SHEET_2016-03-07-15.34.40.99.doc
Request;20160307-000056;71105;PACE;Inpatient;PACE;C:\Users\FGuo\Documents\work doucment\attachment\attachmentDB\20161005\originalFileFromAerial\DOCSVC_20161003.tar\DOCSVC_20161003\Sect2\INPATIENT\REQ_20160307-000056\Cea Frank IP Denial Montefiore Medical Center 3-10-16_2016-03-10-15.38.21.585.pdf
Request;20160307-000056;71105;PACE;Inpatient;PACE;C:\Users\FGuo\Documents\work doucment\attachment\attachmentDB\20161005\originalFileFromAerial\DOCSVC_20161003.tar\DOCSVC_20161003\Sect2\INPATIENT\REQ_20160307-000056\CEA, FRANK_3-8-14_2016-03-09-10.09.14.990.pdf
Request;20160307-000056;71105;PACE;Inpatient;PACE;C:\Users\FGuo\Documents\work doucment\attachment\attachmentDB\20161005\originalFileFromAerial\DOCSVC_20161003.tar\DOCSVC_20161003\Sect2\INPATIENT\REQ_20160307-000056\G_\Genis\Bronx\Cea, Frank 71105- Admission_2016-03-07-15.39.41.717.TIF
Request;20160307-000056;71105;PACE;Inpatient;PACE;C:\Users\FGuo\Documents\work doucment\attachment\attachmentDB\20161005\originalFileFromAerial\DOCSVC_20161003.tar\DOCSVC_20161003\Sect2\INPATIENT\REQ_20160307-000056\G_\Genis\Bronx\Cea, Frank 71105- Clinicals 3-7-2016_2016-03-07-15.57.07.872.TIF
Request;20160307-000056;71105;PACE;Inpatient;PACE;C:\Users\FGuo\Documents\work doucment\attachment\attachmentDB\20161005\originalFileFromAerial\DOCSVC_20161003.tar\DOCSVC_20161003\Sect2\INPATIENT\REQ_20160307-000056\G_\Genis\Inpt Admit\Cea, Frank 71105 - Medical Center Clinical Review Request Form_2016-03-07-15.46.46.328.doc
Request;20160307-000057;31516;DIRECT/SELECT LT;Inpatient;DIRECT/SELECT LT;C:\Users\FGuo\Documents\work doucment\attachment\attachmentDB\20161005\originalFileFromAerial\DOCSVC_20161003.tar\DOCSVC_20161003\Sect2\INPATIENT\REQ_20160307-000057\Josefina Segura PRI assessment 3-7-16_2016-03-07-15.41.36.103.tif
Request;20160307-000057;31516;DIRECT/SELECT LT;Inpatient;DIRECT/SELECT LT;C:\Users\FGuo\Documents\work doucment\attachment\attachmentDB\20161005\originalFileFromAerial\DOCSVC_20161003.tar\DOCSVC_20161003\Sect2\INPATIENT\REQ_20160307-000057\Josefina Segura SNF Notes 3-14-16_2016-03-14-17.41.15.689.tif
Request;20160307-000057;31516;DIRECT/SELECT LT;Inpatient;DIRECT/SELECT LT;C:\Users\FGuo\Documents\work doucment\attachment\attachmentDB\20161005\originalFileFromAerial\DOCSVC_20161003.tar\DOCSVC_20161003\Sect2\INPATIENT\REQ_20160307-000057\Segura, Josefina - PELHAM PARKWAY NURSING CARE & REHAB 9.09.16_2016-09-09-11.52.46.587.pdf
Request;20160307-000057;31516;DIRECT/SELECT LT;Inpatient;DIRECT/SELECT LT;C:\Users\FGuo\Documents\work doucment\attachment\attachmentDB\20161005\originalFileFromAerial\DOCSVC_20161003.tar\DOCSVC_20161003\Sect2\INPATIENT\REQ_20160307-000057\Segura, Josephina  - Pelham Pkwy Rehab NH SELECT Auth Approval Form 3-9-16_2016-03-09-10.09.14.863.docx
Request;20160307-000062;59397;DIRECT;Inpatient;DIRECT;C:\Users\FGuo\Documents\work doucment\attachment\attachmentDB\20161005\originalFileFromAerial\DOCSVC_20161003.tar\DOCSVC_20161003\Sect2\INPATIENT\REQ_20160307-000062\Corbin, Cummins  - MONTEFIORE MEDICAL CENTER 8-10-2016_2016-08-10-15.53.41.716.pdf
Request;20160307-000062;59397;DIRECT;Inpatient;DIRECT;C:\Users\FGuo\Documents\work doucment\attachment\attachmentDB\20161005\originalFileFromAerial\DOCSVC_20161003.tar\DOCSVC_20161003\Sect2\INPATIENT\REQ_20160307-000062\CORBIN, CUMMINS_3-7-116_2016-03-07-16.52.46.226.pdf
Request;20160307-000062;59397;DIRECT;Inpatient;DIRECT;C:\Users\FGuo\Documents\work doucment\attachment\attachmentDB\20161005\originalFileFromAerial\DOCSVC_20161003.tar\DOCSVC_20161003\Sect2\INPATIENT\REQ_20160307-000062\G_\Genis\Bronx\Corbin, Cummins 59397- Clinicals_2016-03-07-16.02.07.223.TIF
Request;20160307-000062;59397;DIRECT;Inpatient;DIRECT;C:\Users\FGuo\Documents\work doucment\attachment\attachmentDB\20161005\originalFileFromAerial\DOCSVC_20161003.tar\DOCSVC_20161003\Sect2\INPATIENT\REQ_20160307-000062\_2016-03-07-16.52.53.520
Request;20160307-000063;38834;null;Inpatient;SELECT;C:\Users\FGuo\Documents\work doucment\attachment\attachmentDB\20161005\originalFileFromAerial\DOCSVC_20161003.tar\DOCSVC_20161003\Sect2\INPATIENT\REQ_20160307-000063\.2 Drummer, Gitta - HAMILTON PARK NURSING AND REHABILITATION - 5.26.16_2016-05-26-09.35.41.753.pdf
Request;20160307-000063;38834;null;Inpatient;SELECT;C:\Users\FGuo\Documents\work doucment\attachment\attachmentDB\20161005\originalFileFromAerial\DOCSVC_20161003.tar\DOCSVC_20161003\Sect2\INPATIENT\REQ_20160307-000063\Drummer Gitta - Hamilton Park Nursing & Rehab 3-7-16_2016-03-23-13.51.08.141.pdf
Request;20160307-000063;38834;null;Inpatient;SELECT;C:\Users\FGuo\Documents\work doucment\attachment\attachmentDB\20161005\originalFileFromAerial\DOCSVC_20161003.tar\DOCSVC_20161003\Sect2\INPATIENT\REQ_20160307-000063\Drummer Gitta - Hamilton Park Nursing & Rehab LTC Mar 7 to Apr 6  4-11-16_2016-04-11-15.59.09.619.pdf
Request;20160308-000003;54906;SELECT;Inpatient;SELECT;C:\Users\FGuo\Documents\work doucment\attachment\attachmentDB\20161005\originalFileFromAerial\DOCSVC_20161003.tar\DOCSVC_20161003\Sect2\INPATIENT\REQ_20160308-000003\JF Clinicals 4.15.16_2016-04-22-10.56.55.764.TIF
Request;20160308-000003;54906;SELECT;Inpatient;SELECT;C:\Users\FGuo\Documents\work doucment\attachment\attachmentDB\20161005\originalFileFromAerial\DOCSVC_20161003.tar\DOCSVC_20161003\Sect2\INPATIENT\REQ_20160308-000003\JF Clinicals 4.6.16_2016-04-07-08.38.19.895.TIF
Request;20160308-000003;54906;SELECT;Inpatient;SELECT;C:\Users\FGuo\Documents\work doucment\attachment\attachmentDB\20161005\originalFileFromAerial\DOCSVC_20161003.tar\DOCSVC_20161003\Sect2\INPATIENT\REQ_20160308-000003\O_\Clinicals\JF Clinicals 3.9.16_2016-03-09-07.57.38.229.TIF
Request;20160308-000004;87333;PACE;Inpatient;PACE;C:\Users\FGuo\Documents\work doucment\attachment\attachmentDB\20161005\originalFileFromAerial\DOCSVC_20161003.tar\DOCSVC_20161003\Sect2\INPATIENT\REQ_20160308-000004\Dacaj, Dila   IP Denial Montefiore Medical Center 3-11-16_2016-03-11-15.16.36.313.pdf
Request;20160308-000004;87333;PACE;Inpatient;PACE;C:\Users\FGuo\Documents\work doucment\attachment\attachmentDB\20161005\originalFileFromAerial\DOCSVC_20161003.tar\DOCSVC_20161003\Sect2\INPATIENT\REQ_20160308-000004\Dacaj, Dila 87333 Clinical Review 10 15 Req Form - Copy (2)_2016-03-08-10.00.47.87.docx
Request;20160308-000004;87333;PACE;Inpatient;PACE;C:\Users\FGuo\Documents\work doucment\attachment\attachmentDB\20161005\originalFileFromAerial\DOCSVC_20161003.tar\DOCSVC_20161003\Sect2\INPATIENT\REQ_20160308-000004\DACAJ, DILA_042216_2016-05-25-14.51.37.11.pdf
Request;20160308-000004;87333;PACE;Inpatient;PACE;C:\Users\FGuo\Documents\work doucment\attachment\attachmentDB\20161005\originalFileFromAerial\DOCSVC_20161003.tar\DOCSVC_20161003\Sect2\INPATIENT\REQ_20160308-000004\G_\Genis\Bronx\Dacaj, Dila 87333- Clinicals_2016-03-08-15.47.23.668.TIF
Request;20160308-000006;42354;PACE;Inpatient;PACE;C:\Users\FGuo\Documents\work doucment\attachment\attachmentDB\20161005\originalFileFromAerial\DOCSVC_20161003.tar\DOCSVC_20161003\Sect2\INPATIENT\REQ_20160308-000006\Perez, Maria A - RESORT NURSING HOME 8.17.16_2016-08-17-16.16.00.475.pdf
Request;20160308-000015;57120;null;Inpatient;SELECT;C:\Users\FGuo\Documents\work doucment\attachment\attachmentDB\20161005\originalFileFromAerial\DOCSVC_20161003.tar\DOCSVC_20161003\Sect2\INPATIENT\REQ_20160308-000015\Davis, Joerene D- SV Operating Three, LLC - 4.1.16_2016-04-01-15.07.34.678.pdf
Request;20160308-000017;59420;SELECT;Inpatient;SELECT;C:\Users\FGuo\Documents\work doucment\attachment\attachmentDB\20161005\originalFileFromAerial\DOCSVC_20161003.tar\DOCSVC_20161003\Sect2\INPATIENT\REQ_20160308-000017\Diaz.N.R.__ Approval Letter __PVC_ 04.06.16_2016-04-06-10.24.11.198.docx
Request;20160308-000017;59420;SELECT;Inpatient;SELECT;C:\Users\FGuo\Documents\work doucment\attachment\attachmentDB\20161005\originalFileFromAerial\DOCSVC_20161003.tar\DOCSVC_20161003\Sect2\INPATIENT\REQ_20160308-000017\Diaznegron, Ramon - PINE VALLEY CENTER, LLC 8.23.16_2016-08-29-15.37.33.693.pdf
Request;20160308-000017;59420;SELECT;Inpatient;SELECT;C:\Users\FGuo\Documents\work doucment\attachment\attachmentDB\20161005\originalFileFromAerial\DOCSVC_20161003.tar\DOCSVC_20161003\Sect2\INPATIENT\REQ_20160308-000017\Diaznegron, Ramon_2016-08-09-14.25.26.244.tif
Request;20160308-000017;59420;SELECT;Inpatient;SELECT;C:\Users\FGuo\Documents\work doucment\attachment\attachmentDB\20161005\originalFileFromAerial\DOCSVC_20161003.tar\DOCSVC_20161003\Sect2\INPATIENT\REQ_20160308-000017\O_\Waters Place\Aerial\Medical Doc Rcvd\DiazNegron.R__PineValleyCenter___03.08.16_2016-03-08-10.57.01.433.tif
Request;20160308-000018;39633;PACE;Inpatient;PACE;C:\Users\FGuo\Documents\work doucment\attachment\attachmentDB\20161005\originalFileFromAerial\DOCSVC_20161003.tar\DOCSVC_20161003\Sect2\INPATIENT\REQ_20160308-000018\Weiner, Lillian  admission_2016-03-08-10.56.26.846.tif
Request;20160308-000018;39633;PACE;Inpatient;PACE;C:\Users\FGuo\Documents\work doucment\attachment\attachmentDB\20161005\originalFileFromAerial\DOCSVC_20161003.tar\DOCSVC_20161003\Sect2\INPATIENT\REQ_20160308-000018\WEINER, LILLIAN  STATEN ISLAND UNIVERSITY_2016-03-08-11.01.30.293.docx
Request;20160308-000018;39633;PACE;Inpatient;PACE;C:\Users\FGuo\Documents\work doucment\attachment\attachmentDB\20161005\originalFileFromAerial\DOCSVC_20161003.tar\DOCSVC_20161003\Sect2\INPATIENT\REQ_20160308-000018\WEINER, LILLIAN - UR_2016-03-16-16.17.55.484.pdf
Request;20160308-000019;23988;PACE;Inpatient;PACE;C:\Users\FGuo\Documents\work doucment\attachment\attachmentDB\20161005\originalFileFromAerial\DOCSVC_20161003.tar\DOCSVC_20161003\Sect2\INPATIENT\REQ_20160308-000019\PAULINO, LORENZO_HOSPICE_2016-03-08-11.12.43.11.tif
Request;20160308-000020;23415;PACE;Inpatient;PACE;C:\Users\FGuo\Documents\work doucment\attachment\attachmentDB\20161005\originalFileFromAerial\DOCSVC_20161003.tar\DOCSVC_20161003\Sect2\INPATIENT\REQ_20160308-000020\Destournelles, Marie  admission_2016-03-08-11.13.02.49.tif
Request;20160308-000020;23415;PACE;Inpatient;PACE;C:\Users\FGuo\Documents\work doucment\attachment\attachmentDB\20161005\originalFileFromAerial\DOCSVC_20161003.tar\DOCSVC_20161003\Sect2\INPATIENT\REQ_20160308-000020\Destournelles, Marie  kings county hospital_2016-03-08-11.17.27.781.docx
Request;20160308-000020;23415;PACE;Inpatient;PACE;C:\Users\FGuo\Documents\work doucment\attachment\attachmentDB\20161005\originalFileFromAerial\DOCSVC_20161003.tar\DOCSVC_20161003\Sect2\INPATIENT\REQ_20160308-000020\Destournelles, Marie - KINGS COUNTY HOSPITAL CENTER 8.24.16_2016-08-24-16.44.05.656.pdf
Request;20160308-000020;23415;PACE;Inpatient;PACE;C:\Users\FGuo\Documents\work doucment\attachment\attachmentDB\20161005\originalFileFromAerial\DOCSVC_20161003.tar\DOCSVC_20161003\Sect2\INPATIENT\REQ_20160308-000020\Destournelles, Marie_clinical_3-8-16_2016-03-10-17.18.39.288.pdf
Request;20160308-000033;57543;null;Inpatient;SELECT;C:\Users\FGuo\Documents\work doucment\attachment\attachmentDB\20161005\originalFileFromAerial\DOCSVC_20161003.tar\DOCSVC_20161003\Sect2\INPATIENT\REQ_20160308-000033\mildred dicostanza4516_2016-04-15-12.18.55.610.tif
Request;20160308-000033;57543;null;Inpatient;SELECT;C:\Users\FGuo\Documents\work doucment\attachment\attachmentDB\20161005\originalFileFromAerial\DOCSVC_20161003.tar\DOCSVC_20161003\Sect2\INPATIENT\REQ_20160308-000033\PORF Submission Dicostanzo, Mildred 57543  Received_2016-03-08-14.26.05.423.txt
Request;20160308-000035;26758;PACE;Inpatient;PACE;C:\Users\FGuo\Documents\work doucment\attachment\attachmentDB\20161005\originalFileFromAerial\DOCSVC_20161003.tar\DOCSVC_20161003\Sect2\INPATIENT\REQ_20160308-000035\O_\26758 SINGH, ROOKMIN UR REQ SHEET_2016-03-08-12.32.14.830.doc
Request;20160308-000035;26758;PACE;Inpatient;PACE;C:\Users\FGuo\Documents\work doucment\attachment\attachmentDB\20161005\originalFileFromAerial\DOCSVC_20161003.tar\DOCSVC_20161003\Sect2\INPATIENT\REQ_20160308-000035\Singh, Rookmin  - Montefiore Medical Center 8-18-16_2016-08-18-16.17.43.438.pdf
Request;20160308-000035;26758;PACE;Inpatient;PACE;C:\Users\FGuo\Documents\work doucment\attachment\attachmentDB\20161005\originalFileFromAerial\DOCSVC_20161003.tar\DOCSVC_20161003\Sect2\INPATIENT\REQ_20160308-000035\SINGH, ROOKMIN_3-10-16_2016-03-16-14.58.39.710.docx
Request;20160308-000035;26758;PACE;Inpatient;PACE;C:\Users\FGuo\Documents\work doucment\attachment\attachmentDB\20161005\originalFileFromAerial\DOCSVC_20161003.tar\DOCSVC_20161003\Sect2\INPATIENT\REQ_20160308-000035\Singh, rookmin_3-7-16_2016-03-16-15.08.34.410.tif
Request;20160308-000036;48684;PACE;Inpatient;PACE;C:\Users\FGuo\Documents\work doucment\attachment\attachmentDB\20161005\originalFileFromAerial\DOCSVC_20161003.tar\DOCSVC_20161003\Sect2\INPATIENT\REQ_20160308-000036\G_\Genis\Bronx\Hinson, Olethia 48684- Clinicals_2016-03-08-13.14.21.862.TIF
Request;20160308-000036;48684;PACE;Inpatient;PACE;C:\Users\FGuo\Documents\work doucment\attachment\attachmentDB\20161005\originalFileFromAerial\DOCSVC_20161003.tar\DOCSVC_20161003\Sect2\INPATIENT\REQ_20160308-000036\Hinson Olethia  IP Denial Montefiore Medical Center 3-15-16_2016-03-15-15.14.36.930.pdf
Request;20160308-000036;48684;PACE;Inpatient;PACE;C:\Users\FGuo\Documents\work doucment\attachment\attachmentDB\20161005\originalFileFromAerial\DOCSVC_20161003.tar\DOCSVC_20161003\Sect2\INPATIENT\REQ_20160308-000036\HINSON, OLETHIA_042516_2016-05-20-14.34.09.845.pdf
Request;20160308-000036;48684;PACE;Inpatient;PACE;C:\Users\FGuo\Documents\work doucment\attachment\attachmentDB\20161005\originalFileFromAerial\DOCSVC_20161003.tar\DOCSVC_20161003\Sect2\INPATIENT\REQ_20160308-000036\O_\48684 HINSON, OLETHIA UR REQ SHEET_2016-03-08-12.38.47.931.doc
Request;20160308-000037;54907;PACE;Inpatient;PACE;C:\Users\FGuo\Documents\work doucment\attachment\attachmentDB\20161005\originalFileFromAerial\DOCSVC_20161003.tar\DOCSVC_20161003\Sect2\INPATIENT\REQ_20160308-000037\O_\54907 WEEKES JR, DODBROOK APPROVAL LTR_2016-03-17-09.34.58.812.docx
Request;20160308-000037;54907;PACE;Inpatient;PACE;C:\Users\FGuo\Documents\work doucment\attachment\attachmentDB\20161005\originalFileFromAerial\DOCSVC_20161003.tar\DOCSVC_20161003\Sect2\INPATIENT\REQ_20160308-000037\O_\54907 WEEKES JR, DODBROOK UR REQ SHEET_2016-03-08-12.53.23.960.doc
Request;20160308-000037;54907;PACE;Inpatient;PACE;C:\Users\FGuo\Documents\work doucment\attachment\attachmentDB\20161005\originalFileFromAerial\DOCSVC_20161003.tar\DOCSVC_20161003\Sect2\INPATIENT\REQ_20160308-000037\Weekes Jr, D 54907_2016-03-11-12.31.07.465.tif
Request;20160308-000040;74644;PACE;Inpatient;PACE;C:\Users\FGuo\Documents\work doucment\attachment\attachmentDB\20161005\originalFileFromAerial\DOCSVC_20161003.tar\DOCSVC_20161003\Sect2\INPATIENT\REQ_20160308-000040\O_\74644 PAUL, MARTHA ALBERTA UR REQ SHEET_2016-03-08-13.27.17.358.doc
Request;20160308-000040;74644;PACE;Inpatient;PACE;C:\Users\FGuo\Documents\work doucment\attachment\attachmentDB\20161005\originalFileFromAerial\DOCSVC_20161003.tar\DOCSVC_20161003\Sect2\INPATIENT\REQ_20160308-000040\PAUL, MARTHA ALBERTA - ADMISSION_2016-03-09-10.23.21.871.pdf
Request;20160308-000040;74644;PACE;Inpatient;PACE;C:\Users\FGuo\Documents\work doucment\attachment\attachmentDB\20161005\originalFileFromAerial\DOCSVC_20161003.tar\DOCSVC_20161003\Sect2\INPATIENT\REQ_20160308-000040\PAUL, MARTHA ALBERTA - CLINICAL_2016-03-09-10.28.47.604.pdf
Request;20160308-000043;57199;null;Inpatient;PACE;C:\Users\FGuo\Documents\work doucment\attachment\attachmentDB\20161005\originalFileFromAerial\DOCSVC_20161003.tar\DOCSVC_20161003\Sect2\INPATIENT\REQ_20160308-000043\Luna, Altagracia Risk Managment note 3-4-16_2016-03-08-16.49.51.458.pdf
Request;20160308-000051;43490;PACE;Inpatient;PACE;C:\Users\FGuo\Documents\work doucment\attachment\attachmentDB\20161005\originalFileFromAerial\DOCSVC_20161003.tar\DOCSVC_20161003\Sect2\INPATIENT\REQ_20160308-000051\Donovan Katherine IP Denial Staten Island University Hospital 3-23-16_2016-03-23-12.33.28.177.pdf
Request;20160308-000051;43490;PACE;Inpatient;PACE;C:\Users\FGuo\Documents\work doucment\attachment\attachmentDB\20161005\originalFileFromAerial\DOCSVC_20161003.tar\DOCSVC_20161003\Sect2\INPATIENT\REQ_20160308-000051\DONOVAN, KATHERINE - 3RD CLINICAL REVIEW REQUEST_2016-03-18-10.02.08.4.doc
Request;20160308-000051;43490;PACE;Inpatient;PACE;C:\Users\FGuo\Documents\work doucment\attachment\attachmentDB\20161005\originalFileFromAerial\DOCSVC_20161003.tar\DOCSVC_20161003\Sect2\INPATIENT\REQ_20160308-000051\DONOVAN, KATHERINE - CLINICAL REVIEW REQUEST_2016-03-16-16.36.13.367.doc
Request;20160308-000051;43490;PACE;Inpatient;PACE;C:\Users\FGuo\Documents\work doucment\attachment\attachmentDB\20161005\originalFileFromAerial\DOCSVC_20161003.tar\DOCSVC_20161003\Sect2\INPATIENT\REQ_20160308-000051\DONOVAN_KATHERINE_1OF3_041516  _2016-05-24-12.38.42.373.pdf
Request;20160308-000051;43490;PACE;Inpatient;PACE;C:\Users\FGuo\Documents\work doucment\attachment\attachmentDB\20161005\originalFileFromAerial\DOCSVC_20161003.tar\DOCSVC_20161003\Sect2\INPATIENT\REQ_20160308-000051\DONOVAN_KATHERINE_3OF3_041516  _2016-05-24-12.39.06.864.pdf
Request;20160308-000051;43490;PACE;Inpatient;PACE;C:\Users\FGuo\Documents\work doucment\attachment\attachmentDB\20161005\originalFileFromAerial\DOCSVC_20161003.tar\DOCSVC_20161003\Sect2\INPATIENT\REQ_20160308-000051\DOVOVAN, KATHERINE CLINICAL REVIEW REQUEST FORM_2016-03-08-15.24.45.77.doc
Request;20160308-000051;43490;PACE;Inpatient;PACE;C:\Users\FGuo\Documents\work doucment\attachment\attachmentDB\20161005\originalFileFromAerial\DOCSVC_20161003.tar\DOCSVC_20161003\Sect2\INPATIENT\REQ_20160308-000051\KDonovan_2016-03-21-13.20.45.374.tif
Request;20160308-000052;70139;PACE;Inpatient;PACE;C:\Users\FGuo\Documents\work doucment\attachment\attachmentDB\20161005\originalFileFromAerial\DOCSVC_20161003.tar\DOCSVC_20161003\Sect2\INPATIENT\REQ_20160308-000052\ESTHER ROSARIO31016_2016-03-10-16.52.17.484.tif
Request;20160308-000052;70139;PACE;Inpatient;PACE;C:\Users\FGuo\Documents\work doucment\attachment\attachmentDB\20161005\originalFileFromAerial\DOCSVC_20161003.tar\DOCSVC_20161003\Sect2\INPATIENT\REQ_20160308-000052\Rosario Esther IP Denial The Presbyterian Hospital 3-16-16_2016-03-16-11.18.53.608.pdf
Request;20160308-000052;70139;PACE;Inpatient;PACE;C:\Users\FGuo\Documents\work doucment\attachment\attachmentDB\20161005\originalFileFromAerial\DOCSVC_20161003.tar\DOCSVC_20161003\Sect2\INPATIENT\REQ_20160308-000052\ROSARIO, ESTHER - CLINICAL REVIEW REQUEST FORM_2016-03-08-15.51.43.297.doc
Request;20160308-000052;70139;PACE;Inpatient;PACE;C:\Users\FGuo\Documents\work doucment\attachment\attachmentDB\20161005\originalFileFromAerial\DOCSVC_20161003.tar\DOCSVC_20161003\Sect2\INPATIENT\REQ_20160308-000052\ROSARIO_ESTHER_041216_2016-05-23-10.43.48.167.pdf
Request;20160308-000053;53652;DIRECT;Inpatient;DIRECT;C:\Users\FGuo\Documents\work doucment\attachment\attachmentDB\20161005\originalFileFromAerial\DOCSVC_20161003.tar\DOCSVC_20161003\Sect2\INPATIENT\REQ_20160308-000053\Jenkins, Lorenzo - New York Methodist Hospital 8-11-16_2016-08-11-15.44.34.808.pdf
Request;20160308-000053;53652;DIRECT;Inpatient;DIRECT;C:\Users\FGuo\Documents\work doucment\attachment\attachmentDB\20161005\originalFileFromAerial\DOCSVC_20161003.tar\DOCSVC_20161003\Sect2\INPATIENT\REQ_20160308-000053\Jenkins, Lorenzo_clinical_3-9-16_2016-03-10-16.56.00.551.pdf
Request;20160308-000053;53652;DIRECT;Inpatient;DIRECT;C:\Users\FGuo\Documents\work doucment\attachment\attachmentDB\20161005\originalFileFromAerial\DOCSVC_20161003.tar\DOCSVC_20161003\Sect2\INPATIENT\REQ_20160308-000053\O_\53652 JENKINS, LORENZO UR REQ SHEET_2016-03-08-15.24.31.723.doc
Request;20160308-000054;26432;PACE;Inpatient;PACE;C:\Users\FGuo\Documents\work doucment\attachment\attachmentDB\20161005\originalFileFromAerial\DOCSVC_20161003.tar\DOCSVC_20161003\Sect2\INPATIENT\REQ_20160308-000054\KUMAR, SHANTA - UR_2016-03-08-15.34.38.801.pdf
Request;20160308-000054;26432;PACE;Inpatient;PACE;C:\Users\FGuo\Documents\work doucment\attachment\attachmentDB\20161005\originalFileFromAerial\DOCSVC_20161003.tar\DOCSVC_20161003\Sect2\INPATIENT\REQ_20160308-000054\Kumari Shanta  IP Denial Flushing Hospital Medical Center 3-15-16_2016-03-15-16.08.09.989.pdf
Request;20160308-000054;26432;PACE;Inpatient;PACE;C:\Users\FGuo\Documents\work doucment\attachment\attachmentDB\20161005\originalFileFromAerial\DOCSVC_20161003.tar\DOCSVC_20161003\Sect2\INPATIENT\REQ_20160308-000054\KUMARI, SHANTA_042716 _2016-05-25-16.32.59.629.pdf
Request;20160308-000054;26432;PACE;Inpatient;PACE;C:\Users\FGuo\Documents\work doucment\attachment\attachmentDB\20161005\originalFileFromAerial\DOCSVC_20161003.tar\DOCSVC_20161003\Sect2\INPATIENT\REQ_20160308-000054\SKumari_2016-03-10-11.56.31.852.tif
Request;20160308-000055;95921;PACE;Inpatient;PACE;C:\Users\FGuo\Documents\work doucment\attachment\attachmentDB\20161005\originalFileFromAerial\DOCSVC_20161003.tar\DOCSVC_20161003\Sect2\INPATIENT\REQ_20160308-000055\Ma, Yun Man - GOUVERNEUR HEALTHCARE SERVICES 8.23.16_2016-08-23-10.32.20.976.pdf
Request;20160308-000056;87384;PACE;Inpatient;PACE;C:\Users\FGuo\Documents\work doucment\attachment\attachmentDB\20161005\originalFileFromAerial\DOCSVC_20161003.tar\DOCSVC_20161003\Sect2\INPATIENT\REQ_20160308-000056\KANG, SOOK CHA - CLINICAL REVIEW REQUEST FORM_2016-03-08-15.59.56.294.doc
Request;20160308-000056;87384;PACE;Inpatient;PACE;C:\Users\FGuo\Documents\work doucment\attachment\attachmentDB\20161005\originalFileFromAerial\DOCSVC_20161003.tar\DOCSVC_20161003\Sect2\INPATIENT\REQ_20160308-000056\SCKang_2016-03-10-13.20.27.5.tif
Request;20160308-000059;31805;PACE;Inpatient;PACE;C:\Users\FGuo\Documents\work doucment\attachment\attachmentDB\20161005\originalFileFromAerial\DOCSVC_20161003.tar\DOCSVC_20161003\Sect2\INPATIENT\REQ_20160308-000059\Li, Mulan - FLUSHING MANOR CARE CENTER 8.23.16_2016-08-23-10.50.04.737.pdf
Request;20160308-000063;39189;PACE;Inpatient;PACE;C:\Users\FGuo\Documents\work doucment\attachment\attachmentDB\20161005\originalFileFromAerial\DOCSVC_20161003.tar\DOCSVC_20161003\Sect2\INPATIENT\REQ_20160308-000063\Khan, Jamilla - MARGARET TIETZ NURSING AND REHAB CTR 8.23.16_2016-08-23-11.02.48.654.pdf
Request;20160308-000064;43615;SELECT;Inpatient;SELECT;C:\Users\FGuo\Documents\work doucment\attachment\attachmentDB\20161005\originalFileFromAerial\DOCSVC_20161003.tar\DOCSVC_20161003\Sect2\INPATIENT\REQ_20160308-000064\Yancey, James J - NORTHERN MANOR MULTICARE CENTER 8.23.16_2016-08-23-11.15.07.778.pdf
Request;20160308-000064;43615;SELECT;Inpatient;SELECT;C:\Users\FGuo\Documents\work doucment\attachment\attachmentDB\20161005\originalFileFromAerial\DOCSVC_20161003.tar\DOCSVC_20161003\Sect2\INPATIENT\REQ_20160308-000064\Yancey, James J - NORTHERN MANOR MULTICARE CENTER 8.23.16_2016-08-23-11.17.17.348.pdf
Request;20160308-000064;43615;SELECT;Inpatient;SELECT;C:\Users\FGuo\Documents\work doucment\attachment\attachmentDB\20161005\originalFileFromAerial\DOCSVC_20161003.tar\DOCSVC_20161003\Sect2\INPATIENT\REQ_20160308-000064\YANCEY, JAMES_PRI.tif 2_2016-03-15-11.03.49.319.tif
Request;20160308-000064;43615;SELECT;Inpatient;SELECT;C:\Users\FGuo\Documents\work doucment\attachment\attachmentDB\20161005\originalFileFromAerial\DOCSVC_20161003.tar\DOCSVC_20161003\Sect2\INPATIENT\REQ_20160308-000064\YANCEY, JAMES_PRI_2016-03-08-16.56.14.896.tif
Request;20160309-000003;34296;SELECT;Inpatient;SELECT;C:\Users\FGuo\Documents\work doucment\attachment\attachmentDB\20161005\originalFileFromAerial\DOCSVC_20161003.tar\DOCSVC_20161003\Sect2\INPATIENT\REQ_20160309-000003\LAURA_PROGRESS NOTE_2016-03-21-09.43.54.613.tif
Request;20160309-000003;34296;SELECT;Inpatient;SELECT;C:\Users\FGuo\Documents\work doucment\attachment\attachmentDB\20161005\originalFileFromAerial\DOCSVC_20161003.tar\DOCSVC_20161003\Sect2\INPATIENT\REQ_20160309-000003\LAURA_PROGRESS NOTE_2016-03-21-09.45.10.383.tif
Request;20160309-000003;34296;SELECT;Inpatient;SELECT;C:\Users\FGuo\Documents\work doucment\attachment\attachmentDB\20161005\originalFileFromAerial\DOCSVC_20161003.tar\DOCSVC_20161003\Sect2\INPATIENT\REQ_20160309-000003\Trzaska, Laura A - FRIEDWALD CENTER FOR REHAB & NURING, LLC 8.23.16_2016-08-23-12.31.03.902.pdf
Request;20160309-000003;34296;SELECT;Inpatient;SELECT;C:\Users\FGuo\Documents\work doucment\attachment\attachmentDB\20161005\originalFileFromAerial\DOCSVC_20161003.tar\DOCSVC_20161003\Sect2\INPATIENT\REQ_20160309-000003\TRZASKA, LAURA_PRI_2016-03-09-09.47.21.381.tif
Request;20160309-000004;78840;PACE;Inpatient;PACE;C:\Users\FGuo\Documents\work doucment\attachment\attachmentDB\20161005\originalFileFromAerial\DOCSVC_20161003.tar\DOCSVC_20161003\Sect2\INPATIENT\REQ_20160309-000004\LTam_2016-03-25-11.30.03.501.tif
Request;20160309-000004;78840;PACE;Inpatient;PACE;C:\Users\FGuo\Documents\work doucment\attachment\attachmentDB\20161005\originalFileFromAerial\DOCSVC_20161003.tar\DOCSVC_20161003\Sect2\INPATIENT\REQ_20160309-000004\MR Tam,Lai 041316_2016-05-27-11.37.32.915.pdf
Request;20160309-000004;78840;PACE;Inpatient;PACE;C:\Users\FGuo\Documents\work doucment\attachment\attachmentDB\20161005\originalFileFromAerial\DOCSVC_20161003.tar\DOCSVC_20161003\Sect2\INPATIENT\REQ_20160309-000004\Tam Lai IP Denial NY Hospital Medical Center Queens 3-25-16_2016-03-25-15.57.00.121.pdf
Request;20160309-000004;78840;PACE;Inpatient;PACE;C:\Users\FGuo\Documents\work doucment\attachment\attachmentDB\20161005\originalFileFromAerial\DOCSVC_20161003.tar\DOCSVC_20161003\Sect2\INPATIENT\REQ_20160309-000004\TAM, LAI - CLINICAL REVEIW REQUEST_2016-03-16-16.53.41.420.tif
Request;20160309-000004;78840;PACE;Inpatient;PACE;C:\Users\FGuo\Documents\work doucment\attachment\attachmentDB\20161005\originalFileFromAerial\DOCSVC_20161003.tar\DOCSVC_20161003\Sect2\INPATIENT\REQ_20160309-000004\Tam, Lai - NY Presbyterian-Queens Clinical Review Request Form 3-9-16_2016-03-09-09.48.07.816.docx
Request;20160309-000004;78840;PACE;Inpatient;PACE;C:\Users\FGuo\Documents\work doucment\attachment\attachmentDB\20161005\originalFileFromAerial\DOCSVC_20161003.tar\DOCSVC_20161003\Sect2\INPATIENT\REQ_20160309-000004\TAM_LAI_041316_2016-05-27-11.34.17.635.pdf
Request;20160309-000008;61119;SELECT;Inpatient;SELECT;C:\Users\FGuo\Documents\work doucment\attachment\attachmentDB\20161005\originalFileFromAerial\DOCSVC_20161003.tar\DOCSVC_20161003\Sect2\INPATIENT\REQ_20160309-000008\Mancini, Estelle - Methodist Church Home 8.18.16_2016-08-18-09.47.33.438.pdf
Request;20160309-000008;61119;SELECT;Inpatient;SELECT;C:\Users\FGuo\Documents\work doucment\attachment\attachmentDB\20161005\originalFileFromAerial\DOCSVC_20161003.tar\DOCSVC_20161003\Sect2\INPATIENT\REQ_20160309-000008\O_\Mancini Estelle 2-1-16_2016-03-09-10.15.41.774.tif
Request;20160309-000010;38309;SELECT;Inpatient;SELECT;C:\Users\FGuo\Documents\work doucment\attachment\attachmentDB\20161005\originalFileFromAerial\DOCSVC_20161003.tar\DOCSVC_20161003\Sect2\INPATIENT\REQ_20160309-000010\erich krieger 3816_2016-03-09-10.18.17.303.tif
Request;20160309-000010;38309;SELECT;Inpatient;SELECT;C:\Users\FGuo\Documents\work doucment\attachment\attachmentDB\20161005\originalFileFromAerial\DOCSVC_20161003.tar\DOCSVC_20161003\Sect2\INPATIENT\REQ_20160309-000010\erich krieger32216_2016-03-23-10.20.05.296.tif
Request;20160309-000010;38309;SELECT;Inpatient;SELECT;C:\Users\FGuo\Documents\work doucment\attachment\attachmentDB\20161005\originalFileFromAerial\DOCSVC_20161003.tar\DOCSVC_20161003\Sect2\INPATIENT\REQ_20160309-000010\Krieger, Erich 38309 NOTIFICATION OF SNF COPAY 2015_2016-03-09-10.33.44.345.doc
Request;20160309-000020;97989;PACE;Inpatient;PACE;C:\Users\FGuo\Documents\work doucment\attachment\attachmentDB\20161005\originalFileFromAerial\DOCSVC_20161003.tar\DOCSVC_20161003\Sect2\INPATIENT\REQ_20160309-000020\green sinclair 31616_2016-03-16-14.17.41.457.tif
Request;20160309-000020;97989;PACE;Inpatient;PACE;C:\Users\FGuo\Documents\work doucment\attachment\attachmentDB\20161005\originalFileFromAerial\DOCSVC_20161003.tar\DOCSVC_20161003\Sect2\INPATIENT\REQ_20160309-000020\Green, Sinclair  - Mt Sinai Hospital 8-18-16_2016-08-18-16.04.04.123.pdf
Request;20160309-000030;52987;PACE;Inpatient;PACE;C:\Users\FGuo\Documents\work doucment\attachment\attachmentDB\20161005\originalFileFromAerial\DOCSVC_20161003.tar\DOCSVC_20161003\Sect2\INPATIENT\REQ_20160309-000030\Hall, Billy J - Kingsbrook Jewish Medical Center 8-17-16_2016-08-17-15.50.40.52.pdf
Request;20160309-000030;52987;PACE;Inpatient;PACE;C:\Users\FGuo\Documents\work doucment\attachment\attachmentDB\20161005\originalFileFromAerial\DOCSVC_20161003.tar\DOCSVC_20161003\Sect2\INPATIENT\REQ_20160309-000030\Hall, Billy_acute rehab notes_3-10-16_2016-03-14-11.20.44.367.pdf
Request;20160309-000030;52987;PACE;Inpatient;PACE;C:\Users\FGuo\Documents\work doucment\attachment\attachmentDB\20161005\originalFileFromAerial\DOCSVC_20161003.tar\DOCSVC_20161003\Sect2\INPATIENT\REQ_20160309-000030\Hall, Billy_Rehab consult-PT eval_3--8-16_2016-03-09-12.07.12.390.pdf
Request;20160309-000032;28230;PACE;Inpatient;PACE;C:\Users\FGuo\Documents\work doucment\attachment\attachmentDB\20161005\originalFileFromAerial\DOCSVC_20161003.tar\DOCSVC_20161003\Sect2\INPATIENT\REQ_20160309-000032\daniels margie3716_2016-03-10-09.33.22.376.tif
Request;20160309-000032;28230;PACE;Inpatient;PACE;C:\Users\FGuo\Documents\work doucment\attachment\attachmentDB\20161005\originalFileFromAerial\DOCSVC_20161003.tar\DOCSVC_20161003\Sect2\INPATIENT\REQ_20160309-000032\Daniels, Margie - Harlem Hospital---Clinical Review Request Form 3-9-16_2016-03-09-12.14.00.910.docx
Request;20160309-000033;43593;SELECT;Inpatient;SELECT;C:\Users\FGuo\Documents\work doucment\attachment\attachmentDB\20161005\originalFileFromAerial\DOCSVC_20161003.tar\DOCSVC_20161003\Sect2\INPATIENT\REQ_20160309-000033\Cantres, Juanita - Cobble Hill Health Center (Auth 20160309-000033 ) 3.9.16_2016-03-09-14.25.52.204.pdf
Request;20160309-000035;77505;PACE;Inpatient;PACE;C:\Users\FGuo\Documents\work doucment\attachment\attachmentDB\20161005\originalFileFromAerial\DOCSVC_20161003.tar\DOCSVC_20161003\Sect2\INPATIENT\REQ_20160309-000035\Groce, Florence  brookdale hospital_2016-03-10-13.18.34.937.doc
Request;20160309-000035;77505;PACE;Inpatient;PACE;C:\Users\FGuo\Documents\work doucment\attachment\attachmentDB\20161005\originalFileFromAerial\DOCSVC_20161003.tar\DOCSVC_20161003\Sect2\INPATIENT\REQ_20160309-000035\Groce, florence- Brookdale Hospital Medical Center  3-14-16_2016-03-14-17.10.00.927.docx
Request;20160309-000035;77505;PACE;Inpatient;PACE;C:\Users\FGuo\Documents\work doucment\attachment\attachmentDB\20161005\originalFileFromAerial\DOCSVC_20161003.tar\DOCSVC_20161003\Sect2\INPATIENT\REQ_20160309-000035\Groce, Florence_Clinical_3-10-16_2016-03-11-16.24.21.752.pdf
Request;20160309-000035;77505;PACE;Inpatient;PACE;C:\Users\FGuo\Documents\work doucment\attachment\attachmentDB\20161005\originalFileFromAerial\DOCSVC_20161003.tar\DOCSVC_20161003\Sect2\INPATIENT\REQ_20160309-000035\O_\77505 GROCE, FLORENCE UR REQ SHEET_2016-03-09-12.19.19.780.doc
Request;20160309-000037;70974;PACE;Inpatient;PACE;C:\Users\FGuo\Documents\work doucment\attachment\attachmentDB\20161005\originalFileFromAerial\DOCSVC_20161003.tar\DOCSVC_20161003\Sect2\INPATIENT\REQ_20160309-000037\Cabrera, D 70974 3-9-16_2016-03-11-09.58.09.364.tif
Request;20160309-000037;70974;PACE;Inpatient;PACE;C:\Users\FGuo\Documents\work doucment\attachment\attachmentDB\20161005\originalFileFromAerial\DOCSVC_20161003.tar\DOCSVC_20161003\Sect2\INPATIENT\REQ_20160309-000037\Cabrera, Digna - MONTEFIORE MEDICAL CENTER 8.25.16_2016-08-25-09.13.39.281.pdf
Request;20160309-000037;70974;PACE;Inpatient;PACE;C:\Users\FGuo\Documents\work doucment\attachment\attachmentDB\20161005\originalFileFromAerial\DOCSVC_20161003.tar\DOCSVC_20161003\Sect2\INPATIENT\REQ_20160309-000037\CABRERA, DIGNA_3-10-16_2016-03-11-12.45.37.569.pdf
Request;20160309-000037;70974;PACE;Inpatient;PACE;C:\Users\FGuo\Documents\work doucment\attachment\attachmentDB\20161005\originalFileFromAerial\DOCSVC_20161003.tar\DOCSVC_20161003\Sect2\INPATIENT\REQ_20160309-000037\Cabrera.Digna__No 70974__ Montefiore MC Weiler__UR__Rcvd 03.24.16__ 05.06.16_2016-05-06-09.31.30.887.tif
Request;20160309-000037;70974;PACE;Inpatient;PACE;C:\Users\FGuo\Documents\work doucment\attachment\attachmentDB\20161005\originalFileFromAerial\DOCSVC_20161003.tar\DOCSVC_20161003\Sect2\INPATIENT\REQ_20160309-000037\Cabrera.Digna__no. 70974__ MMC Weiler__UR__Rcvd 03.17.16___05.06.16_2016-05-06-09.31.15.101.tif
Request;20160309-000037;70974;PACE;Inpatient;PACE;C:\Users\FGuo\Documents\work doucment\attachment\attachmentDB\20161005\originalFileFromAerial\DOCSVC_20161003.tar\DOCSVC_20161003\Sect2\INPATIENT\REQ_20160309-000037\Cabrera.Digna__No. 70974__ MMC_ Weiler__Rcvd 04.07.16___05.06.16_2016-05-06-09.34.28.898.tif
Request;20160309-000037;70974;PACE;Inpatient;PACE;C:\Users\FGuo\Documents\work doucment\attachment\attachmentDB\20161005\originalFileFromAerial\DOCSVC_20161003.tar\DOCSVC_20161003\Sect2\INPATIENT\REQ_20160309-000037\O_\70974 CABRERA, DIGNA UR REQ SHEET_2016-03-09-12.36.20.437.doc
Request;20160309-000040;31970;PACE;Inpatient;PACE;C:\Users\FGuo\Documents\work doucment\attachment\attachmentDB\20161005\originalFileFromAerial\DOCSVC_20161003.tar\DOCSVC_20161003\Sect2\INPATIENT\REQ_20160309-000040\APerdomo_2016-03-14-10.47.27.577.tif
Request;20160309-000040;31970;PACE;Inpatient;PACE;C:\Users\FGuo\Documents\work doucment\attachment\attachmentDB\20161005\originalFileFromAerial\DOCSVC_20161003.tar\DOCSVC_20161003\Sect2\INPATIENT\REQ_20160309-000040\Perdomo Alcira -  IP Denial Jamaica Hospital Medical Center  3-16-16_2016-03-16-16.37.12.599.pdf
Request;20160309-000040;31970;PACE;Inpatient;PACE;C:\Users\FGuo\Documents\work doucment\attachment\attachmentDB\20161005\originalFileFromAerial\DOCSVC_20161003.tar\DOCSVC_20161003\Sect2\INPATIENT\REQ_20160309-000040\PERDOMO, ALCIRA - ADMISSION_2016-03-10-14.42.03.242.pdf
Request;20160309-000040;31970;PACE;Inpatient;PACE;C:\Users\FGuo\Documents\work doucment\attachment\attachmentDB\20161005\originalFileFromAerial\DOCSVC_20161003.tar\DOCSVC_20161003\Sect2\INPATIENT\REQ_20160309-000040\PERDOMO, ALCIRA - CLINICAL REVIEW REQUEST FORM_2016-03-09-14.00.20.492.doc
Request;20160309-000040;31970;PACE;Inpatient;PACE;C:\Users\FGuo\Documents\work doucment\attachment\attachmentDB\20161005\originalFileFromAerial\DOCSVC_20161003.tar\DOCSVC_20161003\Sect2\INPATIENT\REQ_20160309-000040\PERDOMO, ALCIRA - UR_2016-03-16-16.26.05.582.pdf
Request;20160309-000042;43593;SELECT;Inpatient;SELECT;C:\Users\FGuo\Documents\work doucment\attachment\attachmentDB\20161005\originalFileFromAerial\DOCSVC_20161003.tar\DOCSVC_20161003\Sect2\INPATIENT\REQ_20160309-000042\Cantres, Juanita - COBBLE HILL HEALTH CENTER 8.23.16_2016-08-23-15.31.15.1.pdf
Request;20160309-000043;54906;SELECT;Inpatient;SELECT;C:\Users\FGuo\Documents\work doucment\attachment\attachmentDB\20161005\originalFileFromAerial\DOCSVC_20161003.tar\DOCSVC_20161003\Sect2\INPATIENT\REQ_20160309-000043\franklin james pri and pt_2016-03-09-13.42.07.167.tif
Request;20160309-000043;54906;SELECT;Inpatient;SELECT;C:\Users\FGuo\Documents\work doucment\attachment\attachmentDB\20161005\originalFileFromAerial\DOCSVC_20161003.tar\DOCSVC_20161003\Sect2\INPATIENT\REQ_20160309-000043\Franklin, James - COBBLE HILL HEALTH CENTER 8.23.16_2016-08-23-15.43.16.260.pdf
Request;20160309-000043;54906;SELECT;Inpatient;SELECT;C:\Users\FGuo\Documents\work doucment\attachment\attachmentDB\20161005\originalFileFromAerial\DOCSVC_20161003.tar\DOCSVC_20161003\Sect2\INPATIENT\REQ_20160309-000043\JF Clinicals 4.29.16_2016-05-02-12.03.14.24.TIF
Request;20160309-000043;54906;SELECT;Inpatient;SELECT;C:\Users\FGuo\Documents\work doucment\attachment\attachmentDB\20161005\originalFileFromAerial\DOCSVC_20161003.tar\DOCSVC_20161003\Sect2\INPATIENT\REQ_20160309-000043\JF Discharge Summary 5.2.16_2016-05-02-12.03.42.81.TIF
Request;20160309-000044;78412;SELECT;Inpatient;SELECT;C:\Users\FGuo\Documents\work doucment\attachment\attachmentDB\20161005\originalFileFromAerial\DOCSVC_20161003.tar\DOCSVC_20161003\Sect2\INPATIENT\REQ_20160309-000044\FYeung_2016-03-09-14.19.42.255.tif
Request;20160309-000048;33606;DIRECT;Inpatient;DIRECT;C:\Users\FGuo\Documents\work doucment\attachment\attachmentDB\20161005\originalFileFromAerial\DOCSVC_20161003.tar\DOCSVC_20161003\Sect2\INPATIENT\REQ_20160309-000048\Torres Jose - Montefiore Medical Center  3-9-16_2016-03-09-14.29.13.759.pdf
Request;20160309-000048;33606;DIRECT;Inpatient;DIRECT;C:\Users\FGuo\Documents\work doucment\attachment\attachmentDB\20161005\originalFileFromAerial\DOCSVC_20161003.tar\DOCSVC_20161003\Sect2\INPATIENT\REQ_20160309-000048\Torres, J 33606_2016-03-11-12.34.07.553.tif
Request;20160309-000048;33606;DIRECT;Inpatient;DIRECT;C:\Users\FGuo\Documents\work doucment\attachment\attachmentDB\20161005\originalFileFromAerial\DOCSVC_20161003.tar\DOCSVC_20161003\Sect2\INPATIENT\REQ_20160309-000048\Torres, Jose - Montefiore MC Weiler - Center Approval Letter 3-16-16_2016-03-16-12.17.06.74.docx
Request;20160309-000051;53009;SELECT;Inpatient;SELECT;C:\Users\FGuo\Documents\work doucment\attachment\attachmentDB\20161005\originalFileFromAerial\DOCSVC_20161003.tar\DOCSVC_20161003\Sect2\INPATIENT\REQ_20160309-000051\Fratto, Tommasina_PRI 2_2016-03-10-09.29.23.669.tif
Request;20160309-000054;49208;PACE;Inpatient;PACE;C:\Users\FGuo\Documents\work doucment\attachment\attachmentDB\20161005\originalFileFromAerial\DOCSVC_20161003.tar\DOCSVC_20161003\Sect2\INPATIENT\REQ_20160309-000054\gloria rodriguez31416_2016-03-14-17.04.58.784.tif
Request;20160309-000054;49208;PACE;Inpatient;PACE;C:\Users\FGuo\Documents\work doucment\attachment\attachmentDB\20161005\originalFileFromAerial\DOCSVC_20161003.tar\DOCSVC_20161003\Sect2\INPATIENT\REQ_20160309-000054\gloria rodriguez32116_2016-03-21-13.08.49.400.tif
Request;20160309-000054;49208;PACE;Inpatient;PACE;C:\Users\FGuo\Documents\work doucment\attachment\attachmentDB\20161005\originalFileFromAerial\DOCSVC_20161003.tar\DOCSVC_20161003\Sect2\INPATIENT\REQ_20160309-000054\maria rodriguez 32816_2016-03-28-11.01.48.716.tif
Request;20160309-000054;49208;PACE;Inpatient;PACE;C:\Users\FGuo\Documents\work doucment\attachment\attachmentDB\20161005\originalFileFromAerial\DOCSVC_20161003.tar\DOCSVC_20161003\Sect2\INPATIENT\REQ_20160309-000054\Rodriguez, Gloria I - WORKMEN'S CIRCLE HOME 8.23.16_2016-08-23-16.05.12.756.pdf
Request;20160309-000054;49208;PACE;Inpatient;PACE;C:\Users\FGuo\Documents\work doucment\attachment\attachmentDB\20161005\originalFileFromAerial\DOCSVC_20161003.tar\DOCSVC_20161003\Sect2\INPATIENT\REQ_20160309-000054\RODRIGUEZ, GLORIA _PRI_2016-03-09-14.59.56.681.tif
Request;20160309-000054;49208;PACE;Inpatient;PACE;C:\Users\FGuo\Documents\work doucment\attachment\attachmentDB\20161005\originalFileFromAerial\DOCSVC_20161003.tar\DOCSVC_20161003\Sect2\INPATIENT\REQ_20160309-000054\Rodriguez, Gloria_2016-06-06-16.07.48.837.tif
Request;20160309-000058;54438;PACE;Inpatient;PACE;C:\Users\FGuo\Documents\work doucment\attachment\attachmentDB\20161005\originalFileFromAerial\DOCSVC_20161003.tar\DOCSVC_20161003\Sect2\INPATIENT\REQ_20160309-000058\alexander vivian31816_2016-03-21-13.21.26.527.tif
Request;20160309-000058;54438;PACE;Inpatient;PACE;C:\Users\FGuo\Documents\work doucment\attachment\attachmentDB\20161005\originalFileFromAerial\DOCSVC_20161003.tar\DOCSVC_20161003\Sect2\INPATIENT\REQ_20160309-000058\Alexander, Vivian_3-7-116.docx PRI_2016-03-09-15.10.35.299.pdf
Request;20160309-000059;56912;SELECT;Inpatient;DIRECT/SELECT LT;C:\Users\FGuo\Documents\work doucment\attachment\attachmentDB\20161005\originalFileFromAerial\DOCSVC_20161003.tar\DOCSVC_20161003\Sect2\INPATIENT\REQ_20160309-000059\RJ Finch, P 56912 3-1-16_2016-03-09-15.10.21.267.tif
Request;20160309-000059;56912;SELECT;Inpatient;DIRECT/SELECT LT;C:\Users\FGuo\Documents\work doucment\attachment\attachmentDB\20161005\originalFileFromAerial\DOCSVC_20161003.tar\DOCSVC_20161003\Sect2\INPATIENT\REQ_20160309-000059\RJ Finch, P 56912 3-1-16_2016-03-09-15.17.18.794.tif
Request;20160309-000063;41303;SELECT;Inpatient;SELECT;C:\Users\FGuo\Documents\work doucment\attachment\attachmentDB\20161005\originalFileFromAerial\DOCSVC_20161003.tar\DOCSVC_20161003\Sect2\INPATIENT\REQ_20160309-000063\ANDREW, GOODEN_PRI_2016-03-09-15.36.21.220.pdf
Request;20160309-000063;41303;SELECT;Inpatient;SELECT;C:\Users\FGuo\Documents\work doucment\attachment\attachmentDB\20161005\originalFileFromAerial\DOCSVC_20161003.tar\DOCSVC_20161003\Sect2\INPATIENT\REQ_20160309-000063\ANDREW, GOODEN_PROGRESS_2016-04-01-11.01.53.831.tif
Request;20160309-000063;41303;SELECT;Inpatient;SELECT;C:\Users\FGuo\Documents\work doucment\attachment\attachmentDB\20161005\originalFileFromAerial\DOCSVC_20161003.tar\DOCSVC_20161003\Sect2\INPATIENT\REQ_20160309-000063\Gooden, Andrew - BETH ABRAHAM HEALTH SERVICES 8.23.16_2016-08-23-16.28.08.612.pdf
Request;20160309-000065;57732;null;Inpatient;SELECT;C:\Users\FGuo\Documents\work doucment\attachment\attachmentDB\20161005\originalFileFromAerial\DOCSVC_20161003.tar\DOCSVC_20161003\Sect2\INPATIENT\REQ_20160309-000065\JOSPEH  PIZZARRO_2016-06-07-12.21.01.810.tif
Request;20160309-000065;57732;null;Inpatient;SELECT;C:\Users\FGuo\Documents\work doucment\attachment\attachmentDB\20161005\originalFileFromAerial\DOCSVC_20161003.tar\DOCSVC_20161003\Sect2\INPATIENT\REQ_20160309-000065\Pizzarro, Joseph - Sea View Hospital Rehabilitation Center & Home - 5.26.16_2016-05-26-12.02.34.576.pdf
Request;20160309-000065;57732;null;Inpatient;SELECT;C:\Users\FGuo\Documents\work doucment\attachment\attachmentDB\20161005\originalFileFromAerial\DOCSVC_20161003.tar\DOCSVC_20161003\Sect2\INPATIENT\REQ_20160309-000065\RJ Pizzarro, J 57732 3-1-16_2016-03-09-15.23.33.607.tif
Request;20160309-000065;57732;null;Inpatient;SELECT;C:\Users\FGuo\Documents\work doucment\attachment\attachmentDB\20161005\originalFileFromAerial\DOCSVC_20161003.tar\DOCSVC_20161003\Sect2\INPATIENT\REQ_20160309-000065\_2016-06-07-12.20.12.750
Request;20160309-000066;74205;PACE;Inpatient;PACE;C:\Users\FGuo\Documents\work doucment\attachment\attachmentDB\20161005\originalFileFromAerial\DOCSVC_20161003.tar\DOCSVC_20161003\Sect2\INPATIENT\REQ_20160309-000066\O_\74205 VARGAS, GLADYS APPROVAL LTR_2016-03-17-10.24.01.634.docx
Request;20160309-000066;74205;PACE;Inpatient;PACE;C:\Users\FGuo\Documents\work doucment\attachment\attachmentDB\20161005\originalFileFromAerial\DOCSVC_20161003.tar\DOCSVC_20161003\Sect2\INPATIENT\REQ_20160309-000066\O_\74205 VARGAS, GLADYS UR REQ SHEET_2016-03-09-15.22.13.803.doc
Request;20160309-000066;74205;PACE;Inpatient;PACE;C:\Users\FGuo\Documents\work doucment\attachment\attachmentDB\20161005\originalFileFromAerial\DOCSVC_20161003.tar\DOCSVC_20161003\Sect2\INPATIENT\REQ_20160309-000066\Vargars, gladys_3-14-16_2016-03-14-12.45.55.761.pdf
Request;20160309-000068;26442;PACE;Inpatient;PACE;C:\Users\FGuo\Documents\work doucment\attachment\attachmentDB\20161005\originalFileFromAerial\DOCSVC_20161003.tar\DOCSVC_20161003\Sect2\INPATIENT\REQ_20160309-000068\Evans Sarah  IP Denial Flushing Hospital Medical Center 3-16-16_2016-03-16-13.56.47.969.pdf
Request;20160309-000068;26442;PACE;Inpatient;PACE;C:\Users\FGuo\Documents\work doucment\attachment\attachmentDB\20161005\originalFileFromAerial\DOCSVC_20161003.tar\DOCSVC_20161003\Sect2\INPATIENT\REQ_20160309-000068\Evans, Sarah  - Flushing Medical Center 4-7-16_2016-04-07-16.41.23.14.pdf
Request;20160309-000068;26442;PACE;Inpatient;PACE;C:\Users\FGuo\Documents\work doucment\attachment\attachmentDB\20161005\originalFileFromAerial\DOCSVC_20161003.tar\DOCSVC_20161003\Sect2\INPATIENT\REQ_20160309-000068\Evans, Sarah - FLUSHING HOSPITAL MEDICAL CTR 8.26.16_2016-08-26-12.02.31.690.pdf
Request;20160309-000068;26442;PACE;Inpatient;PACE;C:\Users\FGuo\Documents\work doucment\attachment\attachmentDB\20161005\originalFileFromAerial\DOCSVC_20161003.tar\DOCSVC_20161003\Sect2\INPATIENT\REQ_20160309-000068\O_\26442 EVANS, SARAH UR REQ SHEET_2016-03-09-15.30.06.414.doc
Request;20160309-000068;26442;PACE;Inpatient;PACE;C:\Users\FGuo\Documents\work doucment\attachment\attachmentDB\20161005\originalFileFromAerial\DOCSVC_20161003.tar\DOCSVC_20161003\Sect2\INPATIENT\REQ_20160309-000068\SEvans 31416_2016-03-15-14.49.16.673.tif
Request;20160309-000068;26442;PACE;Inpatient;PACE;C:\Users\FGuo\Documents\work doucment\attachment\attachmentDB\20161005\originalFileFromAerial\DOCSVC_20161003.tar\DOCSVC_20161003\Sect2\INPATIENT\REQ_20160309-000068\SEvans_2016-03-14-10.07.09.36.tif
Request;20160309-000070;39633;PACE;Inpatient;PACE;C:\Users\FGuo\Documents\work doucment\attachment\attachmentDB\20161005\originalFileFromAerial\DOCSVC_20161003.tar\DOCSVC_20161003\Sect2\INPATIENT\REQ_20160309-000070\LWeiner_2016-03-09-15.36.30.54.tif
Request;20160309-000070;39633;PACE;Inpatient;PACE;C:\Users\FGuo\Documents\work doucment\attachment\attachmentDB\20161005\originalFileFromAerial\DOCSVC_20161003.tar\DOCSVC_20161003\Sect2\INPATIENT\REQ_20160309-000070\Weiner Lillian -Staten Island University Hospital 3-10-16_2016-03-10-14.48.13.610.pdf
Request;20160310-000005;50167;SELECT;Inpatient;FIDA;C:\Users\FGuo\Documents\work doucment\attachment\attachmentDB\20161005\originalFileFromAerial\DOCSVC_20161003.tar\DOCSVC_20161003\Sect2\INPATIENT\REQ_20160310-000005\Harris, D 50167 3-1-16_2016-03-10-09.48.00.381.tif
Request;20160310-000005;50167;SELECT;Inpatient;FIDA;C:\Users\FGuo\Documents\work doucment\attachment\attachmentDB\20161005\originalFileFromAerial\DOCSVC_20161003.tar\DOCSVC_20161003\Sect2\INPATIENT\REQ_20160310-000005\Harris, Dorothy_PRI-Rehab notes_3-9-16_2016-03-11-15.59.03.572.pdf
Request;20160310-000013;54628;PACE;Inpatient;PACE;C:\Users\FGuo\Documents\work doucment\attachment\attachmentDB\20161005\originalFileFromAerial\DOCSVC_20161003.tar\DOCSVC_20161003\Sect2\INPATIENT\REQ_20160310-000013\Boyle, Maureen 54628 Clinical Review 10 15 Req Form - Copy (2)_2016-03-10-10.58.16.240.docx
Request;20160310-000027;46326;PACE;Inpatient;PACE;C:\Users\FGuo\Documents\work doucment\attachment\attachmentDB\20161005\originalFileFromAerial\DOCSVC_20161003.tar\DOCSVC_20161003\Sect2\INPATIENT\REQ_20160310-000027\Gladden, Audrey T - REGEIS CARE CENTER 8.24.16_2016-08-24-10.44.38.268.pdf
Request;20160310-000029;99966;PACE;Inpatient;PACE;C:\Users\FGuo\Documents\work doucment\attachment\attachmentDB\20161005\originalFileFromAerial\DOCSVC_20161003.tar\DOCSVC_20161003\Sect2\INPATIENT\REQ_20160310-000029\clayborne dolores 32516_2016-03-25-12.37.37.274.tif
Request;20160310-000029;99966;PACE;Inpatient;PACE;C:\Users\FGuo\Documents\work doucment\attachment\attachmentDB\20161005\originalFileFromAerial\DOCSVC_20161003.tar\DOCSVC_20161003\Sect2\INPATIENT\REQ_20160310-000029\Clayborne, Dolores - WORKMEN'S CIRCLE HOME 8.24.16_2016-08-24-10.58.29.514.pdf
Request;20160310-000029;99966;PACE;Inpatient;PACE;C:\Users\FGuo\Documents\work doucment\attachment\attachmentDB\20161005\originalFileFromAerial\DOCSVC_20161003.tar\DOCSVC_20161003\Sect2\INPATIENT\REQ_20160310-000029\Clayborne, Dolores_2016-06-10-10.18.21.39.tif
Request;20160310-000029;99966;PACE;Inpatient;PACE;C:\Users\FGuo\Documents\work doucment\attachment\attachmentDB\20161005\originalFileFromAerial\DOCSVC_20161003.tar\DOCSVC_20161003\Sect2\INPATIENT\REQ_20160310-000029\Clayborne, Dolores_2016-06-17-12.13.39.959.tif
Request;20160310-000029;99966;PACE;Inpatient;PACE;C:\Users\FGuo\Documents\work doucment\attachment\attachmentDB\20161005\originalFileFromAerial\DOCSVC_20161003.tar\DOCSVC_20161003\Sect2\INPATIENT\REQ_20160310-000029\Clayborne, Dolores_2016-07-12-12.06.14.561.tif
Request;20160310-000029;99966;PACE;Inpatient;PACE;C:\Users\FGuo\Documents\work doucment\attachment\attachmentDB\20161005\originalFileFromAerial\DOCSVC_20161003.tar\DOCSVC_20161003\Sect2\INPATIENT\REQ_20160310-000029\Clayborne, Dolores_2016-07-21-16.25.45.514.tif
Request;20160310-000029;99966;PACE;Inpatient;PACE;C:\Users\FGuo\Documents\work doucment\attachment\attachmentDB\20161005\originalFileFromAerial\DOCSVC_20161003.tar\DOCSVC_20161003\Sect2\INPATIENT\REQ_20160310-000029\dolores clayborne 31416_2016-03-14-10.55.10.520.tif
Request;20160310-000036;45876;DIRECT;Inpatient;DIRECT;C:\Users\FGuo\Documents\work doucment\attachment\attachmentDB\20161005\originalFileFromAerial\DOCSVC_20161003.tar\DOCSVC_20161003\Sect2\INPATIENT\REQ_20160310-000036\david enayatian dc32116_2016-03-21-16.38.20.884.tif
Request;20160310-000036;45876;DIRECT;Inpatient;DIRECT;C:\Users\FGuo\Documents\work doucment\attachment\attachmentDB\20161005\originalFileFromAerial\DOCSVC_20161003.tar\DOCSVC_20161003\Sect2\INPATIENT\REQ_20160310-000036\david enyatian31116_2016-03-11-13.03.24.379.tif
Request;20160310-000036;45876;DIRECT;Inpatient;DIRECT;C:\Users\FGuo\Documents\work doucment\attachment\attachmentDB\20161005\originalFileFromAerial\DOCSVC_20161003.tar\DOCSVC_20161003\Sect2\INPATIENT\REQ_20160310-000036\Enaytian David - North Shore University Hospital Manhasset  3-10-16_2016-03-10-13.43.12.504.pdf
Request;20160310-000039;54949;DIRECT;Inpatient;DIRECT;C:\Users\FGuo\Documents\work doucment\attachment\attachmentDB\20161005\originalFileFromAerial\DOCSVC_20161003.tar\DOCSVC_20161003\Sect2\INPATIENT\REQ_20160310-000039\MPlotkin_2016-03-14-11.56.17.9.tif
Request;20160310-000039;54949;DIRECT;Inpatient;DIRECT;C:\Users\FGuo\Documents\work doucment\attachment\attachmentDB\20161005\originalFileFromAerial\DOCSVC_20161003.tar\DOCSVC_20161003\Sect2\INPATIENT\REQ_20160310-000039\Plotkin Mark - St. John's Episcopal Hospital  3-10-16_2016-03-10-14.25.01.429.pdf
Request;20160310-000039;54949;DIRECT;Inpatient;DIRECT;C:\Users\FGuo\Documents\work doucment\attachment\attachmentDB\20161005\originalFileFromAerial\DOCSVC_20161003.tar\DOCSVC_20161003\Sect2\INPATIENT\REQ_20160310-000039\Plotkin, Mark IP Denial St Johns Episcopal Hospital 6-20-16_2016-06-20-15.46.32.357.pdf
Request;20160310-000043;50167;SELECT;Inpatient;SELECT;C:\Users\FGuo\Documents\work doucment\attachment\attachmentDB\20161005\originalFileFromAerial\DOCSVC_20161003.tar\DOCSVC_20161003\Sect2\INPATIENT\REQ_20160310-000043\Harris, Dorothy - CENTER FOR NURSING AND REHABILITATION 8.24.16_2016-08-24-15.30.55.146.pdf
Request;20160310-000043;50167;SELECT;Inpatient;SELECT;C:\Users\FGuo\Documents\work doucment\attachment\attachmentDB\20161005\originalFileFromAerial\DOCSVC_20161003.tar\DOCSVC_20161003\Sect2\INPATIENT\REQ_20160310-000043\Harris, Dorothy_2016-07-13-16.30.55.866.tif
Request;20160310-000043;50167;SELECT;Inpatient;SELECT;C:\Users\FGuo\Documents\work doucment\attachment\attachmentDB\20161005\originalFileFromAerial\DOCSVC_20161003.tar\DOCSVC_20161003\Sect2\INPATIENT\REQ_20160310-000043\Harris, Dorothy_2016-07-14-10.39.06.536.tif
Request;20160310-000043;50167;SELECT;Inpatient;SELECT;C:\Users\FGuo\Documents\work doucment\attachment\attachmentDB\20161005\originalFileFromAerial\DOCSVC_20161003.tar\DOCSVC_20161003\Sect2\INPATIENT\REQ_20160310-000043\Harris, Dorothy_PRI-Rehab notes_3-9-16_2016-03-10-15.40.43.386.pdf
Request;20160310-000047;40442;DIRECT;Inpatient;DIRECT;C:\Users\FGuo\Documents\work doucment\attachment\attachmentDB\20161005\originalFileFromAerial\DOCSVC_20161003.tar\DOCSVC_20161003\Sect2\INPATIENT\REQ_20160310-000047\O_\40442 BARONE, JOSEPHINE APPROVAL LTR_2016-03-17-11.44.05.93.docx
Request;20160310-000047;40442;DIRECT;Inpatient;DIRECT;C:\Users\FGuo\Documents\work doucment\attachment\attachmentDB\20161005\originalFileFromAerial\DOCSVC_20161003.tar\DOCSVC_20161003\Sect2\INPATIENT\REQ_20160310-000047\O_\40442 BARONE, JOSEPHINE CLINICALS_2016-03-15-10.15.42.157.tif
Request;20160310-000047;40442;DIRECT;Inpatient;DIRECT;C:\Users\FGuo\Documents\work doucment\attachment\attachmentDB\20161005\originalFileFromAerial\DOCSVC_20161003.tar\DOCSVC_20161003\Sect2\INPATIENT\REQ_20160310-000047\O_\40442 BARONE, JOSPHINE UR REQ SHEET_2016-03-10-14.59.47.94.doc
Request;20160310-000048;58879;null;Inpatient;DIRECT;C:\Users\FGuo\Documents\work doucment\attachment\attachmentDB\20161005\originalFileFromAerial\DOCSVC_20161003.tar\DOCSVC_20161003\Sect2\INPATIENT\REQ_20160310-000048\davis, david_3-9-16_2016-03-15-15.52.05.192.pdf
Request;20160310-000048;58879;null;Inpatient;DIRECT;C:\Users\FGuo\Documents\work doucment\attachment\attachmentDB\20161005\originalFileFromAerial\DOCSVC_20161003.tar\DOCSVC_20161003\Sect2\INPATIENT\REQ_20160310-000048\O_\58879 DAVIS, DAVID APPROVAL LTR_2016-03-17-11.34.07.67.docx
Request;20160310-000048;58879;null;Inpatient;DIRECT;C:\Users\FGuo\Documents\work doucment\attachment\attachmentDB\20161005\originalFileFromAerial\DOCSVC_20161003.tar\DOCSVC_20161003\Sect2\INPATIENT\REQ_20160310-000048\O_\58879 DAVIS, DAVID CLINICALS_2016-03-15-10.18.19.71.tif
Request;20160310-000048;58879;null;Inpatient;DIRECT;C:\Users\FGuo\Documents\work doucment\attachment\attachmentDB\20161005\originalFileFromAerial\DOCSVC_20161003.tar\DOCSVC_20161003\Sect2\INPATIENT\REQ_20160310-000048\O_\58879 DAVIS, DAVID UR REQ SHEET_2016-03-10-15.05.58.549.doc
Request;20160310-000052;54907;PACE;Inpatient;PACE;C:\Users\FGuo\Documents\work doucment\attachment\attachmentDB\20161005\originalFileFromAerial\DOCSVC_20161003.tar\DOCSVC_20161003\Sect2\INPATIENT\REQ_20160310-000052\dodbrook weekses 41916_2016-04-19-11.47.38.230.tif
Request;20160310-000052;54907;PACE;Inpatient;PACE;C:\Users\FGuo\Documents\work doucment\attachment\attachmentDB\20161005\originalFileFromAerial\DOCSVC_20161003.tar\DOCSVC_20161003\Sect2\INPATIENT\REQ_20160310-000052\Weekes.Jr. Dodbrook__No 54907__Dumont Notes__Rcvd 05.26.16__05.31.16_2016-05-31-11.52.23.631.TIF
Request;20160310-000052;54907;PACE;Inpatient;PACE;C:\Users\FGuo\Documents\work doucment\attachment\attachmentDB\20161005\originalFileFromAerial\DOCSVC_20161003.tar\DOCSVC_20161003\Sect2\INPATIENT\REQ_20160310-000052\Weekes.Jr. Dodbrook__No 54907__Dumont Note__II__Rcvd 04.22.16__05.31.16_2016-05-31-11.55.33.556.tif
Request;20160310-000052;54907;PACE;Inpatient;PACE;C:\Users\FGuo\Documents\work doucment\attachment\attachmentDB\20161005\originalFileFromAerial\DOCSVC_20161003.tar\DOCSVC_20161003\Sect2\INPATIENT\REQ_20160310-000052\Weekes.Jr.Dodbrook__No 54907__Dumont Notes__III__Rcvd   04.28.16__05.31.16_2016-05-31-11.58.42.946.tif
Request;20160310-000054;25084;SELECT;Inpatient;SELECT;C:\Users\FGuo\Documents\work doucment\attachment\attachmentDB\20161005\originalFileFromAerial\DOCSVC_20161003.tar\DOCSVC_20161003\Sect2\INPATIENT\REQ_20160310-000054\Chan, Wan Lee - ATLANTIS REHAB & RHCF 8.24.16_2016-08-24-15.53.01.837.pdf
Request;20160310-000061;31875;PACE;Inpatient;PACE;C:\Users\FGuo\Documents\work doucment\attachment\attachmentDB\20161005\originalFileFromAerial\DOCSVC_20161003.tar\DOCSVC_20161003\Sect2\INPATIENT\REQ_20160310-000061\TAYLOR, DOLORES - ADMISSION_2016-03-10-16.20.17.924.tif
Request;20160310-000061;31875;PACE;Inpatient;PACE;C:\Users\FGuo\Documents\work doucment\attachment\attachmentDB\20161005\originalFileFromAerial\DOCSVC_20161003.tar\DOCSVC_20161003\Sect2\INPATIENT\REQ_20160310-000061\TAYLOR, DOLORES - UR_2016-03-10-16.21.40.67.pdf
Request;20160310-000062;25084;SELECT;Inpatient;SELECT;C:\Users\FGuo\Documents\work doucment\attachment\attachmentDB\20161005\originalFileFromAerial\DOCSVC_20161003.tar\DOCSVC_20161003\Sect2\INPATIENT\REQ_20160310-000062\Chan, Wan Lee - Atlantis Rehab & RHCF 8.18.16_2016-08-18-12.02.36.207.pdf
Request;20160310-000063;25084;SELECT;Inpatient;SELECT;C:\Users\FGuo\Documents\work doucment\attachment\attachmentDB\20161005\originalFileFromAerial\DOCSVC_20161003.tar\DOCSVC_20161003\Sect2\INPATIENT\REQ_20160310-000063\Chan, Wan Lee - ATLANTIS REHAB & RHCF 8.24.16_2016-08-24-16.21.22.938.pdf
Request;20160310-000064;24948;SELECT;Inpatient;SELECT;C:\Users\FGuo\Documents\work doucment\attachment\attachmentDB\20161005\originalFileFromAerial\DOCSVC_20161003.tar\DOCSVC_20161003\Sect2\INPATIENT\REQ_20160310-000064\Murrain, Mary E - St Joachim & Ann Residence & Rehab Center - 9.30.16_2016-09-30-10.06.13.252.pdf
Request;20160310-000064;24948;SELECT;Inpatient;SELECT;C:\Users\FGuo\Documents\work doucment\attachment\attachmentDB\20161005\originalFileFromAerial\DOCSVC_20161003.tar\DOCSVC_20161003\Sect2\INPATIENT\REQ_20160310-000064\O_\24948 Mary Murrain - PRI - Centerlight_2016-03-10-16.35.14.572.pdf
Request;20160310-000066;76230;PACE;Inpatient;PACE;C:\Users\FGuo\Documents\work doucment\attachment\attachmentDB\20161005\originalFileFromAerial\DOCSVC_20161003.tar\DOCSVC_20161003\Sect2\INPATIENT\REQ_20160310-000066\Vasquez, Aida 76230 hosp adm BA-FAX1_1603011809438720_2016-03-10-17.06.24.998.TIF
Request;20160311-000001;61273;SELECT;Inpatient;Not Valued;C:\Users\FGuo\Documents\work doucment\attachment\attachmentDB\20161005\originalFileFromAerial\DOCSVC_20161003.tar\DOCSVC_20161003\Sect2\INPATIENT\REQ_20160311-000001\Davis, Neatus - RESORT NURSING HOME 8.18.16_2016-08-18-12.53.44.342.pdf
Request;20160311-000001;61273;SELECT;Inpatient;Not Valued;C:\Users\FGuo\Documents\work doucment\attachment\attachmentDB\20161005\originalFileFromAerial\DOCSVC_20161003.tar\DOCSVC_20161003\Sect2\INPATIENT\REQ_20160311-000001\O_\Davis Neatus 3-1-16_2016-03-11-09.51.27.494.tif
Request;20160311-000005;61495;SELECT;Inpatient;SELECT;C:\Users\FGuo\Documents\work doucment\attachment\attachmentDB\20161005\originalFileFromAerial\DOCSVC_20161003.tar\DOCSVC_20161003\Sect2\INPATIENT\REQ_20160311-000005\Gimbel, Frances 61495 Select SNF Service Authorization Approval PRAp6 - Copy_2016-03-17-11.50.03.23.docx
Request;20160311-000005;61495;SELECT;Inpatient;SELECT;C:\Users\FGuo\Documents\work doucment\attachment\attachmentDB\20161005\originalFileFromAerial\DOCSVC_20161003.tar\DOCSVC_20161003\Sect2\INPATIENT\REQ_20160311-000005\O_\Gimbel Frances 3-1-16_2016-03-11-10.20.09.12.tif
Request;20160311-000011;48535;PACE;Inpatient;PACE;C:\Users\FGuo\Documents\work doucment\attachment\attachmentDB\20161005\originalFileFromAerial\DOCSVC_20161003.tar\DOCSVC_20161003\Sect2\INPATIENT\REQ_20160311-000011\YUNG, YIKCHUNG - ADMISSION_2016-03-11-10.29.02.498.pdf
Request;20160311-000011;48535;PACE;Inpatient;PACE;C:\Users\FGuo\Documents\work doucment\attachment\attachmentDB\20161005\originalFileFromAerial\DOCSVC_20161003.tar\DOCSVC_20161003\Sect2\INPATIENT\REQ_20160311-000011\YUNG, YIKCHUNG - Service Authorization Approval PRAp6_2016-03-24-14.49.35.919.docx
Request;20160311-000011;48535;PACE;Inpatient;PACE;C:\Users\FGuo\Documents\work doucment\attachment\attachmentDB\20161005\originalFileFromAerial\DOCSVC_20161003.tar\DOCSVC_20161003\Sect2\INPATIENT\REQ_20160311-000011\YUNG, YIKCHUNG - UR_2016-03-11-10.41.36.141.pdf
Request;20160311-000011;48535;PACE;Inpatient;PACE;C:\Users\FGuo\Documents\work doucment\attachment\attachmentDB\20161005\originalFileFromAerial\DOCSVC_20161003.tar\DOCSVC_20161003\Sect2\INPATIENT\REQ_20160311-000011\YYung_2016-03-14-11.31.11.136.tif
Request;20160311-000012;88294;SELECT;Inpatient;Not Valued;C:\Users\FGuo\Documents\work doucment\attachment\attachmentDB\20161005\originalFileFromAerial\DOCSVC_20161003.tar\DOCSVC_20161003\Sect2\INPATIENT\REQ_20160311-000012\Vaughn Sharon IP Denial Brooklyn Hospital Center 3-15-16_2016-03-15-12.24.09.862.pdf
Request;20160311-000012;88294;SELECT;Inpatient;Not Valued;C:\Users\FGuo\Documents\work doucment\attachment\attachmentDB\20161005\originalFileFromAerial\DOCSVC_20161003.tar\DOCSVC_20161003\Sect2\INPATIENT\REQ_20160311-000012\Vaughn, Sharon 88294 Clinical Review 10 15 Req Form - Copy (2)_2016-03-11-10.38.05.794.docx
Request;20160311-000012;88294;SELECT;Inpatient;Not Valued;C:\Users\FGuo\Documents\work doucment\attachment\attachmentDB\20161005\originalFileFromAerial\DOCSVC_20161003.tar\DOCSVC_20161003\Sect2\INPATIENT\REQ_20160311-000012\Vaughn, Sharon_clinical_3-11-16_2016-03-14-12.22.32.469.pdf
Request;20160311-000012;88294;SELECT;Inpatient;Not Valued;C:\Users\FGuo\Documents\work doucment\attachment\attachmentDB\20161005\originalFileFromAerial\DOCSVC_20161003.tar\DOCSVC_20161003\Sect2\INPATIENT\REQ_20160311-000012\VAUGHN_SHARON_041216_2016-06-14-13.11.18.396.pdf
Request;20160311-000014;34512;SELECT;Inpatient;SELECT;C:\Users\FGuo\Documents\work doucment\attachment\attachmentDB\20161005\originalFileFromAerial\DOCSVC_20161003.tar\DOCSVC_20161003\Sect2\INPATIENT\REQ_20160311-000014\Grace Panceal  - FAX NOTIFICATION OF SNF COPAY 3-11-16_2016-03-15-12.53.39.336.doc
Request;20160311-000019;21521;PACE;Inpatient;PACE;C:\Users\FGuo\Documents\work doucment\attachment\attachmentDB\20161005\originalFileFromAerial\DOCSVC_20161003.tar\DOCSVC_20161003\Sect2\INPATIENT\REQ_20160311-000019\maria pagan31416_2016-03-14-17.01.24.771.tif
Request;20160311-000019;21521;PACE;Inpatient;PACE;C:\Users\FGuo\Documents\work doucment\attachment\attachmentDB\20161005\originalFileFromAerial\DOCSVC_20161003.tar\DOCSVC_20161003\Sect2\INPATIENT\REQ_20160311-000019\Pagan Maria IP Denial Beth Israel Medical Center 3-15-16_2016-03-15-14.55.15.838.pdf
Request;20160311-000019;21521;PACE;Inpatient;PACE;C:\Users\FGuo\Documents\work doucment\attachment\attachmentDB\20161005\originalFileFromAerial\DOCSVC_20161003.tar\DOCSVC_20161003\Sect2\INPATIENT\REQ_20160311-000019\PAGAN, MARIA _1OF3_041916_2016-05-23-10.54.59.791.pdf
Request;20160311-000019;21521;PACE;Inpatient;PACE;C:\Users\FGuo\Documents\work doucment\attachment\attachmentDB\20161005\originalFileFromAerial\DOCSVC_20161003.tar\DOCSVC_20161003\Sect2\INPATIENT\REQ_20160311-000019\PAGAN, MARIA _MR2OF3_041916_2016-05-23-10.57.08.471.pdf
Request;20160311-000019;21521;PACE;Inpatient;PACE;C:\Users\FGuo\Documents\work doucment\attachment\attachmentDB\20161005\originalFileFromAerial\DOCSVC_20161003.tar\DOCSVC_20161003\Sect2\INPATIENT\REQ_20160311-000019\PAGAN, MARIA _MR3OF3_041916_2016-05-23-10.59.05.790.pdf
Request;20160311-000019;21521;PACE;Inpatient;PACE;C:\Users\FGuo\Documents\work doucment\attachment\attachmentDB\20161005\originalFileFromAerial\DOCSVC_20161003.tar\DOCSVC_20161003\Sect2\INPATIENT\REQ_20160311-000019\Pagan, Maria- MS Beth Israel MC Petrie -Clinical Review Request Form 3-11-16_2016-03-11-11.08.01.518.docx
Request;20160311-000025;29821;PACE;Inpatient;PACE;C:\Users\FGuo\Documents\work doucment\attachment\attachmentDB\20161005\originalFileFromAerial\DOCSVC_20161003.tar\DOCSVC_20161003\Sect2\INPATIENT\REQ_20160311-000025\Dobi, Hidajete    MAIMONIDES_2016-03-11-11.44.00.149.doc
Request;20160311-000025;29821;PACE;Inpatient;PACE;C:\Users\FGuo\Documents\work doucment\attachment\attachmentDB\20161005\originalFileFromAerial\DOCSVC_20161003.tar\DOCSVC_20161003\Sect2\INPATIENT\REQ_20160311-000025\Dobi, Hidajete   3-11-16_2016-03-11-11.33.59.480.tif
Request;20160311-000025;29821;PACE;Inpatient;PACE;C:\Users\FGuo\Documents\work doucment\attachment\attachmentDB\20161005\originalFileFromAerial\DOCSVC_20161003.tar\DOCSVC_20161003\Sect2\INPATIENT\REQ_20160311-000025\Dobi, Hidajete - Maimonides Medical Center -_2016-03-17-11.27.00.255.docx
Request;20160311-000025;29821;PACE;Inpatient;PACE;C:\Users\FGuo\Documents\work doucment\attachment\attachmentDB\20161005\originalFileFromAerial\DOCSVC_20161003.tar\DOCSVC_20161003\Sect2\INPATIENT\REQ_20160311-000025\Dobi, Hidajete_clinical_3-10-16_2016-03-14-11.38.59.984.pdf
Request;20160311-000027;61233;SELECT;Inpatient;SELECT;C:\Users\FGuo\Documents\work doucment\attachment\attachmentDB\20161005\originalFileFromAerial\DOCSVC_20161003.tar\DOCSVC_20161003\Sect2\INPATIENT\REQ_20160311-000027\O_\nursing home documents\J Morris 61233_2016-03-11-11.48.49.577.tif
Request;20160311-000033;34556;null;Inpatient;SELECT;C:\Users\FGuo\Documents\work doucment\attachment\attachmentDB\20161005\originalFileFromAerial\DOCSVC_20161003.tar\DOCSVC_20161003\Sect2\INPATIENT\REQ_20160311-000033\Rolon, Domitila - Rebekah Rehab & Extended Care - Approval Letter 3-17-16_2016-03-17-15.33.37.935.docx
Request;20160311-000036;74205;PACE;Inpatient;PACE;C:\Users\FGuo\Documents\work doucment\attachment\attachmentDB\20161005\originalFileFromAerial\DOCSVC_20161003.tar\DOCSVC_20161003\Sect2\INPATIENT\REQ_20160311-000036\O_\74205 VARGAS, GLADYS APPROVAL LTR ST JOE_2016-03-21-10.28.09.902.docx
Request;20160311-000036;74205;PACE;Inpatient;PACE;C:\Users\FGuo\Documents\work doucment\attachment\attachmentDB\20161005\originalFileFromAerial\DOCSVC_20161003.tar\DOCSVC_20161003\Sect2\INPATIENT\REQ_20160311-000036\O_\74205 VARGAS, GLADYS CLINICALS_2016-03-15-11.36.03.486.tif
Request;20160311-000036;74205;PACE;Inpatient;PACE;C:\Users\FGuo\Documents\work doucment\attachment\attachmentDB\20161005\originalFileFromAerial\DOCSVC_20161003.tar\DOCSVC_20161003\Sect2\INPATIENT\REQ_20160311-000036\Vargas, Gladys  - St Joseph Hosp  914 Clinical Review Request Form 3-11-16_2016-03-11-12.23.56.497.docx
Request;20160311-000036;74205;PACE;Inpatient;PACE;C:\Users\FGuo\Documents\work doucment\attachment\attachmentDB\20161005\originalFileFromAerial\DOCSVC_20161003.tar\DOCSVC_20161003\Sect2\INPATIENT\REQ_20160311-000036\VARGAS, GLADYS ST JOSE_2016-03-15-16.07.26.334.pdf
Request;20160311-000041;78840;PACE;Inpatient;PACE;C:\Users\FGuo\Documents\work doucment\attachment\attachmentDB\20161005\originalFileFromAerial\DOCSVC_20161003.tar\DOCSVC_20161003\Sect2\INPATIENT\REQ_20160311-000041\LTam_2016-03-14-12.11.52.595.tif
Request;20160311-000041;78840;PACE;Inpatient;PACE;C:\Users\FGuo\Documents\work doucment\attachment\attachmentDB\20161005\originalFileFromAerial\DOCSVC_20161003.tar\DOCSVC_20161003\Sect2\INPATIENT\REQ_20160311-000041\Tam, Lai - Cliffside Rehabilitation & Residential 8.18.16_2016-08-18-13.31.44.293.pdf
Request;20160311-000046;28750;PACE;Inpatient;PACE;C:\Users\FGuo\Documents\work doucment\attachment\attachmentDB\20161005\originalFileFromAerial\DOCSVC_20161003.tar\DOCSVC_20161003\Sect2\INPATIENT\REQ_20160311-000046\04112016 VOLKOV_YURIY_1OF3_041116 _2016-05-16-13.26.24.517.pdf
Request;20160311-000046;28750;PACE;Inpatient;PACE;C:\Users\FGuo\Documents\work doucment\attachment\attachmentDB\20161005\originalFileFromAerial\DOCSVC_20161003.tar\DOCSVC_20161003\Sect2\INPATIENT\REQ_20160311-000046\04112016 VOLKOV_YURIY_1OF3_041116 _2016-05-16-13.27.28.26.pdf
Request;20160311-000046;28750;PACE;Inpatient;PACE;C:\Users\FGuo\Documents\work doucment\attachment\attachmentDB\20161005\originalFileFromAerial\DOCSVC_20161003.tar\DOCSVC_20161003\Sect2\INPATIENT\REQ_20160311-000046\04112016 VOLKOV_YURIY_2OF3_041116 _2016-05-16-13.26.51.195.pdf
Request;20160311-000046;28750;PACE;Inpatient;PACE;C:\Users\FGuo\Documents\work doucment\attachment\attachmentDB\20161005\originalFileFromAerial\DOCSVC_20161003.tar\DOCSVC_20161003\Sect2\INPATIENT\REQ_20160311-000046\04112016 VOLKOV_YURIY_3OF3_041116 _2016-05-16-13.27.07.893.pdf
Request;20160311-000046;28750;PACE;Inpatient;PACE;C:\Users\FGuo\Documents\work doucment\attachment\attachmentDB\20161005\originalFileFromAerial\DOCSVC_20161003.tar\DOCSVC_20161003\Sect2\INPATIENT\REQ_20160311-000046\O_\Waters Place\Aerial\Auth Req_Clinicals\Volkov.Y__StatenIslandUniv.Hosp__Clinical Request Form_ 03.11.16_2016-03-11-13.34.42.557.docx
Request;20160311-000046;28750;PACE;Inpatient;PACE;C:\Users\FGuo\Documents\work doucment\attachment\attachmentDB\20161005\originalFileFromAerial\DOCSVC_20161003.tar\DOCSVC_20161003\Sect2\INPATIENT\REQ_20160311-000046\O_\Waters Place\Aerial\Auth Req_Clinicals\Volkov.Y__StatenIslandUniv.Hosp__Clinical Request Form_ 03.11.16_2016-03-11-13.35.21.361.docx
Request;20160311-000046;28750;PACE;Inpatient;PACE;C:\Users\FGuo\Documents\work doucment\attachment\attachmentDB\20161005\originalFileFromAerial\DOCSVC_20161003.tar\DOCSVC_20161003\Sect2\INPATIENT\REQ_20160311-000046\Volkov Yuriy IP Denial Staten Island University Hospital  3-22-16_2016-03-22-09.35.36.238.pdf
Request;20160311-000046;28750;PACE;Inpatient;PACE;C:\Users\FGuo\Documents\work doucment\attachment\attachmentDB\20161005\originalFileFromAerial\DOCSVC_20161003.tar\DOCSVC_20161003\Sect2\INPATIENT\REQ_20160311-000046\Volkov.Y__StatenIslandUniv.Hosp__Clinical Request Form_ 03.11.16_2016-03-11-13.36.33.176.docx
Request;20160311-000046;28750;PACE;Inpatient;PACE;C:\Users\FGuo\Documents\work doucment\attachment\attachmentDB\20161005\originalFileFromAerial\DOCSVC_20161003.tar\DOCSVC_20161003\Sect2\INPATIENT\REQ_20160311-000046\YVolkov_2016-03-17-14.33.16.989.tif
Request;20160311-000049;23688;SELECT;Inpatient;SELECT;C:\Users\FGuo\Documents\work doucment\attachment\attachmentDB\20161005\originalFileFromAerial\DOCSVC_20161003.tar\DOCSVC_20161003\Sect2\INPATIENT\REQ_20160311-000049\CHEUNG, KWANKAM - BED HOLD_2016-03-11-13.45.04.251.pdf
Request;20160311-000049;23688;SELECT;Inpatient;SELECT;C:\Users\FGuo\Documents\work doucment\attachment\attachmentDB\20161005\originalFileFromAerial\DOCSVC_20161003.tar\DOCSVC_20161003\Sect2\INPATIENT\REQ_20160311-000049\CHEUNG, KWANKAM - BED HOLD_2016-03-16-08.29.04.322.tif
Request;20160311-000051;45035;PACE;Inpatient;PACE;C:\Users\FGuo\Documents\work doucment\attachment\attachmentDB\20161005\originalFileFromAerial\DOCSVC_20161003.tar\DOCSVC_20161003\Sect2\INPATIENT\REQ_20160311-000051\carolyn dyer31516_2016-03-15-10.47.50.767.tif
Request;20160311-000051;45035;PACE;Inpatient;PACE;C:\Users\FGuo\Documents\work doucment\attachment\attachmentDB\20161005\originalFileFromAerial\DOCSVC_20161003.tar\DOCSVC_20161003\Sect2\INPATIENT\REQ_20160311-000051\Dyer Carolyn IP Denial Lenox Hill Hospital Center 3-16-16_2016-03-16-16.08.05.275.pdf
Request;20160311-000051;45035;PACE;Inpatient;PACE;C:\Users\FGuo\Documents\work doucment\attachment\attachmentDB\20161005\originalFileFromAerial\DOCSVC_20161003.tar\DOCSVC_20161003\Sect2\INPATIENT\REQ_20160311-000051\DYER, CAROLYN_042716_2016-05-20-14.26.41.589.pdf
Request;20160311-000051;45035;PACE;Inpatient;PACE;C:\Users\FGuo\Documents\work doucment\attachment\attachmentDB\20161005\originalFileFromAerial\DOCSVC_20161003.tar\DOCSVC_20161003\Sect2\INPATIENT\REQ_20160311-000051\DYER, CAROLYN_042716_2016-05-20-14.29.32.937.pdf
Request;20160311-000051;45035;PACE;Inpatient;PACE;C:\Users\FGuo\Documents\work doucment\attachment\attachmentDB\20161005\originalFileFromAerial\DOCSVC_20161003.tar\DOCSVC_20161003\Sect2\INPATIENT\REQ_20160311-000051\O_\45035 DYER, CAROLYN UR REQ SHEET_2016-03-11-14.31.17.285.doc
Request;20160311-000052;37459;SELECT;Inpatient;SELECT;C:\Users\FGuo\Documents\work doucment\attachment\attachmentDB\20161005\originalFileFromAerial\DOCSVC_20161003.tar\DOCSVC_20161003\Sect2\INPATIENT\REQ_20160311-000052\Breslaw, Janice P - NORTHERN METROPOLITAN INC 8.25.16_2016-08-25-09.30.02.801.pdf
Request;20160311-000052;37459;SELECT;Inpatient;SELECT;C:\Users\FGuo\Documents\work doucment\attachment\attachmentDB\20161005\originalFileFromAerial\DOCSVC_20161003.tar\DOCSVC_20161003\Sect2\INPATIENT\REQ_20160311-000052\Breslaw, Janice_PRI_2016-03-11-14.38.05.802.tif
Request;20160311-000056;25772;PACE;Inpatient;PACE;C:\Users\FGuo\Documents\work doucment\attachment\attachmentDB\20161005\originalFileFromAerial\DOCSVC_20161003.tar\DOCSVC_20161003\Sect2\INPATIENT\REQ_20160311-000056\Lopez, F 25772 3-11-16_2016-03-14-11.05.36.20.tif
Request;20160311-000056;25772;PACE;Inpatient;PACE;C:\Users\FGuo\Documents\work doucment\attachment\attachmentDB\20161005\originalFileFromAerial\DOCSVC_20161003.tar\DOCSVC_20161003\Sect2\INPATIENT\REQ_20160311-000056\O_\25772 LOPEZ, FELIPE APPROVAL LTR_2016-03-17-09.59.33.694.docx
Request;20160311-000056;25772;PACE;Inpatient;PACE;C:\Users\FGuo\Documents\work doucment\attachment\attachmentDB\20161005\originalFileFromAerial\DOCSVC_20161003.tar\DOCSVC_20161003\Sect2\INPATIENT\REQ_20160311-000056\O_\25772 LOPEZ, FELIPE UR REQ SHEET_2016-03-11-15.45.43.891.doc
Request;20160311-000059;94990;PACE;Inpatient;PACE;C:\Users\FGuo\Documents\work doucment\attachment\attachmentDB\20161005\originalFileFromAerial\DOCSVC_20161003.tar\DOCSVC_20161003\Sect2\INPATIENT\REQ_20160311-000059\Grant Michael IP Denial Montefiore Medical Center 3-16-16_2016-03-16-15.57.06.47.pdf
Request;20160311-000059;94990;PACE;Inpatient;PACE;C:\Users\FGuo\Documents\work doucment\attachment\attachmentDB\20161005\originalFileFromAerial\DOCSVC_20161003.tar\DOCSVC_20161003\Sect2\INPATIENT\REQ_20160311-000059\GRANT, MICHAEL_050316 _2016-06-16-12.54.35.264.pdf
Request;20160311-000059;94990;PACE;Inpatient;PACE;C:\Users\FGuo\Documents\work doucment\attachment\attachmentDB\20161005\originalFileFromAerial\DOCSVC_20161003.tar\DOCSVC_20161003\Sect2\INPATIENT\REQ_20160311-000059\grant, michael_3-15-16_2016-03-15-16.01.35.374.pdf
Request;20160311-000059;94990;PACE;Inpatient;PACE;C:\Users\FGuo\Documents\work doucment\attachment\attachmentDB\20161005\originalFileFromAerial\DOCSVC_20161003.tar\DOCSVC_20161003\Sect2\INPATIENT\REQ_20160311-000059\O_\94990 GRANT, MICHAEL UR REQ SHEET_2016-03-11-16.06.22.234.doc
Request;20160311-000059;94990;PACE;Inpatient;PACE;C:\Users\FGuo\Documents\work doucment\attachment\attachmentDB\20161005\originalFileFromAerial\DOCSVC_20161003.tar\DOCSVC_20161003\Sect2\INPATIENT\REQ_20160311-000059\O_\94990 GRANT, MICHAEL UR-CLINICALS_2016-03-15-10.20.49.880.tif
Request;20160311-000060;35387;PACE;Inpatient;FIDA;C:\Users\FGuo\Documents\work doucment\attachment\attachmentDB\20161005\originalFileFromAerial\DOCSVC_20161003.tar\DOCSVC_20161003\Sect2\INPATIENT\REQ_20160311-000060\gabriella hernandez31616_2016-03-15-10.35.30.717.tif
Request;20160311-000060;35387;PACE;Inpatient;FIDA;C:\Users\FGuo\Documents\work doucment\attachment\attachmentDB\20161005\originalFileFromAerial\DOCSVC_20161003.tar\DOCSVC_20161003\Sect2\INPATIENT\REQ_20160311-000060\Hernandez Gabriela IP Denial Beth Israel Petri  3-15-16_2016-03-15-15.29.25.370.pdf
Request;20160311-000060;35387;PACE;Inpatient;FIDA;C:\Users\FGuo\Documents\work doucment\attachment\attachmentDB\20161005\originalFileFromAerial\DOCSVC_20161003.tar\DOCSVC_20161003\Sect2\INPATIENT\REQ_20160311-000060\Hernandez Gabriela IP Denial Beth Israel Petri  3-15-16_2016-03-15-15.33.01.768.pdf
Request;20160311-000060;35387;PACE;Inpatient;FIDA;C:\Users\FGuo\Documents\work doucment\attachment\attachmentDB\20161005\originalFileFromAerial\DOCSVC_20161003.tar\DOCSVC_20161003\Sect2\INPATIENT\REQ_20160311-000060\HERNANDEZ, GABRIELA_1OF2_042716  _2016-05-20-14.18.11.545.pdf
Request;20160311-000060;35387;PACE;Inpatient;FIDA;C:\Users\FGuo\Documents\work doucment\attachment\attachmentDB\20161005\originalFileFromAerial\DOCSVC_20161003.tar\DOCSVC_20161003\Sect2\INPATIENT\REQ_20160311-000060\HERNANDEZ, GABRIELA_2OF2_042716  _2016-05-20-14.18.29.959.pdf
Request;20160311-000060;35387;PACE;Inpatient;FIDA;C:\Users\FGuo\Documents\work doucment\attachment\attachmentDB\20161005\originalFileFromAerial\DOCSVC_20161003.tar\DOCSVC_20161003\Sect2\INPATIENT\REQ_20160311-000060\O_\35387 HERNANDEZ, GABRIELA UR REQ SHEET_2016-03-11-16.13.41.616.doc
Request;20160314-000006;48553;PACE;Inpatient;PACE;C:\Users\FGuo\Documents\work doucment\attachment\attachmentDB\20161005\originalFileFromAerial\DOCSVC_20161003.tar\DOCSVC_20161003\Sect2\INPATIENT\REQ_20160314-000006\Petrosyan Serho  IP Denial NYU Hospital Center  3-16-16_2016-03-16-12.14.59.731.pdf
Request;20160314-000006;48553;PACE;Inpatient;PACE;C:\Users\FGuo\Documents\work doucment\attachment\attachmentDB\20161005\originalFileFromAerial\DOCSVC_20161003.tar\DOCSVC_20161003\Sect2\INPATIENT\REQ_20160314-000006\petrosyan serho31516_2016-03-15-12.33.04.742.tif
Request;20160314-000006;48553;PACE;Inpatient;PACE;C:\Users\FGuo\Documents\work doucment\attachment\attachmentDB\20161005\originalFileFromAerial\DOCSVC_20161003.tar\DOCSVC_20161003\Sect2\INPATIENT\REQ_20160314-000006\Petrosyan, Serho 48553 Hosp Notifaction BA-FAX1_1603101844064577_2016-03-14-10.22.49.281.TIF
Request;20160314-000006;48553;PACE;Inpatient;PACE;C:\Users\FGuo\Documents\work doucment\attachment\attachmentDB\20161005\originalFileFromAerial\DOCSVC_20161003.tar\DOCSVC_20161003\Sect2\INPATIENT\REQ_20160314-000006\Petrosyan, Serho 48553 Review 10 15 Req Form - Copy (2)_2016-03-14-10.33.24.84.docx
Request;20160314-000007;49519;FIDA;Inpatient;FIDA;C:\Users\FGuo\Documents\work doucment\attachment\attachmentDB\20161005\originalFileFromAerial\DOCSVC_20161003.tar\DOCSVC_20161003\Sect2\INPATIENT\REQ_20160314-000007\04072016 ROGERS_ELLEN_1OF2_040716 _2016-05-16-13.42.00.650.pdf
Request;20160314-000007;49519;FIDA;Inpatient;FIDA;C:\Users\FGuo\Documents\work doucment\attachment\attachmentDB\20161005\originalFileFromAerial\DOCSVC_20161003.tar\DOCSVC_20161003\Sect2\INPATIENT\REQ_20160314-000007\04072016 ROGERS_ELLEN_2OF2_040716 _2016-05-16-13.42.33.185.pdf
Request;20160314-000007;49519;FIDA;Inpatient;FIDA;C:\Users\FGuo\Documents\work doucment\attachment\attachmentDB\20161005\originalFileFromAerial\DOCSVC_20161003.tar\DOCSVC_20161003\Sect2\INPATIENT\REQ_20160314-000007\Rogers Ellen IP Denial Brookdale Hospital Medical Center 3-18-16_2016-03-18-11.58.08.142.pdf
Request;20160314-000007;49519;FIDA;Inpatient;FIDA;C:\Users\FGuo\Documents\work doucment\attachment\attachmentDB\20161005\originalFileFromAerial\DOCSVC_20161003.tar\DOCSVC_20161003\Sect2\INPATIENT\REQ_20160314-000007\Rogers, Ellen -Brookdale Hosp - Clinical Review Request Form 3-14-16_2016-03-14-10.11.57.399.docx
Request;20160314-000007;49519;FIDA;Inpatient;FIDA;C:\Users\FGuo\Documents\work doucment\attachment\attachmentDB\20161005\originalFileFromAerial\DOCSVC_20161003.tar\DOCSVC_20161003\Sect2\INPATIENT\REQ_20160314-000007\Rogers, Ellen_clinical-PRI_3-14-16_2016-03-15-17.53.28.481.pdf
Request;20160314-000010;88479;DIRECT;Inpatient;DIRECT;C:\Users\FGuo\Documents\work doucment\attachment\attachmentDB\20161005\originalFileFromAerial\DOCSVC_20161003.tar\DOCSVC_20161003\Sect2\INPATIENT\REQ_20160314-000010\Watts Joyce IP Denial New York Methodist Hospital 3-17-16_2016-03-17-16.31.15.296.pdf
Request;20160314-000010;88479;DIRECT;Inpatient;DIRECT;C:\Users\FGuo\Documents\work doucment\attachment\attachmentDB\20161005\originalFileFromAerial\DOCSVC_20161003.tar\DOCSVC_20161003\Sect2\INPATIENT\REQ_20160314-000010\Watts, Joyce - NY Methodist Hosp Clinical Review Request Form 3-14-16_2016-03-14-10.33.23.521.docx
Request;20160314-000010;88479;DIRECT;Inpatient;DIRECT;C:\Users\FGuo\Documents\work doucment\attachment\attachmentDB\20161005\originalFileFromAerial\DOCSVC_20161003.tar\DOCSVC_20161003\Sect2\INPATIENT\REQ_20160314-000010\Watts, Joyce MR1_2016-07-22-13.18.47.586.pdf
Request;20160314-000010;88479;DIRECT;Inpatient;DIRECT;C:\Users\FGuo\Documents\work doucment\attachment\attachmentDB\20161005\originalFileFromAerial\DOCSVC_20161003.tar\DOCSVC_20161003\Sect2\INPATIENT\REQ_20160314-000010\Watts, Joyce MR2_2016-07-22-13.19.22.541.pdf
Request;20160314-000010;88479;DIRECT;Inpatient;DIRECT;C:\Users\FGuo\Documents\work doucment\attachment\attachmentDB\20161005\originalFileFromAerial\DOCSVC_20161003.tar\DOCSVC_20161003\Sect2\INPATIENT\REQ_20160314-000010\Watts, Joyce MR3_2016-07-22-13.20.01.343.pdf
Request;20160314-000010;88479;DIRECT;Inpatient;DIRECT;C:\Users\FGuo\Documents\work doucment\attachment\attachmentDB\20161005\originalFileFromAerial\DOCSVC_20161003.tar\DOCSVC_20161003\Sect2\INPATIENT\REQ_20160314-000010\Watts, Joyce MR4_2016-07-22-13.20.24.375.pdf
Request;20160314-000010;88479;DIRECT;Inpatient;DIRECT;C:\Users\FGuo\Documents\work doucment\attachment\attachmentDB\20161005\originalFileFromAerial\DOCSVC_20161003.tar\DOCSVC_20161003\Sect2\INPATIENT\REQ_20160314-000010\Watts, Joyce_clinical_3-15-16_2016-03-15-17.42.06.771.pdf
Request;20160314-000011;58988;PACE;Inpatient;PACE;C:\Users\FGuo\Documents\work doucment\attachment\attachmentDB\20161005\originalFileFromAerial\DOCSVC_20161003.tar\DOCSVC_20161003\Sect2\INPATIENT\REQ_20160314-000011\Dorino, Mary - New York Methodist Hospital  -_2016-03-24-10.56.15.381.docx
Request;20160314-000011;58988;PACE;Inpatient;PACE;C:\Users\FGuo\Documents\work doucment\attachment\attachmentDB\20161005\originalFileFromAerial\DOCSVC_20161003.tar\DOCSVC_20161003\Sect2\INPATIENT\REQ_20160314-000011\Dorino, Mary - NY Methodist Hosp Clinical Review Request Form 3-14-16_2016-03-14-10.38.45.910.docx
Request;20160314-000011;58988;PACE;Inpatient;PACE;C:\Users\FGuo\Documents\work doucment\attachment\attachmentDB\20161005\originalFileFromAerial\DOCSVC_20161003.tar\DOCSVC_20161003\Sect2\INPATIENT\REQ_20160314-000011\Dorino, Mary_clinical_3-15-16_2016-03-15-17.29.14.135.pdf
Request;20160314-000013;42800;PACE;Inpatient;PACE;C:\Users\FGuo\Documents\work doucment\attachment\attachmentDB\20161005\originalFileFromAerial\DOCSVC_20161003.tar\DOCSVC_20161003\Sect2\INPATIENT\REQ_20160314-000013\kiu ngor wong 33016_2016-03-30-10.44.55.855.tif
Request;20160314-000013;42800;PACE;Inpatient;PACE;C:\Users\FGuo\Documents\work doucment\attachment\attachmentDB\20161005\originalFileFromAerial\DOCSVC_20161003.tar\DOCSVC_20161003\Sect2\INPATIENT\REQ_20160314-000013\Wong, Kiu Ngor  - New York Presby LMH Hospital Clinical Review Request Form 3-14-16_2016-03-14-10.50.27.958.docx
Request;20160314-000014;53895;DIRECT;Inpatient;DIRECT;C:\Users\FGuo\Documents\work doucment\attachment\attachmentDB\20161005\originalFileFromAerial\DOCSVC_20161003.tar\DOCSVC_20161003\Sect2\INPATIENT\REQ_20160314-000014\CCruz_2016-03-15-11.40.07.793.tif
Request;20160314-000014;53895;DIRECT;Inpatient;DIRECT;C:\Users\FGuo\Documents\work doucment\attachment\attachmentDB\20161005\originalFileFromAerial\DOCSVC_20161003.tar\DOCSVC_20161003\Sect2\INPATIENT\REQ_20160314-000014\Cruz Carmen IP Denial St Johns Episcopal Hospital  3-15-16_2016-03-15-12.58.27.330.pdf
Request;20160314-000014;53895;DIRECT;Inpatient;DIRECT;C:\Users\FGuo\Documents\work doucment\attachment\attachmentDB\20161005\originalFileFromAerial\DOCSVC_20161003.tar\DOCSVC_20161003\Sect2\INPATIENT\REQ_20160314-000014\Cruz, carmen 53895  Review 10 15 Req Form - Copy (2)_2016-03-14-10.59.26.603.docx
Request;20160314-000015;26301;PACE;Inpatient;PACE;C:\Users\FGuo\Documents\work doucment\attachment\attachmentDB\20161005\originalFileFromAerial\DOCSVC_20161003.tar\DOCSVC_20161003\Sect2\INPATIENT\REQ_20160314-000015\NVidal_2016-03-17-11.15.31.503.tif
Request;20160314-000015;26301;PACE;Inpatient;PACE;C:\Users\FGuo\Documents\work doucment\attachment\attachmentDB\20161005\originalFileFromAerial\DOCSVC_20161003.tar\DOCSVC_20161003\Sect2\INPATIENT\REQ_20160314-000015\VIDAL, NARDA - ADMISSION_2016-03-28-16.47.12.495.pdf
Request;20160314-000015;26301;PACE;Inpatient;PACE;C:\Users\FGuo\Documents\work doucment\attachment\attachmentDB\20161005\originalFileFromAerial\DOCSVC_20161003.tar\DOCSVC_20161003\Sect2\INPATIENT\REQ_20160314-000015\Vidal, NArda 26301  Review 10 15 Req Form - Copy (2)_2016-03-14-11.08.25.221.docx
Request;20160314-000023;29821;PACE;Inpatient;PACE;C:\Users\FGuo\Documents\work doucment\attachment\attachmentDB\20161005\originalFileFromAerial\DOCSVC_20161003.tar\DOCSVC_20161003\Sect2\INPATIENT\REQ_20160314-000023\dobi hidajete32116_2016-03-21-13.01.03.945.tif
Request;20160314-000023;29821;PACE;Inpatient;PACE;C:\Users\FGuo\Documents\work doucment\attachment\attachmentDB\20161005\originalFileFromAerial\DOCSVC_20161003.tar\DOCSVC_20161003\Sect2\INPATIENT\REQ_20160314-000023\dobi hidajete32516_2016-03-25-13.53.12.914.tif
Request;20160314-000023;29821;PACE;Inpatient;PACE;C:\Users\FGuo\Documents\work doucment\attachment\attachmentDB\20161005\originalFileFromAerial\DOCSVC_20161003.tar\DOCSVC_20161003\Sect2\INPATIENT\REQ_20160314-000023\Dobi, Hidajete  Haym Salomon Home for the Aged LLC._2016-03-16-12.51.20.502.docx
Request;20160314-000023;29821;PACE;Inpatient;PACE;C:\Users\FGuo\Documents\work doucment\attachment\attachmentDB\20161005\originalFileFromAerial\DOCSVC_20161003.tar\DOCSVC_20161003\Sect2\INPATIENT\REQ_20160314-000023\Dobi, Hidajete_PRI-Notes_3-14-16_2016-03-14-12.26.22.715.pdf
Request;20160314-000024;46312;PACE;Inpatient;PACE;C:\Users\FGuo\Documents\work doucment\attachment\attachmentDB\20161005\originalFileFromAerial\DOCSVC_20161003.tar\DOCSVC_20161003\Sect2\INPATIENT\REQ_20160314-000024\O_\46312 WILLIAMSON, GEORGIA UR REQ SHEET_2016-03-14-12.20.12.735.doc
Request;20160314-000024;46312;PACE;Inpatient;PACE;C:\Users\FGuo\Documents\work doucment\attachment\attachmentDB\20161005\originalFileFromAerial\DOCSVC_20161003.tar\DOCSVC_20161003\Sect2\INPATIENT\REQ_20160314-000024\O_\61299 WOODSON, ROBERT_2016-03-14-12.17.05.899.tif
Request;20160314-000024;46312;PACE;Inpatient;PACE;C:\Users\FGuo\Documents\work doucment\attachment\attachmentDB\20161005\originalFileFromAerial\DOCSVC_20161003.tar\DOCSVC_20161003\Sect2\INPATIENT\REQ_20160314-000024\Williamson Georgia IP Denial Brooklyn Hospital Center 3-18-16_2016-03-18-12.00.59.877.pdf
Request;20160314-000024;46312;PACE;Inpatient;PACE;C:\Users\FGuo\Documents\work doucment\attachment\attachmentDB\20161005\originalFileFromAerial\DOCSVC_20161003.tar\DOCSVC_20161003\Sect2\INPATIENT\REQ_20160314-000024\Williamson, Georgia_Clinical_3-14-16_2016-03-16-09.42.26.679.pdf
Request;20160314-000025;86353;PACE;Inpatient;PACE;C:\Users\FGuo\Documents\work doucment\attachment\attachmentDB\20161005\originalFileFromAerial\DOCSVC_20161003.tar\DOCSVC_20161003\Sect2\INPATIENT\REQ_20160314-000025\tam teresa 31516_2016-03-15-13.16.59.942.tif
Request;20160314-000025;86353;PACE;Inpatient;PACE;C:\Users\FGuo\Documents\work doucment\attachment\attachmentDB\20161005\originalFileFromAerial\DOCSVC_20161003.tar\DOCSVC_20161003\Sect2\INPATIENT\REQ_20160314-000025\Tam Teresa IP Denial Beth Israel Medical Center 3-16-16_2016-03-16-14.14.27.1.pdf
Request;20160314-000025;86353;PACE;Inpatient;PACE;C:\Users\FGuo\Documents\work doucment\attachment\attachmentDB\20161005\originalFileFromAerial\DOCSVC_20161003.tar\DOCSVC_20161003\Sect2\INPATIENT\REQ_20160314-000025\Tam, Teresa - MS Beth Israel MC Petrie -Clinical Review Request Form 3-14-16_2016-03-14-12.24.10.908.docx
Request;20160314-000025;86353;PACE;Inpatient;PACE;C:\Users\FGuo\Documents\work doucment\attachment\attachmentDB\20161005\originalFileFromAerial\DOCSVC_20161003.tar\DOCSVC_20161003\Sect2\INPATIENT\REQ_20160314-000025\TAM, TERESA_MR1OF5_042116_2016-05-23-11.21.45.912.pdf
Request;20160314-000025;86353;PACE;Inpatient;PACE;C:\Users\FGuo\Documents\work doucment\attachment\attachmentDB\20161005\originalFileFromAerial\DOCSVC_20161003.tar\DOCSVC_20161003\Sect2\INPATIENT\REQ_20160314-000025\TAM, TERESA_MR2OF5_042116_2016-05-23-11.22.03.802.pdf
Request;20160314-000025;86353;PACE;Inpatient;PACE;C:\Users\FGuo\Documents\work doucment\attachment\attachmentDB\20161005\originalFileFromAerial\DOCSVC_20161003.tar\DOCSVC_20161003\Sect2\INPATIENT\REQ_20160314-000025\TAM, TERESA_MR3OF5_042116_2016-05-23-11.22.31.296.pdf
Request;20160314-000025;86353;PACE;Inpatient;PACE;C:\Users\FGuo\Documents\work doucment\attachment\attachmentDB\20161005\originalFileFromAerial\DOCSVC_20161003.tar\DOCSVC_20161003\Sect2\INPATIENT\REQ_20160314-000025\TAM, TERESA_MR4OF5_042116_2016-05-23-11.22.53.993.pdf
Request;20160314-000025;86353;PACE;Inpatient;PACE;C:\Users\FGuo\Documents\work doucment\attachment\attachmentDB\20161005\originalFileFromAerial\DOCSVC_20161003.tar\DOCSVC_20161003\Sect2\INPATIENT\REQ_20160314-000025\TAM, TERESA_MR5OF5_042116_2016-05-23-11.23.08.673.pdf
Request;20160314-000026;93653;PACE;Inpatient;PACE;C:\Users\FGuo\Documents\work doucment\attachment\attachmentDB\20161005\originalFileFromAerial\DOCSVC_20161003.tar\DOCSVC_20161003\Sect2\INPATIENT\REQ_20160314-000026\liang ou 32316_2016-03-23-17.34.25.84.tif
Request;20160314-000026;93653;PACE;Inpatient;PACE;C:\Users\FGuo\Documents\work doucment\attachment\attachmentDB\20161005\originalFileFromAerial\DOCSVC_20161003.tar\DOCSVC_20161003\Sect2\INPATIENT\REQ_20160314-000026\liang ou h31516_2016-03-15-13.05.12.958.tif
Request;20160314-000026;93653;PACE;Inpatient;PACE;C:\Users\FGuo\Documents\work doucment\attachment\attachmentDB\20161005\originalFileFromAerial\DOCSVC_20161003.tar\DOCSVC_20161003\Sect2\INPATIENT\REQ_20160314-000026\Liang, Ou - MS Beth Israel MC Petrie -Clinical Review Request Form 3-14-16_2016-03-14-12.29.14.901.docx
Request;20160314-000026;93653;PACE;Inpatient;PACE;C:\Users\FGuo\Documents\work doucment\attachment\attachmentDB\20161005\originalFileFromAerial\DOCSVC_20161003.tar\DOCSVC_20161003\Sect2\INPATIENT\REQ_20160314-000026\Liang.Ou.H__ Clinical Request Form__04.01.16_2016-04-01-14.14.26.658.docx
Request;20160314-000036;60380;SELECT;Inpatient;SELECT;C:\Users\FGuo\Documents\work doucment\attachment\attachmentDB\20161005\originalFileFromAerial\DOCSVC_20161003.tar\DOCSVC_20161003\Sect2\INPATIENT\REQ_20160314-000036\chan wai 32316_2016-03-23-19.38.23.696.tif
Request;20160314-000036;60380;SELECT;Inpatient;SELECT;C:\Users\FGuo\Documents\work doucment\attachment\attachmentDB\20161005\originalFileFromAerial\DOCSVC_20161003.tar\DOCSVC_20161003\Sect2\INPATIENT\REQ_20160314-000036\Chan Wai C pri and pt notes_2016-03-14-13.43.11.356.tif
Request;20160314-000037;54552;PACE;Inpatient;PACE;C:\Users\FGuo\Documents\work doucment\attachment\attachmentDB\20161005\originalFileFromAerial\DOCSVC_20161003.tar\DOCSVC_20161003\Sect2\INPATIENT\REQ_20160314-000037\COLEMAN, CARRIE -  BED HOLD_2016-03-14-14.01.20.548.pdf
Request;20160314-000039;71512;PACE;Inpatient;PACE;C:\Users\FGuo\Documents\work doucment\attachment\attachmentDB\20161005\originalFileFromAerial\DOCSVC_20161003.tar\DOCSVC_20161003\Sect2\INPATIENT\REQ_20160314-000039\esther johnson31516_2016-03-15-16.25.33.873.tif
Request;20160314-000039;71512;PACE;Inpatient;PACE;C:\Users\FGuo\Documents\work doucment\attachment\attachmentDB\20161005\originalFileFromAerial\DOCSVC_20161003.tar\DOCSVC_20161003\Sect2\INPATIENT\REQ_20160314-000039\Johnson Esther IP Denial Harlem Hospital Center 3-17-16_2016-03-17-16.28.22.78.pdf
Request;20160314-000039;71512;PACE;Inpatient;PACE;C:\Users\FGuo\Documents\work doucment\attachment\attachmentDB\20161005\originalFileFromAerial\DOCSVC_20161003.tar\DOCSVC_20161003\Sect2\INPATIENT\REQ_20160314-000039\JOHNSON, ESTHER_042516_2016-05-25-16.05.16.710.pdf
Request;20160314-000039;71512;PACE;Inpatient;PACE;C:\Users\FGuo\Documents\work doucment\attachment\attachmentDB\20161005\originalFileFromAerial\DOCSVC_20161003.tar\DOCSVC_20161003\Sect2\INPATIENT\REQ_20160314-000039\Johnson.Esther__HarlemHospitcal__Clinical Request Form_ 03.14.16_2016-03-14-15.06.45.83.docx
Request;20160314-000040;58879;null;Inpatient;DIRECT;C:\Users\FGuo\Documents\work doucment\attachment\attachmentDB\20161005\originalFileFromAerial\DOCSVC_20161003.tar\DOCSVC_20161003\Sect2\INPATIENT\REQ_20160314-000040\Davis David IP Denial White Plains Hospital 3-17-16_2016-03-17-16.37.04.496.pdf
Request;20160314-000040;58879;null;Inpatient;DIRECT;C:\Users\FGuo\Documents\work doucment\attachment\attachmentDB\20161005\originalFileFromAerial\DOCSVC_20161003.tar\DOCSVC_20161003\Sect2\INPATIENT\REQ_20160314-000040\davis, david_3-11-16_2016-03-15-15.52.42.984.pdf
Request;20160314-000040;58879;null;Inpatient;DIRECT;C:\Users\FGuo\Documents\work doucment\attachment\attachmentDB\20161005\originalFileFromAerial\DOCSVC_20161003.tar\DOCSVC_20161003\Sect2\INPATIENT\REQ_20160314-000040\Davis.D.__White Plains Hospital Center__Clinical Request Form_ 03.14.16_2016-03-14-15.05.33.489.docx
Request;20160314-000040;58879;null;Inpatient;DIRECT;C:\Users\FGuo\Documents\work doucment\attachment\attachmentDB\20161005\originalFileFromAerial\DOCSVC_20161003.tar\DOCSVC_20161003\Sect2\INPATIENT\REQ_20160314-000040\O_\Waters Place\Aerial\Auth Req_Clinicals\Davis.D.__White Plains Hospital Center__Clinical Request Form_ 03.14.16_2016-03-14-15.04.18.778.docx
Request;20160314-000044;25238;SELECT;Inpatient;SELECT;C:\Users\FGuo\Documents\work doucment\attachment\attachmentDB\20161005\originalFileFromAerial\DOCSVC_20161003.tar\DOCSVC_20161003\Sect2\INPATIENT\REQ_20160314-000044\O_\BA-FAX1_1603111441454982VernikovaDC_2016-03-14-15.55.40.794
Request;20160314-000046;94347;PACE;Inpatient;PACE;C:\Users\FGuo\Documents\work doucment\attachment\attachmentDB\20161005\originalFileFromAerial\DOCSVC_20161003.tar\DOCSVC_20161003\Sect2\INPATIENT\REQ_20160314-000046\06062016 Rosa, Altagracia_2016-06-23-10.30.49.999.pdf
Request;20160314-000046;94347;PACE;Inpatient;PACE;C:\Users\FGuo\Documents\work doucment\attachment\attachmentDB\20161005\originalFileFromAerial\DOCSVC_20161003.tar\DOCSVC_20161003\Sect2\INPATIENT\REQ_20160314-000046\Rosa Altagracia IP Denial Montefiore Medical Center 3-18-16_2016-03-18-12.12.22.754.pdf
Request;20160314-000046;94347;PACE;Inpatient;PACE;C:\Users\FGuo\Documents\work doucment\attachment\attachmentDB\20161005\originalFileFromAerial\DOCSVC_20161003.tar\DOCSVC_20161003\Sect2\INPATIENT\REQ_20160314-000046\Rosa, A 94347 3-14-16_2016-03-15-14.11.17.748.tif
Request;20160314-000046;94347;PACE;Inpatient;PACE;C:\Users\FGuo\Documents\work doucment\attachment\attachmentDB\20161005\originalFileFromAerial\DOCSVC_20161003.tar\DOCSVC_20161003\Sect2\INPATIENT\REQ_20160314-000046\ROSA, ALTAGRACIA - CLINICAL REVIEW REQUEST FORM_2016-03-14-16.12.55.724.doc
Request;20160314-000050;49148;PACE;Inpatient;PACE;C:\Users\FGuo\Documents\work doucment\attachment\attachmentDB\20161005\originalFileFromAerial\DOCSVC_20161003.tar\DOCSVC_20161003\Sect2\INPATIENT\REQ_20160314-000050\Toussaint, Oneil  BETH ISRAEL MEDICAL CENTER- KINGS HIGHWAY_2016-03-17-11.07.31.426.doc
Request;20160314-000051;28932;PACE;Inpatient;PACE;C:\Users\FGuo\Documents\work doucment\attachment\attachmentDB\20161005\originalFileFromAerial\DOCSVC_20161003.tar\DOCSVC_20161003\Sect2\INPATIENT\REQ_20160314-000051\O_\28932 BAKER, RHONDA APPROVAL LTR_2016-03-23-09.45.00.509.docx
Request;20160314-000051;28932;PACE;Inpatient;PACE;C:\Users\FGuo\Documents\work doucment\attachment\attachmentDB\20161005\originalFileFromAerial\DOCSVC_20161003.tar\DOCSVC_20161003\Sect2\INPATIENT\REQ_20160314-000051\O_\28932 BAKER, RHONDA CLINICALS_2016-03-17-11.22.45.851.tif
Request;20160314-000051;28932;PACE;Inpatient;PACE;C:\Users\FGuo\Documents\work doucment\attachment\attachmentDB\20161005\originalFileFromAerial\DOCSVC_20161003.tar\DOCSVC_20161003\Sect2\INPATIENT\REQ_20160314-000051\O_\28932 BAKER, RHONDA UR REQ SHEET_2016-03-14-16.28.25.708.doc
