Request;20150617-000001;T1;PACE;Inpatient;PACE;C:\Users\FGuo\Documents\work doucment\attachment\attachmentDB\20161005\originalFileFromAerial\DOCSVC_20161003.tar\DOCSVC_20161003\DOCSVC_20161003\INPATIENT\REQ_20150617-000001\AerialRequestModificationTracker_2015-10-21-12.51.54.493.docx
Request;20150617-000001;T1;PACE;Inpatient;PACE;C:\Users\FGuo\Documents\work doucment\attachment\attachmentDB\20161005\originalFileFromAerial\DOCSVC_20161003.tar\DOCSVC_20161003\DOCSVC_20161003\INPATIENT\REQ_20150617-000001\ProviderFeed_2015-10-21-12.52.03.979.docx
Request;20150706-000009;54180;null;Inpatient;PACE;C:\Users\FGuo\Documents\work doucment\attachment\attachmentDB\20161005\originalFileFromAerial\DOCSVC_20161003.tar\DOCSVC_20161003\DOCSVC_20161003\INPATIENT\REQ_20150706-000009\Francisca Torresdecastro PRI 7-6-15_2015-07-06-13.50.22.483.tif
Request;20150706-000009;54180;null;Inpatient;PACE;C:\Users\FGuo\Documents\work doucment\attachment\attachmentDB\20161005\originalFileFromAerial\DOCSVC_20161003.tar\DOCSVC_20161003\DOCSVC_20161003\INPATIENT\REQ_20150706-000009\Torresdelcastro, Francisca- Queens Boulevard Extended Care   7.7.15_2015-07-22-12.44.54.262.docx
Request;20150715-000002;97334;PACE;Inpatient;PACE;C:\Users\FGuo\Documents\work doucment\attachment\attachmentDB\20161005\originalFileFromAerial\DOCSVC_20161003.tar\DOCSVC_20161003\DOCSVC_20161003\INPATIENT\REQ_20150715-000002\alice robinson12_2015-07-20-11.24.28.114.tif
Request;20150715-000002;97334;PACE;Inpatient;PACE;C:\Users\FGuo\Documents\work doucment\attachment\attachmentDB\20161005\originalFileFromAerial\DOCSVC_20161003.tar\DOCSVC_20161003\DOCSVC_20161003\INPATIENT\REQ_20150715-000002\alice robinson12_2015-07-21-12.44.59.809.tif
Request;20150715-000002;97334;PACE;Inpatient;PACE;C:\Users\FGuo\Documents\work doucment\attachment\attachmentDB\20161005\originalFileFromAerial\DOCSVC_20161003.tar\DOCSVC_20161003\DOCSVC_20161003\INPATIENT\REQ_20150715-000002\ROBINSON alice 97334 - hosp 7 15_2015-07-15-17.12.57.825.msg
Request;20150715-000003;24029;PACE;Inpatient;PACE;C:\Users\FGuo\Documents\work doucment\attachment\attachmentDB\20161005\originalFileFromAerial\DOCSVC_20161003.tar\DOCSVC_20161003\DOCSVC_20161003\INPATIENT\REQ_20150715-000003\Gshauvo 71515_2015-07-15-17.15.01.659.tif
Request;20150715-000004;23678;SELECT;Inpatient;SELECT;C:\Users\FGuo\Documents\work doucment\attachment\attachmentDB\20161005\originalFileFromAerial\DOCSVC_20161003.tar\DOCSVC_20161003\DOCSVC_20161003\INPATIENT\REQ_20150715-000004\FStewart_2015-07-15-17.27.06.87.tif
Request;20150715-000004;23678;SELECT;Inpatient;SELECT;C:\Users\FGuo\Documents\work doucment\attachment\attachmentDB\20161005\originalFileFromAerial\DOCSVC_20161003.tar\DOCSVC_20161003\DOCSVC_20161003\INPATIENT\REQ_20150715-000004\SFitzgerald_2015-09-02-17.22.10.203.tif
Request;20150716-000005;38706;PACE;Inpatient;PACE;C:\Users\FGuo\Documents\work doucment\attachment\attachmentDB\20161005\originalFileFromAerial\DOCSVC_20161003.tar\DOCSVC_20161003\DOCSVC_20161003\INPATIENT\REQ_20150716-000005\Evelyn Tepper UR 7-16-15_2015-07-16-12.03.21.668.tif
Request;20150716-000006;40365;PACE;Inpatient;PACE;C:\Users\FGuo\Documents\work doucment\attachment\attachmentDB\20161005\originalFileFromAerial\DOCSVC_20161003.tar\DOCSVC_20161003\DOCSVC_20161003\INPATIENT\REQ_20150716-000006\Ahmed Sultan-Our Lady of Consolation 7-17-15_2015-07-17-15.04.22.708.docx
Request;20150716-000006;40365;PACE;Inpatient;PACE;C:\Users\FGuo\Documents\work doucment\attachment\attachmentDB\20161005\originalFileFromAerial\DOCSVC_20161003.tar\DOCSVC_20161003\DOCSVC_20161003\INPATIENT\REQ_20150716-000006\ahmed sultan717_2015-07-20-13.59.18.818.tif
Request;20150716-000014;56591;PACE;Inpatient;PACE;C:\Users\FGuo\Documents\work doucment\attachment\attachmentDB\20161005\originalFileFromAerial\DOCSVC_20161003.tar\DOCSVC_20161003\DOCSVC_20161003\INPATIENT\REQ_20150716-000014\Guevara, Paul- United Hebrew Geriatric Center  7.22.15_2015-07-22-16.53.00.402.docx
Request;20150716-000014;56591;PACE;Inpatient;PACE;C:\Users\FGuo\Documents\work doucment\attachment\attachmentDB\20161005\originalFileFromAerial\DOCSVC_20161003.tar\DOCSVC_20161003\DOCSVC_20161003\INPATIENT\REQ_20150716-000014\LTC cancellation - Paul Guevara_2015-08-12-15.39.36.300.txt
Request;20150717-000005;78518;PACE;Inpatient;PACE;C:\Users\FGuo\Documents\work doucment\attachment\attachmentDB\20161005\originalFileFromAerial\DOCSVC_20161003.tar\DOCSVC_20161003\DOCSVC_20161003\INPATIENT\REQ_20150717-000005\Alami Ouali, Aicha -Mount Sinai Hospital -Clinical Review Request Form 7-17-15_2015-07-17-10.25.42.593.docx
Request;20150717-000011;70257;PACE;Inpatient;PACE;C:\Users\FGuo\Documents\work doucment\attachment\attachmentDB\20161005\originalFileFromAerial\DOCSVC_20161003.tar\DOCSVC_20161003\DOCSVC_20161003\INPATIENT\REQ_20150717-000011\ALipkina_2015-07-24-11.24.43.525.tif
Request;20150717-000011;70257;PACE;Inpatient;PACE;C:\Users\FGuo\Documents\work doucment\attachment\attachmentDB\20161005\originalFileFromAerial\DOCSVC_20161003.tar\DOCSVC_20161003\DOCSVC_20161003\INPATIENT\REQ_20150717-000011\Lipkina Anna IP Denial Coney Island  Hospital 7-27-15_2015-07-27-14.23.22.240.docx
Request;20150717-000014;79779;SELECT;Inpatient;SELECT;C:\Users\FGuo\Documents\work doucment\attachment\attachmentDB\20161005\originalFileFromAerial\DOCSVC_20161003.tar\DOCSVC_20161003\DOCSVC_20161003\INPATIENT\REQ_20150717-000014\CCobo_2015-07-17-11.22.13.179.tif
Request;20150717-000022;33220;PACE;Inpatient;PACE;C:\Users\FGuo\Documents\work doucment\attachment\attachmentDB\20161005\originalFileFromAerial\DOCSVC_20161003.tar\DOCSVC_20161003\DOCSVC_20161003\INPATIENT\REQ_20150717-000022\Greene, Ursula---NS Franklin Hospital  Clinical Review Request Form 7-17-15_2015-07-17-14.31.07.231.docx
Request;20150717-000022;33220;PACE;Inpatient;PACE;C:\Users\FGuo\Documents\work doucment\attachment\attachmentDB\20161005\originalFileFromAerial\DOCSVC_20161003.tar\DOCSVC_20161003\DOCSVC_20161003\INPATIENT\REQ_20150717-000022\Ursula Greene UR 7-20-15_2015-07-20-12.23.26.78.tif
Request;20150717-000025;75816;PACE;Inpatient;PACE;C:\Users\FGuo\Documents\work doucment\attachment\attachmentDB\20161005\originalFileFromAerial\DOCSVC_20161003.tar\DOCSVC_20161003\DOCSVC_20161003\INPATIENT\REQ_20150717-000025\cordero evan 7 14 15_2015-07-17-15.03.50.690.pdf
Request;20150717-000025;75816;PACE;Inpatient;PACE;C:\Users\FGuo\Documents\work doucment\attachment\attachmentDB\20161005\originalFileFromAerial\DOCSVC_20161003.tar\DOCSVC_20161003\DOCSVC_20161003\INPATIENT\REQ_20150717-000025\Cordero Evan IP Denial Beth Israel Petri 7-22-15_2015-07-23-09.56.58.759.docx
Request;20150717-000025;75816;PACE;Inpatient;PACE;C:\Users\FGuo\Documents\work doucment\attachment\attachmentDB\20161005\originalFileFromAerial\DOCSVC_20161003.tar\DOCSVC_20161003\DOCSVC_20161003\INPATIENT\REQ_20150717-000025\cordero evan ur 7 14_2015-07-17-15.07.22.885.pdf
Request;20150717-000025;75816;PACE;Inpatient;PACE;C:\Users\FGuo\Documents\work doucment\attachment\attachmentDB\20161005\originalFileFromAerial\DOCSVC_20161003.tar\DOCSVC_20161003\DOCSVC_20161003\INPATIENT\REQ_20150717-000025\Cordero, Evan 100931928 LETTER_2015-09-02-14.12.32.377.pdf
Request;20150717-000025;75816;PACE;Inpatient;PACE;C:\Users\FGuo\Documents\work doucment\attachment\attachmentDB\20161005\originalFileFromAerial\DOCSVC_20161003.tar\DOCSVC_20161003\DOCSVC_20161003\INPATIENT\REQ_20150717-000025\Cordero, Evan Appeal Ack Letter_2015-09-02-14.12.55.630.docx
Request;20150717-000025;75816;PACE;Inpatient;PACE;C:\Users\FGuo\Documents\work doucment\attachment\attachmentDB\20161005\originalFileFromAerial\DOCSVC_20161003.tar\DOCSVC_20161003\DOCSVC_20161003\INPATIENT\REQ_20150717-000025\Cordero, Evan Final Adverse Determination Appeal Unfavorable-Contracted Hospitals_2015-09-14-14.17.42.739.docx
Request;20150717-000025;75816;PACE;Inpatient;PACE;C:\Users\FGuo\Documents\work doucment\attachment\attachmentDB\20161005\originalFileFromAerial\DOCSVC_20161003.tar\DOCSVC_20161003\DOCSVC_20161003\INPATIENT\REQ_20150717-000025\Cordero, Evan Final Adverse Determination Appeal Unfavorable-Contracted Hospitals_2015-09-15-16.46.37.218.docx
Request;20150717-000025;75816;PACE;Inpatient;PACE;C:\Users\FGuo\Documents\work doucment\attachment\attachmentDB\20161005\originalFileFromAerial\DOCSVC_20161003.tar\DOCSVC_20161003\DOCSVC_20161003\INPATIENT\REQ_20150717-000025\CORDERO,EVAN  MR # 212461 FILE_2015-09-02-14.12.13.779.pdf
Request;20150717-000031;24029;PACE;Inpatient;PACE;C:\Users\FGuo\Documents\work doucment\attachment\attachmentDB\20161005\originalFileFromAerial\DOCSVC_20161003.tar\DOCSVC_20161003\DOCSVC_20161003\INPATIENT\REQ_20150717-000031\Shauvo, Galen - Crown Nursing Home Associates  7.23.15_2015-07-23-12.30.16.996.docx
Request;20150717-000033;42971;PACE;Inpatient;PACE;C:\Users\FGuo\Documents\work doucment\attachment\attachmentDB\20161005\originalFileFromAerial\DOCSVC_20161003.tar\DOCSVC_20161003\DOCSVC_20161003\INPATIENT\REQ_20150717-000033\Rivera Sergio-Shoreview NH 7-20-15_2015-07-20-16.27.41.885.docx
Request;20150720-000008;36313;PACE;Inpatient;PACE;C:\Users\FGuo\Documents\work doucment\attachment\attachmentDB\20161005\originalFileFromAerial\DOCSVC_20161003.tar\DOCSVC_20161003\DOCSVC_20161003\INPATIENT\REQ_20150720-000008\Blair Linda  PACE-NY Methodist Hospital 7-28-15_2015-07-28-11.18.10.554.docx
Request;20150720-000008;36313;PACE;Inpatient;PACE;C:\Users\FGuo\Documents\work doucment\attachment\attachmentDB\20161005\originalFileFromAerial\DOCSVC_20161003.tar\DOCSVC_20161003\DOCSVC_20161003\INPATIENT\REQ_20150720-000008\Blair Linda  PACE-NY Methodist Hospital 7-28-15_2015-08-25-11.35.37.135.docx
Request;20150720-000008;36313;PACE;Inpatient;PACE;C:\Users\FGuo\Documents\work doucment\attachment\attachmentDB\20161005\originalFileFromAerial\DOCSVC_20161003.tar\DOCSVC_20161003\DOCSVC_20161003\INPATIENT\REQ_20150720-000008\Blair Linda IP Denial NY Methodist Hospital 8-25-15_2015-08-25-13.48.34.442.docx
Request;20150720-000008;36313;PACE;Inpatient;PACE;C:\Users\FGuo\Documents\work doucment\attachment\attachmentDB\20161005\originalFileFromAerial\DOCSVC_20161003.tar\DOCSVC_20161003\DOCSVC_20161003\INPATIENT\REQ_20150720-000008\Blair, Linda 36313 CLINICAL REVIEW REQUEST FORM.doc 7 20 15_2015-07-20-09.41.29.979.doc
Request;20150720-000008;36313;PACE;Inpatient;PACE;C:\Users\FGuo\Documents\work doucment\attachment\attachmentDB\20161005\originalFileFromAerial\DOCSVC_20161003.tar\DOCSVC_20161003\DOCSVC_20161003\INPATIENT\REQ_20150720-000008\LBlair_2015-07-28-12.11.59.245.tif
Request;20150720-000008;36313;PACE;Inpatient;PACE;C:\Users\FGuo\Documents\work doucment\attachment\attachmentDB\20161005\originalFileFromAerial\DOCSVC_20161003.tar\DOCSVC_20161003\DOCSVC_20161003\INPATIENT\REQ_20150720-000008\MR part 1_2015-11-02-11.19.27.678.pdf
Request;20150720-000008;36313;PACE;Inpatient;PACE;C:\Users\FGuo\Documents\work doucment\attachment\attachmentDB\20161005\originalFileFromAerial\DOCSVC_20161003.tar\DOCSVC_20161003\DOCSVC_20161003\INPATIENT\REQ_20150720-000008\MR part 2_2015-11-02-11.19.58.399.pdf
Request;20150720-000008;36313;PACE;Inpatient;PACE;C:\Users\FGuo\Documents\work doucment\attachment\attachmentDB\20161005\originalFileFromAerial\DOCSVC_20161003.tar\DOCSVC_20161003\DOCSVC_20161003\INPATIENT\REQ_20150720-000008\MR part 3_2015-11-02-11.20.54.411.pdf
Request;20150720-000008;36313;PACE;Inpatient;PACE;C:\Users\FGuo\Documents\work doucment\attachment\attachmentDB\20161005\originalFileFromAerial\DOCSVC_20161003.tar\DOCSVC_20161003\DOCSVC_20161003\INPATIENT\REQ_20150720-000008\PRA-1  Appeal Acknowledgement _2015-09-15-13.13.18.132.docx
Request;20150720-000008;36313;PACE;Inpatient;PACE;C:\Users\FGuo\Documents\work doucment\attachment\attachmentDB\20161005\originalFileFromAerial\DOCSVC_20161003.tar\DOCSVC_20161003\DOCSVC_20161003\INPATIENT\REQ_20150720-000008\PRNCA-1 PACE Final Adverse Determination- Appeal  Unfavorable Non-Contracted Hospitals_2015-11-19-15.49.03.430.docx
Request;20150720-000009;58329;null;Inpatient;PACE;C:\Users\FGuo\Documents\work doucment\attachment\attachmentDB\20161005\originalFileFromAerial\DOCSVC_20161003.tar\DOCSVC_20161003\DOCSVC_20161003\INPATIENT\REQ_20150720-000009\CTaylor_2015-07-28-17.36.04.139.tif
Request;20150720-000009;58329;null;Inpatient;PACE;C:\Users\FGuo\Documents\work doucment\attachment\attachmentDB\20161005\originalFileFromAerial\DOCSVC_20161003.tar\DOCSVC_20161003\DOCSVC_20161003\INPATIENT\REQ_20150720-000009\Taylor, Carol---Kingsbrook J MC---Clinical Review Request Form 7-20-15_2015-07-20-09.49.54.544.docx
Request;20150720-000011;48553;PACE;Inpatient;PACE;C:\Users\FGuo\Documents\work doucment\attachment\attachmentDB\20161005\originalFileFromAerial\DOCSVC_20161003.tar\DOCSVC_20161003\DOCSVC_20161003\INPATIENT\REQ_20150720-000011\Petrosyan Serho IP Admit Maimonides Medical Center 8-3-15_2015-08-03-16.22.06.38.docx
Request;20150720-000011;48553;PACE;Inpatient;PACE;C:\Users\FGuo\Documents\work doucment\attachment\attachmentDB\20161005\originalFileFromAerial\DOCSVC_20161003.tar\DOCSVC_20161003\DOCSVC_20161003\INPATIENT\REQ_20150720-000011\Petrosyan, Serho_2015-07-20-10.33.50.916.tif
Request;20150720-000011;48553;PACE;Inpatient;PACE;C:\Users\FGuo\Documents\work doucment\attachment\attachmentDB\20161005\originalFileFromAerial\DOCSVC_20161003.tar\DOCSVC_20161003\DOCSVC_20161003\INPATIENT\REQ_20150720-000011\SPetrosyan_2015-07-24-14.48.48.259.tif
Request;20150720-000014;55100;DIRECT;Inpatient;DIRECT;C:\Users\FGuo\Documents\work doucment\attachment\attachmentDB\20161005\originalFileFromAerial\DOCSVC_20161003.tar\DOCSVC_20161003\DOCSVC_20161003\INPATIENT\REQ_20150720-000014\Santiago, Raphael 55100 CLINICAL REVIEW REQUEST FORM.doc 7 20 15_2015-07-20-11.25.41.596.doc
Request;20150720-000014;55100;DIRECT;Inpatient;DIRECT;C:\Users\FGuo\Documents\work doucment\attachment\attachmentDB\20161005\originalFileFromAerial\DOCSVC_20161003.tar\DOCSVC_20161003\DOCSVC_20161003\INPATIENT\REQ_20150720-000014\santiago, raphael_2015-07-27-08.15.44.62.tif
Request;20150720-000015;97334;PACE;Inpatient;PACE;C:\Users\FGuo\Documents\work doucment\attachment\attachmentDB\20161005\originalFileFromAerial\DOCSVC_20161003.tar\DOCSVC_20161003\DOCSVC_20161003\INPATIENT\REQ_20150720-000015\Alice Robinson PRI_2015-07-20-13.55.15.698.tif
Request;20150720-000015;97334;PACE;Inpatient;PACE;C:\Users\FGuo\Documents\work doucment\attachment\attachmentDB\20161005\originalFileFromAerial\DOCSVC_20161003.tar\DOCSVC_20161003\DOCSVC_20161003\INPATIENT\REQ_20150720-000015\alice robinson11_2015-08-11-13.55.03.493.tif
Request;20150720-000015;97334;PACE;Inpatient;PACE;C:\Users\FGuo\Documents\work doucment\attachment\attachmentDB\20161005\originalFileFromAerial\DOCSVC_20161003.tar\DOCSVC_20161003\DOCSVC_20161003\INPATIENT\REQ_20150720-000015\alice robinson28_2015-07-29-19.22.44.570.tif
Request;20150720-000015;97334;PACE;Inpatient;PACE;C:\Users\FGuo\Documents\work doucment\attachment\attachmentDB\20161005\originalFileFromAerial\DOCSVC_20161003.tar\DOCSVC_20161003\DOCSVC_20161003\INPATIENT\REQ_20150720-000015\alice robinson803_2015-08-05-13.54.51.719.tif
Request;20150720-000015;97334;PACE;Inpatient;PACE;C:\Users\FGuo\Documents\work doucment\attachment\attachmentDB\20161005\originalFileFromAerial\DOCSVC_20161003.tar\DOCSVC_20161003\DOCSVC_20161003\INPATIENT\REQ_20150720-000015\alice robinson803_2015-08-05-13.56.26.761.tif
Request;20150720-000015;97334;PACE;Inpatient;PACE;C:\Users\FGuo\Documents\work doucment\attachment\attachmentDB\20161005\originalFileFromAerial\DOCSVC_20161003.tar\DOCSVC_20161003\DOCSVC_20161003\INPATIENT\REQ_20150720-000015\Robinson, Alice - The Riverside LLC - 7-21-15_2015-07-21-13.44.12.457.docx
Request;20150720-000015;97334;PACE;Inpatient;PACE;C:\Users\FGuo\Documents\work doucment\attachment\attachmentDB\20161005\originalFileFromAerial\DOCSVC_20161003.tar\DOCSVC_20161003\DOCSVC_20161003\INPATIENT\REQ_20150720-000015\Robinson, Alice - The Riverside LLC - 7-21-15_2015-07-21-13.48.43.28.docx
Request;20150720-000015;97334;PACE;Inpatient;PACE;C:\Users\FGuo\Documents\work doucment\attachment\attachmentDB\20161005\originalFileFromAerial\DOCSVC_20161003.tar\DOCSVC_20161003\DOCSVC_20161003\INPATIENT\REQ_20150720-000015\_2015-08-05-13.55.02.658
Request;20150720-000015;97334;PACE;Inpatient;PACE;C:\Users\FGuo\Documents\work doucment\attachment\attachmentDB\20161005\originalFileFromAerial\DOCSVC_20161003.tar\DOCSVC_20161003\DOCSVC_20161003\INPATIENT\REQ_20150720-000015\_2015-08-05-13.56.05.900
Request;20150720-000018;23397;SELECT;Inpatient;SELECT;C:\Users\FGuo\Documents\work doucment\attachment\attachmentDB\20161005\originalFileFromAerial\DOCSVC_20161003.tar\DOCSVC_20161003\DOCSVC_20161003\INPATIENT\REQ_20150720-000018\RFattorusso PRI_2015-07-20-12.07.26.852.tif
Request;20150720-000019;25160;PACE;Inpatient;PACE;C:\Users\FGuo\Documents\work doucment\attachment\attachmentDB\20161005\originalFileFromAerial\DOCSVC_20161003.tar\DOCSVC_20161003\DOCSVC_20161003\INPATIENT\REQ_20150720-000019\martin,marie_2015-08-06-15.40.44.66.tif
Request;20150720-000019;25160;PACE;Inpatient;PACE;C:\Users\FGuo\Documents\work doucment\attachment\attachmentDB\20161005\originalFileFromAerial\DOCSVC_20161003.tar\DOCSVC_20161003\DOCSVC_20161003\INPATIENT\REQ_20150720-000019\martinDC_2015-08-06-15.41.13.230.tif
Request;20150720-000019;25160;PACE;Inpatient;PACE;C:\Users\FGuo\Documents\work doucment\attachment\attachmentDB\20161005\originalFileFromAerial\DOCSVC_20161003.tar\DOCSVC_20161003\DOCSVC_20161003\INPATIENT\REQ_20150720-000019\_2015-08-06-15.39.29.89
Request;20150720-000019;25160;PACE;Inpatient;PACE;C:\Users\FGuo\Documents\work doucment\attachment\attachmentDB\20161005\originalFileFromAerial\DOCSVC_20161003.tar\DOCSVC_20161003\DOCSVC_20161003\INPATIENT\REQ_20150720-000019\_2015-08-06-15.39.34.734
Request;20150720-000019;25160;PACE;Inpatient;PACE;C:\Users\FGuo\Documents\work doucment\attachment\attachmentDB\20161005\originalFileFromAerial\DOCSVC_20161003.tar\DOCSVC_20161003\DOCSVC_20161003\INPATIENT\REQ_20150720-000019\_2015-08-06-15.39.58.619
Request;20150720-000021;79088;PACE;Inpatient;PACE;C:\Users\FGuo\Documents\work doucment\attachment\attachmentDB\20161005\originalFileFromAerial\DOCSVC_20161003.tar\DOCSVC_20161003\DOCSVC_20161003\INPATIENT\REQ_20150720-000021\Holmes Alice IP Denial Montefiore Medical Center 8-7-15_2015-08-07-13.25.45.707.docx
Request;20150720-000021;79088;PACE;Inpatient;PACE;C:\Users\FGuo\Documents\work doucment\attachment\attachmentDB\20161005\originalFileFromAerial\DOCSVC_20161003.tar\DOCSVC_20161003\DOCSVC_20161003\INPATIENT\REQ_20150720-000021\Holmes, Alice Appeal Ack letter_2015-09-10-12.29.17.235.docx
Request;20150720-000021;79088;PACE;Inpatient;PACE;C:\Users\FGuo\Documents\work doucment\attachment\attachmentDB\20161005\originalFileFromAerial\DOCSVC_20161003.tar\DOCSVC_20161003\DOCSVC_20161003\INPATIENT\REQ_20150720-000021\Holmes, Alice---Montefiore North- Clinical Review Request Form 7-20-15_2015-07-20-12.31.41.210.docx
Request;20150720-000021;79088;PACE;Inpatient;PACE;C:\Users\FGuo\Documents\work doucment\attachment\attachmentDB\20161005\originalFileFromAerial\DOCSVC_20161003.tar\DOCSVC_20161003\DOCSVC_20161003\INPATIENT\REQ_20150720-000021\holmes2_2015-07-29-14.17.31.644.tif
Request;20150720-000021;79088;PACE;Inpatient;PACE;C:\Users\FGuo\Documents\work doucment\attachment\attachmentDB\20161005\originalFileFromAerial\DOCSVC_20161003.tar\DOCSVC_20161003\DOCSVC_20161003\INPATIENT\REQ_20150720-000021\holmesDC_2015-08-06-15.22.46.460.tif
Request;20150720-000021;79088;PACE;Inpatient;PACE;C:\Users\FGuo\Documents\work doucment\attachment\attachmentDB\20161005\originalFileFromAerial\DOCSVC_20161003.tar\DOCSVC_20161003\DOCSVC_20161003\INPATIENT\REQ_20150720-000021\holmes_2015-07-20-15.57.07.187.tif
Request;20150720-000021;79088;PACE;Inpatient;PACE;C:\Users\FGuo\Documents\work doucment\attachment\attachmentDB\20161005\originalFileFromAerial\DOCSVC_20161003.tar\DOCSVC_20161003\DOCSVC_20161003\INPATIENT\REQ_20150720-000021\holmes_2015-07-23-11.41.58.992.tif
Request;20150720-000021;79088;PACE;Inpatient;PACE;C:\Users\FGuo\Documents\work doucment\attachment\attachmentDB\20161005\originalFileFromAerial\DOCSVC_20161003.tar\DOCSVC_20161003\DOCSVC_20161003\INPATIENT\REQ_20150720-000021\_2015-08-06-15.22.26.605
Request;20150720-000021;79088;PACE;Inpatient;PACE;C:\Users\FGuo\Documents\work doucment\attachment\attachmentDB\20161005\originalFileFromAerial\DOCSVC_20161003.tar\DOCSVC_20161003\DOCSVC_20161003\INPATIENT\REQ_20150720-000021\_2015-08-06-15.22.32.82
Request;20150720-000022;54032;DIRECT;Inpatient;DIRECT;C:\Users\FGuo\Documents\work doucment\attachment\attachmentDB\20161005\originalFileFromAerial\DOCSVC_20161003.tar\DOCSVC_20161003\DOCSVC_20161003\INPATIENT\REQ_20150720-000022\DEVINE, MARGARET_2015-07-20-12.37.11.107.tif
Request;20150720-000023;99612;PACE;Inpatient;PACE;C:\Users\FGuo\Documents\work doucment\attachment\attachmentDB\20161005\originalFileFromAerial\DOCSVC_20161003.tar\DOCSVC_20161003\DOCSVC_20161003\INPATIENT\REQ_20150720-000023\Eguez Gloria  IP Denial Montefiore Medical Center 7-22-15_2015-07-23-09.48.29.700.docx
Request;20150720-000023;99612;PACE;Inpatient;PACE;C:\Users\FGuo\Documents\work doucment\attachment\attachmentDB\20161005\originalFileFromAerial\DOCSVC_20161003.tar\DOCSVC_20161003\DOCSVC_20161003\INPATIENT\REQ_20150720-000023\Eguez, Gloria Appeal Ack Letter_2015-09-16-13.52.18.253.docx
Request;20150720-000023;99612;PACE;Inpatient;PACE;C:\Users\FGuo\Documents\work doucment\attachment\attachmentDB\20161005\originalFileFromAerial\DOCSVC_20161003.tar\DOCSVC_20161003\DOCSVC_20161003\INPATIENT\REQ_20150720-000023\Eguez, Gloria Final Adverse Determination Appeal Unfavorable-Contracted Hospitals_2015-10-02-14.25.22.680.docx
Request;20150720-000023;99612;PACE;Inpatient;PACE;C:\Users\FGuo\Documents\work doucment\attachment\attachmentDB\20161005\originalFileFromAerial\DOCSVC_20161003.tar\DOCSVC_20161003\DOCSVC_20161003\INPATIENT\REQ_20150720-000023\Eguez, Gloria Final Adverse Determination Appeal Unfavorable-Contracted Hospitals_2015-10-02-14.25.41.306.docx
Request;20150720-000023;99612;PACE;Inpatient;PACE;C:\Users\FGuo\Documents\work doucment\attachment\attachmentDB\20161005\originalFileFromAerial\DOCSVC_20161003.tar\DOCSVC_20161003\DOCSVC_20161003\INPATIENT\REQ_20150720-000023\Eguez, Gloria MR-1_2015-09-28-10.24.18.428.pdf
Request;20150720-000023;99612;PACE;Inpatient;PACE;C:\Users\FGuo\Documents\work doucment\attachment\attachmentDB\20161005\originalFileFromAerial\DOCSVC_20161003.tar\DOCSVC_20161003\DOCSVC_20161003\INPATIENT\REQ_20150720-000023\Eguez, Gloria MR-2_2015-09-28-10.24.42.441.pdf
Request;20150720-000023;99612;PACE;Inpatient;PACE;C:\Users\FGuo\Documents\work doucment\attachment\attachmentDB\20161005\originalFileFromAerial\DOCSVC_20161003.tar\DOCSVC_20161003\DOCSVC_20161003\INPATIENT\REQ_20150720-000023\eguez, gloria_2015-07-20-15.43.09.500.tif
Request;20150720-000024;57158;DIRECT;Inpatient;DIRECT;C:\Users\FGuo\Documents\work doucment\attachment\attachmentDB\20161005\originalFileFromAerial\DOCSVC_20161003.tar\DOCSVC_20161003\DOCSVC_20161003\INPATIENT\REQ_20150720-000024\Medical Record_2015-11-04-09.52.16.50.pdf
Request;20150720-000024;57158;DIRECT;Inpatient;DIRECT;C:\Users\FGuo\Documents\work doucment\attachment\attachmentDB\20161005\originalFileFromAerial\DOCSVC_20161003.tar\DOCSVC_20161003\DOCSVC_20161003\INPATIENT\REQ_20150720-000024\Mercado Iris DIRECT IP Denial Montefiore Medical Center 7-24-15_2015-07-31-14.36.16.718.docx
Request;20150720-000024;57158;DIRECT;Inpatient;DIRECT;C:\Users\FGuo\Documents\work doucment\attachment\attachmentDB\20161005\originalFileFromAerial\DOCSVC_20161003.tar\DOCSVC_20161003\DOCSVC_20161003\INPATIENT\REQ_20150720-000024\mercado, I_2015-07-20-16.20.13.163.tif
Request;20150720-000024;57158;DIRECT;Inpatient;DIRECT;C:\Users\FGuo\Documents\work doucment\attachment\attachmentDB\20161005\originalFileFromAerial\DOCSVC_20161003.tar\DOCSVC_20161003\DOCSVC_20161003\INPATIENT\REQ_20150720-000024\PRA-1  Appeal Acknowledgement _2015-09-23-14.34.17.127.docx
Request;20150720-000024;57158;DIRECT;Inpatient;DIRECT;C:\Users\FGuo\Documents\work doucment\attachment\attachmentDB\20161005\originalFileFromAerial\DOCSVC_20161003.tar\DOCSVC_20161003\DOCSVC_20161003\INPATIENT\REQ_20150720-000024\PRA-2 Final Adverse Determination Appeal Unfavorable-Contracted Hospitals_2015-11-12-16.20.28.309.docx
Request;20150720-000025;78983;PACE;Inpatient;PACE;C:\Users\FGuo\Documents\work doucment\attachment\attachmentDB\20161005\originalFileFromAerial\DOCSVC_20161003.tar\DOCSVC_20161003\DOCSVC_20161003\INPATIENT\REQ_20150720-000025\Medical Record_2015-11-04-11.42.24.536.pdf
Request;20150720-000025;78983;PACE;Inpatient;PACE;C:\Users\FGuo\Documents\work doucment\attachment\attachmentDB\20161005\originalFileFromAerial\DOCSVC_20161003.tar\DOCSVC_20161003\DOCSVC_20161003\INPATIENT\REQ_20150720-000025\Portillo Benjamin IP Denial Montefiore Medical Center 7-24-15_2015-07-27-16.05.17.328.docx
Request;20150720-000025;78983;PACE;Inpatient;PACE;C:\Users\FGuo\Documents\work doucment\attachment\attachmentDB\20161005\originalFileFromAerial\DOCSVC_20161003.tar\DOCSVC_20161003\DOCSVC_20161003\INPATIENT\REQ_20150720-000025\portillo2_2015-07-22-12.01.50.381.tif
Request;20150720-000025;78983;PACE;Inpatient;PACE;C:\Users\FGuo\Documents\work doucment\attachment\attachmentDB\20161005\originalFileFromAerial\DOCSVC_20161003.tar\DOCSVC_20161003\DOCSVC_20161003\INPATIENT\REQ_20150720-000025\portillo_2015-07-21-08.53.37.217.tif
Request;20150720-000025;78983;PACE;Inpatient;PACE;C:\Users\FGuo\Documents\work doucment\attachment\attachmentDB\20161005\originalFileFromAerial\DOCSVC_20161003.tar\DOCSVC_20161003\DOCSVC_20161003\INPATIENT\REQ_20150720-000025\PRA-1  Appeal Acknowledgement _2015-09-30-11.40.57.155.docx
Request;20150720-000025;78983;PACE;Inpatient;PACE;C:\Users\FGuo\Documents\work doucment\attachment\attachmentDB\20161005\originalFileFromAerial\DOCSVC_20161003.tar\DOCSVC_20161003\DOCSVC_20161003\INPATIENT\REQ_20150720-000025\PRA-2 Final Adverse Determination Appeal Unfavorable-Contracted Hospitals_2015-11-06-10.10.04.284.docx
Request;20150720-000025;78983;PACE;Inpatient;PACE;C:\Users\FGuo\Documents\work doucment\attachment\attachmentDB\20161005\originalFileFromAerial\DOCSVC_20161003.tar\DOCSVC_20161003\DOCSVC_20161003\INPATIENT\REQ_20150720-000025\PRA-2 Final Adverse Determination Appeal Unfavorable-Contracted Hospitals_2015-11-06-12.16.37.21.docx
Request;20150720-000027;58032;PACE;Inpatient;PACE;C:\Users\FGuo\Documents\work doucment\attachment\attachmentDB\20161005\originalFileFromAerial\DOCSVC_20161003.tar\DOCSVC_20161003\DOCSVC_20161003\INPATIENT\REQ_20150720-000027\barbara friddie_2015-09-14-12.57.16.486.tif
Request;20150720-000027;58032;PACE;Inpatient;PACE;C:\Users\FGuo\Documents\work doucment\attachment\attachmentDB\20161005\originalFileFromAerial\DOCSVC_20161003.tar\DOCSVC_20161003\DOCSVC_20161003\INPATIENT\REQ_20150720-000027\Barbara Fridie.docx ltc req_2015-07-20-13.46.55.246.docx
Request;20150720-000027;58032;PACE;Inpatient;PACE;C:\Users\FGuo\Documents\work doucment\attachment\attachmentDB\20161005\originalFileFromAerial\DOCSVC_20161003.tar\DOCSVC_20161003\DOCSVC_20161003\INPATIENT\REQ_20150720-000027\Fridie, Barbara 58032 Auth Approval Letter_2015-09-14-16.26.58.324.doc
Request;20150720-000031;94347;PACE;Inpatient;PACE;C:\Users\FGuo\Documents\work doucment\attachment\attachmentDB\20161005\originalFileFromAerial\DOCSVC_20161003.tar\DOCSVC_20161003\DOCSVC_20161003\INPATIENT\REQ_20150720-000031\rosa, alta_2015-07-21-09.12.25.159.tif
Request;20150720-000032;53505;DIRECT;Inpatient;DIRECT;C:\Users\FGuo\Documents\work doucment\attachment\attachmentDB\20161005\originalFileFromAerial\DOCSVC_20161003.tar\DOCSVC_20161003\DOCSVC_20161003\INPATIENT\REQ_20150720-000032\Bell, Emma- Montefiore Med Cen-Moses-Clinical Review Request Form 7-20-15_2015-07-20-14.45.07.609.docx
Request;20150720-000032;53505;DIRECT;Inpatient;DIRECT;C:\Users\FGuo\Documents\work doucment\attachment\attachmentDB\20161005\originalFileFromAerial\DOCSVC_20161003.tar\DOCSVC_20161003\DOCSVC_20161003\INPATIENT\REQ_20150720-000032\bell_2015-07-21-11.47.02.336.tif
Request;20150720-000034;91931;PACE;Inpatient;PACE;C:\Users\FGuo\Documents\work doucment\attachment\attachmentDB\20161005\originalFileFromAerial\DOCSVC_20161003.tar\DOCSVC_20161003\DOCSVC_20161003\INPATIENT\REQ_20150720-000034\Luciano Francisca IP Denial Montefiore Medical Center 7-24-15_2015-07-31-14.39.09.533.docx
Request;20150720-000034;91931;PACE;Inpatient;PACE;C:\Users\FGuo\Documents\work doucment\attachment\attachmentDB\20161005\originalFileFromAerial\DOCSVC_20161003.tar\DOCSVC_20161003\DOCSVC_20161003\INPATIENT\REQ_20150720-000034\Luciano, Francisca  - Montefiore Med Cen-Moses-Clinical Review Request Form 7-20-15_2015-07-20-15.01.40.910.docx
Request;20150720-000034;91931;PACE;Inpatient;PACE;C:\Users\FGuo\Documents\work doucment\attachment\attachmentDB\20161005\originalFileFromAerial\DOCSVC_20161003.tar\DOCSVC_20161003\DOCSVC_20161003\INPATIENT\REQ_20150720-000034\Luciano, Francisca Appeal Acknowledgement Letter_2015-09-16-13.31.40.433.docx
Request;20150720-000034;91931;PACE;Inpatient;PACE;C:\Users\FGuo\Documents\work doucment\attachment\attachmentDB\20161005\originalFileFromAerial\DOCSVC_20161003.tar\DOCSVC_20161003\DOCSVC_20161003\INPATIENT\REQ_20150720-000034\Luciano, Francisca Final Adverse Determination Appeal Unfavorable-Contracted Hospitals_2015-10-02-14.29.04.244.docx
Request;20150720-000034;91931;PACE;Inpatient;PACE;C:\Users\FGuo\Documents\work doucment\attachment\attachmentDB\20161005\originalFileFromAerial\DOCSVC_20161003.tar\DOCSVC_20161003\DOCSVC_20161003\INPATIENT\REQ_20150720-000034\Luciano, Francisca MR_2015-09-28-10.37.28.309.pdf
Request;20150720-000034;91931;PACE;Inpatient;PACE;C:\Users\FGuo\Documents\work doucment\attachment\attachmentDB\20161005\originalFileFromAerial\DOCSVC_20161003.tar\DOCSVC_20161003\DOCSVC_20161003\INPATIENT\REQ_20150720-000034\luciano_2015-07-20-16.03.53.792.tif
Request;20150720-000036;74667;null;Inpatient;PACE;C:\Users\FGuo\Documents\work doucment\attachment\attachmentDB\20161005\originalFileFromAerial\DOCSVC_20161003.tar\DOCSVC_20161003\DOCSVC_20161003\INPATIENT\REQ_20150720-000036\Lee Chi Cha IP Denial St John's Riverside Hospital 8-11-15_2015-08-11-16.08.49.602.docx
Request;20150720-000036;74667;null;Inpatient;PACE;C:\Users\FGuo\Documents\work doucment\attachment\attachmentDB\20161005\originalFileFromAerial\DOCSVC_20161003.tar\DOCSVC_20161003\DOCSVC_20161003\INPATIENT\REQ_20150720-000036\Lee, Chi Cha -  St John's Riverside Hospital Clinical Review Request Form 7-20-15_2015-07-20-15.18.19.754.docx
Request;20150720-000036;74667;null;Inpatient;PACE;C:\Users\FGuo\Documents\work doucment\attachment\attachmentDB\20161005\originalFileFromAerial\DOCSVC_20161003.tar\DOCSVC_20161003\DOCSVC_20161003\INPATIENT\REQ_20150720-000036\lee, chi_2015-08-06-15.27.55.214.tif
Request;20150720-000036;74667;null;Inpatient;PACE;C:\Users\FGuo\Documents\work doucment\attachment\attachmentDB\20161005\originalFileFromAerial\DOCSVC_20161003.tar\DOCSVC_20161003\DOCSVC_20161003\INPATIENT\REQ_20150720-000036\lee, chi_2015-08-06-15.28.22.794.tif
Request;20150720-000040;30765;PACE;Inpatient;PACE;C:\Users\FGuo\Documents\work doucment\attachment\attachmentDB\20161005\originalFileFromAerial\DOCSVC_20161003.tar\DOCSVC_20161003\DOCSVC_20161003\INPATIENT\REQ_20150720-000040\Ramos, Mildred - St Joseph Hosp  914 Clinical Review Request Form 7-20-15_2015-07-20-16.20.27.80.docx
Request;20150720-000040;30765;PACE;Inpatient;PACE;C:\Users\FGuo\Documents\work doucment\attachment\attachmentDB\20161005\originalFileFromAerial\DOCSVC_20161003.tar\DOCSVC_20161003\DOCSVC_20161003\INPATIENT\REQ_20150720-000040\ramos, mildred_2015-07-24-13.26.39.931.tif
Request;20150720-000040;30765;PACE;Inpatient;PACE;C:\Users\FGuo\Documents\work doucment\attachment\attachmentDB\20161005\originalFileFromAerial\DOCSVC_20161003.tar\DOCSVC_20161003\DOCSVC_20161003\INPATIENT\REQ_20150720-000040\ramos-consult_2015-08-06-15.09.35.741.tif
Request;20150720-000044;97071;DIRECT;Inpatient;DIRECT;C:\Users\FGuo\Documents\work doucment\attachment\attachmentDB\20161005\originalFileFromAerial\DOCSVC_20161003.tar\DOCSVC_20161003\DOCSVC_20161003\INPATIENT\REQ_20150720-000044\Pinto, Ivan---Montefiore North- Clinical Review Request Form 7-23-15_2015-07-23-15.21.01.101.docx
Request;20150720-000045;57012;PACE;Inpatient;PACE;C:\Users\FGuo\Documents\work doucment\attachment\attachmentDB\20161005\originalFileFromAerial\DOCSVC_20161003.tar\DOCSVC_20161003\DOCSVC_20161003\INPATIENT\REQ_20150720-000045\Puglatti, F 57012 7-17-15_2015-07-21-11.09.53.583.tif
Request;20150720-000045;57012;PACE;Inpatient;PACE;C:\Users\FGuo\Documents\work doucment\attachment\attachmentDB\20161005\originalFileFromAerial\DOCSVC_20161003.tar\DOCSVC_20161003\DOCSVC_20161003\INPATIENT\REQ_20150720-000045\Pugliatti, Frank  - White Plains Hospital Center  10.23.15_2015-10-23-12.11.34.337.docx
Request;20150720-000045;57012;PACE;Inpatient;PACE;C:\Users\FGuo\Documents\work doucment\attachment\attachmentDB\20161005\originalFileFromAerial\DOCSVC_20161003.tar\DOCSVC_20161003\DOCSVC_20161003\INPATIENT\REQ_20150720-000045\pugliatti_2015-07-21-11.59.35.390.tif
Request;20150721-000007;50926;PACE;Inpatient;PACE;C:\Users\FGuo\Documents\work doucment\attachment\attachmentDB\20161005\originalFileFromAerial\DOCSVC_20161003.tar\DOCSVC_20161003\DOCSVC_20161003\INPATIENT\REQ_20150721-000007\Bebi Persaud UR 7-24-15_2015-07-24-12.01.34.929.tif
Request;20150721-000007;50926;PACE;Inpatient;PACE;C:\Users\FGuo\Documents\work doucment\attachment\attachmentDB\20161005\originalFileFromAerial\DOCSVC_20161003.tar\DOCSVC_20161003\DOCSVC_20161003\INPATIENT\REQ_20150721-000007\Persaud bebi  50926 CLINICAL REVIEW REQUEST FORM.doc 7 21 15_2015-07-21-11.09.14.421.doc
Request;20150721-000007;50926;PACE;Inpatient;PACE;C:\Users\FGuo\Documents\work doucment\attachment\attachmentDB\20161005\originalFileFromAerial\DOCSVC_20161003.tar\DOCSVC_20161003\DOCSVC_20161003\INPATIENT\REQ_20150721-000007\Persaud, Bebi ADM_2015-07-21-10.05.52.369.tif
Request;20150721-000009;36460;DIRECT;Inpatient;DIRECT;C:\Users\FGuo\Documents\work doucment\attachment\attachmentDB\20161005\originalFileFromAerial\DOCSVC_20161003.tar\DOCSVC_20161003\DOCSVC_20161003\INPATIENT\REQ_20150721-000009\MAHIN RAHMANA - LI - Notice of hospitalization_2015-07-21-10.15.53.599.txt
Request;20150721-000009;36460;DIRECT;Inpatient;DIRECT;C:\Users\FGuo\Documents\work doucment\attachment\attachmentDB\20161005\originalFileFromAerial\DOCSVC_20161003.tar\DOCSVC_20161003\DOCSVC_20161003\INPATIENT\REQ_20150721-000009\Mahin Rahmanan UR 7-31-15_2015-07-31-14.06.08.730.tif
Request;20150721-000009;36460;DIRECT;Inpatient;DIRECT;C:\Users\FGuo\Documents\work doucment\attachment\attachmentDB\20161005\originalFileFromAerial\DOCSVC_20161003.tar\DOCSVC_20161003\DOCSVC_20161003\INPATIENT\REQ_20150721-000009\Rahmanan, mahin 36460 CLINICAL REVIEW REQUEST FORM.doc 7 21 15_2015-07-21-11.17.18.329.doc
Request;20150721-000015;56243;DIRECT;Inpatient;DIRECT;C:\Users\FGuo\Documents\work doucment\attachment\attachmentDB\20161005\originalFileFromAerial\DOCSVC_20161003.tar\DOCSVC_20161003\DOCSVC_20161003\INPATIENT\REQ_20150721-000015\Gura, Ilya---NY Methodist Hosp Clinical Review Request Form 8-5-15_2015-08-05-09.32.37.361.docx
Request;20150721-000015;56243;DIRECT;Inpatient;DIRECT;C:\Users\FGuo\Documents\work doucment\attachment\attachmentDB\20161005\originalFileFromAerial\DOCSVC_20161003.tar\DOCSVC_20161003\DOCSVC_20161003\INPATIENT\REQ_20150721-000015\Ilya Gura UR 8-7-15_2015-08-10-08.07.39.814.tif
Request;20150721-000016;26194;PACE;Inpatient;PACE;C:\Users\FGuo\Documents\work doucment\attachment\attachmentDB\20161005\originalFileFromAerial\DOCSVC_20161003.tar\DOCSVC_20161003\DOCSVC_20161003\INPATIENT\REQ_20150721-000016\Previl, Junette 26194 CLINICAL REVIEW REQUEST FORM.doc 7 21 15_2015-07-21-11.50.31.484.doc
Request;20150721-000022;56765;PACE;Inpatient;PACE;C:\Users\FGuo\Documents\work doucment\attachment\attachmentDB\20161005\originalFileFromAerial\DOCSVC_20161003.tar\DOCSVC_20161003\DOCSVC_20161003\INPATIENT\REQ_20150721-000022\LLodge 72215_2015-07-22-15.40.17.860.tif
Request;20150721-000022;56765;PACE;Inpatient;PACE;C:\Users\FGuo\Documents\work doucment\attachment\attachmentDB\20161005\originalFileFromAerial\DOCSVC_20161003.tar\DOCSVC_20161003\DOCSVC_20161003\INPATIENT\REQ_20150721-000022\LLodge_2015-07-21-13.36.06.604.tif
Request;20150721-000022;56765;PACE;Inpatient;PACE;C:\Users\FGuo\Documents\work doucment\attachment\attachmentDB\20161005\originalFileFromAerial\DOCSVC_20161003.tar\DOCSVC_20161003\DOCSVC_20161003\INPATIENT\REQ_20150721-000022\Lodge, Linda MR1_2016-03-17-14.35.59.166.pdf
Request;20150721-000022;56765;PACE;Inpatient;PACE;C:\Users\FGuo\Documents\work doucment\attachment\attachmentDB\20161005\originalFileFromAerial\DOCSVC_20161003.tar\DOCSVC_20161003\DOCSVC_20161003\INPATIENT\REQ_20150721-000022\Lodge, Linda MR2_2016-03-17-14.36.40.309.pdf
Request;20150721-000033;20298;PACE;Inpatient;PACE;C:\Users\FGuo\Documents\work doucment\attachment\attachmentDB\20161005\originalFileFromAerial\DOCSVC_20161003.tar\DOCSVC_20161003\DOCSVC_20161003\INPATIENT\REQ_20150721-000033\Eundook Park UR 7-24-15_2015-07-24-16.25.48.663.tif
Request;20150721-000033;20298;PACE;Inpatient;PACE;C:\Users\FGuo\Documents\work doucment\attachment\attachmentDB\20161005\originalFileFromAerial\DOCSVC_20161003.tar\DOCSVC_20161003\DOCSVC_20161003\INPATIENT\REQ_20150721-000033\Eunsook Park UR 7-23-15_2015-07-24-09.13.26.465.tif
Request;20150721-000033;20298;PACE;Inpatient;PACE;C:\Users\FGuo\Documents\work doucment\attachment\attachmentDB\20161005\originalFileFromAerial\DOCSVC_20161003.tar\DOCSVC_20161003\DOCSVC_20161003\INPATIENT\REQ_20150721-000033\Medical Record_2015-11-10-11.41.54.77.pdf
Request;20150721-000033;20298;PACE;Inpatient;PACE;C:\Users\FGuo\Documents\work doucment\attachment\attachmentDB\20161005\originalFileFromAerial\DOCSVC_20161003.tar\DOCSVC_20161003\DOCSVC_20161003\INPATIENT\REQ_20150721-000033\Park Eunsook IP Denial Flushing Hospital Center 7-27-15_2015-07-27-13.38.37.657.docx
Request;20150721-000033;20298;PACE;Inpatient;PACE;C:\Users\FGuo\Documents\work doucment\attachment\attachmentDB\20161005\originalFileFromAerial\DOCSVC_20161003.tar\DOCSVC_20161003\DOCSVC_20161003\INPATIENT\REQ_20150721-000033\PRA-1  Appeal Acknowledgement _2015-09-23-09.59.39.893.docx
Request;20150721-000033;20298;PACE;Inpatient;PACE;C:\Users\FGuo\Documents\work doucment\attachment\attachmentDB\20161005\originalFileFromAerial\DOCSVC_20161003.tar\DOCSVC_20161003\DOCSVC_20161003\INPATIENT\REQ_20150721-000033\PRA-2 Final Adverse Determination Appeal Unfavorable-Contracted Hospitals_2015-11-13-16.13.55.625.docx
Request;20150721-000045;77590;PACE;Inpatient;PACE;C:\Users\FGuo\Documents\work doucment\attachment\attachmentDB\20161005\originalFileFromAerial\DOCSVC_20161003.tar\DOCSVC_20161003\DOCSVC_20161003\INPATIENT\REQ_20150721-000045\cornelius enerstine_2015-07-29-19.25.19.885.tif
Request;20150721-000045;77590;PACE;Inpatient;PACE;C:\Users\FGuo\Documents\work doucment\attachment\attachmentDB\20161005\originalFileFromAerial\DOCSVC_20161003.tar\DOCSVC_20161003\DOCSVC_20161003\INPATIENT\REQ_20150721-000045\Cornelius Ernestine IP Denial Montefiore Medical Center 7-23-15_2015-07-23-14.22.56.125.docx
Request;20150722-000007;82466;PACE;Inpatient;PACE;C:\Users\FGuo\Documents\work doucment\attachment\attachmentDB\20161005\originalFileFromAerial\DOCSVC_20161003.tar\DOCSVC_20161003\DOCSVC_20161003\INPATIENT\REQ_20150722-000007\Pibernus, Gladys- Beth Abraham Nursing Home  7.22.15_2015-07-22-13.04.22.995.docx
Request;20150722-000007;82466;PACE;Inpatient;PACE;C:\Users\FGuo\Documents\work doucment\attachment\attachmentDB\20161005\originalFileFromAerial\DOCSVC_20161003.tar\DOCSVC_20161003\DOCSVC_20161003\INPATIENT\REQ_20150722-000007\RJ Pibernus, G 82466 7-20-15_2015-07-22-08.37.18.708.msg
Request;20150722-000007;82466;PACE;Inpatient;PACE;C:\Users\FGuo\Documents\work doucment\attachment\attachmentDB\20161005\originalFileFromAerial\DOCSVC_20161003.tar\DOCSVC_20161003\DOCSVC_20161003\INPATIENT\REQ_20150722-000007\RJ Pibernus, G 82466 7-20-15_2015-07-22-08.40.36.305.htm
Request;20150722-000007;82466;PACE;Inpatient;PACE;C:\Users\FGuo\Documents\work doucment\attachment\attachmentDB\20161005\originalFileFromAerial\DOCSVC_20161003.tar\DOCSVC_20161003\DOCSVC_20161003\INPATIENT\REQ_20150722-000007\_2015-07-22-13.03.55.880
Request;20150722-000009;29678;PACE;Inpatient;PACE;C:\Users\FGuo\Documents\work doucment\attachment\attachmentDB\20161005\originalFileFromAerial\DOCSVC_20161003.tar\DOCSVC_20161003\DOCSVC_20161003\INPATIENT\REQ_20150722-000009\RJ Tigre, J 29678 7-16-15_2015-07-22-08.56.21.432.tif
Request;20150722-000009;29678;PACE;Inpatient;PACE;C:\Users\FGuo\Documents\work doucment\attachment\attachmentDB\20161005\originalFileFromAerial\DOCSVC_20161003.tar\DOCSVC_20161003\DOCSVC_20161003\INPATIENT\REQ_20150722-000009\Tigre, Juan  - Dr. Arnold Wilson Montefiore Medical Center  8.5.15_2015-08-05-16.25.06.389.docx
Request;20150722-000009;29678;PACE;Inpatient;PACE;C:\Users\FGuo\Documents\work doucment\attachment\attachmentDB\20161005\originalFileFromAerial\DOCSVC_20161003.tar\DOCSVC_20161003\DOCSVC_20161003\INPATIENT\REQ_20150722-000009\tigre,juan_2015-07-29-13.45.12.781.tif
Request;20150722-000010;88370;DIRECT;Inpatient;DIRECT;C:\Users\FGuo\Documents\work doucment\attachment\attachmentDB\20161005\originalFileFromAerial\DOCSVC_20161003.tar\DOCSVC_20161003\DOCSVC_20161003\INPATIENT\REQ_20150722-000010\Frost, Kenneth - Dr. Arnold Wilson - 7-28-15_2015-07-28-15.39.55.62.docx
Request;20150722-000010;88370;DIRECT;Inpatient;DIRECT;C:\Users\FGuo\Documents\work doucment\attachment\attachmentDB\20161005\originalFileFromAerial\DOCSVC_20161003.tar\DOCSVC_20161003\DOCSVC_20161003\INPATIENT\REQ_20150722-000010\frost,kenneth_2015-07-29-13.31.35.739.tif
Request;20150722-000010;88370;DIRECT;Inpatient;DIRECT;C:\Users\FGuo\Documents\work doucment\attachment\attachmentDB\20161005\originalFileFromAerial\DOCSVC_20161003.tar\DOCSVC_20161003\DOCSVC_20161003\INPATIENT\REQ_20150722-000010\RJ Frost, K 88370 7-21-15_2015-07-22-09.10.02.842.tif
Request;20150722-000015;55449;null;Inpatient;DIRECT;C:\Users\FGuo\Documents\work doucment\attachment\attachmentDB\20161005\originalFileFromAerial\DOCSVC_20161003.tar\DOCSVC_20161003\DOCSVC_20161003\INPATIENT\REQ_20150722-000015\Brewster, Cecil 55449 CLINICAL REVIEW REQUEST FORM.doc 7 22 15_2015-07-22-13.43.25.146.doc
Request;20150722-000015;55449;null;Inpatient;DIRECT;C:\Users\FGuo\Documents\work doucment\attachment\attachmentDB\20161005\originalFileFromAerial\DOCSVC_20161003.tar\DOCSVC_20161003\DOCSVC_20161003\INPATIENT\REQ_20150722-000015\Cecil Brewster UR 7-23-15_2015-07-23-15.39.10.123.tif
Request;20150722-000018;26194;PACE;Inpatient;PACE;C:\Users\FGuo\Documents\work doucment\attachment\attachmentDB\20161005\originalFileFromAerial\DOCSVC_20161003.tar\DOCSVC_20161003\DOCSVC_20161003\INPATIENT\REQ_20150722-000018\Junette Previl UR 7-22-15_2015-07-22-16.26.22.997.tif
Request;20150722-000018;26194;PACE;Inpatient;PACE;C:\Users\FGuo\Documents\work doucment\attachment\attachmentDB\20161005\originalFileFromAerial\DOCSVC_20161003.tar\DOCSVC_20161003\DOCSVC_20161003\INPATIENT\REQ_20150722-000018\Junette Previl UR 7-27-15_2015-07-27-11.52.24.192.tif
Request;20150722-000018;26194;PACE;Inpatient;PACE;C:\Users\FGuo\Documents\work doucment\attachment\attachmentDB\20161005\originalFileFromAerial\DOCSVC_20161003.tar\DOCSVC_20161003\DOCSVC_20161003\INPATIENT\REQ_20150722-000018\Previl, Junette 26194 CLINICAL REVIEW REQUEST FORM.doc 7 22 15_2015-07-22-13.47.26.820.doc
Request;20150722-000024;45987;DIRECT;Inpatient;DIRECT;C:\Users\FGuo\Documents\work doucment\attachment\attachmentDB\20161005\originalFileFromAerial\DOCSVC_20161003.tar\DOCSVC_20161003\DOCSVC_20161003\INPATIENT\REQ_20150722-000024\barbara sheaffer_2015-07-24-11.35.29.747.tif
Request;20150722-000024;45987;DIRECT;Inpatient;DIRECT;C:\Users\FGuo\Documents\work doucment\attachment\attachmentDB\20161005\originalFileFromAerial\DOCSVC_20161003.tar\DOCSVC_20161003\DOCSVC_20161003\INPATIENT\REQ_20150722-000024\Sheaffer Barbara DIRECT IP Denial Mt Sinai Hospital 7-27-15_2015-07-27-13.59.28.377.docx
Request;20150722-000024;45987;DIRECT;Inpatient;DIRECT;C:\Users\FGuo\Documents\work doucment\attachment\attachmentDB\20161005\originalFileFromAerial\DOCSVC_20161003.tar\DOCSVC_20161003\DOCSVC_20161003\INPATIENT\REQ_20150722-000024\Sheaffer, Barbara Appeal Ack Letter _2015-09-03-11.07.13.63.docx
Request;20150722-000024;45987;DIRECT;Inpatient;DIRECT;C:\Users\FGuo\Documents\work doucment\attachment\attachmentDB\20161005\originalFileFromAerial\DOCSVC_20161003.tar\DOCSVC_20161003\DOCSVC_20161003\INPATIENT\REQ_20150722-000024\Sheaffer, Barbara MR1_2015-10-19-11.13.36.490.pdf
Request;20150722-000024;45987;DIRECT;Inpatient;DIRECT;C:\Users\FGuo\Documents\work doucment\attachment\attachmentDB\20161005\originalFileFromAerial\DOCSVC_20161003.tar\DOCSVC_20161003\DOCSVC_20161003\INPATIENT\REQ_20150722-000024\Sheaffer, Barbara MR2_2015-10-19-11.14.02.897.pdf
Request;20150722-000024;45987;DIRECT;Inpatient;DIRECT;C:\Users\FGuo\Documents\work doucment\attachment\attachmentDB\20161005\originalFileFromAerial\DOCSVC_20161003.tar\DOCSVC_20161003\DOCSVC_20161003\INPATIENT\REQ_20150722-000024\Sheaffer, Barbara WOL_2015-09-04-11.02.29.904.TIF
Request;20150722-000028;94566;PACE;Inpatient;PACE;C:\Users\FGuo\Documents\work doucment\attachment\attachmentDB\20161005\originalFileFromAerial\DOCSVC_20161003.tar\DOCSVC_20161003\DOCSVC_20161003\INPATIENT\REQ_20150722-000028\PoyHar Lee Yee NH Notes 8-14-15_2015-08-17-09.09.50.498.tif
Request;20150722-000028;94566;PACE;Inpatient;PACE;C:\Users\FGuo\Documents\work doucment\attachment\attachmentDB\20161005\originalFileFromAerial\DOCSVC_20161003.tar\DOCSVC_20161003\DOCSVC_20161003\INPATIENT\REQ_20150722-000028\PoyHar Lee Yee NH Notes 8-14-15_2015-08-25-10.45.02.877.tif
Request;20150722-000028;94566;PACE;Inpatient;PACE;C:\Users\FGuo\Documents\work doucment\attachment\attachmentDB\20161005\originalFileFromAerial\DOCSVC_20161003.tar\DOCSVC_20161003\DOCSVC_20161003\INPATIENT\REQ_20150722-000028\PoyHar Lee Yee NH Notes 8-21-15_2015-08-25-10.44.51.568.tif
Request;20150722-000028;94566;PACE;Inpatient;PACE;C:\Users\FGuo\Documents\work doucment\attachment\attachmentDB\20161005\originalFileFromAerial\DOCSVC_20161003.tar\DOCSVC_20161003\DOCSVC_20161003\INPATIENT\REQ_20150722-000028\PoyHar Lee Yee PRI 7-22-15_2015-07-22-13.19.23.46.tif
Request;20150722-000028;94566;PACE;Inpatient;PACE;C:\Users\FGuo\Documents\work doucment\attachment\attachmentDB\20161005\originalFileFromAerial\DOCSVC_20161003.tar\DOCSVC_20161003\DOCSVC_20161003\INPATIENT\REQ_20150722-000028\Yee Poyhar L- Union Plaza Nursing Home  7.23.15_2015-07-23-13.35.43.220.docx
Request;20150722-000030;21284;SELECT;Inpatient;SELECT;C:\Users\FGuo\Documents\work doucment\attachment\attachmentDB\20161005\originalFileFromAerial\DOCSVC_20161003.tar\DOCSVC_20161003\DOCSVC_20161003\INPATIENT\REQ_20150722-000030\Ling, Yung Ying 21284 Clinicals_2015-09-21-10.49.02.71.TIF
Request;20150722-000030;21284;SELECT;Inpatient;SELECT;C:\Users\FGuo\Documents\work doucment\attachment\attachmentDB\20161005\originalFileFromAerial\DOCSVC_20161003.tar\DOCSVC_20161003\DOCSVC_20161003\INPATIENT\REQ_20150722-000030\Ling, Yung Ying- New Franklin Rehabilitation & Health Care 7.23.15_2015-07-23-14.51.49.6.docx
Request;20150722-000030;21284;SELECT;Inpatient;SELECT;C:\Users\FGuo\Documents\work doucment\attachment\attachmentDB\20161005\originalFileFromAerial\DOCSVC_20161003.tar\DOCSVC_20161003\DOCSVC_20161003\INPATIENT\REQ_20150722-000030\Yung Ying Ling NH Notes 9-11-15_2015-09-14-10.02.51.348.tif
Request;20150722-000030;21284;SELECT;Inpatient;SELECT;C:\Users\FGuo\Documents\work doucment\attachment\attachmentDB\20161005\originalFileFromAerial\DOCSVC_20161003.tar\DOCSVC_20161003\DOCSVC_20161003\INPATIENT\REQ_20150722-000030\Yungying Ling NH Notes 7-24-15_2015-07-27-09.38.27.153.tif
Request;20150722-000030;21284;SELECT;Inpatient;SELECT;C:\Users\FGuo\Documents\work doucment\attachment\attachmentDB\20161005\originalFileFromAerial\DOCSVC_20161003.tar\DOCSVC_20161003\DOCSVC_20161003\INPATIENT\REQ_20150722-000030\Yungying Ling PRI 7-22-15_2015-07-22-14.31.22.408.tif
Request;20150722-000030;21284;SELECT;Inpatient;SELECT;C:\Users\FGuo\Documents\work doucment\attachment\attachmentDB\20161005\originalFileFromAerial\DOCSVC_20161003.tar\DOCSVC_20161003\DOCSVC_20161003\INPATIENT\REQ_20150722-000030\Yungying Ling PRI 7-22-15_2015-07-22-14.31.52.116.tif
Request;20150722-000030;21284;SELECT;Inpatient;SELECT;C:\Users\FGuo\Documents\work doucment\attachment\attachmentDB\20161005\originalFileFromAerial\DOCSVC_20161003.tar\DOCSVC_20161003\DOCSVC_20161003\INPATIENT\REQ_20150722-000030\_2015-07-22-14.31.33.298
Request;20150722-000032;42181;PACE;Inpatient;PACE;C:\Users\FGuo\Documents\work doucment\attachment\attachmentDB\20161005\originalFileFromAerial\DOCSVC_20161003.tar\DOCSVC_20161003\DOCSVC_20161003\INPATIENT\REQ_20150722-000032\granucci_2015-07-22-15.30.12.809.tif
Request;20150722-000041;77590;PACE;Inpatient;PACE;C:\Users\FGuo\Documents\work doucment\attachment\attachmentDB\20161005\originalFileFromAerial\DOCSVC_20161003.tar\DOCSVC_20161003\DOCSVC_20161003\INPATIENT\REQ_20150722-000041\Cornelius Ernestine IP Denial Montefiore Medical Center 7-23-15_2015-07-27-16.02.26.986.docx
Request;20150722-000041;77590;PACE;Inpatient;PACE;C:\Users\FGuo\Documents\work doucment\attachment\attachmentDB\20161005\originalFileFromAerial\DOCSVC_20161003.tar\DOCSVC_20161003\DOCSVC_20161003\INPATIENT\REQ_20150722-000041\Cornelius Ernestine MR part 1 (1)_2015-11-04-09.55.22.673.pdf
Request;20150722-000041;77590;PACE;Inpatient;PACE;C:\Users\FGuo\Documents\work doucment\attachment\attachmentDB\20161005\originalFileFromAerial\DOCSVC_20161003.tar\DOCSVC_20161003\DOCSVC_20161003\INPATIENT\REQ_20150722-000041\Cornelius Ernestine MR part 2 (2)_2015-11-04-09.55.35.227.pdf
Request;20150722-000041;77590;PACE;Inpatient;PACE;C:\Users\FGuo\Documents\work doucment\attachment\attachmentDB\20161005\originalFileFromAerial\DOCSVC_20161003.tar\DOCSVC_20161003\DOCSVC_20161003\INPATIENT\REQ_20150722-000041\cornelius_2015-07-23-10.23.12.933.tif
Request;20150722-000041;77590;PACE;Inpatient;PACE;C:\Users\FGuo\Documents\work doucment\attachment\attachmentDB\20161005\originalFileFromAerial\DOCSVC_20161003.tar\DOCSVC_20161003\DOCSVC_20161003\INPATIENT\REQ_20150722-000041\PRA-1  Appeal Acknowledgement _2015-09-30-11.50.32.921.docx
Request;20150722-000041;77590;PACE;Inpatient;PACE;C:\Users\FGuo\Documents\work doucment\attachment\attachmentDB\20161005\originalFileFromAerial\DOCSVC_20161003.tar\DOCSVC_20161003\DOCSVC_20161003\INPATIENT\REQ_20150722-000041\PRA-2 Final Adverse Determination Appeal Unfavorable-Contracted Hospitals_2015-11-12-16.14.05.365.docx
Request;20150722-000046;48067;FIDA;Inpatient;FIDA;C:\Users\FGuo\Documents\work doucment\attachment\attachmentDB\20161005\originalFileFromAerial\DOCSVC_20161003.tar\DOCSVC_20161003\DOCSVC_20161003\INPATIENT\REQ_20150722-000046\FJames 72115_2015-07-22-16.01.47.783.tif
Request;20150722-000046;48067;FIDA;Inpatient;FIDA;C:\Users\FGuo\Documents\work doucment\attachment\attachmentDB\20161005\originalFileFromAerial\DOCSVC_20161003.tar\DOCSVC_20161003\DOCSVC_20161003\INPATIENT\REQ_20150722-000046\James, Ferdinand(2nd Document)- Center For Nursing & Rehabilitation  7.27.15_2015-07-27-10.43.49.554.docx
Request;20150722-000056;49313;PACE;Inpatient;PACE;C:\Users\FGuo\Documents\work doucment\attachment\attachmentDB\20161005\originalFileFromAerial\DOCSVC_20161003.tar\DOCSVC_20161003\DOCSVC_20161003\INPATIENT\REQ_20150722-000056\elsie worrell27_2015-07-27-13.14.38.82.tif
Request;20150722-000056;49313;PACE;Inpatient;PACE;C:\Users\FGuo\Documents\work doucment\attachment\attachmentDB\20161005\originalFileFromAerial\DOCSVC_20161003.tar\DOCSVC_20161003\DOCSVC_20161003\INPATIENT\REQ_20150722-000056\EWorrell_2015-07-22-17.53.59.911.tif
Request;20150722-000056;49313;PACE;Inpatient;PACE;C:\Users\FGuo\Documents\work doucment\attachment\attachmentDB\20161005\originalFileFromAerial\DOCSVC_20161003.tar\DOCSVC_20161003\DOCSVC_20161003\INPATIENT\REQ_20150722-000056\Worrell, Elsie - River Manor Corp DBA River Manor Care  7.27.15_2015-07-27-12.04.01.932.docx
Request;20150723-000001;57187;SELECT;Inpatient;SELECT;C:\Users\FGuo\Documents\work doucment\attachment\attachmentDB\20161005\originalFileFromAerial\DOCSVC_20161003.tar\DOCSVC_20161003\DOCSVC_20161003\INPATIENT\REQ_20150723-000001\Howard Thompson NH Notes 7-22-15_2015-07-23-08.20.48.438.tif
Request;20150723-000004;26194;PACE;Inpatient;PACE;C:\Users\FGuo\Documents\work doucment\attachment\attachmentDB\20161005\originalFileFromAerial\DOCSVC_20161003.tar\DOCSVC_20161003\DOCSVC_20161003\INPATIENT\REQ_20150723-000004\Junette Previl UR 7-27-15_2015-07-27-16.45.11.626.tif
Request;20150723-000009;37332;PACE;Inpatient;PACE;C:\Users\FGuo\Documents\work doucment\attachment\attachmentDB\20161005\originalFileFromAerial\DOCSVC_20161003.tar\DOCSVC_20161003\DOCSVC_20161003\INPATIENT\REQ_20150723-000009\Edwin Flowers UR 7-23-15_2015-07-23-16.01.18.599.tif
Request;20150723-000009;37332;PACE;Inpatient;PACE;C:\Users\FGuo\Documents\work doucment\attachment\attachmentDB\20161005\originalFileFromAerial\DOCSVC_20161003.tar\DOCSVC_20161003\DOCSVC_20161003\INPATIENT\REQ_20150723-000009\Flowers Edwin IP Denial Forest Hills Hosital 7-27-15_2015-07-27-15.55.41.869.docx
Request;20150723-000009;37332;PACE;Inpatient;PACE;C:\Users\FGuo\Documents\work doucment\attachment\attachmentDB\20161005\originalFileFromAerial\DOCSVC_20161003.tar\DOCSVC_20161003\DOCSVC_20161003\INPATIENT\REQ_20150723-000009\PRA-1  Appeal Acknowledgement _2015-09-23-10.25.11.112.docx
Request;20150723-000009;37332;PACE;Inpatient;PACE;C:\Users\FGuo\Documents\work doucment\attachment\attachmentDB\20161005\originalFileFromAerial\DOCSVC_20161003.tar\DOCSVC_20161003\DOCSVC_20161003\INPATIENT\REQ_20150723-000009\PRA-2 Final Adverse Determination Appeal Unfavorable-Contracted Hospitals_2015-10-15-16.26.35.862.docx
Request;20150723-000014;21284;SELECT;Inpatient;SELECT;C:\Users\FGuo\Documents\work doucment\attachment\attachmentDB\20161005\originalFileFromAerial\DOCSVC_20161003.tar\DOCSVC_20161003\DOCSVC_20161003\INPATIENT\REQ_20150723-000014\Ling, Yung Ying(Bed Hold)- New Franklin Rehabilitation & Health Care 7.23.15_2015-07-23-15.01.05.900.docx
Request;20150723-000017;70693;null;Inpatient;PACE;C:\Users\FGuo\Documents\work doucment\attachment\attachmentDB\20161005\originalFileFromAerial\DOCSVC_20161003.tar\DOCSVC_20161003\DOCSVC_20161003\INPATIENT\REQ_20150723-000017\Moll, Adele 70693 H CLINICAL REVIEW REQUEST FORM.doc 7 23 15_2015-07-23-11.17.42.619.doc
Request;20150723-000017;70693;null;Inpatient;PACE;C:\Users\FGuo\Documents\work doucment\attachment\attachmentDB\20161005\originalFileFromAerial\DOCSVC_20161003.tar\DOCSVC_20161003\DOCSVC_20161003\INPATIENT\REQ_20150723-000017\moll, adele_2015-07-24-14.47.26.952.tif
Request;20150723-000033;81013;PACE;Inpatient;PACE;C:\Users\FGuo\Documents\work doucment\attachment\attachmentDB\20161005\originalFileFromAerial\DOCSVC_20161003.tar\DOCSVC_20161003\DOCSVC_20161003\INPATIENT\REQ_20150723-000033\ortiz, jose_2015-07-23-14.58.35.203.tif
Request;20150723-000033;81013;PACE;Inpatient;PACE;C:\Users\FGuo\Documents\work doucment\attachment\attachmentDB\20161005\originalFileFromAerial\DOCSVC_20161003.tar\DOCSVC_20161003\DOCSVC_20161003\INPATIENT\REQ_20150723-000033\ortiz,jose,update_2015-07-30-16.10.19.386.tif
Request;20150723-000037;54669;PACE;Inpatient;PACE;C:\Users\FGuo\Documents\work doucment\attachment\attachmentDB\20161005\originalFileFromAerial\DOCSVC_20161003.tar\DOCSVC_20161003\DOCSVC_20161003\INPATIENT\REQ_20150723-000037\santos, amantina_2015-07-23-15.32.16.502.tif
Request;20150723-000039;81198;PACE;Inpatient;PACE;C:\Users\FGuo\Documents\work doucment\attachment\attachmentDB\20161005\originalFileFromAerial\DOCSVC_20161003.tar\DOCSVC_20161003\DOCSVC_20161003\INPATIENT\REQ_20150723-000039\marino rivera_2015-07-23-15.24.12.305.tif
Request;20150723-000039;81198;PACE;Inpatient;PACE;C:\Users\FGuo\Documents\work doucment\attachment\attachmentDB\20161005\originalFileFromAerial\DOCSVC_20161003.tar\DOCSVC_20161003\DOCSVC_20161003\INPATIENT\REQ_20150723-000039\rivera,PRI_2015-07-30-09.29.20.700.tif
Request;20150723-000039;81198;PACE;Inpatient;PACE;C:\Users\FGuo\Documents\work doucment\attachment\attachmentDB\20161005\originalFileFromAerial\DOCSVC_20161003.tar\DOCSVC_20161003\DOCSVC_20161003\INPATIENT\REQ_20150723-000039\rivera-DCsummary_2015-07-30-10.09.23.997.tif
Request;20150723-000039;81198;PACE;Inpatient;PACE;C:\Users\FGuo\Documents\work doucment\attachment\attachmentDB\20161005\originalFileFromAerial\DOCSVC_20161003.tar\DOCSVC_20161003\DOCSVC_20161003\INPATIENT\REQ_20150723-000039\_2015-07-30-10.09.12.963
Request;20150723-000041;83958;DIRECT/SELECT LT;Inpatient;DIRECT;C:\Users\FGuo\Documents\work doucment\attachment\attachmentDB\20161005\originalFileFromAerial\DOCSVC_20161003.tar\DOCSVC_20161003\DOCSVC_20161003\INPATIENT\REQ_20150723-000041\santiago, prim_2015-07-24-09.18.55.183.tif
Request;20150723-000042;42561;PACE;Inpatient;PACE;C:\Users\FGuo\Documents\work doucment\attachment\attachmentDB\20161005\originalFileFromAerial\DOCSVC_20161003.tar\DOCSVC_20161003\DOCSVC_20161003\INPATIENT\REQ_20150723-000042\Merritt Geraldine IP Denial Montefiore Medical Center 8-7-15_2015-08-07-16.06.16.756.docx
Request;20150723-000042;42561;PACE;Inpatient;PACE;C:\Users\FGuo\Documents\work doucment\attachment\attachmentDB\20161005\originalFileFromAerial\DOCSVC_20161003.tar\DOCSVC_20161003\DOCSVC_20161003\INPATIENT\REQ_20150723-000042\Merritt, Geraldine Appeal Acknowledgement_2015-10-05-15.14.07.617.docx
Request;20150723-000042;42561;PACE;Inpatient;PACE;C:\Users\FGuo\Documents\work doucment\attachment\attachmentDB\20161005\originalFileFromAerial\DOCSVC_20161003.tar\DOCSVC_20161003\DOCSVC_20161003\INPATIENT\REQ_20150723-000042\merritt-PRI_2015-07-29-10.16.37.850.tif
Request;20150723-000042;42561;PACE;Inpatient;PACE;C:\Users\FGuo\Documents\work doucment\attachment\attachmentDB\20161005\originalFileFromAerial\DOCSVC_20161003.tar\DOCSVC_20161003\DOCSVC_20161003\INPATIENT\REQ_20150723-000042\merrittDC summary_2015-08-07-11.10.50.17.tif
Request;20150723-000042;42561;PACE;Inpatient;PACE;C:\Users\FGuo\Documents\work doucment\attachment\attachmentDB\20161005\originalFileFromAerial\DOCSVC_20161003.tar\DOCSVC_20161003\DOCSVC_20161003\INPATIENT\REQ_20150723-000042\_2015-08-07-11.10.34.554
Request;20150723-000043;72632;PACE;Inpatient;PACE;C:\Users\FGuo\Documents\work doucment\attachment\attachmentDB\20161005\originalFileFromAerial\DOCSVC_20161003.tar\DOCSVC_20161003\DOCSVC_20161003\INPATIENT\REQ_20150723-000043\Modesta Torres hosp_2015-07-23-15.18.59.770.tif
Request;20150723-000043;72632;PACE;Inpatient;PACE;C:\Users\FGuo\Documents\work doucment\attachment\attachmentDB\20161005\originalFileFromAerial\DOCSVC_20161003.tar\DOCSVC_20161003\DOCSVC_20161003\INPATIENT\REQ_20150723-000043\Modesta Torres29_2015-07-29-19.12.58.3.tif
Request;20150723-000043;72632;PACE;Inpatient;PACE;C:\Users\FGuo\Documents\work doucment\attachment\attachmentDB\20161005\originalFileFromAerial\DOCSVC_20161003.tar\DOCSVC_20161003\DOCSVC_20161003\INPATIENT\REQ_20150723-000043\Torres Modesta IP Denial Beth Israel Petri 12-4-15_2015-12-04-11.48.25.566.pdf
Request;20150723-000043;72632;PACE;Inpatient;PACE;C:\Users\FGuo\Documents\work doucment\attachment\attachmentDB\20161005\originalFileFromAerial\DOCSVC_20161003.tar\DOCSVC_20161003\DOCSVC_20161003\INPATIENT\REQ_20150723-000043\Torres, Modesta 72632 CLINICAL REVIEW REQUEST FORM.doc 7 23 15_2015-07-23-15.22.35.760.doc
Request;20150723-000047;37450;PACE;Inpatient;PACE;C:\Users\FGuo\Documents\work doucment\attachment\attachmentDB\20161005\originalFileFromAerial\DOCSVC_20161003.tar\DOCSVC_20161003\DOCSVC_20161003\INPATIENT\REQ_20150723-000047\37450 EYO, BASSEY CLINICAL REVIEW REQ_2015-08-06-09.44.44.127.doc
Request;20150723-000047;37450;PACE;Inpatient;PACE;C:\Users\FGuo\Documents\work doucment\attachment\attachmentDB\20161005\originalFileFromAerial\DOCSVC_20161003.tar\DOCSVC_20161003\DOCSVC_20161003\INPATIENT\REQ_20150723-000047\37450 EYO, BASSY ADMIT  FORM_2015-07-23-16.41.19.570.tif
Request;20150723-000047;37450;PACE;Inpatient;PACE;C:\Users\FGuo\Documents\work doucment\attachment\attachmentDB\20161005\originalFileFromAerial\DOCSVC_20161003.tar\DOCSVC_20161003\DOCSVC_20161003\INPATIENT\REQ_20150723-000047\37450 EYO, BASSY ADMIT  FORM_2015-07-27-10.12.13.74.tif
Request;20150723-000047;37450;PACE;Inpatient;PACE;C:\Users\FGuo\Documents\work doucment\attachment\attachmentDB\20161005\originalFileFromAerial\DOCSVC_20161003.tar\DOCSVC_20161003\DOCSVC_20161003\INPATIENT\REQ_20150723-000047\Bassey Eyo UR 8-6-15_2015-08-06-12.17.07.152.tif
Request;20150724-000004;53159;DIRECT;Inpatient;DIRECT;C:\Users\FGuo\Documents\work doucment\attachment\attachmentDB\20161005\originalFileFromAerial\DOCSVC_20161003.tar\DOCSVC_20161003\DOCSVC_20161003\INPATIENT\REQ_20150724-000004\MATALON, RACHEL - UR_2015-07-24-07.45.25.116.tif
Request;20150724-000004;53159;DIRECT;Inpatient;DIRECT;C:\Users\FGuo\Documents\work doucment\attachment\attachmentDB\20161005\originalFileFromAerial\DOCSVC_20161003.tar\DOCSVC_20161003\DOCSVC_20161003\INPATIENT\REQ_20150724-000004\Rachel Matalon UR 7-30-15_2015-07-30-15.05.38.344.tif
Request;20150724-000005;38627;SELECT;Inpatient;SELECT;C:\Users\FGuo\Documents\work doucment\attachment\attachmentDB\20161005\originalFileFromAerial\DOCSVC_20161003.tar\DOCSVC_20161003\DOCSVC_20161003\INPATIENT\REQ_20150724-000005\Asif Ziba-FIDA IP Denial Flushing Hospital Center 7-27-15_2015-07-27-15.51.32.84.docx
Request;20150724-000005;38627;SELECT;Inpatient;SELECT;C:\Users\FGuo\Documents\work doucment\attachment\attachmentDB\20161005\originalFileFromAerial\DOCSVC_20161003.tar\DOCSVC_20161003\DOCSVC_20161003\INPATIENT\REQ_20150724-000005\ASIF, ZIBA - UR_2015-07-24-07.59.32.325.tif
Request;20150724-000005;38627;SELECT;Inpatient;SELECT;C:\Users\FGuo\Documents\work doucment\attachment\attachmentDB\20161005\originalFileFromAerial\DOCSVC_20161003.tar\DOCSVC_20161003\DOCSVC_20161003\INPATIENT\REQ_20150724-000005\FIDA ACK Letter_2015-09-25-10.26.05.472.docx
Request;20150724-000005;38627;SELECT;Inpatient;SELECT;C:\Users\FGuo\Documents\work doucment\attachment\attachmentDB\20161005\originalFileFromAerial\DOCSVC_20161003.tar\DOCSVC_20161003\DOCSVC_20161003\INPATIENT\REQ_20150724-000005\FIDA ACK Letter_2015-09-25-10.38.37.224.docx
Request;20150724-000005;38627;SELECT;Inpatient;SELECT;C:\Users\FGuo\Documents\work doucment\attachment\attachmentDB\20161005\originalFileFromAerial\DOCSVC_20161003.tar\DOCSVC_20161003\DOCSVC_20161003\INPATIENT\REQ_20150724-000005\Medical Record_2015-11-10-16.14.49.987.pdf
Request;20150724-000005;38627;SELECT;Inpatient;SELECT;C:\Users\FGuo\Documents\work doucment\attachment\attachmentDB\20161005\originalFileFromAerial\DOCSVC_20161003.tar\DOCSVC_20161003\DOCSVC_20161003\INPATIENT\REQ_20150724-000005\PRA-2 Final Adverse Determination Appeal Unfavorable-Contracted Hospitals_2015-11-13-10.22.38.770.docx
Request;20150724-000010;57836;DIRECT;Inpatient;DIRECT;C:\Users\FGuo\Documents\work doucment\attachment\attachmentDB\20161005\originalFileFromAerial\DOCSVC_20161003.tar\DOCSVC_20161003\DOCSVC_20161003\INPATIENT\REQ_20150724-000010\russo, patricia_2015-07-28-09.05.44.63.tif
Request;20150724-000011;50392;PACE;Inpatient;PACE;C:\Users\FGuo\Documents\work doucment\attachment\attachmentDB\20161005\originalFileFromAerial\DOCSVC_20161003.tar\DOCSVC_20161003\DOCSVC_20161003\INPATIENT\REQ_20150724-000011\KHAN, YAJATKUMAR -  UR_2015-07-24-10.03.48.544.tif
Request;20150724-000012;55857;PACE;Inpatient;PACE;C:\Users\FGuo\Documents\work doucment\attachment\attachmentDB\20161005\originalFileFromAerial\DOCSVC_20161003.tar\DOCSVC_20161003\DOCSVC_20161003\INPATIENT\REQ_20150724-000012\AMADIZ, EUSEBIA - UR_2015-07-24-10.10.36.662.tif
Request;20150724-000015;32035;PACE;Inpatient;PACE;C:\Users\FGuo\Documents\work doucment\attachment\attachmentDB\20161005\originalFileFromAerial\DOCSVC_20161003.tar\DOCSVC_20161003\DOCSVC_20161003\INPATIENT\REQ_20150724-000015\Ramsingh, Rookma - Resort Nursing Home - 8-4-15_2015-08-04-15.05.48.264.docx
Request;20150724-000015;32035;PACE;Inpatient;PACE;C:\Users\FGuo\Documents\work doucment\attachment\attachmentDB\20161005\originalFileFromAerial\DOCSVC_20161003.tar\DOCSVC_20161003\DOCSVC_20161003\INPATIENT\REQ_20150724-000015\Ramsingh, Rookma - Resort Nursing Home 9.09.16_2016-09-09-15.26.53.61.pdf
Request;20150724-000015;32035;PACE;Inpatient;PACE;C:\Users\FGuo\Documents\work doucment\attachment\attachmentDB\20161005\originalFileFromAerial\DOCSVC_20161003.tar\DOCSVC_20161003\DOCSVC_20161003\INPATIENT\REQ_20150724-000015\RJ Ramsingh, R 32035 7-23-15_2015-07-24-10.43.29.848.pdf
Request;20150724-000018;54618;DIRECT;Inpatient;DIRECT;C:\Users\FGuo\Documents\work doucment\attachment\attachmentDB\20161005\originalFileFromAerial\DOCSVC_20161003.tar\DOCSVC_20161003\DOCSVC_20161003\INPATIENT\REQ_20150724-000018\AJagmohan_2015-07-27-13.54.53.76.tif
Request;20150724-000018;54618;DIRECT;Inpatient;DIRECT;C:\Users\FGuo\Documents\work doucment\attachment\attachmentDB\20161005\originalFileFromAerial\DOCSVC_20161003.tar\DOCSVC_20161003\DOCSVC_20161003\INPATIENT\REQ_20150724-000018\Jagmohan, Alice_2015-07-24-10.52.13.155.tif
Request;20150724-000021;27316;DIRECT;Inpatient;DIRECT;C:\Users\FGuo\Documents\work doucment\attachment\attachmentDB\20161005\originalFileFromAerial\DOCSVC_20161003.tar\DOCSVC_20161003\DOCSVC_20161003\INPATIENT\REQ_20150724-000021\Ingram Lillie UR 7-24-15_2015-07-24-13.31.23.268.tif
Request;20150724-000021;27316;DIRECT;Inpatient;DIRECT;C:\Users\FGuo\Documents\work doucment\attachment\attachmentDB\20161005\originalFileFromAerial\DOCSVC_20161003.tar\DOCSVC_20161003\DOCSVC_20161003\INPATIENT\REQ_20150724-000021\Ingram, lillie27316 hosp CLINICAL REVIEW REQUEST FORM.doc 7 24 15_2015-07-24-11.13.23.367.doc
Request;20150724-000021;27316;DIRECT;Inpatient;DIRECT;C:\Users\FGuo\Documents\work doucment\attachment\attachmentDB\20161005\originalFileFromAerial\DOCSVC_20161003.tar\DOCSVC_20161003\DOCSVC_20161003\INPATIENT\REQ_20150724-000021\Lillie Ingram UR 7-28-15_2015-07-28-13.24.13.79.tif
Request;20150724-000025;37332;PACE;Inpatient;PACE;C:\Users\FGuo\Documents\work doucment\attachment\attachmentDB\20161005\originalFileFromAerial\DOCSVC_20161003.tar\DOCSVC_20161003\DOCSVC_20161003\INPATIENT\REQ_20150724-000025\edwin flower10_2015-08-12-15.00.57.811.tif
Request;20150724-000025;37332;PACE;Inpatient;PACE;C:\Users\FGuo\Documents\work doucment\attachment\attachmentDB\20161005\originalFileFromAerial\DOCSVC_20161003.tar\DOCSVC_20161003\DOCSVC_20161003\INPATIENT\REQ_20150724-000025\edwin flower26_2015-08-26-14.40.02.834.tif
Request;20150724-000025;37332;PACE;Inpatient;PACE;C:\Users\FGuo\Documents\work doucment\attachment\attachmentDB\20161005\originalFileFromAerial\DOCSVC_20161003.tar\DOCSVC_20161003\DOCSVC_20161003\INPATIENT\REQ_20150724-000025\Edwin Flowers PRI 7-24-15_2015-07-24-11.48.07.195.tif
Request;20150724-000025;37332;PACE;Inpatient;PACE;C:\Users\FGuo\Documents\work doucment\attachment\attachmentDB\20161005\originalFileFromAerial\DOCSVC_20161003.tar\DOCSVC_20161003\DOCSVC_20161003\INPATIENT\REQ_20150724-000025\edwin flowers_2015-08-05-20.49.15.808.tif
Request;20150724-000025;37332;PACE;Inpatient;PACE;C:\Users\FGuo\Documents\work doucment\attachment\attachmentDB\20161005\originalFileFromAerial\DOCSVC_20161003.tar\DOCSVC_20161003\DOCSVC_20161003\INPATIENT\REQ_20150724-000025\Edwin Flower_2015-07-29-19.38.05.699.tif
Request;20150724-000027;26442;PACE;Inpatient;PACE;C:\Users\FGuo\Documents\work doucment\attachment\attachmentDB\20161005\originalFileFromAerial\DOCSVC_20161003.tar\DOCSVC_20161003\DOCSVC_20161003\INPATIENT\REQ_20150724-000027\Evans, Sarah - Margaret Teitz Nursing & Rehab Center  7.24.15_2015-07-24-16.28.36.876.docx
Request;20150724-000027;26442;PACE;Inpatient;PACE;C:\Users\FGuo\Documents\work doucment\attachment\attachmentDB\20161005\originalFileFromAerial\DOCSVC_20161003.tar\DOCSVC_20161003\DOCSVC_20161003\INPATIENT\REQ_20150724-000027\Evans, Sarah - MARGARET TIETZ NURSING AND REHAB CTR 9.07.16_2016-09-07-08.55.29.479.pdf
Request;20150724-000040;99221;PACE;Inpatient;PACE;C:\Users\FGuo\Documents\work doucment\attachment\attachmentDB\20161005\originalFileFromAerial\DOCSVC_20161003.tar\DOCSVC_20161003\DOCSVC_20161003\INPATIENT\REQ_20150724-000040\JUAN VAZQUEZ clinicals hosp adm_2015-07-24-13.51.08.77.txt
Request;20150724-000047;71337;null;Inpatient;PACE;C:\Users\FGuo\Documents\work doucment\attachment\attachmentDB\20161005\originalFileFromAerial\DOCSVC_20161003.tar\DOCSVC_20161003\DOCSVC_20161003\INPATIENT\REQ_20150724-000047\maria matosdcsum_2015-08-11-10.18.34.784.tif
Request;20150724-000047;71337;null;Inpatient;PACE;C:\Users\FGuo\Documents\work doucment\attachment\attachmentDB\20161005\originalFileFromAerial\DOCSVC_20161003.tar\DOCSVC_20161003\DOCSVC_20161003\INPATIENT\REQ_20150724-000047\Matos Maria  PACE-Beth Israel Petri 8-7-15_2015-08-07-15.51.23.502.docx
Request;20150724-000047;71337;null;Inpatient;PACE;C:\Users\FGuo\Documents\work doucment\attachment\attachmentDB\20161005\originalFileFromAerial\DOCSVC_20161003.tar\DOCSVC_20161003\DOCSVC_20161003\INPATIENT\REQ_20150724-000047\matos Rivera, maria 7 24_2015-07-24-14.48.38.716.tif
Request;20150724-000047;71337;null;Inpatient;PACE;C:\Users\FGuo\Documents\work doucment\attachment\attachmentDB\20161005\originalFileFromAerial\DOCSVC_20161003.tar\DOCSVC_20161003\DOCSVC_20161003\INPATIENT\REQ_20150724-000047\Matos Rivera, maria 71337 CLINICAL REVIEW REQUEST FORM.doc 7 24 15_2015-07-24-14.56.25.850.doc
Request;20150724-000047;71337;null;Inpatient;PACE;C:\Users\FGuo\Documents\work doucment\attachment\attachmentDB\20161005\originalFileFromAerial\DOCSVC_20161003.tar\DOCSVC_20161003\DOCSVC_20161003\INPATIENT\REQ_20150724-000047\_2015-08-11-10.17.25.901
Request;20150724-000062;53228;PACE;Inpatient;PACE;C:\Users\FGuo\Documents\work doucment\attachment\attachmentDB\20161005\originalFileFromAerial\DOCSVC_20161003.tar\DOCSVC_20161003\DOCSVC_20161003\INPATIENT\REQ_20150724-000062\WPelzer_2015-07-24-16.19.37.626.tif
Request;20150724-000067;31957;PACE;Inpatient;PACE;C:\Users\FGuo\Documents\work doucment\attachment\attachmentDB\20161005\originalFileFromAerial\DOCSVC_20161003.tar\DOCSVC_20161003\DOCSVC_20161003\INPATIENT\REQ_20150724-000067\Vaz, Enid - Margaret Teitz Nursing & Rehab Center  7.27.15_2015-07-27-17.19.31.967.docx
Request;20150727-000002;20604;FIDA;Inpatient;FIDA;C:\Users\FGuo\Documents\work doucment\attachment\attachmentDB\20161005\originalFileFromAerial\DOCSVC_20161003.tar\DOCSVC_20161003\DOCSVC_20161003\INPATIENT\REQ_20150727-000002\Wilson, Lorraine- Bezalel Nursing Home Company  7.27.15_2015-07-27-10.21.03.755.docx
Request;20150727-000004;82569;PACE;Inpatient;PACE;C:\Users\FGuo\Documents\work doucment\attachment\attachmentDB\20161005\originalFileFromAerial\DOCSVC_20161003.tar\DOCSVC_20161003\DOCSVC_20161003\INPATIENT\REQ_20150727-000004\Radha Ramkissoon UR 7-27-15_2015-07-27-12.29.08.504.tif
Request;20150727-000004;82569;PACE;Inpatient;PACE;C:\Users\FGuo\Documents\work doucment\attachment\attachmentDB\20161005\originalFileFromAerial\DOCSVC_20161003.tar\DOCSVC_20161003\DOCSVC_20161003\INPATIENT\REQ_20150727-000004\Ramikissoon, Radha Final Adverse Determination Appeal Unfavorable-Contracted Hospitals_2015-09-28-13.48.07.475.docx
Request;20150727-000004;82569;PACE;Inpatient;PACE;C:\Users\FGuo\Documents\work doucment\attachment\attachmentDB\20161005\originalFileFromAerial\DOCSVC_20161003.tar\DOCSVC_20161003\DOCSVC_20161003\INPATIENT\REQ_20150727-000004\Ramkissoon Radha IP Denial Forest Hills Hosital 7-28-15_2015-07-28-15.09.05.915.docx
Request;20150727-000004;82569;PACE;Inpatient;PACE;C:\Users\FGuo\Documents\work doucment\attachment\attachmentDB\20161005\originalFileFromAerial\DOCSVC_20161003.tar\DOCSVC_20161003\DOCSVC_20161003\INPATIENT\REQ_20150727-000004\Ramkissoon, Radha  NS Forest Hills Clinical Review Request Form 7-27-15_2015-07-27-09.43.50.413.docx
Request;20150727-000004;82569;PACE;Inpatient;PACE;C:\Users\FGuo\Documents\work doucment\attachment\attachmentDB\20161005\originalFileFromAerial\DOCSVC_20161003.tar\DOCSVC_20161003\DOCSVC_20161003\INPATIENT\REQ_20150727-000004\Ramkissoon, Radha Appeal Ack Letter_2015-09-04-12.55.17.166.docx
Request;20150727-000005;55337;DIRECT;Inpatient;DIRECT;C:\Users\FGuo\Documents\work doucment\attachment\attachmentDB\20161005\originalFileFromAerial\DOCSVC_20161003.tar\DOCSVC_20161003\DOCSVC_20161003\INPATIENT\REQ_20150727-000005\Bourne, Gerald_2015-07-28-11.33.00.144.tif
Request;20150727-000005;55337;DIRECT;Inpatient;DIRECT;C:\Users\FGuo\Documents\work doucment\attachment\attachmentDB\20161005\originalFileFromAerial\DOCSVC_20161003.tar\DOCSVC_20161003\DOCSVC_20161003\INPATIENT\REQ_20150727-000005\bourne-DC_2015-08-05-10.09.46.123.tif
Request;20150727-000005;55337;DIRECT;Inpatient;DIRECT;C:\Users\FGuo\Documents\work doucment\attachment\attachmentDB\20161005\originalFileFromAerial\DOCSVC_20161003.tar\DOCSVC_20161003\DOCSVC_20161003\INPATIENT\REQ_20150727-000005\bourne-DNR_2015-08-05-10.10.11.992.tif
Request;20150727-000006;41099;PACE;Inpatient;PACE;C:\Users\FGuo\Documents\work doucment\attachment\attachmentDB\20161005\originalFileFromAerial\DOCSVC_20161003.tar\DOCSVC_20161003\DOCSVC_20161003\INPATIENT\REQ_20150727-000006\Miriam Lahey UR 7-27-15_2015-07-28-07.48.48.502.tif
Request;20150727-000007;88805;PACE;Inpatient;PACE;C:\Users\FGuo\Documents\work doucment\attachment\attachmentDB\20161005\originalFileFromAerial\DOCSVC_20161003.tar\DOCSVC_20161003\DOCSVC_20161003\INPATIENT\REQ_20150727-000007\Guo Ting Xiang IP Denial Lutheran Medical Center 8-3-15_2015-08-03-16.26.53.346.docx
Request;20150727-000007;88805;PACE;Inpatient;PACE;C:\Users\FGuo\Documents\work doucment\attachment\attachmentDB\20161005\originalFileFromAerial\DOCSVC_20161003.tar\DOCSVC_20161003\DOCSVC_20161003\INPATIENT\REQ_20150727-000007\Guo, Ting Xiang--Lutheran Medical Center Clinical Review Request Form 7-27-15_2015-07-27-09.57.33.871.docx
Request;20150727-000012;23338;PACE;Inpatient;PACE;C:\Users\FGuo\Documents\work doucment\attachment\attachmentDB\20161005\originalFileFromAerial\DOCSVC_20161003.tar\DOCSVC_20161003\DOCSVC_20161003\INPATIENT\REQ_20150727-000012\JSalcedo dc_2015-08-04-15.57.05.688.tif
Request;20150727-000012;23338;PACE;Inpatient;PACE;C:\Users\FGuo\Documents\work doucment\attachment\attachmentDB\20161005\originalFileFromAerial\DOCSVC_20161003.tar\DOCSVC_20161003\DOCSVC_20161003\INPATIENT\REQ_20150727-000012\JSalcedo_2015-07-27-15.02.21.78.tif
Request;20150727-000012;23338;PACE;Inpatient;PACE;C:\Users\FGuo\Documents\work doucment\attachment\attachmentDB\20161005\originalFileFromAerial\DOCSVC_20161003.tar\DOCSVC_20161003\DOCSVC_20161003\INPATIENT\REQ_20150727-000012\Salcedo, Julia 23338_2015-07-27-11.37.09.586.tif
Request;20150727-000013;47876;FIDA;Inpatient;FIDA;C:\Users\FGuo\Documents\work doucment\attachment\attachmentDB\20161005\originalFileFromAerial\DOCSVC_20161003.tar\DOCSVC_20161003\DOCSVC_20161003\INPATIENT\REQ_20150727-000013\DJones 72715_2015-07-27-17.21.25.614.tif
Request;20150727-000013;47876;FIDA;Inpatient;FIDA;C:\Users\FGuo\Documents\work doucment\attachment\attachmentDB\20161005\originalFileFromAerial\DOCSVC_20161003.tar\DOCSVC_20161003\DOCSVC_20161003\INPATIENT\REQ_20150727-000013\DJones DC Summary_2015-07-28-16.45.36.700.tif
Request;20150727-000013;47876;FIDA;Inpatient;FIDA;C:\Users\FGuo\Documents\work doucment\attachment\attachmentDB\20161005\originalFileFromAerial\DOCSVC_20161003.tar\DOCSVC_20161003\DOCSVC_20161003\INPATIENT\REQ_20150727-000013\Jones, Deborah_2015-07-27-11.42.46.991.tif
Request;20150727-000016;97961;PACE;Inpatient;PACE;C:\Users\FGuo\Documents\work doucment\attachment\attachmentDB\20161005\originalFileFromAerial\DOCSVC_20161003.tar\DOCSVC_20161003\DOCSVC_20161003\INPATIENT\REQ_20150727-000016\edwards, hattie_2015-07-28-08.37.10.431.tif
Request;20150727-000016;97961;PACE;Inpatient;PACE;C:\Users\FGuo\Documents\work doucment\attachment\attachmentDB\20161005\originalFileFromAerial\DOCSVC_20161003.tar\DOCSVC_20161003\DOCSVC_20161003\INPATIENT\REQ_20150727-000016\edwards,pri_2015-08-05-09.06.21.812.tif
Request;20150727-000016;97961;PACE;Inpatient;PACE;C:\Users\FGuo\Documents\work doucment\attachment\attachmentDB\20161005\originalFileFromAerial\DOCSVC_20161003.tar\DOCSVC_20161003\DOCSVC_20161003\INPATIENT\REQ_20150727-000016\edwards2_2015-08-05-09.04.49.75.tif
Request;20150727-000016;97961;PACE;Inpatient;PACE;C:\Users\FGuo\Documents\work doucment\attachment\attachmentDB\20161005\originalFileFromAerial\DOCSVC_20161003.tar\DOCSVC_20161003\DOCSVC_20161003\INPATIENT\REQ_20150727-000016\edwards8-7_2015-08-13-09.45.54.547.tif
Request;20150727-000021;99615;PACE;Inpatient;PACE;C:\Users\FGuo\Documents\work doucment\attachment\attachmentDB\20161005\originalFileFromAerial\DOCSVC_20161003.tar\DOCSVC_20161003\DOCSVC_20161003\INPATIENT\REQ_20150727-000021\Barton, Phyllis - Beth Abram Health Svcs. - 7-30-15_2015-07-30-11.02.48.588.docx
Request;20150727-000021;99615;PACE;Inpatient;PACE;C:\Users\FGuo\Documents\work doucment\attachment\attachmentDB\20161005\originalFileFromAerial\DOCSVC_20161003.tar\DOCSVC_20161003\DOCSVC_20161003\INPATIENT\REQ_20150727-000021\RJ Barton, P 99615 7-27-15_2015-07-27-12.22.35.627.htm
Request;20150727-000024;55060;DIRECT/SELECT LT;Inpatient;DIRECT/SELECT LT;C:\Users\FGuo\Documents\work doucment\attachment\attachmentDB\20161005\originalFileFromAerial\DOCSVC_20161003.tar\DOCSVC_20161003\DOCSVC_20161003\INPATIENT\REQ_20150727-000024\Davis Mary-Member Denial Center for Nursing & Rehab 7-28-15_2015-07-31-14.51.26.376.docx
Request;20150727-000024;55060;DIRECT/SELECT LT;Inpatient;DIRECT/SELECT LT;C:\Users\FGuo\Documents\work doucment\attachment\attachmentDB\20161005\originalFileFromAerial\DOCSVC_20161003.tar\DOCSVC_20161003\DOCSVC_20161003\INPATIENT\REQ_20150727-000024\Davis Mary-Provider Denial Center for Nursing & Rehab 7-28-15_2015-07-31-14.51.44.400.docx
Request;20150727-000024;55060;DIRECT/SELECT LT;Inpatient;DIRECT/SELECT LT;C:\Users\FGuo\Documents\work doucment\attachment\attachmentDB\20161005\originalFileFromAerial\DOCSVC_20161003.tar\DOCSVC_20161003\DOCSVC_20161003\INPATIENT\REQ_20150727-000024\MDavis_2015-07-27-13.09.16.272.tif
Request;20150727-000033;51143;PACE;Inpatient;PACE;C:\Users\FGuo\Documents\work doucment\attachment\attachmentDB\20161005\originalFileFromAerial\DOCSVC_20161003.tar\DOCSVC_20161003\DOCSVC_20161003\INPATIENT\REQ_20150727-000033\Alicia Cardona UR 7-29-15_2015-07-29-15.37.39.712.tif
Request;20150727-000033;51143;PACE;Inpatient;PACE;C:\Users\FGuo\Documents\work doucment\attachment\attachmentDB\20161005\originalFileFromAerial\DOCSVC_20161003.tar\DOCSVC_20161003\DOCSVC_20161003\INPATIENT\REQ_20150727-000033\CARDONA, ALICIA - CLINICAL REVIEW REQUEST FORM_2015-07-27-15.41.27.572.doc
Request;20150728-000004;58475;FIDA;Inpatient;FIDA;C:\Users\FGuo\Documents\work doucment\attachment\attachmentDB\20161005\originalFileFromAerial\DOCSVC_20161003.tar\DOCSVC_20161003\DOCSVC_20161003\INPATIENT\REQ_20150728-000004\Echevarria, Digna - Jacobi Medical Center Clinical Review Request 7-28-15_2015-07-28-09.28.08.762.docx
Request;20150728-000005;42108;PACE;Inpatient;PACE;C:\Users\FGuo\Documents\work doucment\attachment\attachmentDB\20161005\originalFileFromAerial\DOCSVC_20161003.tar\DOCSVC_20161003\DOCSVC_20161003\INPATIENT\REQ_20150728-000005\Nick Doxakopoulos UR 7-27-15_2015-07-28-10.21.43.359.tif
Request;20150728-000007;47413;PACE;Inpatient;PACE;C:\Users\FGuo\Documents\work doucment\attachment\attachmentDB\20161005\originalFileFromAerial\DOCSVC_20161003.tar\DOCSVC_20161003\DOCSVC_20161003\INPATIENT\REQ_20150728-000007\plenty, robert_2015-07-28-16.01.19.704.tif
Request;20150728-000010;29210;DIRECT;Inpatient;DIRECT;C:\Users\FGuo\Documents\work doucment\attachment\attachmentDB\20161005\originalFileFromAerial\DOCSVC_20161003.tar\DOCSVC_20161003\DOCSVC_20161003\INPATIENT\REQ_20150728-000010\curry,b_2015-07-31-10.17.58.833.tif
Request;20150728-000011;43653;PACE;Inpatient;PACE;C:\Users\FGuo\Documents\work doucment\attachment\attachmentDB\20161005\originalFileFromAerial\DOCSVC_20161003.tar\DOCSVC_20161003\DOCSVC_20161003\INPATIENT\REQ_20150728-000011\louise patterson19_2015-08-19-18.22.53.88.tif
Request;20150728-000011;43653;PACE;Inpatient;PACE;C:\Users\FGuo\Documents\work doucment\attachment\attachmentDB\20161005\originalFileFromAerial\DOCSVC_20161003.tar\DOCSVC_20161003\DOCSVC_20161003\INPATIENT\REQ_20150728-000011\Louise PattersonPRI 7-27-15_2015-07-28-10.03.12.781.tif
Request;20150728-000011;43653;PACE;Inpatient;PACE;C:\Users\FGuo\Documents\work doucment\attachment\attachmentDB\20161005\originalFileFromAerial\DOCSVC_20161003.tar\DOCSVC_20161003\DOCSVC_20161003\INPATIENT\REQ_20150728-000011\louise patterson_2015-08-10-13.42.37.925.tif
Request;20150728-000013;99221;PACE;Inpatient;PACE;C:\Users\FGuo\Documents\work doucment\attachment\attachmentDB\20161005\originalFileFromAerial\DOCSVC_20161003.tar\DOCSVC_20161003\DOCSVC_20161003\INPATIENT\REQ_20150728-000013\Vazquez, Juan  - Montefiore Med Cen-Moses-Clinical Review Request Form 7-28-15_2015-07-28-09.56.06.171.docx
Request;20150728-000013;99221;PACE;Inpatient;PACE;C:\Users\FGuo\Documents\work doucment\attachment\attachmentDB\20161005\originalFileFromAerial\DOCSVC_20161003.tar\DOCSVC_20161003\DOCSVC_20161003\INPATIENT\REQ_20150728-000013\vazquez, juan_2015-07-29-16.19.17.960.tif
Request;20150728-000016;27620;DIRECT;Inpatient;DIRECT;C:\Users\FGuo\Documents\work doucment\attachment\attachmentDB\20161005\originalFileFromAerial\DOCSVC_20161003.tar\DOCSVC_20161003\DOCSVC_20161003\INPATIENT\REQ_20150728-000016\smith,elizabeth_2015-07-30-16.34.13.429.tif
Request;20150728-000023;53835;DIRECT;Inpatient;DIRECT;C:\Users\FGuo\Documents\work doucment\attachment\attachmentDB\20161005\originalFileFromAerial\DOCSVC_20161003.tar\DOCSVC_20161003\DOCSVC_20161003\INPATIENT\REQ_20150728-000023\Fernandez Ismael DIRECT IP Denial St Johns Episcopal Hospital 8-6-15_2015-08-06-13.30.11.372.docx
Request;20150728-000023;53835;DIRECT;Inpatient;DIRECT;C:\Users\FGuo\Documents\work doucment\attachment\attachmentDB\20161005\originalFileFromAerial\DOCSVC_20161003.tar\DOCSVC_20161003\DOCSVC_20161003\INPATIENT\REQ_20150728-000023\Fernandez, Ismael Appeal ACK Letter_2015-10-02-12.00.33.385.docx
Request;20150728-000023;53835;DIRECT;Inpatient;DIRECT;C:\Users\FGuo\Documents\work doucment\attachment\attachmentDB\20161005\originalFileFromAerial\DOCSVC_20161003.tar\DOCSVC_20161003\DOCSVC_20161003\INPATIENT\REQ_20150728-000023\Fernandez, Ismael- St John's Episcopal Hospital -Clinical Review Request Form 7-28-15_2015-07-28-10.32.12.19.docx
Request;20150728-000023;53835;DIRECT;Inpatient;DIRECT;C:\Users\FGuo\Documents\work doucment\attachment\attachmentDB\20161005\originalFileFromAerial\DOCSVC_20161003.tar\DOCSVC_20161003\DOCSVC_20161003\INPATIENT\REQ_20150728-000023\Ismael Fernandez UR 7-30-15_2015-07-30-11.37.32.990.tif
Request;20150728-000024;57727;DIRECT;Inpatient;DIRECT;C:\Users\FGuo\Documents\work doucment\attachment\attachmentDB\20161005\originalFileFromAerial\DOCSVC_20161003.tar\DOCSVC_20161003\DOCSVC_20161003\INPATIENT\REQ_20150728-000024\Genaro Vega UR 7-28-15_2015-07-28-15.10.42.367.tif
Request;20150728-000024;57727;DIRECT;Inpatient;DIRECT;C:\Users\FGuo\Documents\work doucment\attachment\attachmentDB\20161005\originalFileFromAerial\DOCSVC_20161003.tar\DOCSVC_20161003\DOCSVC_20161003\INPATIENT\REQ_20150728-000024\Vega, Genaro - St John's Episcopal Hospital -Clinical Review Request Form 7-28-15_2015-07-28-10.44.41.825.docx
Request;20150728-000028;34600;PACE;Inpatient;PACE;C:\Users\FGuo\Documents\work doucment\attachment\attachmentDB\20161005\originalFileFromAerial\DOCSVC_20161003.tar\DOCSVC_20161003\DOCSVC_20161003\INPATIENT\REQ_20150728-000028\Anthony Lucev UR 7-27-15_2015-07-28-16.04.51.876.tif
Request;20150728-000028;34600;PACE;Inpatient;PACE;C:\Users\FGuo\Documents\work doucment\attachment\attachmentDB\20161005\originalFileFromAerial\DOCSVC_20161003.tar\DOCSVC_20161003\DOCSVC_20161003\INPATIENT\REQ_20150728-000028\Anthony Lucev UR 7-30-15_2015-07-30-15.07.20.668.tif
Request;20150728-000028;34600;PACE;Inpatient;PACE;C:\Users\FGuo\Documents\work doucment\attachment\attachmentDB\20161005\originalFileFromAerial\DOCSVC_20161003.tar\DOCSVC_20161003\DOCSVC_20161003\INPATIENT\REQ_20150728-000028\LUCEV ANTHONY - CLINICAL REVIEW REQUEST FORM_2015-07-28-12.07.58.508.doc
Request;20150728-000028;34600;PACE;Inpatient;PACE;C:\Users\FGuo\Documents\work doucment\attachment\attachmentDB\20161005\originalFileFromAerial\DOCSVC_20161003.tar\DOCSVC_20161003\DOCSVC_20161003\INPATIENT\REQ_20150728-000028\LUCEV, ANTHONY - ADMISSION_2015-07-28-11.58.16.71.tif
Request;20150728-000029;53895;DIRECT;Inpatient;DIRECT;C:\Users\FGuo\Documents\work doucment\attachment\attachmentDB\20161005\originalFileFromAerial\DOCSVC_20161003.tar\DOCSVC_20161003\DOCSVC_20161003\INPATIENT\REQ_20150728-000029\Carmen Cruz UR 7-28-15_2015-07-28-15.47.24.689.tif
Request;20150728-000029;53895;DIRECT;Inpatient;DIRECT;C:\Users\FGuo\Documents\work doucment\attachment\attachmentDB\20161005\originalFileFromAerial\DOCSVC_20161003.tar\DOCSVC_20161003\DOCSVC_20161003\INPATIENT\REQ_20150728-000029\Carmen Cruz UR 7-30-15_2015-07-30-15.09.05.321.tif
Request;20150728-000029;53895;DIRECT;Inpatient;DIRECT;C:\Users\FGuo\Documents\work doucment\attachment\attachmentDB\20161005\originalFileFromAerial\DOCSVC_20161003.tar\DOCSVC_20161003\DOCSVC_20161003\INPATIENT\REQ_20150728-000029\Cruz, Carmen 53895 CLINICAL REVIEW REQUEST FORM.doc 7 28 15_2015-07-28-11.34.05.337.doc
Request;20150728-000036;54618;DIRECT;Inpatient;DIRECT;C:\Users\FGuo\Documents\work doucment\attachment\attachmentDB\20161005\originalFileFromAerial\DOCSVC_20161003.tar\DOCSVC_20161003\DOCSVC_20161003\INPATIENT\REQ_20150728-000036\AJagmohan PRI_2015-07-28-13.51.27.412.tif
Request;20150728-000042;43725;PACE;Inpatient;PACE;C:\Users\FGuo\Documents\work doucment\attachment\attachmentDB\20161005\originalFileFromAerial\DOCSVC_20161003.tar\DOCSVC_20161003\DOCSVC_20161003\INPATIENT\REQ_20150728-000042\Elda Villard UR 7-30-15_2015-07-30-14.58.23.854.tif
Request;20150728-000042;43725;PACE;Inpatient;PACE;C:\Users\FGuo\Documents\work doucment\attachment\attachmentDB\20161005\originalFileFromAerial\DOCSVC_20161003.tar\DOCSVC_20161003\DOCSVC_20161003\INPATIENT\REQ_20150728-000042\Elda Villard UR 7-31-15_2015-07-31-14.52.08.529.tif
Request;20150728-000043;26660;PACE;Inpatient;PACE;C:\Users\FGuo\Documents\work doucment\attachment\attachmentDB\20161005\originalFileFromAerial\DOCSVC_20161003.tar\DOCSVC_20161003\DOCSVC_20161003\INPATIENT\REQ_20150728-000043\roy, nancy_2015-07-29-08.35.55.306.tif
Request;20150728-000044;42561;PACE;Inpatient;PACE;C:\Users\FGuo\Documents\work doucment\attachment\attachmentDB\20161005\originalFileFromAerial\DOCSVC_20161003.tar\DOCSVC_20161003\DOCSVC_20161003\INPATIENT\REQ_20150728-000044\geraldine merritt12_2015-08-12-13.42.23.812.tif
Request;20150728-000044;42561;PACE;Inpatient;PACE;C:\Users\FGuo\Documents\work doucment\attachment\attachmentDB\20161005\originalFileFromAerial\DOCSVC_20161003.tar\DOCSVC_20161003\DOCSVC_20161003\INPATIENT\REQ_20150728-000044\geraldine merritt18a_2015-08-18-18.01.53.275.tif
Request;20150728-000044;42561;PACE;Inpatient;PACE;C:\Users\FGuo\Documents\work doucment\attachment\attachmentDB\20161005\originalFileFromAerial\DOCSVC_20161003.tar\DOCSVC_20161003\DOCSVC_20161003\INPATIENT\REQ_20150728-000044\geraldine merritt18_2015-08-18-18.00.25.269.tif
Request;20150728-000044;42561;PACE;Inpatient;PACE;C:\Users\FGuo\Documents\work doucment\attachment\attachmentDB\20161005\originalFileFromAerial\DOCSVC_20161003.tar\DOCSVC_20161003\DOCSVC_20161003\INPATIENT\REQ_20150728-000044\geraldine merritt_2015-07-31-13.38.27.717.tif
Request;20150728-000044;42561;PACE;Inpatient;PACE;C:\Users\FGuo\Documents\work doucment\attachment\attachmentDB\20161005\originalFileFromAerial\DOCSVC_20161003.tar\DOCSVC_20161003\DOCSVC_20161003\INPATIENT\REQ_20150728-000044\geraldine merrit_2015-08-05-20.42.12.67.tif
Request;20150728-000044;42561;PACE;Inpatient;PACE;C:\Users\FGuo\Documents\work doucment\attachment\attachmentDB\20161005\originalFileFromAerial\DOCSVC_20161003.tar\DOCSVC_20161003\DOCSVC_20161003\INPATIENT\REQ_20150728-000044\merritt-PRI_2015-07-28-15.18.38.131.tif
Request;20150728-000044;42561;PACE;Inpatient;PACE;C:\Users\FGuo\Documents\work doucment\attachment\attachmentDB\20161005\originalFileFromAerial\DOCSVC_20161003.tar\DOCSVC_20161003\DOCSVC_20161003\INPATIENT\REQ_20150728-000044\_2015-07-31-13.38.32.180
Request;20150728-000044;42561;PACE;Inpatient;PACE;C:\Users\FGuo\Documents\work doucment\attachment\attachmentDB\20161005\originalFileFromAerial\DOCSVC_20161003.tar\DOCSVC_20161003\DOCSVC_20161003\INPATIENT\REQ_20150728-000044\_2015-08-18-17.59.54.371
Request;20150728-000046;32608;PACE;Inpatient;PACE;C:\Users\FGuo\Documents\work doucment\attachment\attachmentDB\20161005\originalFileFromAerial\DOCSVC_20161003.tar\DOCSVC_20161003\DOCSVC_20161003\INPATIENT\REQ_20150728-000046\fresa marte_2015-07-28-15.53.08.678.tif
Request;20150728-000046;32608;PACE;Inpatient;PACE;C:\Users\FGuo\Documents\work doucment\attachment\attachmentDB\20161005\originalFileFromAerial\DOCSVC_20161003.tar\DOCSVC_20161003\DOCSVC_20161003\INPATIENT\REQ_20150728-000046\Marte Fresa PACE Member Denial 7-29-15_2015-07-29-14.48.51.831.docx
Request;20150728-000046;32608;PACE;Inpatient;PACE;C:\Users\FGuo\Documents\work doucment\attachment\attachmentDB\20161005\originalFileFromAerial\DOCSVC_20161003.tar\DOCSVC_20161003\DOCSVC_20161003\INPATIENT\REQ_20150728-000046\Marte Fresa PACE Provider Denial 7-29-15_2015-07-29-14.49.14.851.docx
Request;20150728-000048;51382;PACE;Inpatient;PACE;C:\Users\FGuo\Documents\work doucment\attachment\attachmentDB\20161005\originalFileFromAerial\DOCSVC_20161003.tar\DOCSVC_20161003\DOCSVC_20161003\INPATIENT\REQ_20150728-000048\Asif Farida IP Denial Lawrence Hospital 8-5-15_2015-08-06-13.38.17.749.docx
Request;20150728-000048;51382;PACE;Inpatient;PACE;C:\Users\FGuo\Documents\work doucment\attachment\attachmentDB\20161005\originalFileFromAerial\DOCSVC_20161003.tar\DOCSVC_20161003\DOCSVC_20161003\INPATIENT\REQ_20150728-000048\Asif, Farida Appeal Ack letter_2015-09-22-14.53.41.643.docx
Request;20150728-000048;51382;PACE;Inpatient;PACE;C:\Users\FGuo\Documents\work doucment\attachment\attachmentDB\20161005\originalFileFromAerial\DOCSVC_20161003.tar\DOCSVC_20161003\DOCSVC_20161003\INPATIENT\REQ_20150728-000048\Asif, Farida Appeal Letter_2015-10-09-10.43.33.498.pdf
Request;20150728-000048;51382;PACE;Inpatient;PACE;C:\Users\FGuo\Documents\work doucment\attachment\attachmentDB\20161005\originalFileFromAerial\DOCSVC_20161003.tar\DOCSVC_20161003\DOCSVC_20161003\INPATIENT\REQ_20150728-000048\Asif, Farida PACE Final Adverse Determination- Appeal  Unfavorable Non-Contracted Hospitals_2015-10-16-12.25.59.499.docx
Request;20150728-000048;51382;PACE;Inpatient;PACE;C:\Users\FGuo\Documents\work doucment\attachment\attachmentDB\20161005\originalFileFromAerial\DOCSVC_20161003.tar\DOCSVC_20161003\DOCSVC_20161003\INPATIENT\REQ_20150728-000048\Asif, Farida---Lawrence Hospital Center Clinical Review Request Form 7-28-15_2015-07-28-15.28.28.501.docx
Request;20150728-000048;51382;PACE;Inpatient;PACE;C:\Users\FGuo\Documents\work doucment\attachment\attachmentDB\20161005\originalFileFromAerial\DOCSVC_20161003.tar\DOCSVC_20161003\DOCSVC_20161003\INPATIENT\REQ_20150728-000048\asif,farida_2015-08-05-08.09.04.958.tif
Request;20150728-000048;51382;PACE;Inpatient;PACE;C:\Users\FGuo\Documents\work doucment\attachment\attachmentDB\20161005\originalFileFromAerial\DOCSVC_20161003.tar\DOCSVC_20161003\DOCSVC_20161003\INPATIENT\REQ_20150728-000048\MEDICAL RECORD ASIF 072415 COMPLETE_2015-10-09-10.43.55.741.pdf
Request;20150728-000049;40297;SELECT;Inpatient;SELECT;C:\Users\FGuo\Documents\work doucment\attachment\attachmentDB\20161005\originalFileFromAerial\DOCSVC_20161003.tar\DOCSVC_20161003\DOCSVC_20161003\INPATIENT\REQ_20150728-000049\Watts, Dorothy--St Barnabas Hospital---Clinical Review Request Form 7-28-15_2015-07-28-15.36.08.362.docx
Request;20150728-000049;40297;SELECT;Inpatient;SELECT;C:\Users\FGuo\Documents\work doucment\attachment\attachmentDB\20161005\originalFileFromAerial\DOCSVC_20161003.tar\DOCSVC_20161003\DOCSVC_20161003\INPATIENT\REQ_20150728-000049\watts, dorothy_2015-07-29-08.19.04.670.tif
Request;20150728-000052;91794;PACE;Inpatient;PACE;C:\Users\FGuo\Documents\work doucment\attachment\attachmentDB\20161005\originalFileFromAerial\DOCSVC_20161003.tar\DOCSVC_20161003\DOCSVC_20161003\INPATIENT\REQ_20150728-000052\townsend,ann_2015-07-29-08.12.08.872.tif
Request;20150728-000063;53862;DIRECT;Inpatient;DIRECT;C:\Users\FGuo\Documents\work doucment\attachment\attachmentDB\20161005\originalFileFromAerial\DOCSVC_20161003.tar\DOCSVC_20161003\DOCSVC_20161003\INPATIENT\REQ_20150728-000063\FKorn 72415_2015-08-12-11.20.30.467.tif
Request;20150728-000063;53862;DIRECT;Inpatient;DIRECT;C:\Users\FGuo\Documents\work doucment\attachment\attachmentDB\20161005\originalFileFromAerial\DOCSVC_20161003.tar\DOCSVC_20161003\DOCSVC_20161003\INPATIENT\REQ_20150728-000063\FKorn_2015-07-28-17.01.47.794.tif
Request;20150729-000001;26133;PACE;Inpatient;PACE;C:\Users\FGuo\Documents\work doucment\attachment\attachmentDB\20161005\originalFileFromAerial\DOCSVC_20161003.tar\DOCSVC_20161003\DOCSVC_20161003\INPATIENT\REQ_20150729-000001\McKenzie Maurice PACE IP Denial St. Johns Episcopal Hospital 7-30-15_2015-07-30-10.50.05.329.docx
Request;20150729-000001;26133;PACE;Inpatient;PACE;C:\Users\FGuo\Documents\work doucment\attachment\attachmentDB\20161005\originalFileFromAerial\DOCSVC_20161003.tar\DOCSVC_20161003\DOCSVC_20161003\INPATIENT\REQ_20150729-000001\MCKENZIE, MAURICE - ADMISSION_2015-07-29-07.48.23.545.tif
Request;20150729-000003;52687;PACE;Inpatient;PACE;C:\Users\FGuo\Documents\work doucment\attachment\attachmentDB\20161005\originalFileFromAerial\DOCSVC_20161003.tar\DOCSVC_20161003\DOCSVC_20161003\INPATIENT\REQ_20150729-000003\saxton, inez_2015-07-29-09.33.20.715.tif
Request;20150729-000003;52687;PACE;Inpatient;PACE;C:\Users\FGuo\Documents\work doucment\attachment\attachmentDB\20161005\originalFileFromAerial\DOCSVC_20161003.tar\DOCSVC_20161003\DOCSVC_20161003\INPATIENT\REQ_20150729-000003\saxton2_2015-08-05-13.14.37.132.tif
Request;20150729-000004;53104;DIRECT;Inpatient;DIRECT;C:\Users\FGuo\Documents\work doucment\attachment\attachmentDB\20161005\originalFileFromAerial\DOCSVC_20161003.tar\DOCSVC_20161003\DOCSVC_20161003\INPATIENT\REQ_20150729-000004\Cesar Andree DIRECT - NY Methodist Hospital 8-7-15_2015-08-07-09.57.22.395.docx
Request;20150729-000004;53104;DIRECT;Inpatient;DIRECT;C:\Users\FGuo\Documents\work doucment\attachment\attachmentDB\20161005\originalFileFromAerial\DOCSVC_20161003.tar\DOCSVC_20161003\DOCSVC_20161003\INPATIENT\REQ_20150729-000004\Cesar, Andree - New York Methodist Hospital  - 11-10-15._2015-11-10-15.19.00.418.docx
Request;20150729-000008;96884;PACE;Inpatient;PACE;C:\Users\FGuo\Documents\work doucment\attachment\attachmentDB\20161005\originalFileFromAerial\DOCSVC_20161003.tar\DOCSVC_20161003\DOCSVC_20161003\INPATIENT\REQ_20150729-000008\chen yue chin_2015-08-10-13.16.29.324.tif
Request;20150729-000010;84445;DIRECT;Inpatient;DIRECT;C:\Users\FGuo\Documents\work doucment\attachment\attachmentDB\20161005\originalFileFromAerial\DOCSVC_20161003.tar\DOCSVC_20161003\DOCSVC_20161003\INPATIENT\REQ_20150729-000010\petruolo, albert_2015-07-29-10.41.14.777.tif
Request;20150729-000014;42108;PACE;Inpatient;PACE;C:\Users\FGuo\Documents\work doucment\attachment\attachmentDB\20161005\originalFileFromAerial\DOCSVC_20161003.tar\DOCSVC_20161003\DOCSVC_20161003\INPATIENT\REQ_20150729-000014\Doxakopoulos, Nickos - Jacob Perlow Hospice Corporation  7.31.15_2015-07-31-10.43.53.650.docx
Request;20150729-000014;42108;PACE;Inpatient;PACE;C:\Users\FGuo\Documents\work doucment\attachment\attachmentDB\20161005\originalFileFromAerial\DOCSVC_20161003.tar\DOCSVC_20161003\DOCSVC_20161003\INPATIENT\REQ_20150729-000014\Nickos Doxakopoulos Hospice 7-29-15_2015-07-30-11.11.38.231.tif
Request;20150729-000014;42108;PACE;Inpatient;PACE;C:\Users\FGuo\Documents\work doucment\attachment\attachmentDB\20161005\originalFileFromAerial\DOCSVC_20161003.tar\DOCSVC_20161003\DOCSVC_20161003\INPATIENT\REQ_20150729-000014\Nickos Doxakopoulos Hospice Correction request 8-5-15_2015-08-05-12.02.52.654.tif
Request;20150729-000019;89032;PACE;Inpatient;PACE;C:\Users\FGuo\Documents\work doucment\attachment\attachmentDB\20161005\originalFileFromAerial\DOCSVC_20161003.tar\DOCSVC_20161003\DOCSVC_20161003\INPATIENT\REQ_20150729-000019\Final Adverse Determination- Appeal  Unfavorable Non-Contracted Hospitals_2015-11-30-15.12.02.621.docx
Request;20150729-000019;89032;PACE;Inpatient;PACE;C:\Users\FGuo\Documents\work doucment\attachment\attachmentDB\20161005\originalFileFromAerial\DOCSVC_20161003.tar\DOCSVC_20161003\DOCSVC_20161003\INPATIENT\REQ_20150729-000019\MR Zou, Shengzhi_3693873_2015-10-13-12.52.13.935.pdf
Request;20150729-000019;89032;PACE;Inpatient;PACE;C:\Users\FGuo\Documents\work doucment\attachment\attachmentDB\20161005\originalFileFromAerial\DOCSVC_20161003.tar\DOCSVC_20161003\DOCSVC_20161003\INPATIENT\REQ_20150729-000019\PRA-1  Appeal Acknowledgement _2015-10-13-12.51.58.871.docx
Request;20150729-000019;89032;PACE;Inpatient;PACE;C:\Users\FGuo\Documents\work doucment\attachment\attachmentDB\20161005\originalFileFromAerial\DOCSVC_20161003.tar\DOCSVC_20161003\DOCSVC_20161003\INPATIENT\REQ_20150729-000019\Shengshi Sou UR 7-30-15_2015-07-30-13.30.56.146.tif
Request;20150729-000019;89032;PACE;Inpatient;PACE;C:\Users\FGuo\Documents\work doucment\attachment\attachmentDB\20161005\originalFileFromAerial\DOCSVC_20161003.tar\DOCSVC_20161003\DOCSVC_20161003\INPATIENT\REQ_20150729-000019\WOL_2015-10-13-15.30.35.427.TIF
Request;20150729-000019;89032;PACE;Inpatient;PACE;C:\Users\FGuo\Documents\work doucment\attachment\attachmentDB\20161005\originalFileFromAerial\DOCSVC_20161003.tar\DOCSVC_20161003\DOCSVC_20161003\INPATIENT\REQ_20150729-000019\Zou Shengzhi appeal letter_2015-10-13-12.52.38.912.pdf
Request;20150729-000019;89032;PACE;Inpatient;PACE;C:\Users\FGuo\Documents\work doucment\attachment\attachmentDB\20161005\originalFileFromAerial\DOCSVC_20161003.tar\DOCSVC_20161003\DOCSVC_20161003\INPATIENT\REQ_20150729-000019\Zou Shengzhi IP Denial NY Hospitla Queens 8-6-15_2015-08-06-13.25.57.663.docx
Request;20150729-000019;89032;PACE;Inpatient;PACE;C:\Users\FGuo\Documents\work doucment\attachment\attachmentDB\20161005\originalFileFromAerial\DOCSVC_20161003.tar\DOCSVC_20161003\DOCSVC_20161003\INPATIENT\REQ_20150729-000019\Zou_2015-07-31-07.42.30.440.pdf
Request;20150729-000021;42340;DIRECT;Inpatient;DIRECT;C:\Users\FGuo\Documents\work doucment\attachment\attachmentDB\20161005\originalFileFromAerial\DOCSVC_20161003.tar\DOCSVC_20161003\DOCSVC_20161003\INPATIENT\REQ_20150729-000021\Hughs, William 42340 CLINICAL REVIEW REQUEST FORM.doc 7 29 15_2015-07-29-11.26.53.993.doc
Request;20150729-000021;42340;DIRECT;Inpatient;DIRECT;C:\Users\FGuo\Documents\work doucment\attachment\attachmentDB\20161005\originalFileFromAerial\DOCSVC_20161003.tar\DOCSVC_20161003\DOCSVC_20161003\INPATIENT\REQ_20150729-000021\hughs,williamPRI_2015-08-05-08.28.56.182.tif
Request;20150729-000021;42340;DIRECT;Inpatient;DIRECT;C:\Users\FGuo\Documents\work doucment\attachment\attachmentDB\20161005\originalFileFromAerial\DOCSVC_20161003.tar\DOCSVC_20161003\DOCSVC_20161003\INPATIENT\REQ_20150729-000021\hughs,william_2015-07-31-11.17.39.224.tif
Request;20150729-000033;36708;PACE;Inpatient;SELECT;C:\Users\FGuo\Documents\work doucment\attachment\attachmentDB\20161005\originalFileFromAerial\DOCSVC_20161003.tar\DOCSVC_20161003\DOCSVC_20161003\INPATIENT\REQ_20150729-000033\Chun, Heeok(Respite)- Flushing Manor Nursing Home & Rehab Center  7.31.15_2015-07-31-10.28.12.211.docx
Request;20150729-000033;36708;PACE;Inpatient;SELECT;C:\Users\FGuo\Documents\work doucment\attachment\attachmentDB\20161005\originalFileFromAerial\DOCSVC_20161003.tar\DOCSVC_20161003\DOCSVC_20161003\INPATIENT\REQ_20150729-000033\Chun, Heeok(Respite)- Flushing Manor Nursing Home & Rehab Center  7.31.15_2015-07-31-10.32.51.47.docx
Request;20150729-000038;76185;PACE;Inpatient;PACE;C:\Users\FGuo\Documents\work doucment\attachment\attachmentDB\20161005\originalFileFromAerial\DOCSVC_20161003.tar\DOCSVC_20161003\DOCSVC_20161003\INPATIENT\REQ_20150729-000038\cozzolino,j_2015-07-30-08.09.32.791.tif
Request;20150729-000038;76185;PACE;Inpatient;PACE;C:\Users\FGuo\Documents\work doucment\attachment\attachmentDB\20161005\originalFileFromAerial\DOCSVC_20161003.tar\DOCSVC_20161003\DOCSVC_20161003\INPATIENT\REQ_20150729-000038\cozzolino-pri_2015-08-05-11.33.16.254.tif
Request;20150729-000048;81198;PACE;Inpatient;PACE;C:\Users\FGuo\Documents\work doucment\attachment\attachmentDB\20161005\originalFileFromAerial\DOCSVC_20161003.tar\DOCSVC_20161003\DOCSVC_20161003\INPATIENT\REQ_20150729-000048\rivera, marino_2015-10-19-11.49.37.328.tif
Request;20150729-000049;48164;DIRECT;Inpatient;DIRECT;C:\Users\FGuo\Documents\work doucment\attachment\attachmentDB\20161005\originalFileFromAerial\DOCSVC_20161003.tar\DOCSVC_20161003\DOCSVC_20161003\INPATIENT\REQ_20150729-000049\Johnson Joann DIRECT IP Denial Mt Sinai Hospital 10-6-15_2015-10-06-12.24.52.601.docx
Request;20150729-000049;48164;DIRECT;Inpatient;DIRECT;C:\Users\FGuo\Documents\work doucment\attachment\attachmentDB\20161005\originalFileFromAerial\DOCSVC_20161003.tar\DOCSVC_20161003\DOCSVC_20161003\INPATIENT\REQ_20150729-000049\Johnson Joann DIRECT IP Denial Mt Sinai Hospital 10-6-15_2015-10-06-15.04.28.733.docx
Request;20150729-000049;48164;DIRECT;Inpatient;DIRECT;C:\Users\FGuo\Documents\work doucment\attachment\attachmentDB\20161005\originalFileFromAerial\DOCSVC_20161003.tar\DOCSVC_20161003\DOCSVC_20161003\INPATIENT\REQ_20150729-000049\Johnson, Joann 48164 CLINICAL REVIEW REQUEST FORM.doc 7 29 15_2015-07-29-15.10.32.250.doc
Request;20150729-000049;48164;DIRECT;Inpatient;DIRECT;C:\Users\FGuo\Documents\work doucment\attachment\attachmentDB\20161005\originalFileFromAerial\DOCSVC_20161003.tar\DOCSVC_20161003\DOCSVC_20161003\INPATIENT\REQ_20150729-000049\johnson, joann hosp_2015-07-29-15.04.47.894.tif
Request;20150729-000049;48164;DIRECT;Inpatient;DIRECT;C:\Users\FGuo\Documents\work doucment\attachment\attachmentDB\20161005\originalFileFromAerial\DOCSVC_20161003.tar\DOCSVC_20161003\DOCSVC_20161003\INPATIENT\REQ_20150729-000049\Medical Record part 1 (1)_2015-12-09-12.52.36.318.pdf
Request;20150729-000049;48164;DIRECT;Inpatient;DIRECT;C:\Users\FGuo\Documents\work doucment\attachment\attachmentDB\20161005\originalFileFromAerial\DOCSVC_20161003.tar\DOCSVC_20161003\DOCSVC_20161003\INPATIENT\REQ_20150729-000049\Medical Record part 2 (2)_2015-12-09-12.54.48.397.pdf
Request;20150729-000049;48164;DIRECT;Inpatient;DIRECT;C:\Users\FGuo\Documents\work doucment\attachment\attachmentDB\20161005\originalFileFromAerial\DOCSVC_20161003.tar\DOCSVC_20161003\DOCSVC_20161003\INPATIENT\REQ_20150729-000049\PRA-1  Appeal Acknowledgement _2015-12-09-12.43.47.429.docx
Request;20150729-000054;70693;null;Inpatient;PACE;C:\Users\FGuo\Documents\work doucment\attachment\attachmentDB\20161005\originalFileFromAerial\DOCSVC_20161003.tar\DOCSVC_20161003\DOCSVC_20161003\INPATIENT\REQ_20150729-000054\moll,NH_2015-09-01-09.38.35.948.tif
Request;20150729-000054;70693;null;Inpatient;PACE;C:\Users\FGuo\Documents\work doucment\attachment\attachmentDB\20161005\originalFileFromAerial\DOCSVC_20161003.tar\DOCSVC_20161003\DOCSVC_20161003\INPATIENT\REQ_20150729-000054\moll,NH_2015-09-04-08.11.12.643.tif
Request;20150729-000056;85786;PACE;Inpatient;PACE;C:\Users\FGuo\Documents\work doucment\attachment\attachmentDB\20161005\originalFileFromAerial\DOCSVC_20161003.tar\DOCSVC_20161003\DOCSVC_20161003\INPATIENT\REQ_20150729-000056\Duman, Maria - Wyckoff Heights MC Clinical Review Request Form 8-4-15_2015-08-04-09.54.12.243.docx
Request;20150729-000056;85786;PACE;Inpatient;PACE;C:\Users\FGuo\Documents\work doucment\attachment\attachmentDB\20161005\originalFileFromAerial\DOCSVC_20161003.tar\DOCSVC_20161003\DOCSVC_20161003\INPATIENT\REQ_20150729-000056\Duman, Maria- Wycoff Heights Medical Center   8.27.15_2015-08-27-10.57.07.23.docx
Request;20150729-000056;85786;PACE;Inpatient;PACE;C:\Users\FGuo\Documents\work doucment\attachment\attachmentDB\20161005\originalFileFromAerial\DOCSVC_20161003.tar\DOCSVC_20161003\DOCSVC_20161003\INPATIENT\REQ_20150729-000056\MDuman_2015-08-17-17.30.50.438.tif
Request;20150729-000059;86213;PACE;Inpatient;PACE;C:\Users\FGuo\Documents\work doucment\attachment\attachmentDB\20161005\originalFileFromAerial\DOCSVC_20161003.tar\DOCSVC_20161003\DOCSVC_20161003\INPATIENT\REQ_20150729-000059\Ortiz Mercado Candelaria IP Denial St Barnabas Hospital 8-4-15_2015-08-04-13.37.22.887.docx
Request;20150729-000059;86213;PACE;Inpatient;PACE;C:\Users\FGuo\Documents\work doucment\attachment\attachmentDB\20161005\originalFileFromAerial\DOCSVC_20161003.tar\DOCSVC_20161003\DOCSVC_20161003\INPATIENT\REQ_20150729-000059\Ortiz Mercado, Candelaria Appeal Ack Letter_2015-09-16-10.56.52.123.docx
Request;20150729-000059;86213;PACE;Inpatient;PACE;C:\Users\FGuo\Documents\work doucment\attachment\attachmentDB\20161005\originalFileFromAerial\DOCSVC_20161003.tar\DOCSVC_20161003\DOCSVC_20161003\INPATIENT\REQ_20150729-000059\Ortiz, Mercado PACE Final Adverse Determination- Appeal  Unfavorable Non-Contracted Hospitals_2015-10-14-15.56.16.713.docx
Request;20150729-000059;86213;PACE;Inpatient;PACE;C:\Users\FGuo\Documents\work doucment\attachment\attachmentDB\20161005\originalFileFromAerial\DOCSVC_20161003.tar\DOCSVC_20161003\DOCSVC_20161003\INPATIENT\REQ_20150729-000059\Ortiz-Mercado, Candelaria MR1_2015-10-09-10.32.34.873.pdf
Request;20150729-000059;86213;PACE;Inpatient;PACE;C:\Users\FGuo\Documents\work doucment\attachment\attachmentDB\20161005\originalFileFromAerial\DOCSVC_20161003.tar\DOCSVC_20161003\DOCSVC_20161003\INPATIENT\REQ_20150729-000059\Ortiz-Mercado, Candelaria MR2_2015-10-09-10.33.12.709.pdf
Request;20150729-000059;86213;PACE;Inpatient;PACE;C:\Users\FGuo\Documents\work doucment\attachment\attachmentDB\20161005\originalFileFromAerial\DOCSVC_20161003.tar\DOCSVC_20161003\DOCSVC_20161003\INPATIENT\REQ_20150729-000059\Ortiz-Mercado, Candelaria WOL_2015-10-14-16.00.06.927.pdf
Request;20150729-000059;86213;PACE;Inpatient;PACE;C:\Users\FGuo\Documents\work doucment\attachment\attachmentDB\20161005\originalFileFromAerial\DOCSVC_20161003.tar\DOCSVC_20161003\DOCSVC_20161003\INPATIENT\REQ_20150729-000059\ortizmercado,candelaria_2015-07-30-08.29.14.26.tif
Request;20150729-000060;83519;PACE;Inpatient;PACE;C:\Users\FGuo\Documents\work doucment\attachment\attachmentDB\20161005\originalFileFromAerial\DOCSVC_20161003.tar\DOCSVC_20161003\DOCSVC_20161003\INPATIENT\REQ_20150729-000060\detres,carmen_2015-07-30-08.20.21.911.tif
Request;20150729-000060;83519;PACE;Inpatient;PACE;C:\Users\FGuo\Documents\work doucment\attachment\attachmentDB\20161005\originalFileFromAerial\DOCSVC_20161003.tar\DOCSVC_20161003\DOCSVC_20161003\INPATIENT\REQ_20150729-000060\detres2_2015-08-06-11.37.38.699.tif
Request;20150730-000002;47876;FIDA;Inpatient;FIDA;C:\Users\FGuo\Documents\work doucment\attachment\attachmentDB\20161005\originalFileFromAerial\DOCSVC_20161003.tar\DOCSVC_20161003\DOCSVC_20161003\INPATIENT\REQ_20150730-000002\DJones 73015_2015-07-31-17.28.31.841.tif
Request;20150730-000002;47876;FIDA;Inpatient;FIDA;C:\Users\FGuo\Documents\work doucment\attachment\attachmentDB\20161005\originalFileFromAerial\DOCSVC_20161003.tar\DOCSVC_20161003\DOCSVC_20161003\INPATIENT\REQ_20150730-000002\Jones, Deborah---Brookdale Hosp--Clinical Review Request Form 7-30-15_2015-07-30-09.23.08.161.docx
Request;20150730-000003;31875;PACE;Inpatient;PACE;C:\Users\FGuo\Documents\work doucment\attachment\attachmentDB\20161005\originalFileFromAerial\DOCSVC_20161003.tar\DOCSVC_20161003\DOCSVC_20161003\INPATIENT\REQ_20150730-000003\Medical record part  2_2015-11-23-12.06.39.976.pdf
Request;20150730-000003;31875;PACE;Inpatient;PACE;C:\Users\FGuo\Documents\work doucment\attachment\attachmentDB\20161005\originalFileFromAerial\DOCSVC_20161003.tar\DOCSVC_20161003\DOCSVC_20161003\INPATIENT\REQ_20150730-000003\Medical record part 1 (1)_2015-11-23-12.06.16.451.pdf
Request;20150730-000003;31875;PACE;Inpatient;PACE;C:\Users\FGuo\Documents\work doucment\attachment\attachmentDB\20161005\originalFileFromAerial\DOCSVC_20161003.tar\DOCSVC_20161003\DOCSVC_20161003\INPATIENT\REQ_20150730-000003\PRA-2 Final Adverse Determination Appeal Unfavorable-Contracted Hospitals_2015-11-25-13.04.30.347.docx
Request;20150730-000003;31875;PACE;Inpatient;PACE;C:\Users\FGuo\Documents\work doucment\attachment\attachmentDB\20161005\originalFileFromAerial\DOCSVC_20161003.tar\DOCSVC_20161003\DOCSVC_20161003\INPATIENT\REQ_20150730-000003\Taylor Dolores IP Denial Montefiore Medical Center 8-11-15_2015-08-11-16.43.39.40.docx
Request;20150730-000003;31875;PACE;Inpatient;PACE;C:\Users\FGuo\Documents\work doucment\attachment\attachmentDB\20161005\originalFileFromAerial\DOCSVC_20161003.tar\DOCSVC_20161003\DOCSVC_20161003\INPATIENT\REQ_20150730-000003\taylor, delores_2015-08-05-08.31.44.698.tif
Request;20150730-000003;31875;PACE;Inpatient;PACE;C:\Users\FGuo\Documents\work doucment\attachment\attachmentDB\20161005\originalFileFromAerial\DOCSVC_20161003.tar\DOCSVC_20161003\DOCSVC_20161003\INPATIENT\REQ_20150730-000003\Taylor, Dolores 31875 CLINICAL REVIEW REQUEST FORM.doc 7 30 15_2015-07-30-09.24.41.851.doc
Request;20150730-000003;31875;PACE;Inpatient;PACE;C:\Users\FGuo\Documents\work doucment\attachment\attachmentDB\20161005\originalFileFromAerial\DOCSVC_20161003.tar\DOCSVC_20161003\DOCSVC_20161003\INPATIENT\REQ_20150730-000003\taylor-DCsummary_2015-08-05-08.32.20.560.tif
Request;20150730-000007;80083;PACE;Inpatient;PACE;C:\Users\FGuo\Documents\work doucment\attachment\attachmentDB\20161005\originalFileFromAerial\DOCSVC_20161003.tar\DOCSVC_20161003\DOCSVC_20161003\INPATIENT\REQ_20150730-000007\Jung Yu 7-31-15_2015-07-31-07.03.00.136.tif
Request;20150730-000007;80083;PACE;Inpatient;PACE;C:\Users\FGuo\Documents\work doucment\attachment\attachmentDB\20161005\originalFileFromAerial\DOCSVC_20161003.tar\DOCSVC_20161003\DOCSVC_20161003\INPATIENT\REQ_20150730-000007\Yu, Jung s 80083 CLINICAL REVIEW REQUEST FORM.doc7 30 15_2015-07-30-10.32.29.984.doc
Request;20150730-000016;40297;SELECT;Inpatient;SELECT;C:\Users\FGuo\Documents\work doucment\attachment\attachmentDB\20161005\originalFileFromAerial\DOCSVC_20161003.tar\DOCSVC_20161003\DOCSVC_20161003\INPATIENT\REQ_20150730-000016\dorothy watts04_2015-08-10-13.00.12.610.tif
Request;20150730-000016;40297;SELECT;Inpatient;SELECT;C:\Users\FGuo\Documents\work doucment\attachment\attachmentDB\20161005\originalFileFromAerial\DOCSVC_20161003.tar\DOCSVC_20161003\DOCSVC_20161003\INPATIENT\REQ_20150730-000016\dorothy watts14_2015-08-14-18.24.10.320.tif
Request;20150730-000016;40297;SELECT;Inpatient;SELECT;C:\Users\FGuo\Documents\work doucment\attachment\attachmentDB\20161005\originalFileFromAerial\DOCSVC_20161003.tar\DOCSVC_20161003\DOCSVC_20161003\INPATIENT\REQ_20150730-000016\dorothy watts_2015-08-07-17.26.34.65.tif
Request;20150730-000018;52122;PACE;Inpatient;PACE;C:\Users\FGuo\Documents\work doucment\attachment\attachmentDB\20161005\originalFileFromAerial\DOCSVC_20161003.tar\DOCSVC_20161003\DOCSVC_20161003\INPATIENT\REQ_20150730-000018\pri-shaw_2015-08-05-08.44.18.123.tif
Request;20150730-000018;52122;PACE;Inpatient;PACE;C:\Users\FGuo\Documents\work doucment\attachment\attachmentDB\20161005\originalFileFromAerial\DOCSVC_20161003.tar\DOCSVC_20161003\DOCSVC_20161003\INPATIENT\REQ_20150730-000018\Shaw, John -  Westcher Medical Center Clinical Review Request Form 7-30-14_2015-07-30-11.40.57.25.docx
Request;20150730-000018;52122;PACE;Inpatient;PACE;C:\Users\FGuo\Documents\work doucment\attachment\attachmentDB\20161005\originalFileFromAerial\DOCSVC_20161003.tar\DOCSVC_20161003\DOCSVC_20161003\INPATIENT\REQ_20150730-000018\shaw,john_2015-08-05-08.43.18.894.tif
Request;20150730-000021;57223;PACE;Inpatient;PACE;C:\Users\FGuo\Documents\work doucment\attachment\attachmentDB\20161005\originalFileFromAerial\DOCSVC_20161003.tar\DOCSVC_20161003\DOCSVC_20161003\INPATIENT\REQ_20150730-000021\parsons sheila_2015-08-05-11.58.55.336.tif
Request;20150730-000021;57223;PACE;Inpatient;PACE;C:\Users\FGuo\Documents\work doucment\attachment\attachmentDB\20161005\originalFileFromAerial\DOCSVC_20161003.tar\DOCSVC_20161003\DOCSVC_20161003\INPATIENT\REQ_20150730-000021\Parsons, Sheila---Kingsbrook J MC---Clinical Review Request Form 7-30-15_2015-07-30-11.50.44.965.docx
Request;20150730-000024;29678;PACE;Inpatient;PACE;C:\Users\FGuo\Documents\work doucment\attachment\attachmentDB\20161005\originalFileFromAerial\DOCSVC_20161003.tar\DOCSVC_20161003\DOCSVC_20161003\INPATIENT\REQ_20150730-000024\juan tigre14_2015-08-14-13.48.06.743.tif
Request;20150730-000024;29678;PACE;Inpatient;PACE;C:\Users\FGuo\Documents\work doucment\attachment\attachmentDB\20161005\originalFileFromAerial\DOCSVC_20161003.tar\DOCSVC_20161003\DOCSVC_20161003\INPATIENT\REQ_20150730-000024\juan tigre21_2015-08-24-10.32.31.409.tif
Request;20150730-000024;29678;PACE;Inpatient;PACE;C:\Users\FGuo\Documents\work doucment\attachment\attachmentDB\20161005\originalFileFromAerial\DOCSVC_20161003.tar\DOCSVC_20161003\DOCSVC_20161003\INPATIENT\REQ_20150730-000024\juan tigre7_2015-08-07-17.11.38.531.tif
Request;20150730-000024;29678;PACE;Inpatient;PACE;C:\Users\FGuo\Documents\work doucment\attachment\attachmentDB\20161005\originalFileFromAerial\DOCSVC_20161003.tar\DOCSVC_20161003\DOCSVC_20161003\INPATIENT\REQ_20150730-000024\juan tigre_2015-08-06-09.30.55.440.tif
Request;20150730-000024;29678;PACE;Inpatient;PACE;C:\Users\FGuo\Documents\work doucment\attachment\attachmentDB\20161005\originalFileFromAerial\DOCSVC_20161003.tar\DOCSVC_20161003\DOCSVC_20161003\INPATIENT\REQ_20150730-000024\Tigre, Juan -Workman?s Circle Home Geriatric Center  8.13.15_2015-08-13-15.57.56.280.docx
Request;20150730-000024;29678;PACE;Inpatient;PACE;C:\Users\FGuo\Documents\work doucment\attachment\attachmentDB\20161005\originalFileFromAerial\DOCSVC_20161003.tar\DOCSVC_20161003\DOCSVC_20161003\INPATIENT\REQ_20150730-000024\_2015-08-13-15.57.37.893
Request;20150730-000027;57622;DIRECT;Inpatient;DIRECT;C:\Users\FGuo\Documents\work doucment\attachment\attachmentDB\20161005\originalFileFromAerial\DOCSVC_20161003.tar\DOCSVC_20161003\DOCSVC_20161003\INPATIENT\REQ_20150730-000027\carmelo velez_2015-07-31-11.55.41.593.tif
Request;20150730-000027;57622;DIRECT;Inpatient;DIRECT;C:\Users\FGuo\Documents\work doucment\attachment\attachmentDB\20161005\originalFileFromAerial\DOCSVC_20161003.tar\DOCSVC_20161003\DOCSVC_20161003\INPATIENT\REQ_20150730-000027\Velez, Carmelo - St. Luke's Roosevelt Clinical Review Request Form 7-30-15_2015-07-30-12.13.19.814.docx
Request;20150730-000037;88370;DIRECT;Inpatient;DIRECT;C:\Users\FGuo\Documents\work doucment\attachment\attachmentDB\20161005\originalFileFromAerial\DOCSVC_20161003.tar\DOCSVC_20161003\DOCSVC_20161003\INPATIENT\REQ_20150730-000037\frost,PRIPT_2015-08-12-16.29.06.184.tif
Request;20150730-000041;48405;PACE;Inpatient;PACE;C:\Users\FGuo\Documents\work doucment\attachment\attachmentDB\20161005\originalFileFromAerial\DOCSVC_20161003.tar\DOCSVC_20161003\DOCSVC_20161003\INPATIENT\REQ_20150730-000041\Olivia Tate UR 8-5-15_2015-08-05-11.27.44.522.tif
Request;20150730-000042;47324;PACE;Inpatient;PACE;C:\Users\FGuo\Documents\work doucment\attachment\attachmentDB\20161005\originalFileFromAerial\DOCSVC_20161003.tar\DOCSVC_20161003\DOCSVC_20161003\INPATIENT\REQ_20150730-000042\Hanley, Maryann - Portchester Nursing & Rehab Center  8.6.15_2015-08-06-12.59.32.979.docx
Request;20150730-000042;47324;PACE;Inpatient;PACE;C:\Users\FGuo\Documents\work doucment\attachment\attachmentDB\20161005\originalFileFromAerial\DOCSVC_20161003.tar\DOCSVC_20161003\DOCSVC_20161003\INPATIENT\REQ_20150730-000042\RJ Hanley, M 47324 7-30-15_2015-07-30-15.21.46.745.htm
Request;20150730-000043;49799;FIDA;Inpatient;FIDA;C:\Users\FGuo\Documents\work doucment\attachment\attachmentDB\20161005\originalFileFromAerial\DOCSVC_20161003.tar\DOCSVC_20161003\DOCSVC_20161003\INPATIENT\REQ_20150730-000043\Doris Fulmore Law Letter 7-30-15_2015-07-30-15.43.42.484.pdf
Request;20150730-000043;49799;FIDA;Inpatient;FIDA;C:\Users\FGuo\Documents\work doucment\attachment\attachmentDB\20161005\originalFileFromAerial\DOCSVC_20161003.tar\DOCSVC_20161003\DOCSVC_20161003\INPATIENT\REQ_20150730-000043\Doris Fulmore NH Hospice Note 7-30-15_2015-07-30-15.43.03.92.pdf
Request;20150730-000044;43092;FIDA;Inpatient;FIDA;C:\Users\FGuo\Documents\work doucment\attachment\attachmentDB\20161005\originalFileFromAerial\DOCSVC_20161003.tar\DOCSVC_20161003\DOCSVC_20161003\INPATIENT\REQ_20150730-000044\Ringle Sophie FIDA IP Denial Beth Israel Brooklyn 8-4-15_2015-08-04-13.22.01.928.docx
Request;20150730-000044;43092;FIDA;Inpatient;FIDA;C:\Users\FGuo\Documents\work doucment\attachment\attachmentDB\20161005\originalFileFromAerial\DOCSVC_20161003.tar\DOCSVC_20161003\DOCSVC_20161003\INPATIENT\REQ_20150730-000044\Ringle, Sophie ACK Letter_2015-10-01-16.05.54.743.docx
Request;20150730-000044;43092;FIDA;Inpatient;FIDA;C:\Users\FGuo\Documents\work doucment\attachment\attachmentDB\20161005\originalFileFromAerial\DOCSVC_20161003.tar\DOCSVC_20161003\DOCSVC_20161003\INPATIENT\REQ_20150730-000044\Ringle, Sophie ACK Letter_2015-10-23-12.25.40.131.docx
Request;20150730-000044;43092;FIDA;Inpatient;FIDA;C:\Users\FGuo\Documents\work doucment\attachment\attachmentDB\20161005\originalFileFromAerial\DOCSVC_20161003.tar\DOCSVC_20161003\DOCSVC_20161003\INPATIENT\REQ_20150730-000044\sophie ringle adm 7 24_2015-07-30-15.45.57.656.tif
Request;20150730-000044;43092;FIDA;Inpatient;FIDA;C:\Users\FGuo\Documents\work doucment\attachment\attachmentDB\20161005\originalFileFromAerial\DOCSVC_20161003.tar\DOCSVC_20161003\DOCSVC_20161003\INPATIENT\REQ_20150730-000044\SRingle 73115_2015-08-03-15.57.08.123.tif
Request;20150730-000051;32931;SELECT;Inpatient;SELECT;C:\Users\FGuo\Documents\work doucment\attachment\attachmentDB\20161005\originalFileFromAerial\DOCSVC_20161003.tar\DOCSVC_20161003\DOCSVC_20161003\INPATIENT\REQ_20150730-000051\CO PAY Ltr---Pisetskaya Ida_2015-07-31-09.05.03.854.doc
Request;20150731-000004;55100;DIRECT;Inpatient;DIRECT;C:\Users\FGuo\Documents\work doucment\attachment\attachmentDB\20161005\originalFileFromAerial\DOCSVC_20161003.tar\DOCSVC_20161003\DOCSVC_20161003\INPATIENT\REQ_20150731-000004\Santiago, Raphael 55100 CLINICAL REVIEW REQUEST FORM.doc 7 31 15_2015-07-31-10.06.21.668.doc
Request;20150731-000004;55100;DIRECT;Inpatient;DIRECT;C:\Users\FGuo\Documents\work doucment\attachment\attachmentDB\20161005\originalFileFromAerial\DOCSVC_20161003.tar\DOCSVC_20161003\DOCSVC_20161003\INPATIENT\REQ_20150731-000004\santiago,2_2015-08-05-10.24.24.345.tif
Request;20150731-000007;57902;PACE;Inpatient;PACE;C:\Users\FGuo\Documents\work doucment\attachment\attachmentDB\20161005\originalFileFromAerial\DOCSVC_20161003.tar\DOCSVC_20161003\DOCSVC_20161003\INPATIENT\REQ_20150731-000007\Goodyear, Helen 57902 CLINICAL REVIEW REQUEST FORM.doc 7 31 15_2015-07-31-10.02.01.786.doc
Request;20150731-000007;57902;PACE;Inpatient;PACE;C:\Users\FGuo\Documents\work doucment\attachment\attachmentDB\20161005\originalFileFromAerial\DOCSVC_20161003.tar\DOCSVC_20161003\DOCSVC_20161003\INPATIENT\REQ_20150731-000007\goodyear,helen_2015-08-05-09.34.33.529.tif
Request;20150731-000007;57902;PACE;Inpatient;PACE;C:\Users\FGuo\Documents\work doucment\attachment\attachmentDB\20161005\originalFileFromAerial\DOCSVC_20161003.tar\DOCSVC_20161003\DOCSVC_20161003\INPATIENT\REQ_20150731-000007\goodyear-PRI_2015-08-05-09.34.58.668.tif
Request;20150731-000010;87070;PACE;Inpatient;PACE;C:\Users\FGuo\Documents\work doucment\attachment\attachmentDB\20161005\originalFileFromAerial\DOCSVC_20161003.tar\DOCSVC_20161003\DOCSVC_20161003\INPATIENT\REQ_20150731-000010\Mills, robert f  87070 7 31 CLINICAL REVIEW REQUEST FORM_2015-07-31-10.33.03.762.doc
Request;20150731-000010;87070;PACE;Inpatient;PACE;C:\Users\FGuo\Documents\work doucment\attachment\attachmentDB\20161005\originalFileFromAerial\DOCSVC_20161003.tar\DOCSVC_20161003\DOCSVC_20161003\INPATIENT\REQ_20150731-000010\mills,robert_2015-07-31-16.31.54.215.tif
Request;20150731-000014;49067;PACE;Inpatient;PACE;C:\Users\FGuo\Documents\work doucment\attachment\attachmentDB\20161005\originalFileFromAerial\DOCSVC_20161003.tar\DOCSVC_20161003\DOCSVC_20161003\INPATIENT\REQ_20150731-000014\AViaud_2015-08-04-13.01.58.897.tif
Request;20150731-000014;49067;PACE;Inpatient;PACE;C:\Users\FGuo\Documents\work doucment\attachment\attachmentDB\20161005\originalFileFromAerial\DOCSVC_20161003.tar\DOCSVC_20161003\DOCSVC_20161003\INPATIENT\REQ_20150731-000014\Viaud, Annalia 49067 7 CLINICAL REVIEW REQUEST FORM.doc 7 31 15_2015-07-31-11.27.27.683.doc
Request;20150731-000014;49067;PACE;Inpatient;PACE;C:\Users\FGuo\Documents\work doucment\attachment\attachmentDB\20161005\originalFileFromAerial\DOCSVC_20161003.tar\DOCSVC_20161003\DOCSVC_20161003\INPATIENT\REQ_20150731-000014\Viaud, Annalia Medical Record_2016-01-27-11.21.01.482.pdf
Request;20150731-000015;20995;null;Inpatient;SELECT;C:\Users\FGuo\Documents\work doucment\attachment\attachmentDB\20161005\originalFileFromAerial\DOCSVC_20161003.tar\DOCSVC_20161003\DOCSVC_20161003\INPATIENT\REQ_20150731-000015\20995 NEIBURG, CLAIRE ADMIT_2015-07-31-11.43.22.162.tif
Request;20150731-000015;20995;null;Inpatient;SELECT;C:\Users\FGuo\Documents\work doucment\attachment\attachmentDB\20161005\originalFileFromAerial\DOCSVC_20161003.tar\DOCSVC_20161003\DOCSVC_20161003\INPATIENT\REQ_20150731-000015\CNeiburg_2015-08-03-16.54.52.471.tif
Request;20150731-000023;38752;PACE;Inpatient;PACE;C:\Users\FGuo\Documents\work doucment\attachment\attachmentDB\20161005\originalFileFromAerial\DOCSVC_20161003.tar\DOCSVC_20161003\DOCSVC_20161003\INPATIENT\REQ_20150731-000023\Stewart, Violet - Waterview Care Center  7.31.15_2015-07-31-16.35.55.784.docx
Request;20150731-000023;38752;PACE;Inpatient;PACE;C:\Users\FGuo\Documents\work doucment\attachment\attachmentDB\20161005\originalFileFromAerial\DOCSVC_20161003.tar\DOCSVC_20161003\DOCSVC_20161003\INPATIENT\REQ_20150731-000023\Violet Stewart PRI 7-31-15_2015-07-31-13.28.41.243.tif
Request;20150731-000029;24585;PACE;Inpatient;PACE;C:\Users\FGuo\Documents\work doucment\attachment\attachmentDB\20161005\originalFileFromAerial\DOCSVC_20161003.tar\DOCSVC_20161003\DOCSVC_20161003\INPATIENT\REQ_20150731-000029\woods denise clinicals_2015-07-31-14.12.37.769.tif
Request;20150731-000029;24585;PACE;Inpatient;PACE;C:\Users\FGuo\Documents\work doucment\attachment\attachmentDB\20161005\originalFileFromAerial\DOCSVC_20161003.tar\DOCSVC_20161003\DOCSVC_20161003\INPATIENT\REQ_20150731-000029\Woods, Denise  CLINICAL REVIEW REQUEST FORM.doc 7 31 15_2015-07-31-14.17.24.649.doc
Request;20150731-000032;87712;PACE;Inpatient;PACE;C:\Users\FGuo\Documents\work doucment\attachment\attachmentDB\20161005\originalFileFromAerial\DOCSVC_20161003.tar\DOCSVC_20161003\DOCSVC_20161003\INPATIENT\REQ_20150731-000032\87712 RODRIGUEZ, LUZ ADMIT_2015-07-31-15.06.59.276.tif
Request;20150731-000032;87712;PACE;Inpatient;PACE;C:\Users\FGuo\Documents\work doucment\attachment\attachmentDB\20161005\originalFileFromAerial\DOCSVC_20161003.tar\DOCSVC_20161003\DOCSVC_20161003\INPATIENT\REQ_20150731-000032\Luz Rodriguez UR 8-17-15_2015-08-17-11.41.38.690.tif
Request;20150731-000032;87712;PACE;Inpatient;PACE;C:\Users\FGuo\Documents\work doucment\attachment\attachmentDB\20161005\originalFileFromAerial\DOCSVC_20161003.tar\DOCSVC_20161003\DOCSVC_20161003\INPATIENT\REQ_20150731-000032\Luz Rodriguez UR 8-5-15_2015-08-05-16.09.43.122.tif
Request;20150731-000037;57048;DIRECT;Inpatient;DIRECT;C:\Users\FGuo\Documents\work doucment\attachment\attachmentDB\20161005\originalFileFromAerial\DOCSVC_20161003.tar\DOCSVC_20161003\DOCSVC_20161003\INPATIENT\REQ_20150731-000037\JWarren PRI_2015-08-03-13.00.11.972.tif
Request;20150731-000037;57048;DIRECT;Inpatient;DIRECT;C:\Users\FGuo\Documents\work doucment\attachment\attachmentDB\20161005\originalFileFromAerial\DOCSVC_20161003.tar\DOCSVC_20161003\DOCSVC_20161003\INPATIENT\REQ_20150731-000037\JWarren_2015-08-03-12.47.20.202.tif
Request;20150731-000038;51223;PACE;Inpatient;PACE;C:\Users\FGuo\Documents\work doucment\attachment\attachmentDB\20161005\originalFileFromAerial\DOCSVC_20161003.tar\DOCSVC_20161003\DOCSVC_20161003\INPATIENT\REQ_20150731-000038\Durosier, Louis J_2015-07-31-15.49.35.57.tif
Request;20150731-000038;51223;PACE;Inpatient;PACE;C:\Users\FGuo\Documents\work doucment\attachment\attachmentDB\20161005\originalFileFromAerial\DOCSVC_20161003.tar\DOCSVC_20161003\DOCSVC_20161003\INPATIENT\REQ_20150731-000038\LDurosier dc_2015-08-13-12.57.15.78.tif
Request;20150731-000040;56537;PACE;Inpatient;PACE;C:\Users\FGuo\Documents\work doucment\attachment\attachmentDB\20161005\originalFileFromAerial\DOCSVC_20161003.tar\DOCSVC_20161003\DOCSVC_20161003\INPATIENT\REQ_20150731-000040\Agman, Yoheved(2nd Document)- New Vanderbilt Rehab & Care Center  8.4.15_2015-08-04-12.04.17.484.docx
Request;20150731-000043;72352;null;Inpatient;SELECT;C:\Users\FGuo\Documents\work doucment\attachment\attachmentDB\20161005\originalFileFromAerial\DOCSVC_20161003.tar\DOCSVC_20161003\DOCSVC_20161003\INPATIENT\REQ_20150731-000043\Qi Hong Yuan NH Notes 9-10-15_2015-09-14-12.16.22.539.tif
Request;20150731-000043;72352;null;Inpatient;SELECT;C:\Users\FGuo\Documents\work doucment\attachment\attachmentDB\20161005\originalFileFromAerial\DOCSVC_20161003.tar\DOCSVC_20161003\DOCSVC_20161003\INPATIENT\REQ_20150731-000043\Qi Hong Yuan NH Notes 9-14-15_2015-09-15-08.59.10.506.tif
Request;20150731-000043;72352;null;Inpatient;SELECT;C:\Users\FGuo\Documents\work doucment\attachment\attachmentDB\20161005\originalFileFromAerial\DOCSVC_20161003.tar\DOCSVC_20161003\DOCSVC_20161003\INPATIENT\REQ_20150731-000043\Qi Hong Yuan_2015-07-31-16.22.43.470.tif
Request;20150731-000043;72352;null;Inpatient;SELECT;C:\Users\FGuo\Documents\work doucment\attachment\attachmentDB\20161005\originalFileFromAerial\DOCSVC_20161003.tar\DOCSVC_20161003\DOCSVC_20161003\INPATIENT\REQ_20150731-000043\yuan  qi hong12_2015-10-12-12.32.54.880.tif
Request;20150731-000043;72352;null;Inpatient;SELECT;C:\Users\FGuo\Documents\work doucment\attachment\attachmentDB\20161005\originalFileFromAerial\DOCSVC_20161003.tar\DOCSVC_20161003\DOCSVC_20161003\INPATIENT\REQ_20150731-000043\yuan qi hong5_2015-10-07-12.38.34.25.tif
Request;20150731-000043;72352;null;Inpatient;SELECT;C:\Users\FGuo\Documents\work doucment\attachment\attachmentDB\20161005\originalFileFromAerial\DOCSVC_20161003.tar\DOCSVC_20161003\DOCSVC_20161003\INPATIENT\REQ_20150731-000043\yuan qi hong_2015-08-21-17.31.50.447.tif
Request;20150731-000043;72352;null;Inpatient;SELECT;C:\Users\FGuo\Documents\work doucment\attachment\attachmentDB\20161005\originalFileFromAerial\DOCSVC_20161003.tar\DOCSVC_20161003\DOCSVC_20161003\INPATIENT\REQ_20150731-000043\yuan qi hong_2015-10-30-11.17.01.453.tif
Request;20150731-000043;72352;null;Inpatient;SELECT;C:\Users\FGuo\Documents\work doucment\attachment\attachmentDB\20161005\originalFileFromAerial\DOCSVC_20161003.tar\DOCSVC_20161003\DOCSVC_20161003\INPATIENT\REQ_20150731-000043\Yuan, Qi Hong - Flushing Manor Nursing Home & Rehab Center  8.4.15_2015-08-04-13.03.56.131.docx
Request;20150731-000043;72352;null;Inpatient;SELECT;C:\Users\FGuo\Documents\work doucment\attachment\attachmentDB\20161005\originalFileFromAerial\DOCSVC_20161003.tar\DOCSVC_20161003\DOCSVC_20161003\INPATIENT\REQ_20150731-000043\Yuan, Qi Hong 72352  COPAY------  FAX NOTIFICATION OF SNF COPAY NEllman_2015-09-15-10.26.43.87.doc
Request;20150731-000045;43092;FIDA;Inpatient;FIDA;C:\Users\FGuo\Documents\work doucment\attachment\attachmentDB\20161005\originalFileFromAerial\DOCSVC_20161003.tar\DOCSVC_20161003\DOCSVC_20161003\INPATIENT\REQ_20150731-000045\43092-SR_2016-05-17-15.30.00.30.pdf
Request;20150731-000045;43092;FIDA;Inpatient;FIDA;C:\Users\FGuo\Documents\work doucment\attachment\attachmentDB\20161005\originalFileFromAerial\DOCSVC_20161003.tar\DOCSVC_20161003\DOCSVC_20161003\INPATIENT\REQ_20150731-000045\Ringle, Sophie - Hyam Salomon Home for the Aged - 8-4-15_2015-08-04-10.17.21.836.docx
Request;20150731-000045;43092;FIDA;Inpatient;FIDA;C:\Users\FGuo\Documents\work doucment\attachment\attachmentDB\20161005\originalFileFromAerial\DOCSVC_20161003.tar\DOCSVC_20161003\DOCSVC_20161003\INPATIENT\REQ_20150731-000045\SRingle PRI_2015-07-31-16.23.36.565.tif
Request;20150731-000047;21805;PACE;Inpatient;PACE;C:\Users\FGuo\Documents\work doucment\attachment\attachmentDB\20161005\originalFileFromAerial\DOCSVC_20161003.tar\DOCSVC_20161003\DOCSVC_20161003\INPATIENT\REQ_20150731-000047\mary ruff_2015-08-06-16.44.04.148.tif
Request;20150731-000047;21805;PACE;Inpatient;PACE;C:\Users\FGuo\Documents\work doucment\attachment\attachmentDB\20161005\originalFileFromAerial\DOCSVC_20161003.tar\DOCSVC_20161003\DOCSVC_20161003\INPATIENT\REQ_20150731-000047\Ruff, Mary(Respite) -Atlantis Rehab & RHCF  8.7.15_2015-08-07-09.53.40.919.docx
Request;20150803-000003;77621;PACE;Inpatient;PACE;C:\Users\FGuo\Documents\work doucment\attachment\attachmentDB\20161005\originalFileFromAerial\DOCSVC_20161003.tar\DOCSVC_20161003\DOCSVC_20161003\INPATIENT\REQ_20150803-000003\Decoteau, Elizabeth -Montefiore Mount Vernon Hosp-Clinical Review Request Form 8-3-15_2015-08-03-09.51.59.803.docx
Request;20150803-000007;57902;PACE;Inpatient;PACE;C:\Users\FGuo\Documents\work doucment\attachment\attachmentDB\20161005\originalFileFromAerial\DOCSVC_20161003.tar\DOCSVC_20161003\DOCSVC_20161003\INPATIENT\REQ_20150803-000007\goodyear helen_2015-08-12-19.15.54.928.tif
Request;20150803-000007;57902;PACE;Inpatient;PACE;C:\Users\FGuo\Documents\work doucment\attachment\attachmentDB\20161005\originalFileFromAerial\DOCSVC_20161003.tar\DOCSVC_20161003\DOCSVC_20161003\INPATIENT\REQ_20150803-000007\goodyear-PRI_2015-08-12-16.24.15.846.tif
Request;20150803-000007;57902;PACE;Inpatient;PACE;C:\Users\FGuo\Documents\work doucment\attachment\attachmentDB\20161005\originalFileFromAerial\DOCSVC_20161003.tar\DOCSVC_20161003\DOCSVC_20161003\INPATIENT\REQ_20150803-000007\helen goodyear_2015-09-15-12.41.13.80.tif
Request;20150803-000013;74721;PACE;Inpatient;PACE;C:\Users\FGuo\Documents\work doucment\attachment\attachmentDB\20161005\originalFileFromAerial\DOCSVC_20161003.tar\DOCSVC_20161003\DOCSVC_20161003\INPATIENT\REQ_20150803-000013\Asif Farida IP Denial Lawrence Hospital 8-5-15_2015-08-07-16.16.07.638.docx
Request;20150803-000013;74721;PACE;Inpatient;PACE;C:\Users\FGuo\Documents\work doucment\attachment\attachmentDB\20161005\originalFileFromAerial\DOCSVC_20161003.tar\DOCSVC_20161003\DOCSVC_20161003\INPATIENT\REQ_20150803-000013\Lin Ru Yi IP Denial Coney Island  Hospital 8-7-15_2015-11-19-15.00.36.383.docx
Request;20150803-000013;74721;PACE;Inpatient;PACE;C:\Users\FGuo\Documents\work doucment\attachment\attachmentDB\20161005\originalFileFromAerial\DOCSVC_20161003.tar\DOCSVC_20161003\DOCSVC_20161003\INPATIENT\REQ_20150803-000013\Lin, RU Yi 74721 CLINICAL REVIEW REQUEST FORM.doc 8 3 15_2015-08-03-12.11.29.740.doc
Request;20150803-000013;74721;PACE;Inpatient;PACE;C:\Users\FGuo\Documents\work doucment\attachment\attachmentDB\20161005\originalFileFromAerial\DOCSVC_20161003.tar\DOCSVC_20161003\DOCSVC_20161003\INPATIENT\REQ_20150803-000013\Ru Lin UR 8-6-15_2015-08-07-07.41.24.394.tif
Request;20150803-000013;74721;PACE;Inpatient;PACE;C:\Users\FGuo\Documents\work doucment\attachment\attachmentDB\20161005\originalFileFromAerial\DOCSVC_20161003.tar\DOCSVC_20161003\DOCSVC_20161003\INPATIENT\REQ_20150803-000013\RYLin 8415_2015-08-04-16.16.45.591.tif
Request;20150803-000022;51229;PACE;Inpatient;PACE;C:\Users\FGuo\Documents\work doucment\attachment\attachmentDB\20161005\originalFileFromAerial\DOCSVC_20161003.tar\DOCSVC_20161003\DOCSVC_20161003\INPATIENT\REQ_20150803-000022\Dhanbasea, Lall Appeal ACK Letter_2015-10-19-10.38.00.916.docx
Request;20150803-000022;51229;PACE;Inpatient;PACE;C:\Users\FGuo\Documents\work doucment\attachment\attachmentDB\20161005\originalFileFromAerial\DOCSVC_20161003.tar\DOCSVC_20161003\DOCSVC_20161003\INPATIENT\REQ_20150803-000022\Dhanbasea, Lall MR1_2015-10-19-10.39.45.420.pdf
Request;20150803-000022;51229;PACE;Inpatient;PACE;C:\Users\FGuo\Documents\work doucment\attachment\attachmentDB\20161005\originalFileFromAerial\DOCSVC_20161003.tar\DOCSVC_20161003\DOCSVC_20161003\INPATIENT\REQ_20150803-000022\Dhanbasea, Lall MR_2015-10-19-10.38.59.8.pdf
Request;20150803-000022;51229;PACE;Inpatient;PACE;C:\Users\FGuo\Documents\work doucment\attachment\attachmentDB\20161005\originalFileFromAerial\DOCSVC_20161003.tar\DOCSVC_20161003\DOCSVC_20161003\INPATIENT\REQ_20150803-000022\Lall Dhanbasea IP Denial Jamaica Hospital Center 8-6-15_2015-08-06-11.59.38.562.docx
Request;20150803-000022;51229;PACE;Inpatient;PACE;C:\Users\FGuo\Documents\work doucment\attachment\attachmentDB\20161005\originalFileFromAerial\DOCSVC_20161003.tar\DOCSVC_20161003\DOCSVC_20161003\INPATIENT\REQ_20150803-000022\LALL, DHANBASEA - UR_2015-08-03-14.27.11.111.tif
Request;20150803-000023;87904;SELECT;Inpatient;SELECT;C:\Users\FGuo\Documents\work doucment\attachment\attachmentDB\20161005\originalFileFromAerial\DOCSVC_20161003.tar\DOCSVC_20161003\DOCSVC_20161003\INPATIENT\REQ_20150803-000023\rossi,g_2015-10-01-08.06.06.149.tif
Request;20150803-000029;56642;SELECT;Inpatient;SELECT;C:\Users\FGuo\Documents\work doucment\attachment\attachmentDB\20161005\originalFileFromAerial\DOCSVC_20161003.tar\DOCSVC_20161003\DOCSVC_20161003\INPATIENT\REQ_20150803-000029\Alexandria Rodriguez NH notes 8-3-15_2015-08-03-15.17.39.740.tif
Request;20150803-000029;56642;SELECT;Inpatient;SELECT;C:\Users\FGuo\Documents\work doucment\attachment\attachmentDB\20161005\originalFileFromAerial\DOCSVC_20161003.tar\DOCSVC_20161003\DOCSVC_20161003\INPATIENT\REQ_20150803-000029\Rodriguez, Alexandria - Clove Lake Health Care Rehab Center  8.4.15_2015-08-04-11.04.46.671.docx
Request;20150803-000032;26166;PACE;Inpatient;PACE;C:\Users\FGuo\Documents\work doucment\attachment\attachmentDB\20161005\originalFileFromAerial\DOCSVC_20161003.tar\DOCSVC_20161003\DOCSVC_20161003\INPATIENT\REQ_20150803-000032\Akber Shahnaz IP Denial North Shore University Manhasset 8-12-15_2015-08-12-16.42.05.311.docx
Request;20150803-000032;26166;PACE;Inpatient;PACE;C:\Users\FGuo\Documents\work doucment\attachment\attachmentDB\20161005\originalFileFromAerial\DOCSVC_20161003.tar\DOCSVC_20161003\DOCSVC_20161003\INPATIENT\REQ_20150803-000032\Akber, Shahnaz Appeal Ack letter_2015-09-10-11.49.40.931.docx
Request;20150803-000032;26166;PACE;Inpatient;PACE;C:\Users\FGuo\Documents\work doucment\attachment\attachmentDB\20161005\originalFileFromAerial\DOCSVC_20161003.tar\DOCSVC_20161003\DOCSVC_20161003\INPATIENT\REQ_20150803-000032\Akber, Shahnaz MR-1_2015-09-16-10.26.04.390.pdf
Request;20150803-000032;26166;PACE;Inpatient;PACE;C:\Users\FGuo\Documents\work doucment\attachment\attachmentDB\20161005\originalFileFromAerial\DOCSVC_20161003.tar\DOCSVC_20161003\DOCSVC_20161003\INPATIENT\REQ_20150803-000032\Akber, Shahnaz MR-2_2015-09-16-10.26.36.58.pdf
Request;20150803-000032;26166;PACE;Inpatient;PACE;C:\Users\FGuo\Documents\work doucment\attachment\attachmentDB\20161005\originalFileFromAerial\DOCSVC_20161003.tar\DOCSVC_20161003\DOCSVC_20161003\INPATIENT\REQ_20150803-000032\Akber, Shahnaz MR-3_2015-09-16-10.27.09.42.pdf
Request;20150803-000032;26166;PACE;Inpatient;PACE;C:\Users\FGuo\Documents\work doucment\attachment\attachmentDB\20161005\originalFileFromAerial\DOCSVC_20161003.tar\DOCSVC_20161003\DOCSVC_20161003\INPATIENT\REQ_20150803-000032\Akber, Shahnaz MR-4_2015-09-16-10.27.39.309.pdf
Request;20150803-000032;26166;PACE;Inpatient;PACE;C:\Users\FGuo\Documents\work doucment\attachment\attachmentDB\20161005\originalFileFromAerial\DOCSVC_20161003.tar\DOCSVC_20161003\DOCSVC_20161003\INPATIENT\REQ_20150803-000032\Shahnaz Akber UR 8-7-15_2015-08-07-12.01.49.245.tif
Request;20150803-000034;79603;PACE;Inpatient;PACE;C:\Users\FGuo\Documents\work doucment\attachment\attachmentDB\20161005\originalFileFromAerial\DOCSVC_20161003.tar\DOCSVC_20161003\DOCSVC_20161003\INPATIENT\REQ_20150803-000034\Medical Record_2015-11-23-11.11.52.807.pdf
Request;20150803-000034;79603;PACE;Inpatient;PACE;C:\Users\FGuo\Documents\work doucment\attachment\attachmentDB\20161005\originalFileFromAerial\DOCSVC_20161003.tar\DOCSVC_20161003\DOCSVC_20161003\INPATIENT\REQ_20150803-000034\Zhang Zi IP Denial NY Presbyterian 8-26-15_2015-08-26-16.50.23.499.docx
Request;20150803-000034;79603;PACE;Inpatient;PACE;C:\Users\FGuo\Documents\work doucment\attachment\attachmentDB\20161005\originalFileFromAerial\DOCSVC_20161003.tar\DOCSVC_20161003\DOCSVC_20161003\INPATIENT\REQ_20150803-000034\zhang zi_2015-08-11-18.20.24.141.tif
Request;20150803-000034;79603;PACE;Inpatient;PACE;C:\Users\FGuo\Documents\work doucment\attachment\attachmentDB\20161005\originalFileFromAerial\DOCSVC_20161003.tar\DOCSVC_20161003\DOCSVC_20161003\INPATIENT\REQ_20150803-000034\Zhang, Zi Q 79603 CLINICAL REVIEW REQUEST FORM.doc 8 3 15_2015-08-03-16.04.45.561.doc
Request;20150803-000034;79603;PACE;Inpatient;PACE;C:\Users\FGuo\Documents\work doucment\attachment\attachmentDB\20161005\originalFileFromAerial\DOCSVC_20161003.tar\DOCSVC_20161003\DOCSVC_20161003\INPATIENT\REQ_20150803-000034\_2015-08-11-18.27.22.577
Request;20150803-000036;86498;SELECT;Inpatient;SELECT;C:\Users\FGuo\Documents\work doucment\attachment\attachmentDB\20161005\originalFileFromAerial\DOCSVC_20161003.tar\DOCSVC_20161003\DOCSVC_20161003\INPATIENT\REQ_20150803-000036\Giaimo, Frances - Margaret Teitz Nursing & Rehab Center  8.4.15_2015-08-04-11.14.04.320.docx
Request;20150803-000037;42214;PACE;Inpatient;PACE;C:\Users\FGuo\Documents\work doucment\attachment\attachmentDB\20161005\originalFileFromAerial\DOCSVC_20161003.tar\DOCSVC_20161003\DOCSVC_20161003\INPATIENT\REQ_20150803-000037\davis sandra_2015-08-13-16.10.50.988.tif
Request;20150803-000040;73372;PACE;Inpatient;PACE;C:\Users\FGuo\Documents\work doucment\attachment\attachmentDB\20161005\originalFileFromAerial\DOCSVC_20161003.tar\DOCSVC_20161003\DOCSVC_20161003\INPATIENT\REQ_20150803-000040\73372 GOMEZ, FRANCISCA ADMISSION_2015-08-06-12.33.09.191.tif
Request;20150803-000040;73372;PACE;Inpatient;PACE;C:\Users\FGuo\Documents\work doucment\attachment\attachmentDB\20161005\originalFileFromAerial\DOCSVC_20161003.tar\DOCSVC_20161003\DOCSVC_20161003\INPATIENT\REQ_20150803-000040\FGomez_2015-08-03-17.18.24.562.tif
Request;20150804-000001;73999;null;Inpatient;PACE;C:\Users\FGuo\Documents\work doucment\attachment\attachmentDB\20161005\originalFileFromAerial\DOCSVC_20161003.tar\DOCSVC_20161003\DOCSVC_20161003\INPATIENT\REQ_20150804-000001\Maria Rodriguez_2015-08-05-20.34.37.470.tif
Request;20150804-000001;73999;null;Inpatient;PACE;C:\Users\FGuo\Documents\work doucment\attachment\attachmentDB\20161005\originalFileFromAerial\DOCSVC_20161003.tar\DOCSVC_20161003\DOCSVC_20161003\INPATIENT\REQ_20150804-000001\Rodriguez Maria IP Denial Brooklyn Hospital Center 8-12-15_2015-08-14-13.58.55.370.docx
Request;20150804-000001;73999;null;Inpatient;PACE;C:\Users\FGuo\Documents\work doucment\attachment\attachmentDB\20161005\originalFileFromAerial\DOCSVC_20161003.tar\DOCSVC_20161003\DOCSVC_20161003\INPATIENT\REQ_20150804-000001\Rodriguez Maria IP Denial Mt Sinai Hospital 2.4.2016_2016-02-04-10.44.19.552.pdf
Request;20150804-000004;35637;PACE;Inpatient;PACE;C:\Users\FGuo\Documents\work doucment\attachment\attachmentDB\20161005\originalFileFromAerial\DOCSVC_20161003.tar\DOCSVC_20161003\DOCSVC_20161003\INPATIENT\REQ_20150804-000004\Lopez-Rodriguez Ada IP Denial Montefiore Mt Vernon Hospital  8-11-15_2015-08-11-15.47.03.145.docx
Request;20150804-000004;35637;PACE;Inpatient;PACE;C:\Users\FGuo\Documents\work doucment\attachment\attachmentDB\20161005\originalFileFromAerial\DOCSVC_20161003.tar\DOCSVC_20161003\DOCSVC_20161003\INPATIENT\REQ_20150804-000004\Lopez-Rodriguez, Ada L 35637 CLINICAL REVIEW REQUEST FORM.doc 8 4 15_2015-08-04-09.43.10.312.doc
Request;20150804-000004;35637;PACE;Inpatient;PACE;C:\Users\FGuo\Documents\work doucment\attachment\attachmentDB\20161005\originalFileFromAerial\DOCSVC_20161003.tar\DOCSVC_20161003\DOCSVC_20161003\INPATIENT\REQ_20150804-000004\LopezRodriguez,A_2015-08-10-12.00.49.650.tif
Request;20150804-000004;35637;PACE;Inpatient;PACE;C:\Users\FGuo\Documents\work doucment\attachment\attachmentDB\20161005\originalFileFromAerial\DOCSVC_20161003.tar\DOCSVC_20161003\DOCSVC_20161003\INPATIENT\REQ_20150804-000004\LopezRodriguez,A_2015-08-10-15.29.24.297.tif
Request;20150804-000006;88204;PACE;Inpatient;PACE;C:\Users\FGuo\Documents\work doucment\attachment\attachmentDB\20161005\originalFileFromAerial\DOCSVC_20161003.tar\DOCSVC_20161003\DOCSVC_20161003\INPATIENT\REQ_20150804-000006\Whyte Merlene IP Denial Montefiore Mt Vernon Hospital  8-6-15_2015-08-06-12.23.36.43.docx
Request;20150804-000006;88204;PACE;Inpatient;PACE;C:\Users\FGuo\Documents\work doucment\attachment\attachmentDB\20161005\originalFileFromAerial\DOCSVC_20161003.tar\DOCSVC_20161003\DOCSVC_20161003\INPATIENT\REQ_20150804-000006\Whyte, Merlene 88204 CLINICAL REVIEW REQUEST FORM.doc 8 4 15_2015-08-04-09.35.39.278.doc
Request;20150804-000006;88204;PACE;Inpatient;PACE;C:\Users\FGuo\Documents\work doucment\attachment\attachmentDB\20161005\originalFileFromAerial\DOCSVC_20161003.tar\DOCSVC_20161003\DOCSVC_20161003\INPATIENT\REQ_20150804-000006\whyte,m_2015-08-05-14.19.20.516.tif
Request;20150804-000008;58300;DIRECT;Inpatient;DIRECT;C:\Users\FGuo\Documents\work doucment\attachment\attachmentDB\20161005\originalFileFromAerial\DOCSVC_20161003.tar\DOCSVC_20161003\DOCSVC_20161003\INPATIENT\REQ_20150804-000008\Alejandrin Vazquez UR 8-11-15_2015-08-11-14.52.51.508.tif
Request;20150804-000008;58300;DIRECT;Inpatient;DIRECT;C:\Users\FGuo\Documents\work doucment\attachment\attachmentDB\20161005\originalFileFromAerial\DOCSVC_20161003.tar\DOCSVC_20161003\DOCSVC_20161003\INPATIENT\REQ_20150804-000008\Vazquez, Alejandrin - Wyckoff Heights MC Clinical Review Request Form 8-4-15_2015-08-04-09.45.58.6.docx
Request;20150804-000014;84630;PACE;Inpatient;PACE;C:\Users\FGuo\Documents\work doucment\attachment\attachmentDB\20161005\originalFileFromAerial\DOCSVC_20161003.tar\DOCSVC_20161003\DOCSVC_20161003\INPATIENT\REQ_20150804-000014\levinson83_2015-08-06-10.50.37.672.tif
Request;20150804-000015;49799;FIDA;Inpatient;FIDA;C:\Users\FGuo\Documents\work doucment\attachment\attachmentDB\20161005\originalFileFromAerial\DOCSVC_20161003.tar\DOCSVC_20161003\DOCSVC_20161003\INPATIENT\REQ_20150804-000015\Fulmore, Doris(Custodial)- Margaret Nursing & Rehab Center  8.4.15_2015-08-04-11.26.38.123.docx
Request;20150804-000018;84630;PACE;Inpatient;PACE;C:\Users\FGuo\Documents\work doucment\attachment\attachmentDB\20161005\originalFileFromAerial\DOCSVC_20161003.tar\DOCSVC_20161003\DOCSVC_20161003\INPATIENT\REQ_20150804-000018\levinson,doris_2015-10-07-14.16.06.963.tif
Request;20150804-000019;36627;PACE;Inpatient;PACE;C:\Users\FGuo\Documents\work doucment\attachment\attachmentDB\20161005\originalFileFromAerial\DOCSVC_20161003.tar\DOCSVC_20161003\DOCSVC_20161003\INPATIENT\REQ_20150804-000019\guo,xu_2015-08-06-16.20.49.51.tif
Request;20150804-000023;46148;PACE;Inpatient;PACE;C:\Users\FGuo\Documents\work doucment\attachment\attachmentDB\20161005\originalFileFromAerial\DOCSVC_20161003.tar\DOCSVC_20161003\DOCSVC_20161003\INPATIENT\REQ_20150804-000023\Medical record _2015-11-23-12.00.28.327.pdf
Request;20150804-000023;46148;PACE;Inpatient;PACE;C:\Users\FGuo\Documents\work doucment\attachment\attachmentDB\20161005\originalFileFromAerial\DOCSVC_20161003.tar\DOCSVC_20161003\DOCSVC_20161003\INPATIENT\REQ_20150804-000023\PRA-1  Appeal Acknowledgement _2015-10-29-18.02.12.855.docx
Request;20150804-000023;46148;PACE;Inpatient;PACE;C:\Users\FGuo\Documents\work doucment\attachment\attachmentDB\20161005\originalFileFromAerial\DOCSVC_20161003.tar\DOCSVC_20161003\DOCSVC_20161003\INPATIENT\REQ_20150804-000023\PRA-2 Final Adverse Determination Appeal Unfavorable-Contracted Hospitals_2015-11-25-13.18.49.103.docx
Request;20150804-000023;46148;PACE;Inpatient;PACE;C:\Users\FGuo\Documents\work doucment\attachment\attachmentDB\20161005\originalFileFromAerial\DOCSVC_20161003.tar\DOCSVC_20161003\DOCSVC_20161003\INPATIENT\REQ_20150804-000023\Wallace Willie IP Denial Jamaica Hospital Center 8-6-15_2015-08-06-11.55.30.627.docx
Request;20150804-000023;46148;PACE;Inpatient;PACE;C:\Users\FGuo\Documents\work doucment\attachment\attachmentDB\20161005\originalFileFromAerial\DOCSVC_20161003.tar\DOCSVC_20161003\DOCSVC_20161003\INPATIENT\REQ_20150804-000023\Wallace Willie IP Denial Jamaica Hospital Center 8-6-15_2015-08-06-12.01.31.556.docx
Request;20150804-000023;46148;PACE;Inpatient;PACE;C:\Users\FGuo\Documents\work doucment\attachment\attachmentDB\20161005\originalFileFromAerial\DOCSVC_20161003.tar\DOCSVC_20161003\DOCSVC_20161003\INPATIENT\REQ_20150804-000023\wallace willie_2015-08-19-17.11.45.802.tif
Request;20150804-000023;46148;PACE;Inpatient;PACE;C:\Users\FGuo\Documents\work doucment\attachment\attachmentDB\20161005\originalFileFromAerial\DOCSVC_20161003.tar\DOCSVC_20161003\DOCSVC_20161003\INPATIENT\REQ_20150804-000023\WALLACE, WILLIE R -  UR_2015-08-04-10.37.33.883.tif
Request;20150804-000028;34600;PACE;Inpatient;PACE;C:\Users\FGuo\Documents\work doucment\attachment\attachmentDB\20161005\originalFileFromAerial\DOCSVC_20161003.tar\DOCSVC_20161003\DOCSVC_20161003\INPATIENT\REQ_20150804-000028\Anthony Lucev PRI 8-3-15_2015-08-04-10.58.41.58.tif
Request;20150804-000028;34600;PACE;Inpatient;PACE;C:\Users\FGuo\Documents\work doucment\attachment\attachmentDB\20161005\originalFileFromAerial\DOCSVC_20161003.tar\DOCSVC_20161003\DOCSVC_20161003\INPATIENT\REQ_20150804-000028\anthony lucev14_2015-08-14-10.01.09.808.tif
Request;20150804-000028;34600;PACE;Inpatient;PACE;C:\Users\FGuo\Documents\work doucment\attachment\attachmentDB\20161005\originalFileFromAerial\DOCSVC_20161003.tar\DOCSVC_20161003\DOCSVC_20161003\INPATIENT\REQ_20150804-000028\anthony lucev_2015-08-12-19.10.39.178.tif
Request;20150804-000028;34600;PACE;Inpatient;PACE;C:\Users\FGuo\Documents\work doucment\attachment\attachmentDB\20161005\originalFileFromAerial\DOCSVC_20161003.tar\DOCSVC_20161003\DOCSVC_20161003\INPATIENT\REQ_20150804-000028\Lucev, Anthony-  East Neck Nursing & Rehab Center  8.4.15_2015-08-04-11.44.58.19.docx
Request;20150804-000028;34600;PACE;Inpatient;PACE;C:\Users\FGuo\Documents\work doucment\attachment\attachmentDB\20161005\originalFileFromAerial\DOCSVC_20161003.tar\DOCSVC_20161003\DOCSVC_20161003\INPATIENT\REQ_20150804-000028\_2015-08-14-10.00.55.484
Request;20150804-000030;93477;PACE;Inpatient;PACE;C:\Users\FGuo\Documents\work doucment\attachment\attachmentDB\20161005\originalFileFromAerial\DOCSVC_20161003.tar\DOCSVC_20161003\DOCSVC_20161003\INPATIENT\REQ_20150804-000030\Quiterio Juana IP Denial Montefiore Medical Center 8-6-15_2015-08-06-12.29.23.254.docx
Request;20150804-000030;93477;PACE;Inpatient;PACE;C:\Users\FGuo\Documents\work doucment\attachment\attachmentDB\20161005\originalFileFromAerial\DOCSVC_20161003.tar\DOCSVC_20161003\DOCSVC_20161003\INPATIENT\REQ_20150804-000030\Quiterio, Juana Montefiore Med Cen-Moses-Clinical Review Request Form 8-4-15_2015-08-04-11.31.16.39.docx
Request;20150804-000030;93477;PACE;Inpatient;PACE;C:\Users\FGuo\Documents\work doucment\attachment\attachmentDB\20161005\originalFileFromAerial\DOCSVC_20161003.tar\DOCSVC_20161003\DOCSVC_20161003\INPATIENT\REQ_20150804-000030\Quiterio, Juana MR-1_2015-11-04-14.33.46.219.pdf
Request;20150804-000030;93477;PACE;Inpatient;PACE;C:\Users\FGuo\Documents\work doucment\attachment\attachmentDB\20161005\originalFileFromAerial\DOCSVC_20161003.tar\DOCSVC_20161003\DOCSVC_20161003\INPATIENT\REQ_20150804-000030\Quiterio, Juana MR-2_2015-11-04-14.34.05.131.pdf
Request;20150804-000030;93477;PACE;Inpatient;PACE;C:\Users\FGuo\Documents\work doucment\attachment\attachmentDB\20161005\originalFileFromAerial\DOCSVC_20161003.tar\DOCSVC_20161003\DOCSVC_20161003\INPATIENT\REQ_20150804-000030\Quiterio, Juana MR-3_2015-11-04-14.34.40.934.pdf
Request;20150804-000030;93477;PACE;Inpatient;PACE;C:\Users\FGuo\Documents\work doucment\attachment\attachmentDB\20161005\originalFileFromAerial\DOCSVC_20161003.tar\DOCSVC_20161003\DOCSVC_20161003\INPATIENT\REQ_20150804-000030\quiterio,DC_2015-08-11-11.14.38.592.tif
Request;20150804-000030;93477;PACE;Inpatient;PACE;C:\Users\FGuo\Documents\work doucment\attachment\attachmentDB\20161005\originalFileFromAerial\DOCSVC_20161003.tar\DOCSVC_20161003\DOCSVC_20161003\INPATIENT\REQ_20150804-000030\quiterio,juana_2015-08-05-11.54.00.763.tif
Request;20150804-000030;93477;PACE;Inpatient;PACE;C:\Users\FGuo\Documents\work doucment\attachment\attachmentDB\20161005\originalFileFromAerial\DOCSVC_20161003.tar\DOCSVC_20161003\DOCSVC_20161003\INPATIENT\REQ_20150804-000030\quiterio,juana_2015-08-05-12.51.45.761.tif
Request;20150804-000030;93477;PACE;Inpatient;PACE;C:\Users\FGuo\Documents\work doucment\attachment\attachmentDB\20161005\originalFileFromAerial\DOCSVC_20161003.tar\DOCSVC_20161003\DOCSVC_20161003\INPATIENT\REQ_20150804-000030\Quitero, Juana Appeal Ack Letter_2015-10-02-11.39.47.644.docx
Request;20150804-000031;23867;DIRECT;Inpatient;DIRECT;C:\Users\FGuo\Documents\work doucment\attachment\attachmentDB\20161005\originalFileFromAerial\DOCSVC_20161003.tar\DOCSVC_20161003\DOCSVC_20161003\INPATIENT\REQ_20150804-000031\Eloi Lennox DIRECT IP Denial Montefiore Medical Center 8-6-15_2015-08-06-12.34.02.256.docx
Request;20150804-000031;23867;DIRECT;Inpatient;DIRECT;C:\Users\FGuo\Documents\work doucment\attachment\attachmentDB\20161005\originalFileFromAerial\DOCSVC_20161003.tar\DOCSVC_20161003\DOCSVC_20161003\INPATIENT\REQ_20150804-000031\eloi,lennox_2015-08-05-13.39.54.332.tif
Request;20150804-000031;23867;DIRECT;Inpatient;DIRECT;C:\Users\FGuo\Documents\work doucment\attachment\attachmentDB\20161005\originalFileFromAerial\DOCSVC_20161003.tar\DOCSVC_20161003\DOCSVC_20161003\INPATIENT\REQ_20150804-000031\eloi-DCsummary_2015-08-05-13.48.54.93.tif
Request;20150804-000031;23867;DIRECT;Inpatient;DIRECT;C:\Users\FGuo\Documents\work doucment\attachment\attachmentDB\20161005\originalFileFromAerial\DOCSVC_20161003.tar\DOCSVC_20161003\DOCSVC_20161003\INPATIENT\REQ_20150804-000031\Medical Record_2015-11-17-11.13.33.895.pdf
Request;20150804-000031;23867;DIRECT;Inpatient;DIRECT;C:\Users\FGuo\Documents\work doucment\attachment\attachmentDB\20161005\originalFileFromAerial\DOCSVC_20161003.tar\DOCSVC_20161003\DOCSVC_20161003\INPATIENT\REQ_20150804-000031\PRA-1  Appeal Acknowledgement _2015-10-29-18.44.01.658.docx
Request;20150804-000031;23867;DIRECT;Inpatient;DIRECT;C:\Users\FGuo\Documents\work doucment\attachment\attachmentDB\20161005\originalFileFromAerial\DOCSVC_20161003.tar\DOCSVC_20161003\DOCSVC_20161003\INPATIENT\REQ_20150804-000031\PRA-2 Final Adverse Determination Appeal Unfavorable-Contracted Hospitals_2015-11-19-14.58.39.981.docx
Request;20150804-000033;88511;PACE;Inpatient;PACE;C:\Users\FGuo\Documents\work doucment\attachment\attachmentDB\20161005\originalFileFromAerial\DOCSVC_20161003.tar\DOCSVC_20161003\DOCSVC_20161003\INPATIENT\REQ_20150804-000033\hasangjeka-DC_2015-08-05-09.52.54.483.tif
Request;20150804-000033;88511;PACE;Inpatient;PACE;C:\Users\FGuo\Documents\work doucment\attachment\attachmentDB\20161005\originalFileFromAerial\DOCSVC_20161003.tar\DOCSVC_20161003\DOCSVC_20161003\INPATIENT\REQ_20150804-000033\Hasangjekaj Celja IP Denial Montefiore Medical Center 8-5-15_2015-08-06-13.56.12.464.docx
Request;20150804-000033;88511;PACE;Inpatient;PACE;C:\Users\FGuo\Documents\work doucment\attachment\attachmentDB\20161005\originalFileFromAerial\DOCSVC_20161003.tar\DOCSVC_20161003\DOCSVC_20161003\INPATIENT\REQ_20150804-000033\Hasangjekaj, Celja Appeal Ack Letter_2015-10-01-15.41.38.141.docx
Request;20150804-000033;88511;PACE;Inpatient;PACE;C:\Users\FGuo\Documents\work doucment\attachment\attachmentDB\20161005\originalFileFromAerial\DOCSVC_20161003.tar\DOCSVC_20161003\DOCSVC_20161003\INPATIENT\REQ_20150804-000033\Hasangjekaj, Celja Appeal Ack Letter_2015-10-01-15.43.43.180.docx
Request;20150804-000033;88511;PACE;Inpatient;PACE;C:\Users\FGuo\Documents\work doucment\attachment\attachmentDB\20161005\originalFileFromAerial\DOCSVC_20161003.tar\DOCSVC_20161003\DOCSVC_20161003\INPATIENT\REQ_20150804-000033\hasangjekaj,celja_2015-08-05-09.51.35.322.tif
Request;20150804-000033;88511;PACE;Inpatient;PACE;C:\Users\FGuo\Documents\work doucment\attachment\attachmentDB\20161005\originalFileFromAerial\DOCSVC_20161003.tar\DOCSVC_20161003\DOCSVC_20161003\INPATIENT\REQ_20150804-000033\Hasangjekal, Celja MR_2015-10-09-10.55.06.741.pdf
Request;20150804-000035;30902;PACE;Inpatient;PACE;C:\Users\FGuo\Documents\work doucment\attachment\attachmentDB\20161005\originalFileFromAerial\DOCSVC_20161003.tar\DOCSVC_20161003\DOCSVC_20161003\INPATIENT\REQ_20150804-000035\Otero, Julio - Beth Abraham Nursing Home  8.11.15_2015-08-11-14.51.23.618.docx
Request;20150804-000035;30902;PACE;Inpatient;PACE;C:\Users\FGuo\Documents\work doucment\attachment\attachmentDB\20161005\originalFileFromAerial\DOCSVC_20161003.tar\DOCSVC_20161003\DOCSVC_20161003\INPATIENT\REQ_20150804-000035\RJ Otero, J 30902 8-3-15_2015-08-04-13.36.52.959.tif
Request;20150804-000040;55324;PACE;Inpatient;PACE;C:\Users\FGuo\Documents\work doucment\attachment\attachmentDB\20161005\originalFileFromAerial\DOCSVC_20161003.tar\DOCSVC_20161003\DOCSVC_20161003\INPATIENT\REQ_20150804-000040\Mata, Roberto--Greenwich Hospital  Clinical Review Request Form 8-4-15_2015-08-04-12.08.49.174.docx
Request;20150804-000040;55324;PACE;Inpatient;PACE;C:\Users\FGuo\Documents\work doucment\attachment\attachmentDB\20161005\originalFileFromAerial\DOCSVC_20161003.tar\DOCSVC_20161003\DOCSVC_20161003\INPATIENT\REQ_20150804-000040\mata, roberto_2015-08-05-13.25.25.937.tif
Request;20150804-000040;55324;PACE;Inpatient;PACE;C:\Users\FGuo\Documents\work doucment\attachment\attachmentDB\20161005\originalFileFromAerial\DOCSVC_20161003.tar\DOCSVC_20161003\DOCSVC_20161003\INPATIENT\REQ_20150804-000040\mata,roberto811_2015-08-12-07.59.44.344.tif
Request;20150804-000040;55324;PACE;Inpatient;PACE;C:\Users\FGuo\Documents\work doucment\attachment\attachmentDB\20161005\originalFileFromAerial\DOCSVC_20161003.tar\DOCSVC_20161003\DOCSVC_20161003\INPATIENT\REQ_20150804-000040\mata814_2015-08-14-11.37.33.767.tif
Request;20150804-000040;55324;PACE;Inpatient;PACE;C:\Users\FGuo\Documents\work doucment\attachment\attachmentDB\20161005\originalFileFromAerial\DOCSVC_20161003.tar\DOCSVC_20161003\DOCSVC_20161003\INPATIENT\REQ_20150804-000040\RMata_2015-08-20-17.06.28.205.tif
Request;20150804-000055;72272;PACE;Inpatient;PACE;C:\Users\FGuo\Documents\work doucment\attachment\attachmentDB\20161005\originalFileFromAerial\DOCSVC_20161003.tar\DOCSVC_20161003\DOCSVC_20161003\INPATIENT\REQ_20150804-000055\Ip Kimtie IP Denial Beth Israel Petri 8-24-15_2015-08-24-16.42.08.555.docx
Request;20150804-000055;72272;PACE;Inpatient;PACE;C:\Users\FGuo\Documents\work doucment\attachment\attachmentDB\20161005\originalFileFromAerial\DOCSVC_20161003.tar\DOCSVC_20161003\DOCSVC_20161003\INPATIENT\REQ_20150804-000055\ip kimtie_2015-08-12-19.31.53.157.tif
Request;20150804-000055;72272;PACE;Inpatient;PACE;C:\Users\FGuo\Documents\work doucment\attachment\attachmentDB\20161005\originalFileFromAerial\DOCSVC_20161003.tar\DOCSVC_20161003\DOCSVC_20161003\INPATIENT\REQ_20150804-000055\Ip, Kimite adm_2015-08-04-15.24.36.880.tif
Request;20150804-000055;72272;PACE;Inpatient;PACE;C:\Users\FGuo\Documents\work doucment\attachment\attachmentDB\20161005\originalFileFromAerial\DOCSVC_20161003.tar\DOCSVC_20161003\DOCSVC_20161003\INPATIENT\REQ_20150804-000055\Ip, Kimite adm_2015-08-04-15.29.19.561.tif
Request;20150804-000055;72272;PACE;Inpatient;PACE;C:\Users\FGuo\Documents\work doucment\attachment\attachmentDB\20161005\originalFileFromAerial\DOCSVC_20161003.tar\DOCSVC_20161003\DOCSVC_20161003\INPATIENT\REQ_20150804-000055\PRA-1  Appeal Acknowledgement _2015-09-25-11.29.57.252.docx
Request;20150804-000055;72272;PACE;Inpatient;PACE;C:\Users\FGuo\Documents\work doucment\attachment\attachmentDB\20161005\originalFileFromAerial\DOCSVC_20161003.tar\DOCSVC_20161003\DOCSVC_20161003\INPATIENT\REQ_20150804-000055\PRA-2 Final Adverse Determination Appeal Unfavorable-Contracted Hospitals_2015-10-22-11.42.46.232.docx
Request;20150804-000062;57838;DIRECT;Inpatient;DIRECT;C:\Users\FGuo\Documents\work doucment\attachment\attachmentDB\20161005\originalFileFromAerial\DOCSVC_20161003.tar\DOCSVC_20161003\DOCSVC_20161003\INPATIENT\REQ_20150804-000062\MELTZER, ROSEBELL - UR_2015-08-04-16.06.21.252.tif
Request;20150804-000064;95125;PACE;Inpatient;PACE;C:\Users\FGuo\Documents\work doucment\attachment\attachmentDB\20161005\originalFileFromAerial\DOCSVC_20161003.tar\DOCSVC_20161003\DOCSVC_20161003\INPATIENT\REQ_20150804-000064\ZHANG, XI MEI - UR_2015-08-04-16.11.16.856.tif
Request;20150804-000068;32608;PACE;Inpatient;PACE;C:\Users\FGuo\Documents\work doucment\attachment\attachmentDB\20161005\originalFileFromAerial\DOCSVC_20161003.tar\DOCSVC_20161003\DOCSVC_20161003\INPATIENT\REQ_20150804-000068\Fresa Marte  32608 CLINICAL REVIEW REQUEST FORM.doc 8 4 15_2015-08-04-16.48.44.221.doc
Request;20150804-000068;32608;PACE;Inpatient;PACE;C:\Users\FGuo\Documents\work doucment\attachment\attachmentDB\20161005\originalFileFromAerial\DOCSVC_20161003.tar\DOCSVC_20161003\DOCSVC_20161003\INPATIENT\REQ_20150804-000068\Fresa marte clinicals 8 1_2015-08-04-16.42.14.956.tif
Request;20150804-000068;32608;PACE;Inpatient;PACE;C:\Users\FGuo\Documents\work doucment\attachment\attachmentDB\20161005\originalFileFromAerial\DOCSVC_20161003.tar\DOCSVC_20161003\DOCSVC_20161003\INPATIENT\REQ_20150804-000068\Marte Fresa IP Denial NY Presbyterian 8-6-15_2015-08-06-13.41.52.196.docx
Request;20150804-000068;32608;PACE;Inpatient;PACE;C:\Users\FGuo\Documents\work doucment\attachment\attachmentDB\20161005\originalFileFromAerial\DOCSVC_20161003.tar\DOCSVC_20161003\DOCSVC_20161003\INPATIENT\REQ_20150804-000068\Medical Record_2015-12-10-11.39.46.138.pdf
Request;20150804-000068;32608;PACE;Inpatient;PACE;C:\Users\FGuo\Documents\work doucment\attachment\attachmentDB\20161005\originalFileFromAerial\DOCSVC_20161003.tar\DOCSVC_20161003\DOCSVC_20161003\INPATIENT\REQ_20150804-000068\PACE Final Adverse Determination- Appeal  Unfavorable Non-Contracted Hospitals_2016-01-04-15.54.04.565.docx
Request;20150804-000068;32608;PACE;Inpatient;PACE;C:\Users\FGuo\Documents\work doucment\attachment\attachmentDB\20161005\originalFileFromAerial\DOCSVC_20161003.tar\DOCSVC_20161003\DOCSVC_20161003\INPATIENT\REQ_20150804-000068\PRA-1  Appeal Acknowledgement _2015-09-30-10.46.43.431.docx
Request;20150805-000003;46139;PACE;Inpatient;PACE;C:\Users\FGuo\Documents\work doucment\attachment\attachmentDB\20161005\originalFileFromAerial\DOCSVC_20161003.tar\DOCSVC_20161003\DOCSVC_20161003\INPATIENT\REQ_20150805-000003\cummings,mabel_2015-08-06-09.52.15.614.tif
Request;20150805-000004;85332;PACE;Inpatient;PACE;C:\Users\FGuo\Documents\work doucment\attachment\attachmentDB\20161005\originalFileFromAerial\DOCSVC_20161003.tar\DOCSVC_20161003\DOCSVC_20161003\INPATIENT\REQ_20150805-000004\Herring Hazel PACE IP Denial Jacobi Medical Center  8-11-15_2015-08-11-16.20.42.177.docx
Request;20150805-000004;85332;PACE;Inpatient;PACE;C:\Users\FGuo\Documents\work doucment\attachment\attachmentDB\20161005\originalFileFromAerial\DOCSVC_20161003.tar\DOCSVC_20161003\DOCSVC_20161003\INPATIENT\REQ_20150805-000004\Herring, Hazel- Jacobi Medical Center Clinical Review Request 8-5-15_2015-08-05-08.23.25.660.docx
Request;20150805-000004;85332;PACE;Inpatient;PACE;C:\Users\FGuo\Documents\work doucment\attachment\attachmentDB\20161005\originalFileFromAerial\DOCSVC_20161003.tar\DOCSVC_20161003\DOCSVC_20161003\INPATIENT\REQ_20150805-000004\herring_2015-08-06-09.47.00.759.tif
Request;20150805-000005;20611;PACE;Inpatient;SELECT;C:\Users\FGuo\Documents\work doucment\attachment\attachmentDB\20161005\originalFileFromAerial\DOCSVC_20161003.tar\DOCSVC_20161003\DOCSVC_20161003\INPATIENT\REQ_20150805-000005\Spence Mavis PACE IP Denial Jacobi Medical Center  9-30-15_2015-09-30-12.29.02.66.docx
Request;20150805-000005;20611;PACE;Inpatient;SELECT;C:\Users\FGuo\Documents\work doucment\attachment\attachmentDB\20161005\originalFileFromAerial\DOCSVC_20161003.tar\DOCSVC_20161003\DOCSVC_20161003\INPATIENT\REQ_20150805-000005\Spence, Mavis - Jacobi Medical Center Clinical Review Request 8-5-15_2015-08-05-08.32.48.541.docx
Request;20150805-000005;20611;PACE;Inpatient;SELECT;C:\Users\FGuo\Documents\work doucment\attachment\attachmentDB\20161005\originalFileFromAerial\DOCSVC_20161003.tar\DOCSVC_20161003\DOCSVC_20161003\INPATIENT\REQ_20150805-000005\spence,mavis_2015-08-06-09.33.25.407.tif
Request;20150805-000006;90838;PACE;Inpatient;PACE;C:\Users\FGuo\Documents\work doucment\attachment\attachmentDB\20161005\originalFileFromAerial\DOCSVC_20161003.tar\DOCSVC_20161003\DOCSVC_20161003\INPATIENT\REQ_20150805-000006\Mckinley, Hilbert - Montefiore Med Cen-Moses-Clinical Review Request Form 8-5-15_2015-08-05-08.41.16.943.docx
Request;20150805-000006;90838;PACE;Inpatient;PACE;C:\Users\FGuo\Documents\work doucment\attachment\attachmentDB\20161005\originalFileFromAerial\DOCSVC_20161003.tar\DOCSVC_20161003\DOCSVC_20161003\INPATIENT\REQ_20150805-000006\mckinley_2015-08-06-10.25.47.859.tif
Request;20150805-000007;85728;PACE;Inpatient;PACE;C:\Users\FGuo\Documents\work doucment\attachment\attachmentDB\20161005\originalFileFromAerial\DOCSVC_20161003.tar\DOCSVC_20161003\DOCSVC_20161003\INPATIENT\REQ_20150805-000007\ortiz,edith_2015-08-12-13.25.44.673.tif
Request;20150805-000007;85728;PACE;Inpatient;PACE;C:\Users\FGuo\Documents\work doucment\attachment\attachmentDB\20161005\originalFileFromAerial\DOCSVC_20161003.tar\DOCSVC_20161003\DOCSVC_20161003\INPATIENT\REQ_20150805-000007\RJ Ortiz, E  85728 8-4-15_2015-08-05-08.46.23.712.tif
Request;20150805-000009;58397;PACE;Inpatient;PACE;C:\Users\FGuo\Documents\work doucment\attachment\attachmentDB\20161005\originalFileFromAerial\DOCSVC_20161003.tar\DOCSVC_20161003\DOCSVC_20161003\INPATIENT\REQ_20150805-000009\marrero,luis_2015-08-05-14.50.51.778.tif
Request;20150805-000010;36328;PACE;Inpatient;PACE;C:\Users\FGuo\Documents\work doucment\attachment\attachmentDB\20161005\originalFileFromAerial\DOCSVC_20161003.tar\DOCSVC_20161003\DOCSVC_20161003\INPATIENT\REQ_20150805-000010\Miller, Hazel--Montefiore New Rochelle -Clinical Review Request Form 8-5-15_2015-08-05-09.13.24.775.docx
Request;20150805-000010;36328;PACE;Inpatient;PACE;C:\Users\FGuo\Documents\work doucment\attachment\attachmentDB\20161005\originalFileFromAerial\DOCSVC_20161003.tar\DOCSVC_20161003\DOCSVC_20161003\INPATIENT\REQ_20150805-000010\miller,hazel_2015-08-10-16.02.26.344.tif
Request;20150805-000011;40365;PACE;Inpatient;PACE;C:\Users\FGuo\Documents\work doucment\attachment\attachmentDB\20161005\originalFileFromAerial\DOCSVC_20161003.tar\DOCSVC_20161003\DOCSVC_20161003\INPATIENT\REQ_20150805-000011\Ahmed Sultan IP Denial Good Samaritan Hispital 8-7-15docx_2015-08-07-13.17.52.237.docx
Request;20150805-000011;40365;PACE;Inpatient;PACE;C:\Users\FGuo\Documents\work doucment\attachment\attachmentDB\20161005\originalFileFromAerial\DOCSVC_20161003.tar\DOCSVC_20161003\DOCSVC_20161003\INPATIENT\REQ_20150805-000011\Ahmed Sultan IP Denial Good Samaritan Hispital 8-7-15docx_2015-08-26-12.02.47.173.docx
Request;20150805-000011;40365;PACE;Inpatient;PACE;C:\Users\FGuo\Documents\work doucment\attachment\attachmentDB\20161005\originalFileFromAerial\DOCSVC_20161003.tar\DOCSVC_20161003\DOCSVC_20161003\INPATIENT\REQ_20150805-000011\Ahmed Sultan IP Denial Good Samaritan Hispital 8-7-15docx_2015-08-26-12.03.24.861.docx
Request;20150805-000011;40365;PACE;Inpatient;PACE;C:\Users\FGuo\Documents\work doucment\attachment\attachmentDB\20161005\originalFileFromAerial\DOCSVC_20161003.tar\DOCSVC_20161003\DOCSVC_20161003\INPATIENT\REQ_20150805-000011\Ahmed Sultan_2015-08-26-12.12.46.321.pdf
Request;20150805-000011;40365;PACE;Inpatient;PACE;C:\Users\FGuo\Documents\work doucment\attachment\attachmentDB\20161005\originalFileFromAerial\DOCSVC_20161003.tar\DOCSVC_20161003\DOCSVC_20161003\INPATIENT\REQ_20150805-000011\Ahmed, Sultan 40365 CLINICAL REVIEW REQUEST FORM.doc 8 5 15_2015-08-05-09.48.06.514.doc
Request;20150805-000011;40365;PACE;Inpatient;PACE;C:\Users\FGuo\Documents\work doucment\attachment\attachmentDB\20161005\originalFileFromAerial\DOCSVC_20161003.tar\DOCSVC_20161003\DOCSVC_20161003\INPATIENT\REQ_20150805-000011\Ahmed, Sultan Appeal Ack Letter_2015-08-26-12.02.11.890.docx
Request;20150805-000011;40365;PACE;Inpatient;PACE;C:\Users\FGuo\Documents\work doucment\attachment\attachmentDB\20161005\originalFileFromAerial\DOCSVC_20161003.tar\DOCSVC_20161003\DOCSVC_20161003\INPATIENT\REQ_20150805-000011\Ahmed, Sultran Appeal Resolution-Favorable_2015-09-02-15.57.54.306.docx
Request;20150805-000012;72074;PACE;Inpatient;PACE;C:\Users\FGuo\Documents\work doucment\attachment\attachmentDB\20161005\originalFileFromAerial\DOCSVC_20161003.tar\DOCSVC_20161003\DOCSVC_20161003\INPATIENT\REQ_20150805-000012\SSteele 92115_2015-09-23-12.08.53.790.tif
Request;20150805-000012;72074;PACE;Inpatient;PACE;C:\Users\FGuo\Documents\work doucment\attachment\attachmentDB\20161005\originalFileFromAerial\DOCSVC_20161003.tar\DOCSVC_20161003\DOCSVC_20161003\INPATIENT\REQ_20150805-000012\Steele, Sadie  - Sea Crest Health Care Center, LLC  - 8.23.16_2016-08-23-09.22.28.888.pdf
Request;20150805-000012;72074;PACE;Inpatient;PACE;C:\Users\FGuo\Documents\work doucment\attachment\attachmentDB\20161005\originalFileFromAerial\DOCSVC_20161003.tar\DOCSVC_20161003\DOCSVC_20161003\INPATIENT\REQ_20150805-000012\Steele, Sadie - Sea Crest Health Care Center, LLC 8.7.15_2015-08-07-15.58.36.274.docx
Request;20150805-000013;44005;SELECT;Inpatient;SELECT;C:\Users\FGuo\Documents\work doucment\attachment\attachmentDB\20161005\originalFileFromAerial\DOCSVC_20161003.tar\DOCSVC_20161003\DOCSVC_20161003\INPATIENT\REQ_20150805-000013\Dorothy Wilson UR 8-6-15_2015-08-06-11.02.17.564.tif
Request;20150805-000013;44005;SELECT;Inpatient;SELECT;C:\Users\FGuo\Documents\work doucment\attachment\attachmentDB\20161005\originalFileFromAerial\DOCSVC_20161003.tar\DOCSVC_20161003\DOCSVC_20161003\INPATIENT\REQ_20150805-000013\Wilson Dorothy-FIDA IP Denial Flushing Hospital Center 8-7-15_2015-08-07-13.14.27.148.docx
Request;20150805-000018;81786;PACE;Inpatient;PACE;C:\Users\FGuo\Documents\work doucment\attachment\attachmentDB\20161005\originalFileFromAerial\DOCSVC_20161003.tar\DOCSVC_20161003\DOCSVC_20161003\INPATIENT\REQ_20150805-000018\Margarita Torodiaz UR 8-5-15_2015-08-17-09.33.25.311.tif
Request;20150805-000018;81786;PACE;Inpatient;PACE;C:\Users\FGuo\Documents\work doucment\attachment\attachmentDB\20161005\originalFileFromAerial\DOCSVC_20161003.tar\DOCSVC_20161003\DOCSVC_20161003\INPATIENT\REQ_20150805-000018\Torodiaz Margarita IP Denial North Shore LIJ medical Center 8-6-15_2015-08-06-12.11.11.161.docx
Request;20150805-000018;81786;PACE;Inpatient;PACE;C:\Users\FGuo\Documents\work doucment\attachment\attachmentDB\20161005\originalFileFromAerial\DOCSVC_20161003.tar\DOCSVC_20161003\DOCSVC_20161003\INPATIENT\REQ_20150805-000018\Torodiaz, Margarita-North Shore UH Manhasset Clinical Review Request Form 8-5-15_2015-08-05-10.42.03.978.docx
Request;20150805-000020;77307;PACE;Inpatient;PACE;C:\Users\FGuo\Documents\work doucment\attachment\attachmentDB\20161005\originalFileFromAerial\DOCSVC_20161003.tar\DOCSVC_20161003\DOCSVC_20161003\INPATIENT\REQ_20150805-000020\Dowdell Marie IP Denial Mt Sinai Hospital 8-26-15_2015-08-26-15.42.32.355.docx
Request;20150805-000020;77307;PACE;Inpatient;PACE;C:\Users\FGuo\Documents\work doucment\attachment\attachmentDB\20161005\originalFileFromAerial\DOCSVC_20161003.tar\DOCSVC_20161003\DOCSVC_20161003\INPATIENT\REQ_20150805-000020\Dowdell Marie IP Denial Mt Sinai Hospital 8-26-15_2015-08-27-15.05.09.342.docx
Request;20150805-000020;77307;PACE;Inpatient;PACE;C:\Users\FGuo\Documents\work doucment\attachment\attachmentDB\20161005\originalFileFromAerial\DOCSVC_20161003.tar\DOCSVC_20161003\DOCSVC_20161003\INPATIENT\REQ_20150805-000020\dowdell marie UM_2015-08-11-11.34.01.901.tif
Request;20150805-000020;77307;PACE;Inpatient;PACE;C:\Users\FGuo\Documents\work doucment\attachment\attachmentDB\20161005\originalFileFromAerial\DOCSVC_20161003.tar\DOCSVC_20161003\DOCSVC_20161003\INPATIENT\REQ_20150805-000020\dowdell marie UM_2015-08-11-11.34.40.826.tif
Request;20150805-000020;77307;PACE;Inpatient;PACE;C:\Users\FGuo\Documents\work doucment\attachment\attachmentDB\20161005\originalFileFromAerial\DOCSVC_20161003.tar\DOCSVC_20161003\DOCSVC_20161003\INPATIENT\REQ_20150805-000020\Dowdell, Marie Appeal Ack Letter_2015-11-12-13.51.18.75.docx
Request;20150805-000020;77307;PACE;Inpatient;PACE;C:\Users\FGuo\Documents\work doucment\attachment\attachmentDB\20161005\originalFileFromAerial\DOCSVC_20161003.tar\DOCSVC_20161003\DOCSVC_20161003\INPATIENT\REQ_20150805-000020\Dowdell, Marie MR DOS 08-02-15 - 08-06-15_2015-11-12-13.52.02.855.pdf
Request;20150805-000020;77307;PACE;Inpatient;PACE;C:\Users\FGuo\Documents\work doucment\attachment\attachmentDB\20161005\originalFileFromAerial\DOCSVC_20161003.tar\DOCSVC_20161003\DOCSVC_20161003\INPATIENT\REQ_20150805-000020\Dowdell, Marie WOL_2015-11-12-13.51.33.981.TIF
Request;20150805-000020;77307;PACE;Inpatient;PACE;C:\Users\FGuo\Documents\work doucment\attachment\attachmentDB\20161005\originalFileFromAerial\DOCSVC_20161003.tar\DOCSVC_20161003\DOCSVC_20161003\INPATIENT\REQ_20150805-000020\marie dowdelldc_2015-08-12-11.39.26.779.tif
Request;20150805-000020;77307;PACE;Inpatient;PACE;C:\Users\FGuo\Documents\work doucment\attachment\attachmentDB\20161005\originalFileFromAerial\DOCSVC_20161003.tar\DOCSVC_20161003\DOCSVC_20161003\INPATIENT\REQ_20150805-000020\marie dowdelpri_2015-08-12-11.56.39.337.tif
Request;20150805-000020;77307;PACE;Inpatient;PACE;C:\Users\FGuo\Documents\work doucment\attachment\attachmentDB\20161005\originalFileFromAerial\DOCSVC_20161003.tar\DOCSVC_20161003\DOCSVC_20161003\INPATIENT\REQ_20150805-000020\_2015-08-11-11.34.08.806
Request;20150805-000020;77307;PACE;Inpatient;PACE;C:\Users\FGuo\Documents\work doucment\attachment\attachmentDB\20161005\originalFileFromAerial\DOCSVC_20161003.tar\DOCSVC_20161003\DOCSVC_20161003\INPATIENT\REQ_20150805-000020\_2015-08-12-11.38.26.899
Request;20150805-000021;97989;PACE;Inpatient;PACE;C:\Users\FGuo\Documents\work doucment\attachment\attachmentDB\20161005\originalFileFromAerial\DOCSVC_20161003.tar\DOCSVC_20161003\DOCSVC_20161003\INPATIENT\REQ_20150805-000021\Green Sinclair IP Denial Mt Sinai Hospital 8-24-15_2015-08-24-16.54.04.45.docx
Request;20150805-000021;97989;PACE;Inpatient;PACE;C:\Users\FGuo\Documents\work doucment\attachment\attachmentDB\20161005\originalFileFromAerial\DOCSVC_20161003.tar\DOCSVC_20161003\DOCSVC_20161003\INPATIENT\REQ_20150805-000021\green sinclair_2015-08-11-11.06.29.957.tif
Request;20150805-000021;97989;PACE;Inpatient;PACE;C:\Users\FGuo\Documents\work doucment\attachment\attachmentDB\20161005\originalFileFromAerial\DOCSVC_20161003.tar\DOCSVC_20161003\DOCSVC_20161003\INPATIENT\REQ_20150805-000021\Medical Record _2015-12-21-12.43.49.478.pdf
Request;20150805-000021;97989;PACE;Inpatient;PACE;C:\Users\FGuo\Documents\work doucment\attachment\attachmentDB\20161005\originalFileFromAerial\DOCSVC_20161003.tar\DOCSVC_20161003\DOCSVC_20161003\INPATIENT\REQ_20150805-000021\PACE Final Adverse Determination- Appeal  Unfavorable Non-Contracted Hospitals_2016-01-04-10.54.15.966.docx
Request;20150805-000022;21805;PACE;Inpatient;PACE;C:\Users\FGuo\Documents\work doucment\attachment\attachmentDB\20161005\originalFileFromAerial\DOCSVC_20161003.tar\DOCSVC_20161003\DOCSVC_20161003\INPATIENT\REQ_20150805-000022\Medical Record_2015-11-30-12.57.38.557.pdf
Request;20150805-000022;21805;PACE;Inpatient;PACE;C:\Users\FGuo\Documents\work doucment\attachment\attachmentDB\20161005\originalFileFromAerial\DOCSVC_20161003.tar\DOCSVC_20161003\DOCSVC_20161003\INPATIENT\REQ_20150805-000022\MRuff_2015-08-12-17.34.10.925.tif
Request;20150805-000022;21805;PACE;Inpatient;PACE;C:\Users\FGuo\Documents\work doucment\attachment\attachmentDB\20161005\originalFileFromAerial\DOCSVC_20161003.tar\DOCSVC_20161003\DOCSVC_20161003\INPATIENT\REQ_20150805-000022\PACE Final Adverse Determination- Appeal  Unfavorable Non-Contracted Hospitals_2015-12-02-11.23.23.26.docx
Request;20150805-000022;21805;PACE;Inpatient;PACE;C:\Users\FGuo\Documents\work doucment\attachment\attachmentDB\20161005\originalFileFromAerial\DOCSVC_20161003.tar\DOCSVC_20161003\DOCSVC_20161003\INPATIENT\REQ_20150805-000022\PRA-1  Appeal Acknowledgement _2015-10-14-16.33.48.37.docx
Request;20150805-000022;21805;PACE;Inpatient;PACE;C:\Users\FGuo\Documents\work doucment\attachment\attachmentDB\20161005\originalFileFromAerial\DOCSVC_20161003.tar\DOCSVC_20161003\DOCSVC_20161003\INPATIENT\REQ_20150805-000022\Ruff Mary IP Denial Brooklyn Hospital Center 8-24-15_2015-08-24-14.16.17.111.docx
Request;20150805-000022;21805;PACE;Inpatient;PACE;C:\Users\FGuo\Documents\work doucment\attachment\attachmentDB\20161005\originalFileFromAerial\DOCSVC_20161003.tar\DOCSVC_20161003\DOCSVC_20161003\INPATIENT\REQ_20150805-000022\Ruff, Mary_2015-08-05-11.03.40.978.tif
Request;20150805-000023;21111;PACE;Inpatient;PACE;C:\Users\FGuo\Documents\work doucment\attachment\attachmentDB\20161005\originalFileFromAerial\DOCSVC_20161003.tar\DOCSVC_20161003\DOCSVC_20161003\INPATIENT\REQ_20150805-000023\James Johnson UR 8-10-15_2015-08-11-12.25.34.754.tif
Request;20150805-000023;21111;PACE;Inpatient;PACE;C:\Users\FGuo\Documents\work doucment\attachment\attachmentDB\20161005\originalFileFromAerial\DOCSVC_20161003.tar\DOCSVC_20161003\DOCSVC_20161003\INPATIENT\REQ_20150805-000023\James Johnson UR 8-5-15_2015-08-06-08.58.14.722.tif
Request;20150805-000026;35154;SELECT;Inpatient;SELECT;C:\Users\FGuo\Documents\work doucment\attachment\attachmentDB\20161005\originalFileFromAerial\DOCSVC_20161003.tar\DOCSVC_20161003\DOCSVC_20161003\INPATIENT\REQ_20150805-000026\Dickson Frankie_2015-08-05-20.29.07.46.tif
Request;20150805-000028;91561;PACE;Inpatient;PACE;C:\Users\FGuo\Documents\work doucment\attachment\attachmentDB\20161005\originalFileFromAerial\DOCSVC_20161003.tar\DOCSVC_20161003\DOCSVC_20161003\INPATIENT\REQ_20150805-000028\Walters, Fredreica -Montefiore Med Cen-Moses-Clinical Review Request Form 8-5-15_2015-08-05-12.02.57.912.docx
Request;20150805-000028;91561;PACE;Inpatient;PACE;C:\Users\FGuo\Documents\work doucment\attachment\attachmentDB\20161005\originalFileFromAerial\DOCSVC_20161003.tar\DOCSVC_20161003\DOCSVC_20161003\INPATIENT\REQ_20150805-000028\walters,fredrica_2015-08-10-15.51.39.909.tif
Request;20150805-000028;91561;PACE;Inpatient;PACE;C:\Users\FGuo\Documents\work doucment\attachment\attachmentDB\20161005\originalFileFromAerial\DOCSVC_20161003.tar\DOCSVC_20161003\DOCSVC_20161003\INPATIENT\REQ_20150805-000028\_2015-08-10-15.51.23.582
Request;20150805-000040;76908;SELECT;Inpatient;SELECT;C:\Users\FGuo\Documents\work doucment\attachment\attachmentDB\20161005\originalFileFromAerial\DOCSVC_20161003.tar\DOCSVC_20161003\DOCSVC_20161003\INPATIENT\REQ_20150805-000040\Aleksandrov, Vladimir(2nd Document)- Resort Nursing Home   8.14.15_2015-08-14-15.03.55.491.docx
Request;20150805-000042;76908;SELECT;Inpatient;SELECT;C:\Users\FGuo\Documents\work doucment\attachment\attachmentDB\20161005\originalFileFromAerial\DOCSVC_20161003.tar\DOCSVC_20161003\DOCSVC_20161003\INPATIENT\REQ_20150805-000042\aleksandrov vladimirdc_2015-08-05-16.26.41.920.tif
Request;20150805-000042;76908;SELECT;Inpatient;SELECT;C:\Users\FGuo\Documents\work doucment\attachment\attachmentDB\20161005\originalFileFromAerial\DOCSVC_20161003.tar\DOCSVC_20161003\DOCSVC_20161003\INPATIENT\REQ_20150805-000042\aleksandrov vladimir_2015-08-05-13.30.03.507.tif
Request;20150805-000042;76908;SELECT;Inpatient;SELECT;C:\Users\FGuo\Documents\work doucment\attachment\attachmentDB\20161005\originalFileFromAerial\DOCSVC_20161003.tar\DOCSVC_20161003\DOCSVC_20161003\INPATIENT\REQ_20150805-000042\Aleksandrov, Vladimir(2nd Document)- Resort Nursing Home   8.10.15_2015-08-10-13.55.19.725.docx
Request;20150805-000042;76908;SELECT;Inpatient;SELECT;C:\Users\FGuo\Documents\work doucment\attachment\attachmentDB\20161005\originalFileFromAerial\DOCSVC_20161003.tar\DOCSVC_20161003\DOCSVC_20161003\INPATIENT\REQ_20150805-000042\_2015-08-05-13.30.10.795
Request;20150805-000042;76908;SELECT;Inpatient;SELECT;C:\Users\FGuo\Documents\work doucment\attachment\attachmentDB\20161005\originalFileFromAerial\DOCSVC_20161003.tar\DOCSVC_20161003\DOCSVC_20161003\INPATIENT\REQ_20150805-000042\_2015-08-05-13.30.18.754
Request;20150805-000049;86498;SELECT;Inpatient;SELECT;C:\Users\FGuo\Documents\work doucment\attachment\attachmentDB\20161005\originalFileFromAerial\DOCSVC_20161003.tar\DOCSVC_20161003\DOCSVC_20161003\INPATIENT\REQ_20150805-000049\Frances Giaimo Hospice Note 8-5-15_2015-08-05-15.56.17.368.pdf
Request;20150805-000049;86498;SELECT;Inpatient;SELECT;C:\Users\FGuo\Documents\work doucment\attachment\attachmentDB\20161005\originalFileFromAerial\DOCSVC_20161003.tar\DOCSVC_20161003\DOCSVC_20161003\INPATIENT\REQ_20150805-000049\Giaimo, Frances(2nd Document -Custodial) - Margaret Teitz Nursing & Rehab Center  8.6.15_2015-08-06-10.20.06.978.docx
Request;20150805-000050;48405;PACE;Inpatient;PACE;C:\Users\FGuo\Documents\work doucment\attachment\attachmentDB\20161005\originalFileFromAerial\DOCSVC_20161003.tar\DOCSVC_20161003\DOCSVC_20161003\INPATIENT\REQ_20150805-000050\Olive Tate_2015-08-05-15.03.28.566.tif
Request;20150805-000050;48405;PACE;Inpatient;PACE;C:\Users\FGuo\Documents\work doucment\attachment\attachmentDB\20161005\originalFileFromAerial\DOCSVC_20161003.tar\DOCSVC_20161003\DOCSVC_20161003\INPATIENT\REQ_20150805-000050\Tate, Olive R - Center For Nursing & Rehabilitation  8.7.15_2015-08-07-16.39.17.584.docx
Request;20150805-000054;75136;PACE;Inpatient;PACE;C:\Users\FGuo\Documents\work doucment\attachment\attachmentDB\20161005\originalFileFromAerial\DOCSVC_20161003.tar\DOCSVC_20161003\DOCSVC_20161003\INPATIENT\REQ_20150805-000054\Matirnaya, Leonora - COMPASSIONATE CARE HOSPICE OF NEW YORK LLC  8.6.15_2015-08-06-10.32.10.223.docx
Request;20150805-000055;72328;PACE;Inpatient;PACE;C:\Users\FGuo\Documents\work doucment\attachment\attachmentDB\20161005\originalFileFromAerial\DOCSVC_20161003.tar\DOCSVC_20161003\DOCSVC_20161003\INPATIENT\REQ_20150805-000055\fernado pagan_2015-08-13-13.50.06.836.tif
Request;20150805-000055;72328;PACE;Inpatient;PACE;C:\Users\FGuo\Documents\work doucment\attachment\attachmentDB\20161005\originalFileFromAerial\DOCSVC_20161003.tar\DOCSVC_20161003\DOCSVC_20161003\INPATIENT\REQ_20150805-000055\fernando pagan 1023_2015-10-26-09.53.28.291.tif
Request;20150805-000055;72328;PACE;Inpatient;PACE;C:\Users\FGuo\Documents\work doucment\attachment\attachmentDB\20161005\originalFileFromAerial\DOCSVC_20161003.tar\DOCSVC_20161003\DOCSVC_20161003\INPATIENT\REQ_20150805-000055\fernando pagan10_2015-09-10-14.48.32.571.tif
Request;20150805-000055;72328;PACE;Inpatient;PACE;C:\Users\FGuo\Documents\work doucment\attachment\attachmentDB\20161005\originalFileFromAerial\DOCSVC_20161003.tar\DOCSVC_20161003\DOCSVC_20161003\INPATIENT\REQ_20150805-000055\fernando Pagan21_2015-08-24-10.28.23.799.tif
Request;20150805-000055;72328;PACE;Inpatient;PACE;C:\Users\FGuo\Documents\work doucment\attachment\attachmentDB\20161005\originalFileFromAerial\DOCSVC_20161003.tar\DOCSVC_20161003\DOCSVC_20161003\INPATIENT\REQ_20150805-000055\fernando Pagan21_2015-08-24-10.29.04.492.tif
Request;20150805-000055;72328;PACE;Inpatient;PACE;C:\Users\FGuo\Documents\work doucment\attachment\attachmentDB\20161005\originalFileFromAerial\DOCSVC_20161003.tar\DOCSVC_20161003\DOCSVC_20161003\INPATIENT\REQ_20150805-000055\fernando pagan28_2015-08-28-10.46.45.742.tif
Request;20150805-000055;72328;PACE;Inpatient;PACE;C:\Users\FGuo\Documents\work doucment\attachment\attachmentDB\20161005\originalFileFromAerial\DOCSVC_20161003.tar\DOCSVC_20161003\DOCSVC_20161003\INPATIENT\REQ_20150805-000055\fernando pagan3_2015-09-03-14.03.40.174.tif
Request;20150805-000055;72328;PACE;Inpatient;PACE;C:\Users\FGuo\Documents\work doucment\attachment\attachmentDB\20161005\originalFileFromAerial\DOCSVC_20161003.tar\DOCSVC_20161003\DOCSVC_20161003\INPATIENT\REQ_20150805-000055\Fernando Pagan_2015-08-07-17.35.33.9.tif
Request;20150805-000055;72328;PACE;Inpatient;PACE;C:\Users\FGuo\Documents\work doucment\attachment\attachmentDB\20161005\originalFileFromAerial\DOCSVC_20161003.tar\DOCSVC_20161003\DOCSVC_20161003\INPATIENT\REQ_20150805-000055\pagan,fernando_2015-08-05-15.11.50.951.tif
Request;20150805-000055;72328;PACE;Inpatient;PACE;C:\Users\FGuo\Documents\work doucment\attachment\attachmentDB\20161005\originalFileFromAerial\DOCSVC_20161003.tar\DOCSVC_20161003\DOCSVC_20161003\INPATIENT\REQ_20150805-000055\_2015-08-24-10.28.38.264
Request;20150805-000064;53006;PACE;Inpatient;PACE;C:\Users\FGuo\Documents\work doucment\attachment\attachmentDB\20161005\originalFileFromAerial\DOCSVC_20161003.tar\DOCSVC_20161003\DOCSVC_20161003\INPATIENT\REQ_20150805-000064\Das Sunil Queens Hospital Center 8-11-15_2015-08-11-11.59.06.178.docx
Request;20150805-000064;53006;PACE;Inpatient;PACE;C:\Users\FGuo\Documents\work doucment\attachment\attachmentDB\20161005\originalFileFromAerial\DOCSVC_20161003.tar\DOCSVC_20161003\DOCSVC_20161003\INPATIENT\REQ_20150805-000064\Das, Sunil Appeal ACK Letter_2015-09-24-12.22.16.361.docx
Request;20150805-000064;53006;PACE;Inpatient;PACE;C:\Users\FGuo\Documents\work doucment\attachment\attachmentDB\20161005\originalFileFromAerial\DOCSVC_20161003.tar\DOCSVC_20161003\DOCSVC_20161003\INPATIENT\REQ_20150805-000064\Das, Sunil Final Adverse Determination- Appeal  Unfavorable Non-Contracted Hospitals_2015-11-06-11.17.18.518.docx
Request;20150805-000064;53006;PACE;Inpatient;PACE;C:\Users\FGuo\Documents\work doucment\attachment\attachmentDB\20161005\originalFileFromAerial\DOCSVC_20161003.tar\DOCSVC_20161003\DOCSVC_20161003\INPATIENT\REQ_20150805-000064\MR-1_2015-11-04-15.36.52.165.pdf
Request;20150805-000064;53006;PACE;Inpatient;PACE;C:\Users\FGuo\Documents\work doucment\attachment\attachmentDB\20161005\originalFileFromAerial\DOCSVC_20161003.tar\DOCSVC_20161003\DOCSVC_20161003\INPATIENT\REQ_20150805-000064\MR-2_2015-11-04-15.37.09.430.pdf
Request;20150805-000064;53006;PACE;Inpatient;PACE;C:\Users\FGuo\Documents\work doucment\attachment\attachmentDB\20161005\originalFileFromAerial\DOCSVC_20161003.tar\DOCSVC_20161003\DOCSVC_20161003\INPATIENT\REQ_20150805-000064\MR-3_2015-11-04-15.37.23.264.pdf
Request;20150805-000064;53006;PACE;Inpatient;PACE;C:\Users\FGuo\Documents\work doucment\attachment\attachmentDB\20161005\originalFileFromAerial\DOCSVC_20161003.tar\DOCSVC_20161003\DOCSVC_20161003\INPATIENT\REQ_20150805-000064\Sunil Das UR 8-7-15_2015-08-10-07.39.05.858.tif
Request;20150805-000066;42165;PACE;Inpatient;PACE;C:\Users\FGuo\Documents\work doucment\attachment\attachmentDB\20161005\originalFileFromAerial\DOCSVC_20161003.tar\DOCSVC_20161003\DOCSVC_20161003\INPATIENT\REQ_20150805-000066\white,ellen818_2015-08-18-16.11.37.864.tif
Request;20150805-000066;42165;PACE;Inpatient;PACE;C:\Users\FGuo\Documents\work doucment\attachment\attachmentDB\20161005\originalFileFromAerial\DOCSVC_20161003.tar\DOCSVC_20161003\DOCSVC_20161003\INPATIENT\REQ_20150805-000066\white,ellen_2015-08-11-15.16.31.617.tif
Request;20150805-000067;42214;PACE;Inpatient;PACE;C:\Users\FGuo\Documents\work doucment\attachment\attachmentDB\20161005\originalFileFromAerial\DOCSVC_20161003.tar\DOCSVC_20161003\DOCSVC_20161003\INPATIENT\REQ_20150805-000067\Davis Sandra IP Denial White Plains Hospital 8-14-15_2015-08-14-13.46.32.639.docx
Request;20150805-000067;42214;PACE;Inpatient;PACE;C:\Users\FGuo\Documents\work doucment\attachment\attachmentDB\20161005\originalFileFromAerial\DOCSVC_20161003.tar\DOCSVC_20161003\DOCSVC_20161003\INPATIENT\REQ_20150805-000067\Davis, Sandra Appeal Acknowledgement Letter_2015-09-16-11.54.05.197.docx
Request;20150805-000067;42214;PACE;Inpatient;PACE;C:\Users\FGuo\Documents\work doucment\attachment\attachmentDB\20161005\originalFileFromAerial\DOCSVC_20161003.tar\DOCSVC_20161003\DOCSVC_20161003\INPATIENT\REQ_20150805-000067\Davis, Sandra Final Adverse Determination Appeal Unfavorable-Contracted Hospitals_2015-10-02-10.58.43.330.docx
Request;20150805-000067;42214;PACE;Inpatient;PACE;C:\Users\FGuo\Documents\work doucment\attachment\attachmentDB\20161005\originalFileFromAerial\DOCSVC_20161003.tar\DOCSVC_20161003\DOCSVC_20161003\INPATIENT\REQ_20150805-000067\Davis, Sandra MR-1_2015-09-28-10.48.07.698.pdf
Request;20150805-000067;42214;PACE;Inpatient;PACE;C:\Users\FGuo\Documents\work doucment\attachment\attachmentDB\20161005\originalFileFromAerial\DOCSVC_20161003.tar\DOCSVC_20161003\DOCSVC_20161003\INPATIENT\REQ_20150805-000067\Davis, Sandra MR-2_2015-09-28-10.48.41.354.pdf
Request;20150805-000067;42214;PACE;Inpatient;PACE;C:\Users\FGuo\Documents\work doucment\attachment\attachmentDB\20161005\originalFileFromAerial\DOCSVC_20161003.tar\DOCSVC_20161003\DOCSVC_20161003\INPATIENT\REQ_20150805-000067\davis, sandra_2015-08-11-09.23.25.411.tif
Request;20150805-000067;42214;PACE;Inpatient;PACE;C:\Users\FGuo\Documents\work doucment\attachment\attachmentDB\20161005\originalFileFromAerial\DOCSVC_20161003.tar\DOCSVC_20161003\DOCSVC_20161003\INPATIENT\REQ_20150805-000067\davis-DCsummary_2015-08-11-09.24.07.889.tif
Request;20150805-000068;77307;PACE;Inpatient;PACE;C:\Users\FGuo\Documents\work doucment\attachment\attachmentDB\20161005\originalFileFromAerial\DOCSVC_20161003.tar\DOCSVC_20161003\DOCSVC_20161003\INPATIENT\REQ_20150805-000068\dowdell marie10_2015-08-20-19.11.43.255.tif
Request;20150805-000068;77307;PACE;Inpatient;PACE;C:\Users\FGuo\Documents\work doucment\attachment\attachmentDB\20161005\originalFileFromAerial\DOCSVC_20161003.tar\DOCSVC_20161003\DOCSVC_20161003\INPATIENT\REQ_20150805-000068\dowdell mariept_2015-08-26-17.42.03.529.tif
Request;20150805-000068;77307;PACE;Inpatient;PACE;C:\Users\FGuo\Documents\work doucment\attachment\attachmentDB\20161005\originalFileFromAerial\DOCSVC_20161003.tar\DOCSVC_20161003\DOCSVC_20161003\INPATIENT\REQ_20150805-000068\dowdell marie_2015-08-06-13.44.55.840.tif
Request;20150805-000068;77307;PACE;Inpatient;PACE;C:\Users\FGuo\Documents\work doucment\attachment\attachmentDB\20161005\originalFileFromAerial\DOCSVC_20161003.tar\DOCSVC_20161003\DOCSVC_20161003\INPATIENT\REQ_20150805-000068\dowdell mary26_2015-08-26-14.55.06.168.tif
Request;20150805-000068;77307;PACE;Inpatient;PACE;C:\Users\FGuo\Documents\work doucment\attachment\attachmentDB\20161005\originalFileFromAerial\DOCSVC_20161003.tar\DOCSVC_20161003\DOCSVC_20161003\INPATIENT\REQ_20150805-000068\marie dowdelpri_2015-08-12-11.57.58.6.tif
Request;20150805-000069;55148;SELECT;Inpatient;SELECT;C:\Users\FGuo\Documents\work doucment\attachment\attachmentDB\20161005\originalFileFromAerial\DOCSVC_20161003.tar\DOCSVC_20161003\DOCSVC_20161003\INPATIENT\REQ_20150805-000069\Silverlake Rahab Center_2015-08-10-13.01.25.169.pdf
Request;20150805-000072;30870;PACE;Inpatient;PACE;C:\Users\FGuo\Documents\work doucment\attachment\attachmentDB\20161005\originalFileFromAerial\DOCSVC_20161003.tar\DOCSVC_20161003\DOCSVC_20161003\INPATIENT\REQ_20150805-000072\Somma, Rose - Buena Vida Continuing Care & Rehab Center  8.10.15_2015-08-10-14.52.08.90.docx
Request;20150805-000073;54669;PACE;Inpatient;PACE;C:\Users\FGuo\Documents\work doucment\attachment\attachmentDB\20161005\originalFileFromAerial\DOCSVC_20161003.tar\DOCSVC_20161003\DOCSVC_20161003\INPATIENT\REQ_20150805-000073\santos, am85_2015-08-10-11.34.44.641.tif
Request;20150805-000073;54669;PACE;Inpatient;PACE;C:\Users\FGuo\Documents\work doucment\attachment\attachmentDB\20161005\originalFileFromAerial\DOCSVC_20161003.tar\DOCSVC_20161003\DOCSVC_20161003\INPATIENT\REQ_20150805-000073\santos,amantine83_2015-08-07-09.36.26.395.tif
Request;20150806-000003;91931;PACE;Inpatient;PACE;C:\Users\FGuo\Documents\work doucment\attachment\attachmentDB\20161005\originalFileFromAerial\DOCSVC_20161003.tar\DOCSVC_20161003\DOCSVC_20161003\INPATIENT\REQ_20150806-000003\luciano-723_2015-08-06-11.13.30.754.tif
Request;20150806-000003;91931;PACE;Inpatient;PACE;C:\Users\FGuo\Documents\work doucment\attachment\attachmentDB\20161005\originalFileFromAerial\DOCSVC_20161003.tar\DOCSVC_20161003\DOCSVC_20161003\INPATIENT\REQ_20150806-000003\lucianoDCsumm_2015-08-06-11.18.06.91.tif
Request;20150806-000004;27502;null;Inpatient;PACE;C:\Users\FGuo\Documents\work doucment\attachment\attachmentDB\20161005\originalFileFromAerial\DOCSVC_20161003.tar\DOCSVC_20161003\DOCSVC_20161003\INPATIENT\REQ_20150806-000004\Ginsberg Steven IP Admit Maimonides Medical Center 8-7-15_2015-08-07-13.22.04.205.docx
Request;20150806-000004;27502;null;Inpatient;PACE;C:\Users\FGuo\Documents\work doucment\attachment\attachmentDB\20161005\originalFileFromAerial\DOCSVC_20161003.tar\DOCSVC_20161003\DOCSVC_20161003\INPATIENT\REQ_20150806-000004\Ginsberg Steven MR_2015-10-15-16.23.13.340.pdf
Request;20150806-000004;27502;null;Inpatient;PACE;C:\Users\FGuo\Documents\work doucment\attachment\attachmentDB\20161005\originalFileFromAerial\DOCSVC_20161003.tar\DOCSVC_20161003\DOCSVC_20161003\INPATIENT\REQ_20150806-000004\Ginsberg, Steven P_2015-08-06-09.27.12.823.tif
Request;20150806-000004;27502;null;Inpatient;PACE;C:\Users\FGuo\Documents\work doucment\attachment\attachmentDB\20161005\originalFileFromAerial\DOCSVC_20161003.tar\DOCSVC_20161003\DOCSVC_20161003\INPATIENT\REQ_20150806-000004\PRA-1  Appeal Acknowledgement _2015-09-23-11.18.08.280.docx
Request;20150806-000004;27502;null;Inpatient;PACE;C:\Users\FGuo\Documents\work doucment\attachment\attachmentDB\20161005\originalFileFromAerial\DOCSVC_20161003.tar\DOCSVC_20161003\DOCSVC_20161003\INPATIENT\REQ_20150806-000004\PRA-2 Final Adverse Determination Appeal Unfavorable-Contracted Hospitals_2015-10-19-11.53.24.225.docx
Request;20150806-000005;47876;FIDA;Inpatient;FIDA;C:\Users\FGuo\Documents\work doucment\attachment\attachmentDB\20161005\originalFileFromAerial\DOCSVC_20161003.tar\DOCSVC_20161003\DOCSVC_20161003\INPATIENT\REQ_20150806-000005\Deborah Jones UR 8-5-15_2015-08-06-12.01.26.133.tif
Request;20150806-000005;47876;FIDA;Inpatient;FIDA;C:\Users\FGuo\Documents\work doucment\attachment\attachmentDB\20161005\originalFileFromAerial\DOCSVC_20161003.tar\DOCSVC_20161003\DOCSVC_20161003\INPATIENT\REQ_20150806-000005\Deborah Jones UR 8-6-15_2015-08-06-12.01.11.609.tif
Request;20150806-000005;47876;FIDA;Inpatient;FIDA;C:\Users\FGuo\Documents\work doucment\attachment\attachmentDB\20161005\originalFileFromAerial\DOCSVC_20161003.tar\DOCSVC_20161003\DOCSVC_20161003\INPATIENT\REQ_20150806-000005\Jones Deborah FIDA IP Denial Flushing Hospital Center 8-13-15_2015-08-13-11.59.32.420.docx
Request;20150806-000005;47876;FIDA;Inpatient;FIDA;C:\Users\FGuo\Documents\work doucment\attachment\attachmentDB\20161005\originalFileFromAerial\DOCSVC_20161003.tar\DOCSVC_20161003\DOCSVC_20161003\INPATIENT\REQ_20150806-000005\Jones, Deborah 8-6-15_2015-08-06-09.34.17.622.tif
Request;20150806-000005;47876;FIDA;Inpatient;FIDA;C:\Users\FGuo\Documents\work doucment\attachment\attachmentDB\20161005\originalFileFromAerial\DOCSVC_20161003.tar\DOCSVC_20161003\DOCSVC_20161003\INPATIENT\REQ_20150806-000005\Jones, Deborah FIDA ACK Letter_2015-09-15-10.43.52.173.docx
Request;20150806-000005;47876;FIDA;Inpatient;FIDA;C:\Users\FGuo\Documents\work doucment\attachment\attachmentDB\20161005\originalFileFromAerial\DOCSVC_20161003.tar\DOCSVC_20161003\DOCSVC_20161003\INPATIENT\REQ_20150806-000005\Jones, Deborah MR_2015-09-15-10.53.59.119.pdf
Request;20150806-000006;27112;PACE;Inpatient;PACE;C:\Users\FGuo\Documents\work doucment\attachment\attachmentDB\20161005\originalFileFromAerial\DOCSVC_20161003.tar\DOCSVC_20161003\DOCSVC_20161003\INPATIENT\REQ_20150806-000006\Etya Malts UR 8-7-15_2015-08-10-09.05.30.754.tif
Request;20150806-000006;27112;PACE;Inpatient;PACE;C:\Users\FGuo\Documents\work doucment\attachment\attachmentDB\20161005\originalFileFromAerial\DOCSVC_20161003.tar\DOCSVC_20161003\DOCSVC_20161003\INPATIENT\REQ_20150806-000006\Malts Etya Denial Beth Israel Medical Center 8-12-15_2015-08-12-16.30.30.553.docx
Request;20150806-000006;27112;PACE;Inpatient;PACE;C:\Users\FGuo\Documents\work doucment\attachment\attachmentDB\20161005\originalFileFromAerial\DOCSVC_20161003.tar\DOCSVC_20161003\DOCSVC_20161003\INPATIENT\REQ_20150806-000006\Malts, Etya---Beth Israel MC Kings Hwy---Clinical Review Request Form 8-6-15_2015-08-06-09.45.18.175.docx
Request;20150806-000006;27112;PACE;Inpatient;PACE;C:\Users\FGuo\Documents\work doucment\attachment\attachmentDB\20161005\originalFileFromAerial\DOCSVC_20161003.tar\DOCSVC_20161003\DOCSVC_20161003\INPATIENT\REQ_20150806-000006\_2015-08-06-09.44.53.137
Request;20150806-000008;20524;DIRECT;Inpatient;DIRECT;C:\Users\FGuo\Documents\work doucment\attachment\attachmentDB\20161005\originalFileFromAerial\DOCSVC_20161003.tar\DOCSVC_20161003\DOCSVC_20161003\INPATIENT\REQ_20150806-000008\tober,david_2015-08-10-16.43.30.29.tif
Request;20150806-000010;86128;PACE;Inpatient;Not Valued;C:\Users\FGuo\Documents\work doucment\attachment\attachmentDB\20161005\originalFileFromAerial\DOCSVC_20161003.tar\DOCSVC_20161003\DOCSVC_20161003\INPATIENT\REQ_20150806-000010\Appeal Letter and MR_2015-11-05-12.36.12.668.TIF
Request;20150806-000010;86128;PACE;Inpatient;Not Valued;C:\Users\FGuo\Documents\work doucment\attachment\attachmentDB\20161005\originalFileFromAerial\DOCSVC_20161003.tar\DOCSVC_20161003\DOCSVC_20161003\INPATIENT\REQ_20150806-000010\HClaudel_2015-08-25-14.58.00.974.tif
Request;20150806-000010;86128;PACE;Inpatient;Not Valued;C:\Users\FGuo\Documents\work doucment\attachment\attachmentDB\20161005\originalFileFromAerial\DOCSVC_20161003.tar\DOCSVC_20161003\DOCSVC_20161003\INPATIENT\REQ_20150806-000010\Henry Claudel IP Denial Lutheran Medical Center 8-28-15_2015-08-28-10.54.25.894.docx
Request;20150806-000010;86128;PACE;Inpatient;Not Valued;C:\Users\FGuo\Documents\work doucment\attachment\attachmentDB\20161005\originalFileFromAerial\DOCSVC_20161003.tar\DOCSVC_20161003\DOCSVC_20161003\INPATIENT\REQ_20150806-000010\Henry, Claudel -Lutheran Medical Center Clinical Review Request Form 8-19-15_2015-08-19-09.25.58.59.docx
Request;20150806-000010;86128;PACE;Inpatient;Not Valued;C:\Users\FGuo\Documents\work doucment\attachment\attachmentDB\20161005\originalFileFromAerial\DOCSVC_20161003.tar\DOCSVC_20161003\DOCSVC_20161003\INPATIENT\REQ_20150806-000010\Henry, Claudel ACK Letter_2015-11-05-12.42.44.915.docx
Request;20150806-000010;86128;PACE;Inpatient;Not Valued;C:\Users\FGuo\Documents\work doucment\attachment\attachmentDB\20161005\originalFileFromAerial\DOCSVC_20161003.tar\DOCSVC_20161003\DOCSVC_20161003\INPATIENT\REQ_20150806-000010\McClellan, Dorothy ACK Letter_2015-11-05-13.07.00.449.docx
Request;20150806-000011;66013;DIRECT;Inpatient;DIRECT;C:\Users\FGuo\Documents\work doucment\attachment\attachmentDB\20161005\originalFileFromAerial\DOCSVC_20161003.tar\DOCSVC_20161003\DOCSVC_20161003\INPATIENT\REQ_20150806-000011\Mike, Rose Lee  -Montefiore Med Cen-Moses-Clinical Review Request Form 8-6-15_2015-08-06-10.15.59.934.docx
Request;20150806-000013;74331;PACE;Inpatient;PACE;C:\Users\FGuo\Documents\work doucment\attachment\attachmentDB\20161005\originalFileFromAerial\DOCSVC_20161003.tar\DOCSVC_20161003\DOCSVC_20161003\INPATIENT\REQ_20150806-000013\74331- LEE, KWINGHOM-ADMIT CLINICALS_2015-08-06-14.19.03.666.tif
Request;20150806-000013;74331;PACE;Inpatient;PACE;C:\Users\FGuo\Documents\work doucment\attachment\attachmentDB\20161005\originalFileFromAerial\DOCSVC_20161003.tar\DOCSVC_20161003\DOCSVC_20161003\INPATIENT\REQ_20150806-000013\Lee, Kwonghon 74331 CLINICAL REVIEW REQUEST FORM.doc 8 6 15_2015-08-06-10.23.49.545.doc
Request;20150806-000017;26442;PACE;Inpatient;PACE;C:\Users\FGuo\Documents\work doucment\attachment\attachmentDB\20161005\originalFileFromAerial\DOCSVC_20161003.tar\DOCSVC_20161003\DOCSVC_20161003\INPATIENT\REQ_20150806-000017\Evans, Sarah 26442 CLINICAL REVIEW REQUEST FORM.doc 8 6 15_2015-08-06-10.57.33.950.doc
Request;20150806-000017;26442;PACE;Inpatient;PACE;C:\Users\FGuo\Documents\work doucment\attachment\attachmentDB\20161005\originalFileFromAerial\DOCSVC_20161003.tar\DOCSVC_20161003\DOCSVC_20161003\INPATIENT\REQ_20150806-000017\Sarah Evans UR 8-7-15_2015-08-11-08.02.14.636.tif
Request;20150806-000018;76034;PACE;Inpatient;PACE;C:\Users\FGuo\Documents\work doucment\attachment\attachmentDB\20161005\originalFileFromAerial\DOCSVC_20161003.tar\DOCSVC_20161003\DOCSVC_20161003\INPATIENT\REQ_20150806-000018\Rui CHen UR 8-6-15_2015-08-06-11.27.39.114.tif
Request;20150806-000024;34602;PACE;Inpatient;PACE;C:\Users\FGuo\Documents\work doucment\attachment\attachmentDB\20161005\originalFileFromAerial\DOCSVC_20161003.tar\DOCSVC_20161003\DOCSVC_20161003\INPATIENT\REQ_20150806-000024\Mamie Myers UR 8-6-15_2015-08-07-07.35.50.968.tif
Request;20150806-000024;34602;PACE;Inpatient;PACE;C:\Users\FGuo\Documents\work doucment\attachment\attachmentDB\20161005\originalFileFromAerial\DOCSVC_20161003.tar\DOCSVC_20161003\DOCSVC_20161003\INPATIENT\REQ_20150806-000024\Mamie Myers UR 8-7-15_2015-08-07-11.37.13.703.tif
Request;20150806-000024;34602;PACE;Inpatient;PACE;C:\Users\FGuo\Documents\work doucment\attachment\attachmentDB\20161005\originalFileFromAerial\DOCSVC_20161003.tar\DOCSVC_20161003\DOCSVC_20161003\INPATIENT\REQ_20150806-000024\Myers, Mamie_2015-08-06-11.42.40.406.tif
Request;20150806-000025;31875;PACE;Inpatient;PACE;C:\Users\FGuo\Documents\work doucment\attachment\attachmentDB\20161005\originalFileFromAerial\DOCSVC_20161003.tar\DOCSVC_20161003\DOCSVC_20161003\INPATIENT\REQ_20150806-000025\dolores taylor11_2015-09-11-16.56.03.890.tif
Request;20150806-000025;31875;PACE;Inpatient;PACE;C:\Users\FGuo\Documents\work doucment\attachment\attachmentDB\20161005\originalFileFromAerial\DOCSVC_20161003.tar\DOCSVC_20161003\DOCSVC_20161003\INPATIENT\REQ_20150806-000025\dolores taylor27_2015-08-27-18.08.27.424.tif
Request;20150806-000025;31875;PACE;Inpatient;PACE;C:\Users\FGuo\Documents\work doucment\attachment\attachmentDB\20161005\originalFileFromAerial\DOCSVC_20161003.tar\DOCSVC_20161003\DOCSVC_20161003\INPATIENT\REQ_20150806-000025\dolores taylor_2015-08-13-16.41.41.336.tif
Request;20150806-000032;27911;null;Inpatient;PACE;C:\Users\FGuo\Documents\work doucment\attachment\attachmentDB\20161005\originalFileFromAerial\DOCSVC_20161003.tar\DOCSVC_20161003\DOCSVC_20161003\INPATIENT\REQ_20150806-000032\27911 CALIXTE, FLAVIE ADMISSION_2015-08-06-13.01.45.34.tif
Request;20150806-000032;27911;null;Inpatient;PACE;C:\Users\FGuo\Documents\work doucment\attachment\attachmentDB\20161005\originalFileFromAerial\DOCSVC_20161003.tar\DOCSVC_20161003\DOCSVC_20161003\INPATIENT\REQ_20150806-000032\27911- CLAIXTE, FLAVIE CLINICAL REVIEW_2015-08-06-13.02.43.796.doc
Request;20150806-000032;27911;null;Inpatient;PACE;C:\Users\FGuo\Documents\work doucment\attachment\attachmentDB\20161005\originalFileFromAerial\DOCSVC_20161003.tar\DOCSVC_20161003\DOCSVC_20161003\INPATIENT\REQ_20150806-000032\FCalixe_2015-09-01-17.35.55.496.tif
Request;20150806-000032;27911;null;Inpatient;PACE;C:\Users\FGuo\Documents\work doucment\attachment\attachmentDB\20161005\originalFileFromAerial\DOCSVC_20161003.tar\DOCSVC_20161003\DOCSVC_20161003\INPATIENT\REQ_20150806-000032\FCalixte_2015-09-14-11.46.14.456.tif
Request;20150806-000035;51223;PACE;Inpatient;PACE;C:\Users\FGuo\Documents\work doucment\attachment\attachmentDB\20161005\originalFileFromAerial\DOCSVC_20161003.tar\DOCSVC_20161003\DOCSVC_20161003\INPATIENT\REQ_20150806-000035\Durosier Louis PACE Member Denial 8-7-15_2015-08-07-13.34.44.343.docx
Request;20150806-000035;51223;PACE;Inpatient;PACE;C:\Users\FGuo\Documents\work doucment\attachment\attachmentDB\20161005\originalFileFromAerial\DOCSVC_20161003.tar\DOCSVC_20161003\DOCSVC_20161003\INPATIENT\REQ_20150806-000035\Durosier Louis PACE Provider Denial 8-7-15_2015-08-07-13.35.10.463.docx
Request;20150806-000035;51223;PACE;Inpatient;PACE;C:\Users\FGuo\Documents\work doucment\attachment\attachmentDB\20161005\originalFileFromAerial\DOCSVC_20161003.tar\DOCSVC_20161003\DOCSVC_20161003\INPATIENT\REQ_20150806-000035\Louis Durosier PT Eval 8-6-15_2015-08-06-13.37.24.431.tif
Request;20150806-000036;97961;PACE;Inpatient;PACE;C:\Users\FGuo\Documents\work doucment\attachment\attachmentDB\20161005\originalFileFromAerial\DOCSVC_20161003.tar\DOCSVC_20161003\DOCSVC_20161003\INPATIENT\REQ_20150806-000036\edward hattie17_2015-08-19-14.14.24.635.tif
Request;20150806-000036;97961;PACE;Inpatient;PACE;C:\Users\FGuo\Documents\work doucment\attachment\attachmentDB\20161005\originalFileFromAerial\DOCSVC_20161003.tar\DOCSVC_20161003\DOCSVC_20161003\INPATIENT\REQ_20150806-000036\edward hattie_2015-08-14-18.29.11.720.tif
Request;20150806-000036;97961;PACE;Inpatient;PACE;C:\Users\FGuo\Documents\work doucment\attachment\attachmentDB\20161005\originalFileFromAerial\DOCSVC_20161003.tar\DOCSVC_20161003\DOCSVC_20161003\INPATIENT\REQ_20150806-000036\edwards,pri_2015-08-06-13.48.41.732.tif
Request;20150806-000045;86552;SELECT;Inpatient;SELECT;C:\Users\FGuo\Documents\work doucment\attachment\attachmentDB\20161005\originalFileFromAerial\DOCSVC_20161003.tar\DOCSVC_20161003\DOCSVC_20161003\INPATIENT\REQ_20150806-000045\garrison robert_2015-08-11-12.21.50.468.tif
Request;20150806-000045;86552;SELECT;Inpatient;SELECT;C:\Users\FGuo\Documents\work doucment\attachment\attachmentDB\20161005\originalFileFromAerial\DOCSVC_20161003.tar\DOCSVC_20161003\DOCSVC_20161003\INPATIENT\REQ_20150806-000045\Robert Garrison Hospice Request 8-6-15_2015-08-06-15.53.16.28.tif
Request;20150807-000001;85374;PACE;Inpatient;PACE;C:\Users\FGuo\Documents\work doucment\attachment\attachmentDB\20161005\originalFileFromAerial\DOCSVC_20161003.tar\DOCSVC_20161003\DOCSVC_20161003\INPATIENT\REQ_20150807-000001\Garcia GuillermoQueens Hospital Center 8-13-15_2015-08-13-12.11.28.527.docx
Request;20150807-000001;85374;PACE;Inpatient;PACE;C:\Users\FGuo\Documents\work doucment\attachment\attachmentDB\20161005\originalFileFromAerial\DOCSVC_20161003.tar\DOCSVC_20161003\DOCSVC_20161003\INPATIENT\REQ_20150807-000001\GARCIA, GUILLERMO - UR_2015-08-07-08.34.30.575.tif
Request;20150807-000001;85374;PACE;Inpatient;PACE;C:\Users\FGuo\Documents\work doucment\attachment\attachmentDB\20161005\originalFileFromAerial\DOCSVC_20161003.tar\DOCSVC_20161003\DOCSVC_20161003\INPATIENT\REQ_20150807-000001\Guillermo, Garcia Appeal Ack Letter_2015-10-02-14.17.17.825.docx
Request;20150807-000001;85374;PACE;Inpatient;PACE;C:\Users\FGuo\Documents\work doucment\attachment\attachmentDB\20161005\originalFileFromAerial\DOCSVC_20161003.tar\DOCSVC_20161003\DOCSVC_20161003\INPATIENT\REQ_20150807-000001\Guillermo, Garcia MR-1_2015-11-04-14.31.19.902.pdf
Request;20150807-000001;85374;PACE;Inpatient;PACE;C:\Users\FGuo\Documents\work doucment\attachment\attachmentDB\20161005\originalFileFromAerial\DOCSVC_20161003.tar\DOCSVC_20161003\DOCSVC_20161003\INPATIENT\REQ_20150807-000001\Guillermo, Garcia MR-2_2015-11-04-14.31.30.331.docx
Request;20150807-000001;85374;PACE;Inpatient;PACE;C:\Users\FGuo\Documents\work doucment\attachment\attachmentDB\20161005\originalFileFromAerial\DOCSVC_20161003.tar\DOCSVC_20161003\DOCSVC_20161003\INPATIENT\REQ_20150807-000001\Guillermo, Garcia MR-3_2015-11-04-14.31.43.51.pdf
Request;20150807-000002;31011;DIRECT;Inpatient;DIRECT;C:\Users\FGuo\Documents\work doucment\attachment\attachmentDB\20161005\originalFileFromAerial\DOCSVC_20161003.tar\DOCSVC_20161003\DOCSVC_20161003\INPATIENT\REQ_20150807-000002\galarza,betty_2015-08-12-09.18.29.448.tif
Request;20150807-000002;31011;DIRECT;Inpatient;DIRECT;C:\Users\FGuo\Documents\work doucment\attachment\attachmentDB\20161005\originalFileFromAerial\DOCSVC_20161003.tar\DOCSVC_20161003\DOCSVC_20161003\INPATIENT\REQ_20150807-000002\galarza812_2015-08-12-13.15.57.547.tif
Request;20150807-000003;26162;PACE;Inpatient;PACE;C:\Users\FGuo\Documents\work doucment\attachment\attachmentDB\20161005\originalFileFromAerial\DOCSVC_20161003.tar\DOCSVC_20161003\DOCSVC_20161003\INPATIENT\REQ_20150807-000003\Josephine Nelson UR 8-7-15_2015-08-10-10.40.45.820.tif
Request;20150807-000003;26162;PACE;Inpatient;PACE;C:\Users\FGuo\Documents\work doucment\attachment\attachmentDB\20161005\originalFileFromAerial\DOCSVC_20161003.tar\DOCSVC_20161003\DOCSVC_20161003\INPATIENT\REQ_20150807-000003\Nelson Josephine PACE IP Denial St. Johns Episcopal Hospital 8-11-15_2015-08-11-13.48.39.945.docx
Request;20150807-000003;26162;PACE;Inpatient;PACE;C:\Users\FGuo\Documents\work doucment\attachment\attachmentDB\20161005\originalFileFromAerial\DOCSVC_20161003.tar\DOCSVC_20161003\DOCSVC_20161003\INPATIENT\REQ_20150807-000003\Nelson, josephine 26162 CLINICAL REVIEW REQUEST FORM.doc 8 7 15_2015-08-07-09.23.22.992.doc
Request;20150807-000004;78049;PACE;Inpatient;PACE;C:\Users\FGuo\Documents\work doucment\attachment\attachmentDB\20161005\originalFileFromAerial\DOCSVC_20161003.tar\DOCSVC_20161003\DOCSVC_20161003\INPATIENT\REQ_20150807-000004\Ding Rong IP Denial Beth Israel Petri 8-26-15_2015-08-26-16.38.57.517.docx
Request;20150807-000004;78049;PACE;Inpatient;PACE;C:\Users\FGuo\Documents\work doucment\attachment\attachmentDB\20161005\originalFileFromAerial\DOCSVC_20161003.tar\DOCSVC_20161003\DOCSVC_20161003\INPATIENT\REQ_20150807-000004\Ding Rong IP Denial Beth Israel Petri 8-26-15_2015-08-27-15.09.15.917.docx
Request;20150807-000004;78049;PACE;Inpatient;PACE;C:\Users\FGuo\Documents\work doucment\attachment\attachmentDB\20161005\originalFileFromAerial\DOCSVC_20161003.tar\DOCSVC_20161003\DOCSVC_20161003\INPATIENT\REQ_20150807-000004\ding rong20_2015-08-20-17.08.43.715.tif
Request;20150807-000004;78049;PACE;Inpatient;PACE;C:\Users\FGuo\Documents\work doucment\attachment\attachmentDB\20161005\originalFileFromAerial\DOCSVC_20161003.tar\DOCSVC_20161003\DOCSVC_20161003\INPATIENT\REQ_20150807-000004\ding rongdc_2015-08-27-15.58.48.418.tif
Request;20150807-000004;78049;PACE;Inpatient;PACE;C:\Users\FGuo\Documents\work doucment\attachment\attachmentDB\20161005\originalFileFromAerial\DOCSVC_20161003.tar\DOCSVC_20161003\DOCSVC_20161003\INPATIENT\REQ_20150807-000004\ding rong_2015-08-07-17.02.33.332.tif
Request;20150807-000005;26194;PACE;Inpatient;PACE;C:\Users\FGuo\Documents\work doucment\attachment\attachmentDB\20161005\originalFileFromAerial\DOCSVC_20161003.tar\DOCSVC_20161003\DOCSVC_20161003\INPATIENT\REQ_20150807-000005\Junette Previl UR 8-7-15_2015-08-11-08.20.33.445.tif
Request;20150807-000005;26194;PACE;Inpatient;PACE;C:\Users\FGuo\Documents\work doucment\attachment\attachmentDB\20161005\originalFileFromAerial\DOCSVC_20161003.tar\DOCSVC_20161003\DOCSVC_20161003\INPATIENT\REQ_20150807-000005\Previl Junette_2015-08-14-12.28.39.992.tif
Request;20150807-000005;26194;PACE;Inpatient;PACE;C:\Users\FGuo\Documents\work doucment\attachment\attachmentDB\20161005\originalFileFromAerial\DOCSVC_20161003.tar\DOCSVC_20161003\DOCSVC_20161003\INPATIENT\REQ_20150807-000005\Previl, Junette 26194 CLINICAL REVIEW REQUEST FORM.doc 8 7 15_2015-08-07-09.40.22.481.doc
Request;20150807-000006;52296;DIRECT;Inpatient;DIRECT;C:\Users\FGuo\Documents\work doucment\attachment\attachmentDB\20161005\originalFileFromAerial\DOCSVC_20161003.tar\DOCSVC_20161003\DOCSVC_20161003\INPATIENT\REQ_20150807-000006\James Macklin UR 8-10-15_2015-08-11-10.44.51.21.tif
Request;20150807-000007;57627;DIRECT;Inpatient;DIRECT;C:\Users\FGuo\Documents\work doucment\attachment\attachmentDB\20161005\originalFileFromAerial\DOCSVC_20161003.tar\DOCSVC_20161003\DOCSVC_20161003\INPATIENT\REQ_20150807-000007\decoteau elizabeth_2015-08-28-13.43.27.295.tif
Request;20150807-000007;57627;DIRECT;Inpatient;DIRECT;C:\Users\FGuo\Documents\work doucment\attachment\attachmentDB\20161005\originalFileFromAerial\DOCSVC_20161003.tar\DOCSVC_20161003\DOCSVC_20161003\INPATIENT\REQ_20150807-000007\gasque,walter_2015-08-12-08.28.59.970.tif
Request;20150807-000008;34602;PACE;Inpatient;PACE;C:\Users\FGuo\Documents\work doucment\attachment\attachmentDB\20161005\originalFileFromAerial\DOCSVC_20161003.tar\DOCSVC_20161003\DOCSVC_20161003\INPATIENT\REQ_20150807-000008\Mamie Myers PRI 8-7-15_2015-08-07-11.29.54.620.tif
Request;20150807-000008;34602;PACE;Inpatient;PACE;C:\Users\FGuo\Documents\work doucment\attachment\attachmentDB\20161005\originalFileFromAerial\DOCSVC_20161003.tar\DOCSVC_20161003\DOCSVC_20161003\INPATIENT\REQ_20150807-000008\Myers, Mamie-(3rd Document) River Manor Corp, DBA River Manor Care   8.7.15_2015-08-07-14.02.26.334.docx
Request;20150807-000009;22152;PACE;Inpatient;PACE;C:\Users\FGuo\Documents\work doucment\attachment\attachmentDB\20161005\originalFileFromAerial\DOCSVC_20161003.tar\DOCSVC_20161003\DOCSVC_20161003\INPATIENT\REQ_20150807-000009\Appeal Acknowledgement _2015-12-11-10.36.13.477.docx
Request;20150807-000009;22152;PACE;Inpatient;PACE;C:\Users\FGuo\Documents\work doucment\attachment\attachmentDB\20161005\originalFileFromAerial\DOCSVC_20161003.tar\DOCSVC_20161003\DOCSVC_20161003\INPATIENT\REQ_20150807-000009\Iline Samuels UR 8-6-15_2015-08-11-08.42.12.531.tif
Request;20150807-000009;22152;PACE;Inpatient;PACE;C:\Users\FGuo\Documents\work doucment\attachment\attachmentDB\20161005\originalFileFromAerial\DOCSVC_20161003.tar\DOCSVC_20161003\DOCSVC_20161003\INPATIENT\REQ_20150807-000009\Medical Record part 1 (1)_2015-12-11-10.52.24.237.pdf
Request;20150807-000009;22152;PACE;Inpatient;PACE;C:\Users\FGuo\Documents\work doucment\attachment\attachmentDB\20161005\originalFileFromAerial\DOCSVC_20161003.tar\DOCSVC_20161003\DOCSVC_20161003\INPATIENT\REQ_20150807-000009\Medical Record part 2 (2)_2015-12-11-10.52.55.661.pdf
Request;20150807-000009;22152;PACE;Inpatient;PACE;C:\Users\FGuo\Documents\work doucment\attachment\attachmentDB\20161005\originalFileFromAerial\DOCSVC_20161003.tar\DOCSVC_20161003\DOCSVC_20161003\INPATIENT\REQ_20150807-000009\Samuels Iline Denial Beth Israel Medical Center 10-27-15_2015-10-27-16.42.40.469.docx
Request;20150807-000009;22152;PACE;Inpatient;PACE;C:\Users\FGuo\Documents\work doucment\attachment\attachmentDB\20161005\originalFileFromAerial\DOCSVC_20161003.tar\DOCSVC_20161003\DOCSVC_20161003\INPATIENT\REQ_20150807-000009\Samuels Iline Denial Beth Israel Medical Center 8-13-15_2015-08-13-12.37.52.723.docx
Request;20150807-000009;22152;PACE;Inpatient;PACE;C:\Users\FGuo\Documents\work doucment\attachment\attachmentDB\20161005\originalFileFromAerial\DOCSVC_20161003.tar\DOCSVC_20161003\DOCSVC_20161003\INPATIENT\REQ_20150807-000009\Samuels, Iline  Final Adverse Determination Appeal Unfavorable-Contracted Hospitals_2016-02-03-13.09.09.152.docx
Request;20150807-000009;22152;PACE;Inpatient;PACE;C:\Users\FGuo\Documents\work doucment\attachment\attachmentDB\20161005\originalFileFromAerial\DOCSVC_20161003.tar\DOCSVC_20161003\DOCSVC_20161003\INPATIENT\REQ_20150807-000009\Samuels, Iline A 22152 CLINICAL REVIEW REQUEST FORM.doc 8 7 15_2015-08-07-10.19.48.916.doc
Request;20150807-000011;51223;PACE;Inpatient;PACE;C:\Users\FGuo\Documents\work doucment\attachment\attachmentDB\20161005\originalFileFromAerial\DOCSVC_20161003.tar\DOCSVC_20161003\DOCSVC_20161003\INPATIENT\REQ_20150807-000011\DUROSIER LOUIS_2015-08-12-15.47.42.296.tif
Request;20150807-000011;51223;PACE;Inpatient;PACE;C:\Users\FGuo\Documents\work doucment\attachment\attachmentDB\20161005\originalFileFromAerial\DOCSVC_20161003.tar\DOCSVC_20161003\DOCSVC_20161003\INPATIENT\REQ_20150807-000011\Durosier, Louis J - Four Seasons Nursing Home - 8-11-15_2015-08-11-08.24.05.966.docx
Request;20150807-000011;51223;PACE;Inpatient;PACE;C:\Users\FGuo\Documents\work doucment\attachment\attachmentDB\20161005\originalFileFromAerial\DOCSVC_20161003.tar\DOCSVC_20161003\DOCSVC_20161003\INPATIENT\REQ_20150807-000011\louis durosierpri_2015-08-07-10.21.39.49.tif
Request;20150807-000012;21164;SELECT;Inpatient;SELECT;C:\Users\FGuo\Documents\work doucment\attachment\attachmentDB\20161005\originalFileFromAerial\DOCSVC_20161003.tar\DOCSVC_20161003\DOCSVC_20161003\INPATIENT\REQ_20150807-000012\Uriev, Zoia-(3rd Document) The Palm Gardens Center For Nursing And Rehab   8.7.15_2015-08-07-13.51.56.506.docx
Request;20150807-000012;21164;SELECT;Inpatient;SELECT;C:\Users\FGuo\Documents\work doucment\attachment\attachmentDB\20161005\originalFileFromAerial\DOCSVC_20161003.tar\DOCSVC_20161003\DOCSVC_20161003\INPATIENT\REQ_20150807-000012\Zoia Uriev PRI 8-7-15_2015-08-07-11.02.51.900.tif
Request;20150807-000013;20566;PACE;Inpatient;PACE;C:\Users\FGuo\Documents\work doucment\attachment\attachmentDB\20161005\originalFileFromAerial\DOCSVC_20161003.tar\DOCSVC_20161003\DOCSVC_20161003\INPATIENT\REQ_20150807-000013\Nelson, Sheila  -Montefiore Med Cen-Moses-Clinical Review Request Form 8-7-15_2015-08-07-10.39.53.757.docx
Request;20150807-000015;31440;DIRECT;Inpatient;DIRECT;C:\Users\FGuo\Documents\work doucment\attachment\attachmentDB\20161005\originalFileFromAerial\DOCSVC_20161003.tar\DOCSVC_20161003\DOCSVC_20161003\INPATIENT\REQ_20150807-000015\Thompson, Trevor  -Montefiore Med Cen-Moses-Clinical Review Request Form 8-7-15_2015-08-07-10.48.32.124.docx
Request;20150807-000019;77194;PACE;Inpatient;PACE;C:\Users\FGuo\Documents\work doucment\attachment\attachmentDB\20161005\originalFileFromAerial\DOCSVC_20161003.tar\DOCSVC_20161003\DOCSVC_20161003\INPATIENT\REQ_20150807-000019\porter,edith817_2015-08-24-15.51.07.292.tif
Request;20150807-000019;77194;PACE;Inpatient;PACE;C:\Users\FGuo\Documents\work doucment\attachment\attachmentDB\20161005\originalFileFromAerial\DOCSVC_20161003.tar\DOCSVC_20161003\DOCSVC_20161003\INPATIENT\REQ_20150807-000019\porter,edith_2015-08-12-13.46.41.980.tif
Request;20150807-000019;77194;PACE;Inpatient;PACE;C:\Users\FGuo\Documents\work doucment\attachment\attachmentDB\20161005\originalFileFromAerial\DOCSVC_20161003.tar\DOCSVC_20161003\DOCSVC_20161003\INPATIENT\REQ_20150807-000019\Porter,Edith_2015-08-17-15.32.12.181.tif
Request;20150807-000019;77194;PACE;Inpatient;PACE;C:\Users\FGuo\Documents\work doucment\attachment\attachmentDB\20161005\originalFileFromAerial\DOCSVC_20161003.tar\DOCSVC_20161003\DOCSVC_20161003\INPATIENT\REQ_20150807-000019\porterDC_2015-08-24-16.30.17.712.tif
Request;20150807-000025;37450;PACE;Inpatient;PACE;C:\Users\FGuo\Documents\work doucment\attachment\attachmentDB\20161005\originalFileFromAerial\DOCSVC_20161003.tar\DOCSVC_20161003\DOCSVC_20161003\INPATIENT\REQ_20150807-000025\Bassey Eyo UR 8-13-15_2015-08-13-15.29.53.86.tif
Request;20150807-000032;51223;PACE;Inpatient;PACE;C:\Users\FGuo\Documents\work doucment\attachment\attachmentDB\20161005\originalFileFromAerial\DOCSVC_20161003.tar\DOCSVC_20161003\DOCSVC_20161003\INPATIENT\REQ_20150807-000032\Durosier, Louis J - Four Seasons Nursing Home  8.11.15_2015-08-11-13.24.15.842.docx
Request;20150807-000032;51223;PACE;Inpatient;PACE;C:\Users\FGuo\Documents\work doucment\attachment\attachmentDB\20161005\originalFileFromAerial\DOCSVC_20161003.tar\DOCSVC_20161003\DOCSVC_20161003\INPATIENT\REQ_20150807-000032\Louis Durosier PRI 8-7-15_2015-08-07-12.06.22.362.tif
Request;20150807-000035;57390;PACE;Inpatient;PACE;C:\Users\FGuo\Documents\work doucment\attachment\attachmentDB\20161005\originalFileFromAerial\DOCSVC_20161003.tar\DOCSVC_20161003\DOCSVC_20161003\INPATIENT\REQ_20150807-000035\David, Vida E 57390 - Auth Approval Letter_2015-08-11-11.22.23.704.doc
Request;20150807-000035;57390;PACE;Inpatient;PACE;C:\Users\FGuo\Documents\work doucment\attachment\attachmentDB\20161005\originalFileFromAerial\DOCSVC_20161003.tar\DOCSVC_20161003\DOCSVC_20161003\INPATIENT\REQ_20150807-000035\davis vida_2015-08-07-12.32.11.478.tif
Request;20150807-000037;41022;SELECT;Inpatient;SELECT;C:\Users\FGuo\Documents\work doucment\attachment\attachmentDB\20161005\originalFileFromAerial\DOCSVC_20161003.tar\DOCSVC_20161003\DOCSVC_20161003\INPATIENT\REQ_20150807-000037\douglas leon_2015-08-07-16.08.52.286.tif
Request;20150807-000037;41022;SELECT;Inpatient;SELECT;C:\Users\FGuo\Documents\work doucment\attachment\attachmentDB\20161005\originalFileFromAerial\DOCSVC_20161003.tar\DOCSVC_20161003\DOCSVC_20161003\INPATIENT\REQ_20150807-000037\Douglas, Leon - River Manor Corp, DBA River Manor Care   11.5.15_2015-11-05-14.06.22.685.docx
Request;20150807-000037;41022;SELECT;Inpatient;SELECT;C:\Users\FGuo\Documents\work doucment\attachment\attachmentDB\20161005\originalFileFromAerial\DOCSVC_20161003.tar\DOCSVC_20161003\DOCSVC_20161003\INPATIENT\REQ_20150807-000037\Douglas, Leon - River Manor Corp.  - 11-5-15._2015-11-05-12.58.29.835.docx
Request;20150807-000037;41022;SELECT;Inpatient;SELECT;C:\Users\FGuo\Documents\work doucment\attachment\attachmentDB\20161005\originalFileFromAerial\DOCSVC_20161003.tar\DOCSVC_20161003\DOCSVC_20161003\INPATIENT\REQ_20150807-000037\Douglas, Leon 41022 Additional Clinicals_2015-09-18-11.00.23.952.pdf
Request;20150807-000037;41022;SELECT;Inpatient;SELECT;C:\Users\FGuo\Documents\work doucment\attachment\attachmentDB\20161005\originalFileFromAerial\DOCSVC_20161003.tar\DOCSVC_20161003\DOCSVC_20161003\INPATIENT\REQ_20150807-000037\_2015-11-05-12.58.17.843
Request;20150807-000044;75747;PACE;Inpatient;PACE;C:\Users\FGuo\Documents\work doucment\attachment\attachmentDB\20161005\originalFileFromAerial\DOCSVC_20161003.tar\DOCSVC_20161003\DOCSVC_20161003\INPATIENT\REQ_20150807-000044\McKenzie Cecil PACE - Lenox Hill Hospital 8-24-15_2015-08-24-13.38.14.413.docx
Request;20150807-000044;75747;PACE;Inpatient;PACE;C:\Users\FGuo\Documents\work doucment\attachment\attachmentDB\20161005\originalFileFromAerial\DOCSVC_20161003.tar\DOCSVC_20161003\DOCSVC_20161003\INPATIENT\REQ_20150807-000044\Mckenzie, Cecil 8-7-15_2015-08-07-12.58.27.346.tif
Request;20150807-000047;77621;PACE;Inpatient;PACE;C:\Users\FGuo\Documents\work doucment\attachment\attachmentDB\20161005\originalFileFromAerial\DOCSVC_20161003.tar\DOCSVC_20161003\DOCSVC_20161003\INPATIENT\REQ_20150807-000047\decoteau elizabeth_2015-08-19-12.46.29.913.tif
Request;20150807-000048;85332;PACE;Inpatient;PACE;C:\Users\FGuo\Documents\work doucment\attachment\attachmentDB\20161005\originalFileFromAerial\DOCSVC_20161003.tar\DOCSVC_20161003\DOCSVC_20161003\INPATIENT\REQ_20150807-000048\hazel herring_2015-09-01-16.56.25.322.tif
Request;20150807-000048;85332;PACE;Inpatient;PACE;C:\Users\FGuo\Documents\work doucment\attachment\attachmentDB\20161005\originalFileFromAerial\DOCSVC_20161003.tar\DOCSVC_20161003\DOCSVC_20161003\INPATIENT\REQ_20150807-000048\Herring, Hazel - Kings Harbour Multicare Center 9.17.15_2015-09-17-10.55.18.922.docx
Request;20150807-000053;54957;PACE;Inpatient;PACE;C:\Users\FGuo\Documents\work doucment\attachment\attachmentDB\20161005\originalFileFromAerial\DOCSVC_20161003.tar\DOCSVC_20161003\DOCSVC_20161003\INPATIENT\REQ_20150807-000053\Zambrano, Modesta--Greenwich Hospital  Clinical Review Request Form 8-7-15_2015-08-07-14.35.01.973.docx
Request;20150807-000053;54957;PACE;Inpatient;PACE;C:\Users\FGuo\Documents\work doucment\attachment\attachmentDB\20161005\originalFileFromAerial\DOCSVC_20161003.tar\DOCSVC_20161003\DOCSVC_20161003\INPATIENT\REQ_20150807-000053\zambrano,_2015-08-11-15.32.04.749.tif
Request;20150807-000055;56633;DIRECT;Inpatient;DIRECT;C:\Users\FGuo\Documents\work doucment\attachment\attachmentDB\20161005\originalFileFromAerial\DOCSVC_20161003.tar\DOCSVC_20161003\DOCSVC_20161003\INPATIENT\REQ_20150807-000055\Georgina Goyanes NH Note 8-6-15_2015-08-14-08.53.10.200.tif
Request;20150807-000055;56633;DIRECT;Inpatient;DIRECT;C:\Users\FGuo\Documents\work doucment\attachment\attachmentDB\20161005\originalFileFromAerial\DOCSVC_20161003.tar\DOCSVC_20161003\DOCSVC_20161003\INPATIENT\REQ_20150807-000055\Goyanes, Georginia - Margaret Teitz Nursing & Rehab Center  8.11.15_2015-08-11-12.05.19.449.docx
Request;20150807-000060;41022;SELECT;Inpatient;SELECT;C:\Users\FGuo\Documents\work doucment\attachment\attachmentDB\20161005\originalFileFromAerial\DOCSVC_20161003.tar\DOCSVC_20161003\DOCSVC_20161003\INPATIENT\REQ_20150807-000060\douglas leon_2015-08-07-16.05.08.708.tif
Request;20150807-000064;26442;PACE;Inpatient;PACE;C:\Users\FGuo\Documents\work doucment\attachment\attachmentDB\20161005\originalFileFromAerial\DOCSVC_20161003.tar\DOCSVC_20161003\DOCSVC_20161003\INPATIENT\REQ_20150807-000064\Evans, Sarah - (2nd Document Corrected Admit Dte)  Margaret Teitz Nursing Rehab Center  8.11.15_2015-08-11-12.15.46.150.docx
Request;20150807-000064;26442;PACE;Inpatient;PACE;C:\Users\FGuo\Documents\work doucment\attachment\attachmentDB\20161005\originalFileFromAerial\DOCSVC_20161003.tar\DOCSVC_20161003\DOCSVC_20161003\INPATIENT\REQ_20150807-000064\Evans, Sarah - Margaret Tietz Nursing And Rehab Center - 6.9.16_2016-06-09-09.08.39.268.pdf
Request;20150807-000064;26442;PACE;Inpatient;PACE;C:\Users\FGuo\Documents\work doucment\attachment\attachmentDB\20161005\originalFileFromAerial\DOCSVC_20161003.tar\DOCSVC_20161003\DOCSVC_20161003\INPATIENT\REQ_20150807-000064\Evans, Sarah(2nd Document) - Margaret Teitz Nursing & Rehab Center  8.10.15_2015-08-10-11.12.12.880.docx
Request;20150807-000064;26442;PACE;Inpatient;PACE;C:\Users\FGuo\Documents\work doucment\attachment\attachmentDB\20161005\originalFileFromAerial\DOCSVC_20161003.tar\DOCSVC_20161003\DOCSVC_20161003\INPATIENT\REQ_20150807-000064\Evans, Sarah(2nd Document) - Margaret Teitz Nursing & Rehab Center  8.10.15_2015-08-10-12.04.36.143.docx
Request;20150807-000064;26442;PACE;Inpatient;PACE;C:\Users\FGuo\Documents\work doucment\attachment\attachmentDB\20161005\originalFileFromAerial\DOCSVC_20161003.tar\DOCSVC_20161003\DOCSVC_20161003\INPATIENT\REQ_20150807-000064\MX-3140N_20150811_112816 (3).pdf- Confirmation_2015-08-11-13.00.40.913.pdf
Request;20150807-000069;42242;DIRECT;Inpatient;DIRECT;C:\Users\FGuo\Documents\work doucment\attachment\attachmentDB\20161005\originalFileFromAerial\DOCSVC_20161003.tar\DOCSVC_20161003\DOCSVC_20161003\INPATIENT\REQ_20150807-000069\RJ Perry, H 42242 8-7-15_2015-08-07-16.11.58.612.htm
Request;20150807-000076;29950;SELECT;Inpatient;SELECT;C:\Users\FGuo\Documents\work doucment\attachment\attachmentDB\20161005\originalFileFromAerial\DOCSVC_20161003.tar\DOCSVC_20161003\DOCSVC_20161003\INPATIENT\REQ_20150807-000076\Shapiro, Dmitriy 29950- Clinicals_2015-09-18-12.26.34.413.tif
Request;20150810-000001;57199;null;Inpatient;PACE;C:\Users\FGuo\Documents\work doucment\attachment\attachmentDB\20161005\originalFileFromAerial\DOCSVC_20161003.tar\DOCSVC_20161003\DOCSVC_20161003\INPATIENT\REQ_20150810-000001\Altagarcia Luna UR 8-10-15_2015-08-11-11.41.15.672.tif
Request;20150810-000001;57199;null;Inpatient;PACE;C:\Users\FGuo\Documents\work doucment\attachment\attachmentDB\20161005\originalFileFromAerial\DOCSVC_20161003.tar\DOCSVC_20161003\DOCSVC_20161003\INPATIENT\REQ_20150810-000001\ALuna_2015-08-25-13.21.43.584.tif
Request;20150810-000001;57199;null;Inpatient;PACE;C:\Users\FGuo\Documents\work doucment\attachment\attachmentDB\20161005\originalFileFromAerial\DOCSVC_20161003.tar\DOCSVC_20161003\DOCSVC_20161003\INPATIENT\REQ_20150810-000001\Luna, Altagracia 57199  CLINICAL REVIEW REQUEST FORM.doc 8 10 15_2015-08-10-11.22.22.624.doc
Request;20150810-000003;47354;PACE;Inpatient;PACE;C:\Users\FGuo\Documents\work doucment\attachment\attachmentDB\20161005\originalFileFromAerial\DOCSVC_20161003.tar\DOCSVC_20161003\DOCSVC_20161003\INPATIENT\REQ_20150810-000003\DIzquierdo 81315_2015-08-13-15.02.58.508.tif
Request;20150810-000003;47354;PACE;Inpatient;PACE;C:\Users\FGuo\Documents\work doucment\attachment\attachmentDB\20161005\originalFileFromAerial\DOCSVC_20161003.tar\DOCSVC_20161003\DOCSVC_20161003\INPATIENT\REQ_20150810-000003\Izquierdo Dulce MR1_2016-04-19-11.31.38.669.pdf
Request;20150810-000003;47354;PACE;Inpatient;PACE;C:\Users\FGuo\Documents\work doucment\attachment\attachmentDB\20161005\originalFileFromAerial\DOCSVC_20161003.tar\DOCSVC_20161003\DOCSVC_20161003\INPATIENT\REQ_20150810-000003\Izquierdo Dulce MR2_2016-04-19-11.35.42.719.pdf
Request;20150810-000003;47354;PACE;Inpatient;PACE;C:\Users\FGuo\Documents\work doucment\attachment\attachmentDB\20161005\originalFileFromAerial\DOCSVC_20161003.tar\DOCSVC_20161003\DOCSVC_20161003\INPATIENT\REQ_20150810-000003\Izquierdo Dulce MR3_2016-04-19-11.36.15.387.pdf
Request;20150810-000003;47354;PACE;Inpatient;PACE;C:\Users\FGuo\Documents\work doucment\attachment\attachmentDB\20161005\originalFileFromAerial\DOCSVC_20161003.tar\DOCSVC_20161003\DOCSVC_20161003\INPATIENT\REQ_20150810-000003\Izquierdo, Dulce 47354 CLINICAL REVIEW REQUEST FORM.doc 8 10 15_2015-08-10-09.38.33.680.doc
Request;20150810-000004;51950;DIRECT;Inpatient;DIRECT;C:\Users\FGuo\Documents\work doucment\attachment\attachmentDB\20161005\originalFileFromAerial\DOCSVC_20161003.tar\DOCSVC_20161003\DOCSVC_20161003\INPATIENT\REQ_20150810-000004\Montague Gertrude - Montefiore Medical Center 3-18-16_2016-03-23-11.35.53.728.pdf
Request;20150810-000004;51950;DIRECT;Inpatient;DIRECT;C:\Users\FGuo\Documents\work doucment\attachment\attachmentDB\20161005\originalFileFromAerial\DOCSVC_20161003.tar\DOCSVC_20161003\DOCSVC_20161003\INPATIENT\REQ_20150810-000004\montague,gertrude_2015-08-14-10.53.36.539.tif
Request;20150810-000005;39189;PACE;Inpatient;PACE;C:\Users\FGuo\Documents\work doucment\attachment\attachmentDB\20161005\originalFileFromAerial\DOCSVC_20161003.tar\DOCSVC_20161003\DOCSVC_20161003\INPATIENT\REQ_20150810-000005\Jamilla Khan UR 8-12-15_2015-08-13-08.24.32.657.tif
Request;20150810-000006;85320;PACE;Inpatient;PACE;C:\Users\FGuo\Documents\work doucment\attachment\attachmentDB\20161005\originalFileFromAerial\DOCSVC_20161003.tar\DOCSVC_20161003\DOCSVC_20161003\INPATIENT\REQ_20150810-000006\Choy Tsang UR 8-10-15_2015-08-11-11.19.59.322.tif
Request;20150810-000010;27752;PACE;Inpatient;PACE;C:\Users\FGuo\Documents\work doucment\attachment\attachmentDB\20161005\originalFileFromAerial\DOCSVC_20161003.tar\DOCSVC_20161003\DOCSVC_20161003\INPATIENT\REQ_20150810-000010\Hsishin Chao UR 8-10-15_2015-08-11-10.28.13.867.tif
Request;20150810-000017;21441;PACE;Inpatient;PACE;C:\Users\FGuo\Documents\work doucment\attachment\attachmentDB\20161005\originalFileFromAerial\DOCSVC_20161003.tar\DOCSVC_20161003\DOCSVC_20161003\INPATIENT\REQ_20150810-000017\Choimei Lee UR  8-10-15_2015-08-11-10.21.05.706.tif
Request;20150810-000017;21441;PACE;Inpatient;PACE;C:\Users\FGuo\Documents\work doucment\attachment\attachmentDB\20161005\originalFileFromAerial\DOCSVC_20161003.tar\DOCSVC_20161003\DOCSVC_20161003\INPATIENT\REQ_20150810-000017\Lee Choi Mei 21441  CLINICAL REVIEW REQUEST FORM.doc 8 10 15_2015-08-10-11.19.13.563.doc
Request;20150810-000023;42971;PACE;Inpatient;PACE;C:\Users\FGuo\Documents\work doucment\attachment\attachmentDB\20161005\originalFileFromAerial\DOCSVC_20161003.tar\DOCSVC_20161003\DOCSVC_20161003\INPATIENT\REQ_20150810-000023\Rivera Sergio PACE-NY Community Hospital Brooklyn 8-25-15_2015-08-25-11.15.08.852.docx
Request;20150810-000029;70139;PACE;Inpatient;PACE;C:\Users\FGuo\Documents\work doucment\attachment\attachmentDB\20161005\originalFileFromAerial\DOCSVC_20161003.tar\DOCSVC_20161003\DOCSVC_20161003\INPATIENT\REQ_20150810-000029\esther rosario10_2015-08-12-14.38.49.93.tif
Request;20150810-000029;70139;PACE;Inpatient;PACE;C:\Users\FGuo\Documents\work doucment\attachment\attachmentDB\20161005\originalFileFromAerial\DOCSVC_20161003.tar\DOCSVC_20161003\DOCSVC_20161003\INPATIENT\REQ_20150810-000029\Rosario Esther Appeal Ack Letter_2015-12-21-10.29.23.310.docx
Request;20150810-000029;70139;PACE;Inpatient;PACE;C:\Users\FGuo\Documents\work doucment\attachment\attachmentDB\20161005\originalFileFromAerial\DOCSVC_20161003.tar\DOCSVC_20161003\DOCSVC_20161003\INPATIENT\REQ_20150810-000029\Rosario Esther IP Denial NY Presbyterian 8-26-15_2015-08-26-17.01.23.22.docx
Request;20150810-000029;70139;PACE;Inpatient;PACE;C:\Users\FGuo\Documents\work doucment\attachment\attachmentDB\20161005\originalFileFromAerial\DOCSVC_20161003.tar\DOCSVC_20161003\DOCSVC_20161003\INPATIENT\REQ_20150810-000029\Rosario, Esther 70139  CLINICAL REVIEW REQUEST FORM.doc 8 10 15_2015-08-10-14.26.26.54.doc
Request;20150810-000032;32320;SELECT;Inpatient;PACE;C:\Users\FGuo\Documents\work doucment\attachment\attachmentDB\20161005\originalFileFromAerial\DOCSVC_20161003.tar\DOCSVC_20161003\DOCSVC_20161003\INPATIENT\REQ_20150810-000032\Lam, Pong S- New Franklin Rehabilitation & Health Care 8.12.15_2015-08-12-16.28.54.176.docx
Request;20150810-000044;75136;PACE;Inpatient;PACE;C:\Users\FGuo\Documents\work doucment\attachment\attachmentDB\20161005\originalFileFromAerial\DOCSVC_20161003.tar\DOCSVC_20161003\DOCSVC_20161003\INPATIENT\REQ_20150810-000044\LMatirnaya 8315_2015-08-17-12.57.01.195.tif
Request;20150810-000044;75136;PACE;Inpatient;PACE;C:\Users\FGuo\Documents\work doucment\attachment\attachmentDB\20161005\originalFileFromAerial\DOCSVC_20161003.tar\DOCSVC_20161003\DOCSVC_20161003\INPATIENT\REQ_20150810-000044\LMatirnaya_2015-08-17-12.53.53.425.tif
Request;20150810-000050;95125;PACE;Inpatient;PACE;C:\Users\FGuo\Documents\work doucment\attachment\attachmentDB\20161005\originalFileFromAerial\DOCSVC_20161003.tar\DOCSVC_20161003\DOCSVC_20161003\INPATIENT\REQ_20150810-000050\XMZhang_2015-09-28-17.24.19.173.tif
Request;20150810-000050;95125;PACE;Inpatient;PACE;C:\Users\FGuo\Documents\work doucment\attachment\attachmentDB\20161005\originalFileFromAerial\DOCSVC_20161003.tar\DOCSVC_20161003\DOCSVC_20161003\INPATIENT\REQ_20150810-000050\zhang xi mei1_2015-10-02-14.39.53.528.tif
Request;20150810-000050;95125;PACE;Inpatient;PACE;C:\Users\FGuo\Documents\work doucment\attachment\attachmentDB\20161005\originalFileFromAerial\DOCSVC_20161003.tar\DOCSVC_20161003\DOCSVC_20161003\INPATIENT\REQ_20150810-000050\zhang xi mei_2015-10-02-14.39.28.21.tif
Request;20150810-000050;95125;PACE;Inpatient;PACE;C:\Users\FGuo\Documents\work doucment\attachment\attachmentDB\20161005\originalFileFromAerial\DOCSVC_20161003.tar\DOCSVC_20161003\DOCSVC_20161003\INPATIENT\REQ_20150810-000050\Zhang, Xi Mei(2nd Document) New Franklin Rehabilitation & Health Care 10.9.15_2015-10-09-18.15.00.240.docx
Request;20150810-000050;95125;PACE;Inpatient;PACE;C:\Users\FGuo\Documents\work doucment\attachment\attachmentDB\20161005\originalFileFromAerial\DOCSVC_20161003.tar\DOCSVC_20161003\DOCSVC_20161003\INPATIENT\REQ_20150810-000050\Zhang, Xi Mei(2nd Document) New Franklin Rehabilitation & Health Care 8.11.15_2015-08-11-13.06.44.321.docx
Request;20150810-000053;57486;SELECT;Inpatient;SELECT;C:\Users\FGuo\Documents\work doucment\attachment\attachmentDB\20161005\originalFileFromAerial\DOCSVC_20161003.tar\DOCSVC_20161003\DOCSVC_20161003\INPATIENT\REQ_20150810-000053\Holliday, Ella- Regeis Care Center   8.13.15_2015-08-13-17.01.24.231.docx
Request;20150811-000002;41850;DIRECT;Inpatient;DIRECT;C:\Users\FGuo\Documents\work doucment\attachment\attachmentDB\20161005\originalFileFromAerial\DOCSVC_20161003.tar\DOCSVC_20161003\DOCSVC_20161003\INPATIENT\REQ_20150811-000002\Behnam Shokr Yacob DIRECT IP Denial North Shore University Hospital 8-17-15_2015-08-14-16.31.50.589.docx
Request;20150811-000002;41850;DIRECT;Inpatient;DIRECT;C:\Users\FGuo\Documents\work doucment\attachment\attachmentDB\20161005\originalFileFromAerial\DOCSVC_20161003.tar\DOCSVC_20161003\DOCSVC_20161003\INPATIENT\REQ_20150811-000002\Yacob Behnam UR 8-13-15_2015-08-14-07.30.16.6.tif
Request;20150811-000002;41850;DIRECT;Inpatient;DIRECT;C:\Users\FGuo\Documents\work doucment\attachment\attachmentDB\20161005\originalFileFromAerial\DOCSVC_20161003.tar\DOCSVC_20161003\DOCSVC_20161003\INPATIENT\REQ_20150811-000002\Yacob, Behnam Appeal Ack Letter_2015-10-01-12.38.04.603.docx
Request;20150811-000002;41850;DIRECT;Inpatient;DIRECT;C:\Users\FGuo\Documents\work doucment\attachment\attachmentDB\20161005\originalFileFromAerial\DOCSVC_20161003.tar\DOCSVC_20161003\DOCSVC_20161003\INPATIENT\REQ_20150811-000002\Yacob, Behnam Appeal ACK Letter_2015-10-23-11.55.31.772.docx
Request;20150811-000002;41850;DIRECT;Inpatient;DIRECT;C:\Users\FGuo\Documents\work doucment\attachment\attachmentDB\20161005\originalFileFromAerial\DOCSVC_20161003.tar\DOCSVC_20161003\DOCSVC_20161003\INPATIENT\REQ_20150811-000002\Yacob, Behnam DIRECT Favorable_2015-10-23-11.55.51.864.docx
Request;20150811-000003;38752;PACE;Inpatient;PACE;C:\Users\FGuo\Documents\work doucment\attachment\attachmentDB\20161005\originalFileFromAerial\DOCSVC_20161003.tar\DOCSVC_20161003\DOCSVC_20161003\INPATIENT\REQ_20150811-000003\Stewart Violet IP Denial Flushing Hospital Center 8-13-15_2015-08-13-11.46.52.420.docx
Request;20150811-000003;38752;PACE;Inpatient;PACE;C:\Users\FGuo\Documents\work doucment\attachment\attachmentDB\20161005\originalFileFromAerial\DOCSVC_20161003.tar\DOCSVC_20161003\DOCSVC_20161003\INPATIENT\REQ_20150811-000003\STEWART, VIOLET - UR_2015-08-11-09.55.04.854.tif
Request;20150811-000003;38752;PACE;Inpatient;PACE;C:\Users\FGuo\Documents\work doucment\attachment\attachmentDB\20161005\originalFileFromAerial\DOCSVC_20161003.tar\DOCSVC_20161003\DOCSVC_20161003\INPATIENT\REQ_20150811-000003\Violet Stewart UR 8-12-15_2015-08-12-13.34.02.224.tif
Request;20150811-000004;39172;PACE;Inpatient;PACE;C:\Users\FGuo\Documents\work doucment\attachment\attachmentDB\20161005\originalFileFromAerial\DOCSVC_20161003.tar\DOCSVC_20161003\DOCSVC_20161003\INPATIENT\REQ_20150811-000004\Medical Record_2015-11-04-11.35.27.588.pdf
Request;20150811-000004;39172;PACE;Inpatient;PACE;C:\Users\FGuo\Documents\work doucment\attachment\attachmentDB\20161005\originalFileFromAerial\DOCSVC_20161003.tar\DOCSVC_20161003\DOCSVC_20161003\INPATIENT\REQ_20150811-000004\PRA-2 Final Adverse Determination Appeal Unfavorable-Contracted Hospitals_2015-11-06-09.57.25.437.docx
Request;20150811-000004;39172;PACE;Inpatient;PACE;C:\Users\FGuo\Documents\work doucment\attachment\attachmentDB\20161005\originalFileFromAerial\DOCSVC_20161003.tar\DOCSVC_20161003\DOCSVC_20161003\INPATIENT\REQ_20150811-000004\Williams Ruby IP Denial Forest Hills Hosital 8-13-15_2015-08-13-12.59.12.971.docx
Request;20150811-000004;39172;PACE;Inpatient;PACE;C:\Users\FGuo\Documents\work doucment\attachment\attachmentDB\20161005\originalFileFromAerial\DOCSVC_20161003.tar\DOCSVC_20161003\DOCSVC_20161003\INPATIENT\REQ_20150811-000004\WILLIAMS, RUBY - UR_2015-08-11-13.24.55.73.tif
Request;20150811-000004;39172;PACE;Inpatient;PACE;C:\Users\FGuo\Documents\work doucment\attachment\attachmentDB\20161005\originalFileFromAerial\DOCSVC_20161003.tar\DOCSVC_20161003\DOCSVC_20161003\INPATIENT\REQ_20150811-000004\Williams, Ruby M 39172 CLINICAL REVIEW REQUEST FORM.doc 8 11 15_2015-08-11-10.44.02.301.doc
Request;20150811-000007;84861;FIDA;Inpatient;FIDA;C:\Users\FGuo\Documents\work doucment\attachment\attachmentDB\20161005\originalFileFromAerial\DOCSVC_20161003.tar\DOCSVC_20161003\DOCSVC_20161003\INPATIENT\REQ_20150811-000007\beras orlando dc_2015-08-24-10.54.26.464.tif
Request;20150811-000007;84861;FIDA;Inpatient;FIDA;C:\Users\FGuo\Documents\work doucment\attachment\attachmentDB\20161005\originalFileFromAerial\DOCSVC_20161003.tar\DOCSVC_20161003\DOCSVC_20161003\INPATIENT\REQ_20150811-000007\beras orlando_2015-08-11-16.37.28.118.tif
Request;20150811-000013;94573;PACE;Inpatient;PACE;C:\Users\FGuo\Documents\work doucment\attachment\attachmentDB\20161005\originalFileFromAerial\DOCSVC_20161003.tar\DOCSVC_20161003\DOCSVC_20161003\INPATIENT\REQ_20150811-000013\BA-FAX1_1508101724241330_2015-08-12-09.09.36.315.TIF
Request;20150811-000013;94573;PACE;Inpatient;PACE;C:\Users\FGuo\Documents\work doucment\attachment\attachmentDB\20161005\originalFileFromAerial\DOCSVC_20161003.tar\DOCSVC_20161003\DOCSVC_20161003\INPATIENT\REQ_20150811-000013\Fontanez, Petra_2015-08-11-11.23.45.917.tif
Request;20150811-000013;94573;PACE;Inpatient;PACE;C:\Users\FGuo\Documents\work doucment\attachment\attachmentDB\20161005\originalFileFromAerial\DOCSVC_20161003.tar\DOCSVC_20161003\DOCSVC_20161003\INPATIENT\REQ_20150811-000013\fontanez,petra_2015-08-12-08.41.11.867.tif
Request;20150811-000013;94573;PACE;Inpatient;PACE;C:\Users\FGuo\Documents\work doucment\attachment\attachmentDB\20161005\originalFileFromAerial\DOCSVC_20161003.tar\DOCSVC_20161003\DOCSVC_20161003\INPATIENT\REQ_20150811-000013\fontanezDC_2015-08-12-08.41.39.126.tif
Request;20150811-000014;35219;PACE;Inpatient;PACE;C:\Users\FGuo\Documents\work doucment\attachment\attachmentDB\20161005\originalFileFromAerial\DOCSVC_20161003.tar\DOCSVC_20161003\DOCSVC_20161003\INPATIENT\REQ_20150811-000014\Guerrero Juana PACE-Kingsbrook Jewish Medical Center 8-24-15_2015-08-24-14.24.29.289.docx
Request;20150811-000014;35219;PACE;Inpatient;PACE;C:\Users\FGuo\Documents\work doucment\attachment\attachmentDB\20161005\originalFileFromAerial\DOCSVC_20161003.tar\DOCSVC_20161003\DOCSVC_20161003\INPATIENT\REQ_20150811-000014\Guerrero, Juana I_2015-08-11-11.32.01.720.tif
Request;20150811-000016;97955;PACE;Inpatient;PACE;C:\Users\FGuo\Documents\work doucment\attachment\attachmentDB\20161005\originalFileFromAerial\DOCSVC_20161003.tar\DOCSVC_20161003\DOCSVC_20161003\INPATIENT\REQ_20150811-000016\Perez, Elisa_2015-08-11-11.39.59.194.tif
Request;20150811-000016;97955;PACE;Inpatient;PACE;C:\Users\FGuo\Documents\work doucment\attachment\attachmentDB\20161005\originalFileFromAerial\DOCSVC_20161003.tar\DOCSVC_20161003\DOCSVC_20161003\INPATIENT\REQ_20150811-000016\perez-hospice_2015-08-12-11.49.11.942.tif
Request;20150811-000017;37301;PACE;Inpatient;PACE;C:\Users\FGuo\Documents\work doucment\attachment\attachmentDB\20161005\originalFileFromAerial\DOCSVC_20161003.tar\DOCSVC_20161003\DOCSVC_20161003\INPATIENT\REQ_20150811-000017\Anlizer Christie UR 8-10-15_2015-08-12-07.50.44.971.tif
Request;20150811-000017;37301;PACE;Inpatient;PACE;C:\Users\FGuo\Documents\work doucment\attachment\attachmentDB\20161005\originalFileFromAerial\DOCSVC_20161003.tar\DOCSVC_20161003\DOCSVC_20161003\INPATIENT\REQ_20150811-000017\Christie, Anlizer_2015-08-11-11.44.02.773.tif
Request;20150811-000018;72903;PACE;Inpatient;PACE;C:\Users\FGuo\Documents\work doucment\attachment\attachmentDB\20161005\originalFileFromAerial\DOCSVC_20161003.tar\DOCSVC_20161003\DOCSVC_20161003\INPATIENT\REQ_20150811-000018\Maria Rodriguez UR 8-10-15_2015-08-11-12.21.44.821.tif
Request;20150811-000018;72903;PACE;Inpatient;PACE;C:\Users\FGuo\Documents\work doucment\attachment\attachmentDB\20161005\originalFileFromAerial\DOCSVC_20161003.tar\DOCSVC_20161003\DOCSVC_20161003\INPATIENT\REQ_20150811-000018\Medical Record _2015-11-30-13.00.14.384.pdf
Request;20150811-000018;72903;PACE;Inpatient;PACE;C:\Users\FGuo\Documents\work doucment\attachment\attachmentDB\20161005\originalFileFromAerial\DOCSVC_20161003.tar\DOCSVC_20161003\DOCSVC_20161003\INPATIENT\REQ_20150811-000018\PACE Final Adverse Determination- Appeal  Unfavorable Non-Contracted Hospitals_2015-12-02-11.32.31.169.docx
Request;20150811-000018;72903;PACE;Inpatient;PACE;C:\Users\FGuo\Documents\work doucment\attachment\attachmentDB\20161005\originalFileFromAerial\DOCSVC_20161003.tar\DOCSVC_20161003\DOCSVC_20161003\INPATIENT\REQ_20150811-000018\PRA-1  Appeal Acknowledgement _2015-10-14-13.23.49.757.docx
Request;20150811-000018;72903;PACE;Inpatient;PACE;C:\Users\FGuo\Documents\work doucment\attachment\attachmentDB\20161005\originalFileFromAerial\DOCSVC_20161003.tar\DOCSVC_20161003\DOCSVC_20161003\INPATIENT\REQ_20150811-000018\Rodriguez Maria IP Denial Brooklyn Hospital Center 8-12-15_2015-08-12-16.49.59.630.docx
Request;20150811-000018;72903;PACE;Inpatient;PACE;C:\Users\FGuo\Documents\work doucment\attachment\attachmentDB\20161005\originalFileFromAerial\DOCSVC_20161003.tar\DOCSVC_20161003\DOCSVC_20161003\INPATIENT\REQ_20150811-000018\Rodriguez Maria IP Denial Brooklyn Hospital Center 8-12-15_2015-08-14-10.37.05.193.docx
Request;20150811-000018;72903;PACE;Inpatient;PACE;C:\Users\FGuo\Documents\work doucment\attachment\attachmentDB\20161005\originalFileFromAerial\DOCSVC_20161003.tar\DOCSVC_20161003\DOCSVC_20161003\INPATIENT\REQ_20150811-000018\Rodriguez, Maria_2015-08-11-11.51.32.204.tif
Request;20150811-000022;55483;SELECT;Inpatient;SELECT;C:\Users\FGuo\Documents\work doucment\attachment\attachmentDB\20161005\originalFileFromAerial\DOCSVC_20161003.tar\DOCSVC_20161003\DOCSVC_20161003\INPATIENT\REQ_20150811-000022\betty crooms28_2015-08-28-15.51.15.754.tif
Request;20150811-000022;55483;SELECT;Inpatient;SELECT;C:\Users\FGuo\Documents\work doucment\attachment\attachmentDB\20161005\originalFileFromAerial\DOCSVC_20161003.tar\DOCSVC_20161003\DOCSVC_20161003\INPATIENT\REQ_20150811-000022\betty crooms_2015-08-11-12.36.43.8.tif
Request;20150811-000027;82934;SELECT;Inpatient;SELECT;C:\Users\FGuo\Documents\work doucment\attachment\attachmentDB\20161005\originalFileFromAerial\DOCSVC_20161003.tar\DOCSVC_20161003\DOCSVC_20161003\INPATIENT\REQ_20150811-000027\jean shields_2015-08-11-13.20.37.108.tif
Request;20150811-000027;82934;SELECT;Inpatient;SELECT;C:\Users\FGuo\Documents\work doucment\attachment\attachmentDB\20161005\originalFileFromAerial\DOCSVC_20161003.tar\DOCSVC_20161003\DOCSVC_20161003\INPATIENT\REQ_20150811-000027\JShields 81815_2015-09-16-13.58.22.906.tif
Request;20150811-000031;52122;PACE;Inpatient;PACE;C:\Users\FGuo\Documents\work doucment\attachment\attachmentDB\20161005\originalFileFromAerial\DOCSVC_20161003.tar\DOCSVC_20161003\DOCSVC_20161003\INPATIENT\REQ_20150811-000031\shaw,john811_2015-08-12-09.09.32.568.tif
Request;20150811-000032;57947;DIRECT;Inpatient;DIRECT;C:\Users\FGuo\Documents\work doucment\attachment\attachmentDB\20161005\originalFileFromAerial\DOCSVC_20161003.tar\DOCSVC_20161003\DOCSVC_20161003\INPATIENT\REQ_20150811-000032\smythe811_2015-08-12-09.50.15.156.tif
Request;20150811-000034;83519;PACE;Inpatient;PACE;C:\Users\FGuo\Documents\work doucment\attachment\attachmentDB\20161005\originalFileFromAerial\DOCSVC_20161003.tar\DOCSVC_20161003\DOCSVC_20161003\INPATIENT\REQ_20150811-000034\Detres, Carmen M - Kings Harbour Multicare Center 9.24.15_2015-09-24-16.17.47.362.docx
Request;20150811-000037;22152;PACE;Inpatient;PACE;C:\Users\FGuo\Documents\work doucment\attachment\attachmentDB\20161005\originalFileFromAerial\DOCSVC_20161003.tar\DOCSVC_20161003\DOCSVC_20161003\INPATIENT\REQ_20150811-000037\Iline Samuels PRI 8-10-15_2015-08-11-15.10.15.921.tif
Request;20150811-000037;22152;PACE;Inpatient;PACE;C:\Users\FGuo\Documents\work doucment\attachment\attachmentDB\20161005\originalFileFromAerial\DOCSVC_20161003.tar\DOCSVC_20161003\DOCSVC_20161003\INPATIENT\REQ_20150811-000037\Iline Samuels PRI 8-11-15_2015-08-11-15.09.58.472.tif
Request;20150811-000037;22152;PACE;Inpatient;PACE;C:\Users\FGuo\Documents\work doucment\attachment\attachmentDB\20161005\originalFileFromAerial\DOCSVC_20161003.tar\DOCSVC_20161003\DOCSVC_20161003\INPATIENT\REQ_20150811-000037\Samuels Iline PACE Member Denial 8-13-15_2015-08-13-10.53.37.379.docx
Request;20150811-000037;22152;PACE;Inpatient;PACE;C:\Users\FGuo\Documents\work doucment\attachment\attachmentDB\20161005\originalFileFromAerial\DOCSVC_20161003.tar\DOCSVC_20161003\DOCSVC_20161003\INPATIENT\REQ_20150811-000037\Samuels Iline PACE Member Denial 8-13-15_2015-08-14-11.22.33.308.docx
Request;20150811-000037;22152;PACE;Inpatient;PACE;C:\Users\FGuo\Documents\work doucment\attachment\attachmentDB\20161005\originalFileFromAerial\DOCSVC_20161003.tar\DOCSVC_20161003\DOCSVC_20161003\INPATIENT\REQ_20150811-000037\Samuels Iline PACE Provider Denial 8-13-15_2015-08-13-10.53.58.117.docx
Request;20150811-000037;22152;PACE;Inpatient;PACE;C:\Users\FGuo\Documents\work doucment\attachment\attachmentDB\20161005\originalFileFromAerial\DOCSVC_20161003.tar\DOCSVC_20161003\DOCSVC_20161003\INPATIENT\REQ_20150811-000037\Samuels Iline PACE Provider Denial 8-13-15_2015-08-14-11.18.13.910.docx
Request;20150811-000042;42971;PACE;Inpatient;PACE;C:\Users\FGuo\Documents\work doucment\attachment\attachmentDB\20161005\originalFileFromAerial\DOCSVC_20161003.tar\DOCSVC_20161003\DOCSVC_20161003\INPATIENT\REQ_20150811-000042\Rivera Sergio PACE Member Denial 8-13-15_2015-08-13-09.33.57.539.docx
Request;20150811-000042;42971;PACE;Inpatient;PACE;C:\Users\FGuo\Documents\work doucment\attachment\attachmentDB\20161005\originalFileFromAerial\DOCSVC_20161003.tar\DOCSVC_20161003\DOCSVC_20161003\INPATIENT\REQ_20150811-000042\Rivera Sergio PACE Member Denial 8-13-15_2015-08-14-11.09.39.918.docx
Request;20150811-000042;42971;PACE;Inpatient;PACE;C:\Users\FGuo\Documents\work doucment\attachment\attachmentDB\20161005\originalFileFromAerial\DOCSVC_20161003.tar\DOCSVC_20161003\DOCSVC_20161003\INPATIENT\REQ_20150811-000042\Rivera Sergio PACE Provider Denial 8-13-15_2015-08-13-09.34.12.289.docx
Request;20150811-000042;42971;PACE;Inpatient;PACE;C:\Users\FGuo\Documents\work doucment\attachment\attachmentDB\20161005\originalFileFromAerial\DOCSVC_20161003.tar\DOCSVC_20161003\DOCSVC_20161003\INPATIENT\REQ_20150811-000042\Rivera Sergio PACE Provider Denial 8-13-15_2015-08-14-11.10.09.334.docx
Request;20150811-000042;42971;PACE;Inpatient;PACE;C:\Users\FGuo\Documents\work doucment\attachment\attachmentDB\20161005\originalFileFromAerial\DOCSVC_20161003.tar\DOCSVC_20161003\DOCSVC_20161003\INPATIENT\REQ_20150811-000042\Sergio Rivera PRI 8-10-15_2015-08-11-15.31.43.15.tif
Request;20150811-000048;45058;SELECT;Inpatient;SELECT;C:\Users\FGuo\Documents\work doucment\attachment\attachmentDB\20161005\originalFileFromAerial\DOCSVC_20161003.tar\DOCSVC_20161003\DOCSVC_20161003\INPATIENT\REQ_20150811-000048\LEE, MI J - UR_2015-08-11-16.25.44.59.tif
Request;20150811-000049;42971;PACE;Inpatient;PACE;C:\Users\FGuo\Documents\work doucment\attachment\attachmentDB\20161005\originalFileFromAerial\DOCSVC_20161003.tar\DOCSVC_20161003\DOCSVC_20161003\INPATIENT\REQ_20150811-000049\Rivera, Sergio  - Shoreview Nursing Home  8.12.15_2015-08-12-14.14.59.957.docx
Request;20150811-000051;35940;SELECT;Inpatient;SELECT;C:\Users\FGuo\Documents\work doucment\attachment\attachmentDB\20161005\originalFileFromAerial\DOCSVC_20161003.tar\DOCSVC_20161003\DOCSVC_20161003\INPATIENT\REQ_20150811-000051\Shapiro, Anna - BORO PARK CENTER FOR REHABILITATION 9.14.16_2016-09-14-10.42.10.648.pdf
Request;20150811-000051;35940;SELECT;Inpatient;SELECT;C:\Users\FGuo\Documents\work doucment\attachment\attachmentDB\20161005\originalFileFromAerial\DOCSVC_20161003.tar\DOCSVC_20161003\DOCSVC_20161003\INPATIENT\REQ_20150811-000051\_2015-08-11-19.01.07.476
Request;20150812-000004;35394;SELECT;Inpatient;SELECT;C:\Users\FGuo\Documents\work doucment\attachment\attachmentDB\20161005\originalFileFromAerial\DOCSVC_20161003.tar\DOCSVC_20161003\DOCSVC_20161003\INPATIENT\REQ_20150812-000004\garwood_2015-09-04-10.38.23.264.tif
Request;20150812-000004;35394;SELECT;Inpatient;SELECT;C:\Users\FGuo\Documents\work doucment\attachment\attachmentDB\20161005\originalFileFromAerial\DOCSVC_20161003.tar\DOCSVC_20161003\DOCSVC_20161003\INPATIENT\REQ_20150812-000004\Norie Garwood SNF Notes 10-2-15_2015-10-02-07.40.06.417.tif
Request;20150812-000004;35394;SELECT;Inpatient;SELECT;C:\Users\FGuo\Documents\work doucment\attachment\attachmentDB\20161005\originalFileFromAerial\DOCSVC_20161003.tar\DOCSVC_20161003\DOCSVC_20161003\INPATIENT\REQ_20150812-000004\Norie Garwood SNF Notes 8-11-15_2015-08-11-17.04.31.870_2015-09-02-13.43.30.224.tif
Request;20150812-000005;27435;PACE;Inpatient;PACE;C:\Users\FGuo\Documents\work doucment\attachment\attachmentDB\20161005\originalFileFromAerial\DOCSVC_20161003.tar\DOCSVC_20161003\DOCSVC_20161003\INPATIENT\REQ_20150812-000005\EPorter_2015-08-17-10.38.29.234.tif
Request;20150812-000006;83822;PACE;Inpatient;PACE;C:\Users\FGuo\Documents\work doucment\attachment\attachmentDB\20161005\originalFileFromAerial\DOCSVC_20161003.tar\DOCSVC_20161003\DOCSVC_20161003\INPATIENT\REQ_20150812-000006\Conyers, Lucille IP Denial Queens Hospital Center 8-19-15_2015-08-25-11.57.52.575.docx
Request;20150812-000006;83822;PACE;Inpatient;PACE;C:\Users\FGuo\Documents\work doucment\attachment\attachmentDB\20161005\originalFileFromAerial\DOCSVC_20161003.tar\DOCSVC_20161003\DOCSVC_20161003\INPATIENT\REQ_20150812-000006\Lucille Conyers UR 8-14-15_2015-08-14-11.41.24.347.tif
Request;20150812-000013;84630;PACE;Inpatient;PACE;C:\Users\FGuo\Documents\work doucment\attachment\attachmentDB\20161005\originalFileFromAerial\DOCSVC_20161003.tar\DOCSVC_20161003\DOCSVC_20161003\INPATIENT\REQ_20150812-000013\doris levinson2_2015-09-02-13.44.15.547.tif
Request;20150812-000013;84630;PACE;Inpatient;PACE;C:\Users\FGuo\Documents\work doucment\attachment\attachmentDB\20161005\originalFileFromAerial\DOCSVC_20161003.tar\DOCSVC_20161003\DOCSVC_20161003\INPATIENT\REQ_20150812-000013\doris levinson_2015-08-12-15.20.01.265.tif
Request;20150812-000013;84630;PACE;Inpatient;PACE;C:\Users\FGuo\Documents\work doucment\attachment\attachmentDB\20161005\originalFileFromAerial\DOCSVC_20161003.tar\DOCSVC_20161003\DOCSVC_20161003\INPATIENT\REQ_20150812-000013\_2015-08-12-15.20.06.759
Request;20150812-000016;23763;null;Inpatient;PACE;C:\Users\FGuo\Documents\work doucment\attachment\attachmentDB\20161005\originalFileFromAerial\DOCSVC_20161003.tar\DOCSVC_20161003\DOCSVC_20161003\INPATIENT\REQ_20150812-000016\matos, Maria 23763 CLINICAL REVIEW REQUEST FORM.doc 8 12 15_2015-08-12-10.55.17.765.doc
Request;20150812-000016;23763;null;Inpatient;PACE;C:\Users\FGuo\Documents\work doucment\attachment\attachmentDB\20161005\originalFileFromAerial\DOCSVC_20161003.tar\DOCSVC_20161003\DOCSVC_20161003\INPATIENT\REQ_20150812-000016\MMatos_2015-08-13-13.30.30.179.tif
Request;20150812-000019;95133;PACE;Inpatient;PACE;C:\Users\FGuo\Documents\work doucment\attachment\attachmentDB\20161005\originalFileFromAerial\DOCSVC_20161003.tar\DOCSVC_20161003\DOCSVC_20161003\INPATIENT\REQ_20150812-000019\cheung heung dc_2015-08-17-11.31.34.398.tif
Request;20150812-000019;95133;PACE;Inpatient;PACE;C:\Users\FGuo\Documents\work doucment\attachment\attachmentDB\20161005\originalFileFromAerial\DOCSVC_20161003.tar\DOCSVC_20161003\DOCSVC_20161003\INPATIENT\REQ_20150812-000019\cheung heung_2015-08-14-09.47.02.561.tif
Request;20150812-000019;95133;PACE;Inpatient;PACE;C:\Users\FGuo\Documents\work doucment\attachment\attachmentDB\20161005\originalFileFromAerial\DOCSVC_20161003.tar\DOCSVC_20161003\DOCSVC_20161003\INPATIENT\REQ_20150812-000019\Cheung, Heung Kin 95133  CLINICAL REVIEW REQUEST FORM.doc 8 12 15_2015-08-12-11.13.33.424.doc
Request;20150812-000020;24029;PACE;Inpatient;PACE;C:\Users\FGuo\Documents\work doucment\attachment\attachmentDB\20161005\originalFileFromAerial\DOCSVC_20161003.tar\DOCSVC_20161003\DOCSVC_20161003\INPATIENT\REQ_20150812-000020\Galen Shauvo UR 8-11-15_2015-08-12-11.39.46.572.tif
Request;20150812-000022;22152;PACE;Inpatient;PACE;C:\Users\FGuo\Documents\work doucment\attachment\attachmentDB\20161005\originalFileFromAerial\DOCSVC_20161003.tar\DOCSVC_20161003\DOCSVC_20161003\INPATIENT\REQ_20150812-000022\Samuels, Iline A - Center For Nursing & Rehabilitation  8.12.15_2015-08-12-14.06.33.739.docx
Request;20150812-000024;94966;PACE;Inpatient;PACE;C:\Users\FGuo\Documents\work doucment\attachment\attachmentDB\20161005\originalFileFromAerial\DOCSVC_20161003.tar\DOCSVC_20161003\DOCSVC_20161003\INPATIENT\REQ_20150812-000024\Appeal Letter and MR_2015-11-05-12.59.29.308.TIF
Request;20150812-000024;94966;PACE;Inpatient;PACE;C:\Users\FGuo\Documents\work doucment\attachment\attachmentDB\20161005\originalFileFromAerial\DOCSVC_20161003.tar\DOCSVC_20161003\DOCSVC_20161003\INPATIENT\REQ_20150812-000024\McClellan Dorothy IP Denial Montefiore Mt Vernon Hospital  8-28-15_2015-08-28-10.32.00.991.docx
Request;20150812-000024;94966;PACE;Inpatient;PACE;C:\Users\FGuo\Documents\work doucment\attachment\attachmentDB\20161005\originalFileFromAerial\DOCSVC_20161003.tar\DOCSVC_20161003\DOCSVC_20161003\INPATIENT\REQ_20150812-000024\mcclellan,dorothy_2015-08-12-16.41.53.395.tif
Request;20150812-000024;94966;PACE;Inpatient;PACE;C:\Users\FGuo\Documents\work doucment\attachment\attachmentDB\20161005\originalFileFromAerial\DOCSVC_20161003.tar\DOCSVC_20161003\DOCSVC_20161003\INPATIENT\REQ_20150812-000024\mcclellan,dorothy_2015-08-13-10.35.34.441.tif
Request;20150812-000024;94966;PACE;Inpatient;PACE;C:\Users\FGuo\Documents\work doucment\attachment\attachmentDB\20161005\originalFileFromAerial\DOCSVC_20161003.tar\DOCSVC_20161003\DOCSVC_20161003\INPATIENT\REQ_20150812-000024\mcclellan,dorothy_2015-08-14-11.50.55.743.tif
Request;20150812-000030;58640;PACE;Inpatient;PACE;C:\Users\FGuo\Documents\work doucment\attachment\attachmentDB\20161005\originalFileFromAerial\DOCSVC_20161003.tar\DOCSVC_20161003\DOCSVC_20161003\INPATIENT\REQ_20150812-000030\MSoru_2015-08-13-13.11.04.937.tif
Request;20150812-000030;58640;PACE;Inpatient;PACE;C:\Users\FGuo\Documents\work doucment\attachment\attachmentDB\20161005\originalFileFromAerial\DOCSVC_20161003.tar\DOCSVC_20161003\DOCSVC_20161003\INPATIENT\REQ_20150812-000030\Soru Maria IP Denial Kingsbrook Jewish Med Center 8-13-15_2015-08-13-11.07.09.413.docx
Request;20150812-000030;58640;PACE;Inpatient;PACE;C:\Users\FGuo\Documents\work doucment\attachment\attachmentDB\20161005\originalFileFromAerial\DOCSVC_20161003.tar\DOCSVC_20161003\DOCSVC_20161003\INPATIENT\REQ_20150812-000030\Soru Maria IP Denial Kingsbrook Jewish Med Center 8-13-15_2015-08-14-10.42.29.79.docx
Request;20150812-000030;58640;PACE;Inpatient;PACE;C:\Users\FGuo\Documents\work doucment\attachment\attachmentDB\20161005\originalFileFromAerial\DOCSVC_20161003.tar\DOCSVC_20161003\DOCSVC_20161003\INPATIENT\REQ_20150812-000030\SORU, MARIA - UR_2015-08-12-12.00.56.249.tif
Request;20150812-000030;58640;PACE;Inpatient;PACE;C:\Users\FGuo\Documents\work doucment\attachment\attachmentDB\20161005\originalFileFromAerial\DOCSVC_20161003.tar\DOCSVC_20161003\DOCSVC_20161003\INPATIENT\REQ_20150812-000030\Soru, Maria MR DOS 08-17-2015 - 08-13-2015_2015-11-04-14.03.43.88.pdf
Request;20150812-000033;77563;PACE;Inpatient;PACE;C:\Users\FGuo\Documents\work doucment\attachment\attachmentDB\20161005\originalFileFromAerial\DOCSVC_20161003.tar\DOCSVC_20161003\DOCSVC_20161003\INPATIENT\REQ_20150812-000033\chung hong_2015-08-19-17.15.24.939.tif
Request;20150812-000040;85320;PACE;Inpatient;PACE;C:\Users\FGuo\Documents\work doucment\attachment\attachmentDB\20161005\originalFileFromAerial\DOCSVC_20161003.tar\DOCSVC_20161003\DOCSVC_20161003\INPATIENT\REQ_20150812-000040\Choy Tsang Hospice 8-10-15_2015-08-12-14.09.36.780.tif
Request;20150812-000040;85320;PACE;Inpatient;PACE;C:\Users\FGuo\Documents\work doucment\attachment\attachmentDB\20161005\originalFileFromAerial\DOCSVC_20161003.tar\DOCSVC_20161003\DOCSVC_20161003\INPATIENT\REQ_20150812-000040\Tsang, Choyying - Jacob Perlow Hospice Corporation  8.12.15_2015-08-12-15.06.28.796.docx
Request;20150812-000047;74026;PACE;Inpatient;PACE;C:\Users\FGuo\Documents\work doucment\attachment\attachmentDB\20161005\originalFileFromAerial\DOCSVC_20161003.tar\DOCSVC_20161003\DOCSVC_20161003\INPATIENT\REQ_20150812-000047\Jean, Marguerite_2015-08-12-14.46.03.494.tif
Request;20150812-000047;74026;PACE;Inpatient;PACE;C:\Users\FGuo\Documents\work doucment\attachment\attachmentDB\20161005\originalFileFromAerial\DOCSVC_20161003.tar\DOCSVC_20161003\DOCSVC_20161003\INPATIENT\REQ_20150812-000047\MJean 91415_2015-09-28-12.28.58.518.tif
Request;20150812-000047;74026;PACE;Inpatient;PACE;C:\Users\FGuo\Documents\work doucment\attachment\attachmentDB\20161005\originalFileFromAerial\DOCSVC_20161003.tar\DOCSVC_20161003\DOCSVC_20161003\INPATIENT\REQ_20150812-000047\MJean_2015-08-17-13.18.32.499.tif
Request;20150812-000055;56591;PACE;Inpatient;PACE;C:\Users\FGuo\Documents\work doucment\attachment\attachmentDB\20161005\originalFileFromAerial\DOCSVC_20161003.tar\DOCSVC_20161003\DOCSVC_20161003\INPATIENT\REQ_20150812-000055\Guevara, Paul - Portchester Nursing & Rehab Center  8.19.15_2015-08-19-13.45.13.270.docx
Request;20150812-000055;56591;PACE;Inpatient;PACE;C:\Users\FGuo\Documents\work doucment\attachment\attachmentDB\20161005\originalFileFromAerial\DOCSVC_20161003.tar\DOCSVC_20161003\DOCSVC_20161003\INPATIENT\REQ_20150812-000055\LTC cancellation - Paul Guevara_2015-08-12-15.59.29.400.txt
Request;20150812-000055;56591;PACE;Inpatient;PACE;C:\Users\FGuo\Documents\work doucment\attachment\attachmentDB\20161005\originalFileFromAerial\DOCSVC_20161003.tar\DOCSVC_20161003\DOCSVC_20161003\INPATIENT\REQ_20150812-000055\Paul Guevara ID # 56591- RESPITE_2015-08-12-16.00.04.430.txt
Request;20150812-000060;43159;DIRECT/SELECT LT;Inpatient;DIRECT/SELECT LT;C:\Users\FGuo\Documents\work doucment\attachment\attachmentDB\20161005\originalFileFromAerial\DOCSVC_20161003.tar\DOCSVC_20161003\DOCSVC_20161003\INPATIENT\REQ_20150812-000060\ALightburn update_2015-08-17-10.15.55.589.tif
Request;20150812-000060;43159;DIRECT/SELECT LT;Inpatient;DIRECT/SELECT LT;C:\Users\FGuo\Documents\work doucment\attachment\attachmentDB\20161005\originalFileFromAerial\DOCSVC_20161003.tar\DOCSVC_20161003\DOCSVC_20161003\INPATIENT\REQ_20150812-000060\ALightburn_2015-08-12-16.13.34.830.tif
Request;20150812-000060;43159;DIRECT/SELECT LT;Inpatient;DIRECT/SELECT LT;C:\Users\FGuo\Documents\work doucment\attachment\attachmentDB\20161005\originalFileFromAerial\DOCSVC_20161003.tar\DOCSVC_20161003\DOCSVC_20161003\INPATIENT\REQ_20150812-000060\Lightburn, Avril - Center For Nursing & Rehabilitation  8.17.15_2015-08-17-13.36.42.398.docx
Request;20150812-000068;97334;PACE;Inpatient;PACE;C:\Users\FGuo\Documents\work doucment\attachment\attachmentDB\20161005\originalFileFromAerial\DOCSVC_20161003.tar\DOCSVC_20161003\DOCSVC_20161003\INPATIENT\REQ_20150812-000068\alice robinson17_2015-08-19-13.24.38.989.tif
Request;20150812-000068;97334;PACE;Inpatient;PACE;C:\Users\FGuo\Documents\work doucment\attachment\attachmentDB\20161005\originalFileFromAerial\DOCSVC_20161003.tar\DOCSVC_20161003\DOCSVC_20161003\INPATIENT\REQ_20150812-000068\Robinson, Alice - The Riverside   8.14.15_2015-08-14-17.11.42.231.docx
Request;20150812-000069;44920;SELECT;Inpatient;SELECT;C:\Users\FGuo\Documents\work doucment\attachment\attachmentDB\20161005\originalFileFromAerial\DOCSVC_20161003.tar\DOCSVC_20161003\DOCSVC_20161003\INPATIENT\REQ_20150812-000069\mankovetskaya yevdokiya_2015-08-12-19.46.16.831.tif
Request;20150813-000002;95125;PACE;Inpatient;PACE;C:\Users\FGuo\Documents\work doucment\attachment\attachmentDB\20161005\originalFileFromAerial\DOCSVC_20161003.tar\DOCSVC_20161003\DOCSVC_20161003\INPATIENT\REQ_20150813-000002\Zhang, Xi Mei(2nd Document) New Franklin Rehabilitation & Health Care 8.11.15_2015-08-13-12.05.18.626.docx
Request;20150813-000003;78662;PACE;Inpatient;PACE;C:\Users\FGuo\Documents\work doucment\attachment\attachmentDB\20161005\originalFileFromAerial\DOCSVC_20161003.tar\DOCSVC_20161003\DOCSVC_20161003\INPATIENT\REQ_20150813-000003\Lopez, Maria 78662 CLINICAL REVIEW REQUEST FORM.doc 8 13 15_2015-08-13-09.39.04.29.doc
Request;20150813-000003;78662;PACE;Inpatient;PACE;C:\Users\FGuo\Documents\work doucment\attachment\attachmentDB\20161005\originalFileFromAerial\DOCSVC_20161003.tar\DOCSVC_20161003\DOCSVC_20161003\INPATIENT\REQ_20150813-000003\MLopez 81815_2015-08-18-13.16.49.246.tif
Request;20150813-000005;97334;PACE;Inpatient;PACE;C:\Users\FGuo\Documents\work doucment\attachment\attachmentDB\20161005\originalFileFromAerial\DOCSVC_20161003.tar\DOCSVC_20161003\DOCSVC_20161003\INPATIENT\REQ_20150813-000005\alice robinson13_2015-08-13-13.10.29.137.tif
Request;20150813-000005;97334;PACE;Inpatient;PACE;C:\Users\FGuo\Documents\work doucment\attachment\attachmentDB\20161005\originalFileFromAerial\DOCSVC_20161003.tar\DOCSVC_20161003\DOCSVC_20161003\INPATIENT\REQ_20150813-000005\ROBINSON, ALICE - ADMISSION_2015-08-13-09.53.32.727.tif
Request;20150813-000011;85728;PACE;Inpatient;PACE;C:\Users\FGuo\Documents\work doucment\attachment\attachmentDB\20161005\originalFileFromAerial\DOCSVC_20161003.tar\DOCSVC_20161003\DOCSVC_20161003\INPATIENT\REQ_20150813-000011\edith ortiz21_2015-08-21-17.48.11.503.tif
Request;20150813-000011;85728;PACE;Inpatient;PACE;C:\Users\FGuo\Documents\work doucment\attachment\attachmentDB\20161005\originalFileFromAerial\DOCSVC_20161003.tar\DOCSVC_20161003\DOCSVC_20161003\INPATIENT\REQ_20150813-000011\edith ortiz_2015-08-19-14.06.48.50.tif
Request;20150813-000011;85728;PACE;Inpatient;PACE;C:\Users\FGuo\Documents\work doucment\attachment\attachmentDB\20161005\originalFileFromAerial\DOCSVC_20161003.tar\DOCSVC_20161003\DOCSVC_20161003\INPATIENT\REQ_20150813-000011\Ortiz, Edith 85728 Auth Approval Letter_2015-08-20-12.29.34.320.doc
Request;20150813-000011;85728;PACE;Inpatient;PACE;C:\Users\FGuo\Documents\work doucment\attachment\attachmentDB\20161005\originalFileFromAerial\DOCSVC_20161003.tar\DOCSVC_20161003\DOCSVC_20161003\INPATIENT\REQ_20150813-000011\ortizPRI-PT_2015-08-13-10.27.08.468.tif
Request;20150813-000014;99221;PACE;Inpatient;PACE;C:\Users\FGuo\Documents\work doucment\attachment\attachmentDB\20161005\originalFileFromAerial\DOCSVC_20161003.tar\DOCSVC_20161003\DOCSVC_20161003\INPATIENT\REQ_20150813-000014\vazquez,juan_2015-08-17-12.13.55.124.tif
Request;20150813-000015;57883;null;Inpatient;DIRECT;C:\Users\FGuo\Documents\work doucment\attachment\attachmentDB\20161005\originalFileFromAerial\DOCSVC_20161003.tar\DOCSVC_20161003\DOCSVC_20161003\INPATIENT\REQ_20150813-000015\MPierre_2015-08-17-10.43.32.826.tif
Request;20150813-000016;23515;PACE;Inpatient;PACE;C:\Users\FGuo\Documents\work doucment\attachment\attachmentDB\20161005\originalFileFromAerial\DOCSVC_20161003.tar\DOCSVC_20161003\DOCSVC_20161003\INPATIENT\REQ_20150813-000016\anglaro,a_2015-08-13-13.53.21.612.tif
Request;20150813-000016;23515;PACE;Inpatient;PACE;C:\Users\FGuo\Documents\work doucment\attachment\attachmentDB\20161005\originalFileFromAerial\DOCSVC_20161003.tar\DOCSVC_20161003\DOCSVC_20161003\INPATIENT\REQ_20150813-000016\Anglero Amparo IP Denial Montefiore Medical Center 8-26-15_2015-08-26-17.09.37.431.docx
Request;20150813-000016;23515;PACE;Inpatient;PACE;C:\Users\FGuo\Documents\work doucment\attachment\attachmentDB\20161005\originalFileFromAerial\DOCSVC_20161003.tar\DOCSVC_20161003\DOCSVC_20161003\INPATIENT\REQ_20150813-000016\Final Adverse Determination Appeal Unfavorable-Contracted Hospitals_2016-01-04-17.51.32.364.docx
Request;20150813-000016;23515;PACE;Inpatient;PACE;C:\Users\FGuo\Documents\work doucment\attachment\attachmentDB\20161005\originalFileFromAerial\DOCSVC_20161003.tar\DOCSVC_20161003\DOCSVC_20161003\INPATIENT\REQ_20150813-000016\MX-5111N_20151208_121818_2015-12-08-13.01.45.617.pdf
Request;20150813-000016;23515;PACE;Inpatient;PACE;C:\Users\FGuo\Documents\work doucment\attachment\attachmentDB\20161005\originalFileFromAerial\DOCSVC_20161003.tar\DOCSVC_20161003\DOCSVC_20161003\INPATIENT\REQ_20150813-000016\PRA-1  Appeal Acknowledgement _2015-11-09-11.26.38.50.docx
Request;20150813-000018;22954;PACE;Inpatient;PACE;C:\Users\FGuo\Documents\work doucment\attachment\attachmentDB\20161005\originalFileFromAerial\DOCSVC_20161003.tar\DOCSVC_20161003\DOCSVC_20161003\INPATIENT\REQ_20150813-000018\AChristian_2015-08-20-16.51.46.759.tif
Request;20150813-000018;22954;PACE;Inpatient;PACE;C:\Users\FGuo\Documents\work doucment\attachment\attachmentDB\20161005\originalFileFromAerial\DOCSVC_20161003.tar\DOCSVC_20161003\DOCSVC_20161003\INPATIENT\REQ_20150813-000018\christian,andrea_2015-08-13-11.19.21.506.tif
Request;20150813-000019;40719;SELECT;Inpatient;SELECT;C:\Users\FGuo\Documents\work doucment\attachment\attachmentDB\20161005\originalFileFromAerial\DOCSVC_20161003.tar\DOCSVC_20161003\DOCSVC_20161003\INPATIENT\REQ_20150813-000019\Wedlake , Margaret(2nd Document)- Eger Health Care and Rehabilitation Center   8.13.15_2015-08-13-11.53.28.348.docx
Request;20150813-000019;40719;SELECT;Inpatient;SELECT;C:\Users\FGuo\Documents\work doucment\attachment\attachmentDB\20161005\originalFileFromAerial\DOCSVC_20161003.tar\DOCSVC_20161003\DOCSVC_20161003\INPATIENT\REQ_20150813-000019\Wedlake, Margaret 40719 Auth Approval Letter_2015-08-21-16.18.19.448.doc
Request;20150813-000020;86587;PACE;Inpatient;PACE;C:\Users\FGuo\Documents\work doucment\attachment\attachmentDB\20161005\originalFileFromAerial\DOCSVC_20161003.tar\DOCSVC_20161003\DOCSVC_20161003\INPATIENT\REQ_20150813-000020\Marrero Maria Hosp Message 7 21 15_2015-08-13-11.33.07.263.txt
Request;20150813-000020;86587;PACE;Inpatient;PACE;C:\Users\FGuo\Documents\work doucment\attachment\attachmentDB\20161005\originalFileFromAerial\DOCSVC_20161003.tar\DOCSVC_20161003\DOCSVC_20161003\INPATIENT\REQ_20150813-000020\Marrero Maria IP Denial  Lincoln Hospital 8-25-15_2015-08-25-09.32.56.431.docx
Request;20150813-000020;86587;PACE;Inpatient;PACE;C:\Users\FGuo\Documents\work doucment\attachment\attachmentDB\20161005\originalFileFromAerial\DOCSVC_20161003.tar\DOCSVC_20161003\DOCSVC_20161003\INPATIENT\REQ_20150813-000020\Marrero Maria IP Denial  Lincoln Hospital 8-25-15_2015-10-09-09.35.57.898.docx
Request;20150813-000020;86587;PACE;Inpatient;PACE;C:\Users\FGuo\Documents\work doucment\attachment\attachmentDB\20161005\originalFileFromAerial\DOCSVC_20161003.tar\DOCSVC_20161003\DOCSVC_20161003\INPATIENT\REQ_20150813-000020\Marrero, Maria 86587 CLINICAL REVIEW REQUEST FORM.doc 8 13 15_2015-08-13-11.38.59.29.doc
Request;20150813-000020;86587;PACE;Inpatient;PACE;C:\Users\FGuo\Documents\work doucment\attachment\attachmentDB\20161005\originalFileFromAerial\DOCSVC_20161003.tar\DOCSVC_20161003\DOCSVC_20161003\INPATIENT\REQ_20150813-000020\Marrero, Maria Appeal Acknowledgement Letter_2015-10-15-14.38.32.913.docx
Request;20150813-000020;86587;PACE;Inpatient;PACE;C:\Users\FGuo\Documents\work doucment\attachment\attachmentDB\20161005\originalFileFromAerial\DOCSVC_20161003.tar\DOCSVC_20161003\DOCSVC_20161003\INPATIENT\REQ_20150813-000020\Marrero, Maria MR DOS 07-21-2015_2015-12-07-15.25.52.426.pdf
Request;20150813-000020;86587;PACE;Inpatient;PACE;C:\Users\FGuo\Documents\work doucment\attachment\attachmentDB\20161005\originalFileFromAerial\DOCSVC_20161003.tar\DOCSVC_20161003\DOCSVC_20161003\INPATIENT\REQ_20150813-000020\Marrero, Maria WOL_2015-12-07-15.25.26.856.TIF
Request;20150813-000020;86587;PACE;Inpatient;PACE;C:\Users\FGuo\Documents\work doucment\attachment\attachmentDB\20161005\originalFileFromAerial\DOCSVC_20161003.tar\DOCSVC_20161003\DOCSVC_20161003\INPATIENT\REQ_20150813-000020\marrero,maria_2015-08-21-11.49.37.217.tif
Request;20150813-000022;51009;PACE;Inpatient;PACE;C:\Users\FGuo\Documents\work doucment\attachment\attachmentDB\20161005\originalFileFromAerial\DOCSVC_20161003.tar\DOCSVC_20161003\DOCSVC_20161003\INPATIENT\REQ_20150813-000022\Montalbo Celenia -Pelham Parkway Nursing Care & Rehab - 8-18-15_2015-08-18-11.55.03.16.docx
Request;20150813-000022;51009;PACE;Inpatient;PACE;C:\Users\FGuo\Documents\work doucment\attachment\attachmentDB\20161005\originalFileFromAerial\DOCSVC_20161003.tar\DOCSVC_20161003\DOCSVC_20161003\INPATIENT\REQ_20150813-000022\montalvoPRI_2015-08-13-11.43.53.738.tif
Request;20150813-000027;49313;PACE;Inpatient;PACE;C:\Users\FGuo\Documents\work doucment\attachment\attachmentDB\20161005\originalFileFromAerial\DOCSVC_20161003.tar\DOCSVC_20161003\DOCSVC_20161003\INPATIENT\REQ_20150813-000027\elsie worrel14_2015-08-14-18.18.59.603.tif
Request;20150813-000027;49313;PACE;Inpatient;PACE;C:\Users\FGuo\Documents\work doucment\attachment\attachmentDB\20161005\originalFileFromAerial\DOCSVC_20161003.tar\DOCSVC_20161003\DOCSVC_20161003\INPATIENT\REQ_20150813-000027\Worrell, Elsie(2nd Document) - River Manor Corp DBA River Manor Care  8.19.15_2015-08-19-15.09.21.362.docx
Request;20150813-000031;71351;PACE;Inpatient;PACE;C:\Users\FGuo\Documents\work doucment\attachment\attachmentDB\20161005\originalFileFromAerial\DOCSVC_20161003.tar\DOCSVC_20161003\DOCSVC_20161003\INPATIENT\REQ_20150813-000031\elizabeth graham10_2015-09-10-20.15.46.506.tif
Request;20150813-000031;71351;PACE;Inpatient;PACE;C:\Users\FGuo\Documents\work doucment\attachment\attachmentDB\20161005\originalFileFromAerial\DOCSVC_20161003.tar\DOCSVC_20161003\DOCSVC_20161003\INPATIENT\REQ_20150813-000031\elizabeth graham10_2015-09-10-20.16.42.885.tif
Request;20150813-000031;71351;PACE;Inpatient;PACE;C:\Users\FGuo\Documents\work doucment\attachment\attachmentDB\20161005\originalFileFromAerial\DOCSVC_20161003.tar\DOCSVC_20161003\DOCSVC_20161003\INPATIENT\REQ_20150813-000031\elizabeth graham27_2015-08-27-13.18.18.80.tif
Request;20150813-000031;71351;PACE;Inpatient;PACE;C:\Users\FGuo\Documents\work doucment\attachment\attachmentDB\20161005\originalFileFromAerial\DOCSVC_20161003.tar\DOCSVC_20161003\DOCSVC_20161003\INPATIENT\REQ_20150813-000031\elizabeth graham_2015-08-24-10.41.25.520.tif
Request;20150813-000031;71351;PACE;Inpatient;PACE;C:\Users\FGuo\Documents\work doucment\attachment\attachmentDB\20161005\originalFileFromAerial\DOCSVC_20161003.tar\DOCSVC_20161003\DOCSVC_20161003\INPATIENT\REQ_20150813-000031\graham,PRIPT_2015-08-13-12.10.37.334.tif
Request;20150813-000032;39928;SELECT;Inpatient;SELECT;C:\Users\FGuo\Documents\work doucment\attachment\attachmentDB\20161005\originalFileFromAerial\DOCSVC_20161003.tar\DOCSVC_20161003\DOCSVC_20161003\INPATIENT\REQ_20150813-000032\Langer, Regina - Menorah Home and Hospital - 8-18-15_2015-08-18-13.47.14.612.docx
Request;20150813-000033;39928;SELECT;Inpatient;SELECT;C:\Users\FGuo\Documents\work doucment\attachment\attachmentDB\20161005\originalFileFromAerial\DOCSVC_20161003.tar\DOCSVC_20161003\DOCSVC_20161003\INPATIENT\REQ_20150813-000033\Langer, Regina - Menorah Home and Hospital for the Aged & Infirmary - 8-18-15_2015-08-18-13.55.39.940.docx
Request;20150813-000034;52128;SELECT;Inpatient;SELECT;C:\Users\FGuo\Documents\work doucment\attachment\attachmentDB\20161005\originalFileFromAerial\DOCSVC_20161003.tar\DOCSVC_20161003\DOCSVC_20161003\INPATIENT\REQ_20150813-000034\James, Ada  -Four Seasons Nursing Home - 8-18-15_2015-08-18-14.17.50.342.docx
Request;20150813-000037;82927;DIRECT/SELECT LT;Inpatient;SELECT;C:\Users\FGuo\Documents\work doucment\attachment\attachmentDB\20161005\originalFileFromAerial\DOCSVC_20161003.tar\DOCSVC_20161003\DOCSVC_20161003\INPATIENT\REQ_20150813-000037\katherine george9_2015-09-15-12.50.43.926.tif
Request;20150813-000037;82927;DIRECT/SELECT LT;Inpatient;SELECT;C:\Users\FGuo\Documents\work doucment\attachment\attachmentDB\20161005\originalFileFromAerial\DOCSVC_20161003.tar\DOCSVC_20161003\DOCSVC_20161003\INPATIENT\REQ_20150813-000037\katherine washington4_2015-09-04-12.02.33.29.tif
Request;20150813-000037;82927;DIRECT/SELECT LT;Inpatient;SELECT;C:\Users\FGuo\Documents\work doucment\attachment\attachmentDB\20161005\originalFileFromAerial\DOCSVC_20161003.tar\DOCSVC_20161003\DOCSVC_20161003\INPATIENT\REQ_20150813-000037\katherine Washington_2015-08-13-16.08.44.810.tif
Request;20150813-000037;82927;DIRECT/SELECT LT;Inpatient;SELECT;C:\Users\FGuo\Documents\work doucment\attachment\attachmentDB\20161005\originalFileFromAerial\DOCSVC_20161003.tar\DOCSVC_20161003\DOCSVC_20161003\INPATIENT\REQ_20150813-000037\Washington, Katherine CO PAY Ltr---FAX NOTIFICATION OF SNF COPAY NEllman (3)_2015-08-14-13.38.15.231.doc
Request;20150813-000044;58640;PACE;Inpatient;PACE;C:\Users\FGuo\Documents\work doucment\attachment\attachmentDB\20161005\originalFileFromAerial\DOCSVC_20161003.tar\DOCSVC_20161003\DOCSVC_20161003\INPATIENT\REQ_20150813-000044\maria soru27_2015-10-27-13.32.13.831.tif
Request;20150813-000044;58640;PACE;Inpatient;PACE;C:\Users\FGuo\Documents\work doucment\attachment\attachmentDB\20161005\originalFileFromAerial\DOCSVC_20161003.tar\DOCSVC_20161003\DOCSVC_20161003\INPATIENT\REQ_20150813-000044\MSoru PRI_2015-08-13-16.15.08.509.tif
Request;20150813-000044;58640;PACE;Inpatient;PACE;C:\Users\FGuo\Documents\work doucment\attachment\attachmentDB\20161005\originalFileFromAerial\DOCSVC_20161003.tar\DOCSVC_20161003\DOCSVC_20161003\INPATIENT\REQ_20150813-000044\Soru MariaPACE Denial Elmhurst Care Cenrer 11-18-15_2015-11-18-09.24.49.925.pdf
Request;20150813-000044;58640;PACE;Inpatient;PACE;C:\Users\FGuo\Documents\work doucment\attachment\attachmentDB\20161005\originalFileFromAerial\DOCSVC_20161003.tar\DOCSVC_20161003\DOCSVC_20161003\INPATIENT\REQ_20150813-000044\Soru, Maria  - Elmhurst Care Center  - 8-18-15_2015-08-18-16.21.19.346.docx
Request;20150814-000001;27445;SELECT;Inpatient;SELECT;C:\Users\FGuo\Documents\work doucment\attachment\attachmentDB\20161005\originalFileFromAerial\DOCSVC_20161003.tar\DOCSVC_20161003\DOCSVC_20161003\INPATIENT\REQ_20150814-000001\Dorothy Searvant NH notes 8-20-15_2015-08-25-11.21.42.170.tif
Request;20150814-000001;27445;SELECT;Inpatient;SELECT;C:\Users\FGuo\Documents\work doucment\attachment\attachmentDB\20161005\originalFileFromAerial\DOCSVC_20161003.tar\DOCSVC_20161003\DOCSVC_20161003\INPATIENT\REQ_20150814-000001\Dorothy Searvant NH notes 8-27-15_2015-08-27-11.31.11.520.tif
Request;20150814-000001;27445;SELECT;Inpatient;SELECT;C:\Users\FGuo\Documents\work doucment\attachment\attachmentDB\20161005\originalFileFromAerial\DOCSVC_20161003.tar\DOCSVC_20161003\DOCSVC_20161003\INPATIENT\REQ_20150814-000001\Dorothy Searvant NH Notes 9-23-15_2015-09-25-11.55.03.405.tif
Request;20150814-000001;27445;SELECT;Inpatient;SELECT;C:\Users\FGuo\Documents\work doucment\attachment\attachmentDB\20161005\originalFileFromAerial\DOCSVC_20161003.tar\DOCSVC_20161003\DOCSVC_20161003\INPATIENT\REQ_20150814-000001\Dorothy Servant NH notes 9-10-15_2015-09-14-12.24.45.462.tif
Request;20150814-000001;27445;SELECT;Inpatient;SELECT;C:\Users\FGuo\Documents\work doucment\attachment\attachmentDB\20161005\originalFileFromAerial\DOCSVC_20161003.tar\DOCSVC_20161003\DOCSVC_20161003\INPATIENT\REQ_20150814-000001\Dorothy Servant NH notes 9-10-15_2015-09-15-07.56.40.526.tif
Request;20150814-000001;27445;SELECT;Inpatient;SELECT;C:\Users\FGuo\Documents\work doucment\attachment\attachmentDB\20161005\originalFileFromAerial\DOCSVC_20161003.tar\DOCSVC_20161003\DOCSVC_20161003\INPATIENT\REQ_20150814-000001\Dorothy Servant NH notes 9-14-15_2015-09-15-07.56.26.928.tif
Request;20150814-000001;27445;SELECT;Inpatient;SELECT;C:\Users\FGuo\Documents\work doucment\attachment\attachmentDB\20161005\originalFileFromAerial\DOCSVC_20161003.tar\DOCSVC_20161003\DOCSVC_20161003\INPATIENT\REQ_20150814-000001\Dorothy Servant NH notes 9-16-15_2015-09-21-11.08.02.768.tif
Request;20150814-000001;27445;SELECT;Inpatient;SELECT;C:\Users\FGuo\Documents\work doucment\attachment\attachmentDB\20161005\originalFileFromAerial\DOCSVC_20161003.tar\DOCSVC_20161003\DOCSVC_20161003\INPATIENT\REQ_20150814-000001\Dorothy Servant NH notes 9-3-15_2015-09-04-11.49.08.62.tif
Request;20150814-000001;27445;SELECT;Inpatient;SELECT;C:\Users\FGuo\Documents\work doucment\attachment\attachmentDB\20161005\originalFileFromAerial\DOCSVC_20161003.tar\DOCSVC_20161003\DOCSVC_20161003\INPATIENT\REQ_20150814-000001\Dorothy Servant PRI 8-13-15_2015-08-14-07.37.19.677.tif
Request;20150814-000001;27445;SELECT;Inpatient;SELECT;C:\Users\FGuo\Documents\work doucment\attachment\attachmentDB\20161005\originalFileFromAerial\DOCSVC_20161003.tar\DOCSVC_20161003\DOCSVC_20161003\INPATIENT\REQ_20150814-000001\dorothy servant08_2015-10-08-17.54.23.106.tif
Request;20150814-000001;27445;SELECT;Inpatient;SELECT;C:\Users\FGuo\Documents\work doucment\attachment\attachmentDB\20161005\originalFileFromAerial\DOCSVC_20161003.tar\DOCSVC_20161003\DOCSVC_20161003\INPATIENT\REQ_20150814-000001\dorothy servant_2015-09-30-23.54.29.964.tif
Request;20150814-000001;27445;SELECT;Inpatient;SELECT;C:\Users\FGuo\Documents\work doucment\attachment\attachmentDB\20161005\originalFileFromAerial\DOCSVC_20161003.tar\DOCSVC_20161003\DOCSVC_20161003\INPATIENT\REQ_20150814-000001\Searvant, Dorothy - Holliswood Care Center - 8-19-15_2015-08-19-14.02.21.257.docx
Request;20150814-000001;27445;SELECT;Inpatient;SELECT;C:\Users\FGuo\Documents\work doucment\attachment\attachmentDB\20161005\originalFileFromAerial\DOCSVC_20161003.tar\DOCSVC_20161003\DOCSVC_20161003\INPATIENT\REQ_20150814-000001\Searvant, Dorothy 27445 Auth Approval Letter_2015-08-27-11.43.07.154.doc
Request;20150814-000002;42510;PACE;Inpatient;PACE;C:\Users\FGuo\Documents\work doucment\attachment\attachmentDB\20161005\originalFileFromAerial\DOCSVC_20161003.tar\DOCSVC_20161003\DOCSVC_20161003\INPATIENT\REQ_20150814-000002\benjamin,alice_2015-08-14-08.22.21.986.tif
Request;20150814-000002;42510;PACE;Inpatient;PACE;C:\Users\FGuo\Documents\work doucment\attachment\attachmentDB\20161005\originalFileFromAerial\DOCSVC_20161003.tar\DOCSVC_20161003\DOCSVC_20161003\INPATIENT\REQ_20150814-000002\benjamin,PT_2015-08-14-08.28.51.661.tif
Request;20150814-000002;42510;PACE;Inpatient;PACE;C:\Users\FGuo\Documents\work doucment\attachment\attachmentDB\20161005\originalFileFromAerial\DOCSVC_20161003.tar\DOCSVC_20161003\DOCSVC_20161003\INPATIENT\REQ_20150814-000002\benjaminPT2_2015-08-14-08.29.22.729.tif
Request;20150814-000003;42510;PACE;Inpatient;PACE;C:\Users\FGuo\Documents\work doucment\attachment\attachmentDB\20161005\originalFileFromAerial\DOCSVC_20161003.tar\DOCSVC_20161003\DOCSVC_20161003\INPATIENT\REQ_20150814-000003\benjamin,PT_2015-08-14-08.36.26.361.tif
Request;20150814-000003;42510;PACE;Inpatient;PACE;C:\Users\FGuo\Documents\work doucment\attachment\attachmentDB\20161005\originalFileFromAerial\DOCSVC_20161003.tar\DOCSVC_20161003\DOCSVC_20161003\INPATIENT\REQ_20150814-000003\benjaminPT2_2015-08-14-08.36.52.163.tif
Request;20150814-000005;85298;PACE;Inpatient;PACE;C:\Users\FGuo\Documents\work doucment\attachment\attachmentDB\20161005\originalFileFromAerial\DOCSVC_20161003.tar\DOCSVC_20161003\DOCSVC_20161003\INPATIENT\REQ_20150814-000005\Chiu Shea Kwong IP Denial Lutheran Medical Center 8-27-15_2015-08-27-12.23.06.324.docx
Request;20150814-000005;85298;PACE;Inpatient;PACE;C:\Users\FGuo\Documents\work doucment\attachment\attachmentDB\20161005\originalFileFromAerial\DOCSVC_20161003.tar\DOCSVC_20161003\DOCSVC_20161003\INPATIENT\REQ_20150814-000005\Chiu Shea Wong IP Denial Lutheran Medical Center 8-27-15_2015-08-27-12.22.08.369.docx
Request;20150814-000005;85298;PACE;Inpatient;PACE;C:\Users\FGuo\Documents\work doucment\attachment\attachmentDB\20161005\originalFileFromAerial\DOCSVC_20161003.tar\DOCSVC_20161003\DOCSVC_20161003\INPATIENT\REQ_20150814-000005\SWChui_2015-08-24-10.55.43.996.tif
Request;20150814-000006;43910;DIRECT;Inpatient;DIRECT;C:\Users\FGuo\Documents\work doucment\attachment\attachmentDB\20161005\originalFileFromAerial\DOCSVC_20161003.tar\DOCSVC_20161003\DOCSVC_20161003\INPATIENT\REQ_20150814-000006\davis,margoUR_2015-08-18-08.41.35.151.tif
Request;20150814-000008;71351;PACE;Inpatient;PACE;C:\Users\FGuo\Documents\work doucment\attachment\attachmentDB\20161005\originalFileFromAerial\DOCSVC_20161003.tar\DOCSVC_20161003\DOCSVC_20161003\INPATIENT\REQ_20150814-000008\graham,UR_2015-08-14-09.25.07.959.tif
Request;20150814-000008;71351;PACE;Inpatient;PACE;C:\Users\FGuo\Documents\work doucment\attachment\attachmentDB\20161005\originalFileFromAerial\DOCSVC_20161003.tar\DOCSVC_20161003\DOCSVC_20161003\INPATIENT\REQ_20150814-000008\_2015-08-14-09.24.59.221
Request;20150814-000009;56282;FIDA;Inpatient;FIDA;C:\Users\FGuo\Documents\work doucment\attachment\attachmentDB\20161005\originalFileFromAerial\DOCSVC_20161003.tar\DOCSVC_20161003\DOCSVC_20161003\INPATIENT\REQ_20150814-000009\vazquez,aliciaUR_2015-08-18-14.46.57.344.tif
Request;20150814-000010;76734;DIRECT;Inpatient;DIRECT;C:\Users\FGuo\Documents\work doucment\attachment\attachmentDB\20161005\originalFileFromAerial\DOCSVC_20161003.tar\DOCSVC_20161003\DOCSVC_20161003\INPATIENT\REQ_20150814-000010\Bonilla, Rafael 76734   CLINICAL REVIEW REQUEST FORM.doc 8 14 15_2015-08-14-10.17.58.429.doc
Request;20150814-000010;76734;DIRECT;Inpatient;DIRECT;C:\Users\FGuo\Documents\work doucment\attachment\attachmentDB\20161005\originalFileFromAerial\DOCSVC_20161003.tar\DOCSVC_20161003\DOCSVC_20161003\INPATIENT\REQ_20150814-000010\bonilla,rafael_2015-08-19-09.32.56.492.tif
Request;20150814-000011;30707;SELECT;Inpatient;SELECT;C:\Users\FGuo\Documents\work doucment\attachment\attachmentDB\20161005\originalFileFromAerial\DOCSVC_20161003.tar\DOCSVC_20161003\DOCSVC_20161003\INPATIENT\REQ_20150814-000011\aromando818_2015-08-18-16.29.15.895.tif
Request;20150814-000011;30707;SELECT;Inpatient;SELECT;C:\Users\FGuo\Documents\work doucment\attachment\attachmentDB\20161005\originalFileFromAerial\DOCSVC_20161003.tar\DOCSVC_20161003\DOCSVC_20161003\INPATIENT\REQ_20150814-000011\aromando818_2015-08-19-09.04.36.702.tif
Request;20150814-000012;70136;PACE;Inpatient;PACE;C:\Users\FGuo\Documents\work doucment\attachment\attachmentDB\20161005\originalFileFromAerial\DOCSVC_20161003.tar\DOCSVC_20161003\DOCSVC_20161003\INPATIENT\REQ_20150814-000012\Figueroa Nicolas IP Denial Montefiore Medical Center 8-26-15_2015-08-26-17.16.18.550.docx
Request;20150814-000012;70136;PACE;Inpatient;PACE;C:\Users\FGuo\Documents\work doucment\attachment\attachmentDB\20161005\originalFileFromAerial\DOCSVC_20161003.tar\DOCSVC_20161003\DOCSVC_20161003\INPATIENT\REQ_20150814-000012\Figueroa, Nicolas 70136 CLINICAL REVIEW REQUEST FORM.doc 8 14 15_2015-08-14-10.13.15.438.doc
Request;20150814-000012;70136;PACE;Inpatient;PACE;C:\Users\FGuo\Documents\work doucment\attachment\attachmentDB\20161005\originalFileFromAerial\DOCSVC_20161003.tar\DOCSVC_20161003\DOCSVC_20161003\INPATIENT\REQ_20150814-000012\figueroa,nicholas_2015-08-14-10.24.59.824.tif
Request;20150814-000015;34600;PACE;Inpatient;PACE;C:\Users\FGuo\Documents\work doucment\attachment\attachmentDB\20161005\originalFileFromAerial\DOCSVC_20161003.tar\DOCSVC_20161003\DOCSVC_20161003\INPATIENT\REQ_20150814-000015\anthony lucevdc_2015-08-24-12.00.12.465.tif
Request;20150814-000015;34600;PACE;Inpatient;PACE;C:\Users\FGuo\Documents\work doucment\attachment\attachmentDB\20161005\originalFileFromAerial\DOCSVC_20161003.tar\DOCSVC_20161003\DOCSVC_20161003\INPATIENT\REQ_20150814-000015\Lucev, Anthony - EAST NECK NURSING & REHABILITATION CENTER 9.13.16_2016-09-13-12.16.35.32.pdf
Request;20150814-000015;34600;PACE;Inpatient;PACE;C:\Users\FGuo\Documents\work doucment\attachment\attachmentDB\20161005\originalFileFromAerial\DOCSVC_20161003.tar\DOCSVC_20161003\DOCSVC_20161003\INPATIENT\REQ_20150814-000015\Lucev, Anthony(2nd Document)-  East Neck Nursing & Rehab Center  8.25.15_2015-08-25-11.52.38.833.docx
Request;20150814-000019;75595;SELECT;Inpatient;SELECT;C:\Users\FGuo\Documents\work doucment\attachment\attachmentDB\20161005\originalFileFromAerial\DOCSVC_20161003.tar\DOCSVC_20161003\DOCSVC_20161003\INPATIENT\REQ_20150814-000019\Wilson, Rachel - The Jewish Home & Hospital For The Aged  8.18.15_2015-08-18-11.51.26.33.docx
Request;20150814-000019;75595;SELECT;Inpatient;SELECT;C:\Users\FGuo\Documents\work doucment\attachment\attachmentDB\20161005\originalFileFromAerial\DOCSVC_20161003.tar\DOCSVC_20161003\DOCSVC_20161003\INPATIENT\REQ_20150814-000019\Wilson, Rachel Select LTC 8 14_2015-08-14-10.44.56.714.tif
Request;20150814-000020;34174;PACE;Inpatient;PACE;C:\Users\FGuo\Documents\work doucment\attachment\attachmentDB\20161005\originalFileFromAerial\DOCSVC_20161003.tar\DOCSVC_20161003\DOCSVC_20161003\INPATIENT\REQ_20150814-000020\Estelle Herman UR 8-13-15_2015-08-14-10.51.59.220.tif
Request;20150814-000020;34174;PACE;Inpatient;PACE;C:\Users\FGuo\Documents\work doucment\attachment\attachmentDB\20161005\originalFileFromAerial\DOCSVC_20161003.tar\DOCSVC_20161003\DOCSVC_20161003\INPATIENT\REQ_20150814-000020\herman estelledc_2015-09-09-10.25.36.335.tif
Request;20150814-000020;34174;PACE;Inpatient;PACE;C:\Users\FGuo\Documents\work doucment\attachment\attachmentDB\20161005\originalFileFromAerial\DOCSVC_20161003.tar\DOCSVC_20161003\DOCSVC_20161003\INPATIENT\REQ_20150814-000020\Herman, Estelle(2nd Document)- Peninsula General Nursing Home  8.18.15_2015-08-18-12.01.33.91.docx
Request;20150814-000025;49067;PACE;Inpatient;PACE;C:\Users\FGuo\Documents\work doucment\attachment\attachmentDB\20161005\originalFileFromAerial\DOCSVC_20161003.tar\DOCSVC_20161003\DOCSVC_20161003\INPATIENT\REQ_20150814-000025\AViaud_2015-08-24-09.50.50.35.tif
Request;20150814-000025;49067;PACE;Inpatient;PACE;C:\Users\FGuo\Documents\work doucment\attachment\attachmentDB\20161005\originalFileFromAerial\DOCSVC_20161003.tar\DOCSVC_20161003\DOCSVC_20161003\INPATIENT\REQ_20150814-000025\Viaud, Annalia 49067 CLINICAL REVIEW REQUEST FORM.doc 8 14 15_2015-08-14-11.33.28.129.doc
Request;20150814-000026;57131;DIRECT;Inpatient;DIRECT;C:\Users\FGuo\Documents\work doucment\attachment\attachmentDB\20161005\originalFileFromAerial\DOCSVC_20161003.tar\DOCSVC_20161003\DOCSVC_20161003\INPATIENT\REQ_20150814-000026\Lyons Elizabeth DIRECT - NY Methodist Hospital 8-24-15_2015-08-24-14.59.53.540.docx
Request;20150814-000026;57131;DIRECT;Inpatient;DIRECT;C:\Users\FGuo\Documents\work doucment\attachment\attachmentDB\20161005\originalFileFromAerial\DOCSVC_20161003.tar\DOCSVC_20161003\DOCSVC_20161003\INPATIENT\REQ_20150814-000026\Lyons, Elizabeth  - New York Methodist Hospital  - 11-10-15._2015-11-10-16.05.41.316.docx
Request;20150814-000026;57131;DIRECT;Inpatient;DIRECT;C:\Users\FGuo\Documents\work doucment\attachment\attachmentDB\20161005\originalFileFromAerial\DOCSVC_20161003.tar\DOCSVC_20161003\DOCSVC_20161003\INPATIENT\REQ_20150814-000026\Lyons, Elizabeth 57131 CLINICAL REVIEW REQUEST FORM.doc 8 14 15_2015-08-14-11.51.03.433.doc
Request;20150814-000031;21441;PACE;Inpatient;PACE;C:\Users\FGuo\Documents\work doucment\attachment\attachmentDB\20161005\originalFileFromAerial\DOCSVC_20161003.tar\DOCSVC_20161003\DOCSVC_20161003\INPATIENT\REQ_20150814-000031\choi mei lee_2015-08-26-15.41.35.470.tif
Request;20150814-000031;21441;PACE;Inpatient;PACE;C:\Users\FGuo\Documents\work doucment\attachment\attachmentDB\20161005\originalFileFromAerial\DOCSVC_20161003.tar\DOCSVC_20161003\DOCSVC_20161003\INPATIENT\REQ_20150814-000031\Choimei Lee PRI 8-14-15_2015-08-14-12.38.00.587.tif
Request;20150814-000031;21441;PACE;Inpatient;PACE;C:\Users\FGuo\Documents\work doucment\attachment\attachmentDB\20161005\originalFileFromAerial\DOCSVC_20161003.tar\DOCSVC_20161003\DOCSVC_20161003\INPATIENT\REQ_20150814-000031\CMLee_2015-09-28-13.00.42.146.tif
Request;20150814-000031;21441;PACE;Inpatient;PACE;C:\Users\FGuo\Documents\work doucment\attachment\attachmentDB\20161005\originalFileFromAerial\DOCSVC_20161003.tar\DOCSVC_20161003\DOCSVC_20161003\INPATIENT\REQ_20150814-000031\lee choi mei17_2015-08-26-15.42.29.873.tif
Request;20150814-000031;21441;PACE;Inpatient;PACE;C:\Users\FGuo\Documents\work doucment\attachment\attachmentDB\20161005\originalFileFromAerial\DOCSVC_20161003.tar\DOCSVC_20161003\DOCSVC_20161003\INPATIENT\REQ_20150814-000031\lee choi mei1_2015-09-01-12.44.29.690.tif
Request;20150814-000031;21441;PACE;Inpatient;PACE;C:\Users\FGuo\Documents\work doucment\attachment\attachmentDB\20161005\originalFileFromAerial\DOCSVC_20161003.tar\DOCSVC_20161003\DOCSVC_20161003\INPATIENT\REQ_20150814-000031\lee choi mei8_2015-09-08-16.00.44.361.tif
Request;20150814-000031;21441;PACE;Inpatient;PACE;C:\Users\FGuo\Documents\work doucment\attachment\attachmentDB\20161005\originalFileFromAerial\DOCSVC_20161003.tar\DOCSVC_20161003\DOCSVC_20161003\INPATIENT\REQ_20150814-000031\Lee, Choi Mei - Union Plaza Nursing Home  8.19.15_2015-08-19-10.25.39.916.docx
Request;20150814-000035;74756;null;Inpatient;PACE;C:\Users\FGuo\Documents\work doucment\attachment\attachmentDB\20161005\originalFileFromAerial\DOCSVC_20161003.tar\DOCSVC_20161003\DOCSVC_20161003\INPATIENT\REQ_20150814-000035\Wong Yuet Kiu PACE Member Denial 8-26-15_2015-08-26-15.19.35.528.docx
Request;20150814-000035;74756;null;Inpatient;PACE;C:\Users\FGuo\Documents\work doucment\attachment\attachmentDB\20161005\originalFileFromAerial\DOCSVC_20161003.tar\DOCSVC_20161003\DOCSVC_20161003\INPATIENT\REQ_20150814-000035\Wong Yuet Kiu PACE Provider Denial 8-26-15_2015-08-26-15.19.49.725.docx
Request;20150814-000035;74756;null;Inpatient;PACE;C:\Users\FGuo\Documents\work doucment\attachment\attachmentDB\20161005\originalFileFromAerial\DOCSVC_20161003.tar\DOCSVC_20161003\DOCSVC_20161003\INPATIENT\REQ_20150814-000035\wong yuet_2015-08-14-13.16.04.755.tif
Request;20150814-000037;40365;PACE;Inpatient;PACE;C:\Users\FGuo\Documents\work doucment\attachment\attachmentDB\20161005\originalFileFromAerial\DOCSVC_20161003.tar\DOCSVC_20161003\DOCSVC_20161003\INPATIENT\REQ_20150814-000037\ahmed sultan 26_2015-08-27-10.30.32.67.tif
Request;20150814-000037;40365;PACE;Inpatient;PACE;C:\Users\FGuo\Documents\work doucment\attachment\attachmentDB\20161005\originalFileFromAerial\DOCSVC_20161003.tar\DOCSVC_20161003\DOCSVC_20161003\INPATIENT\REQ_20150814-000037\ahmed sultan25_2015-08-27-10.29.18.462.tif
Request;20150814-000037;40365;PACE;Inpatient;PACE;C:\Users\FGuo\Documents\work doucment\attachment\attachmentDB\20161005\originalFileFromAerial\DOCSVC_20161003.tar\DOCSVC_20161003\DOCSVC_20161003\INPATIENT\REQ_20150814-000037\Ahmed, Sultan(3rd Documentation)- Our Lady OF Consolation  8.19.15_2015-08-19-11.24.22.370.docx
Request;20150814-000037;40365;PACE;Inpatient;PACE;C:\Users\FGuo\Documents\work doucment\attachment\attachmentDB\20161005\originalFileFromAerial\DOCSVC_20161003.tar\DOCSVC_20161003\DOCSVC_20161003\INPATIENT\REQ_20150814-000037\Sultan Ahmed PRI 8-14-15_2015-08-14-13.43.56.82.tif
Request;20150814-000039;42510;PACE;Inpatient;PACE;C:\Users\FGuo\Documents\work doucment\attachment\attachmentDB\20161005\originalFileFromAerial\DOCSVC_20161003.tar\DOCSVC_20161003\DOCSVC_20161003\INPATIENT\REQ_20150814-000039\alice benjamin11_2015-09-11-16.58.56.780.tif
Request;20150814-000039;42510;PACE;Inpatient;PACE;C:\Users\FGuo\Documents\work doucment\attachment\attachmentDB\20161005\originalFileFromAerial\DOCSVC_20161003.tar\DOCSVC_20161003\DOCSVC_20161003\INPATIENT\REQ_20150814-000039\alice benjamin21_2015-08-24-09.37.25.174.tif
Request;20150814-000039;42510;PACE;Inpatient;PACE;C:\Users\FGuo\Documents\work doucment\attachment\attachmentDB\20161005\originalFileFromAerial\DOCSVC_20161003.tar\DOCSVC_20161003\DOCSVC_20161003\INPATIENT\REQ_20150814-000039\alice benjamin27_2015-08-27-18.12.37.18.tif
Request;20150814-000039;42510;PACE;Inpatient;PACE;C:\Users\FGuo\Documents\work doucment\attachment\attachmentDB\20161005\originalFileFromAerial\DOCSVC_20161003.tar\DOCSVC_20161003\DOCSVC_20161003\INPATIENT\REQ_20150814-000039\alice benjamin5_2015-10-07-12.33.35.360.tif
Request;20150814-000039;42510;PACE;Inpatient;PACE;C:\Users\FGuo\Documents\work doucment\attachment\attachmentDB\20161005\originalFileFromAerial\DOCSVC_20161003.tar\DOCSVC_20161003\DOCSVC_20161003\INPATIENT\REQ_20150814-000039\alice benjamin8_2015-09-08-16.29.25.430.tif
Request;20150814-000039;42510;PACE;Inpatient;PACE;C:\Users\FGuo\Documents\work doucment\attachment\attachmentDB\20161005\originalFileFromAerial\DOCSVC_20161003.tar\DOCSVC_20161003\DOCSVC_20161003\INPATIENT\REQ_20150814-000039\alice benjamin_2015-08-17-17.34.37.717.tif
Request;20150814-000039;42510;PACE;Inpatient;PACE;C:\Users\FGuo\Documents\work doucment\attachment\attachmentDB\20161005\originalFileFromAerial\DOCSVC_20161003.tar\DOCSVC_20161003\DOCSVC_20161003\INPATIENT\REQ_20150814-000039\benjamin,PT_2015-08-14-13.51.08.90.tif
Request;20150814-000039;42510;PACE;Inpatient;PACE;C:\Users\FGuo\Documents\work doucment\attachment\attachmentDB\20161005\originalFileFromAerial\DOCSVC_20161003.tar\DOCSVC_20161003\DOCSVC_20161003\INPATIENT\REQ_20150814-000039\benjaminPT2_2015-08-14-13.51.50.823.tif
Request;20150814-000041;22840;SELECT;Inpatient;SELECT;C:\Users\FGuo\Documents\work doucment\attachment\attachmentDB\20161005\originalFileFromAerial\DOCSVC_20161003.tar\DOCSVC_20161003\DOCSVC_20161003\INPATIENT\REQ_20150814-000041\anthony sheila_2015-08-14-14.01.39.610.tif
Request;20150814-000041;22840;SELECT;Inpatient;SELECT;C:\Users\FGuo\Documents\work doucment\attachment\attachmentDB\20161005\originalFileFromAerial\DOCSVC_20161003.tar\DOCSVC_20161003\DOCSVC_20161003\INPATIENT\REQ_20150814-000041\Anthony, Sheila - Dr. Susan Smith McKinney Nursing & Rehab. -  2.2.16_2016-02-02-11.40.03.599.pdf
Request;20150814-000041;22840;SELECT;Inpatient;SELECT;C:\Users\FGuo\Documents\work doucment\attachment\attachmentDB\20161005\originalFileFromAerial\DOCSVC_20161003.tar\DOCSVC_20161003\DOCSVC_20161003\INPATIENT\REQ_20150814-000041\Anthony, Sheila(3rd Document) -  Dr Susan Smith McKinney Nursing & Rehabilitation Center  8.19.15.docx_2015-08-19-13.03.23.288.doc
Request;20150814-000041;22840;SELECT;Inpatient;SELECT;C:\Users\FGuo\Documents\work doucment\attachment\attachmentDB\20161005\originalFileFromAerial\DOCSVC_20161003.tar\DOCSVC_20161003\DOCSVC_20161003\INPATIENT\REQ_20150814-000041\Anthony, Sheila(3rd Document) -  Dr Susan Smith McKinney Nursing & Rehabilitation Center  8.19.15_2015-08-19-11.44.51.699.docx
Request;20150814-000041;22840;SELECT;Inpatient;SELECT;C:\Users\FGuo\Documents\work doucment\attachment\attachmentDB\20161005\originalFileFromAerial\DOCSVC_20161003.tar\DOCSVC_20161003\DOCSVC_20161003\INPATIENT\REQ_20150814-000041\Anthony, Sheila(3rd Document) -  Dr Susan Smith McKinney Nursing & Rehabilitation Center  8.19.15_2015-08-19-11.45.31.524.docx
Request;20150814-000041;22840;SELECT;Inpatient;SELECT;C:\Users\FGuo\Documents\work doucment\attachment\attachmentDB\20161005\originalFileFromAerial\DOCSVC_20161003.tar\DOCSVC_20161003\DOCSVC_20161003\INPATIENT\REQ_20150814-000041\Anthony, Sheila(3rd Document) -  Dr Susan Smith McKinney Nursing & Rehabilitation Center  8.19.15_2015-08-19-11.48.10.271.docx
Request;20150814-000041;22840;SELECT;Inpatient;SELECT;C:\Users\FGuo\Documents\work doucment\attachment\attachmentDB\20161005\originalFileFromAerial\DOCSVC_20161003.tar\DOCSVC_20161003\DOCSVC_20161003\INPATIENT\REQ_20150814-000041\Anthony, Sheila(3rd Document) -  Dr Susan Smith McKinney Nursing & Rehabilitation Center  8.19.15_2015-08-19-11.54.50.89.docx
Request;20150814-000041;22840;SELECT;Inpatient;SELECT;C:\Users\FGuo\Documents\work doucment\attachment\attachmentDB\20161005\originalFileFromAerial\DOCSVC_20161003.tar\DOCSVC_20161003\DOCSVC_20161003\INPATIENT\REQ_20150814-000041\Anthony, Sheila(3rd Document) -  Dr Susan Smith McKinney Nursing & Rehabilitation Center  8.19.15_2015-08-19-11.55.30.721.docx
Request;20150814-000041;22840;SELECT;Inpatient;SELECT;C:\Users\FGuo\Documents\work doucment\attachment\attachmentDB\20161005\originalFileFromAerial\DOCSVC_20161003.tar\DOCSVC_20161003\DOCSVC_20161003\INPATIENT\REQ_20150814-000041\Anthony, Sheila(3rd Document) -  Dr Susan Smith McKinney Nursing & Rehabilitation Center  8.19.15_2015-08-19-13.01.13.398.docx
Request;20150814-000046;78788;SELECT;Inpatient;SELECT;C:\Users\FGuo\Documents\work doucment\attachment\attachmentDB\20161005\originalFileFromAerial\DOCSVC_20161003.tar\DOCSVC_20161003\DOCSVC_20161003\INPATIENT\REQ_20150814-000046\Tereza Skalamera NH Notes 8-10-15_2015-08-25-08.57.35.998.tif
Request;20150814-000046;78788;SELECT;Inpatient;SELECT;C:\Users\FGuo\Documents\work doucment\attachment\attachmentDB\20161005\originalFileFromAerial\DOCSVC_20161003.tar\DOCSVC_20161003\DOCSVC_20161003\INPATIENT\REQ_20150814-000046\Tereza Skalamera NH Notes 8-14-15_2015-08-25-08.57.53.62.tif
Request;20150814-000051;27609;SELECT;Inpatient;SELECT;C:\Users\FGuo\Documents\work doucment\attachment\attachmentDB\20161005\originalFileFromAerial\DOCSVC_20161003.tar\DOCSVC_20161003\DOCSVC_20161003\INPATIENT\REQ_20150814-000051\AHolder pri 81415_2015-08-14-16.22.51.107.tif
Request;20150814-000055;24029;PACE;Inpatient;PACE;C:\Users\FGuo\Documents\work doucment\attachment\attachmentDB\20161005\originalFileFromAerial\DOCSVC_20161003.tar\DOCSVC_20161003\DOCSVC_20161003\INPATIENT\REQ_20150814-000055\Galen Shauvo_2015-08-27-15.24.45.201.tif
Request;20150814-000055;24029;PACE;Inpatient;PACE;C:\Users\FGuo\Documents\work doucment\attachment\attachmentDB\20161005\originalFileFromAerial\DOCSVC_20161003.tar\DOCSVC_20161003\DOCSVC_20161003\INPATIENT\REQ_20150814-000055\GShauvo PRI_2015-08-17-16.16.53.934.tif
Request;20150814-000055;24029;PACE;Inpatient;PACE;C:\Users\FGuo\Documents\work doucment\attachment\attachmentDB\20161005\originalFileFromAerial\DOCSVC_20161003.tar\DOCSVC_20161003\DOCSVC_20161003\INPATIENT\REQ_20150814-000055\_2015-08-27-15.24.49.946
Request;20150814-000056;49164;SELECT;Inpatient;SELECT;C:\Users\FGuo\Documents\work doucment\attachment\attachmentDB\20161005\originalFileFromAerial\DOCSVC_20161003.tar\DOCSVC_20161003\DOCSVC_20161003\INPATIENT\REQ_20150814-000056\philippe simon_2015-08-14-17.57.52.800.tif
Request;20150814-000056;49164;SELECT;Inpatient;SELECT;C:\Users\FGuo\Documents\work doucment\attachment\attachmentDB\20161005\originalFileFromAerial\DOCSVC_20161003.tar\DOCSVC_20161003\DOCSVC_20161003\INPATIENT\REQ_20150814-000056\Simon, Philippe J- Jewish Home Lifecare Harry & Jeanette Weinberg Center  8.19.15_2015-08-19-14.45.12.885.docx
Request;20150814-000057;49164;SELECT;Inpatient;SELECT;C:\Users\FGuo\Documents\work doucment\attachment\attachmentDB\20161005\originalFileFromAerial\DOCSVC_20161003.tar\DOCSVC_20161003\DOCSVC_20161003\INPATIENT\REQ_20150814-000057\philippe simon1102_2015-11-18-18.01.04.456.tif
Request;20150814-000057;49164;SELECT;Inpatient;SELECT;C:\Users\FGuo\Documents\work doucment\attachment\attachmentDB\20161005\originalFileFromAerial\DOCSVC_20161003.tar\DOCSVC_20161003\DOCSVC_20161003\INPATIENT\REQ_20150814-000057\philippe simon_2015-08-14-18.04.32.145.tif
Request;20150814-000057;49164;SELECT;Inpatient;SELECT;C:\Users\FGuo\Documents\work doucment\attachment\attachmentDB\20161005\originalFileFromAerial\DOCSVC_20161003.tar\DOCSVC_20161003\DOCSVC_20161003\INPATIENT\REQ_20150814-000057\philippe simon_2015-08-14-18.05.15.104.tif
Request;20150814-000057;49164;SELECT;Inpatient;SELECT;C:\Users\FGuo\Documents\work doucment\attachment\attachmentDB\20161005\originalFileFromAerial\DOCSVC_20161003.tar\DOCSVC_20161003\DOCSVC_20161003\INPATIENT\REQ_20150814-000057\Simon, Philippe J-Jewish Community Council  8.19.15_2015-08-19-14.56.28.547.docx
Request;20150814-000057;49164;SELECT;Inpatient;SELECT;C:\Users\FGuo\Documents\work doucment\attachment\attachmentDB\20161005\originalFileFromAerial\DOCSVC_20161003.tar\DOCSVC_20161003\DOCSVC_20161003\INPATIENT\REQ_20150814-000057\Simon, Phillipe J - The Jewish Home & Hospital For Aged - 6.21.16_2016-06-21-10.50.33.416.pdf
Request;20150814-000057;49164;SELECT;Inpatient;SELECT;C:\Users\FGuo\Documents\work doucment\attachment\attachmentDB\20161005\originalFileFromAerial\DOCSVC_20161003.tar\DOCSVC_20161003\DOCSVC_20161003\INPATIENT\REQ_20150814-000057\Simon, Phillipe_2016-07-15-12.01.37.700.tif
Request;20150814-000057;49164;SELECT;Inpatient;SELECT;C:\Users\FGuo\Documents\work doucment\attachment\attachmentDB\20161005\originalFileFromAerial\DOCSVC_20161003.tar\DOCSVC_20161003\DOCSVC_20161003\INPATIENT\REQ_20150814-000057\_2015-08-14-18.04.40.665
Request;20150817-000005;20090;PACE;Inpatient;PACE;C:\Users\FGuo\Documents\work doucment\attachment\attachmentDB\20161005\originalFileFromAerial\DOCSVC_20161003.tar\DOCSVC_20161003\DOCSVC_20161003\INPATIENT\REQ_20150817-000005\PRA-1  Appeal Acknowledgement _2015-10-14-16.43.11.878.docx
Request;20150817-000005;20090;PACE;Inpatient;PACE;C:\Users\FGuo\Documents\work doucment\attachment\attachmentDB\20161005\originalFileFromAerial\DOCSVC_20161003.tar\DOCSVC_20161003\DOCSVC_20161003\INPATIENT\REQ_20150817-000005\Sims Wendy IP Denial Mt Sinai Hospital 8-27-15_2015-08-27-12.41.26.115.docx
Request;20150817-000005;20090;PACE;Inpatient;PACE;C:\Users\FGuo\Documents\work doucment\attachment\attachmentDB\20161005\originalFileFromAerial\DOCSVC_20161003.tar\DOCSVC_20161003\DOCSVC_20161003\INPATIENT\REQ_20150817-000005\Sims Wendy MR Part 2_2016-01-26-15.28.55.187.pdf
Request;20150817-000005;20090;PACE;Inpatient;PACE;C:\Users\FGuo\Documents\work doucment\attachment\attachmentDB\20161005\originalFileFromAerial\DOCSVC_20161003.tar\DOCSVC_20161003\DOCSVC_20161003\INPATIENT\REQ_20150817-000005\sims wendy18_2015-08-18-17.07.40.569.tif
Request;20150817-000005;20090;PACE;Inpatient;PACE;C:\Users\FGuo\Documents\work doucment\attachment\attachmentDB\20161005\originalFileFromAerial\DOCSVC_20161003.tar\DOCSVC_20161003\DOCSVC_20161003\INPATIENT\REQ_20150817-000005\sims wendydc_2015-09-01-13.23.20.345.tif
Request;20150817-000005;20090;PACE;Inpatient;PACE;C:\Users\FGuo\Documents\work doucment\attachment\attachmentDB\20161005\originalFileFromAerial\DOCSVC_20161003.tar\DOCSVC_20161003\DOCSVC_20161003\INPATIENT\REQ_20150817-000005\Sims, Wendy  Final Adverse Determination- Appeal  Unfavorable Non-Contracted Hospitals_2016-02-03-14.37.10.490.docx
Request;20150817-000005;20090;PACE;Inpatient;PACE;C:\Users\FGuo\Documents\work doucment\attachment\attachmentDB\20161005\originalFileFromAerial\DOCSVC_20161003.tar\DOCSVC_20161003\DOCSVC_20161003\INPATIENT\REQ_20150817-000005\Sims, Wendy MR Part 1_2016-01-26-15.28.34.66.pdf
Request;20150817-000005;20090;PACE;Inpatient;PACE;C:\Users\FGuo\Documents\work doucment\attachment\attachmentDB\20161005\originalFileFromAerial\DOCSVC_20161003.tar\DOCSVC_20161003\DOCSVC_20161003\INPATIENT\REQ_20150817-000005\Sims, Wendy MR Part 3_2016-01-26-15.29.15.269.pdf
Request;20150817-000012;42698;PACE;Inpatient;PACE;C:\Users\FGuo\Documents\work doucment\attachment\attachmentDB\20161005\originalFileFromAerial\DOCSVC_20161003.tar\DOCSVC_20161003\DOCSVC_20161003\INPATIENT\REQ_20150817-000012\Allen Gloria  IP Denial University Hospital of Brooklyn 8-27-15_2015-08-27-09.39.59.31.docx
Request;20150817-000012;42698;PACE;Inpatient;PACE;C:\Users\FGuo\Documents\work doucment\attachment\attachmentDB\20161005\originalFileFromAerial\DOCSVC_20161003.tar\DOCSVC_20161003\DOCSVC_20161003\INPATIENT\REQ_20150817-000012\GAllen_2015-08-24-09.15.54.70.tif
Request;20150817-000012;42698;PACE;Inpatient;PACE;C:\Users\FGuo\Documents\work doucment\attachment\attachmentDB\20161005\originalFileFromAerial\DOCSVC_20161003.tar\DOCSVC_20161003\DOCSVC_20161003\INPATIENT\REQ_20150817-000012\Medical Record_2015-11-10-16.04.02.990.pdf
Request;20150817-000012;42698;PACE;Inpatient;PACE;C:\Users\FGuo\Documents\work doucment\attachment\attachmentDB\20161005\originalFileFromAerial\DOCSVC_20161003.tar\DOCSVC_20161003\DOCSVC_20161003\INPATIENT\REQ_20150817-000012\PRA-1  Appeal Acknowledgement _2015-09-30-11.10.48.28.docx
Request;20150817-000012;42698;PACE;Inpatient;PACE;C:\Users\FGuo\Documents\work doucment\attachment\attachmentDB\20161005\originalFileFromAerial\DOCSVC_20161003.tar\DOCSVC_20161003\DOCSVC_20161003\INPATIENT\REQ_20150817-000012\PRNCA-1 PACE Final Adverse Determination- Appeal  Unfavorable Non-Contracted Hospitals_2015-11-13-12.07.35.956.docx
Request;20150817-000016;53512;DIRECT;Inpatient;DIRECT;C:\Users\FGuo\Documents\work doucment\attachment\attachmentDB\20161005\originalFileFromAerial\DOCSVC_20161003.tar\DOCSVC_20161003\DOCSVC_20161003\INPATIENT\REQ_20150817-000016\Appeal Acknowledgement _2016-01-19-16.12.27.61.docx
Request;20150817-000016;53512;DIRECT;Inpatient;DIRECT;C:\Users\FGuo\Documents\work doucment\attachment\attachmentDB\20161005\originalFileFromAerial\DOCSVC_20161003.tar\DOCSVC_20161003\DOCSVC_20161003\INPATIENT\REQ_20150817-000016\Appeal_2016-01-15-14.29.18.24.TIF
Request;20150817-000016;53512;DIRECT;Inpatient;DIRECT;C:\Users\FGuo\Documents\work doucment\attachment\attachmentDB\20161005\originalFileFromAerial\DOCSVC_20161003.tar\DOCSVC_20161003\DOCSVC_20161003\INPATIENT\REQ_20150817-000016\Audain, Frances Appeal Resolution-Favorable_2016-01-19-16.11.43.43.docx
Request;20150817-000016;53512;DIRECT;Inpatient;DIRECT;C:\Users\FGuo\Documents\work doucment\attachment\attachmentDB\20161005\originalFileFromAerial\DOCSVC_20161003.tar\DOCSVC_20161003\DOCSVC_20161003\INPATIENT\REQ_20150817-000016\PRA-1  Appeal Acknowledgement _2016-01-19-16.11.20.598.docx
Request;20150817-000016;53512;DIRECT;Inpatient;DIRECT;C:\Users\FGuo\Documents\work doucment\attachment\attachmentDB\20161005\originalFileFromAerial\DOCSVC_20161003.tar\DOCSVC_20161003\DOCSVC_20161003\INPATIENT\REQ_20150817-000016\Williams Jacqueline DIRECT IP Denial Mount Vernon Hospital 8-24-15_2015-08-24-15.34.46.506.docx
Request;20150817-000016;53512;DIRECT;Inpatient;DIRECT;C:\Users\FGuo\Documents\work doucment\attachment\attachmentDB\20161005\originalFileFromAerial\DOCSVC_20161003.tar\DOCSVC_20161003\DOCSVC_20161003\INPATIENT\REQ_20150817-000016\Williams, Jacqueline Appeal Resolution-Favorable_2016-01-19-16.12.55.105.docx
Request;20150817-000016;53512;DIRECT;Inpatient;DIRECT;C:\Users\FGuo\Documents\work doucment\attachment\attachmentDB\20161005\originalFileFromAerial\DOCSVC_20161003.tar\DOCSVC_20161003\DOCSVC_20161003\INPATIENT\REQ_20150817-000016\williams,jacqueline_2015-08-18-09.20.30.861.tif
Request;20150817-000018;22976;SELECT;Inpatient;SELECT;C:\Users\FGuo\Documents\work doucment\attachment\attachmentDB\20161005\originalFileFromAerial\DOCSVC_20161003.tar\DOCSVC_20161003\DOCSVC_20161003\INPATIENT\REQ_20150817-000018\Jinette Joseph NH Notes 8-13-15_2015-08-25-08.40.35.226.tif
Request;20150817-000018;22976;SELECT;Inpatient;SELECT;C:\Users\FGuo\Documents\work doucment\attachment\attachmentDB\20161005\originalFileFromAerial\DOCSVC_20161003.tar\DOCSVC_20161003\DOCSVC_20161003\INPATIENT\REQ_20150817-000018\Jinette Joseph NH Notes 8-7-15_2015-08-25-08.41.01.627.tif
Request;20150817-000018;22976;SELECT;Inpatient;SELECT;C:\Users\FGuo\Documents\work doucment\attachment\attachmentDB\20161005\originalFileFromAerial\DOCSVC_20161003.tar\DOCSVC_20161003\DOCSVC_20161003\INPATIENT\REQ_20150817-000018\Joseph, Jinette(2nd Document)- West Lawrence Care Center- 8.26.15_2015-08-26-10.56.12.474.docx
Request;20150817-000019;25695;SELECT;Inpatient;SELECT;C:\Users\FGuo\Documents\work doucment\attachment\attachmentDB\20161005\originalFileFromAerial\DOCSVC_20161003.tar\DOCSVC_20161003\DOCSVC_20161003\INPATIENT\REQ_20150817-000019\rodolpho rodriguez_2015-08-26-11.35.43.531.tif
Request;20150817-000020;39189;PACE;Inpatient;PACE;C:\Users\FGuo\Documents\work doucment\attachment\attachmentDB\20161005\originalFileFromAerial\DOCSVC_20161003.tar\DOCSVC_20161003\DOCSVC_20161003\INPATIENT\REQ_20150817-000020\Jamilla Khan UR 8-18-15_2015-08-18-15.06.07.429.tif
Request;20150817-000020;39189;PACE;Inpatient;PACE;C:\Users\FGuo\Documents\work doucment\attachment\attachmentDB\20161005\originalFileFromAerial\DOCSVC_20161003.tar\DOCSVC_20161003\DOCSVC_20161003\INPATIENT\REQ_20150817-000020\Khan Jamilla IP Denial NY Hospitla Queens 8-24-15_2015-08-24-14.38.54.644.docx
Request;20150817-000020;39189;PACE;Inpatient;PACE;C:\Users\FGuo\Documents\work doucment\attachment\attachmentDB\20161005\originalFileFromAerial\DOCSVC_20161003.tar\DOCSVC_20161003\DOCSVC_20161003\INPATIENT\REQ_20150817-000020\Khan, Jamilla_3850540_2015-09-23-15.49.52.510.pdf
Request;20150817-000020;39189;PACE;Inpatient;PACE;C:\Users\FGuo\Documents\work doucment\attachment\attachmentDB\20161005\originalFileFromAerial\DOCSVC_20161003.tar\DOCSVC_20161003\DOCSVC_20161003\INPATIENT\REQ_20150817-000020\PRA-1  Appeal Acknowledgement _2015-09-23-15.49.40.121.docx
Request;20150817-000020;39189;PACE;Inpatient;PACE;C:\Users\FGuo\Documents\work doucment\attachment\attachmentDB\20161005\originalFileFromAerial\DOCSVC_20161003.tar\DOCSVC_20161003\DOCSVC_20161003\INPATIENT\REQ_20150817-000020\PRNCA-1 PACE Final Adverse Determination- Appeal  Unfavorable Non-Contracted Hospitals_2015-11-13-16.39.02.547.docx
Request;20150817-000024;45058;SELECT;Inpatient;SELECT;C:\Users\FGuo\Documents\work doucment\attachment\attachmentDB\20161005\originalFileFromAerial\DOCSVC_20161003.tar\DOCSVC_20161003\DOCSVC_20161003\INPATIENT\REQ_20150817-000024\LEE, MI J - COPAY (2)_2015-11-19-16.01.26.686.tif
Request;20150817-000024;45058;SELECT;Inpatient;SELECT;C:\Users\FGuo\Documents\work doucment\attachment\attachmentDB\20161005\originalFileFromAerial\DOCSVC_20161003.tar\DOCSVC_20161003\DOCSVC_20161003\INPATIENT\REQ_20150817-000024\Lee, Mi J - FLUSHING MANOR NURSING HOME & REHABILITATION 8.17.16_2016-08-17-16.00.20.134.pdf
Request;20150817-000024;45058;SELECT;Inpatient;SELECT;C:\Users\FGuo\Documents\work doucment\attachment\attachmentDB\20161005\originalFileFromAerial\DOCSVC_20161003.tar\DOCSVC_20161003\DOCSVC_20161003\INPATIENT\REQ_20150817-000024\Lee, Mi J 45058 Auth Approval Letter_2015-08-20-10.09.46.655.doc
Request;20150817-000024;45058;SELECT;Inpatient;SELECT;C:\Users\FGuo\Documents\work doucment\attachment\attachmentDB\20161005\originalFileFromAerial\DOCSVC_20161003.tar\DOCSVC_20161003\DOCSVC_20161003\INPATIENT\REQ_20150817-000024\Lee, Mi J 45058 Auth Approval Letter_2015-09-01-14.37.09.18.doc
Request;20150817-000024;45058;SELECT;Inpatient;SELECT;C:\Users\FGuo\Documents\work doucment\attachment\attachmentDB\20161005\originalFileFromAerial\DOCSVC_20161003.tar\DOCSVC_20161003\DOCSVC_20161003\INPATIENT\REQ_20150817-000024\Mi Ji Lee NH Notes 9-10-15_2015-09-14-10.46.47.171.tif
Request;20150817-000024;45058;SELECT;Inpatient;SELECT;C:\Users\FGuo\Documents\work doucment\attachment\attachmentDB\20161005\originalFileFromAerial\DOCSVC_20161003.tar\DOCSVC_20161003\DOCSVC_20161003\INPATIENT\REQ_20150817-000024\MIji Lee NH Notes 8-31-15_2015-09-01-11.33.22.619.tif
Request;20150817-000024;45058;SELECT;Inpatient;SELECT;C:\Users\FGuo\Documents\work doucment\attachment\attachmentDB\20161005\originalFileFromAerial\DOCSVC_20161003.tar\DOCSVC_20161003\DOCSVC_20161003\INPATIENT\REQ_20150817-000024\MIji Lee NH Notes 9-28-15_2015-09-29-11.09.51.39.tif
Request;20150817-000024;45058;SELECT;Inpatient;SELECT;C:\Users\FGuo\Documents\work doucment\attachment\attachmentDB\20161005\originalFileFromAerial\DOCSVC_20161003.tar\DOCSVC_20161003\DOCSVC_20161003\INPATIENT\REQ_20150817-000024\MIji Lee PRI 8-14-15_2015-08-17-12.03.15.993.tif
Request;20150817-000028;58342;PACE;Inpatient;PACE;C:\Users\FGuo\Documents\work doucment\attachment\attachmentDB\20161005\originalFileFromAerial\DOCSVC_20161003.tar\DOCSVC_20161003\DOCSVC_20161003\INPATIENT\REQ_20150817-000028\Harris Joan IP Denial Kingsbrook Jewish Med Center 8-25-15_2015-08-25-10.40.54.717.docx
Request;20150817-000028;58342;PACE;Inpatient;PACE;C:\Users\FGuo\Documents\work doucment\attachment\attachmentDB\20161005\originalFileFromAerial\DOCSVC_20161003.tar\DOCSVC_20161003\DOCSVC_20161003\INPATIENT\REQ_20150817-000028\Harris, Joan_2015-08-17-12.02.56.429.tif
Request;20150817-000028;58342;PACE;Inpatient;PACE;C:\Users\FGuo\Documents\work doucment\attachment\attachmentDB\20161005\originalFileFromAerial\DOCSVC_20161003.tar\DOCSVC_20161003\DOCSVC_20161003\INPATIENT\REQ_20150817-000028\JHarris_2015-08-18-13.47.08.134.tif
Request;20150817-000035;43226;PACE;Inpatient;PACE;C:\Users\FGuo\Documents\work doucment\attachment\attachmentDB\20161005\originalFileFromAerial\DOCSVC_20161003.tar\DOCSVC_20161003\DOCSVC_20161003\INPATIENT\REQ_20150817-000035\CNott 82015_2015-08-20-15.36.44.398.tif
Request;20150817-000035;43226;PACE;Inpatient;PACE;C:\Users\FGuo\Documents\work doucment\attachment\attachmentDB\20161005\originalFileFromAerial\DOCSVC_20161003.tar\DOCSVC_20161003\DOCSVC_20161003\INPATIENT\REQ_20150817-000035\Nott Carroll IP Denial NY Methodist Hospital 8-28-15_2015-08-28-09.44.05.857.docx
Request;20150817-000035;43226;PACE;Inpatient;PACE;C:\Users\FGuo\Documents\work doucment\attachment\attachmentDB\20161005\originalFileFromAerial\DOCSVC_20161003.tar\DOCSVC_20161003\DOCSVC_20161003\INPATIENT\REQ_20150817-000035\Nott, Carroll Appeal ACK Letter_2015-11-04-14.22.28.591.docx
Request;20150817-000035;43226;PACE;Inpatient;PACE;C:\Users\FGuo\Documents\work doucment\attachment\attachmentDB\20161005\originalFileFromAerial\DOCSVC_20161003.tar\DOCSVC_20161003\DOCSVC_20161003\INPATIENT\REQ_20150817-000035\Nott, Carroll MR_2015-11-04-15.02.25.844.pdf
Request;20150817-000035;43226;PACE;Inpatient;PACE;C:\Users\FGuo\Documents\work doucment\attachment\attachmentDB\20161005\originalFileFromAerial\DOCSVC_20161003.tar\DOCSVC_20161003\DOCSVC_20161003\INPATIENT\REQ_20150817-000035\Nott, Carroll MR_2015-11-23-09.26.47.426.pdf
Request;20150817-000043;51557;PACE;Inpatient;PACE;C:\Users\FGuo\Documents\work doucment\attachment\attachmentDB\20161005\originalFileFromAerial\DOCSVC_20161003.tar\DOCSVC_20161003\DOCSVC_20161003\INPATIENT\REQ_20150817-000043\Forbes Phillipa  IP Denial Interfaith Medical Center 8-28-15_2015-08-28-09.52.32.623.docx
Request;20150817-000043;51557;PACE;Inpatient;PACE;C:\Users\FGuo\Documents\work doucment\attachment\attachmentDB\20161005\originalFileFromAerial\DOCSVC_20161003.tar\DOCSVC_20161003\DOCSVC_20161003\INPATIENT\REQ_20150817-000043\MX-5111N_20151208_121303_2015-12-08-13.03.39.672.pdf
Request;20150817-000043;51557;PACE;Inpatient;PACE;C:\Users\FGuo\Documents\work doucment\attachment\attachmentDB\20161005\originalFileFromAerial\DOCSVC_20161003.tar\DOCSVC_20161003\DOCSVC_20161003\INPATIENT\REQ_20150817-000043\PACE Final Adverse Determination- Appeal  Unfavorable Non-Contracted Hospitals_2016-01-04-18.07.51.87.docx
Request;20150817-000043;51557;PACE;Inpatient;PACE;C:\Users\FGuo\Documents\work doucment\attachment\attachmentDB\20161005\originalFileFromAerial\DOCSVC_20161003.tar\DOCSVC_20161003\DOCSVC_20161003\INPATIENT\REQ_20150817-000043\PForbes_2015-08-25-13.49.14.836.tif
Request;20150817-000043;51557;PACE;Inpatient;PACE;C:\Users\FGuo\Documents\work doucment\attachment\attachmentDB\20161005\originalFileFromAerial\DOCSVC_20161003.tar\DOCSVC_20161003\DOCSVC_20161003\INPATIENT\REQ_20150817-000043\PRA-1  Appeal Acknowledgement _2015-10-20-16.31.56.767.docx
Request;20150817-000047;20274;null;Inpatient;PACE;C:\Users\FGuo\Documents\work doucment\attachment\attachmentDB\20161005\originalFileFromAerial\DOCSVC_20161003.tar\DOCSVC_20161003\DOCSVC_20161003\INPATIENT\REQ_20150817-000047\belhommePRI_2015-08-18-14.56.06.646.tif
Request;20150817-000047;20274;null;Inpatient;PACE;C:\Users\FGuo\Documents\work doucment\attachment\attachmentDB\20161005\originalFileFromAerial\DOCSVC_20161003.tar\DOCSVC_20161003\DOCSVC_20161003\INPATIENT\REQ_20150817-000047\belhommeUR_2015-08-18-14.55.36.978.tif
Request;20150817-000050;20274;null;Inpatient;PACE;C:\Users\FGuo\Documents\work doucment\attachment\attachmentDB\20161005\originalFileFromAerial\DOCSVC_20161003.tar\DOCSVC_20161003\DOCSVC_20161003\INPATIENT\REQ_20150817-000050\Belhomme, Deronide 20274 Auth Approval Letter_2015-09-14-16.41.22.215.doc
Request;20150817-000050;20274;null;Inpatient;PACE;C:\Users\FGuo\Documents\work doucment\attachment\attachmentDB\20161005\originalFileFromAerial\DOCSVC_20161003.tar\DOCSVC_20161003\DOCSVC_20161003\INPATIENT\REQ_20150817-000050\Belhomme, Deronide(3rd Document)- Kings Harbour Multicare Center 9.11.15_2015-09-11-15.48.27.716.docx
Request;20150817-000051;57641;null;Inpatient;SELECT;C:\Users\FGuo\Documents\work doucment\attachment\attachmentDB\20161005\originalFileFromAerial\DOCSVC_20161003.tar\DOCSVC_20161003\DOCSVC_20161003\INPATIENT\REQ_20150817-000051\Don Scott Medicare Denial Letter 8-17-15_2015-08-18-11.27.55.148.tif
Request;20150817-000051;57641;null;Inpatient;SELECT;C:\Users\FGuo\Documents\work doucment\attachment\attachmentDB\20161005\originalFileFromAerial\DOCSVC_20161003.tar\DOCSVC_20161003\DOCSVC_20161003\INPATIENT\REQ_20150817-000051\Don Scott PRI 8-17-15_2015-08-18-11.27.35.280.tif
Request;20150817-000051;57641;null;Inpatient;SELECT;C:\Users\FGuo\Documents\work doucment\attachment\attachmentDB\20161005\originalFileFromAerial\DOCSVC_20161003.tar\DOCSVC_20161003\DOCSVC_20161003\INPATIENT\REQ_20150817-000051\SCOTT, DON - NAME CHANGE REQUEST_2015-10-27-13.32.56.567.tif
Request;20150817-000051;57641;null;Inpatient;SELECT;C:\Users\FGuo\Documents\work doucment\attachment\attachmentDB\20161005\originalFileFromAerial\DOCSVC_20161003.tar\DOCSVC_20161003\DOCSVC_20161003\INPATIENT\REQ_20150817-000051\Scott, Don -DAUGHTERS OF JACOB NURSING HOME - 8-24-15_2015-08-24-08.28.42.737.docx
Request;20150817-000051;57641;null;Inpatient;SELECT;C:\Users\FGuo\Documents\work doucment\attachment\attachmentDB\20161005\originalFileFromAerial\DOCSVC_20161003.tar\DOCSVC_20161003\DOCSVC_20161003\INPATIENT\REQ_20150817-000051\Scott, Don -Hope Center Operations, LLC  11.5.15_2015-11-05-10.18.34.345.docx
Request;20150817-000052;23508;DIRECT;Inpatient;PACE;C:\Users\FGuo\Documents\work doucment\attachment\attachmentDB\20161005\originalFileFromAerial\DOCSVC_20161003.tar\DOCSVC_20161003\DOCSVC_20161003\INPATIENT\REQ_20150817-000052\O_\Scans\PRI_Screen_Pearl_Zappone_23508_2015-08-17-15.25.09.93.pdf
Request;20150817-000052;23508;DIRECT;Inpatient;PACE;C:\Users\FGuo\Documents\work doucment\attachment\attachmentDB\20161005\originalFileFromAerial\DOCSVC_20161003.tar\DOCSVC_20161003\DOCSVC_20161003\INPATIENT\REQ_20150817-000052\RJ Zappone, P 23508 8-19-15 _2015-08-19-09.48.38.800.htm
Request;20150817-000052;23508;DIRECT;Inpatient;PACE;C:\Users\FGuo\Documents\work doucment\attachment\attachmentDB\20161005\originalFileFromAerial\DOCSVC_20161003.tar\DOCSVC_20161003\DOCSVC_20161003\INPATIENT\REQ_20150817-000052\RJ Zappone, P 23508 PRI 8-19-15_2015-08-19-09.48.52.898.pdf
Request;20150817-000052;23508;DIRECT;Inpatient;PACE;C:\Users\FGuo\Documents\work doucment\attachment\attachmentDB\20161005\originalFileFromAerial\DOCSVC_20161003.tar\DOCSVC_20161003\DOCSVC_20161003\INPATIENT\REQ_20150817-000052\Zappone, Pearl - Schnurmacher Nursing Home   8.20.15_2015-08-20-12.49.12.823.docx
Request;20150817-000053;23461;null;Inpatient;PACE;C:\Users\FGuo\Documents\work doucment\attachment\attachmentDB\20161005\originalFileFromAerial\DOCSVC_20161003.tar\DOCSVC_20161003\DOCSVC_20161003\INPATIENT\REQ_20150817-000053\Ortega AgustinPACE - Bellevue Hospital Center 8-24-15_2015-08-24-13.45.55.563.docx
Request;20150817-000053;23461;null;Inpatient;PACE;C:\Users\FGuo\Documents\work doucment\attachment\attachmentDB\20161005\originalFileFromAerial\DOCSVC_20161003.tar\DOCSVC_20161003\DOCSVC_20161003\INPATIENT\REQ_20150817-000053\Ortega, Agustin x_2015-08-17-15.43.51.795.tif
Request;20150817-000055;56593;PACE;Inpatient;PACE;C:\Users\FGuo\Documents\work doucment\attachment\attachmentDB\20161005\originalFileFromAerial\DOCSVC_20161003.tar\DOCSVC_20161003\DOCSVC_20161003\INPATIENT\REQ_20150817-000055\jacqueline taglieri_2015-09-01-12.38.05.577.tif
Request;20150817-000055;56593;PACE;Inpatient;PACE;C:\Users\FGuo\Documents\work doucment\attachment\attachmentDB\20161005\originalFileFromAerial\DOCSVC_20161003.tar\DOCSVC_20161003\DOCSVC_20161003\INPATIENT\REQ_20150817-000055\O_\Scans\PRI_Screen_Jacqueline_Taglieri_56593_2015-08-17-15.56.19.56.pdf
Request;20150817-000055;56593;PACE;Inpatient;PACE;C:\Users\FGuo\Documents\work doucment\attachment\attachmentDB\20161005\originalFileFromAerial\DOCSVC_20161003.tar\DOCSVC_20161003\DOCSVC_20161003\INPATIENT\REQ_20150817-000055\RJ Taglieri, J 56593 8-17-15 PRI_2015-08-19-09.05.13.411.pdf
Request;20150817-000055;56593;PACE;Inpatient;PACE;C:\Users\FGuo\Documents\work doucment\attachment\attachmentDB\20161005\originalFileFromAerial\DOCSVC_20161003.tar\DOCSVC_20161003\DOCSVC_20161003\INPATIENT\REQ_20150817-000055\RJ Taglieri, J 56593 8-17-15_2015-08-19-09.04.48.864.htm
Request;20150817-000057;87712;PACE;Inpatient;PACE;C:\Users\FGuo\Documents\work doucment\attachment\attachmentDB\20161005\originalFileFromAerial\DOCSVC_20161003.tar\DOCSVC_20161003\DOCSVC_20161003\INPATIENT\REQ_20150817-000057\Luz Rodriguez PRI 8-17-15_2015-08-17-16.14.37.614.tif
Request;20150817-000057;87712;PACE;Inpatient;PACE;C:\Users\FGuo\Documents\work doucment\attachment\attachmentDB\20161005\originalFileFromAerial\DOCSVC_20161003.tar\DOCSVC_20161003\DOCSVC_20161003\INPATIENT\REQ_20150817-000057\luz rodriguezdc_2015-08-20-10.35.23.873.tif
Request;20150817-000057;87712;PACE;Inpatient;PACE;C:\Users\FGuo\Documents\work doucment\attachment\attachmentDB\20161005\originalFileFromAerial\DOCSVC_20161003.tar\DOCSVC_20161003\DOCSVC_20161003\INPATIENT\REQ_20150817-000057\luz rodriguez_2015-08-19-18.05.51.171.tif
Request;20150817-000057;87712;PACE;Inpatient;PACE;C:\Users\FGuo\Documents\work doucment\attachment\attachmentDB\20161005\originalFileFromAerial\DOCSVC_20161003.tar\DOCSVC_20161003\DOCSVC_20161003\INPATIENT\REQ_20150817-000057\Rodriguez, Luz 87712 Auth Approval Letter_2015-08-20-15.30.50.340.doc
Request;20150817-000060;91925;PACE;Inpatient;PACE;C:\Users\FGuo\Documents\work doucment\attachment\attachmentDB\20161005\originalFileFromAerial\DOCSVC_20161003.tar\DOCSVC_20161003\DOCSVC_20161003\INPATIENT\REQ_20150817-000060\Neal, John Appeal Ack Letter_2015-09-10-11.59.31.327.docx
Request;20150817-000060;91925;PACE;Inpatient;PACE;C:\Users\FGuo\Documents\work doucment\attachment\attachmentDB\20161005\originalFileFromAerial\DOCSVC_20161003.tar\DOCSVC_20161003\DOCSVC_20161003\INPATIENT\REQ_20150817-000060\Neal, John MR_2015-09-16-09.18.21.910.pdf
Request;20150817-000060;91925;PACE;Inpatient;PACE;C:\Users\FGuo\Documents\work doucment\attachment\attachmentDB\20161005\originalFileFromAerial\DOCSVC_20161003.tar\DOCSVC_20161003\DOCSVC_20161003\INPATIENT\REQ_20150817-000060\O_\Scans\PRI_Screen_John_Neal_91925_2015-08-17-16.27.07.152.pdf
Request;20150817-000060;91925;PACE;Inpatient;PACE;C:\Users\FGuo\Documents\work doucment\attachment\attachmentDB\20161005\originalFileFromAerial\DOCSVC_20161003.tar\DOCSVC_20161003\DOCSVC_20161003\INPATIENT\REQ_20150817-000060\RJ Neal, J 91925 8-17-15_2015-08-21-10.14.47.87.htm
Request;20150817-000063;34698;SELECT;Inpatient;SELECT;C:\Users\FGuo\Documents\work doucment\attachment\attachmentDB\20161005\originalFileFromAerial\DOCSVC_20161003.tar\DOCSVC_20161003\DOCSVC_20161003\INPATIENT\REQ_20150817-000063\eli koyt_2015-11-19-15.18.41.780.tif
Request;20150817-000063;34698;SELECT;Inpatient;SELECT;C:\Users\FGuo\Documents\work doucment\attachment\attachmentDB\20161005\originalFileFromAerial\DOCSVC_20161003.tar\DOCSVC_20161003\DOCSVC_20161003\INPATIENT\REQ_20150817-000063\kotlyar yekizaveta22_2015-10-23-21.38.41.598.tif
Request;20150817-000063;34698;SELECT;Inpatient;SELECT;C:\Users\FGuo\Documents\work doucment\attachment\attachmentDB\20161005\originalFileFromAerial\DOCSVC_20161003.tar\DOCSVC_20161003\DOCSVC_20161003\INPATIENT\REQ_20150817-000063\kotlyar yelizaveta 1211_2015-12-11-11.08.16.350.tif
Request;20150817-000063;34698;SELECT;Inpatient;SELECT;C:\Users\FGuo\Documents\work doucment\attachment\attachmentDB\20161005\originalFileFromAerial\DOCSVC_20161003.tar\DOCSVC_20161003\DOCSVC_20161003\INPATIENT\REQ_20150817-000063\kotlyar yelizaveta11416_2016-01-14-17.18.52.771.tif
Request;20150817-000063;34698;SELECT;Inpatient;SELECT;C:\Users\FGuo\Documents\work doucment\attachment\attachmentDB\20161005\originalFileFromAerial\DOCSVC_20161003.tar\DOCSVC_20161003\DOCSVC_20161003\INPATIENT\REQ_20150817-000063\Kotlyar, Yelizaveta - SHEEPSHEAD NURSING AND REHAB CENTER 9.13.16_2016-09-13-14.30.55.45.pdf
Request;20150817-000063;34698;SELECT;Inpatient;SELECT;C:\Users\FGuo\Documents\work doucment\attachment\attachmentDB\20161005\originalFileFromAerial\DOCSVC_20161003.tar\DOCSVC_20161003\DOCSVC_20161003\INPATIENT\REQ_20150817-000063\Kotlyar, Yelizaveta 34698 - Sheephead Nursing Clinical Additional_2015-09-21-10.46.10.861.TIF
Request;20150817-000063;34698;SELECT;Inpatient;SELECT;C:\Users\FGuo\Documents\work doucment\attachment\attachmentDB\20161005\originalFileFromAerial\DOCSVC_20161003.tar\DOCSVC_20161003\DOCSVC_20161003\INPATIENT\REQ_20150817-000063\Kotlyar, Yelizaveta 34698 - Sheephead Nursing Clinical_2015-09-18-10.47.01.516.TIF
Request;20150817-000063;34698;SELECT;Inpatient;SELECT;C:\Users\FGuo\Documents\work doucment\attachment\attachmentDB\20161005\originalFileFromAerial\DOCSVC_20161003.tar\DOCSVC_20161003\DOCSVC_20161003\INPATIENT\REQ_20150817-000063\Kotlyar, Yelizaveta 34698 Auth Approval Letter_2015-08-20-16.12.32.181.doc
Request;20150817-000063;34698;SELECT;Inpatient;SELECT;C:\Users\FGuo\Documents\work doucment\attachment\attachmentDB\20161005\originalFileFromAerial\DOCSVC_20161003.tar\DOCSVC_20161003\DOCSVC_20161003\INPATIENT\REQ_20150817-000063\Kotlyar, Yelizaveta_2016-08-16-17.31.06.207.tif
Request;20150817-000063;34698;SELECT;Inpatient;SELECT;C:\Users\FGuo\Documents\work doucment\attachment\attachmentDB\20161005\originalFileFromAerial\DOCSVC_20161003.tar\DOCSVC_20161003\DOCSVC_20161003\INPATIENT\REQ_20150817-000063\YKotlyar_2015-08-17-17.00.48.965.tif
Request;20150817-000065;55060;DIRECT/SELECT LT;Inpatient;DIRECT/SELECT LT;C:\Users\FGuo\Documents\work doucment\attachment\attachmentDB\20161005\originalFileFromAerial\DOCSVC_20161003.tar\DOCSVC_20161003\DOCSVC_20161003\INPATIENT\REQ_20150817-000065\Davis Mary  FIDA  Appeal  Unfavorable Non-Contracted Hospitals_2016-01-19-12.24.16.592.docx
Request;20150817-000065;55060;DIRECT/SELECT LT;Inpatient;DIRECT/SELECT LT;C:\Users\FGuo\Documents\work doucment\attachment\attachmentDB\20161005\originalFileFromAerial\DOCSVC_20161003.tar\DOCSVC_20161003\DOCSVC_20161003\INPATIENT\REQ_20150817-000065\Davis Mary FIDA IP Denial Flushing Hospital Center 8-25-15_2015-08-25-11.03.00.117.docx
Request;20150817-000065;55060;DIRECT/SELECT LT;Inpatient;DIRECT/SELECT LT;C:\Users\FGuo\Documents\work doucment\attachment\attachmentDB\20161005\originalFileFromAerial\DOCSVC_20161003.tar\DOCSVC_20161003\DOCSVC_20161003\INPATIENT\REQ_20150817-000065\Davis Mary FIDA Maximus cover letter_2016-01-19-12.23.29.271.docm
Request;20150817-000065;55060;DIRECT/SELECT LT;Inpatient;DIRECT/SELECT LT;C:\Users\FGuo\Documents\work doucment\attachment\attachmentDB\20161005\originalFileFromAerial\DOCSVC_20161003.tar\DOCSVC_20161003\DOCSVC_20161003\INPATIENT\REQ_20150817-000065\Davis Mary FIDA Maximus cover letter_2016-01-19-12.23.34.962.docm
Request;20150817-000065;55060;DIRECT/SELECT LT;Inpatient;DIRECT/SELECT LT;C:\Users\FGuo\Documents\work doucment\attachment\attachmentDB\20161005\originalFileFromAerial\DOCSVC_20161003.tar\DOCSVC_20161003\DOCSVC_20161003\INPATIENT\REQ_20150817-000065\Mary Davis MEDICARE MANAGED CARE RECONSIDERATION BACKGROUND DATA FORM_2016-01-19-12.23.21.5.docx
Request;20150817-000065;55060;DIRECT/SELECT LT;Inpatient;DIRECT/SELECT LT;C:\Users\FGuo\Documents\work doucment\attachment\attachmentDB\20161005\originalFileFromAerial\DOCSVC_20161003.tar\DOCSVC_20161003\DOCSVC_20161003\INPATIENT\REQ_20150817-000065\MDavise 72315_2015-08-17-17.28.11.82.tif
Request;20150817-000065;55060;DIRECT/SELECT LT;Inpatient;DIRECT/SELECT LT;C:\Users\FGuo\Documents\work doucment\attachment\attachmentDB\20161005\originalFileFromAerial\DOCSVC_20161003.tar\DOCSVC_20161003\DOCSVC_20161003\INPATIENT\REQ_20150817-000065\Medical Record _2015-12-24-12.14.19.658.pdf
Request;20150818-000008;58640;PACE;Inpatient;PACE;C:\Users\FGuo\Documents\work doucment\attachment\attachmentDB\20161005\originalFileFromAerial\DOCSVC_20161003.tar\DOCSVC_20161003\DOCSVC_20161003\INPATIENT\REQ_20150818-000008\SORU, MARIA - UR_2015-08-20-08.50.03.955.tif
Request;20150818-000008;58640;PACE;Inpatient;PACE;C:\Users\FGuo\Documents\work doucment\attachment\attachmentDB\20161005\originalFileFromAerial\DOCSVC_20161003.tar\DOCSVC_20161003\DOCSVC_20161003\INPATIENT\REQ_20150818-000008\Soru, Maria -The MT. Sinai Hosp of Queens-Clinical Review Request Form 8-18-15_2015-08-18-09.21.17.437.docx
Request;20150818-000009;27316;DIRECT;Inpatient;DIRECT;C:\Users\FGuo\Documents\work doucment\attachment\attachmentDB\20161005\originalFileFromAerial\DOCSVC_20161003.tar\DOCSVC_20161003\DOCSVC_20161003\INPATIENT\REQ_20150818-000009\Ingram, Lillie 27316 CLINICAL REVIEW REQUEST FORM_2015-08-18-09.46.03.790.doc
Request;20150818-000009;27316;DIRECT;Inpatient;DIRECT;C:\Users\FGuo\Documents\work doucment\attachment\attachmentDB\20161005\originalFileFromAerial\DOCSVC_20161003.tar\DOCSVC_20161003\DOCSVC_20161003\INPATIENT\REQ_20150818-000009\ingram,lillie_2015-08-21-15.33.08.983.tif
Request;20150818-000009;27316;DIRECT;Inpatient;DIRECT;C:\Users\FGuo\Documents\work doucment\attachment\attachmentDB\20161005\originalFileFromAerial\DOCSVC_20161003.tar\DOCSVC_20161003\DOCSVC_20161003\INPATIENT\REQ_20150818-000009\ingram91_2015-09-01-09.52.09.9.tif
Request;20150818-000009;27316;DIRECT;Inpatient;DIRECT;C:\Users\FGuo\Documents\work doucment\attachment\attachmentDB\20161005\originalFileFromAerial\DOCSVC_20161003.tar\DOCSVC_20161003\DOCSVC_20161003\INPATIENT\REQ_20150818-000009\ingramUpdate_2015-08-26-16.02.32.82.tif
Request;20150818-000010;26194;PACE;Inpatient;PACE;C:\Users\FGuo\Documents\work doucment\attachment\attachmentDB\20161005\originalFileFromAerial\DOCSVC_20161003.tar\DOCSVC_20161003\DOCSVC_20161003\INPATIENT\REQ_20150818-000010\Junette Previl UR 8-24-15_2015-08-25-10.49.03.126.tif
Request;20150818-000010;26194;PACE;Inpatient;PACE;C:\Users\FGuo\Documents\work doucment\attachment\attachmentDB\20161005\originalFileFromAerial\DOCSVC_20161003.tar\DOCSVC_20161003\DOCSVC_20161003\INPATIENT\REQ_20150818-000010\Junette Previl UR 8-25-15_2015-08-25-17.45.19.576.tif
Request;20150818-000010;26194;PACE;Inpatient;PACE;C:\Users\FGuo\Documents\work doucment\attachment\attachmentDB\20161005\originalFileFromAerial\DOCSVC_20161003.tar\DOCSVC_20161003\DOCSVC_20161003\INPATIENT\REQ_20150818-000010\PREVIL, JUNETTE - UR_2015-08-18-09.30.46.514.tif
Request;20150818-000012;77563;PACE;Inpatient;PACE;C:\Users\FGuo\Documents\work doucment\attachment\attachmentDB\20161005\originalFileFromAerial\DOCSVC_20161003.tar\DOCSVC_20161003\DOCSVC_20161003\INPATIENT\REQ_20150818-000012\Hong, Chung Ja 77563- CLINICAL REVIEW REQUEST FORM.doc 8 18 15_2015-08-18-10.09.47.502.doc
Request;20150818-000012;77563;PACE;Inpatient;PACE;C:\Users\FGuo\Documents\work doucment\attachment\attachmentDB\20161005\originalFileFromAerial\DOCSVC_20161003.tar\DOCSVC_20161003\DOCSVC_20161003\INPATIENT\REQ_20150818-000012\hong,UR_2015-08-19-08.41.38.636.tif
Request;20150818-000014;84220;DIRECT;Inpatient;DIRECT;C:\Users\FGuo\Documents\work doucment\attachment\attachmentDB\20161005\originalFileFromAerial\DOCSVC_20161003.tar\DOCSVC_20161003\DOCSVC_20161003\INPATIENT\REQ_20150818-000014\brooks,harriet_2015-08-19-08.24.22.828.tif
Request;20150818-000014;84220;DIRECT;Inpatient;DIRECT;C:\Users\FGuo\Documents\work doucment\attachment\attachmentDB\20161005\originalFileFromAerial\DOCSVC_20161003.tar\DOCSVC_20161003\DOCSVC_20161003\INPATIENT\REQ_20150818-000014\Brroks, harriet 84220 CLINICAL REVIEW REQUEST FORM.doc 8 18 15_2015-08-18-10.02.10.486.doc
Request;20150818-000018;48933;SELECT;Inpatient;SELECT;C:\Users\FGuo\Documents\work doucment\attachment\attachmentDB\20161005\originalFileFromAerial\DOCSVC_20161003.tar\DOCSVC_20161003\DOCSVC_20161003\INPATIENT\REQ_20150818-000018\SANTULLI, THERESA - CLINICAL_2015-10-02-10.33.57.562.tif
Request;20150818-000018;48933;SELECT;Inpatient;SELECT;C:\Users\FGuo\Documents\work doucment\attachment\attachmentDB\20161005\originalFileFromAerial\DOCSVC_20161003.tar\DOCSVC_20161003\DOCSVC_20161003\INPATIENT\REQ_20150818-000018\Santulli,Theresa - Daleview Care Center MMR Care Corp. - 10.15.15 docx_2015-10-15-11.32.16.739.docx
Request;20150818-000022;79350;null;Inpatient;PACE;C:\Users\FGuo\Documents\work doucment\attachment\attachmentDB\20161005\originalFileFromAerial\DOCSVC_20161003.tar\DOCSVC_20161003\DOCSVC_20161003\INPATIENT\REQ_20150818-000022\LEE, CHOI N  - ADMISSION_2015-08-31-15.58.15.571.tif
Request;20150818-000022;79350;null;Inpatient;PACE;C:\Users\FGuo\Documents\work doucment\attachment\attachmentDB\20161005\originalFileFromAerial\DOCSVC_20161003.tar\DOCSVC_20161003\DOCSVC_20161003\INPATIENT\REQ_20150818-000022\LEE, CHOI N - UR_2015-08-18-10.33.33.921.tif
Request;20150818-000029;74756;null;Inpatient;PACE;C:\Users\FGuo\Documents\work doucment\attachment\attachmentDB\20161005\originalFileFromAerial\DOCSVC_20161003.tar\DOCSVC_20161003\DOCSVC_20161003\INPATIENT\REQ_20150818-000029\Wong Yuet Kiu   hosp adm_2015-08-18-11.07.57.758.tif
Request;20150818-000029;74756;null;Inpatient;PACE;C:\Users\FGuo\Documents\work doucment\attachment\attachmentDB\20161005\originalFileFromAerial\DOCSVC_20161003.tar\DOCSVC_20161003\DOCSVC_20161003\INPATIENT\REQ_20150818-000029\Wong Yuet Kiu 74756 - CLINICAL REVIEW REQUEST FORM.doc 8 18 15_2015-08-18-11.16.44.299.doc
Request;20150818-000029;74756;null;Inpatient;PACE;C:\Users\FGuo\Documents\work doucment\attachment\attachmentDB\20161005\originalFileFromAerial\DOCSVC_20161003.tar\DOCSVC_20161003\DOCSVC_20161003\INPATIENT\REQ_20150818-000029\wong yuetdc_2015-08-21-11.44.16.418.tif
Request;20150818-000029;74756;null;Inpatient;PACE;C:\Users\FGuo\Documents\work doucment\attachment\attachmentDB\20161005\originalFileFromAerial\DOCSVC_20161003.tar\DOCSVC_20161003\DOCSVC_20161003\INPATIENT\REQ_20150818-000029\WONG-YUET-100935386 LETTER_2016-04-26-13.19.44.250.pdf
Request;20150818-000029;74756;null;Inpatient;PACE;C:\Users\FGuo\Documents\work doucment\attachment\attachmentDB\20161005\originalFileFromAerial\DOCSVC_20161003.tar\DOCSVC_20161003\DOCSVC_20161003\INPATIENT\REQ_20150818-000029\yuet wong 2_2015-08-26-18.00.19.933.tif
Request;20150818-000029;74756;null;Inpatient;PACE;C:\Users\FGuo\Documents\work doucment\attachment\attachmentDB\20161005\originalFileFromAerial\DOCSVC_20161003.tar\DOCSVC_20161003\DOCSVC_20161003\INPATIENT\REQ_20150818-000029\yuet wong_2015-08-26-17.53.50.679.tif
Request;20150818-000030;20274;null;Inpatient;PACE;C:\Users\FGuo\Documents\work doucment\attachment\attachmentDB\20161005\originalFileFromAerial\DOCSVC_20161003.tar\DOCSVC_20161003\DOCSVC_20161003\INPATIENT\REQ_20150818-000030\Belhomme, Deronide - Kings Harbour - 8-20-15_2015-08-20-11.14.44.487.docx
Request;20150818-000030;20274;null;Inpatient;PACE;C:\Users\FGuo\Documents\work doucment\attachment\attachmentDB\20161005\originalFileFromAerial\DOCSVC_20161003.tar\DOCSVC_20161003\DOCSVC_20161003\INPATIENT\REQ_20150818-000030\Belhomme, Deronide(2nd Document)- Kings Harbour Multicare Center 8.25.15_2015-08-25-14.11.42.399.docx
Request;20150818-000032;74756;null;Inpatient;PACE;C:\Users\FGuo\Documents\work doucment\attachment\attachmentDB\20161005\originalFileFromAerial\DOCSVC_20161003.tar\DOCSVC_20161003\DOCSVC_20161003\INPATIENT\REQ_20150818-000032\Wong, Yuet Kiu - Atlantis Rehab - 8-20-15_2015-08-20-13.47.35.737.docx
Request;20150818-000034;39189;PACE;Inpatient;PACE;C:\Users\FGuo\Documents\work doucment\attachment\attachmentDB\20161005\originalFileFromAerial\DOCSVC_20161003.tar\DOCSVC_20161003\DOCSVC_20161003\INPATIENT\REQ_20150818-000034\Jamilla Khan LTC 8-18-15_2015-08-18-11.49.37.538.tif
Request;20150818-000034;39189;PACE;Inpatient;PACE;C:\Users\FGuo\Documents\work doucment\attachment\attachmentDB\20161005\originalFileFromAerial\DOCSVC_20161003.tar\DOCSVC_20161003\DOCSVC_20161003\INPATIENT\REQ_20150818-000034\jamilla khan_2015-08-24-09.35.40.898.tif
Request;20150818-000034;39189;PACE;Inpatient;PACE;C:\Users\FGuo\Documents\work doucment\attachment\attachmentDB\20161005\originalFileFromAerial\DOCSVC_20161003.tar\DOCSVC_20161003\DOCSVC_20161003\INPATIENT\REQ_20150818-000034\Khan, Jamilla  -Margaret Tiez Nursing and Rehab - 8-20-15_2015-08-20-14.10.24.417.docx
Request;20150818-000036;73787;PACE;Inpatient;PACE;C:\Users\FGuo\Documents\work doucment\attachment\attachmentDB\20161005\originalFileFromAerial\DOCSVC_20161003.tar\DOCSVC_20161003\DOCSVC_20161003\INPATIENT\REQ_20150818-000036\guillermina Ortiz_2015-08-18-16.45.57.389.tif
Request;20150818-000036;73787;PACE;Inpatient;PACE;C:\Users\FGuo\Documents\work doucment\attachment\attachmentDB\20161005\originalFileFromAerial\DOCSVC_20161003.tar\DOCSVC_20161003\DOCSVC_20161003\INPATIENT\REQ_20150818-000036\Ortiz, Guillermina  73787  Clinical Notes Hosp_2015-08-18-11.52.29.28.doc
Request;20150818-000039;77505;PACE;Inpatient;PACE;C:\Users\FGuo\Documents\work doucment\attachment\attachmentDB\20161005\originalFileFromAerial\DOCSVC_20161003.tar\DOCSVC_20161003\DOCSVC_20161003\INPATIENT\REQ_20150818-000039\FGroce_2015-09-17-15.27.45.914.tif
Request;20150818-000039;77505;PACE;Inpatient;PACE;C:\Users\FGuo\Documents\work doucment\attachment\attachmentDB\20161005\originalFileFromAerial\DOCSVC_20161003.tar\DOCSVC_20161003\DOCSVC_20161003\INPATIENT\REQ_20150818-000039\Groce, Florence -Maimonides Medical Center  8.26.15_2015-08-26-14.29.06.763.docx
Request;20150818-000039;77505;PACE;Inpatient;PACE;C:\Users\FGuo\Documents\work doucment\attachment\attachmentDB\20161005\originalFileFromAerial\DOCSVC_20161003.tar\DOCSVC_20161003\DOCSVC_20161003\INPATIENT\REQ_20150818-000039\Groce, Florence_2015-08-18-12.06.16.130.tif
Request;20150818-000043;41850;DIRECT;Inpatient;DIRECT;C:\Users\FGuo\Documents\work doucment\attachment\attachmentDB\20161005\originalFileFromAerial\DOCSVC_20161003.tar\DOCSVC_20161003\DOCSVC_20161003\INPATIENT\REQ_20150818-000043\Behnam Shokr DIRECT - North Shore University Hospital 8-28-15_2015-09-22-15.00.40.526.docx
Request;20150818-000043;41850;DIRECT;Inpatient;DIRECT;C:\Users\FGuo\Documents\work doucment\attachment\attachmentDB\20161005\originalFileFromAerial\DOCSVC_20161003.tar\DOCSVC_20161003\DOCSVC_20161003\INPATIENT\REQ_20150818-000043\Behnam Shokr DIRECT - NY Methodist Hospital 8-28-15_2015-08-28-15.01.21.977.docx
Request;20150818-000043;41850;DIRECT;Inpatient;DIRECT;C:\Users\FGuo\Documents\work doucment\attachment\attachmentDB\20161005\originalFileFromAerial\DOCSVC_20161003.tar\DOCSVC_20161003\DOCSVC_20161003\INPATIENT\REQ_20150818-000043\Behnam Shokr, Yacob-North Shore UH Manhasset Clinical Review Request Form 8-18-15_2015-08-18-12.56.10.480.docx
Request;20150818-000043;41850;DIRECT;Inpatient;DIRECT;C:\Users\FGuo\Documents\work doucment\attachment\attachmentDB\20161005\originalFileFromAerial\DOCSVC_20161003.tar\DOCSVC_20161003\DOCSVC_20161003\INPATIENT\REQ_20150818-000043\PRA-4 Appeal Resolution-Favorable_2015-11-20-12.46.41.69.docx
Request;20150818-000058;48625;SELECT;Inpatient;SELECT;C:\Users\FGuo\Documents\work doucment\attachment\attachmentDB\20161005\originalFileFromAerial\DOCSVC_20161003.tar\DOCSVC_20161003\DOCSVC_20161003\INPATIENT\REQ_20150818-000058\alturo rodriguez_2015-08-25-16.58.59.301.tif
Request;20150818-000058;48625;SELECT;Inpatient;SELECT;C:\Users\FGuo\Documents\work doucment\attachment\attachmentDB\20161005\originalFileFromAerial\DOCSVC_20161003.tar\DOCSVC_20161003\DOCSVC_20161003\INPATIENT\REQ_20150818-000058\Rodriguez Alturo-FIDA IP Denial Harlem Hospital Center 8-28-15_2015-08-28-10.43.20.959.docx
Request;20150818-000058;48625;SELECT;Inpatient;SELECT;C:\Users\FGuo\Documents\work doucment\attachment\attachmentDB\20161005\originalFileFromAerial\DOCSVC_20161003.tar\DOCSVC_20161003\DOCSVC_20161003\INPATIENT\REQ_20150818-000058\Rodriguez Alturo-FIDA IP Denial Harlem Hospital Center 8-28-15_2015-08-28-13.37.18.425.docx
Request;20150818-000058;48625;SELECT;Inpatient;SELECT;C:\Users\FGuo\Documents\work doucment\attachment\attachmentDB\20161005\originalFileFromAerial\DOCSVC_20161003.tar\DOCSVC_20161003\DOCSVC_20161003\INPATIENT\REQ_20150818-000058\Rodriguez, Alturo 48625 CLINICAL REVIEW REQUEST FORM.doc 8 18 15_2015-08-18-15.05.05.624.doc
Request;20150818-000058;48625;SELECT;Inpatient;SELECT;C:\Users\FGuo\Documents\work doucment\attachment\attachmentDB\20161005\originalFileFromAerial\DOCSVC_20161003.tar\DOCSVC_20161003\DOCSVC_20161003\INPATIENT\REQ_20150818-000058\Rodriguez, Alturo MR_2016-01-12-09.25.47.843.pdf
Request;20150818-000058;48625;SELECT;Inpatient;SELECT;C:\Users\FGuo\Documents\work doucment\attachment\attachmentDB\20161005\originalFileFromAerial\DOCSVC_20161003.tar\DOCSVC_20161003\DOCSVC_20161003\INPATIENT\REQ_20150818-000058\Rodriguez, Arturo hosp adm 8 10_2015-08-18-14.58.58.569.tif
Request;20150818-000058;48625;SELECT;Inpatient;SELECT;C:\Users\FGuo\Documents\work doucment\attachment\attachmentDB\20161005\originalFileFromAerial\DOCSVC_20161003.tar\DOCSVC_20161003\DOCSVC_20161003\INPATIENT\REQ_20150818-000058\_2015-08-25-16.59.09.233
Request;20150818-000069;56633;DIRECT;Inpatient;DIRECT;C:\Users\FGuo\Documents\work doucment\attachment\attachmentDB\20161005\originalFileFromAerial\DOCSVC_20161003.tar\DOCSVC_20161003\DOCSVC_20161003\INPATIENT\REQ_20150818-000069\Goyanes, Georginia -Hempstead Park Nursing Home   8.24.15_2015-08-24-15.54.12.261.docx
Request;20150819-000005;87898;PACE;Inpatient;PACE;C:\Users\FGuo\Documents\work doucment\attachment\attachmentDB\20161005\originalFileFromAerial\DOCSVC_20161003.tar\DOCSVC_20161003\DOCSVC_20161003\INPATIENT\REQ_20150819-000005\Landers Dorothy IP Denial Good Samaritan Hispital 8-25-15docx_2015-08-25-11.46.38.554.docx
Request;20150819-000005;87898;PACE;Inpatient;PACE;C:\Users\FGuo\Documents\work doucment\attachment\attachmentDB\20161005\originalFileFromAerial\DOCSVC_20161003.tar\DOCSVC_20161003\DOCSVC_20161003\INPATIENT\REQ_20150819-000005\Landers Dorothy_2015-09-15-10.24.57.703.pdf
Request;20150819-000005;87898;PACE;Inpatient;PACE;C:\Users\FGuo\Documents\work doucment\attachment\attachmentDB\20161005\originalFileFromAerial\DOCSVC_20161003.tar\DOCSVC_20161003\DOCSVC_20161003\INPATIENT\REQ_20150819-000005\Landers, Dorothy - Good Samaritan Hosp MC Clinical Review Request Form 8-19-15_2015-08-19-09.35.06.350.docx
Request;20150819-000005;87898;PACE;Inpatient;PACE;C:\Users\FGuo\Documents\work doucment\attachment\attachmentDB\20161005\originalFileFromAerial\DOCSVC_20161003.tar\DOCSVC_20161003\DOCSVC_20161003\INPATIENT\REQ_20150819-000005\PRA-1  Appeal Acknowledgement _2015-09-15-10.10.16.589.docx
Request;20150819-000005;87898;PACE;Inpatient;PACE;C:\Users\FGuo\Documents\work doucment\attachment\attachmentDB\20161005\originalFileFromAerial\DOCSVC_20161003.tar\DOCSVC_20161003\DOCSVC_20161003\INPATIENT\REQ_20150819-000005\PRA-2 Final Adverse Determination Appeal Unfavorable-Contracted Hospitals_2015-10-29-09.59.57.702.docx
Request;20150819-000006;89562;PACE;Inpatient;FIDA;C:\Users\FGuo\Documents\work doucment\attachment\attachmentDB\20161005\originalFileFromAerial\DOCSVC_20161003.tar\DOCSVC_20161003\DOCSVC_20161003\INPATIENT\REQ_20150819-000006\Final Adverse Determination- Appeal  Unfavorable Non-Contracted Hospitals_2015-11-25-10.40.31.16.docx
Request;20150819-000006;89562;PACE;Inpatient;FIDA;C:\Users\FGuo\Documents\work doucment\attachment\attachmentDB\20161005\originalFileFromAerial\DOCSVC_20161003.tar\DOCSVC_20161003\DOCSVC_20161003\INPATIENT\REQ_20150819-000006\Harris Dorothy FIDA - Beth Israel Kings Highway Hospital 9-1-15_2015-09-01-14.19.52.501.docx
Request;20150819-000006;89562;PACE;Inpatient;FIDA;C:\Users\FGuo\Documents\work doucment\attachment\attachmentDB\20161005\originalFileFromAerial\DOCSVC_20161003.tar\DOCSVC_20161003\DOCSVC_20161003\INPATIENT\REQ_20150819-000006\Harris, Dorothy 89562 CLINICAL REVIEW REQUEST FORM.doc 8 19_2015-08-19-09.45.31.983.doc
Request;20150819-000006;89562;PACE;Inpatient;FIDA;C:\Users\FGuo\Documents\work doucment\attachment\attachmentDB\20161005\originalFileFromAerial\DOCSVC_20161003.tar\DOCSVC_20161003\DOCSVC_20161003\INPATIENT\REQ_20150819-000006\Medical record _2015-11-23-12.03.11.987.pdf
Request;20150819-000006;89562;PACE;Inpatient;FIDA;C:\Users\FGuo\Documents\work doucment\attachment\attachmentDB\20161005\originalFileFromAerial\DOCSVC_20161003.tar\DOCSVC_20161003\DOCSVC_20161003\INPATIENT\REQ_20150819-000006\PRA-1  Appeal Acknowledgement _2015-10-29-17.39.36.881.docx
Request;20150819-000008;44383;FIDA;Inpatient;FIDA;C:\Users\FGuo\Documents\work doucment\attachment\attachmentDB\20161005\originalFileFromAerial\DOCSVC_20161003.tar\DOCSVC_20161003\DOCSVC_20161003\INPATIENT\REQ_20150819-000008\Frances McWeeney UR 8-20-15_2015-08-20-11.24.59.63.tif
Request;20150819-000008;44383;FIDA;Inpatient;FIDA;C:\Users\FGuo\Documents\work doucment\attachment\attachmentDB\20161005\originalFileFromAerial\DOCSVC_20161003.tar\DOCSVC_20161003\DOCSVC_20161003\INPATIENT\REQ_20150819-000008\McWeeney Frances-FIDA IP Denial Winthrop University Hospital 9-25-15_2015-09-25-14.38.25.345.docx
Request;20150819-000008;44383;FIDA;Inpatient;FIDA;C:\Users\FGuo\Documents\work doucment\attachment\attachmentDB\20161005\originalFileFromAerial\DOCSVC_20161003.tar\DOCSVC_20161003\DOCSVC_20161003\INPATIENT\REQ_20150819-000008\Mcweeney, Frances ACK Letter_2015-10-19-09.43.04.475.docx
Request;20150819-000010;54626;DIRECT;Inpatient;DIRECT;C:\Users\FGuo\Documents\work doucment\attachment\attachmentDB\20161005\originalFileFromAerial\DOCSVC_20161003.tar\DOCSVC_20161003\DOCSVC_20161003\INPATIENT\REQ_20150819-000010\IMcgann_2015-08-25-10.28.51.92.tif
Request;20150819-000011;81775;PACE;Inpatient;PACE;C:\Users\FGuo\Documents\work doucment\attachment\attachmentDB\20161005\originalFileFromAerial\DOCSVC_20161003.tar\DOCSVC_20161003\DOCSVC_20161003\INPATIENT\REQ_20150819-000011\-2nd Appeal Acknowledgement Letter_2016-01-07-11.51.30.374.docx
Request;20150819-000011;81775;PACE;Inpatient;PACE;C:\Users\FGuo\Documents\work doucment\attachment\attachmentDB\20161005\originalFileFromAerial\DOCSVC_20161003.tar\DOCSVC_20161003\DOCSVC_20161003\INPATIENT\REQ_20150819-000011\Deo Leo, Teresa Medical Record Part 1_2016-01-27-10.22.26.316.pdf
Request;20150819-000011;81775;PACE;Inpatient;PACE;C:\Users\FGuo\Documents\work doucment\attachment\attachmentDB\20161005\originalFileFromAerial\DOCSVC_20161003.tar\DOCSVC_20161003\DOCSVC_20161003\INPATIENT\REQ_20150819-000011\Deo Leo, Teresa Medical Record Part 2_2016-01-27-10.23.24.840.pdf
Request;20150819-000011;81775;PACE;Inpatient;PACE;C:\Users\FGuo\Documents\work doucment\attachment\attachmentDB\20161005\originalFileFromAerial\DOCSVC_20161003.tar\DOCSVC_20161003\DOCSVC_20161003\INPATIENT\REQ_20150819-000011\Deoleo Teresa  IP Denial NY Methodist Hospital 9-23-15_2015-09-23-13.57.12.124.docx
Request;20150819-000011;81775;PACE;Inpatient;PACE;C:\Users\FGuo\Documents\work doucment\attachment\attachmentDB\20161005\originalFileFromAerial\DOCSVC_20161003.tar\DOCSVC_20161003\DOCSVC_20161003\INPATIENT\REQ_20150819-000011\DeoLeo, Teresa Medical Record Part 3_2016-01-27-10.25.32.199.pdf
Request;20150819-000011;81775;PACE;Inpatient;PACE;C:\Users\FGuo\Documents\work doucment\attachment\attachmentDB\20161005\originalFileFromAerial\DOCSVC_20161003.tar\DOCSVC_20161003\DOCSVC_20161003\INPATIENT\REQ_20150819-000011\PRA-1  Appeal Acknowledgement _2015-11-24-09.55.17.681.docx
Request;20150819-000011;81775;PACE;Inpatient;PACE;C:\Users\FGuo\Documents\work doucment\attachment\attachmentDB\20161005\originalFileFromAerial\DOCSVC_20161003.tar\DOCSVC_20161003\DOCSVC_20161003\INPATIENT\REQ_20150819-000011\TDeleo_2015-08-24-13.05.30.994.tif
Request;20150819-000014;75930;FIDA;Inpatient;FIDA;C:\Users\FGuo\Documents\work doucment\attachment\attachmentDB\20161005\originalFileFromAerial\DOCSVC_20161003.tar\DOCSVC_20161003\DOCSVC_20161003\INPATIENT\REQ_20150819-000014\bailey,UR818_2015-08-19-10.49.07.841.tif
Request;20150819-000015;31221;DIRECT;Inpatient;DIRECT;C:\Users\FGuo\Documents\work doucment\attachment\attachmentDB\20161005\originalFileFromAerial\DOCSVC_20161003.tar\DOCSVC_20161003\DOCSVC_20161003\INPATIENT\REQ_20150819-000015\falcon, jose_2015-08-19-11.17.49.43.tif
Request;20150819-000017;81180;PACE;Inpatient;PACE;C:\Users\FGuo\Documents\work doucment\attachment\attachmentDB\20161005\originalFileFromAerial\DOCSVC_20161003.tar\DOCSVC_20161003\DOCSVC_20161003\INPATIENT\REQ_20150819-000017\Borrero, Felicita-St Barnabas Hospital---Clinical Review Request Form 8-19-15_2015-08-19-11.00.09.376.docx
Request;20150819-000017;81180;PACE;Inpatient;PACE;C:\Users\FGuo\Documents\work doucment\attachment\attachmentDB\20161005\originalFileFromAerial\DOCSVC_20161003.tar\DOCSVC_20161003\DOCSVC_20161003\INPATIENT\REQ_20150819-000017\Borrero, Felicita-St Barnabas Hospital---Clinical Review Request Form 8-19-15_2015-08-19-11.01.58.252.docx
Request;20150819-000017;81180;PACE;Inpatient;PACE;C:\Users\FGuo\Documents\work doucment\attachment\attachmentDB\20161005\originalFileFromAerial\DOCSVC_20161003.tar\DOCSVC_20161003\DOCSVC_20161003\INPATIENT\REQ_20150819-000017\borrero,f_2015-08-21-10.59.37.372.tif
Request;20150819-000017;81180;PACE;Inpatient;PACE;C:\Users\FGuo\Documents\work doucment\attachment\attachmentDB\20161005\originalFileFromAerial\DOCSVC_20161003.tar\DOCSVC_20161003\DOCSVC_20161003\INPATIENT\REQ_20150819-000017\_2015-08-21-10.59.26.150
Request;20150819-000021;23515;PACE;Inpatient;PACE;C:\Users\FGuo\Documents\work doucment\attachment\attachmentDB\20161005\originalFileFromAerial\DOCSVC_20161003.tar\DOCSVC_20161003\DOCSVC_20161003\INPATIENT\REQ_20150819-000021\AAnglero update_2015-08-20-17.03.37.727.tif
Request;20150819-000021;23515;PACE;Inpatient;PACE;C:\Users\FGuo\Documents\work doucment\attachment\attachmentDB\20161005\originalFileFromAerial\DOCSVC_20161003.tar\DOCSVC_20161003\DOCSVC_20161003\INPATIENT\REQ_20150819-000021\AAnglero_2015-08-20-17.01.54.450.tif
Request;20150819-000021;23515;PACE;Inpatient;PACE;C:\Users\FGuo\Documents\work doucment\attachment\attachmentDB\20161005\originalFileFromAerial\DOCSVC_20161003.tar\DOCSVC_20161003\DOCSVC_20161003\INPATIENT\REQ_20150819-000021\amparo,a821_2015-08-24-08.46.57.528.tif
Request;20150819-000021;23515;PACE;Inpatient;PACE;C:\Users\FGuo\Documents\work doucment\attachment\attachmentDB\20161005\originalFileFromAerial\DOCSVC_20161003.tar\DOCSVC_20161003\DOCSVC_20161003\INPATIENT\REQ_20150819-000021\Anglero, Amparo-St Barnabas Hospital---Clinical Review Request Form 8-19-15_2015-08-19-11.17.57.941.docx
Request;20150819-000035;56918;null;Inpatient;PACE;C:\Users\FGuo\Documents\work doucment\attachment\attachmentDB\20161005\originalFileFromAerial\DOCSVC_20161003.tar\DOCSVC_20161003\DOCSVC_20161003\INPATIENT\REQ_20150819-000035\CLynch Review_2015-08-20-11.44.53.289.tif
Request;20150819-000037;27572;PACE;Inpatient;SELECT;C:\Users\FGuo\Documents\work doucment\attachment\attachmentDB\20161005\originalFileFromAerial\DOCSVC_20161003.tar\DOCSVC_20161003\DOCSVC_20161003\INPATIENT\REQ_20150819-000037\Cruckshank, Verona - Center For Nursing & Rehabilitation  8.20.15_2015-08-20-14.37.21.521.docx
Request;20150819-000037;27572;PACE;Inpatient;SELECT;C:\Users\FGuo\Documents\work doucment\attachment\attachmentDB\20161005\originalFileFromAerial\DOCSVC_20161003.tar\DOCSVC_20161003\DOCSVC_20161003\INPATIENT\REQ_20150819-000037\VCrukshank_2015-08-19-13.14.59.370.pdf
Request;20150819-000038;57962;DIRECT;Inpatient;DIRECT;C:\Users\FGuo\Documents\work doucment\attachment\attachmentDB\20161005\originalFileFromAerial\DOCSVC_20161003.tar\DOCSVC_20161003\DOCSVC_20161003\INPATIENT\REQ_20150819-000038\Rosado, Sylvia 57962 CLINICAL REVIEW REQUEST FORM.doc 8 19_2015-08-19-13.30.38.797.doc
Request;20150819-000038;57962;DIRECT;Inpatient;DIRECT;C:\Users\FGuo\Documents\work doucment\attachment\attachmentDB\20161005\originalFileFromAerial\DOCSVC_20161003.tar\DOCSVC_20161003\DOCSVC_20161003\INPATIENT\REQ_20150819-000038\Rosado, Sylvia 8 17_2015-08-19-13.25.23.66.tif
Request;20150819-000038;57962;DIRECT;Inpatient;DIRECT;C:\Users\FGuo\Documents\work doucment\attachment\attachmentDB\20161005\originalFileFromAerial\DOCSVC_20161003.tar\DOCSVC_20161003\DOCSVC_20161003\INPATIENT\REQ_20150819-000038\sylvia rosado20_2015-10-23-22.35.15.56.tif
Request;20150819-000039;84567;PACE;Inpatient;PACE;C:\Users\FGuo\Documents\work doucment\attachment\attachmentDB\20161005\originalFileFromAerial\DOCSVC_20161003.tar\DOCSVC_20161003\DOCSVC_20161003\INPATIENT\REQ_20150819-000039\dread susandc_2015-09-09-15.38.56.812.tif
Request;20150819-000039;84567;PACE;Inpatient;PACE;C:\Users\FGuo\Documents\work doucment\attachment\attachmentDB\20161005\originalFileFromAerial\DOCSVC_20161003.tar\DOCSVC_20161003\DOCSVC_20161003\INPATIENT\REQ_20150819-000039\dread susan_2015-08-24-13.48.27.630.tif
Request;20150819-000039;84567;PACE;Inpatient;PACE;C:\Users\FGuo\Documents\work doucment\attachment\attachmentDB\20161005\originalFileFromAerial\DOCSVC_20161003.tar\DOCSVC_20161003\DOCSVC_20161003\INPATIENT\REQ_20150819-000039\Dread, Susan 84567 CLINICAL REVIEW REQUEST FORM.doc 8 19_2015-08-19-13.44.46.332.doc
Request;20150819-000039;84567;PACE;Inpatient;PACE;C:\Users\FGuo\Documents\work doucment\attachment\attachmentDB\20161005\originalFileFromAerial\DOCSVC_20161003.tar\DOCSVC_20161003\DOCSVC_20161003\INPATIENT\REQ_20150819-000039\Dread, susan hosp adm 8 17_2015-08-19-13.35.14.750.tif
Request;20150819-000040;44383;FIDA;Inpatient;FIDA;C:\Users\FGuo\Documents\work doucment\attachment\attachmentDB\20161005\originalFileFromAerial\DOCSVC_20161003.tar\DOCSVC_20161003\DOCSVC_20161003\INPATIENT\REQ_20150819-000040\Frances Mcweeney_2015-08-19-16.54.10.364.tif
Request;20150819-000042;56918;null;Inpatient;PACE;C:\Users\FGuo\Documents\work doucment\attachment\attachmentDB\20161005\originalFileFromAerial\DOCSVC_20161003.tar\DOCSVC_20161003\DOCSVC_20161003\INPATIENT\REQ_20150819-000042\CLynch PT eval_2015-08-20-11.26.42.290.tif
Request;20150819-000046;23763;null;Inpatient;PACE;C:\Users\FGuo\Documents\work doucment\attachment\attachmentDB\20161005\originalFileFromAerial\DOCSVC_20161003.tar\DOCSVC_20161003\DOCSVC_20161003\INPATIENT\REQ_20150819-000046\maria matos21_2015-08-24-09.45.11.619.tif
Request;20150819-000046;23763;null;Inpatient;PACE;C:\Users\FGuo\Documents\work doucment\attachment\attachmentDB\20161005\originalFileFromAerial\DOCSVC_20161003.tar\DOCSVC_20161003\DOCSVC_20161003\INPATIENT\REQ_20150819-000046\MMatos PRi_2015-08-19-14.33.07.800.tif
Request;20150819-000049;80900;PACE;Inpatient;PACE;C:\Users\FGuo\Documents\work doucment\attachment\attachmentDB\20161005\originalFileFromAerial\DOCSVC_20161003.tar\DOCSVC_20161003\DOCSVC_20161003\INPATIENT\REQ_20150819-000049\Burke, Ionie - Beth Abraham Nursing Home  8.25.15_2015-08-25-15.30.29.132.docx
Request;20150819-000049;80900;PACE;Inpatient;PACE;C:\Users\FGuo\Documents\work doucment\attachment\attachmentDB\20161005\originalFileFromAerial\DOCSVC_20161003.tar\DOCSVC_20161003\DOCSVC_20161003\INPATIENT\REQ_20150819-000049\RJ Burke, I 80900 8-24-15_2015-08-24-15.19.35.757.htm
Request;20150819-000052;26576;null;Inpatient;PACE;C:\Users\FGuo\Documents\work doucment\attachment\attachmentDB\20161005\originalFileFromAerial\DOCSVC_20161003.tar\DOCSVC_20161003\DOCSVC_20161003\INPATIENT\REQ_20150819-000052\De La Cruz, Nimia Appeal ACK Letter_2015-12-29-11.12.44.293.docx
Request;20150819-000052;26576;null;Inpatient;PACE;C:\Users\FGuo\Documents\work doucment\attachment\attachmentDB\20161005\originalFileFromAerial\DOCSVC_20161003.tar\DOCSVC_20161003\DOCSVC_20161003\INPATIENT\REQ_20150819-000052\De La Cruz, Nimia MR_2015-12-29-11.13.14.215.pdf
Request;20150819-000052;26576;null;Inpatient;PACE;C:\Users\FGuo\Documents\work doucment\attachment\attachmentDB\20161005\originalFileFromAerial\DOCSVC_20161003.tar\DOCSVC_20161003\DOCSVC_20161003\INPATIENT\REQ_20150819-000052\Dela Cruz IP Denial Montefiore Medical Center 8-28-15_2015-08-28-11.28.13.138.docx
Request;20150819-000052;26576;null;Inpatient;PACE;C:\Users\FGuo\Documents\work doucment\attachment\attachmentDB\20161005\originalFileFromAerial\DOCSVC_20161003.tar\DOCSVC_20161003\DOCSVC_20161003\INPATIENT\REQ_20150819-000052\Dela Cruz, Nimia  -Montefiore Med Cen-Moses-Clinical Review Request Form 8-19-15_2015-08-19-15.23.38.927.docx
Request;20150819-000052;26576;null;Inpatient;PACE;C:\Users\FGuo\Documents\work doucment\attachment\attachmentDB\20161005\originalFileFromAerial\DOCSVC_20161003.tar\DOCSVC_20161003\DOCSVC_20161003\INPATIENT\REQ_20150819-000052\NDelacruz_2015-08-20-17.27.57.320.tif
Request;20150819-000053;26576;null;Inpatient;PACE;C:\Users\FGuo\Documents\work doucment\attachment\attachmentDB\20161005\originalFileFromAerial\DOCSVC_20161003.tar\DOCSVC_20161003\DOCSVC_20161003\INPATIENT\REQ_20150819-000053\RJ Dela Cruz, N 26575 8-18-15_2015-08-19-15.38.17.636.pdf
Request;20150819-000055;22607;PACE;Inpatient;PACE;C:\Users\FGuo\Documents\work doucment\attachment\attachmentDB\20161005\originalFileFromAerial\DOCSVC_20161003.tar\DOCSVC_20161003\DOCSVC_20161003\INPATIENT\REQ_20150819-000055\Martinesdepena, Mercedes adm hosp_2015-08-19-15.47.48.941.tif
Request;20150819-000055;22607;PACE;Inpatient;PACE;C:\Users\FGuo\Documents\work doucment\attachment\attachmentDB\20161005\originalFileFromAerial\DOCSVC_20161003.tar\DOCSVC_20161003\DOCSVC_20161003\INPATIENT\REQ_20150819-000055\martinez mercedes26_2015-08-26-15.13.05.615.tif
Request;20150819-000055;22607;PACE;Inpatient;PACE;C:\Users\FGuo\Documents\work doucment\attachment\attachmentDB\20161005\originalFileFromAerial\DOCSVC_20161003.tar\DOCSVC_20161003\DOCSVC_20161003\INPATIENT\REQ_20150819-000055\Martinezdepena Mercedes  IP Denial Beth Israel Petri 9-1-15_2015-09-01-14.00.06.685.docx
Request;20150819-000055;22607;PACE;Inpatient;PACE;C:\Users\FGuo\Documents\work doucment\attachment\attachmentDB\20161005\originalFileFromAerial\DOCSVC_20161003.tar\DOCSVC_20161003\DOCSVC_20161003\INPATIENT\REQ_20150819-000055\Martinezdepena Mercedes  IP Denial Beth Israel Petri 9-1-15_2015-09-01-14.10.45.735.docx
Request;20150819-000055;22607;PACE;Inpatient;PACE;C:\Users\FGuo\Documents\work doucment\attachment\attachmentDB\20161005\originalFileFromAerial\DOCSVC_20161003.tar\DOCSVC_20161003\DOCSVC_20161003\INPATIENT\REQ_20150819-000055\Martinezdepena, Mercedes 22607 CLINICAL REVIEW REQUEST FORM.doc 8 19_2015-08-19-15.52.54.60.doc
Request;20150819-000058;26476;PACE;Inpatient;PACE;C:\Users\FGuo\Documents\work doucment\attachment\attachmentDB\20161005\originalFileFromAerial\DOCSVC_20161003.tar\DOCSVC_20161003\DOCSVC_20161003\INPATIENT\REQ_20150819-000058\Manning Vincent 8 19 hosp_2015-08-19-16.28.52.116.tif
Request;20150819-000058;26476;PACE;Inpatient;PACE;C:\Users\FGuo\Documents\work doucment\attachment\attachmentDB\20161005\originalFileFromAerial\DOCSVC_20161003.tar\DOCSVC_20161003\DOCSVC_20161003\INPATIENT\REQ_20150819-000058\Manning Vincent IP Denial Beth Israel Petri 9-1-15_2015-09-01-14.12.03.303.docx
Request;20150819-000058;26476;PACE;Inpatient;PACE;C:\Users\FGuo\Documents\work doucment\attachment\attachmentDB\20161005\originalFileFromAerial\DOCSVC_20161003.tar\DOCSVC_20161003\DOCSVC_20161003\INPATIENT\REQ_20150819-000058\manning vincent_2015-08-25-12.29.20.303.tif
Request;20150819-000058;26476;PACE;Inpatient;PACE;C:\Users\FGuo\Documents\work doucment\attachment\attachmentDB\20161005\originalFileFromAerial\DOCSVC_20161003.tar\DOCSVC_20161003\DOCSVC_20161003\INPATIENT\REQ_20150819-000058\Manning, vincent 26476  CLINICAL REVIEW REQUEST FORM.doc 8 19_2015-08-19-16.32.05.507.doc
Request;20150820-000008;29318;PACE;Inpatient;PACE;C:\Users\FGuo\Documents\work doucment\attachment\attachmentDB\20161005\originalFileFromAerial\DOCSVC_20161003.tar\DOCSVC_20161003\DOCSVC_20161003\INPATIENT\REQ_20150820-000008\KARANTZALIS, ANASTASIA - UR_2015-08-20-09.28.01.736.tif
Request;20150820-000010;95627;PACE;Inpatient;PACE;C:\Users\FGuo\Documents\work doucment\attachment\attachmentDB\20161005\originalFileFromAerial\DOCSVC_20161003.tar\DOCSVC_20161003\DOCSVC_20161003\INPATIENT\REQ_20150820-000010\Lai Leung IP Denial Beth Israel Petri 8-27-15_2015-08-27-09.53.33.943.docx
Request;20150820-000010;95627;PACE;Inpatient;PACE;C:\Users\FGuo\Documents\work doucment\attachment\attachmentDB\20161005\originalFileFromAerial\DOCSVC_20161003.tar\DOCSVC_20161003\DOCSVC_20161003\INPATIENT\REQ_20150820-000010\Lai Leung IP Denial Beth Israel Petri 8-27-15_2015-08-27-15.27.45.860.docx
Request;20150820-000010;95627;PACE;Inpatient;PACE;C:\Users\FGuo\Documents\work doucment\attachment\attachmentDB\20161005\originalFileFromAerial\DOCSVC_20161003.tar\DOCSVC_20161003\DOCSVC_20161003\INPATIENT\REQ_20150820-000010\lai leungdc_2015-08-20-10.53.27.510.tif
Request;20150820-000013;58350;PACE;Inpatient;PACE;C:\Users\FGuo\Documents\work doucment\attachment\attachmentDB\20161005\originalFileFromAerial\DOCSVC_20161003.tar\DOCSVC_20161003\DOCSVC_20161003\INPATIENT\REQ_20150820-000013\KIM, EUNG S - LTC_2015-08-20-09.59.12.625.tif
Request;20150820-000013;58350;PACE;Inpatient;PACE;C:\Users\FGuo\Documents\work doucment\attachment\attachmentDB\20161005\originalFileFromAerial\DOCSVC_20161003.tar\DOCSVC_20161003\DOCSVC_20161003\INPATIENT\REQ_20150820-000013\Kim, Eung S 58350 Auth Approval Letter_2015-08-21-11.20.38.659.doc
Request;20150820-000014;51085;PACE;Inpatient;PACE;C:\Users\FGuo\Documents\work doucment\attachment\attachmentDB\20161005\originalFileFromAerial\DOCSVC_20161003.tar\DOCSVC_20161003\DOCSVC_20161003\INPATIENT\REQ_20150820-000014\Hoyos Irma IP Denial Greenwich Hospital 8-25-15_2015-08-25-09.24.16.760.docx
Request;20150820-000014;51085;PACE;Inpatient;PACE;C:\Users\FGuo\Documents\work doucment\attachment\attachmentDB\20161005\originalFileFromAerial\DOCSVC_20161003.tar\DOCSVC_20161003\DOCSVC_20161003\INPATIENT\REQ_20150820-000014\Hoyos, Irma A 51085 CLINICAL REVIEW REQUEST FORM.doc 8 20 15_2015-08-20-10.09.50.460.doc
Request;20150820-000014;51085;PACE;Inpatient;PACE;C:\Users\FGuo\Documents\work doucment\attachment\attachmentDB\20161005\originalFileFromAerial\DOCSVC_20161003.tar\DOCSVC_20161003\DOCSVC_20161003\INPATIENT\REQ_20150820-000014\hoyos,irma_2015-08-21-15.07.29.294.tif
Request;20150820-000020;30707;SELECT;Inpatient;SELECT;C:\Users\FGuo\Documents\work doucment\attachment\attachmentDB\20161005\originalFileFromAerial\DOCSVC_20161003.tar\DOCSVC_20161003\DOCSVC_20161003\INPATIENT\REQ_20150820-000020\Aromando, Maria 30707 Auth Approval Letter_2015-08-21-12.25.32.752.doc
Request;20150820-000020;30707;SELECT;Inpatient;SELECT;C:\Users\FGuo\Documents\work doucment\attachment\attachmentDB\20161005\originalFileFromAerial\DOCSVC_20161003.tar\DOCSVC_20161003\DOCSVC_20161003\INPATIENT\REQ_20150820-000020\Aromando, Maria 30707 Auth Approval Letter_2015-08-21-12.36.15.662.doc
Request;20150820-000021;73242;PACE;Inpatient;PACE;C:\Users\FGuo\Documents\work doucment\attachment\attachmentDB\20161005\originalFileFromAerial\DOCSVC_20161003.tar\DOCSVC_20161003\DOCSVC_20161003\INPATIENT\REQ_20150820-000021\Crawley, Mary 8-20-15_2015-08-20-11.03.01.411.tif
Request;20150820-000021;73242;PACE;Inpatient;PACE;C:\Users\FGuo\Documents\work doucment\attachment\attachmentDB\20161005\originalFileFromAerial\DOCSVC_20161003.tar\DOCSVC_20161003\DOCSVC_20161003\INPATIENT\REQ_20150820-000021\crawley,mary_2015-08-27-11.47.43.893.tif
Request;20150820-000026;74742;PACE;Inpatient;PACE;C:\Users\FGuo\Documents\work doucment\attachment\attachmentDB\20161005\originalFileFromAerial\DOCSVC_20161003.tar\DOCSVC_20161003\DOCSVC_20161003\INPATIENT\REQ_20150820-000026\RJ Verdejo, A 74742 8-19-15_2015-08-20-12.55.42.265.pdf
Request;20150820-000030;40719;SELECT;Inpatient;SELECT;C:\Users\FGuo\Documents\work doucment\attachment\attachmentDB\20161005\originalFileFromAerial\DOCSVC_20161003.tar\DOCSVC_20161003\DOCSVC_20161003\INPATIENT\REQ_20150820-000030\Wedlake, Margaret 40719 (2) Auth Approval Letter_2015-08-21-16.26.35.572.doc
Request;20150820-000031;30298;PACE;Inpatient;PACE;C:\Users\FGuo\Documents\work doucment\attachment\attachmentDB\20161005\originalFileFromAerial\DOCSVC_20161003.tar\DOCSVC_20161003\DOCSVC_20161003\INPATIENT\REQ_20150820-000031\Elizabeth Kingston UR 8-20-15_2015-08-20-17.06.58.497.tif
Request;20150820-000031;30298;PACE;Inpatient;PACE;C:\Users\FGuo\Documents\work doucment\attachment\attachmentDB\20161005\originalFileFromAerial\DOCSVC_20161003.tar\DOCSVC_20161003\DOCSVC_20161003\INPATIENT\REQ_20150820-000031\Kingston Elizabeth IP Denial Franklin Hospital 8-27-15_2015-08-27-12.53.49.918.docx
Request;20150820-000031;30298;PACE;Inpatient;PACE;C:\Users\FGuo\Documents\work doucment\attachment\attachmentDB\20161005\originalFileFromAerial\DOCSVC_20161003.tar\DOCSVC_20161003\DOCSVC_20161003\INPATIENT\REQ_20150820-000031\KINGSTON, ELIZABETH - AUTH REQUEST_2015-08-24-09.49.39.687.tif
Request;20150820-000031;30298;PACE;Inpatient;PACE;C:\Users\FGuo\Documents\work doucment\attachment\attachmentDB\20161005\originalFileFromAerial\DOCSVC_20161003.tar\DOCSVC_20161003\DOCSVC_20161003\INPATIENT\REQ_20150820-000031\Kingston, Elizabeth---NS Franklin Hospital  Clinical Review Request Form 8-20-15_2015-08-20-13.27.07.269.docx
Request;20150820-000031;30298;PACE;Inpatient;PACE;C:\Users\FGuo\Documents\work doucment\attachment\attachmentDB\20161005\originalFileFromAerial\DOCSVC_20161003.tar\DOCSVC_20161003\DOCSVC_20161003\INPATIENT\REQ_20150820-000031\Medical Record part 1_2015-11-10-16.09.08.392.pdf
Request;20150820-000031;30298;PACE;Inpatient;PACE;C:\Users\FGuo\Documents\work doucment\attachment\attachmentDB\20161005\originalFileFromAerial\DOCSVC_20161003.tar\DOCSVC_20161003\DOCSVC_20161003\INPATIENT\REQ_20150820-000031\Medical Record part 2_2015-11-10-16.09.52.47.pdf
Request;20150820-000031;30298;PACE;Inpatient;PACE;C:\Users\FGuo\Documents\work doucment\attachment\attachmentDB\20161005\originalFileFromAerial\DOCSVC_20161003.tar\DOCSVC_20161003\DOCSVC_20161003\INPATIENT\REQ_20150820-000031\PRA-2 Final Adverse Determination Appeal Unfavorable-Contracted Hospitals_2015-11-13-10.38.47.189.docx
Request;20150820-000044;82705;PACE;Inpatient;PACE;C:\Users\FGuo\Documents\work doucment\attachment\attachmentDB\20161005\originalFileFromAerial\DOCSVC_20161003.tar\DOCSVC_20161003\DOCSVC_20161003\INPATIENT\REQ_20150820-000044\ho wong nancy_2015-08-20-15.23.52.731.tif
Request;20150820-000044;82705;PACE;Inpatient;PACE;C:\Users\FGuo\Documents\work doucment\attachment\attachmentDB\20161005\originalFileFromAerial\DOCSVC_20161003.tar\DOCSVC_20161003\DOCSVC_20161003\INPATIENT\REQ_20150820-000044\Ho, Nancy Wong- Cliffside Rehab & Residential Healthcare Center   8.21.15_2015-08-24-12.14.51.945.docx
Request;20150820-000045;84029;SELECT;Inpatient;SELECT;C:\Users\FGuo\Documents\work doucment\attachment\attachmentDB\20161005\originalFileFromAerial\DOCSVC_20161003.tar\DOCSVC_20161003\DOCSVC_20161003\INPATIENT\REQ_20150820-000045\avant lytl23_2015-10-23-22.51.43.819.tif
Request;20150820-000045;84029;SELECT;Inpatient;SELECT;C:\Users\FGuo\Documents\work doucment\attachment\attachmentDB\20161005\originalFileFromAerial\DOCSVC_20161003.tar\DOCSVC_20161003\DOCSVC_20161003\INPATIENT\REQ_20150820-000045\Avant Lytle NH PT note 8-24-15_2015-08-25-18.18.22.538.tif
Request;20150820-000045;84029;SELECT;Inpatient;SELECT;C:\Users\FGuo\Documents\work doucment\attachment\attachmentDB\20161005\originalFileFromAerial\DOCSVC_20161003.tar\DOCSVC_20161003\DOCSVC_20161003\INPATIENT\REQ_20150820-000045\Avant Lytle NH PT note 9-11-15_2015-09-14-11.47.37.178.tif
Request;20150820-000045;84029;SELECT;Inpatient;SELECT;C:\Users\FGuo\Documents\work doucment\attachment\attachmentDB\20161005\originalFileFromAerial\DOCSVC_20161003.tar\DOCSVC_20161003\DOCSVC_20161003\INPATIENT\REQ_20150820-000045\Avant Lytle NH PT note 9-21-15_2015-09-21-11.43.11.102.tif
Request;20150820-000045;84029;SELECT;Inpatient;SELECT;C:\Users\FGuo\Documents\work doucment\attachment\attachmentDB\20161005\originalFileFromAerial\DOCSVC_20161003.tar\DOCSVC_20161003\DOCSVC_20161003\INPATIENT\REQ_20150820-000045\Avant Lytle NH ST notes 8-24-15_2015-08-25-18.18.54.104.tif
Request;20150820-000045;84029;SELECT;Inpatient;SELECT;C:\Users\FGuo\Documents\work doucment\attachment\attachmentDB\20161005\originalFileFromAerial\DOCSVC_20161003.tar\DOCSVC_20161003\DOCSVC_20161003\INPATIENT\REQ_20150820-000045\Avant Lytle OT Notes 8-24-15_2015-08-25-18.18.44.120.tif
Request;20150820-000045;84029;SELECT;Inpatient;SELECT;C:\Users\FGuo\Documents\work doucment\attachment\attachmentDB\20161005\originalFileFromAerial\DOCSVC_20161003.tar\DOCSVC_20161003\DOCSVC_20161003\INPATIENT\REQ_20150820-000045\Avant Lytle OT Notes 9-25-15_2015-09-28-08.28.46.872.tif
Request;20150820-000045;84029;SELECT;Inpatient;SELECT;C:\Users\FGuo\Documents\work doucment\attachment\attachmentDB\20161005\originalFileFromAerial\DOCSVC_20161003.tar\DOCSVC_20161003\DOCSVC_20161003\INPATIENT\REQ_20150820-000045\Avant Lytle OT Notes 9-8-15_2015-09-11-16.19.26.853.tif
Request;20150820-000045;84029;SELECT;Inpatient;SELECT;C:\Users\FGuo\Documents\work doucment\attachment\attachmentDB\20161005\originalFileFromAerial\DOCSVC_20161003.tar\DOCSVC_20161003\DOCSVC_20161003\INPATIENT\REQ_20150820-000045\Avant Lytle PRI 8-20-15_2015-08-20-15.15.48.116.tif
Request;20150820-000045;84029;SELECT;Inpatient;SELECT;C:\Users\FGuo\Documents\work doucment\attachment\attachmentDB\20161005\originalFileFromAerial\DOCSVC_20161003.tar\DOCSVC_20161003\DOCSVC_20161003\INPATIENT\REQ_20150820-000045\avant lytle16_2015-10-16-16.32.01.930.tif
Request;20150820-000045;84029;SELECT;Inpatient;SELECT;C:\Users\FGuo\Documents\work doucment\attachment\attachmentDB\20161005\originalFileFromAerial\DOCSVC_20161003.tar\DOCSVC_20161003\DOCSVC_20161003\INPATIENT\REQ_20150820-000045\avant lytlejr1102_2015-11-02-15.30.54.864.tif
Request;20150820-000045;84029;SELECT;Inpatient;SELECT;C:\Users\FGuo\Documents\work doucment\attachment\attachmentDB\20161005\originalFileFromAerial\DOCSVC_20161003.tar\DOCSVC_20161003\DOCSVC_20161003\INPATIENT\REQ_20150820-000045\avant lytlejr1106_2015-11-06-17.54.47.573.tif
Request;20150820-000045;84029;SELECT;Inpatient;SELECT;C:\Users\FGuo\Documents\work doucment\attachment\attachmentDB\20161005\originalFileFromAerial\DOCSVC_20161003.tar\DOCSVC_20161003\DOCSVC_20161003\INPATIENT\REQ_20150820-000045\avant lytlejr_2015-10-30-15.13.49.268.tif
Request;20150820-000045;84029;SELECT;Inpatient;SELECT;C:\Users\FGuo\Documents\work doucment\attachment\attachmentDB\20161005\originalFileFromAerial\DOCSVC_20161003.tar\DOCSVC_20161003\DOCSVC_20161003\INPATIENT\REQ_20150820-000045\avant lyt_2015-10-07-13.24.00.816.tif
Request;20150820-000045;84029;SELECT;Inpatient;SELECT;C:\Users\FGuo\Documents\work doucment\attachment\attachmentDB\20161005\originalFileFromAerial\DOCSVC_20161003.tar\DOCSVC_20161003\DOCSVC_20161003\INPATIENT\REQ_20150820-000045\avnt lytlejr_2015-11-09-14.09.51.294.tif
Request;20150820-000045;84029;SELECT;Inpatient;SELECT;C:\Users\FGuo\Documents\work doucment\attachment\attachmentDB\20161005\originalFileFromAerial\DOCSVC_20161003.tar\DOCSVC_20161003\DOCSVC_20161003\INPATIENT\REQ_20150820-000045\Lytle Jr avant Adverse Determ Margaret Teitz Nursing and Rehab 11-13-15_2015-11-13-16.32.43.876.docx
Request;20150820-000045;84029;SELECT;Inpatient;SELECT;C:\Users\FGuo\Documents\work doucment\attachment\attachmentDB\20161005\originalFileFromAerial\DOCSVC_20161003.tar\DOCSVC_20161003\DOCSVC_20161003\INPATIENT\REQ_20150820-000045\Lytle Jr Avant MLTC Margaret Teitz Nursing Home 11-13-15_2015-11-13-16.33.01.259.docx
Request;20150820-000045;84029;SELECT;Inpatient;SELECT;C:\Users\FGuo\Documents\work doucment\attachment\attachmentDB\20161005\originalFileFromAerial\DOCSVC_20161003.tar\DOCSVC_20161003\DOCSVC_20161003\INPATIENT\REQ_20150820-000045\Lytle Jr, Avant A - Margaret Teitz Nursing & Rehab Center  8.24.15_2015-08-24-12.10.50.696.docx
Request;20150820-000050;43226;PACE;Inpatient;PACE;C:\Users\FGuo\Documents\work doucment\attachment\attachmentDB\20161005\originalFileFromAerial\DOCSVC_20161003.tar\DOCSVC_20161003\DOCSVC_20161003\INPATIENT\REQ_20150820-000050\CNott_2015-08-20-15.40.09.111.tif
Request;20150820-000054;55851;DIRECT;Inpatient;DIRECT;C:\Users\FGuo\Documents\work doucment\attachment\attachmentDB\20161005\originalFileFromAerial\DOCSVC_20161003.tar\DOCSVC_20161003\DOCSVC_20161003\INPATIENT\REQ_20150820-000054\ortiz,margarita_2015-08-24-08.56.57.978.tif
Request;20150821-000006;53890;DIRECT;Inpatient;DIRECT;C:\Users\FGuo\Documents\work doucment\attachment\attachmentDB\20161005\originalFileFromAerial\DOCSVC_20161003.tar\DOCSVC_20161003\DOCSVC_20161003\INPATIENT\REQ_20150821-000006\errol marshall_2015-10-08-12.51.12.589.tif
Request;20150821-000006;53890;DIRECT;Inpatient;DIRECT;C:\Users\FGuo\Documents\work doucment\attachment\attachmentDB\20161005\originalFileFromAerial\DOCSVC_20161003.tar\DOCSVC_20161003\DOCSVC_20161003\INPATIENT\REQ_20150821-000006\Marshall Errol DIRECT IP Denial St Johns Episcopal Hospital 10-9-15_2015-10-09-12.16.00.830.docx
Request;20150821-000006;53890;DIRECT;Inpatient;DIRECT;C:\Users\FGuo\Documents\work doucment\attachment\attachmentDB\20161005\originalFileFromAerial\DOCSVC_20161003.tar\DOCSVC_20161003\DOCSVC_20161003\INPATIENT\REQ_20150821-000006\MARSHALL, ERROL -  ADMISSION_2015-08-24-16.49.59.235.tif
Request;20150821-000007;35528;FIDA;Inpatient;FIDA;C:\Users\FGuo\Documents\work doucment\attachment\attachmentDB\20161005\originalFileFromAerial\DOCSVC_20161003.tar\DOCSVC_20161003\DOCSVC_20161003\INPATIENT\REQ_20150821-000007\delvalle,maria_2015-08-25-16.12.35.730.tif
Request;20150821-000007;35528;FIDA;Inpatient;FIDA;C:\Users\FGuo\Documents\work doucment\attachment\attachmentDB\20161005\originalFileFromAerial\DOCSVC_20161003.tar\DOCSVC_20161003\DOCSVC_20161003\INPATIENT\REQ_20150821-000007\Valle Maria-FIDA IP Denial Flushing Hospital Center 8-28-15_2015-08-28-10.20.30.325.docx
Request;20150821-000007;35528;FIDA;Inpatient;FIDA;C:\Users\FGuo\Documents\work doucment\attachment\attachmentDB\20161005\originalFileFromAerial\DOCSVC_20161003.tar\DOCSVC_20161003\DOCSVC_20161003\INPATIENT\REQ_20150821-000007\Valle Maria-FIDA IP Denial Flushing Hospital Center-Amandment 8-31-15_2015-08-31-12.15.33.541.docx
Request;20150821-000008;76280;SELECT;Inpatient;SELECT;C:\Users\FGuo\Documents\work doucment\attachment\attachmentDB\20161005\originalFileFromAerial\DOCSVC_20161003.tar\DOCSVC_20161003\DOCSVC_20161003\INPATIENT\REQ_20150821-000008\Matvayeva Galina FIDA - Beth Israel Kings Highway Hospital 9-1-15_2015-09-01-15.33.10.388.docx
Request;20150821-000008;76280;SELECT;Inpatient;SELECT;C:\Users\FGuo\Documents\work doucment\attachment\attachmentDB\20161005\originalFileFromAerial\DOCSVC_20161003.tar\DOCSVC_20161003\DOCSVC_20161003\INPATIENT\REQ_20150821-000008\Matveyeva, Galina 76280 CLINICAL REVIEW REQUEST FORM.doc 8 21 15_2015-08-21-09.35.30.271.doc
Request;20150821-000008;76280;SELECT;Inpatient;SELECT;C:\Users\FGuo\Documents\work doucment\attachment\attachmentDB\20161005\originalFileFromAerial\DOCSVC_20161003.tar\DOCSVC_20161003\DOCSVC_20161003\INPATIENT\REQ_20150821-000008\Matveyeva, Galina Appeal Ack Letter_2015-10-22-11.11.17.346.docx
Request;20150821-000010;97961;PACE;Inpatient;PACE;C:\Users\FGuo\Documents\work doucment\attachment\attachmentDB\20161005\originalFileFromAerial\DOCSVC_20161003.tar\DOCSVC_20161003\DOCSVC_20161003\INPATIENT\REQ_20150821-000010\edwards,h821_2015-08-21-10.07.29.371.tif
Request;20150821-000011;87328;PACE;Inpatient;PACE;C:\Users\FGuo\Documents\work doucment\attachment\attachmentDB\20161005\originalFileFromAerial\DOCSVC_20161003.tar\DOCSVC_20161003\DOCSVC_20161003\INPATIENT\REQ_20150821-000011\Ruiz, Laureana  -Montefiore Med Cen-Moses-Clinical Review Request Form 8-21-15_2015-08-21-09.56.52.741.docx
Request;20150821-000011;87328;PACE;Inpatient;PACE;C:\Users\FGuo\Documents\work doucment\attachment\attachmentDB\20161005\originalFileFromAerial\DOCSVC_20161003.tar\DOCSVC_20161003\DOCSVC_20161003\INPATIENT\REQ_20150821-000011\ruiz,laureana_2015-08-21-14.31.24.913.tif
Request;20150821-000013;40297;SELECT;Inpatient;SELECT;C:\Users\FGuo\Documents\work doucment\attachment\attachmentDB\20161005\originalFileFromAerial\DOCSVC_20161003.tar\DOCSVC_20161003\DOCSVC_20161003\INPATIENT\REQ_20150821-000013\RJ Watts, D 40297 8-19-15_2015-08-21-10.30.46.40.pdf
Request;20150821-000015;86523;PACE;Inpatient;PACE;C:\Users\FGuo\Documents\work doucment\attachment\attachmentDB\20161005\originalFileFromAerial\DOCSVC_20161003.tar\DOCSVC_20161003\DOCSVC_20161003\INPATIENT\REQ_20150821-000015\SStruts_2015-08-24-15.05.24.213.tif
Request;20150821-000015;86523;PACE;Inpatient;PACE;C:\Users\FGuo\Documents\work doucment\attachment\attachmentDB\20161005\originalFileFromAerial\DOCSVC_20161003.tar\DOCSVC_20161003\DOCSVC_20161003\INPATIENT\REQ_20150821-000015\Struts Sima Denial Beth Israel Medical Center 8-27-15_2015-08-27-10.09.13.510.docx
Request;20150821-000016;75366;PACE;Inpatient;PACE;C:\Users\FGuo\Documents\work doucment\attachment\attachmentDB\20161005\originalFileFromAerial\DOCSVC_20161003.tar\DOCSVC_20161003\DOCSVC_20161003\INPATIENT\REQ_20150821-000016\ASolomon_2015-08-25-10.09.54.334.tif
Request;20150821-000017;29678;PACE;Inpatient;PACE;C:\Users\FGuo\Documents\work doucment\attachment\attachmentDB\20161005\originalFileFromAerial\DOCSVC_20161003.tar\DOCSVC_20161003\DOCSVC_20161003\INPATIENT\REQ_20150821-000017\juan tigre21_2015-08-24-10.31.32.284.tif
Request;20150821-000017;29678;PACE;Inpatient;PACE;C:\Users\FGuo\Documents\work doucment\attachment\attachmentDB\20161005\originalFileFromAerial\DOCSVC_20161003.tar\DOCSVC_20161003\DOCSVC_20161003\INPATIENT\REQ_20150821-000017\Tigre, Juan 29678 Auth Approval Letter_2015-08-26-10.10.33.202.doc
Request;20150821-000018;43226;PACE;Inpatient;PACE;C:\Users\FGuo\Documents\work doucment\attachment\attachmentDB\20161005\originalFileFromAerial\DOCSVC_20161003.tar\DOCSVC_20161003\DOCSVC_20161003\INPATIENT\REQ_20150821-000018\carroll nottdc_2015-08-26-15.04.04.928.tif
Request;20150821-000018;43226;PACE;Inpatient;PACE;C:\Users\FGuo\Documents\work doucment\attachment\attachmentDB\20161005\originalFileFromAerial\DOCSVC_20161003.tar\DOCSVC_20161003\DOCSVC_20161003\INPATIENT\REQ_20150821-000018\carrolll nott_2015-08-21-16.54.21.413.tif
Request;20150821-000018;43226;PACE;Inpatient;PACE;C:\Users\FGuo\Documents\work doucment\attachment\attachmentDB\20161005\originalFileFromAerial\DOCSVC_20161003.tar\DOCSVC_20161003\DOCSVC_20161003\INPATIENT\REQ_20150821-000018\Nott, Carroll---Clinical Review Request Form 8-21-15_2015-08-21-10.50.09.603.docx
Request;20150821-000018;43226;PACE;Inpatient;PACE;C:\Users\FGuo\Documents\work doucment\attachment\attachmentDB\20161005\originalFileFromAerial\DOCSVC_20161003.tar\DOCSVC_20161003\DOCSVC_20161003\INPATIENT\REQ_20150821-000018\_2015-08-26-15.04.27.127
Request;20150821-000026;42165;PACE;Inpatient;PACE;C:\Users\FGuo\Documents\work doucment\attachment\attachmentDB\20161005\originalFileFromAerial\DOCSVC_20161003.tar\DOCSVC_20161003\DOCSVC_20161003\INPATIENT\REQ_20150821-000026\White, Ellen - Schnurmacher Nursing Home   11.3.15_2015-11-03-17.06.41.415.docx
Request;20150821-000034;84630;PACE;Inpatient;PACE;C:\Users\FGuo\Documents\work doucment\attachment\attachmentDB\20161005\originalFileFromAerial\DOCSVC_20161003.tar\DOCSVC_20161003\DOCSVC_20161003\INPATIENT\REQ_20150821-000034\doris levinson10_2015-09-11-11.04.13.621.tif
Request;20150821-000034;84630;PACE;Inpatient;PACE;C:\Users\FGuo\Documents\work doucment\attachment\attachmentDB\20161005\originalFileFromAerial\DOCSVC_20161003.tar\DOCSVC_20161003\DOCSVC_20161003\INPATIENT\REQ_20150821-000034\doris levinsonpript_2015-08-21-12.57.00.368.tif
Request;20150821-000034;84630;PACE;Inpatient;PACE;C:\Users\FGuo\Documents\work doucment\attachment\attachmentDB\20161005\originalFileFromAerial\DOCSVC_20161003.tar\DOCSVC_20161003\DOCSVC_20161003\INPATIENT\REQ_20150821-000034\Levinson, Doris 84630 Auth Approval Letter_2015-08-25-11.51.08.947.doc
Request;20150821-000034;84630;PACE;Inpatient;PACE;C:\Users\FGuo\Documents\work doucment\attachment\attachmentDB\20161005\originalFileFromAerial\DOCSVC_20161003.tar\DOCSVC_20161003\DOCSVC_20161003\INPATIENT\REQ_20150821-000034\Levinson, Doris 84630 Auth Approval Letter_2015-08-25-11.53.57.62.doc
Request;20150821-000038;70139;PACE;Inpatient;PACE;C:\Users\FGuo\Documents\work doucment\attachment\attachmentDB\20161005\originalFileFromAerial\DOCSVC_20161003.tar\DOCSVC_20161003\DOCSVC_20161003\INPATIENT\REQ_20150821-000038\esther rosariopri_2015-08-21-13.29.09.489.tif
Request;20150821-000038;70139;PACE;Inpatient;PACE;C:\Users\FGuo\Documents\work doucment\attachment\attachmentDB\20161005\originalFileFromAerial\DOCSVC_20161003.tar\DOCSVC_20161003\DOCSVC_20161003\INPATIENT\REQ_20150821-000038\Rosario, Esther 70139 Auth Approval Letter_2015-08-26-10.17.00.871.doc
Request;20150821-000044;42561;PACE;Inpatient;PACE;C:\Users\FGuo\Documents\work doucment\attachment\attachmentDB\20161005\originalFileFromAerial\DOCSVC_20161003.tar\DOCSVC_20161003\DOCSVC_20161003\INPATIENT\REQ_20150821-000044\Merritt, Geraldine 42561 Auth Approval Letter_2015-08-25-14.18.03.3.doc
Request;20150821-000045;97961;PACE;Inpatient;PACE;C:\Users\FGuo\Documents\work doucment\attachment\attachmentDB\20161005\originalFileFromAerial\DOCSVC_20161003.tar\DOCSVC_20161003\DOCSVC_20161003\INPATIENT\REQ_20150821-000045\edwar hattie2_2015-09-02-11.39.16.701.tif
Request;20150821-000045;97961;PACE;Inpatient;PACE;C:\Users\FGuo\Documents\work doucment\attachment\attachmentDB\20161005\originalFileFromAerial\DOCSVC_20161003.tar\DOCSVC_20161003\DOCSVC_20161003\INPATIENT\REQ_20150821-000045\Edward Hattie25_2015-08-25-16.19.25.49.tif
Request;20150821-000054;40297;SELECT;Inpatient;SELECT;C:\Users\FGuo\Documents\work doucment\attachment\attachmentDB\20161005\originalFileFromAerial\DOCSVC_20161003.tar\DOCSVC_20161003\DOCSVC_20161003\INPATIENT\REQ_20150821-000054\Watts, Dorothy--St Barnabas Hospital---Clinical Review Request Form 8-21-15_2015-08-21-15.22.07.16.docx
Request;20150821-000054;40297;SELECT;Inpatient;SELECT;C:\Users\FGuo\Documents\work doucment\attachment\attachmentDB\20161005\originalFileFromAerial\DOCSVC_20161003.tar\DOCSVC_20161003\DOCSVC_20161003\INPATIENT\REQ_20150821-000054\watts,dorothy824_2015-08-24-12.07.23.302.tif
Request;20150821-000054;40297;SELECT;Inpatient;SELECT;C:\Users\FGuo\Documents\work doucment\attachment\attachmentDB\20161005\originalFileFromAerial\DOCSVC_20161003.tar\DOCSVC_20161003\DOCSVC_20161003\INPATIENT\REQ_20150821-000054\watts,dorothy_2015-08-24-08.36.08.170.tif
Request;20150821-000056;72902;PACE;Inpatient;PACE;C:\Users\FGuo\Documents\work doucment\attachment\attachmentDB\20161005\originalFileFromAerial\DOCSVC_20161003.tar\DOCSVC_20161003\DOCSVC_20161003\INPATIENT\REQ_20150821-000056\Bradshaw Mattie IP Denial Montefiore Medical Center 8-31-15_2015-08-31-12.08.19.778.docx
Request;20150821-000056;72902;PACE;Inpatient;PACE;C:\Users\FGuo\Documents\work doucment\attachment\attachmentDB\20161005\originalFileFromAerial\DOCSVC_20161003.tar\DOCSVC_20161003\DOCSVC_20161003\INPATIENT\REQ_20150821-000056\Bradshaw Mattie IP Denial Montefiore Medical Center 8-31-15_2015-08-31-13.55.37.535.docx
Request;20150821-000056;72902;PACE;Inpatient;PACE;C:\Users\FGuo\Documents\work doucment\attachment\attachmentDB\20161005\originalFileFromAerial\DOCSVC_20161003.tar\DOCSVC_20161003\DOCSVC_20161003\INPATIENT\REQ_20150821-000056\Bradshaw Mattie IP Denial Montefiore Medical Center 8-31-15_2015-09-02-14.28.28.839.docx
Request;20150821-000056;72902;PACE;Inpatient;PACE;C:\Users\FGuo\Documents\work doucment\attachment\attachmentDB\20161005\originalFileFromAerial\DOCSVC_20161003.tar\DOCSVC_20161003\DOCSVC_20161003\INPATIENT\REQ_20150821-000056\bradshaw821_2015-08-24-16.43.31.188.tif
Request;20150821-000056;72902;PACE;Inpatient;PACE;C:\Users\FGuo\Documents\work doucment\attachment\attachmentDB\20161005\originalFileFromAerial\DOCSVC_20161003.tar\DOCSVC_20161003\DOCSVC_20161003\INPATIENT\REQ_20150821-000056\bradshawDC_2015-08-25-11.19.41.115.tif
Request;20150821-000056;72902;PACE;Inpatient;PACE;C:\Users\FGuo\Documents\work doucment\attachment\attachmentDB\20161005\originalFileFromAerial\DOCSVC_20161003.tar\DOCSVC_20161003\DOCSVC_20161003\INPATIENT\REQ_20150821-000056\bradshawDC_2015-08-31-09.51.11.670.tif
Request;20150821-000060;21722;PACE;Inpatient;PACE;C:\Users\FGuo\Documents\work doucment\attachment\attachmentDB\20161005\originalFileFromAerial\DOCSVC_20161003.tar\DOCSVC_20161003\DOCSVC_20161003\INPATIENT\REQ_20150821-000060\Ringenberger, Robert -Hudson View Care Center DBA Regency Extended Care Center   8.25.15_2015-08-25-15.00.49.945.docx
Request;20150824-000001;52202;PACE;Inpatient;PACE;C:\Users\FGuo\Documents\work doucment\attachment\attachmentDB\20161005\originalFileFromAerial\DOCSVC_20161003.tar\DOCSVC_20161003\DOCSVC_20161003\INPATIENT\REQ_20150824-000001\Music Hajrija IP Denial NY Hospital Queens 8-27-15_2015-08-27-13.04.40.697.docx
Request;20150824-000001;52202;PACE;Inpatient;PACE;C:\Users\FGuo\Documents\work doucment\attachment\attachmentDB\20161005\originalFileFromAerial\DOCSVC_20161003.tar\DOCSVC_20161003\DOCSVC_20161003\INPATIENT\REQ_20150824-000001\MUSIC, HAJRIJA - UR_2015-08-24-08.39.03.409.tif
Request;20150824-000001;52202;PACE;Inpatient;PACE;C:\Users\FGuo\Documents\work doucment\attachment\attachmentDB\20161005\originalFileFromAerial\DOCSVC_20161003.tar\DOCSVC_20161003\DOCSVC_20161003\INPATIENT\REQ_20150824-000001\Music, Hajrija Appeal Acknowledgement Letter_2015-10-01-12.09.04.401.docx
Request;20150824-000001;52202;PACE;Inpatient;PACE;C:\Users\FGuo\Documents\work doucment\attachment\attachmentDB\20161005\originalFileFromAerial\DOCSVC_20161003.tar\DOCSVC_20161003\DOCSVC_20161003\INPATIENT\REQ_20150824-000001\Music, Hajrija MR_2015-10-01-12.09.35.219.pdf
Request;20150824-000015;23709;SELECT;Inpatient;SELECT;C:\Users\FGuo\Documents\work doucment\attachment\attachmentDB\20161005\originalFileFromAerial\DOCSVC_20161003.tar\DOCSVC_20161003\DOCSVC_20161003\INPATIENT\REQ_20150824-000015\Cheung, Chiukan(2nd Document)- Union Plaza Nursing Home  8.24.15_2015-08-24-14.23.47.432.docx
Request;20150824-000015;23709;SELECT;Inpatient;SELECT;C:\Users\FGuo\Documents\work doucment\attachment\attachmentDB\20161005\originalFileFromAerial\DOCSVC_20161003.tar\DOCSVC_20161003\DOCSVC_20161003\INPATIENT\REQ_20150824-000015\Chiukan Cheunh UR 8-19-15_2015-08-24-10.35.58.131.tif
Request;20150824-000016;26433;PACE;Inpatient;PACE;C:\Users\FGuo\Documents\work doucment\attachment\attachmentDB\20161005\originalFileFromAerial\DOCSVC_20161003.tar\DOCSVC_20161003\DOCSVC_20161003\INPATIENT\REQ_20150824-000016\Morales Vivian IP Denial Staten Island University Hospital 8-28-15_2015-08-28-12.53.25.390.docx
Request;20150824-000016;26433;PACE;Inpatient;PACE;C:\Users\FGuo\Documents\work doucment\attachment\attachmentDB\20161005\originalFileFromAerial\DOCSVC_20161003.tar\DOCSVC_20161003\DOCSVC_20161003\INPATIENT\REQ_20150824-000016\Morales Vivian IP Denial Staten Island University Hospital 8-28-15_2015-08-28-14.08.30.654.docx
Request;20150824-000016;26433;PACE;Inpatient;PACE;C:\Users\FGuo\Documents\work doucment\attachment\attachmentDB\20161005\originalFileFromAerial\DOCSVC_20161003.tar\DOCSVC_20161003\DOCSVC_20161003\INPATIENT\REQ_20150824-000016\Morales, Vivian Appeal Acknowledgement Letter_2015-10-15-14.15.39.276.docx
Request;20150824-000016;26433;PACE;Inpatient;PACE;C:\Users\FGuo\Documents\work doucment\attachment\attachmentDB\20161005\originalFileFromAerial\DOCSVC_20161003.tar\DOCSVC_20161003\DOCSVC_20161003\INPATIENT\REQ_20150824-000016\Morales, Vivian-Staten Island Univer Hosp North-Clinical Review Request Form 8-24-15_2015-08-24-10.48.38.826.docx
Request;20150824-000016;26433;PACE;Inpatient;PACE;C:\Users\FGuo\Documents\work doucment\attachment\attachmentDB\20161005\originalFileFromAerial\DOCSVC_20161003.tar\DOCSVC_20161003\DOCSVC_20161003\INPATIENT\REQ_20150824-000016\Vivian Morales UR 8-27-15_2015-08-27-12.46.46.983.tif
Request;20150824-000021;39591;DIRECT;Inpatient;DIRECT;C:\Users\FGuo\Documents\work doucment\attachment\attachmentDB\20161005\originalFileFromAerial\DOCSVC_20161003.tar\DOCSVC_20161003\DOCSVC_20161003\INPATIENT\REQ_20150824-000021\Stapleton Iris DIRECT - NY Hospital of Queens 9-15-15_2015-09-15-11.34.11.578.docx
Request;20150824-000021;39591;DIRECT;Inpatient;DIRECT;C:\Users\FGuo\Documents\work doucment\attachment\attachmentDB\20161005\originalFileFromAerial\DOCSVC_20161003.tar\DOCSVC_20161003\DOCSVC_20161003\INPATIENT\REQ_20150824-000021\STAPLETON, IRIS - ADMISSION REQUEST_2015-08-24-11.20.39.764.tif
Request;20150824-000023;44378;PACE;Inpatient;PACE;C:\Users\FGuo\Documents\work doucment\attachment\attachmentDB\20161005\originalFileFromAerial\DOCSVC_20161003.tar\DOCSVC_20161003\DOCSVC_20161003\INPATIENT\REQ_20150824-000023\Quinones Antonio IP Denial Montefiore Medical Center 8-28-15_2015-08-28-11.38.06.288.docx
Request;20150824-000023;44378;PACE;Inpatient;PACE;C:\Users\FGuo\Documents\work doucment\attachment\attachmentDB\20161005\originalFileFromAerial\DOCSVC_20161003.tar\DOCSVC_20161003\DOCSVC_20161003\INPATIENT\REQ_20150824-000023\quinones,antonio_2015-08-24-13.48.50.3.tif
Request;20150824-000023;44378;PACE;Inpatient;PACE;C:\Users\FGuo\Documents\work doucment\attachment\attachmentDB\20161005\originalFileFromAerial\DOCSVC_20161003.tar\DOCSVC_20161003\DOCSVC_20161003\INPATIENT\REQ_20150824-000023\quinonesDCsum_2015-08-25-14.39.34.574.tif
Request;20150824-000023;44378;PACE;Inpatient;PACE;C:\Users\FGuo\Documents\work doucment\attachment\attachmentDB\20161005\originalFileFromAerial\DOCSVC_20161003.tar\DOCSVC_20161003\DOCSVC_20161003\INPATIENT\REQ_20150824-000023\_2015-08-25-14.39.08.685
Request;20150824-000028;84942;null;Inpatient;PACE;C:\Users\FGuo\Documents\work doucment\attachment\attachmentDB\20161005\originalFileFromAerial\DOCSVC_20161003.tar\DOCSVC_20161003\DOCSVC_20161003\INPATIENT\REQ_20150824-000028\Robinson, Pauline_2015-08-24-11.57.50.920.tif
Request;20150824-000031;78049;PACE;Inpatient;PACE;C:\Users\FGuo\Documents\work doucment\attachment\attachmentDB\20161005\originalFileFromAerial\DOCSVC_20161003.tar\DOCSVC_20161003\DOCSVC_20161003\INPATIENT\REQ_20150824-000031\ding rong26_2015-08-26-14.34.48.67.tif
Request;20150824-000031;78049;PACE;Inpatient;PACE;C:\Users\FGuo\Documents\work doucment\attachment\attachmentDB\20161005\originalFileFromAerial\DOCSVC_20161003.tar\DOCSVC_20161003\DOCSVC_20161003\INPATIENT\REQ_20150824-000031\ding rongpri_2015-08-24-12.11.55.993.tif
Request;20150824-000031;78049;PACE;Inpatient;PACE;C:\Users\FGuo\Documents\work doucment\attachment\attachmentDB\20161005\originalFileFromAerial\DOCSVC_20161003.tar\DOCSVC_20161003\DOCSVC_20161003\INPATIENT\REQ_20150824-000031\Ding, Rong -Atlantis Rehab & RHCF  9.3.15_2015-09-03-11.14.40.29.docx
Request;20150824-000034;28123;SELECT;Inpatient;SELECT;C:\Users\FGuo\Documents\work doucment\attachment\attachmentDB\20161005\originalFileFromAerial\DOCSVC_20161003.tar\DOCSVC_20161003\DOCSVC_20161003\INPATIENT\REQ_20150824-000034\chiu kwon08_2015-10-02-09.59.48.400.tif
Request;20150824-000034;28123;SELECT;Inpatient;SELECT;C:\Users\FGuo\Documents\work doucment\attachment\attachmentDB\20161005\originalFileFromAerial\DOCSVC_20161003.tar\DOCSVC_20161003\DOCSVC_20161003\INPATIENT\REQ_20150824-000034\chiu kwong09_2015-10-02-10.00.12.609.tif
Request;20150824-000034;28123;SELECT;Inpatient;SELECT;C:\Users\FGuo\Documents\work doucment\attachment\attachmentDB\20161005\originalFileFromAerial\DOCSVC_20161003.tar\DOCSVC_20161003\DOCSVC_20161003\INPATIENT\REQ_20150824-000034\chiu kwong_2015-10-02-09.58.41.580.tif
Request;20150824-000034;28123;SELECT;Inpatient;SELECT;C:\Users\FGuo\Documents\work doucment\attachment\attachmentDB\20161005\originalFileFromAerial\DOCSVC_20161003.tar\DOCSVC_20161003\DOCSVC_20161003\INPATIENT\REQ_20150824-000034\Kwong Chiu Adverse Determ Pavilion at Queens Rehab 10-15-15_2015-10-15-15.51.49.999.docx
Request;20150824-000034;28123;SELECT;Inpatient;SELECT;C:\Users\FGuo\Documents\work doucment\attachment\attachmentDB\20161005\originalFileFromAerial\DOCSVC_20161003.tar\DOCSVC_20161003\DOCSVC_20161003\INPATIENT\REQ_20150824-000034\Kwong Chiu MLTC -Pavilion at Queens Rehab 10-15-15_2015-10-15-15.52.21.624.docx
Request;20150824-000034;28123;SELECT;Inpatient;SELECT;C:\Users\FGuo\Documents\work doucment\attachment\attachmentDB\20161005\originalFileFromAerial\DOCSVC_20161003.tar\DOCSVC_20161003\DOCSVC_20161003\INPATIENT\REQ_20150824-000034\MX-3140N_20151207_145957_2015-12-07-15.38.55.177.pdf
Request;20150824-000036;85450;PACE;Inpatient;PACE;C:\Users\FGuo\Documents\work doucment\attachment\attachmentDB\20161005\originalFileFromAerial\DOCSVC_20161003.tar\DOCSVC_20161003\DOCSVC_20161003\INPATIENT\REQ_20150824-000036\Stewart, Jewel_2015-08-24-12.37.41.183.tif
Request;20150824-000036;85450;PACE;Inpatient;PACE;C:\Users\FGuo\Documents\work doucment\attachment\attachmentDB\20161005\originalFileFromAerial\DOCSVC_20161003.tar\DOCSVC_20161003\DOCSVC_20161003\INPATIENT\REQ_20150824-000036\stewart,jewel2_2015-08-28-15.01.21.348.tif
Request;20150824-000037;80277;PACE;Inpatient;PACE;C:\Users\FGuo\Documents\work doucment\attachment\attachmentDB\20161005\originalFileFromAerial\DOCSVC_20161003.tar\DOCSVC_20161003\DOCSVC_20161003\INPATIENT\REQ_20150824-000037\choi hei wong ur_2015-08-27-17.31.01.728.tif
Request;20150824-000037;80277;PACE;Inpatient;PACE;C:\Users\FGuo\Documents\work doucment\attachment\attachmentDB\20161005\originalFileFromAerial\DOCSVC_20161003.tar\DOCSVC_20161003\DOCSVC_20161003\INPATIENT\REQ_20150824-000037\Wong, Choi Hei -NY Presby Hospital Columbus-Clinical Review Request Form 8-24-15_2015-08-24-12.56.00.946.docx
Request;20150824-000038;22824;SELECT;Inpatient;SELECT;C:\Users\FGuo\Documents\work doucment\attachment\attachmentDB\20161005\originalFileFromAerial\DOCSVC_20161003.tar\DOCSVC_20161003\DOCSVC_20161003\INPATIENT\REQ_20150824-000038\goldberger sarah_2015-08-27-16.04.19.736.tif
Request;20150824-000038;22824;SELECT;Inpatient;SELECT;C:\Users\FGuo\Documents\work doucment\attachment\attachmentDB\20161005\originalFileFromAerial\DOCSVC_20161003.tar\DOCSVC_20161003\DOCSVC_20161003\INPATIENT\REQ_20150824-000038\Goldberger, Sara -Henry J Carter Specialty Hospital, NYC Health & Hospital   8.25.15_2015-08-25-15.51.43.395.docx
Request;20150824-000038;22824;SELECT;Inpatient;SELECT;C:\Users\FGuo\Documents\work doucment\attachment\attachmentDB\20161005\originalFileFromAerial\DOCSVC_20161003.tar\DOCSVC_20161003\DOCSVC_20161003\INPATIENT\REQ_20150824-000038\sara Goldberger pri_2015-08-24-13.04.29.808.tif
Request;20150824-000038;22824;SELECT;Inpatient;SELECT;C:\Users\FGuo\Documents\work doucment\attachment\attachmentDB\20161005\originalFileFromAerial\DOCSVC_20161003.tar\DOCSVC_20161003\DOCSVC_20161003\INPATIENT\REQ_20150824-000038\sarah goldberger1_2015-09-01-14.36.18.650.tif
Request;20150824-000048;85728;PACE;Inpatient;PACE;C:\Users\FGuo\Documents\work doucment\attachment\attachmentDB\20161005\originalFileFromAerial\DOCSVC_20161003.tar\DOCSVC_20161003\DOCSVC_20161003\INPATIENT\REQ_20150824-000048\Ortiz Edith IP Denial Montefiore Medical Center 8-28-15_2015-08-28-11.17.02.93.docx
Request;20150824-000048;85728;PACE;Inpatient;PACE;C:\Users\FGuo\Documents\work doucment\attachment\attachmentDB\20161005\originalFileFromAerial\DOCSVC_20161003.tar\DOCSVC_20161003\DOCSVC_20161003\INPATIENT\REQ_20150824-000048\Ortiz, Edith -Montefiore Med Cen-Moses-Clinical Review Request Form 8-24-15_2015-08-24-14.58.47.87.docx
Request;20150824-000048;85728;PACE;Inpatient;PACE;C:\Users\FGuo\Documents\work doucment\attachment\attachmentDB\20161005\originalFileFromAerial\DOCSVC_20161003.tar\DOCSVC_20161003\DOCSVC_20161003\INPATIENT\REQ_20150824-000048\Ortiz, Edith Appeal Letter & MR_2016-06-13-12.42.06.126.tif
Request;20150824-000048;85728;PACE;Inpatient;PACE;C:\Users\FGuo\Documents\work doucment\attachment\attachmentDB\20161005\originalFileFromAerial\DOCSVC_20161003.tar\DOCSVC_20161003\DOCSVC_20161003\INPATIENT\REQ_20150824-000048\ortiz,edith826_2015-08-26-15.03.09.461.tif
Request;20150824-000052;85728;PACE;Inpatient;PACE;C:\Users\FGuo\Documents\work doucment\attachment\attachmentDB\20161005\originalFileFromAerial\DOCSVC_20161003.tar\DOCSVC_20161003\DOCSVC_20161003\INPATIENT\REQ_20150824-000052\edith ortiz1_2015-09-01-12.54.20.286.tif
Request;20150824-000052;85728;PACE;Inpatient;PACE;C:\Users\FGuo\Documents\work doucment\attachment\attachmentDB\20161005\originalFileFromAerial\DOCSVC_20161003.tar\DOCSVC_20161003\DOCSVC_20161003\INPATIENT\REQ_20150824-000052\edith ortiz26_2015-08-26-14.56.43.603.tif
Request;20150824-000052;85728;PACE;Inpatient;PACE;C:\Users\FGuo\Documents\work doucment\attachment\attachmentDB\20161005\originalFileFromAerial\DOCSVC_20161003.tar\DOCSVC_20161003\DOCSVC_20161003\INPATIENT\REQ_20150824-000052\ortiz,ePRI_2015-08-24-16.14.09.558.tif
Request;20150824-000054;44383;FIDA;Inpatient;FIDA;C:\Users\FGuo\Documents\work doucment\attachment\attachmentDB\20161005\originalFileFromAerial\DOCSVC_20161003.tar\DOCSVC_20161003\DOCSVC_20161003\INPATIENT\REQ_20150824-000054\Frances McWeeney NH note 8-27-15_2015-08-28-08.42.57.553.tif
Request;20150824-000054;44383;FIDA;Inpatient;FIDA;C:\Users\FGuo\Documents\work doucment\attachment\attachmentDB\20161005\originalFileFromAerial\DOCSVC_20161003.tar\DOCSVC_20161003\DOCSVC_20161003\INPATIENT\REQ_20150824-000054\Frances McWeeney NH note 8-27-15_2015-08-31-08.27.08.937.tif
Request;20150824-000054;44383;FIDA;Inpatient;FIDA;C:\Users\FGuo\Documents\work doucment\attachment\attachmentDB\20161005\originalFileFromAerial\DOCSVC_20161003.tar\DOCSVC_20161003\DOCSVC_20161003\INPATIENT\REQ_20150824-000054\Frances McWeeney NH note 9-24-15_2015-09-25-08.12.12.471.tif
Request;20150824-000054;44383;FIDA;Inpatient;FIDA;C:\Users\FGuo\Documents\work doucment\attachment\attachmentDB\20161005\originalFileFromAerial\DOCSVC_20161003.tar\DOCSVC_20161003\DOCSVC_20161003\INPATIENT\REQ_20150824-000054\Frances McWeeney NH note 9-3-15_2015-09-04-11.35.05.352.tif
Request;20150824-000054;44383;FIDA;Inpatient;FIDA;C:\Users\FGuo\Documents\work doucment\attachment\attachmentDB\20161005\originalFileFromAerial\DOCSVC_20161003.tar\DOCSVC_20161003\DOCSVC_20161003\INPATIENT\REQ_20150824-000054\Frances McWeeney PRI 8-24-15_2015-08-25-13.04.40.100.tif
Request;20150824-000054;44383;FIDA;Inpatient;FIDA;C:\Users\FGuo\Documents\work doucment\attachment\attachmentDB\20161005\originalFileFromAerial\DOCSVC_20161003.tar\DOCSVC_20161003\DOCSVC_20161003\INPATIENT\REQ_20150824-000054\McWeeney, Frances 44383 Auth Approval Letter_2015-08-26-16.20.18.814.doc
Request;20150824-000055;58640;PACE;Inpatient;PACE;C:\Users\FGuo\Documents\work doucment\attachment\attachmentDB\20161005\originalFileFromAerial\DOCSVC_20161003.tar\DOCSVC_20161003\DOCSVC_20161003\INPATIENT\REQ_20150824-000055\Maria Soru PRI 8-24-15_2015-08-24-15.47.08.769.tif
Request;20150824-000055;58640;PACE;Inpatient;PACE;C:\Users\FGuo\Documents\work doucment\attachment\attachmentDB\20161005\originalFileFromAerial\DOCSVC_20161003.tar\DOCSVC_20161003\DOCSVC_20161003\INPATIENT\REQ_20150824-000055\Soru, Maria- Elmhurst Care Center 8.25.15_2015-08-25-16.32.53.695.docx
Request;20150825-000002;81341;FIDA;Inpatient;FIDA;C:\Users\FGuo\Documents\work doucment\attachment\attachmentDB\20161005\originalFileFromAerial\DOCSVC_20161003.tar\DOCSVC_20161003\DOCSVC_20161003\INPATIENT\REQ_20150825-000002\Final Adverse Determination Appeal Unfavorable-Contracted Hospitals_2015-12-28-10.54.57.419.docx
Request;20150825-000002;81341;FIDA;Inpatient;FIDA;C:\Users\FGuo\Documents\work doucment\attachment\attachmentDB\20161005\originalFileFromAerial\DOCSVC_20161003.tar\DOCSVC_20161003\DOCSVC_20161003\INPATIENT\REQ_20150825-000002\Lima Kathleen -FIDA IP Denial Montefiore Medical Center 8-28-15_2015-08-28-11.07.50.288.docx
Request;20150825-000002;81341;FIDA;Inpatient;FIDA;C:\Users\FGuo\Documents\work doucment\attachment\attachmentDB\20161005\originalFileFromAerial\DOCSVC_20161003.tar\DOCSVC_20161003\DOCSVC_20161003\INPATIENT\REQ_20150825-000002\Lima Kathleen -FIDA IP Denial Montefiore Medical Center 8-28-15_2015-08-28-14.01.52.136.docx
Request;20150825-000002;81341;FIDA;Inpatient;FIDA;C:\Users\FGuo\Documents\work doucment\attachment\attachmentDB\20161005\originalFileFromAerial\DOCSVC_20161003.tar\DOCSVC_20161003\DOCSVC_20161003\INPATIENT\REQ_20150825-000002\lima,kathleen_2015-08-25-11.49.07.60.tif
Request;20150825-000002;81341;FIDA;Inpatient;FIDA;C:\Users\FGuo\Documents\work doucment\attachment\attachmentDB\20161005\originalFileFromAerial\DOCSVC_20161003.tar\DOCSVC_20161003\DOCSVC_20161003\INPATIENT\REQ_20150825-000002\Medical Record _2015-12-21-12.51.04.39.pdf
Request;20150825-000002;81341;FIDA;Inpatient;FIDA;C:\Users\FGuo\Documents\work doucment\attachment\attachmentDB\20161005\originalFileFromAerial\DOCSVC_20161003.tar\DOCSVC_20161003\DOCSVC_20161003\INPATIENT\REQ_20150825-000002\PRA-1  Appeal Acknowledgement _2015-10-29-12.12.06.680.docx
Request;20150825-000003;22493;PACE;Inpatient;PACE;C:\Users\FGuo\Documents\work doucment\attachment\attachmentDB\20161005\originalFileFromAerial\DOCSVC_20161003.tar\DOCSVC_20161003\DOCSVC_20161003\INPATIENT\REQ_20150825-000003\JETER, CATHERINE - ADMISSION_2015-08-25-09.40.04.404.tif
Request;20150825-000004;28940;PACE;Inpatient;PACE;C:\Users\FGuo\Documents\work doucment\attachment\attachmentDB\20161005\originalFileFromAerial\DOCSVC_20161003.tar\DOCSVC_20161003\DOCSVC_20161003\INPATIENT\REQ_20150825-000004\Thompson, Charles  -Montefiore Med Cen-Moses-Clinical Review Request Form 8-25-15_2015-08-25-10.04.40.289.docx
Request;20150825-000004;28940;PACE;Inpatient;PACE;C:\Users\FGuo\Documents\work doucment\attachment\attachmentDB\20161005\originalFileFromAerial\DOCSVC_20161003.tar\DOCSVC_20161003\DOCSVC_20161003\INPATIENT\REQ_20150825-000004\thompson,charles_2015-08-26-08.43.24.859.tif
Request;20150825-000004;28940;PACE;Inpatient;PACE;C:\Users\FGuo\Documents\work doucment\attachment\attachmentDB\20161005\originalFileFromAerial\DOCSVC_20161003.tar\DOCSVC_20161003\DOCSVC_20161003\INPATIENT\REQ_20150825-000004\_2015-08-26-08.43.13.977
Request;20150825-000005;81602;PACE;Inpatient;PACE;C:\Users\FGuo\Documents\work doucment\attachment\attachmentDB\20161005\originalFileFromAerial\DOCSVC_20161003.tar\DOCSVC_20161003\DOCSVC_20161003\INPATIENT\REQ_20150825-000005\rodriguez-hospice_2015-08-25-11.16.21.964.tif
Request;20150825-000007;85298;PACE;Inpatient;PACE;C:\Users\FGuo\Documents\work doucment\attachment\attachmentDB\20161005\originalFileFromAerial\DOCSVC_20161003.tar\DOCSVC_20161003\DOCSVC_20161003\INPATIENT\REQ_20150825-000007\chiu shea kwong1_2015-09-10-11.23.22.972.tif
Request;20150825-000007;85298;PACE;Inpatient;PACE;C:\Users\FGuo\Documents\work doucment\attachment\attachmentDB\20161005\originalFileFromAerial\DOCSVC_20161003.tar\DOCSVC_20161003\DOCSVC_20161003\INPATIENT\REQ_20150825-000007\chiu shea kwong_2015-08-28-10.35.29.235.tif
Request;20150825-000007;85298;PACE;Inpatient;PACE;C:\Users\FGuo\Documents\work doucment\attachment\attachmentDB\20161005\originalFileFromAerial\DOCSVC_20161003.tar\DOCSVC_20161003\DOCSVC_20161003\INPATIENT\REQ_20150825-000007\SChiu_2015-08-25-11.21.36.904.tif
Request;20150825-000007;85298;PACE;Inpatient;PACE;C:\Users\FGuo\Documents\work doucment\attachment\attachmentDB\20161005\originalFileFromAerial\DOCSVC_20161003.tar\DOCSVC_20161003\DOCSVC_20161003\INPATIENT\REQ_20150825-000007\SKChiu_2015-09-21-12.25.53.150.tif
Request;20150825-000008;80792;PACE;Inpatient;PACE;C:\Users\FGuo\Documents\work doucment\attachment\attachmentDB\20161005\originalFileFromAerial\DOCSVC_20161003.tar\DOCSVC_20161003\DOCSVC_20161003\INPATIENT\REQ_20150825-000008\Dever, Rosemary - St Joseph Hosp  Clinical Review Request Form 8-25-15_2015-08-25-10.41.32.681.docx
Request;20150825-000008;80792;PACE;Inpatient;PACE;C:\Users\FGuo\Documents\work doucment\attachment\attachmentDB\20161005\originalFileFromAerial\DOCSVC_20161003.tar\DOCSVC_20161003\DOCSVC_20161003\INPATIENT\REQ_20150825-000008\Rosemary Dever UR 8-28-15_2015-08-31-07.26.53.310.tif
Request;20150825-000012;27445;SELECT;Inpatient;SELECT;C:\Users\FGuo\Documents\work doucment\attachment\attachmentDB\20161005\originalFileFromAerial\DOCSVC_20161003.tar\DOCSVC_20161003\DOCSVC_20161003\INPATIENT\REQ_20150825-000012\Dorothy Searvant NH notes 8-18-15_2015-08-25-11.13.04.78.tif
Request;20150825-000012;27445;SELECT;Inpatient;SELECT;C:\Users\FGuo\Documents\work doucment\attachment\attachmentDB\20161005\originalFileFromAerial\DOCSVC_20161003.tar\DOCSVC_20161003\DOCSVC_20161003\INPATIENT\REQ_20150825-000012\Searvant, Dorothy - Holliswood Care Center, Inc  8.26.15_2015-08-26-15.33.22.74.docx
Request;20150825-000020;54618;DIRECT;Inpatient;DIRECT;C:\Users\FGuo\Documents\work doucment\attachment\attachmentDB\20161005\originalFileFromAerial\DOCSVC_20161003.tar\DOCSVC_20161003\DOCSVC_20161003\INPATIENT\REQ_20150825-000020\AJagmohan 83115_2015-09-01-11.14.42.636.tif
Request;20150825-000020;54618;DIRECT;Inpatient;DIRECT;C:\Users\FGuo\Documents\work doucment\attachment\attachmentDB\20161005\originalFileFromAerial\DOCSVC_20161003.tar\DOCSVC_20161003\DOCSVC_20161003\INPATIENT\REQ_20150825-000020\Jagmhan Alice DIRECT IP Denial NY Methodist Hospital 9-1-15_2015-09-01-16.15.13.30.docx
Request;20150825-000020;54618;DIRECT;Inpatient;DIRECT;C:\Users\FGuo\Documents\work doucment\attachment\attachmentDB\20161005\originalFileFromAerial\DOCSVC_20161003.tar\DOCSVC_20161003\DOCSVC_20161003\INPATIENT\REQ_20150825-000020\Jagmhan Alice DIRECT IP Denial NY Methodist Hospital 9-1-15_2015-09-01-17.02.39.17.docx
Request;20150825-000020;54618;DIRECT;Inpatient;DIRECT;C:\Users\FGuo\Documents\work doucment\attachment\attachmentDB\20161005\originalFileFromAerial\DOCSVC_20161003.tar\DOCSVC_20161003\DOCSVC_20161003\INPATIENT\REQ_20150825-000020\Jagmohan Alice DIRECT IP Denial NY Methodist Hospital 9-1-15_2015-09-02-12.23.39.3.docx
Request;20150825-000021;51032;DIRECT;Inpatient;DIRECT;C:\Users\FGuo\Documents\work doucment\attachment\attachmentDB\20161005\originalFileFromAerial\DOCSVC_20161003.tar\DOCSVC_20161003\DOCSVC_20161003\INPATIENT\REQ_20150825-000021\chalk,barbara_2015-08-28-14.50.00.616.tif
Request;20150825-000029;58640;PACE;Inpatient;PACE;C:\Users\FGuo\Documents\work doucment\attachment\attachmentDB\20161005\originalFileFromAerial\DOCSVC_20161003.tar\DOCSVC_20161003\DOCSVC_20161003\INPATIENT\REQ_20150825-000029\Maria Soru Hospice Reeequest 8-25-15_2015-08-25-13.40.21.530.tif
Request;20150825-000029;58640;PACE;Inpatient;PACE;C:\Users\FGuo\Documents\work doucment\attachment\attachmentDB\20161005\originalFileFromAerial\DOCSVC_20161003.tar\DOCSVC_20161003\DOCSVC_20161003\INPATIENT\REQ_20150825-000029\Soru, Maria- Hospice of NY, LLC  8.26.15_2015-08-26-16.49.23.285.docx
Request;20150825-000031;74742;PACE;Inpatient;PACE;C:\Users\FGuo\Documents\work doucment\attachment\attachmentDB\20161005\originalFileFromAerial\DOCSVC_20161003.tar\DOCSVC_20161003\DOCSVC_20161003\INPATIENT\REQ_20150825-000031\ana verdejopri_2015-08-25-16.09.41.601.tif
Request;20150825-000031;74742;PACE;Inpatient;PACE;C:\Users\FGuo\Documents\work doucment\attachment\attachmentDB\20161005\originalFileFromAerial\DOCSVC_20161003.tar\DOCSVC_20161003\DOCSVC_20161003\INPATIENT\REQ_20150825-000031\Verejo, Ana 74742  Auth Approval Letter_2015-08-26-14.48.53.325.doc
Request;20150825-000037;55864;SELECT;Inpatient;PACE;C:\Users\FGuo\Documents\work doucment\attachment\attachmentDB\20161005\originalFileFromAerial\DOCSVC_20161003.tar\DOCSVC_20161003\DOCSVC_20161003\INPATIENT\REQ_20150825-000037\Rosa Marino PACE-NY Presbyterian Hospital 9-1-15_2015-09-01-15.05.00.397.docx
Request;20150825-000037;55864;SELECT;Inpatient;PACE;C:\Users\FGuo\Documents\work doucment\attachment\attachmentDB\20161005\originalFileFromAerial\DOCSVC_20161003.tar\DOCSVC_20161003\DOCSVC_20161003\INPATIENT\REQ_20150825-000037\Rosa Marion MR DOS 08-10-15 - 08-11-15_2015-12-07-15.29.07.551.pdf
Request;20150825-000037;55864;SELECT;Inpatient;PACE;C:\Users\FGuo\Documents\work doucment\attachment\attachmentDB\20161005\originalFileFromAerial\DOCSVC_20161003.tar\DOCSVC_20161003\DOCSVC_20161003\INPATIENT\REQ_20150825-000037\Rosa, Marino Appeal ACK Letter_2015-12-07-15.28.21.895.docx
Request;20150825-000037;55864;SELECT;Inpatient;PACE;C:\Users\FGuo\Documents\work doucment\attachment\attachmentDB\20161005\originalFileFromAerial\DOCSVC_20161003.tar\DOCSVC_20161003\DOCSVC_20161003\INPATIENT\REQ_20150825-000037\Rosa, Marino WOL_2015-12-07-15.28.34.578.TIF
Request;20150825-000038;31234;PACE;Inpatient;PACE;C:\Users\FGuo\Documents\work doucment\attachment\attachmentDB\20161005\originalFileFromAerial\DOCSVC_20161003.tar\DOCSVC_20161003\DOCSVC_20161003\INPATIENT\REQ_20150825-000038\ortega,ana825_2015-08-26-15.50.12.805.tif
Request;20150825-000038;31234;PACE;Inpatient;PACE;C:\Users\FGuo\Documents\work doucment\attachment\attachmentDB\20161005\originalFileFromAerial\DOCSVC_20161003.tar\DOCSVC_20161003\DOCSVC_20161003\INPATIENT\REQ_20150825-000038\ortega,ana825_2015-08-26-16.26.36.2.tif
Request;20150825-000041;40297;SELECT;Inpatient;SELECT;C:\Users\FGuo\Documents\work doucment\attachment\attachmentDB\20161005\originalFileFromAerial\DOCSVC_20161003.tar\DOCSVC_20161003\DOCSVC_20161003\INPATIENT\REQ_20150825-000041\watts,PRI_2015-10-19-14.55.47.476.tif
Request;20150825-000041;40297;SELECT;Inpatient;SELECT;C:\Users\FGuo\Documents\work doucment\attachment\attachmentDB\20161005\originalFileFromAerial\DOCSVC_20161003.tar\DOCSVC_20161003\DOCSVC_20161003\INPATIENT\REQ_20150825-000041\watts831_2015-10-19-14.57.29.830.tif
Request;20150825-000041;40297;SELECT;Inpatient;SELECT;C:\Users\FGuo\Documents\work doucment\attachment\attachmentDB\20161005\originalFileFromAerial\DOCSVC_20161003.tar\DOCSVC_20161003\DOCSVC_20161003\INPATIENT\REQ_20150825-000041\watts925_2015-10-19-14.58.45.363.tif
Request;20150825-000050;53304;DIRECT;Inpatient;DIRECT;C:\Users\FGuo\Documents\work doucment\attachment\attachmentDB\20161005\originalFileFromAerial\DOCSVC_20161003.tar\DOCSVC_20161003\DOCSVC_20161003\INPATIENT\REQ_20150825-000050\Moore, Hildegarde - White Plains Hospital Center Clinical Review Request 8-25-15_2015-08-25-16.55.19.914.docx
Request;20150825-000050;53304;DIRECT;Inpatient;DIRECT;C:\Users\FGuo\Documents\work doucment\attachment\attachmentDB\20161005\originalFileFromAerial\DOCSVC_20161003.tar\DOCSVC_20161003\DOCSVC_20161003\INPATIENT\REQ_20150825-000050\moore,hildegard_2015-08-26-16.12.15.916.tif
Request;20150825-000051;55661;DIRECT;Inpatient;DIRECT;C:\Users\FGuo\Documents\work doucment\attachment\attachmentDB\20161005\originalFileFromAerial\DOCSVC_20161003.tar\DOCSVC_20161003\DOCSVC_20161003\INPATIENT\REQ_20150825-000051\Zdanoff, Ruth - White Plains Hospital Center Clinical Review Request 8-25-15_2015-08-25-17.00.47.61.docx
Request;20150825-000051;55661;DIRECT;Inpatient;DIRECT;C:\Users\FGuo\Documents\work doucment\attachment\attachmentDB\20161005\originalFileFromAerial\DOCSVC_20161003.tar\DOCSVC_20161003\DOCSVC_20161003\INPATIENT\REQ_20150825-000051\zdanoff,ruth_2015-08-26-14.45.19.429.tif
Request;20150825-000052;43426;null;Inpatient;SELECT;C:\Users\FGuo\Documents\work doucment\attachment\attachmentDB\20161005\originalFileFromAerial\DOCSVC_20161003.tar\DOCSVC_20161003\DOCSVC_20161003\INPATIENT\REQ_20150825-000052\McDaniels, Jonathan (5th Document)- Nursing Care Center At Medford Multicare Inc   8.27.15_2015-09-03-09.49.21.479.docx
Request;20150825-000052;43426;null;Inpatient;SELECT;C:\Users\FGuo\Documents\work doucment\attachment\attachmentDB\20161005\originalFileFromAerial\DOCSVC_20161003.tar\DOCSVC_20161003\DOCSVC_20161003\INPATIENT\REQ_20150825-000052\McDaniels, Jonathan 5th Document Nursing Care Center At Medford Multicare Inc   8.27.15_2015-08-27-12.01.36.994.docx
Request;20150825-000055;20632;SELECT;Inpatient;SELECT;C:\Users\FGuo\Documents\work doucment\attachment\attachmentDB\20161005\originalFileFromAerial\DOCSVC_20161003.tar\DOCSVC_20161003\DOCSVC_20161003\INPATIENT\REQ_20150825-000055\Linda Rhames NH Notes 8-25-15_2015-08-25-17.35.44.912.tif
Request;20150825-000055;20632;SELECT;Inpatient;SELECT;C:\Users\FGuo\Documents\work doucment\attachment\attachmentDB\20161005\originalFileFromAerial\DOCSVC_20161003.tar\DOCSVC_20161003\DOCSVC_20161003\INPATIENT\REQ_20150825-000055\Rhames, Linda M(2nd Document)- Rego Park Nursing Home  8.27.15_2015-08-27-11.24.53.749.docx
Request;20150826-000001;41757;SELECT;Inpatient;SELECT;C:\Users\FGuo\Documents\work doucment\attachment\attachmentDB\20161005\originalFileFromAerial\DOCSVC_20161003.tar\DOCSVC_20161003\DOCSVC_20161003\INPATIENT\REQ_20150826-000001\Francis, Linette - Hillside Manor Nursing Home -8-27-15_2015-08-27-12.58.45.114.docx
Request;20150826-000001;41757;SELECT;Inpatient;SELECT;C:\Users\FGuo\Documents\work doucment\attachment\attachmentDB\20161005\originalFileFromAerial\DOCSVC_20161003.tar\DOCSVC_20161003\DOCSVC_20161003\INPATIENT\REQ_20150826-000001\Linette Francis NH Note 8-19-15_2015-08-26-07.41.17.433.tif
Request;20150826-000001;41757;SELECT;Inpatient;SELECT;C:\Users\FGuo\Documents\work doucment\attachment\attachmentDB\20161005\originalFileFromAerial\DOCSVC_20161003.tar\DOCSVC_20161003\DOCSVC_20161003\INPATIENT\REQ_20150826-000001\Linette Francis NH Note 8-24-15_2015-08-26-07.41.03.655.tif
Request;20150826-000001;41757;SELECT;Inpatient;SELECT;C:\Users\FGuo\Documents\work doucment\attachment\attachmentDB\20161005\originalFileFromAerial\DOCSVC_20161003.tar\DOCSVC_20161003\DOCSVC_20161003\INPATIENT\REQ_20150826-000001\Linette Francis NH Note 8-31-15_2015-08-31-13.51.48.226.tif
Request;20150826-000001;41757;SELECT;Inpatient;SELECT;C:\Users\FGuo\Documents\work doucment\attachment\attachmentDB\20161005\originalFileFromAerial\DOCSVC_20161003.tar\DOCSVC_20161003\DOCSVC_20161003\INPATIENT\REQ_20150826-000001\Linette Francis NH Note 9-8-15_2015-09-09-15.46.50.591.tif
Request;20150826-000002;33983;PACE;Inpatient;PACE;C:\Users\FGuo\Documents\work doucment\attachment\attachmentDB\20161005\originalFileFromAerial\DOCSVC_20161003.tar\DOCSVC_20161003\DOCSVC_20161003\INPATIENT\REQ_20150826-000002\Winder Linda IP Denial Montefiore Medical Center 8-28-15_2015-08-28-12.01.11.80.docx
Request;20150826-000002;33983;PACE;Inpatient;PACE;C:\Users\FGuo\Documents\work doucment\attachment\attachmentDB\20161005\originalFileFromAerial\DOCSVC_20161003.tar\DOCSVC_20161003\DOCSVC_20161003\INPATIENT\REQ_20150826-000002\WINDER, LINDA - UR_2015-08-26-09.20.24.119.tif
Request;20150826-000002;33983;PACE;Inpatient;PACE;C:\Users\FGuo\Documents\work doucment\attachment\attachmentDB\20161005\originalFileFromAerial\DOCSVC_20161003.tar\DOCSVC_20161003\DOCSVC_20161003\INPATIENT\REQ_20150826-000002\winder,linda825_2015-08-26-09.48.15.832.tif
Request;20150826-000003;88685;PACE;Inpatient;PACE;C:\Users\FGuo\Documents\work doucment\attachment\attachmentDB\20161005\originalFileFromAerial\DOCSVC_20161003.tar\DOCSVC_20161003\DOCSVC_20161003\INPATIENT\REQ_20150826-000003\alma cohen26_2015-08-26-17.30.28.136.tif
Request;20150826-000003;88685;PACE;Inpatient;PACE;C:\Users\FGuo\Documents\work doucment\attachment\attachmentDB\20161005\originalFileFromAerial\DOCSVC_20161003.tar\DOCSVC_20161003\DOCSVC_20161003\INPATIENT\REQ_20150826-000003\Cohen Alma IP Denial NY Presbyterian 8-28-15_2015-08-28-13.04.08.754.docx
Request;20150826-000003;88685;PACE;Inpatient;PACE;C:\Users\FGuo\Documents\work doucment\attachment\attachmentDB\20161005\originalFileFromAerial\DOCSVC_20161003.tar\DOCSVC_20161003\DOCSVC_20161003\INPATIENT\REQ_20150826-000003\Cohen Alma _2016-04-07-14.54.15.355.pdf
Request;20150826-000003;88685;PACE;Inpatient;PACE;C:\Users\FGuo\Documents\work doucment\attachment\attachmentDB\20161005\originalFileFromAerial\DOCSVC_20161003.tar\DOCSVC_20161003\DOCSVC_20161003\INPATIENT\REQ_20150826-000003\COHEN, ALMA - UR_2015-08-26-09.31.08.454.tif
Request;20150826-000004;26283;PACE;Inpatient;PACE;C:\Users\FGuo\Documents\work doucment\attachment\attachmentDB\20161005\originalFileFromAerial\DOCSVC_20161003.tar\DOCSVC_20161003\DOCSVC_20161003\INPATIENT\REQ_20150826-000004\Devi Sushila IP Denial Mt Sinai Hospital 8-28-15_2015-08-28-13.11.56.874.docx
Request;20150826-000004;26283;PACE;Inpatient;PACE;C:\Users\FGuo\Documents\work doucment\attachment\attachmentDB\20161005\originalFileFromAerial\DOCSVC_20161003.tar\DOCSVC_20161003\DOCSVC_20161003\INPATIENT\REQ_20150826-000004\Sushila Devi UR 8-27-15_2015-08-27-13.13.04.252.tif
Request;20150826-000008;56333;SELECT;Inpatient;SELECT;C:\Users\FGuo\Documents\work doucment\attachment\attachmentDB\20161005\originalFileFromAerial\DOCSVC_20161003.tar\DOCSVC_20161003\DOCSVC_20161003\INPATIENT\REQ_20150826-000008\Cerullo, Mary E- Nursing Care Center At Medford Multicare Inc   8.27.15_2015-08-27-13.34.25.498.docx
Request;20150826-000008;56333;SELECT;Inpatient;SELECT;C:\Users\FGuo\Documents\work doucment\attachment\attachmentDB\20161005\originalFileFromAerial\DOCSVC_20161003.tar\DOCSVC_20161003\DOCSVC_20161003\INPATIENT\REQ_20150826-000008\Mary Cerullo NH Notes 8-25-15_2015-08-26-10.20.15.825.tif
Request;20150826-000012;94347;PACE;Inpatient;PACE;C:\Users\FGuo\Documents\work doucment\attachment\attachmentDB\20161005\originalFileFromAerial\DOCSVC_20161003.tar\DOCSVC_20161003\DOCSVC_20161003\INPATIENT\REQ_20150826-000012\rosa,altagracia825_2015-08-26-10.56.21.528.tif
Request;20150826-000013;85528;DIRECT;Inpatient;DIRECT;C:\Users\FGuo\Documents\work doucment\attachment\attachmentDB\20161005\originalFileFromAerial\DOCSVC_20161003.tar\DOCSVC_20161003\DOCSVC_20161003\INPATIENT\REQ_20150826-000013\Berger Shirley DIRECT IP Denial Long Island Jewish Med Center 8-28-15docx_2015-08-28-13.21.41.681.docx
Request;20150826-000013;85528;DIRECT;Inpatient;DIRECT;C:\Users\FGuo\Documents\work doucment\attachment\attachmentDB\20161005\originalFileFromAerial\DOCSVC_20161003.tar\DOCSVC_20161003\DOCSVC_20161003\INPATIENT\REQ_20150826-000013\Berger Shirley DIRECT IP Denial Long Island Jewish Med Center 8-28-15docx_2015-08-28-13.34.05.559.docx
Request;20150826-000013;85528;DIRECT;Inpatient;DIRECT;C:\Users\FGuo\Documents\work doucment\attachment\attachmentDB\20161005\originalFileFromAerial\DOCSVC_20161003.tar\DOCSVC_20161003\DOCSVC_20161003\INPATIENT\REQ_20150826-000013\BERGER, SHIRLEY - ADMISSION_2015-09-14-15.25.47.282.tif
Request;20150826-000013;85528;DIRECT;Inpatient;DIRECT;C:\Users\FGuo\Documents\work doucment\attachment\attachmentDB\20161005\originalFileFromAerial\DOCSVC_20161003.tar\DOCSVC_20161003\DOCSVC_20161003\INPATIENT\REQ_20150826-000013\Berger, Shirley- NS Long Island Jewish MC  Clinical Review Request Form 8-26-15_2015-08-26-10.58.42.499.docx
Request;20150826-000013;85528;DIRECT;Inpatient;DIRECT;C:\Users\FGuo\Documents\work doucment\attachment\attachmentDB\20161005\originalFileFromAerial\DOCSVC_20161003.tar\DOCSVC_20161003\DOCSVC_20161003\INPATIENT\REQ_20150826-000013\Shirley Berger UR 8-27-15_2015-08-27-15.10.04.529.tif
Request;20150826-000014;75465;PACE;Inpatient;PACE;C:\Users\FGuo\Documents\work doucment\attachment\attachmentDB\20161005\originalFileFromAerial\DOCSVC_20161003.tar\DOCSVC_20161003\DOCSVC_20161003\INPATIENT\REQ_20150826-000014\fayanju,anne_2015-08-27-12.19.23.143.tif
Request;20150826-000015;47862;SELECT;Inpatient;SELECT;C:\Users\FGuo\Documents\work doucment\attachment\attachmentDB\20161005\originalFileFromAerial\DOCSVC_20161003.tar\DOCSVC_20161003\DOCSVC_20161003\INPATIENT\REQ_20150826-000015\WILLIS, IDA - CLINICAL_2015-08-26-11.36.28.675.tif
Request;20150826-000016;84214;PACE;Inpatient;Not Valued;C:\Users\FGuo\Documents\work doucment\attachment\attachmentDB\20161005\originalFileFromAerial\DOCSVC_20161003.tar\DOCSVC_20161003\DOCSVC_20161003\INPATIENT\REQ_20150826-000016\84124 RODRIGUEZ, FRANCES INPT NOTES_2015-08-26-11.46.46.877.tif
Request;20150826-000016;84214;PACE;Inpatient;Not Valued;C:\Users\FGuo\Documents\work doucment\attachment\attachmentDB\20161005\originalFileFromAerial\DOCSVC_20161003.tar\DOCSVC_20161003\DOCSVC_20161003\INPATIENT\REQ_20150826-000016\FRodriguez_2015-09-23-17.02.51.723.tif
Request;20150826-000016;84214;PACE;Inpatient;Not Valued;C:\Users\FGuo\Documents\work doucment\attachment\attachmentDB\20161005\originalFileFromAerial\DOCSVC_20161003.tar\DOCSVC_20161003\DOCSVC_20161003\INPATIENT\REQ_20150826-000016\Rodriguez, Frances - Lutheran Medical Center  9.9.15_2015-09-09-10.02.55.673.docx
Request;20150826-000017;86320;PACE;Inpatient;PACE;C:\Users\FGuo\Documents\work doucment\attachment\attachmentDB\20161005\originalFileFromAerial\DOCSVC_20161003.tar\DOCSVC_20161003\DOCSVC_20161003\INPATIENT\REQ_20150826-000017\HU, CHUANHAO - UR_2015-08-26-11.46.40.224.tif
Request;20150826-000022;84931;PACE;Inpatient;PACE;C:\Users\FGuo\Documents\work doucment\attachment\attachmentDB\20161005\originalFileFromAerial\DOCSVC_20161003.tar\DOCSVC_20161003\DOCSVC_20161003\INPATIENT\REQ_20150826-000022\castillo eladio11_2015-08-26-12.34.41.45.tif
Request;20150826-000022;84931;PACE;Inpatient;PACE;C:\Users\FGuo\Documents\work doucment\attachment\attachmentDB\20161005\originalFileFromAerial\DOCSVC_20161003.tar\DOCSVC_20161003\DOCSVC_20161003\INPATIENT\REQ_20150826-000022\castillo eladio17_2015-08-26-12.35.14.797.tif
Request;20150826-000022;84931;PACE;Inpatient;PACE;C:\Users\FGuo\Documents\work doucment\attachment\attachmentDB\20161005\originalFileFromAerial\DOCSVC_20161003.tar\DOCSVC_20161003\DOCSVC_20161003\INPATIENT\REQ_20150826-000022\Castillo, Eladio- Beth Abraham Nursing Home  8.27.15_2015-08-27-15.33.52.190.docx
Request;20150826-000026;25771;PACE;Inpatient;PACE;C:\Users\FGuo\Documents\work doucment\attachment\attachmentDB\20161005\originalFileFromAerial\DOCSVC_20161003.tar\DOCSVC_20161003\DOCSVC_20161003\INPATIENT\REQ_20150826-000026\Fahie Sydney IP Denial Bronx Lebanon Hospital Center 9-1-15_2015-09-01-15.17.31.680.docx
Request;20150826-000026;25771;PACE;Inpatient;PACE;C:\Users\FGuo\Documents\work doucment\attachment\attachmentDB\20161005\originalFileFromAerial\DOCSVC_20161003.tar\DOCSVC_20161003\DOCSVC_20161003\INPATIENT\REQ_20150826-000026\fahie,sydney_2015-08-26-14.26.19.101.tif
Request;20150826-000027;32356;DIRECT;Inpatient;DIRECT;C:\Users\FGuo\Documents\work doucment\attachment\attachmentDB\20161005\originalFileFromAerial\DOCSVC_20161003.tar\DOCSVC_20161003\DOCSVC_20161003\INPATIENT\REQ_20150826-000027\BESSERMAN, FLORENCE- ADMISSION_2015-08-26-14.36.17.152.tif
Request;20150826-000027;32356;DIRECT;Inpatient;DIRECT;C:\Users\FGuo\Documents\work doucment\attachment\attachmentDB\20161005\originalFileFromAerial\DOCSVC_20161003.tar\DOCSVC_20161003\DOCSVC_20161003\INPATIENT\REQ_20150826-000027\Florence Besserman PRI 9-8-15_2015-09-08-11.56.27.176.tif
Request;20150826-000027;32356;DIRECT;Inpatient;DIRECT;C:\Users\FGuo\Documents\work doucment\attachment\attachmentDB\20161005\originalFileFromAerial\DOCSVC_20161003.tar\DOCSVC_20161003\DOCSVC_20161003\INPATIENT\REQ_20150826-000027\Florence Besserman UR2  9-2-15_2015-09-02-11.56.29.262.tif
Request;20150826-000028;36519;SELECT;Inpatient;SELECT;C:\Users\FGuo\Documents\work doucment\attachment\attachmentDB\20161005\originalFileFromAerial\DOCSVC_20161003.tar\DOCSVC_20161003\DOCSVC_20161003\INPATIENT\REQ_20150826-000028\Litrovnikova, Sima - Dr. Alina Vasilyeva-Rozinger -8-28-15_2015-08-28-13.22.20.407.docx
Request;20150826-000028;36519;SELECT;Inpatient;SELECT;C:\Users\FGuo\Documents\work doucment\attachment\attachmentDB\20161005\originalFileFromAerial\DOCSVC_20161003.tar\DOCSVC_20161003\DOCSVC_20161003\INPATIENT\REQ_20150826-000028\Sima Litrovnikova NH Notes 7-13-15_2015-08-26-14.42.08.872.tif
Request;20150826-000028;36519;SELECT;Inpatient;SELECT;C:\Users\FGuo\Documents\work doucment\attachment\attachmentDB\20161005\originalFileFromAerial\DOCSVC_20161003.tar\DOCSVC_20161003\DOCSVC_20161003\INPATIENT\REQ_20150826-000028\Sima Litrovnikova NH Notes 7-18-15_2015-08-26-14.41.55.495.tif
Request;20150826-000042;37296;PACE;Inpatient;PACE;C:\Users\FGuo\Documents\work doucment\attachment\attachmentDB\20161005\originalFileFromAerial\DOCSVC_20161003.tar\DOCSVC_20161003\DOCSVC_20161003\INPATIENT\REQ_20150826-000042\Jenkins, Dorothy 37296 Auth Approval Letter_2015-08-27-10.43.29.936.doc
Request;20150826-000042;37296;PACE;Inpatient;PACE;C:\Users\FGuo\Documents\work doucment\attachment\attachmentDB\20161005\originalFileFromAerial\DOCSVC_20161003.tar\DOCSVC_20161003\DOCSVC_20161003\INPATIENT\REQ_20150826-000042\O_\Scans\PRI_Screen_Dorothy_Jenkins_37296_2015-08-26-16.03.39.607.pdf
Request;20150826-000045;26283;PACE;Inpatient;PACE;C:\Users\FGuo\Documents\work doucment\attachment\attachmentDB\20161005\originalFileFromAerial\DOCSVC_20161003.tar\DOCSVC_20161003\DOCSVC_20161003\INPATIENT\REQ_20150826-000045\devi sushila9_2015-09-15-12.56.23.215.tif
Request;20150826-000045;26283;PACE;Inpatient;PACE;C:\Users\FGuo\Documents\work doucment\attachment\attachmentDB\20161005\originalFileFromAerial\DOCSVC_20161003.tar\DOCSVC_20161003\DOCSVC_20161003\INPATIENT\REQ_20150826-000045\Devi, Sushila -  NY Rehab Care Management  - 8-28-15_2015-08-28-14.44.58.856.docx
Request;20150826-000045;26283;PACE;Inpatient;PACE;C:\Users\FGuo\Documents\work doucment\attachment\attachmentDB\20161005\originalFileFromAerial\DOCSVC_20161003.tar\DOCSVC_20161003\DOCSVC_20161003\INPATIENT\REQ_20150826-000045\Sushila Devi PRI 8-26-15_2015-08-26-16.29.05.550.tif
Request;20150827-000001;49805;PACE;Inpatient;PACE;C:\Users\FGuo\Documents\work doucment\attachment\attachmentDB\20161005\originalFileFromAerial\DOCSVC_20161003.tar\DOCSVC_20161003\DOCSVC_20161003\INPATIENT\REQ_20150827-000001\Silvia Vargas PRI 8-26-15_2015-08-27-08.51.58.180.tif
Request;20150827-000001;49805;PACE;Inpatient;PACE;C:\Users\FGuo\Documents\work doucment\attachment\attachmentDB\20161005\originalFileFromAerial\DOCSVC_20161003.tar\DOCSVC_20161003\DOCSVC_20161003\INPATIENT\REQ_20150827-000001\Vargas, Silvia 49805 Auth Approval Letter_2015-08-27-10.22.59.246.doc
Request;20150827-000001;49805;PACE;Inpatient;PACE;C:\Users\FGuo\Documents\work doucment\attachment\attachmentDB\20161005\originalFileFromAerial\DOCSVC_20161003.tar\DOCSVC_20161003\DOCSVC_20161003\INPATIENT\REQ_20150827-000001\Vargas, Silvia 49805 Auth Approval Letter_2015-08-31-15.16.28.17.doc
Request;20150827-000002;98830;PACE;Inpatient;PACE;C:\Users\FGuo\Documents\work doucment\attachment\attachmentDB\20161005\originalFileFromAerial\DOCSVC_20161003.tar\DOCSVC_20161003\DOCSVC_20161003\INPATIENT\REQ_20150827-000002\claudio,alice_2015-08-27-09.13.04.60.tif
Request;20150827-000003;88280;PACE;Inpatient;PACE;C:\Users\FGuo\Documents\work doucment\attachment\attachmentDB\20161005\originalFileFromAerial\DOCSVC_20161003.tar\DOCSVC_20161003\DOCSVC_20161003\INPATIENT\REQ_20150827-000003\James Dorothy PACE-Beth Israel Medical Center 9-3-15_2015-09-03-11.19.23.347.docx
Request;20150827-000007;50558;null;Inpatient;PACE;C:\Users\FGuo\Documents\work doucment\attachment\attachmentDB\20161005\originalFileFromAerial\DOCSVC_20161003.tar\DOCSVC_20161003\DOCSVC_20161003\INPATIENT\REQ_20150827-000007\Lamas Joyce IP Denial Bronx Lebanon Hospital Center 8-28-15_2015-08-28-11.53.51.584.docx
Request;20150827-000007;50558;null;Inpatient;PACE;C:\Users\FGuo\Documents\work doucment\attachment\attachmentDB\20161005\originalFileFromAerial\DOCSVC_20161003.tar\DOCSVC_20161003\DOCSVC_20161003\INPATIENT\REQ_20150827-000007\lamas,joyce_2015-08-27-10.39.40.612.tif
Request;20150827-000010;36255;PACE;Inpatient;PACE;C:\Users\FGuo\Documents\work doucment\attachment\attachmentDB\20161005\originalFileFromAerial\DOCSVC_20161003.tar\DOCSVC_20161003\DOCSVC_20161003\INPATIENT\REQ_20150827-000010\Ellis, Sarah - BETH ABRAHAM HEALTH SERVICES 9.14.16_2016-09-14-09.24.02.730.pdf
Request;20150827-000010;36255;PACE;Inpatient;PACE;C:\Users\FGuo\Documents\work doucment\attachment\attachmentDB\20161005\originalFileFromAerial\DOCSVC_20161003.tar\DOCSVC_20161003\DOCSVC_20161003\INPATIENT\REQ_20150827-000010\Ellis, Sarah 36255 Auth Approval Letter_2015-08-27-10.35.50.738.doc
Request;20150827-000010;36255;PACE;Inpatient;PACE;C:\Users\FGuo\Documents\work doucment\attachment\attachmentDB\20161005\originalFileFromAerial\DOCSVC_20161003.tar\DOCSVC_20161003\DOCSVC_20161003\INPATIENT\REQ_20150827-000010\sarah ellis_2015-08-27-10.18.48.113.tif
Request;20150827-000012;51382;PACE;Inpatient;PACE;C:\Users\FGuo\Documents\work doucment\attachment\attachmentDB\20161005\originalFileFromAerial\DOCSVC_20161003.tar\DOCSVC_20161003\DOCSVC_20161003\INPATIENT\REQ_20150827-000012\Asif, Farida---Lawrence Hospital Center Clinical Review Request Form 8-27-15_2015-08-27-10.35.12.99.docx
Request;20150827-000012;51382;PACE;Inpatient;PACE;C:\Users\FGuo\Documents\work doucment\attachment\attachmentDB\20161005\originalFileFromAerial\DOCSVC_20161003.tar\DOCSVC_20161003\DOCSVC_20161003\INPATIENT\REQ_20150827-000012\asif,farida_2015-08-28-12.16.30.44.tif
Request;20150827-000013;40365;PACE;Inpatient;PACE;C:\Users\FGuo\Documents\work doucment\attachment\attachmentDB\20161005\originalFileFromAerial\DOCSVC_20161003.tar\DOCSVC_20161003\DOCSVC_20161003\INPATIENT\REQ_20150827-000013\Ahmed, Sultan 40365 Auth Approval Letter_2015-08-27-10.50.54.831.doc
Request;20150827-000018;82556;PACE;Inpatient;PACE;C:\Users\FGuo\Documents\work doucment\attachment\attachmentDB\20161005\originalFileFromAerial\DOCSVC_20161003.tar\DOCSVC_20161003\DOCSVC_20161003\INPATIENT\REQ_20150827-000018\Rivera, Jorge -Bronx Lebanon Hospital Ctr--Clinical Review Request Form 8-27-15_2015-08-27-11.02.53.710.docx
Request;20150827-000018;82556;PACE;Inpatient;PACE;C:\Users\FGuo\Documents\work doucment\attachment\attachmentDB\20161005\originalFileFromAerial\DOCSVC_20161003.tar\DOCSVC_20161003\DOCSVC_20161003\INPATIENT\REQ_20150827-000018\rivera,j831_2015-08-31-12.32.00.242.tif
Request;20150827-000018;82556;PACE;Inpatient;PACE;C:\Users\FGuo\Documents\work doucment\attachment\attachmentDB\20161005\originalFileFromAerial\DOCSVC_20161003.tar\DOCSVC_20161003\DOCSVC_20161003\INPATIENT\REQ_20150827-000018\rivera,jorge_2015-08-28-10.43.42.616.tif
Request;20150827-000023;53006;PACE;Inpatient;PACE;C:\Users\FGuo\Documents\work doucment\attachment\attachmentDB\20161005\originalFileFromAerial\DOCSVC_20161003.tar\DOCSVC_20161003\DOCSVC_20161003\INPATIENT\REQ_20150827-000023\Das Suni Forest Hills Hospital Center 9-2-15_2015-09-03-09.45.57.58.docx
Request;20150827-000023;53006;PACE;Inpatient;PACE;C:\Users\FGuo\Documents\work doucment\attachment\attachmentDB\20161005\originalFileFromAerial\DOCSVC_20161003.tar\DOCSVC_20161003\DOCSVC_20161003\INPATIENT\REQ_20150827-000023\Das Sunil Forest Hills Hospital Center 9-2-15_2015-09-03-15.36.21.493.docx
Request;20150827-000023;53006;PACE;Inpatient;PACE;C:\Users\FGuo\Documents\work doucment\attachment\attachmentDB\20161005\originalFileFromAerial\DOCSVC_20161003.tar\DOCSVC_20161003\DOCSVC_20161003\INPATIENT\REQ_20150827-000023\Das Sunil UR 9-1-15_2015-09-01-15.45.28.447.tif
Request;20150827-000023;53006;PACE;Inpatient;PACE;C:\Users\FGuo\Documents\work doucment\attachment\attachmentDB\20161005\originalFileFromAerial\DOCSVC_20161003.tar\DOCSVC_20161003\DOCSVC_20161003\INPATIENT\REQ_20150827-000023\Medical Record_2015-11-17-11.54.31.380.pdf
Request;20150827-000023;53006;PACE;Inpatient;PACE;C:\Users\FGuo\Documents\work doucment\attachment\attachmentDB\20161005\originalFileFromAerial\DOCSVC_20161003.tar\DOCSVC_20161003\DOCSVC_20161003\INPATIENT\REQ_20150827-000023\PRA-2 Final Adverse Determination Appeal Unfavorable-Contracted Hospitals_2015-11-19-14.39.15.899.docx
Request;20150827-000025;55148;SELECT;Inpatient;SELECT;C:\Users\FGuo\Documents\work doucment\attachment\attachmentDB\20161005\originalFileFromAerial\DOCSVC_20161003.tar\DOCSVC_20161003\DOCSVC_20161003\INPATIENT\REQ_20150827-000025\Defrancesco, Sheila  -  Silverlake Specialized Rehab & Care Center - 10-2-15_2015-10-02-13.28.55.26.docx
Request;20150827-000026;77307;PACE;Inpatient;PACE;C:\Users\FGuo\Documents\work doucment\attachment\attachmentDB\20161005\originalFileFromAerial\DOCSVC_20161003.tar\DOCSVC_20161003\DOCSVC_20161003\INPATIENT\REQ_20150827-000026\Dowdell, Marie 77307 Auth Approval Letter_2015-08-27-11.33.43.776.doc
Request;20150827-000028;32779;PACE;Inpatient;PACE;C:\Users\FGuo\Documents\work doucment\attachment\attachmentDB\20161005\originalFileFromAerial\DOCSVC_20161003.tar\DOCSVC_20161003\DOCSVC_20161003\INPATIENT\REQ_20150827-000028\Ren Yan UR 8-27-15_2015-08-28-08.08.33.969.tif
Request;20150827-000028;32779;PACE;Inpatient;PACE;C:\Users\FGuo\Documents\work doucment\attachment\attachmentDB\20161005\originalFileFromAerial\DOCSVC_20161003.tar\DOCSVC_20161003\DOCSVC_20161003\INPATIENT\REQ_20150827-000028\Yan Ren an IP Denial North Shore LIJ Medical Center 9-1-15_2015-09-01-14.55.11.754.docx
Request;20150827-000028;32779;PACE;Inpatient;PACE;C:\Users\FGuo\Documents\work doucment\attachment\attachmentDB\20161005\originalFileFromAerial\DOCSVC_20161003.tar\DOCSVC_20161003\DOCSVC_20161003\INPATIENT\REQ_20150827-000028\Yan Ren An IP Denial North Shore LIJ Medical Center 9-1-15_2015-09-02-11.58.14.857.docx
Request;20150827-000029;23515;PACE;Inpatient;PACE;C:\Users\FGuo\Documents\work doucment\attachment\attachmentDB\20161005\originalFileFromAerial\DOCSVC_20161003.tar\DOCSVC_20161003\DOCSVC_20161003\INPATIENT\REQ_20150827-000029\amparo anglero10_2015-09-15-13.32.58.52.tif
Request;20150827-000029;23515;PACE;Inpatient;PACE;C:\Users\FGuo\Documents\work doucment\attachment\attachmentDB\20161005\originalFileFromAerial\DOCSVC_20161003.tar\DOCSVC_20161003\DOCSVC_20161003\INPATIENT\REQ_20150827-000029\amparo anglero_2015-09-10-12.52.36.861.tif
Request;20150827-000029;23515;PACE;Inpatient;PACE;C:\Users\FGuo\Documents\work doucment\attachment\attachmentDB\20161005\originalFileFromAerial\DOCSVC_20161003.tar\DOCSVC_20161003\DOCSVC_20161003\INPATIENT\REQ_20150827-000029\amparoPRI_2015-09-02-13.39.01.674.tif
Request;20150827-000029;23515;PACE;Inpatient;PACE;C:\Users\FGuo\Documents\work doucment\attachment\attachmentDB\20161005\originalFileFromAerial\DOCSVC_20161003.tar\DOCSVC_20161003\DOCSVC_20161003\INPATIENT\REQ_20150827-000029\anglero amparo_2015-10-14-11.29.47.549.tif
Request;20150827-000043;43226;PACE;Inpatient;PACE;C:\Users\FGuo\Documents\work doucment\attachment\attachmentDB\20161005\originalFileFromAerial\DOCSVC_20161003.tar\DOCSVC_20161003\DOCSVC_20161003\INPATIENT\REQ_20150827-000043\carroll nottdc_2015-08-27-15.03.19.991.tif
Request;20150827-000049;20632;SELECT;Inpatient;SELECT;C:\Users\FGuo\Documents\work doucment\attachment\attachmentDB\20161005\originalFileFromAerial\DOCSVC_20161003.tar\DOCSVC_20161003\DOCSVC_20161003\INPATIENT\REQ_20150827-000049\Linda Rhames NH Notes 8-27-15_2015-08-27-15.56.30.286.tif
Request;20150827-000049;20632;SELECT;Inpatient;SELECT;C:\Users\FGuo\Documents\work doucment\attachment\attachmentDB\20161005\originalFileFromAerial\DOCSVC_20161003.tar\DOCSVC_20161003\DOCSVC_20161003\INPATIENT\REQ_20150827-000049\Rhames, Linda 20632 Auth Approval Letter_2015-08-28-09.50.49.320.doc
Request;20150827-000049;20632;SELECT;Inpatient;SELECT;C:\Users\FGuo\Documents\work doucment\attachment\attachmentDB\20161005\originalFileFromAerial\DOCSVC_20161003.tar\DOCSVC_20161003\DOCSVC_20161003\INPATIENT\REQ_20150827-000049\Rhames, Linda M(3rd Document)- Rego Park Nursing Home  9.24.15_2015-09-24-10.17.54.650.docx
Request;20150827-000050;78063;PACE;Inpatient;PACE;C:\Users\FGuo\Documents\work doucment\attachment\attachmentDB\20161005\originalFileFromAerial\DOCSVC_20161003.tar\DOCSVC_20161003\DOCSVC_20161003\INPATIENT\REQ_20150827-000050\chen esther_2015-09-11-16.46.15.196.tif
Request;20150827-000050;78063;PACE;Inpatient;PACE;C:\Users\FGuo\Documents\work doucment\attachment\attachmentDB\20161005\originalFileFromAerial\DOCSVC_20161003.tar\DOCSVC_20161003\DOCSVC_20161003\INPATIENT\REQ_20150827-000050\Chen, Esther - Schnurmacher Nursing Home   9.2.15_2015-09-02-15.29.12.192.docx
Request;20150827-000050;78063;PACE;Inpatient;PACE;C:\Users\FGuo\Documents\work doucment\attachment\attachmentDB\20161005\originalFileFromAerial\DOCSVC_20161003.tar\DOCSVC_20161003\DOCSVC_20161003\INPATIENT\REQ_20150827-000050\O_\Scans\PRI_Screen_Esther_Chen_78063_2015-08-27-16.16.35.961.pdf
Request;20150827-000053;56824;SELECT;Inpatient;SELECT;C:\Users\FGuo\Documents\work doucment\attachment\attachmentDB\20161005\originalFileFromAerial\DOCSVC_20161003.tar\DOCSVC_20161003\DOCSVC_20161003\INPATIENT\REQ_20150827-000053\galindo maria_2015-08-27-18.01.38.587.tif
Request;20150827-000053;56824;SELECT;Inpatient;SELECT;C:\Users\FGuo\Documents\work doucment\attachment\attachmentDB\20161005\originalFileFromAerial\DOCSVC_20161003.tar\DOCSVC_20161003\DOCSVC_20161003\INPATIENT\REQ_20150827-000053\galindo maria_2015-08-27-18.03.08.164.tif
Request;20150827-000053;56824;SELECT;Inpatient;SELECT;C:\Users\FGuo\Documents\work doucment\attachment\attachmentDB\20161005\originalFileFromAerial\DOCSVC_20161003.tar\DOCSVC_20161003\DOCSVC_20161003\INPATIENT\REQ_20150827-000053\Galindo, Maria Luisa 56824  Auth Approval Letter_2015-08-28-09.39.41.155.doc
Request;20150828-000002;56677;PACE;Inpatient;PACE;C:\Users\FGuo\Documents\work doucment\attachment\attachmentDB\20161005\originalFileFromAerial\DOCSVC_20161003.tar\DOCSVC_20161003\DOCSVC_20161003\INPATIENT\REQ_20150828-000002\Dorothy Montalvo UR 8-28-15_2015-08-31-07.54.39.748.tif
Request;20150828-000002;56677;PACE;Inpatient;PACE;C:\Users\FGuo\Documents\work doucment\attachment\attachmentDB\20161005\originalFileFromAerial\DOCSVC_20161003.tar\DOCSVC_20161003\DOCSVC_20161003\INPATIENT\REQ_20150828-000002\MONTAVLVO, DOROTHY -  ADMISSION_2015-08-28-11.30.45.12.tif
Request;20150828-000003;38311;null;Inpatient;SELECT;C:\Users\FGuo\Documents\work doucment\attachment\attachmentDB\20161005\originalFileFromAerial\DOCSVC_20161003.tar\DOCSVC_20161003\DOCSVC_20161003\INPATIENT\REQ_20150828-000003\Frances Kopczynski NH notes 9-1-15_2015-09-04-08.24.16.772.tif
Request;20150828-000003;38311;null;Inpatient;SELECT;C:\Users\FGuo\Documents\work doucment\attachment\attachmentDB\20161005\originalFileFromAerial\DOCSVC_20161003.tar\DOCSVC_20161003\DOCSVC_20161003\INPATIENT\REQ_20150828-000003\Frances Kopczynski NH notes 9-10-15_2015-09-14-10.12.16.553.tif
Request;20150828-000003;38311;null;Inpatient;SELECT;C:\Users\FGuo\Documents\work doucment\attachment\attachmentDB\20161005\originalFileFromAerial\DOCSVC_20161003.tar\DOCSVC_20161003\DOCSVC_20161003\INPATIENT\REQ_20150828-000003\Frances Kopczynski NH notes 9-3-15_2015-09-04-08.25.28.212.tif
Request;20150828-000003;38311;null;Inpatient;SELECT;C:\Users\FGuo\Documents\work doucment\attachment\attachmentDB\20161005\originalFileFromAerial\DOCSVC_20161003.tar\DOCSVC_20161003\DOCSVC_20161003\INPATIENT\REQ_20150828-000003\Frances Kopczynski PRI 8-27-15_2015-08-28-09.44.58.863.tif
Request;20150828-000003;38311;null;Inpatient;SELECT;C:\Users\FGuo\Documents\work doucment\attachment\attachmentDB\20161005\originalFileFromAerial\DOCSVC_20161003.tar\DOCSVC_20161003\DOCSVC_20161003\INPATIENT\REQ_20150828-000003\Frances Kopczynski SAR request 8-31-15_2015-08-31-10.31.07.744.tif
Request;20150828-000004;29985;PACE;Inpatient;PACE;C:\Users\FGuo\Documents\work doucment\attachment\attachmentDB\20161005\originalFileFromAerial\DOCSVC_20161003.tar\DOCSVC_20161003\DOCSVC_20161003\INPATIENT\REQ_20150828-000004\SYKES, DAVID - ADMISSION_2015-08-28-10.01.54.96.tif
Request;20150828-000005;83825;SELECT;Inpatient;SELECT;C:\Users\FGuo\Documents\work doucment\attachment\attachmentDB\20161005\originalFileFromAerial\DOCSVC_20161003.tar\DOCSVC_20161003\DOCSVC_20161003\INPATIENT\REQ_20150828-000005\MORENO, ESTRELLA - ADMISSION_2015-08-28-10.07.52.198.tif
Request;20150828-000005;83825;SELECT;Inpatient;SELECT;C:\Users\FGuo\Documents\work doucment\attachment\attachmentDB\20161005\originalFileFromAerial\DOCSVC_20161003.tar\DOCSVC_20161003\DOCSVC_20161003\INPATIENT\REQ_20150828-000005\moreno,estrella_2015-08-28-10.12.48.408.tif
Request;20150828-000006;30322;SELECT;Inpatient;SELECT;C:\Users\FGuo\Documents\work doucment\attachment\attachmentDB\20161005\originalFileFromAerial\DOCSVC_20161003.tar\DOCSVC_20161003\DOCSVC_20161003\INPATIENT\REQ_20150828-000006\Kumari Kumardai NH Notes 9-3-15_2015-09-04-13.48.18.227.tif
Request;20150828-000006;30322;SELECT;Inpatient;SELECT;C:\Users\FGuo\Documents\work doucment\attachment\attachmentDB\20161005\originalFileFromAerial\DOCSVC_20161003.tar\DOCSVC_20161003\DOCSVC_20161003\INPATIENT\REQ_20150828-000006\Kumarie Kumardai NH note 9-3-15_2015-09-03-10.18.08.687.tif
Request;20150828-000006;30322;SELECT;Inpatient;SELECT;C:\Users\FGuo\Documents\work doucment\attachment\attachmentDB\20161005\originalFileFromAerial\DOCSVC_20161003.tar\DOCSVC_20161003\DOCSVC_20161003\INPATIENT\REQ_20150828-000006\Kumarie Kumardai NOMNC 9-11-15_2015-09-11-13.35.30.697.tif
Request;20150828-000006;30322;SELECT;Inpatient;SELECT;C:\Users\FGuo\Documents\work doucment\attachment\attachmentDB\20161005\originalFileFromAerial\DOCSVC_20161003.tar\DOCSVC_20161003\DOCSVC_20161003\INPATIENT\REQ_20150828-000006\kumarie kumardai_2015-08-28-10.11.06.503.tif
Request;20150828-000007;27988;PACE;Inpatient;PACE;C:\Users\FGuo\Documents\work doucment\attachment\attachmentDB\20161005\originalFileFromAerial\DOCSVC_20161003.tar\DOCSVC_20161003\DOCSVC_20161003\INPATIENT\REQ_20150828-000007\sinamaj,bada_2015-08-28-10.30.05.798.tif
Request;20150828-000007;27988;PACE;Inpatient;PACE;C:\Users\FGuo\Documents\work doucment\attachment\attachmentDB\20161005\originalFileFromAerial\DOCSVC_20161003.tar\DOCSVC_20161003\DOCSVC_20161003\INPATIENT\REQ_20150828-000007\sinanajDC_2015-08-31-10.02.05.293.tif
Request;20150828-000007;27988;PACE;Inpatient;PACE;C:\Users\FGuo\Documents\work doucment\attachment\attachmentDB\20161005\originalFileFromAerial\DOCSVC_20161003.tar\DOCSVC_20161003\DOCSVC_20161003\INPATIENT\REQ_20150828-000007\SINANOVIC, BADA - ADMISSION_2015-08-28-10.14.06.289.tif
Request;20150828-000011;73999;null;Inpatient;PACE;C:\Users\FGuo\Documents\work doucment\attachment\attachmentDB\20161005\originalFileFromAerial\DOCSVC_20161003.tar\DOCSVC_20161003\DOCSVC_20161003\INPATIENT\REQ_20150828-000011\maria rodriguez27_2015-09-01-14.04.35.254.tif
Request;20150828-000011;73999;null;Inpatient;PACE;C:\Users\FGuo\Documents\work doucment\attachment\attachmentDB\20161005\originalFileFromAerial\DOCSVC_20161003.tar\DOCSVC_20161003\DOCSVC_20161003\INPATIENT\REQ_20150828-000011\Rodriguez, Maria T D C 11 3 BA-FAX1_1511031350339439 (3)_2015-11-03-13.25.29.709.tif
Request;20150828-000012;97590;PACE;Inpatient;PACE;C:\Users\FGuo\Documents\work doucment\attachment\attachmentDB\20161005\originalFileFromAerial\DOCSVC_20161003.tar\DOCSVC_20161003\DOCSVC_20161003\INPATIENT\REQ_20150828-000012\henderson,j_2015-08-28-12.05.48.999.tif
Request;20150828-000018;87875;PACE;Inpatient;PACE;C:\Users\FGuo\Documents\work doucment\attachment\attachmentDB\20161005\originalFileFromAerial\DOCSVC_20161003.tar\DOCSVC_20161003\DOCSVC_20161003\INPATIENT\REQ_20150828-000018\Noisette Yolande Denial Beth Israel Medical Center 12-30-15_2015-12-30-11.36.56.30.pdf
Request;20150828-000018;87875;PACE;Inpatient;PACE;C:\Users\FGuo\Documents\work doucment\attachment\attachmentDB\20161005\originalFileFromAerial\DOCSVC_20161003.tar\DOCSVC_20161003\DOCSVC_20161003\INPATIENT\REQ_20150828-000018\Noisette Yolande Part 1_2016-03-18-11.33.47.252.pdf
Request;20150828-000018;87875;PACE;Inpatient;PACE;C:\Users\FGuo\Documents\work doucment\attachment\attachmentDB\20161005\originalFileFromAerial\DOCSVC_20161003.tar\DOCSVC_20161003\DOCSVC_20161003\INPATIENT\REQ_20150828-000018\Noisette Yolande Part 2_2016-03-18-11.34.20.490.pdf
Request;20150828-000018;87875;PACE;Inpatient;PACE;C:\Users\FGuo\Documents\work doucment\attachment\attachmentDB\20161005\originalFileFromAerial\DOCSVC_20161003.tar\DOCSVC_20161003\DOCSVC_20161003\INPATIENT\REQ_20150828-000018\Noisette, Yolande  -Appeal Ack Letter_2016-03-18-11.35.46.46.docx
Request;20150828-000018;87875;PACE;Inpatient;PACE;C:\Users\FGuo\Documents\work doucment\attachment\attachmentDB\20161005\originalFileFromAerial\DOCSVC_20161003.tar\DOCSVC_20161003\DOCSVC_20161003\INPATIENT\REQ_20150828-000018\Noisette, Yolande Final Adverse Determination Appeal Unfavorable-Contracted Hospitals_2016-03-28-15.02.21.185.docx
Request;20150828-000018;87875;PACE;Inpatient;PACE;C:\Users\FGuo\Documents\work doucment\attachment\attachmentDB\20161005\originalFileFromAerial\DOCSVC_20161003.tar\DOCSVC_20161003\DOCSVC_20161003\INPATIENT\REQ_20150828-000018\Noisette, Yolande_2015-08-28-11.30.43.72.tif
Request;20150828-000018;87875;PACE;Inpatient;PACE;C:\Users\FGuo\Documents\work doucment\attachment\attachmentDB\20161005\originalFileFromAerial\DOCSVC_20161003.tar\DOCSVC_20161003\DOCSVC_20161003\INPATIENT\REQ_20150828-000018\noisette,y_2015-08-28-13.56.41.799.tif
Request;20150828-000020;53228;PACE;Inpatient;PACE;C:\Users\FGuo\Documents\work doucment\attachment\attachmentDB\20161005\originalFileFromAerial\DOCSVC_20161003.tar\DOCSVC_20161003\DOCSVC_20161003\INPATIENT\REQ_20150828-000020\pelzer,william_2015-08-28-15.23.53.116.tif
Request;20150828-000025;36625;FIDA;Inpatient;FIDA;C:\Users\FGuo\Documents\work doucment\attachment\attachmentDB\20161005\originalFileFromAerial\DOCSVC_20161003.tar\DOCSVC_20161003\DOCSVC_20161003\INPATIENT\REQ_20150828-000025\LSamuels Review_2015-09-03-12.00.20.18.tif
Request;20150828-000025;36625;FIDA;Inpatient;FIDA;C:\Users\FGuo\Documents\work doucment\attachment\attachmentDB\20161005\originalFileFromAerial\DOCSVC_20161003.tar\DOCSVC_20161003\DOCSVC_20161003\INPATIENT\REQ_20150828-000025\Samuels, Lee_2015-08-28-12.27.03.460.tif
Request;20150828-000031;26166;PACE;Inpatient;PACE;C:\Users\FGuo\Documents\work doucment\attachment\attachmentDB\20161005\originalFileFromAerial\DOCSVC_20161003.tar\DOCSVC_20161003\DOCSVC_20161003\INPATIENT\REQ_20150828-000031\akber shanaz_2015-09-01-12.52.26.299.tif
Request;20150828-000031;26166;PACE;Inpatient;PACE;C:\Users\FGuo\Documents\work doucment\attachment\attachmentDB\20161005\originalFileFromAerial\DOCSVC_20161003.tar\DOCSVC_20161003\DOCSVC_20161003\INPATIENT\REQ_20150828-000031\Akber, Shahnaz - Union Plaza Nursing Home  8.31.15_2015-08-31-15.16.17.465.docx
Request;20150828-000031;26166;PACE;Inpatient;PACE;C:\Users\FGuo\Documents\work doucment\attachment\attachmentDB\20161005\originalFileFromAerial\DOCSVC_20161003.tar\DOCSVC_20161003\DOCSVC_20161003\INPATIENT\REQ_20150828-000031\Shahnaz Akber PRI 8-28-15_2015-08-28-13.46.58.510.tif
Request;20150828-000034;48405;PACE;Inpatient;PACE;C:\Users\FGuo\Documents\work doucment\attachment\attachmentDB\20161005\originalFileFromAerial\DOCSVC_20161003.tar\DOCSVC_20161003\DOCSVC_20161003\INPATIENT\REQ_20150828-000034\OTate_2015-09-16-13.26.00.337.tif
Request;20150828-000036;75930;FIDA;Inpatient;FIDA;C:\Users\FGuo\Documents\work doucment\attachment\attachmentDB\20161005\originalFileFromAerial\DOCSVC_20161003.tar\DOCSVC_20161003\DOCSVC_20161003\INPATIENT\REQ_20150828-000036\bailey,william827_2015-08-28-14.16.36.531.tif
Request;20150828-000036;75930;FIDA;Inpatient;FIDA;C:\Users\FGuo\Documents\work doucment\attachment\attachmentDB\20161005\originalFileFromAerial\DOCSVC_20161003.tar\DOCSVC_20161003\DOCSVC_20161003\INPATIENT\REQ_20150828-000036\bailey,william827_2015-08-28-14.31.29.732.tif
Request;20150828-000036;75930;FIDA;Inpatient;FIDA;C:\Users\FGuo\Documents\work doucment\attachment\attachmentDB\20161005\originalFileFromAerial\DOCSVC_20161003.tar\DOCSVC_20161003\DOCSVC_20161003\INPATIENT\REQ_20150828-000036\baileyPRIDC_2015-08-31-10.25.07.242.tif
Request;20150828-000039;37332;PACE;Inpatient;PACE;C:\Users\FGuo\Documents\work doucment\attachment\attachmentDB\20161005\originalFileFromAerial\DOCSVC_20161003.tar\DOCSVC_20161003\DOCSVC_20161003\INPATIENT\REQ_20150828-000039\Flowers, Edwin - Elmhurst Care Center 8.31.15_2015-08-31-15.30.56.304.docx
Request;20150828-000042;88377;DIRECT;Inpatient;DIRECT;C:\Users\FGuo\Documents\work doucment\attachment\attachmentDB\20161005\originalFileFromAerial\DOCSVC_20161003.tar\DOCSVC_20161003\DOCSVC_20161003\INPATIENT\REQ_20150828-000042\Gordon Hyacinth DIRECT IP Denial NY Methodist Hospital 9-1-15_2015-09-01-17.10.57.176.docx
Request;20150828-000042;88377;DIRECT;Inpatient;DIRECT;C:\Users\FGuo\Documents\work doucment\attachment\attachmentDB\20161005\originalFileFromAerial\DOCSVC_20161003.tar\DOCSVC_20161003\DOCSVC_20161003\INPATIENT\REQ_20150828-000042\HGordon_2015-09-01-11.27.20.120.tif
Request;20150828-000042;88377;DIRECT;Inpatient;DIRECT;C:\Users\FGuo\Documents\work doucment\attachment\attachmentDB\20161005\originalFileFromAerial\DOCSVC_20161003.tar\DOCSVC_20161003\DOCSVC_20161003\INPATIENT\REQ_20150828-000042\PRA-1  Appeal Acknowledgement _2015-10-14-15.55.53.789.docx
Request;20150828-000042;88377;DIRECT;Inpatient;DIRECT;C:\Users\FGuo\Documents\work doucment\attachment\attachmentDB\20161005\originalFileFromAerial\DOCSVC_20161003.tar\DOCSVC_20161003\DOCSVC_20161003\INPATIENT\REQ_20150828-000042\PRA-4 Appeal Resolution-Favorable_2015-12-04-17.52.59.475.docx
Request;20150828-000047;55483;SELECT;Inpatient;SELECT;C:\Users\FGuo\Documents\work doucment\attachment\attachmentDB\20161005\originalFileFromAerial\DOCSVC_20161003.tar\DOCSVC_20161003\DOCSVC_20161003\INPATIENT\REQ_20150828-000047\BCrooms 9815_2015-09-23-16.58.57.204.tif
Request;20150828-000047;55483;SELECT;Inpatient;SELECT;C:\Users\FGuo\Documents\work doucment\attachment\attachmentDB\20161005\originalFileFromAerial\DOCSVC_20161003.tar\DOCSVC_20161003\DOCSVC_20161003\INPATIENT\REQ_20150828-000047\betty crooms28_2015-08-28-15.56.48.487.tif
Request;20150828-000048;20088;PACE;Inpatient;PACE;C:\Users\FGuo\Documents\work doucment\attachment\attachmentDB\20161005\originalFileFromAerial\DOCSVC_20161003.tar\DOCSVC_20161003\DOCSVC_20161003\INPATIENT\REQ_20150828-000048\Leskaj Muharrem IP Denial Wycoff Heights Med Center 9-4-15_2015-09-04-11.46.32.67.docx
Request;20150828-000048;20088;PACE;Inpatient;PACE;C:\Users\FGuo\Documents\work doucment\attachment\attachmentDB\20161005\originalFileFromAerial\DOCSVC_20161003.tar\DOCSVC_20161003\DOCSVC_20161003\INPATIENT\REQ_20150828-000048\LESKAJ, MUHARREM - ADMISSION_2015-08-28-16.06.21.416.tif
Request;20150828-000048;20088;PACE;Inpatient;PACE;C:\Users\FGuo\Documents\work doucment\attachment\attachmentDB\20161005\originalFileFromAerial\DOCSVC_20161003.tar\DOCSVC_20161003\DOCSVC_20161003\INPATIENT\REQ_20150828-000048\MLeskaj_2015-09-03-11.20.54.32.tif
Request;20150828-000049;57191;SELECT;Inpatient;SELECT;C:\Users\FGuo\Documents\work doucment\attachment\attachmentDB\20161005\originalFileFromAerial\DOCSVC_20161003.tar\DOCSVC_20161003\DOCSVC_20161003\INPATIENT\REQ_20150828-000049\earl pittman_2015-08-28-16.23.39.386.tif
Request;20150828-000049;57191;SELECT;Inpatient;SELECT;C:\Users\FGuo\Documents\work doucment\attachment\attachmentDB\20161005\originalFileFromAerial\DOCSVC_20161003.tar\DOCSVC_20161003\DOCSVC_20161003\INPATIENT\REQ_20150828-000049\Pittman, Earl -Morningside House Nursing Home   8.31.15_2015-08-31-11.31.32.621.docx
Request;20150828-000049;57191;SELECT;Inpatient;SELECT;C:\Users\FGuo\Documents\work doucment\attachment\attachmentDB\20161005\originalFileFromAerial\DOCSVC_20161003.tar\DOCSVC_20161003\DOCSVC_20161003\INPATIENT\REQ_20150828-000049\_2015-08-28-16.23.08.365
Request;20150828-000050;95627;PACE;Inpatient;PACE;C:\Users\FGuo\Documents\work doucment\attachment\attachmentDB\20161005\originalFileFromAerial\DOCSVC_20161003.tar\DOCSVC_20161003\DOCSVC_20161003\INPATIENT\REQ_20150828-000050\lai leung3_2015-09-03-12.26.56.411.tif
Request;20150828-000050;95627;PACE;Inpatient;PACE;C:\Users\FGuo\Documents\work doucment\attachment\attachmentDB\20161005\originalFileFromAerial\DOCSVC_20161003.tar\DOCSVC_20161003\DOCSVC_20161003\INPATIENT\REQ_20150828-000050\lai leung8_2015-09-08-13.34.31.20.tif
Request;20150828-000050;95627;PACE;Inpatient;PACE;C:\Users\FGuo\Documents\work doucment\attachment\attachmentDB\20161005\originalFileFromAerial\DOCSVC_20161003.tar\DOCSVC_20161003\DOCSVC_20161003\INPATIENT\REQ_20150828-000050\lai leungdc2_2015-08-31-15.51.44.935.tif
Request;20150828-000050;95627;PACE;Inpatient;PACE;C:\Users\FGuo\Documents\work doucment\attachment\attachmentDB\20161005\originalFileFromAerial\DOCSVC_20161003.tar\DOCSVC_20161003\DOCSVC_20161003\INPATIENT\REQ_20150828-000050\lai leung_2015-08-28-16.37.17.404.tif
Request;20150828-000050;95627;PACE;Inpatient;PACE;C:\Users\FGuo\Documents\work doucment\attachment\attachmentDB\20161005\originalFileFromAerial\DOCSVC_20161003.tar\DOCSVC_20161003\DOCSVC_20161003\INPATIENT\REQ_20150828-000050\Lai, Leung - The Riverside   9.1.15_2015-09-01-11.37.16.690.docx
Request;20150828-000050;95627;PACE;Inpatient;PACE;C:\Users\FGuo\Documents\work doucment\attachment\attachmentDB\20161005\originalFileFromAerial\DOCSVC_20161003.tar\DOCSVC_20161003\DOCSVC_20161003\INPATIENT\REQ_20150828-000050\LLai_2015-09-22-15.18.36.573.tif
Request;20150828-000050;95627;PACE;Inpatient;PACE;C:\Users\FGuo\Documents\work doucment\attachment\attachmentDB\20161005\originalFileFromAerial\DOCSVC_20161003.tar\DOCSVC_20161003\DOCSVC_20161003\INPATIENT\REQ_20150828-000050\LLai_2015-10-02-18.44.41.75.tif
Request;20150828-000051;84942;null;Inpatient;PACE;C:\Users\FGuo\Documents\work doucment\attachment\attachmentDB\20161005\originalFileFromAerial\DOCSVC_20161003.tar\DOCSVC_20161003\DOCSVC_20161003\INPATIENT\REQ_20150828-000051\Robinson, Pauline 84942 - Rehab Clinicals_2015-09-18-13.37.36.274.TIF
Request;20150831-000001;38752;PACE;Inpatient;PACE;C:\Users\FGuo\Documents\work doucment\attachment\attachmentDB\20161005\originalFileFromAerial\DOCSVC_20161003.tar\DOCSVC_20161003\DOCSVC_20161003\INPATIENT\REQ_20150831-000001\Stewart, Violet 38752 Auth Approval Letter_2015-08-31-10.29.11.349.doc
Request;20150831-000003;58475;FIDA;Inpatient;FIDA;C:\Users\FGuo\Documents\work doucment\attachment\attachmentDB\20161005\originalFileFromAerial\DOCSVC_20161003.tar\DOCSVC_20161003\DOCSVC_20161003\INPATIENT\REQ_20150831-000003\Echevarria Digna FIDA IP Denial Jacobi Medical Center 9-2-15_2015-09-03-09.41.19.924.docx
Request;20150831-000003;58475;FIDA;Inpatient;FIDA;C:\Users\FGuo\Documents\work doucment\attachment\attachmentDB\20161005\originalFileFromAerial\DOCSVC_20161003.tar\DOCSVC_20161003\DOCSVC_20161003\INPATIENT\REQ_20150831-000003\Echevarria, Digna Appeal Acknowledgement _2015-10-01-15.23.10.52.docx
Request;20150831-000003;58475;FIDA;Inpatient;FIDA;C:\Users\FGuo\Documents\work doucment\attachment\attachmentDB\20161005\originalFileFromAerial\DOCSVC_20161003.tar\DOCSVC_20161003\DOCSVC_20161003\INPATIENT\REQ_20150831-000003\Echevarria, Digna MR_2015-11-04-13.54.25.213.pdf
Request;20150831-000003;58475;FIDA;Inpatient;FIDA;C:\Users\FGuo\Documents\work doucment\attachment\attachmentDB\20161005\originalFileFromAerial\DOCSVC_20161003.tar\DOCSVC_20161003\DOCSVC_20161003\INPATIENT\REQ_20150831-000003\Echevarria, Digna WOL_2015-11-04-13.55.21.411.TIF
Request;20150831-000003;58475;FIDA;Inpatient;FIDA;C:\Users\FGuo\Documents\work doucment\attachment\attachmentDB\20161005\originalFileFromAerial\DOCSVC_20161003.tar\DOCSVC_20161003\DOCSVC_20161003\INPATIENT\REQ_20150831-000003\echevarria,digna_2015-09-01-15.13.20.249.tif
Request;20150831-000004;74264;PACE;Inpatient;PACE;C:\Users\FGuo\Documents\work doucment\attachment\attachmentDB\20161005\originalFileFromAerial\DOCSVC_20161003.tar\DOCSVC_20161003\DOCSVC_20161003\INPATIENT\REQ_20150831-000004\Chan Pun Chuen IP Denial Montefiore Medical Center 9-2-15_2015-09-03-09.14.00.625.docx
Request;20150831-000004;74264;PACE;Inpatient;PACE;C:\Users\FGuo\Documents\work doucment\attachment\attachmentDB\20161005\originalFileFromAerial\DOCSVC_20161003.tar\DOCSVC_20161003\DOCSVC_20161003\INPATIENT\REQ_20150831-000004\Pun C Chan UR 9-1-15_2015-09-01-15.57.38.24.tif
Request;20150831-000006;98318;PACE;Inpatient;PACE;C:\Users\FGuo\Documents\work doucment\attachment\attachmentDB\20161005\originalFileFromAerial\DOCSVC_20161003.tar\DOCSVC_20161003\DOCSVC_20161003\INPATIENT\REQ_20150831-000006\Arroyo Carmen IP Denial Beth Israel Med Center 9-1-15_2015-09-01-14.33.22.333.docx
Request;20150831-000006;98318;PACE;Inpatient;PACE;C:\Users\FGuo\Documents\work doucment\attachment\attachmentDB\20161005\originalFileFromAerial\DOCSVC_20161003.tar\DOCSVC_20161003\DOCSVC_20161003\INPATIENT\REQ_20150831-000006\Arroyo Carmen IP Denial Beth Israel Med Center 9-1-15_2015-09-02-11.44.01.647.docx
Request;20150831-000006;98318;PACE;Inpatient;PACE;C:\Users\FGuo\Documents\work doucment\attachment\attachmentDB\20161005\originalFileFromAerial\DOCSVC_20161003.tar\DOCSVC_20161003\DOCSVC_20161003\INPATIENT\REQ_20150831-000006\arroyo carmen31_2015-08-31-16.03.51.235.tif
Request;20150831-000006;98318;PACE;Inpatient;PACE;C:\Users\FGuo\Documents\work doucment\attachment\attachmentDB\20161005\originalFileFromAerial\DOCSVC_20161003.tar\DOCSVC_20161003\DOCSVC_20161003\INPATIENT\REQ_20150831-000006\Arroyo, Carmen 98318  CLINICAL REVIEW REQUEST FORM.doc 8 31 15_2015-08-31-10.42.00.968.doc
Request;20150831-000007;86340;PACE;Inpatient;PACE;C:\Users\FGuo\Documents\work doucment\attachment\attachmentDB\20161005\originalFileFromAerial\DOCSVC_20161003.tar\DOCSVC_20161003\DOCSVC_20161003\INPATIENT\REQ_20150831-000007\OFelix_2015-09-01-12.27.52.434.tif
Request;20150831-000008;99912;PACE;Inpatient;PACE;C:\Users\FGuo\Documents\work doucment\attachment\attachmentDB\20161005\originalFileFromAerial\DOCSVC_20161003.tar\DOCSVC_20161003\DOCSVC_20161003\INPATIENT\REQ_20150831-000008\cho  yuk wun_2015-09-01-13.03.09.669.tif
Request;20150831-000008;99912;PACE;Inpatient;PACE;C:\Users\FGuo\Documents\work doucment\attachment\attachmentDB\20161005\originalFileFromAerial\DOCSVC_20161003.tar\DOCSVC_20161003\DOCSVC_20161003\INPATIENT\REQ_20150831-000008\CHo Yuk Wun 99912 CLINICAL REVIEW REQUEST FORM.doc 8 31 15_2015-08-31-10.21.52.335.doc
Request;20150831-000015;35325;PACE;Inpatient;PACE;C:\Users\FGuo\Documents\work doucment\attachment\attachmentDB\20161005\originalFileFromAerial\DOCSVC_20161003.tar\DOCSVC_20161003\DOCSVC_20161003\INPATIENT\REQ_20150831-000015\35325.9.3.15_2015-09-04-09.11.17.44.tif
Request;20150831-000015;35325;PACE;Inpatient;PACE;C:\Users\FGuo\Documents\work doucment\attachment\attachmentDB\20161005\originalFileFromAerial\DOCSVC_20161003.tar\DOCSVC_20161003\DOCSVC_20161003\INPATIENT\REQ_20150831-000015\BA-FAX1_1511032017500013_2015-12-24-11.17.11.547.TIF
Request;20150831-000015;35325;PACE;Inpatient;PACE;C:\Users\FGuo\Documents\work doucment\attachment\attachmentDB\20161005\originalFileFromAerial\DOCSVC_20161003.tar\DOCSVC_20161003\DOCSVC_20161003\INPATIENT\REQ_20150831-000015\Dillon Merlyn IP Denial New York Community Hospital  9-4-15_2015-09-04-12.01.21.287.docx
Request;20150831-000015;35325;PACE;Inpatient;PACE;C:\Users\FGuo\Documents\work doucment\attachment\attachmentDB\20161005\originalFileFromAerial\DOCSVC_20161003.tar\DOCSVC_20161003\DOCSVC_20161003\INPATIENT\REQ_20150831-000015\Dillon Merlyn IP Denial New York Community Hospital  9-4-15_2015-09-04-15.33.00.46.docx
Request;20150831-000015;35325;PACE;Inpatient;PACE;C:\Users\FGuo\Documents\work doucment\attachment\attachmentDB\20161005\originalFileFromAerial\DOCSVC_20161003.tar\DOCSVC_20161003\DOCSVC_20161003\INPATIENT\REQ_20150831-000015\Dillon, Merlyn 35325 CLINICAL REVIEW REQUEST FORM.doc 8 31 15_2015-08-31-10.56.00.386.doc
Request;20150831-000015;35325;PACE;Inpatient;PACE;C:\Users\FGuo\Documents\work doucment\attachment\attachmentDB\20161005\originalFileFromAerial\DOCSVC_20161003.tar\DOCSVC_20161003\DOCSVC_20161003\INPATIENT\REQ_20150831-000015\MDillon_2015-09-01-13.00.00.73.tif
Request;20150831-000017;57534;DIRECT;Inpatient;DIRECT;C:\Users\FGuo\Documents\work doucment\attachment\attachmentDB\20161005\originalFileFromAerial\DOCSVC_20161003.tar\DOCSVC_20161003\DOCSVC_20161003\INPATIENT\REQ_20150831-000017\Appeal Acknowledgement _2016-01-19-16.48.45.258.docx
Request;20150831-000017;57534;DIRECT;Inpatient;DIRECT;C:\Users\FGuo\Documents\work doucment\attachment\attachmentDB\20161005\originalFileFromAerial\DOCSVC_20161003.tar\DOCSVC_20161003\DOCSVC_20161003\INPATIENT\REQ_20150831-000017\Greene Shirley DIRECT IP Denial Montefiore  Mount Vernon Hospital 9-17-15_2015-09-17-14.09.01.221.docx
Request;20150831-000017;57534;DIRECT;Inpatient;DIRECT;C:\Users\FGuo\Documents\work doucment\attachment\attachmentDB\20161005\originalFileFromAerial\DOCSVC_20161003.tar\DOCSVC_20161003\DOCSVC_20161003\INPATIENT\REQ_20150831-000017\Greene Shirley DIRECT IP Denial Montefiore  Mount Vernon Hospital 9-4-15_2015-09-04-13.01.59.445.docx
Request;20150831-000017;57534;DIRECT;Inpatient;DIRECT;C:\Users\FGuo\Documents\work doucment\attachment\attachmentDB\20161005\originalFileFromAerial\DOCSVC_20161003.tar\DOCSVC_20161003\DOCSVC_20161003\INPATIENT\REQ_20150831-000017\Greene Shirley DIRECT IP Denial Montefiore  Mount Vernon Hospital 9-4-15_2015-09-04-15.05.19.237.docx
Request;20150831-000017;57534;DIRECT;Inpatient;DIRECT;C:\Users\FGuo\Documents\work doucment\attachment\attachmentDB\20161005\originalFileFromAerial\DOCSVC_20161003.tar\DOCSVC_20161003\DOCSVC_20161003\INPATIENT\REQ_20150831-000017\Greene, Shirley  DIRECT Final Adverse Determination- Appeal  Unfavorable Non-Contracted Hospitals_2016-01-19-16.48.53.874.docx
Request;20150831-000017;57534;DIRECT;Inpatient;DIRECT;C:\Users\FGuo\Documents\work doucment\attachment\attachmentDB\20161005\originalFileFromAerial\DOCSVC_20161003.tar\DOCSVC_20161003\DOCSVC_20161003\INPATIENT\REQ_20150831-000017\Greene, Shirley  DIRECT Final Adverse Determination- Appeal  Unfavorable Non-Contracted Hospitals_2016-01-19-16.49.02.397.docx
Request;20150831-000017;57534;DIRECT;Inpatient;DIRECT;C:\Users\FGuo\Documents\work doucment\attachment\attachmentDB\20161005\originalFileFromAerial\DOCSVC_20161003.tar\DOCSVC_20161003\DOCSVC_20161003\INPATIENT\REQ_20150831-000017\Greene, Shirley  DIRECT Final Adverse Determination- Appeal  Unfavorable Non-Contracted Hospitals_2016-01-19-16.49.31.954.docx
Request;20150831-000017;57534;DIRECT;Inpatient;DIRECT;C:\Users\FGuo\Documents\work doucment\attachment\attachmentDB\20161005\originalFileFromAerial\DOCSVC_20161003.tar\DOCSVC_20161003\DOCSVC_20161003\INPATIENT\REQ_20150831-000017\Greene, Shirley Medical Record_2016-01-15-14.17.06.446.pdf
Request;20150831-000017;57534;DIRECT;Inpatient;DIRECT;C:\Users\FGuo\Documents\work doucment\attachment\attachmentDB\20161005\originalFileFromAerial\DOCSVC_20161003.tar\DOCSVC_20161003\DOCSVC_20161003\INPATIENT\REQ_20150831-000017\greene,shirley_2015-09-01-16.04.24.660.tif
Request;20150831-000017;57534;DIRECT;Inpatient;DIRECT;C:\Users\FGuo\Documents\work doucment\attachment\attachmentDB\20161005\originalFileFromAerial\DOCSVC_20161003.tar\DOCSVC_20161003\DOCSVC_20161003\INPATIENT\REQ_20150831-000017\greene,shirley_2015-09-02-08.48.44.190.tif
Request;20150831-000017;57534;DIRECT;Inpatient;DIRECT;C:\Users\FGuo\Documents\work doucment\attachment\attachmentDB\20161005\originalFileFromAerial\DOCSVC_20161003.tar\DOCSVC_20161003\DOCSVC_20161003\INPATIENT\REQ_20150831-000017\overturned by external appeal_2016-03-22-16.07.33.337.tif
Request;20150831-000018;58708;DIRECT;Inpatient;DIRECT;C:\Users\FGuo\Documents\work doucment\attachment\attachmentDB\20161005\originalFileFromAerial\DOCSVC_20161003.tar\DOCSVC_20161003\DOCSVC_20161003\INPATIENT\REQ_20150831-000018\Vargas, Clara - IP Montefiore Medical Center - 7.18.16_2016-07-18-15.06.59.603.pdf
Request;20150831-000018;58708;DIRECT;Inpatient;DIRECT;C:\Users\FGuo\Documents\work doucment\attachment\attachmentDB\20161005\originalFileFromAerial\DOCSVC_20161003.tar\DOCSVC_20161003\DOCSVC_20161003\INPATIENT\REQ_20150831-000018\vargas,clara_2015-09-03-15.05.58.683.tif
Request;20150831-000025;94268;PACE;Inpatient;PACE;C:\Users\FGuo\Documents\work doucment\attachment\attachmentDB\20161005\originalFileFromAerial\DOCSVC_20161003.tar\DOCSVC_20161003\DOCSVC_20161003\INPATIENT\REQ_20150831-000025\jian tao zhou_2015-09-02-11.45.16.433.tif
Request;20150831-000025;94268;PACE;Inpatient;PACE;C:\Users\FGuo\Documents\work doucment\attachment\attachmentDB\20161005\originalFileFromAerial\DOCSVC_20161003.tar\DOCSVC_20161003\DOCSVC_20161003\INPATIENT\REQ_20150831-000025\Zhao, Tao Jian Appeal Acknowledgement Letter_2015-10-07-15.40.18.162.docx
Request;20150831-000025;94268;PACE;Inpatient;PACE;C:\Users\FGuo\Documents\work doucment\attachment\attachmentDB\20161005\originalFileFromAerial\DOCSVC_20161003.tar\DOCSVC_20161003\DOCSVC_20161003\INPATIENT\REQ_20150831-000025\Zhao, Tao Jian WOL_2015-10-07-15.40.33.200.TIF
Request;20150831-000025;94268;PACE;Inpatient;PACE;C:\Users\FGuo\Documents\work doucment\attachment\attachmentDB\20161005\originalFileFromAerial\DOCSVC_20161003.tar\DOCSVC_20161003\DOCSVC_20161003\INPATIENT\REQ_20150831-000025\Zhao, Tao Jin Appeal Resolution-Favorable_2015-10-12-10.42.32.924.docx
Request;20150831-000025;94268;PACE;Inpatient;PACE;C:\Users\FGuo\Documents\work doucment\attachment\attachmentDB\20161005\originalFileFromAerial\DOCSVC_20161003.tar\DOCSVC_20161003\DOCSVC_20161003\INPATIENT\REQ_20150831-000025\Zhao, Tao MR_2015-10-08-10.22.56.352.pdf
Request;20150831-000025;94268;PACE;Inpatient;PACE;C:\Users\FGuo\Documents\work doucment\attachment\attachmentDB\20161005\originalFileFromAerial\DOCSVC_20161003.tar\DOCSVC_20161003\DOCSVC_20161003\INPATIENT\REQ_20150831-000025\Zhou, Taio, Jian IP Denial NY Presbyterian 9-9-15_2015-09-09-15.28.53.51.docx
Request;20150831-000025;94268;PACE;Inpatient;PACE;C:\Users\FGuo\Documents\work doucment\attachment\attachmentDB\20161005\originalFileFromAerial\DOCSVC_20161003.tar\DOCSVC_20161003\DOCSVC_20161003\INPATIENT\REQ_20150831-000025\Zhou, Tao Jian-NY Presby Hospital Columbus-Clinical Review Request Form 8-31-15_2015-08-31-11.46.15.774.docx
Request;20150831-000038;23763;null;Inpatient;PACE;C:\Users\FGuo\Documents\work doucment\attachment\attachmentDB\20161005\originalFileFromAerial\DOCSVC_20161003.tar\DOCSVC_20161003\DOCSVC_20161003\INPATIENT\REQ_20150831-000038\Matos Maria  IP Denial Richmond University Medical Center 9-1-2015_2015-09-01-16.54.53.615.docx
Request;20150831-000038;23763;null;Inpatient;PACE;C:\Users\FGuo\Documents\work doucment\attachment\attachmentDB\20161005\originalFileFromAerial\DOCSVC_20161003.tar\DOCSVC_20161003\DOCSVC_20161003\INPATIENT\REQ_20150831-000038\Matos Maria  IP Denial Richmond University Medical Center 9-1-2015_2015-09-02-11.50.09.533.docx
Request;20150831-000038;23763;null;Inpatient;PACE;C:\Users\FGuo\Documents\work doucment\attachment\attachmentDB\20161005\originalFileFromAerial\DOCSVC_20161003.tar\DOCSVC_20161003\DOCSVC_20161003\INPATIENT\REQ_20150831-000038\MATOS, MARIA - ADMISSION_2015-08-31-12.45.16.547.tif
Request;20150831-000042;57457;PACE;Inpatient;PACE;C:\Users\FGuo\Documents\work doucment\attachment\attachmentDB\20161005\originalFileFromAerial\DOCSVC_20161003.tar\DOCSVC_20161003\DOCSVC_20161003\INPATIENT\REQ_20150831-000042\Barbara Tiwari UR 9-8-15_2015-09-08-12.01.03.481.tif
Request;20150831-000042;57457;PACE;Inpatient;PACE;C:\Users\FGuo\Documents\work doucment\attachment\attachmentDB\20161005\originalFileFromAerial\DOCSVC_20161003.tar\DOCSVC_20161003\DOCSVC_20161003\INPATIENT\REQ_20150831-000042\TIWARI, BARBARA B - UR_2015-08-31-12.59.46.138.tif
Request;20150831-000047;98161;PACE;Inpatient;DIRECT/SELECT LT;C:\Users\FGuo\Documents\work doucment\attachment\attachmentDB\20161005\originalFileFromAerial\DOCSVC_20161003.tar\DOCSVC_20161003\DOCSVC_20161003\INPATIENT\REQ_20150831-000047\brown, sabrina_2015-08-31-14.49.33.221.tif
Request;20150831-000049;57307;PACE;Inpatient;PACE;C:\Users\FGuo\Documents\work doucment\attachment\attachmentDB\20161005\originalFileFromAerial\DOCSVC_20161003.tar\DOCSVC_20161003\DOCSVC_20161003\INPATIENT\REQ_20150831-000049\Watson Iona IP Denial Montefiore Medical Center 9-2-15_2015-09-03-09.23.00.494.docx
Request;20150831-000049;57307;PACE;Inpatient;PACE;C:\Users\FGuo\Documents\work doucment\attachment\attachmentDB\20161005\originalFileFromAerial\DOCSVC_20161003.tar\DOCSVC_20161003\DOCSVC_20161003\INPATIENT\REQ_20150831-000049\Watson, Iona - Montefiore Med Cen-Moses-Clinical Review Request Form 8-31-15_2015-08-31-14.39.49.625.docx
Request;20150831-000049;57307;PACE;Inpatient;PACE;C:\Users\FGuo\Documents\work doucment\attachment\attachmentDB\20161005\originalFileFromAerial\DOCSVC_20161003.tar\DOCSVC_20161003\DOCSVC_20161003\INPATIENT\REQ_20150831-000049\Watson, Iona_2016-01-19-10.40.36.647.pdf
Request;20150831-000049;57307;PACE;Inpatient;PACE;C:\Users\FGuo\Documents\work doucment\attachment\attachmentDB\20161005\originalFileFromAerial\DOCSVC_20161003.tar\DOCSVC_20161003\DOCSVC_20161003\INPATIENT\REQ_20150831-000049\watson,iona_2015-09-01-11.09.19.246.tif
Request;20150831-000049;57307;PACE;Inpatient;PACE;C:\Users\FGuo\Documents\work doucment\attachment\attachmentDB\20161005\originalFileFromAerial\DOCSVC_20161003.tar\DOCSVC_20161003\DOCSVC_20161003\INPATIENT\REQ_20150831-000049\watsonDC_2015-09-01-15.04.55.775.tif
Request;20150831-000054;44378;PACE;Inpatient;PACE;C:\Users\FGuo\Documents\work doucment\attachment\attachmentDB\20161005\originalFileFromAerial\DOCSVC_20161003.tar\DOCSVC_20161003\DOCSVC_20161003\INPATIENT\REQ_20150831-000054\Final Adverse Determination Appeal Unfavorable-Contracted Hospitals_2015-12-28-11.16.34.735.docx
Request;20150831-000054;44378;PACE;Inpatient;PACE;C:\Users\FGuo\Documents\work doucment\attachment\attachmentDB\20161005\originalFileFromAerial\DOCSVC_20161003.tar\DOCSVC_20161003\DOCSVC_20161003\INPATIENT\REQ_20150831-000054\Medical Record _2015-12-21-12.48.13.127.pdf
Request;20150831-000054;44378;PACE;Inpatient;PACE;C:\Users\FGuo\Documents\work doucment\attachment\attachmentDB\20161005\originalFileFromAerial\DOCSVC_20161003.tar\DOCSVC_20161003\DOCSVC_20161003\INPATIENT\REQ_20150831-000054\PRA-1  Appeal Acknowledgement _2015-11-16-15.47.48.133.docx
Request;20150831-000054;44378;PACE;Inpatient;PACE;C:\Users\FGuo\Documents\work doucment\attachment\attachmentDB\20161005\originalFileFromAerial\DOCSVC_20161003.tar\DOCSVC_20161003\DOCSVC_20161003\INPATIENT\REQ_20150831-000054\Quinones Antonio IP Denial Montefiore Medical Center 9-2-15_2015-09-03-09.18.39.53.docx
Request;20150831-000054;44378;PACE;Inpatient;PACE;C:\Users\FGuo\Documents\work doucment\attachment\attachmentDB\20161005\originalFileFromAerial\DOCSVC_20161003.tar\DOCSVC_20161003\DOCSVC_20161003\INPATIENT\REQ_20150831-000054\quinones,antonio_2015-08-31-15.02.29.200.tif
Request;20150831-000054;44378;PACE;Inpatient;PACE;C:\Users\FGuo\Documents\work doucment\attachment\attachmentDB\20161005\originalFileFromAerial\DOCSVC_20161003.tar\DOCSVC_20161003\DOCSVC_20161003\INPATIENT\REQ_20150831-000054\quinones831_2015-08-31-15.04.11.936.tif
Request;20150831-000055;78202;PACE;Inpatient;PACE;C:\Users\FGuo\Documents\work doucment\attachment\attachmentDB\20161005\originalFileFromAerial\DOCSVC_20161003.tar\DOCSVC_20161003\DOCSVC_20161003\INPATIENT\REQ_20150831-000055\Mendez, Laura - St Barnabas Hospital--Clinical Review Request Form 8-31-15_2015-08-31-14.56.25.124.docx
Request;20150831-000055;78202;PACE;Inpatient;PACE;C:\Users\FGuo\Documents\work doucment\attachment\attachmentDB\20161005\originalFileFromAerial\DOCSVC_20161003.tar\DOCSVC_20161003\DOCSVC_20161003\INPATIENT\REQ_20150831-000055\mendez,91_2015-09-02-11.25.41.94.tif
Request;20150831-000055;78202;PACE;Inpatient;PACE;C:\Users\FGuo\Documents\work doucment\attachment\attachmentDB\20161005\originalFileFromAerial\DOCSVC_20161003.tar\DOCSVC_20161003\DOCSVC_20161003\INPATIENT\REQ_20150831-000055\mendez,lauraDC_2015-09-02-16.14.52.139.tif
Request;20150831-000074;28940;PACE;Inpatient;PACE;C:\Users\FGuo\Documents\work doucment\attachment\attachmentDB\20161005\originalFileFromAerial\DOCSVC_20161003.tar\DOCSVC_20161003\DOCSVC_20161003\INPATIENT\REQ_20150831-000074\charles thompson_2015-09-03-10.56.35.22.tif
Request;20150901-000001;56965;PACE;Inpatient;PACE;C:\Users\FGuo\Documents\work doucment\attachment\attachmentDB\20161005\originalFileFromAerial\DOCSVC_20161003.tar\DOCSVC_20161003\DOCSVC_20161003\INPATIENT\REQ_20150901-000001\56965-1_2015-09-01-08.27.43.976.msg
Request;20150901-000001;56965;PACE;Inpatient;PACE;C:\Users\FGuo\Documents\work doucment\attachment\attachmentDB\20161005\originalFileFromAerial\DOCSVC_20161003.tar\DOCSVC_20161003\DOCSVC_20161003\INPATIENT\REQ_20150901-000001\Chowdhury, Mamunur R - Waterview Care Center  9.1.15_2015-09-01-11.20.06.850.docx
Request;20150901-000001;56965;PACE;Inpatient;PACE;C:\Users\FGuo\Documents\work doucment\attachment\attachmentDB\20161005\originalFileFromAerial\DOCSVC_20161003.tar\DOCSVC_20161003\DOCSVC_20161003\INPATIENT\REQ_20150901-000001\Chowdhury, Mamunur R- Cliffside Rehab & Residential Healthcare Center   9.4.15_2015-09-04-16.50.54.279.docx
Request;20150901-000001;56965;PACE;Inpatient;PACE;C:\Users\FGuo\Documents\work doucment\attachment\attachmentDB\20161005\originalFileFromAerial\DOCSVC_20161003.tar\DOCSVC_20161003\DOCSVC_20161003\INPATIENT\REQ_20150901-000001\Mamunur Chowdhury PRI 9-1-15_2015-09-01-09.40.51.269.tif
Request;20150901-000001;56965;PACE;Inpatient;PACE;C:\Users\FGuo\Documents\work doucment\attachment\attachmentDB\20161005\originalFileFromAerial\DOCSVC_20161003.tar\DOCSVC_20161003\DOCSVC_20161003\INPATIENT\REQ_20150901-000001\Mamunur Chowdhury PRI 9-1-15_2015-09-01-09.42.39.440.tif
Request;20150901-000006;72216;PACE;Inpatient;PACE;C:\Users\FGuo\Documents\work doucment\attachment\attachmentDB\20161005\originalFileFromAerial\DOCSVC_20161003.tar\DOCSVC_20161003\DOCSVC_20161003\INPATIENT\REQ_20150901-000006\Lee Ok    Clinicals 8 25 15_2015-09-01-10.52.15.998.TIF
Request;20150901-000006;72216;PACE;Inpatient;PACE;C:\Users\FGuo\Documents\work doucment\attachment\attachmentDB\20161005\originalFileFromAerial\DOCSVC_20161003.tar\DOCSVC_20161003\DOCSVC_20161003\INPATIENT\REQ_20150901-000006\leeOK_2015-09-01-11.12.12.536.tif
Request;20150901-000009;47413;PACE;Inpatient;PACE;C:\Users\FGuo\Documents\work doucment\attachment\attachmentDB\20161005\originalFileFromAerial\DOCSVC_20161003.tar\DOCSVC_20161003\DOCSVC_20161003\INPATIENT\REQ_20150901-000009\Plenty, Robert IP Admit White Plains Hospital 9-14-15_2015-09-14-14.24.27.919.docx
Request;20150901-000009;47413;PACE;Inpatient;PACE;C:\Users\FGuo\Documents\work doucment\attachment\attachmentDB\20161005\originalFileFromAerial\DOCSVC_20161003.tar\DOCSVC_20161003\DOCSVC_20161003\INPATIENT\REQ_20150901-000009\plenty93_2015-09-03-08.33.38.922.tif
Request;20150901-000009;47413;PACE;Inpatient;PACE;C:\Users\FGuo\Documents\work doucment\attachment\attachmentDB\20161005\originalFileFromAerial\DOCSVC_20161003.tar\DOCSVC_20161003\DOCSVC_20161003\INPATIENT\REQ_20150901-000009\robert plenty08_2015-09-10-13.06.00.912.tif
Request;20150901-000010;22997;FIDA;Inpatient;FIDA;C:\Users\FGuo\Documents\work doucment\attachment\attachmentDB\20161005\originalFileFromAerial\DOCSVC_20161003.tar\DOCSVC_20161003\DOCSVC_20161003\INPATIENT\REQ_20150901-000010\Diaz, haydee 22997 CLINICAL REVIEW REQUEST FORM.doc 9 1 15_2015-09-01-11.20.23.623.doc
Request;20150901-000010;22997;FIDA;Inpatient;FIDA;C:\Users\FGuo\Documents\work doucment\attachment\attachmentDB\20161005\originalFileFromAerial\DOCSVC_20161003.tar\DOCSVC_20161003\DOCSVC_20161003\INPATIENT\REQ_20150901-000010\Haydee Diaz UR 9-2-15_2015-09-02-12.21.19.565.tif
Request;20150901-000011;20090;PACE;Inpatient;PACE;C:\Users\FGuo\Documents\work doucment\attachment\attachmentDB\20161005\originalFileFromAerial\DOCSVC_20161003.tar\DOCSVC_20161003\DOCSVC_20161003\INPATIENT\REQ_20150901-000011\sims wendydc_2015-09-01-13.12.11.848.tif
Request;20150901-000011;20090;PACE;Inpatient;PACE;C:\Users\FGuo\Documents\work doucment\attachment\attachmentDB\20161005\originalFileFromAerial\DOCSVC_20161003.tar\DOCSVC_20161003\DOCSVC_20161003\INPATIENT\REQ_20150901-000011\Sims, Wendy - NY Presby Hospital Columbus-Clinical Review Request Form 9-1-15_2015-09-01-11.15.34.989.docx
Request;20150901-000012;56918;null;Inpatient;PACE;C:\Users\FGuo\Documents\work doucment\attachment\attachmentDB\20161005\originalFileFromAerial\DOCSVC_20161003.tar\DOCSVC_20161003\DOCSVC_20161003\INPATIENT\REQ_20150901-000012\Lynch Cynthia PACE-NY Methodist Hospital 9-15-15_2015-09-15-16.20.54.294.docx
Request;20150901-000013;57512;PACE;Inpatient;PACE;C:\Users\FGuo\Documents\work doucment\attachment\attachmentDB\20161005\originalFileFromAerial\DOCSVC_20161003.tar\DOCSVC_20161003\DOCSVC_20161003\INPATIENT\REQ_20150901-000013\CLINICAL REVIEW REQUEST FORM_2015-09-01-11.58.10.665.doc
Request;20150901-000013;57512;PACE;Inpatient;PACE;C:\Users\FGuo\Documents\work doucment\attachment\attachmentDB\20161005\originalFileFromAerial\DOCSVC_20161003.tar\DOCSVC_20161003\DOCSVC_20161003\INPATIENT\REQ_20150901-000013\HARRILL, JOHNIE -ADMISSION_2015-09-01-11.41.28.343.tif
Request;20150901-000013;57512;PACE;Inpatient;PACE;C:\Users\FGuo\Documents\work doucment\attachment\attachmentDB\20161005\originalFileFromAerial\DOCSVC_20161003.tar\DOCSVC_20161003\DOCSVC_20161003\INPATIENT\REQ_20150901-000013\HARRILL, JOHNIE CLINICAL REVIEW REQUEST_2015-09-01-12.01.34.395.doc
Request;20150901-000014;74220;PACE;Inpatient;PACE;C:\Users\FGuo\Documents\work doucment\attachment\attachmentDB\20161005\originalFileFromAerial\DOCSVC_20161003.tar\DOCSVC_20161003\DOCSVC_20161003\INPATIENT\REQ_20150901-000014\Sookja Yoonchung UR 9-1-15_2015-09-02-08.30.32.833.tif
Request;20150901-000014;74220;PACE;Inpatient;PACE;C:\Users\FGuo\Documents\work doucment\attachment\attachmentDB\20161005\originalFileFromAerial\DOCSVC_20161003.tar\DOCSVC_20161003\DOCSVC_20161003\INPATIENT\REQ_20150901-000014\Yoonchung, Sookja 74220 CLINICAL REVIEW REQUEST FORM.doc 9 1 15_2015-09-01-12.00.20.502.doc
Request;20150901-000017;97334;PACE;Inpatient;PACE;C:\Users\FGuo\Documents\work doucment\attachment\attachmentDB\20161005\originalFileFromAerial\DOCSVC_20161003.tar\DOCSVC_20161003\DOCSVC_20161003\INPATIENT\REQ_20150901-000017\Robinson, Alice - The Riverside 4-20-16_2016-04-20-14.09.37.408.pdf
Request;20150901-000017;97334;PACE;Inpatient;PACE;C:\Users\FGuo\Documents\work doucment\attachment\attachmentDB\20161005\originalFileFromAerial\DOCSVC_20161003.tar\DOCSVC_20161003\DOCSVC_20161003\INPATIENT\REQ_20150901-000017\Robinson, Alice(2nd Document) - The Riverside   9.1.15_2015-09-01-13.46.48.833.docx
Request;20150901-000018;43732;PACE;Inpatient;PACE;C:\Users\FGuo\Documents\work doucment\attachment\attachmentDB\20161005\originalFileFromAerial\DOCSVC_20161003.tar\DOCSVC_20161003\DOCSVC_20161003\INPATIENT\REQ_20150901-000018\Helen Hoffman PRI 9-1-15_2015-09-01-12.34.48.229.tif
Request;20150901-000018;43732;PACE;Inpatient;PACE;C:\Users\FGuo\Documents\work doucment\attachment\attachmentDB\20161005\originalFileFromAerial\DOCSVC_20161003.tar\DOCSVC_20161003\DOCSVC_20161003\INPATIENT\REQ_20150901-000018\helen hoffman11_2015-09-14-13.10.48.507.tif
Request;20150901-000018;43732;PACE;Inpatient;PACE;C:\Users\FGuo\Documents\work doucment\attachment\attachmentDB\20161005\originalFileFromAerial\DOCSVC_20161003.tar\DOCSVC_20161003\DOCSVC_20161003\INPATIENT\REQ_20150901-000018\Hoffman, Helen(2nd Document)- West Lawrence Care Center- 11.9.15_2015-11-09-14.06.48.346.docx
Request;20150901-000018;43732;PACE;Inpatient;PACE;C:\Users\FGuo\Documents\work doucment\attachment\attachmentDB\20161005\originalFileFromAerial\DOCSVC_20161003.tar\DOCSVC_20161003\DOCSVC_20161003\INPATIENT\REQ_20150901-000018\Hoffman, Helen(2nd Document)- West Lawrence Care Center- 9.1.15_2015-09-01-14.17.18.233.docx
Request;20150901-000031;56537;PACE;Inpatient;PACE;C:\Users\FGuo\Documents\work doucment\attachment\attachmentDB\20161005\originalFileFromAerial\DOCSVC_20161003.tar\DOCSVC_20161003\DOCSVC_20161003\INPATIENT\REQ_20150901-000031\Agman, Yoheved(SKILLED NURSING)- New Vanderbilt Rehab & Care Center  9.2.15_2015-09-02-10.47.51.372.docx
Request;20150901-000031;56537;PACE;Inpatient;PACE;C:\Users\FGuo\Documents\work doucment\attachment\attachmentDB\20161005\originalFileFromAerial\DOCSVC_20161003.tar\DOCSVC_20161003\DOCSVC_20161003\INPATIENT\REQ_20150901-000031\Yoheved Agman PRI 9-1-15_2015-09-01-15.05.58.772.tif
Request;20150901-000033;56537;PACE;Inpatient;PACE;C:\Users\FGuo\Documents\work doucment\attachment\attachmentDB\20161005\originalFileFromAerial\DOCSVC_20161003.tar\DOCSVC_20161003\DOCSVC_20161003\INPATIENT\REQ_20150901-000033\Agman, Yoheved 56537 Auth Approval Letter_2015-09-02-10.08.25.451.doc
Request;20150901-000036;83735;SELECT;Inpatient;SELECT;C:\Users\FGuo\Documents\work doucment\attachment\attachmentDB\20161005\originalFileFromAerial\DOCSVC_20161003.tar\DOCSVC_20161003\DOCSVC_20161003\INPATIENT\REQ_20150901-000036\FFowler 9115_2015-09-01-15.42.07.666.tif
Request;20150901-000036;83735;SELECT;Inpatient;SELECT;C:\Users\FGuo\Documents\work doucment\attachment\attachmentDB\20161005\originalFileFromAerial\DOCSVC_20161003.tar\DOCSVC_20161003\DOCSVC_20161003\INPATIENT\REQ_20150901-000036\Fowler Frederica Denial of Requested Services River Manor Corp-Member 9-3-15_2015-09-03-11.09.13.426.docx
Request;20150901-000036;83735;SELECT;Inpatient;SELECT;C:\Users\FGuo\Documents\work doucment\attachment\attachmentDB\20161005\originalFileFromAerial\DOCSVC_20161003.tar\DOCSVC_20161003\DOCSVC_20161003\INPATIENT\REQ_20150901-000036\Fowler Frederica Denial of Requested Services River Manor Corp-Provider 9-3-15_2015-09-03-11.09.28.470.docx
Request;20150901-000036;83735;SELECT;Inpatient;SELECT;C:\Users\FGuo\Documents\work doucment\attachment\attachmentDB\20161005\originalFileFromAerial\DOCSVC_20161003.tar\DOCSVC_20161003\DOCSVC_20161003\INPATIENT\REQ_20150901-000036\Fowler, Frederica - River Manor Corp DBA River Manor Care  9.1.15_2015-09-01-17.02.14.834.docx
Request;20150901-000038;57199;null;Inpatient;PACE;C:\Users\FGuo\Documents\work doucment\attachment\attachmentDB\20161005\originalFileFromAerial\DOCSVC_20161003.tar\DOCSVC_20161003\DOCSVC_20161003\INPATIENT\REQ_20150901-000038\ALuna_2015-09-01-16.21.44.967.tif
Request;20150901-000038;57199;null;Inpatient;PACE;C:\Users\FGuo\Documents\work doucment\attachment\attachmentDB\20161005\originalFileFromAerial\DOCSVC_20161003.tar\DOCSVC_20161003\DOCSVC_20161003\INPATIENT\REQ_20150901-000038\Luna, Altagracia 57199 Auth Approval Letter_2015-09-02-09.49.56.507.doc
Request;20150901-000042;95543;DIRECT;Inpatient;DIRECT;C:\Users\FGuo\Documents\work doucment\attachment\attachmentDB\20161005\originalFileFromAerial\DOCSVC_20161003.tar\DOCSVC_20161003\DOCSVC_20161003\INPATIENT\REQ_20150901-000042\chrusciel,wendy_2015-09-02-09.11.16.556.tif
Request;20150901-000042;95543;DIRECT;Inpatient;DIRECT;C:\Users\FGuo\Documents\work doucment\attachment\attachmentDB\20161005\originalFileFromAerial\DOCSVC_20161003.tar\DOCSVC_20161003\DOCSVC_20161003\INPATIENT\REQ_20150901-000042\chrusciel,wendy_2015-09-16-09.46.58.809.tif
Request;20150901-000043;92318;PACE;Inpatient;PACE;C:\Users\FGuo\Documents\work doucment\attachment\attachmentDB\20161005\originalFileFromAerial\DOCSVC_20161003.tar\DOCSVC_20161003\DOCSVC_20161003\INPATIENT\REQ_20150901-000043\consuelo matos_2015-09-08-18.20.58.100.tif
Request;20150901-000043;92318;PACE;Inpatient;PACE;C:\Users\FGuo\Documents\work doucment\attachment\attachmentDB\20161005\originalFileFromAerial\DOCSVC_20161003.tar\DOCSVC_20161003\DOCSVC_20161003\INPATIENT\REQ_20150901-000043\matos,consuelo_2015-09-02-09.50.54.801.tif
Request;20150901-000043;92318;PACE;Inpatient;PACE;C:\Users\FGuo\Documents\work doucment\attachment\attachmentDB\20161005\originalFileFromAerial\DOCSVC_20161003.tar\DOCSVC_20161003\DOCSVC_20161003\INPATIENT\REQ_20150901-000043\matos,consuelo_2015-09-02-09.58.10.31.tif
Request;20150901-000044;85145;null;Inpatient;PACE;C:\Users\FGuo\Documents\work doucment\attachment\attachmentDB\20161005\originalFileFromAerial\DOCSVC_20161003.tar\DOCSVC_20161003\DOCSVC_20161003\INPATIENT\REQ_20150901-000044\santiago, margarita_2015-09-02-10.33.48.938.tif
Request;20150901-000045;77591;PACE;Inpatient;PACE;C:\Users\FGuo\Documents\work doucment\attachment\attachmentDB\20161005\originalFileFromAerial\DOCSVC_20161003.tar\DOCSVC_20161003\DOCSVC_20161003\INPATIENT\REQ_20150901-000045\song,daesub_2015-09-02-08.36.51.897.tif
Request;20150902-000001;27120;SELECT;Inpatient;SELECT;C:\Users\FGuo\Documents\work doucment\attachment\attachmentDB\20161005\originalFileFromAerial\DOCSVC_20161003.tar\DOCSVC_20161003\DOCSVC_20161003\INPATIENT\REQ_20150902-000001\Asya Specktor PRI 9-2-15_2015-09-02-14.11.23.51.tif
Request;20150902-000001;27120;SELECT;Inpatient;SELECT;C:\Users\FGuo\Documents\work doucment\attachment\attachmentDB\20161005\originalFileFromAerial\DOCSVC_20161003.tar\DOCSVC_20161003\DOCSVC_20161003\INPATIENT\REQ_20150902-000001\Spektgor, Asya -  Margaret Tietz Nursing and Rehab Center - 10-2-15_2015-10-02-13.17.00.889.docx
Request;20150902-000006;43732;PACE;Inpatient;PACE;C:\Users\FGuo\Documents\work doucment\attachment\attachmentDB\20161005\originalFileFromAerial\DOCSVC_20161003.tar\DOCSVC_20161003\DOCSVC_20161003\INPATIENT\REQ_20150902-000006\Hoffman, Helen - Mercy Medical Center Clinical Review Request 9-2-15_2015-09-02-09.57.39.595.docx
Request;20150902-000007;23515;PACE;Inpatient;PACE;C:\Users\FGuo\Documents\work doucment\attachment\attachmentDB\20161005\originalFileFromAerial\DOCSVC_20161003.tar\DOCSVC_20161003\DOCSVC_20161003\INPATIENT\REQ_20150902-000007\Amparo, Anglero Appeal Acknowledgement _2015-12-29-11.05.36.594.docx
Request;20150902-000007;23515;PACE;Inpatient;PACE;C:\Users\FGuo\Documents\work doucment\attachment\attachmentDB\20161005\originalFileFromAerial\DOCSVC_20161003.tar\DOCSVC_20161003\DOCSVC_20161003\INPATIENT\REQ_20150902-000007\Amparo, Anglero MR_2015-12-29-11.06.12.4.pdf
Request;20150902-000007;23515;PACE;Inpatient;PACE;C:\Users\FGuo\Documents\work doucment\attachment\attachmentDB\20161005\originalFileFromAerial\DOCSVC_20161003.tar\DOCSVC_20161003\DOCSVC_20161003\INPATIENT\REQ_20150902-000007\amparo92_2015-09-02-11.00.23.535.tif
Request;20150902-000007;23515;PACE;Inpatient;PACE;C:\Users\FGuo\Documents\work doucment\attachment\attachmentDB\20161005\originalFileFromAerial\DOCSVC_20161003.tar\DOCSVC_20161003\DOCSVC_20161003\INPATIENT\REQ_20150902-000007\Anglero Amparo IP Denial Montefiore Medical Center 9-2-15_2015-09-03-09.54.48.406.docx
Request;20150902-000008;36755;PACE;Inpatient;PACE;C:\Users\FGuo\Documents\work doucment\attachment\attachmentDB\20161005\originalFileFromAerial\DOCSVC_20161003.tar\DOCSVC_20161003\DOCSVC_20161003\INPATIENT\REQ_20150902-000008\Gray, Tamela 36755 CLINICAL REVIEW REQUEST FORM.doc 9 2 15_2015-09-02-10.27.40.981.doc
Request;20150902-000008;36755;PACE;Inpatient;PACE;C:\Users\FGuo\Documents\work doucment\attachment\attachmentDB\20161005\originalFileFromAerial\DOCSVC_20161003.tar\DOCSVC_20161003\DOCSVC_20161003\INPATIENT\REQ_20150902-000008\gray,tamela_2015-09-02-14.02.57.356.tif
Request;20150902-000008;36755;PACE;Inpatient;PACE;C:\Users\FGuo\Documents\work doucment\attachment\attachmentDB\20161005\originalFileFromAerial\DOCSVC_20161003.tar\DOCSVC_20161003\DOCSVC_20161003\INPATIENT\REQ_20150902-000008\grayDC_2015-09-03-16.33.23.491.tif
Request;20150902-000009;70107;PACE;Inpatient;PACE;C:\Users\FGuo\Documents\work doucment\attachment\attachmentDB\20161005\originalFileFromAerial\DOCSVC_20161003.tar\DOCSVC_20161003\DOCSVC_20161003\INPATIENT\REQ_20150902-000009\Medical record_2015-12-10-14.37.30.562.pdf
Request;20150902-000009;70107;PACE;Inpatient;PACE;C:\Users\FGuo\Documents\work doucment\attachment\attachmentDB\20161005\originalFileFromAerial\DOCSVC_20161003.tar\DOCSVC_20161003\DOCSVC_20161003\INPATIENT\REQ_20150902-000009\PACE Final Adverse Determination- Appeal  Unfavorable Non-Contracted Hospitals_2016-01-04-14.47.22.351.docx
Request;20150902-000009;70107;PACE;Inpatient;PACE;C:\Users\FGuo\Documents\work doucment\attachment\attachmentDB\20161005\originalFileFromAerial\DOCSVC_20161003.tar\DOCSVC_20161003\DOCSVC_20161003\INPATIENT\REQ_20150902-000009\PRA-1  Appeal Acknowledgement _2015-11-09-16.30.06.626.docx
Request;20150902-000009;70107;PACE;Inpatient;PACE;C:\Users\FGuo\Documents\work doucment\attachment\attachmentDB\20161005\originalFileFromAerial\DOCSVC_20161003.tar\DOCSVC_20161003\DOCSVC_20161003\INPATIENT\REQ_20150902-000009\Stone Betty PACE-Mt Sinai Hospital 9-15-15_2015-09-15-11.18.49.211.docx
Request;20150902-000009;70107;PACE;Inpatient;PACE;C:\Users\FGuo\Documents\work doucment\attachment\attachmentDB\20161005\originalFileFromAerial\DOCSVC_20161003.tar\DOCSVC_20161003\DOCSVC_20161003\INPATIENT\REQ_20150902-000009\Stone, Betty 70107 Clinicals 10 29   BA-FAX1_1510231408582598_2015-10-29-13.58.20.921.TIF
Request;20150902-000009;70107;PACE;Inpatient;PACE;C:\Users\FGuo\Documents\work doucment\attachment\attachmentDB\20161005\originalFileFromAerial\DOCSVC_20161003.tar\DOCSVC_20161003\DOCSVC_20161003\INPATIENT\REQ_20150902-000009\Stone, Betty IP Denial Mount Sinai Hospital 11-20-15_2015-11-20-16.31.38.397.pdf
Request;20150902-000009;70107;PACE;Inpatient;PACE;C:\Users\FGuo\Documents\work doucment\attachment\attachmentDB\20161005\originalFileFromAerial\DOCSVC_20161003.tar\DOCSVC_20161003\DOCSVC_20161003\INPATIENT\REQ_20150902-000009\_2015-11-20-16.17.14.26
Request;20150902-000011;23763;null;Inpatient;PACE;C:\Users\FGuo\Documents\work doucment\attachment\attachmentDB\20161005\originalFileFromAerial\DOCSVC_20161003.tar\DOCSVC_20161003\DOCSVC_20161003\INPATIENT\REQ_20150902-000011\Maria Matos PRI 9-1-15_2015-09-02-10.09.59.965.tif
Request;20150902-000011;23763;null;Inpatient;PACE;C:\Users\FGuo\Documents\work doucment\attachment\attachmentDB\20161005\originalFileFromAerial\DOCSVC_20161003.tar\DOCSVC_20161003\DOCSVC_20161003\INPATIENT\REQ_20150902-000011\maria matos11_2015-09-14-16.24.36.12.tif
Request;20150902-000011;23763;null;Inpatient;PACE;C:\Users\FGuo\Documents\work doucment\attachment\attachmentDB\20161005\originalFileFromAerial\DOCSVC_20161003.tar\DOCSVC_20161003\DOCSVC_20161003\INPATIENT\REQ_20150902-000011\maria matos14_2015-09-14-16.23.01.901.tif
Request;20150902-000011;23763;null;Inpatient;PACE;C:\Users\FGuo\Documents\work doucment\attachment\attachmentDB\20161005\originalFileFromAerial\DOCSVC_20161003.tar\DOCSVC_20161003\DOCSVC_20161003\INPATIENT\REQ_20150902-000011\Matos, Maria  d-c_2015-11-02-11.26.12.401.tif
Request;20150902-000011;23763;null;Inpatient;PACE;C:\Users\FGuo\Documents\work doucment\attachment\attachmentDB\20161005\originalFileFromAerial\DOCSVC_20161003.tar\DOCSVC_20161003\DOCSVC_20161003\INPATIENT\REQ_20150902-000011\Matos, Maria 23763  Auth Approval Letter_2015-09-02-11.50.08.55.doc
Request;20150902-000012;32424;PACE;Inpatient;PACE;C:\Users\FGuo\Documents\work doucment\attachment\attachmentDB\20161005\originalFileFromAerial\DOCSVC_20161003.tar\DOCSVC_20161003\DOCSVC_20161003\INPATIENT\REQ_20150902-000012\32424 d-c 9-4_2015-09-04-11.24.31.664.tif
Request;20150902-000012;32424;PACE;Inpatient;PACE;C:\Users\FGuo\Documents\work doucment\attachment\attachmentDB\20161005\originalFileFromAerial\DOCSVC_20161003.tar\DOCSVC_20161003\DOCSVC_20161003\INPATIENT\REQ_20150902-000012\KAUR, RATTAN - UR_2015-09-02-10.10.30.431.tif
Request;20150902-000012;32424;PACE;Inpatient;PACE;C:\Users\FGuo\Documents\work doucment\attachment\attachmentDB\20161005\originalFileFromAerial\DOCSVC_20161003.tar\DOCSVC_20161003\DOCSVC_20161003\INPATIENT\REQ_20150902-000012\Rattan Kaur UR 9-2-15_2015-09-03-08.49.18.431.tif
Request;20150902-000013;58988;PACE;Inpatient;PACE;C:\Users\FGuo\Documents\work doucment\attachment\attachmentDB\20161005\originalFileFromAerial\DOCSVC_20161003.tar\DOCSVC_20161003\DOCSVC_20161003\INPATIENT\REQ_20150902-000013\MDorino_2015-09-10-13.49.11.230.tif
Request;20150902-000014;84861;FIDA;Inpatient;FIDA;C:\Users\FGuo\Documents\work doucment\attachment\attachmentDB\20161005\originalFileFromAerial\DOCSVC_20161003.tar\DOCSVC_20161003\DOCSVC_20161003\INPATIENT\REQ_20150902-000014\BA-FAX1_1509021700177659_2015-09-08-15.06.37.198.TIF
Request;20150902-000014;84861;FIDA;Inpatient;FIDA;C:\Users\FGuo\Documents\work doucment\attachment\attachmentDB\20161005\originalFileFromAerial\DOCSVC_20161003.tar\DOCSVC_20161003\DOCSVC_20161003\INPATIENT\REQ_20150902-000014\beras orlando2_2015-09-02-13.23.35.122.tif
Request;20150902-000018;43732;PACE;Inpatient;PACE;C:\Users\FGuo\Documents\work doucment\attachment\attachmentDB\20161005\originalFileFromAerial\DOCSVC_20161003.tar\DOCSVC_20161003\DOCSVC_20161003\INPATIENT\REQ_20150902-000018\Hoffman Helen IP Denial Mercy Medical Center  9-2-15_2015-09-03-09.51.14.171.docx
Request;20150902-000018;43732;PACE;Inpatient;PACE;C:\Users\FGuo\Documents\work doucment\attachment\attachmentDB\20161005\originalFileFromAerial\DOCSVC_20161003.tar\DOCSVC_20161003\DOCSVC_20161003\INPATIENT\REQ_20150902-000018\HOFFMAN, HELEN - ADMISSION_2015-09-02-10.46.00.486.tif
Request;20150902-000018;43732;PACE;Inpatient;PACE;C:\Users\FGuo\Documents\work doucment\attachment\attachmentDB\20161005\originalFileFromAerial\DOCSVC_20161003.tar\DOCSVC_20161003\DOCSVC_20161003\INPATIENT\REQ_20150902-000018\Hoffman, Helen MR (2)_2016-01-28-11.21.40.886.pdf
Request;20150902-000018;43732;PACE;Inpatient;PACE;C:\Users\FGuo\Documents\work doucment\attachment\attachmentDB\20161005\originalFileFromAerial\DOCSVC_20161003.tar\DOCSVC_20161003\DOCSVC_20161003\INPATIENT\REQ_20150902-000018\hoffman,helen_2015-10-09-14.35.11.7.tif
Request;20150902-000026;23654;PACE;Inpatient;PACE;C:\Users\FGuo\Documents\work doucment\attachment\attachmentDB\20161005\originalFileFromAerial\DOCSVC_20161003.tar\DOCSVC_20161003\DOCSVC_20161003\INPATIENT\REQ_20150902-000026\francisco gomez cabrera_2015-09-09-13.16.07.433.tif
Request;20150902-000026;23654;PACE;Inpatient;PACE;C:\Users\FGuo\Documents\work doucment\attachment\attachmentDB\20161005\originalFileFromAerial\DOCSVC_20161003.tar\DOCSVC_20161003\DOCSVC_20161003\INPATIENT\REQ_20150902-000026\gomez-cabrera francisco_2015-09-10-13.33.52.406.tif
Request;20150902-000029;53006;PACE;Inpatient;PACE;C:\Users\FGuo\Documents\work doucment\attachment\attachmentDB\20161005\originalFileFromAerial\DOCSVC_20161003.tar\DOCSVC_20161003\DOCSVC_20161003\INPATIENT\REQ_20150902-000029\das sunil10a_2015-09-10-18.45.21.70.tif
Request;20150902-000029;53006;PACE;Inpatient;PACE;C:\Users\FGuo\Documents\work doucment\attachment\attachmentDB\20161005\originalFileFromAerial\DOCSVC_20161003.tar\DOCSVC_20161003\DOCSVC_20161003\INPATIENT\REQ_20150902-000029\das sunil10_2015-09-10-18.43.57.863.tif
Request;20150902-000029;53006;PACE;Inpatient;PACE;C:\Users\FGuo\Documents\work doucment\attachment\attachmentDB\20161005\originalFileFromAerial\DOCSVC_20161003.tar\DOCSVC_20161003\DOCSVC_20161003\INPATIENT\REQ_20150902-000029\das sunil8a_2015-09-08-16.25.38.911.tif
Request;20150902-000029;53006;PACE;Inpatient;PACE;C:\Users\FGuo\Documents\work doucment\attachment\attachmentDB\20161005\originalFileFromAerial\DOCSVC_20161003.tar\DOCSVC_20161003\DOCSVC_20161003\INPATIENT\REQ_20150902-000029\das sunilpt_2015-09-10-11.52.46.47.tif
Request;20150902-000029;53006;PACE;Inpatient;PACE;C:\Users\FGuo\Documents\work doucment\attachment\attachmentDB\20161005\originalFileFromAerial\DOCSVC_20161003.tar\DOCSVC_20161003\DOCSVC_20161003\INPATIENT\REQ_20150902-000029\das sunil_2015-09-08-16.17.00.226.tif
Request;20150902-000029;53006;PACE;Inpatient;PACE;C:\Users\FGuo\Documents\work doucment\attachment\attachmentDB\20161005\originalFileFromAerial\DOCSVC_20161003.tar\DOCSVC_20161003\DOCSVC_20161003\INPATIENT\REQ_20150902-000029\Das, Sunil B. - Margaret Tiez Nursing and Rehab -9 -3-15_2015-09-03-09.04.02.697.docx
Request;20150902-000029;53006;PACE;Inpatient;PACE;C:\Users\FGuo\Documents\work doucment\attachment\attachmentDB\20161005\originalFileFromAerial\DOCSVC_20161003.tar\DOCSVC_20161003\DOCSVC_20161003\INPATIENT\REQ_20150902-000029\SDas_2015-09-22-16.01.48.160.tif
Request;20150902-000029;53006;PACE;Inpatient;PACE;C:\Users\FGuo\Documents\work doucment\attachment\attachmentDB\20161005\originalFileFromAerial\DOCSVC_20161003.tar\DOCSVC_20161003\DOCSVC_20161003\INPATIENT\REQ_20150902-000029\Sunil Das PRI 9-1-15_2015-09-02-12.09.47.256.tif
Request;20150902-000042;57512;PACE;Inpatient;PACE;C:\Users\FGuo\Documents\work doucment\attachment\attachmentDB\20161005\originalFileFromAerial\DOCSVC_20161003.tar\DOCSVC_20161003\DOCSVC_20161003\INPATIENT\REQ_20150902-000042\Harrill Johnie IP Denial NY Hospital Queens 9-4-15_2015-09-04-12.20.03.537.docx
Request;20150902-000042;57512;PACE;Inpatient;PACE;C:\Users\FGuo\Documents\work doucment\attachment\attachmentDB\20161005\originalFileFromAerial\DOCSVC_20161003.tar\DOCSVC_20161003\DOCSVC_20161003\INPATIENT\REQ_20150902-000042\HARRILL, JOHNIE - UR_2015-09-02-14.25.22.771.tif
Request;20150902-000042;57512;PACE;Inpatient;PACE;C:\Users\FGuo\Documents\work doucment\attachment\attachmentDB\20161005\originalFileFromAerial\DOCSVC_20161003.tar\DOCSVC_20161003\DOCSVC_20161003\INPATIENT\REQ_20150902-000042\Harrill, Johnie_1118416_2015-10-14-11.48.58.716.pdf
Request;20150902-000042;57512;PACE;Inpatient;PACE;C:\Users\FGuo\Documents\work doucment\attachment\attachmentDB\20161005\originalFileFromAerial\DOCSVC_20161003.tar\DOCSVC_20161003\DOCSVC_20161003\INPATIENT\REQ_20150902-000042\PACE Final Adverse Determination- Appeal  Unfavorable Non-Contracted Hospitals_2016-01-04-18.00.46.462.docx
Request;20150902-000042;57512;PACE;Inpatient;PACE;C:\Users\FGuo\Documents\work doucment\attachment\attachmentDB\20161005\originalFileFromAerial\DOCSVC_20161003.tar\DOCSVC_20161003\DOCSVC_20161003\INPATIENT\REQ_20150902-000042\PRA-1  Appeal Acknowledgement _2015-10-14-11.48.36.133.docx
Request;20150902-000042;57512;PACE;Inpatient;PACE;C:\Users\FGuo\Documents\work doucment\attachment\attachmentDB\20161005\originalFileFromAerial\DOCSVC_20161003.tar\DOCSVC_20161003\DOCSVC_20161003\INPATIENT\REQ_20150902-000042\WOL_2015-10-16-16.50.37.350.TIF
Request;20150902-000042;57512;PACE;Inpatient;PACE;C:\Users\FGuo\Documents\work doucment\attachment\attachmentDB\20161005\originalFileFromAerial\DOCSVC_20161003.tar\DOCSVC_20161003\DOCSVC_20161003\INPATIENT\REQ_20150902-000042\_2015-09-02-14.25.39.62
Request;20150902-000043;34975;PACE;Inpatient;PACE;C:\Users\FGuo\Documents\work doucment\attachment\attachmentDB\20161005\originalFileFromAerial\DOCSVC_20161003.tar\DOCSVC_20161003\DOCSVC_20161003\INPATIENT\REQ_20150902-000043\Appeal Acknowledgement _2015-12-16-11.45.36.299.docx
Request;20150902-000043;34975;PACE;Inpatient;PACE;C:\Users\FGuo\Documents\work doucment\attachment\attachmentDB\20161005\originalFileFromAerial\DOCSVC_20161003.tar\DOCSVC_20161003\DOCSVC_20161003\INPATIENT\REQ_20150902-000043\Calderon Angel IP Denial Montefiore Medical Center  9-4-15_2015-09-04-12.11.32.413.docx
Request;20150902-000043;34975;PACE;Inpatient;PACE;C:\Users\FGuo\Documents\work doucment\attachment\attachmentDB\20161005\originalFileFromAerial\DOCSVC_20161003.tar\DOCSVC_20161003\DOCSVC_20161003\INPATIENT\REQ_20150902-000043\calderon,angel_2015-09-02-14.56.43.186.tif
Request;20150902-000043;34975;PACE;Inpatient;PACE;C:\Users\FGuo\Documents\work doucment\attachment\attachmentDB\20161005\originalFileFromAerial\DOCSVC_20161003.tar\DOCSVC_20161003\DOCSVC_20161003\INPATIENT\REQ_20150902-000043\Caldron, Angel Final Adverse Determination Appeal Unfavorable-Contracted Hospitals_2016-01-20-15.27.39.181.docx
Request;20150902-000043;34975;PACE;Inpatient;PACE;C:\Users\FGuo\Documents\work doucment\attachment\attachmentDB\20161005\originalFileFromAerial\DOCSVC_20161003.tar\DOCSVC_20161003\DOCSVC_20161003\INPATIENT\REQ_20150902-000043\Medical Record part 1 (1)_2015-12-16-11.46.05.928.pdf
Request;20150902-000043;34975;PACE;Inpatient;PACE;C:\Users\FGuo\Documents\work doucment\attachment\attachmentDB\20161005\originalFileFromAerial\DOCSVC_20161003.tar\DOCSVC_20161003\DOCSVC_20161003\INPATIENT\REQ_20150902-000043\Medical Record part 2 (2)_2015-12-16-11.46.15.37.pdf
Request;20150902-000044;86655;PACE;Inpatient;PACE;C:\Users\FGuo\Documents\work doucment\attachment\attachmentDB\20161005\originalFileFromAerial\DOCSVC_20161003.tar\DOCSVC_20161003\DOCSVC_20161003\INPATIENT\REQ_20150902-000044\calderon jose9_2015-09-15-12.54.38.706.tif
Request;20150902-000044;86655;PACE;Inpatient;PACE;C:\Users\FGuo\Documents\work doucment\attachment\attachmentDB\20161005\originalFileFromAerial\DOCSVC_20161003.tar\DOCSVC_20161003\DOCSVC_20161003\INPATIENT\REQ_20150902-000044\Calderon, Jose  IP Denial Montefiore  Med Center 9-8-15_2015-09-08-14.22.13.850.docx
Request;20150902-000044;86655;PACE;Inpatient;PACE;C:\Users\FGuo\Documents\work doucment\attachment\attachmentDB\20161005\originalFileFromAerial\DOCSVC_20161003.tar\DOCSVC_20161003\DOCSVC_20161003\INPATIENT\REQ_20150902-000044\calderon,jose_2015-09-02-15.28.35.692.tif
Request;20150902-000044;86655;PACE;Inpatient;PACE;C:\Users\FGuo\Documents\work doucment\attachment\attachmentDB\20161005\originalFileFromAerial\DOCSVC_20161003.tar\DOCSVC_20161003\DOCSVC_20161003\INPATIENT\REQ_20150902-000044\PRA-4 Appeal Resolution-Favorable_2015-12-04-18.15.54.381.docx
Request;20150902-000046;49313;PACE;Inpatient;PACE;C:\Users\FGuo\Documents\work doucment\attachment\attachmentDB\20161005\originalFileFromAerial\DOCSVC_20161003.tar\DOCSVC_20161003\DOCSVC_20161003\INPATIENT\REQ_20150902-000046\EWorrell 9815_2015-09-08-13.50.54.131.tif
Request;20150902-000046;49313;PACE;Inpatient;PACE;C:\Users\FGuo\Documents\work doucment\attachment\attachmentDB\20161005\originalFileFromAerial\DOCSVC_20161003.tar\DOCSVC_20161003\DOCSVC_20161003\INPATIENT\REQ_20150902-000046\Worrell, Elsie -NY Methodist Hosp Clinical Review Request Form 9-2-15_2015-09-02-14.54.19.473.docx
Request;20150902-000049;31031;SELECT;Inpatient;SELECT;C:\Users\FGuo\Documents\work doucment\attachment\attachmentDB\20161005\originalFileFromAerial\DOCSVC_20161003.tar\DOCSVC_20161003\DOCSVC_20161003\INPATIENT\REQ_20150902-000049\ACuervo_2015-09-02-15.31.36.402.tif
Request;20150902-000049;31031;SELECT;Inpatient;SELECT;C:\Users\FGuo\Documents\work doucment\attachment\attachmentDB\20161005\originalFileFromAerial\DOCSVC_20161003.tar\DOCSVC_20161003\DOCSVC_20161003\INPATIENT\REQ_20150902-000049\Cuervo, Antonia - Rockaway Care Center  9.2.15_2015-09-02-16.11.37.859.docx
Request;20150902-000049;31031;SELECT;Inpatient;SELECT;C:\Users\FGuo\Documents\work doucment\attachment\attachmentDB\20161005\originalFileFromAerial\DOCSVC_20161003.tar\DOCSVC_20161003\DOCSVC_20161003\INPATIENT\REQ_20150902-000049\Cuervo, Antonia - ROCKAWAY CARE CENTER 9.09.16_2016-09-09-08.46.58.58.pdf
Request;20150902-000051;23654;PACE;Inpatient;PACE;C:\Users\FGuo\Documents\work doucment\attachment\attachmentDB\20161005\originalFileFromAerial\DOCSVC_20161003.tar\DOCSVC_20161003\DOCSVC_20161003\INPATIENT\REQ_20150902-000051\gomez,francisco_2015-09-02-15.59.07.215.tif
Request;20150902-000052;98318;PACE;Inpatient;PACE;C:\Users\FGuo\Documents\work doucment\attachment\attachmentDB\20161005\originalFileFromAerial\DOCSVC_20161003.tar\DOCSVC_20161003\DOCSVC_20161003\INPATIENT\REQ_20150902-000052\arroyo carmen pri_2015-09-02-15.33.48.198.tif
